caption,unfunny,somewhat_funny,funny,count,contest
Be right back after I feed the dogs and hook up the sled.,8.0,1.0,0.0,9.0,511
Being the little spoon isn't as fun as I thought,8.0,1.0,0.0,9.0,511
"Doctor's orders, son! I have to cut back on everything!",8.0,1.0,0.0,9.0,511
"Unlike some pathetic losers I know, I prefer to undercompensate.",8.0,1.0,0.0,9.0,511
I have an idea: let's switch coats.,8.0,1.0,0.0,9.0,511
"You keep it, son. I'm in no hurry to reach the office.",8.0,1.0,0.0,9.0,511
Quit complaining and keep digging. How do you think I learned to do this?,8.0,1.0,0.0,9.0,511
At least I won't be needing my scissors to cut the lawn today.,8.0,1.0,0.0,9.0,511
I'll shovel the Trump fans' driveways. You can flip their yard signs.,8.0,1.0,0.0,9.0,511
You wanna switch soon?,8.0,1.0,0.0,9.0,511
"Hey Mister, I'm outsourcing snow removal. I can get you started in the gig economy.",8.0,1.0,0.0,9.0,511
You missed a spot...,8.0,1.0,0.0,9.0,511
"You see, son, always set low expectations and you will reach your goals.",8.0,1.0,0.0,9.0,511
No. I don't know what happened to your shovel.,8.0,1.0,0.0,9.0,511
"Sorry, Dairy Queen only trained me how to do it this way.",8.0,1.0,0.0,9.0,511
Wait till I tell your mother I did this with your shovel.,8.0,1.0,0.0,9.0,511
The yellow snow is gluten free,8.0,1.0,0.0,9.0,511
Every inch of the walkway that I shovel is just another minute I spend chaperoning your first date... Almost at two hours kiddo!,8.0,1.0,0.0,9.0,511
"'Sure, this takes longer ... but it beats having a heart attack!""",8.0,1.0,0.0,9.0,511
God is in the details.,8.0,1.0,0.0,9.0,511
"You see son, size does matter.",8.0,1.0,0.0,9.0,511
Do you still think size doesn't matter?,8.0,1.0,0.0,9.0,511
Where've you been? You could have talked me out of this days ago.,8.0,1.0,0.0,9.0,511
It helps me to meet my FitBit goal.,8.0,1.0,0.0,9.0,511
Forget the shovel. Go into the house and get your toothbrush to help daddy clean the walk.,8.0,1.0,0.0,9.0,511
"Son, please leave that alone. That's for daddy to use when it really snows.",8.0,1.0,0.0,9.0,511
"It's not about substance, it's about style.",8.0,1.0,0.0,9.0,511
I thought you said size doesn't really matter?,8.0,1.0,0.0,9.0,511
What? I hate shoveling!,8.0,1.0,0.0,9.0,511
Are you trying to make me redundant?,8.0,1.0,0.0,9.0,511
"No, thanks. We already traded yesterday",8.0,1.0,0.0,9.0,511
The economy size gets better mileage.,8.0,1.0,0.0,9.0,511
"Like I told your Mother, size doesn't matter.",8.0,1.0,0.0,9.0,511
I have the best intentions.,8.0,1.0,0.0,9.0,511
"It's called an intentional productivity slowdown, son.",8.0,1.0,0.0,9.0,511
"Rick, remember when you laughed at my shovel purchase in July?",8.0,1.0,0.0,9.0,511
"Son, let this be a life lesson for you: sometimes the other guy gets the 'cushy' job!",8.0,1.0,0.0,9.0,511
It is all in how you use it.,8.0,1.0,0.0,9.0,511
Don't ever let anyone tell you that size matters.,8.0,1.0,0.0,9.0,511
"It's like your mother always says: It's not the size, it's how you use it.",8.0,1.0,0.0,9.0,511
"Hey dad, still think size doesn't matter?",8.0,1.0,0.0,9.0,511
"Yes, but I need the exercise.",8.0,1.0,0.0,9.0,511
"No really, you've done your share. So let's trade back now, okay?",8.0,1.0,0.0,9.0,511
We need to right size this operation.,8.0,1.0,0.0,9.0,511
"When you're my age, you'll need one like this too",8.0,1.0,0.0,9.0,511
All I'm saying is it's a matter of perspective.,8.0,1.0,0.0,9.0,511
I'll take it from here.,8.0,1.0,0.0,9.0,511
"I don't know which is deeper and more annoying, the snow or the metaphor?",8.0,1.0,0.0,9.0,511
"Social Security Broke, Chores Replace Checks.",8.0,1.0,0.0,9.0,511
"Like this, only bigger!",8.0,1.0,0.0,9.0,511
"Yes, I'm a congressman. Why do you ask?",8.0,1.0,0.0,9.0,511
"Dad, I will give you a quarter to get off your cell phone and finish the walk.",8.0,1.0,0.0,9.0,511
Labor laws!? What child labor laws?,8.0,1.0,0.0,9.0,511
"Keep digging, our right to privacy is under there somewhere!",8.0,1.0,0.0,9.0,511
It's your mom's idea. It's called The Zen Diet.,8.0,1.0,0.0,9.0,511
That little garden gnome... always so superior.,8.0,1.0,0.0,9.0,511
Judge me when you're married.,8.0,1.0,0.0,9.0,511
"Go ahead, take your time with your huge shovel.",8.0,1.0,0.0,9.0,511
"I'm sorry, I can't read that when it's upside down",8.0,1.0,0.0,9.0,511
"Someday you'll find true love, settle down, and begin the life long quest for chores that take an extremely long time.",8.0,1.0,0.0,9.0,511
Son. I gave you the coolest snow shovel ever made.,8.0,1.0,0.0,9.0,511
"Once an an archeologist,,,,,",8.0,1.0,0.0,9.0,511
"Just like my wife says, size isn't everything!",8.0,1.0,0.0,9.0,511
Remember the story of The Tortoise and the Hare?,8.0,1.0,0.0,9.0,511
y ? x,8.0,1.0,0.0,9.0,511
"As you get older, son, you'll realize that it's the little things in life that make a difference.",8.0,1.0,0.0,9.0,511
See. Just like daddy.,8.0,1.0,0.0,9.0,511
Must be nice to be part of that one percent.,8.0,1.0,0.0,9.0,511
"How many times do I have to repeat it: it's not the size that counts, it's how you use it!",8.0,1.0,0.0,9.0,511
"Hey, grab a spoon and help me.",8.0,1.0,0.0,9.0,511
Size really doesn't matter.,8.0,1.0,0.0,9.0,511
- A Bad Case of Shovel Envy,8.0,1.0,0.0,9.0,511
"In the snow, Derek always cleared a path from the highway to his gnome",8.0,1.0,0.0,9.0,511
Pretty good for old technology.,8.0,1.0,0.0,9.0,511
We you get back home tell Santa I do NOT appreciate his sense of humor!,8.0,1.0,0.0,9.0,511
You're still not getting a bigger allowance.,8.0,1.0,0.0,9.0,511
"Size matters, son.",8.0,1.0,0.0,9.0,511
All I asked for was a little help clearing the snow . . . a Gnome from Nome and a soup spoon is what I got,8.0,1.0,0.0,9.0,511
It must be opposites day.,8.0,1.0,0.0,9.0,511
"When you're older, you can use amphetamines like Daddy does.",8.0,1.0,0.0,9.0,511
"Think Big,you'll grow to love it",8.0,1.0,0.0,9.0,511
I don't care if you do speak softly -- get on the walkway.,8.0,1.0,0.0,9.0,511
How about you clean out the litter box and we call it even?,8.0,1.0,0.0,9.0,511
"Hey hey, we're The Monkees... and people say we monkey around!",8.0,1.0,0.0,9.0,511
One fall of snow and we lose all sense of perspective,8.0,1.0,0.0,9.0,511
"Yeah, but I read somewhere, in Florida they have a python infestation.",8.0,1.0,0.0,9.0,511
"Well, you see, this is trickle down shoveling.",8.0,1.0,0.0,9.0,511
"Thanks son, this shovel app is not quite cutting it.",8.0,1.0,0.0,9.0,511
It’s time you learned about managing people’s expectations.,8.0,1.0,0.0,9.0,511
"No thanks Ed, I don’t need to borrow your shovel, I’m getting paid by the hour!",8.0,1.0,0.0,9.0,511
"Another three hours, another foot.",8.0,1.0,0.0,9.0,511
It's not the size that counts.,8.0,1.0,0.0,9.0,511
I guess it's true what they say: shovel softly and carry a big stick!,8.0,1.0,0.0,9.0,511
That's why Santa left YOU the big one son,8.0,1.0,0.0,9.0,511
"Betty, I think it's time we stop buying our snow shovels from the clearance section.",8.0,1.0,0.0,9.0,511
"Compensating much, Larry?",8.0,1.0,0.0,9.0,511
Well at least you can't accuse me of compensating for something.,8.0,1.0,0.0,9.0,511
"Thanks, but I really don't want to go to work today",8.0,1.0,0.0,9.0,511
Where's your brother?,8.0,1.0,0.0,9.0,511
I suppose you're going to complain about the wage gap too.,8.0,1.0,0.0,9.0,511
"That's right, son . . . . Now yours is bigger.",8.0,1.0,0.0,9.0,511
"It's not about size, but keeping a healthy emotional connection with your shovel.",8.0,1.0,0.0,9.0,511
"You see? It's not the engine, it's the engineer.",8.0,1.0,0.0,9.0,511
I see we have a future politician in the family.,8.0,1.0,0.0,9.0,511
"See, this is how the GOP has fixed our economy. I'm so big I can dominate the market even though you have a much better product.",8.0,1.0,0.0,9.0,511
"Thanks a lot, Santa -- there goes my excuse not to go in to work!",8.0,1.0,0.0,9.0,511
"Hmm, should I tell him he's shoveling wrong? Nope, wait until he's done.",8.0,1.0,0.0,9.0,511
"While you stand there, these walks aren't going to shovel themselves.",8.0,1.0,0.0,9.0,511
Don't give me that size and motion crap.,8.0,1.0,0.0,9.0,511
"Son, a good carpenter doesn't blame his tools.",8.0,1.0,0.0,9.0,511
"No, I'm just scooping enough for a snow cone.",8.0,1.0,0.0,9.0,511
It's all in the wrist.,8.0,1.0,0.0,9.0,511
It's a smart shovel. It knows flake by flake what to do.,8.0,1.0,0.0,9.0,511
"It's not the size of your implement, but how you implement your strategy.",8.0,1.0,0.0,9.0,511
"Remember, son, your allowance will reflect your contribution.",8.0,1.0,0.0,9.0,511
That would have been helpful twelve hours ago.,8.0,1.0,0.0,9.0,511
"Son, it's not the size that matters, but what you do with it that counts.",8.0,1.0,0.0,9.0,511
I thought you garden gnomes worked just in the summer.,8.0,1.0,0.0,9.0,511
"If memory serves, you eat peas one at a time.",8.0,1.0,0.0,9.0,511
The minimalist lifestyle allows no exceptions.,8.0,1.0,0.0,9.0,511
"Sorry, got to go.",8.0,1.0,0.0,9.0,511
"Naw, I need the exercise!",8.0,1.0,0.0,9.0,511
"Just like my wife always says, ""size matters.""",8.0,1.0,0.0,9.0,511
You kids these days want the easy way out.,8.0,1.0,0.0,9.0,511
After we're done we can make a thimble of hot chocolate.,8.0,1.0,0.0,9.0,511
Don't you always say bigger is better?,8.0,1.0,0.0,9.0,511
Want to trade shovels,8.0,1.0,0.0,9.0,511
"The Sun'll come out, Tomorrow, Tomorrow......",8.0,1.0,0.0,9.0,511
This reminds me of a cartoon in 'Family Circle.',8.0,1.0,0.0,9.0,511
"Yes, I did wish for a bigger one.",8.0,1.0,0.0,9.0,511
Sharon bought Larry a nice garden trowel for Valentine's Day. He mistakenly thought he outdid her with a snow shovel.,8.0,1.0,0.0,9.0,511
"And this son, is how I get paid more on an hourly basis.",8.0,1.0,0.0,9.0,511
"......illustrating our new line of AGE-CALIBRATED, CARDIO-RESTRAINED snow shovels....",8.0,1.0,0.0,9.0,511
I think we should trade shovels.,8.0,1.0,0.0,9.0,511
It's all a matter of perspective...,8.0,1.0,0.0,9.0,511
Mom says she needs her ice cream scoop back.,8.0,1.0,0.0,9.0,511
"No, I don't cur my lawn with scissors",8.0,1.0,0.0,9.0,511
"Son, it's not the size of the shovel that matters, but how you use it.",8.0,1.0,0.0,9.0,511
"Remember son, we are judged by results not the efficiency of our efforts.",8.0,1.0,0.0,9.0,511
"Son, remember, quality not quantity.",8.0,1.0,0.0,9.0,511
"Bend your knees and lift with your legs, not your back.",8.0,1.0,0.0,9.0,511
Think positive!,8.0,1.0,0.0,9.0,511
"You know, Son, our old Mailman used to have a shovel just like that...",8.0,1.0,0.0,9.0,511
"Hey, low energy. Pick up the pace.",8.0,1.0,0.0,9.0,511
enough already. I'm walking to Florida.,8.0,1.0,0.0,9.0,511
Just sign the union agreement and this can be yours!,8.0,1.0,0.0,9.0,511
Mom says to use this to shovel the walk unless you want her to flip the burgers with a plunger,8.0,1.0,0.0,9.0,511
Next time I get to choose odd or even!,8.0,1.0,0.0,9.0,511
"'Lazy kids will do anything to avoid work.""",8.0,1.0,0.0,9.0,511
sometimes less is more,8.0,1.0,0.0,9.0,511
"Son, stop playing in the snow. We've got work to do.",8.0,1.0,0.0,9.0,511
Some day you'll thank me for this.,8.0,1.0,0.0,9.0,511
I'm still not paying you $100 per hour!,8.0,1.0,0.0,9.0,511
Why don't you go help your mother.She deserves your services.,8.0,1.0,0.0,9.0,511
Next we have to do the driveway.,8.0,1.0,0.0,9.0,511
Try to keep up.,8.0,1.0,0.0,9.0,511
Shovel Envy,8.0,1.0,0.0,9.0,511
"I'm almost finished,then we'll play",8.0,1.0,0.0,9.0,511
"If she is paying you buy the hour, you need a new shovel",8.0,1.0,0.0,9.0,511
Tell your mother I'm not pouting about the snowblower.,8.0,1.0,0.0,9.0,511
Because I'm the detail man that's why!!!,8.0,1.0,0.0,9.0,511
I bet you drive a sports car too!,8.0,1.0,0.0,9.0,511
"Because you speaks so softly, that's why.",8.0,1.0,0.0,9.0,511
You can use the Back Saver 2000 when you're the parent.,8.0,1.0,0.0,9.0,511
If only I had bought two big shovels.,8.0,1.0,0.0,9.0,511
"Oh! So now, all of a sudden size does matter.",8.0,1.0,0.0,9.0,511
"Then again, if we were smart about this we'd move to San Diego.",8.0,1.0,0.0,9.0,511
"It's not the size of your shovel son, it's how you use it.",8.0,1.0,0.0,9.0,511
I disagree with you - size DOES matter!,8.0,1.0,0.0,9.0,511
"Yes, tell your grandmother I'll be in as soon as I'm done shoveling the walk",8.0,1.0,0.0,9.0,511
"No thanks, I'm working on my triceps.",8.0,1.0,0.0,9.0,511
"Hey kid, it’s not always about the size of the tool.",8.0,1.0,0.0,9.0,511
There isn't an app for that!,8.0,1.0,0.0,9.0,511
"I tell you kid, it's not the size of the tool that matters, it's what you do with it.",8.0,1.0,0.0,9.0,511
Standing around again? We'll never get done at this rate!,8.0,1.0,0.0,9.0,511
"You see son, it's not really work, if you love what you do.",8.0,1.0,0.0,9.0,511
I really thought he would grow into that shovel.,8.0,1.0,0.0,9.0,511
I'm embracing minimalism.,8.0,1.0,0.0,9.0,511
"Lift with your knuckles, not your back.",8.0,1.0,0.0,9.0,511
Because it's the little details that really make the sidewalk pop!,8.0,1.0,0.0,9.0,511
That's it! Put your back in it!,8.0,1.0,0.0,9.0,511
Because I promised your mother we would talk after I finished the driveway.,8.0,1.0,0.0,9.0,511
"Looks like you're gonna lose the bet, son.",8.0,1.0,0.0,9.0,511
It was your bright idea to level the playing field.,8.0,1.0,0.0,9.0,511
Time to Switch. That's 4 hours.,8.0,1.0,0.0,9.0,511
"You see son, A poor workman blames his tools.",8.0,1.0,0.0,9.0,511
Tomorrow we'll get into guns vs. butter.,8.0,1.0,0.0,9.0,511
"Remember, son, it's not the size of the shovel that counts, but the size of the man with the shovel.",8.0,1.0,0.0,9.0,511
$50 or the snow goes back on the sidewalk.,8.0,1.0,0.0,9.0,511
"It's quality not quantity, kiddo.",8.0,1.0,0.0,9.0,511
"Someday, Son, this will be yours.",8.0,1.0,0.0,9.0,511
"...and here I thought Florida was supposed to be an escape from the frozen north, and I'd never need a snow shovel again!!!",8.0,1.0,0.0,9.0,511
I only use that one for political snowjobs.,8.0,1.0,0.0,9.0,511
Now let's talk about your allowance.,8.0,1.0,0.0,9.0,511
"Remember Son, it's not the size of your shovel, but how you use it.",8.0,1.0,0.0,9.0,511
Thank you. I feel validated.,8.0,1.0,0.0,9.0,511
"It's all perspective, Bobby.",8.0,1.0,0.0,9.0,511
"When you wear big boy pants, you use the baby shovel.",8.0,1.0,0.0,9.0,511
It's never too early to learn how to shovel it.,8.0,1.0,0.0,9.0,511
Welcome to Dad's world.,8.0,1.0,0.0,9.0,511
"Did he say a 100 foot path 36 "" wide or a 36 foot path, one hundred inches wide?",8.0,1.0,0.0,9.0,511
"Ok, so sometimes size does matter.",8.0,1.0,0.0,9.0,511
"As you might have surmised, son, this is a lesson about size.",8.0,1.0,0.0,9.0,511
The secret is to keep your back straight.,8.0,1.0,0.0,9.0,511
Question: What's wrong with this picture? Answer: My neighbor has cleared part of his sidewalk even before the snow melted for a change.,8.0,1.0,0.0,9.0,511
"Ha! It's not the size of the shovel, it's the devotion to motion!",8.0,1.0,0.0,9.0,511
Shovel it.,8.0,1.0,0.0,9.0,511
"Son, I know what your teacher said but taking turns isn't always a good thing.",8.0,1.0,0.0,9.0,511
It's an app called 'Snowblower.' Standard data charges may apply.,8.0,1.0,0.0,9.0,511
"Pop, let's trade, I'll take the shovel you take this spatula!",8.0,1.0,0.0,9.0,511
No you know how I feel when we go to the beach.,8.0,1.0,0.0,9.0,511
It's not a race son.,8.0,1.0,0.0,9.0,511
Junior! It's not the size but how you use it.,8.0,1.0,0.0,9.0,511
You're a troll...,8.0,1.0,0.0,9.0,511
High tech is no use if you don't know how to use it.,8.0,1.0,0.0,9.0,511
You should see how I paint the house in the summer.,8.0,1.0,0.0,9.0,511
I'll have time to listen to your idea AFTER we finish this incessant shoveling.,8.0,1.0,0.0,9.0,511
You'll understand one day when YOUR mother-in-law is visiting.,8.0,1.0,0.0,9.0,511
"This one keeps me out longer, away from your mother.",8.0,1.0,0.0,9.0,511
"It's not about the size, it's about how you use it.",8.0,1.0,0.0,9.0,511
"No, I don't want to trade!",8.0,1.0,0.0,9.0,511
Does your wife know you're into swapping?,8.0,1.0,0.0,9.0,511
"When you reach China, we'll switch back.",8.0,1.0,0.0,9.0,511
"Son, you know that's our display shovel.",8.0,1.0,0.0,9.0,511
... and toss.,8.0,1.0,0.0,9.0,511
Compensating much?,8.0,1.0,0.0,9.0,511
"""978,979....I was right Mr. Know it all. It takes your shovel more scoops than....heeeeyyyy",8.0,1.0,0.0,9.0,511
Apple's shoveling more than snow with the iShovel!,8.0,1.0,0.0,9.0,511
"You see son, size really doesn't matter.",8.0,1.0,0.0,9.0,511
"I'm sorry you think this is a snow job.""",8.0,1.0,0.0,9.0,511
I told you short and steady wins the race.,8.0,1.0,0.0,9.0,511
"Of course I said,""go back, Phil,"" not ""go backfill.""",8.0,1.0,0.0,9.0,511
Shovel size means nothing.,8.0,1.0,0.0,9.0,511
I'm the right fool for the job.,8.0,1.0,0.0,9.0,511
"You always want the largest, biggest and most. So stop whining!",8.0,1.0,0.0,9.0,511
"I suppose there was an app for that, too.",8.0,1.0,0.0,9.0,511
You need to work harder if we're going to make America great again.,8.0,1.0,0.0,9.0,511
"Hey, dad, can I have my shovel back?",8.0,1.0,0.0,9.0,511
We don't need no stinking shovels,8.0,1.0,0.0,9.0,511
"Keep at it, Mom. I'm sure my little pail is down there somewhere.",8.0,1.0,0.0,9.0,511
It's your perspective.,8.0,1.0,0.0,9.0,511
You oughta be in snow business!,8.0,1.0,0.0,9.0,511
My shovel's not really that small; it's just drawn that way.,8.0,1.0,0.0,9.0,511
"And so you see, son, you can be stupid and have bad tools and still win the race.",8.0,1.0,0.0,9.0,511
"After an hour or so, we'll switch shovels again.",8.0,1.0,0.0,9.0,511
"Next time like usual, sonny. See, here's the SCOOP: If I get home in time, the missus insists we go to the Trump rally... .",8.0,1.0,0.0,9.0,511
The trick is to start before it snows,8.0,1.0,0.0,9.0,511
"Son, you won't create many jobs doing it like that.",8.0,1.0,0.0,9.0,511
But that's for snow. This is kitty litter.,8.0,1.0,0.0,9.0,511
I thought you asked for a snow job!,8.0,1.0,0.0,9.0,511
You should pay attention to the details...,8.0,1.0,0.0,9.0,511
How's that workin out for ya?,8.0,1.0,0.0,9.0,511
It was in your room?,8.0,1.0,0.0,9.0,511
"Dad, I think you're 'feeling the Bern' in a way that's not very helpful.",8.0,1.0,0.0,9.0,511
"Wait a few years kid, and you'll understand.",8.0,1.0,0.0,9.0,511
"Son, remember this, never paint with a broad brush.",8.0,1.0,0.0,9.0,511
"Because, I'm not mechanically inclined, that's why!",8.0,1.0,0.0,9.0,511
"Thanks, Jimmy, but this little baby ensures I miss the Academy Awards.",8.0,1.0,0.0,9.0,511
"Now, it's time to upgrade my shovel.",8.0,1.0,0.0,9.0,511
"I think I can, I think I can.",8.0,1.0,0.0,9.0,511
"Thank you my son, put your mother went out of her way to buy me this wonderful shovel last Father's Day",8.0,1.0,0.0,9.0,511
"Got it, oxymoron! Now back to your homework!",8.0,1.0,0.0,9.0,511
"Remember, it's not the size, but the motion.",8.0,1.0,0.0,9.0,511
I try not to paint things with the same broad brush.,8.0,1.0,0.0,9.0,511
What a Napolean Complex!,8.0,1.0,0.0,9.0,511
"Oh, *that* other shovel.",8.0,1.0,0.0,9.0,511
"It's so beautiful! Make it last, son!",8.0,1.0,0.0,9.0,511
Hi Kevin careful I know it winter but don't get a frostbite.,8.0,1.0,0.0,9.0,511
The Ironics never fully appreciated their family name.,8.0,1.0,0.0,9.0,511
See! Size matters!,8.0,1.0,0.0,9.0,511
We can't go to Grandma's recital until we're done.,8.0,1.0,0.0,9.0,511
This is the last time I'm flipping a coin with him.,8.0,1.0,0.0,9.0,511
"I know you're just trying to protect me, but, when your mother said she was tired of me shoveling it all the time, I don't think is was snow she meant.",8.0,1.0,0.0,9.0,511
"Snowballs, fun! Shovels, poo-poo!",8.0,1.0,0.0,9.0,511
Why don't we try on each others' shoes and see if that makes things easier?,8.0,1.0,0.0,9.0,511
"No Sisyphus, and I don't want to hear that kind of talk from you ever again!",8.0,1.0,0.0,9.0,511
I knew you were waiting for me.,8.0,1.0,0.0,9.0,511
"See, son: it's not the size of your trowel that matters.",8.0,1.0,0.0,9.0,511
What was in that 100% natural protein shake?,8.0,1.0,0.0,9.0,511
The Power of Small,8.0,1.0,0.0,9.0,511
"Don't look at me like that, Archie. It's called damage control.",8.0,1.0,0.0,9.0,511
"Remember, it's not the size of the snow shovel in the fight; it's the size of fight you put in your snow shovel.",8.0,1.0,0.0,9.0,511
"No thanks! I must go to work when I've finished shoveling out,",8.0,1.0,0.0,9.0,511
"Keep at it, two hands and use your knees.",8.0,1.0,0.0,9.0,511
"I told you, we can build a snowman just as soon as I'm done shovelling the walk.",8.0,1.0,0.0,9.0,511
"Remember son, it's not the size of the shovel, it's the motion",8.0,1.0,0.0,9.0,511
The doctor said it's best for my heart.,8.0,1.0,0.0,9.0,511
No thanks. This is the least I can do . . . and I always enjoy doing the least I can do!,8.0,1.0,0.0,9.0,511
"No, Son, I'm saving that shovel for the next round of the debates.",8.0,1.0,0.0,9.0,511
Just follow my lead. It's called style over substance.,8.0,1.0,0.0,9.0,511
"I'll get some here, son. You can clear out the rest.",8.0,1.0,0.0,9.0,511
"Lift with your knees, Pops!",8.0,1.0,0.0,9.0,511
Well? I'm waiting.,8.0,1.0,0.0,9.0,511
Take that back to your mother -- it's more fun using this one.,8.0,1.0,0.0,9.0,511
Don't be a Sisyphus.,8.0,1.0,0.0,9.0,511
Inefficiencies of scale.,8.0,1.0,0.0,9.0,511
"Maybe there's a better way to do this, Phil.",8.0,1.0,0.0,9.0,511
Sometimes in life son size really doesn't matter.,8.0,1.0,0.0,9.0,511
See what I can do with a little tool?,8.0,1.0,0.0,9.0,511
"As we always say, ""Prepare of the worst, and hope for the best.""",8.0,1.0,0.0,9.0,511
"As I told you during our talk, size doesn't matter.",8.0,1.0,0.0,9.0,511
"You know, it's not the size of your shovel that matters, it is how you use it.",8.0,1.0,0.0,9.0,511
Now I know what it feels like to shovel in your footsteps.,8.0,1.0,0.0,9.0,511
"I told you, size doesn't matter.",8.0,1.0,0.0,9.0,511
"OK, you won the coin flip. When will you start shoveling?",8.0,1.0,0.0,9.0,511
"Damn Roy, when you started shoveling the snow, you were 5ft 7 inches tall! Now look at you! I need a drink, fast!",8.0,1.0,0.0,9.0,511
There's an app for that?,8.0,1.0,0.0,9.0,511
"Happy ""freaky Friday"" George!",8.0,1.0,0.0,9.0,511
"Let this be a lesson: It’s not how big it is, it’s what you do with it.",8.0,1.0,0.0,9.0,511
Keep shoveling!!,8.0,1.0,0.0,9.0,511
I'm tired of these kids clearing out the stores before we can even get to them. And then they can't even use what they bought.,8.0,1.0,0.0,9.0,511
"Suddenly Jack realized, size does matter.",8.0,1.0,0.0,9.0,511
"You just have to put your back in it, son!",8.0,1.0,0.0,9.0,511
Give a call to Goldilocks to come on over with her shovel,8.0,1.0,0.0,9.0,511
Mine has a smaller carbon footprint.,8.0,1.0,0.0,9.0,511
Don't forget the roof!,8.0,1.0,0.0,9.0,511
No. I don't think snow is mentioned in the Bible.,8.0,1.0,0.0,9.0,511
"Son, we just have to use the gifts God gave us.",8.0,1.0,0.0,9.0,511
Linda's biggest mistake in life was reassuring her husband that size doesn't matter.,8.0,1.0,0.0,9.0,511
It builds character!,8.0,1.0,0.0,9.0,511
"This is not a trick, son, I'm just in my second childhood.",8.0,1.0,0.0,9.0,511
"Son, Monday morning is a very bad time to renegotiate your compensation with the boss.",8.0,1.0,0.0,9.0,511
This is my gop BS shovel.,8.0,1.0,0.0,9.0,511
"See how I use my knees, and not my back, to put the snow in the neighbor's yard?",8.0,1.0,0.0,9.0,511
"Hey, this division of labor appears to be very asymmetrical.",8.0,1.0,0.0,9.0,511
This is what happens when shovels are issued according to need!,8.0,1.0,0.0,9.0,511
That's only your perspective.,8.0,1.0,0.0,9.0,511
And John weeped with happiness for he knew his son's shovel would be bigger than his own,8.0,1.0,0.0,9.0,511
I'm going to make an abominable snowman.,8.0,1.0,0.0,9.0,511
"Daddy. is this what they mean by ""misallocation of resources""?",8.0,1.0,0.0,9.0,511
See what whistling while you work will do for you?,8.0,1.0,0.0,9.0,511
Use the force Luke; let go Luke....trust me,8.0,1.0,0.0,9.0,511
"Dear lord, it wasn't funny the first time...",8.0,1.0,0.0,9.0,511
these kids are early adapters,8.0,1.0,0.0,9.0,511
Why do I always have to clean up after you?,8.0,1.0,0.0,9.0,511
"When you finish the lawn, I'll fix you a sno-cone.",8.0,1.0,0.0,9.0,511
Who does your contracts?,8.0,1.0,0.0,9.0,511
It's makes total sense when you realize it's cocaine.,8.0,1.0,0.0,9.0,511
Mom says you're avoiding her.,8.0,1.0,0.0,9.0,511
Now is not the time to search for your frisbee.,8.0,1.0,0.0,9.0,511
"Always have the right tool for the job, son. That's what my daddy taught me.",8.0,1.0,0.0,9.0,511
At least you do not have to mow the lawn for a while.,8.0,1.0,0.0,9.0,511
I think our perspective on shovels is wrong.,8.0,1.0,0.0,9.0,511
"It's not the size of the shovel, son, but the speed of the deed.",8.0,1.0,0.0,9.0,511
"Not, I don't have snow shovel envy",8.0,1.0,0.0,9.0,511
Have you seen my rock salt shaker?,8.0,1.0,0.0,9.0,511
"Sometimes size does matter, Fred...",8.0,1.0,0.0,9.0,511
I guess the saying also applies to shoveling snow.,8.0,1.0,0.0,9.0,511
"Instead of the dollar, I'll teach you about the trickle-down effect.",8.0,1.0,0.0,9.0,511
It's not about quantity...it's about quality.,8.0,1.0,0.0,9.0,511
There's more to inequality than just income,8.0,1.0,0.0,9.0,511
I get paid so much a shovel full....how about you,8.0,1.0,0.0,9.0,511
"Well the weatherman said two inches, that's enough outta you",8.0,1.0,0.0,9.0,511
No ! No ! No ! I'll dig out grandma .,8.0,1.0,0.0,9.0,511
Yes I overcompensate. People with small shovels often do.,8.0,1.0,0.0,9.0,511
"Dad, is this what you meant when you told mom size doesn't matter?",8.0,1.0,0.0,9.0,511
All I know is that I have never hurt my back shovelling snow when I use this shovel.,8.0,1.0,0.0,9.0,511
"Back straight, knees bent... You can do it Parker!",8.0,1.0,0.0,9.0,511
