caption,unfunny,somewhat_funny,funny,count,contest
"""Admit that the free market disproportionately favors those who inherit means and I'll give you the snow shovel, Gary."" “Go to Hell, Linda.” The 2016 election cycle had created an increasingly hostile environment in the Johnson household.",9.0,0.0,0.0,9.0,511
Are you calling me a liar?,8.0,0.0,0.0,8.0,511
I'll be shoveling snow until the another snowstorm arrived in one month!,7.0,0.0,0.0,7.0,511
"I'm an artist, not a garage painter!",9.0,0.0,0.0,9.0,511
Even after 25 years I still like to prove to your mother that size doesn't matter.,9.0,0.0,0.0,9.0,511
"It's cotton candy, Bro!",9.0,0.0,0.0,9.0,511
"This is how my father plowed snow, and this is how you will plow.",9.0,0.0,0.0,9.0,511
"No, I can't come dig you out!",9.0,0.0,0.0,9.0,511
Why didn’t I think of buying a bigger shovel?,9.0,0.0,0.0,9.0,511
"I told your mother I'd help out for a sec.... OK, back to you, Billy.",8.0,0.0,0.0,8.0,511
"In my day I had to use the big shovel, too.",7.0,0.0,0.0,7.0,511
Mommy said it was right in the garage where she said it was???,8.0,0.0,0.0,8.0,511
Something is just not right about this,9.0,0.0,0.0,9.0,511
"What do you mean I've ""lost it""! I saw it in the basement!",9.0,0.0,0.0,9.0,511
Don't speak so softly.,9.0,0.0,0.0,9.0,511
"Hey Dad, Mom says maybe you could use this instead of a spatula.",9.0,0.0,0.0,9.0,511
hurry up Bobby! Find the Dog! BARK! BarK!,9.0,0.0,0.0,9.0,511
I triple dog dare you!,9.0,0.0,0.0,9.0,511
IT'S NOT ABOUT HOW BIG IT IS,8.0,0.0,0.0,8.0,511
"Mine is too small. Yours is too big. Come on, let's switch hats.",8.0,0.0,0.0,8.0,511
"Who ever said, size matters.",9.0,0.0,0.0,9.0,511
"Yes, son, I know 'Child is father to the man.' But if you don't give me back my shovel, I'm telling mommy!",8.0,0.0,0.0,8.0,511
"Like father,like son!",8.0,0.0,0.0,8.0,511
"Like I say, size doesn't matter.",9.0,0.0,0.0,9.0,511
"It's time to start thinking big, dad.",9.0,0.0,0.0,9.0,511
"Remember, not a word about my 'stamina' to your mother.",8.0,0.0,0.0,8.0,511
I'm tithing.,8.0,0.0,0.0,8.0,511
I should have gone to Costco also.,8.0,0.0,0.0,8.0,511
"Son, I told you to get the shovel your size...",8.0,0.0,0.0,8.0,511
Seriously? You've been sitting there with that shovel for the past two hours?,8.0,0.0,0.0,8.0,511
"Daddy, suffering independence or socialist leanings?",9.0,0.0,0.0,9.0,511
"You know what they say, Big Shovel.........",8.0,0.0,0.0,8.0,511
Wanna swap?,9.0,0.0,0.0,9.0,511
"It's not about size, its all about how you use it.",7.0,0.0,0.0,7.0,511
Martha got off path and lost her way.,9.0,0.0,0.0,9.0,511
"Whew. Rob, are you sure by door-to-door the campaign manager meant from the front door to the door of the polling booth?",9.0,0.0,0.0,9.0,511
Its too big for the sand box .,8.0,0.0,0.0,8.0,511
"Scalable, schmalable. I'm paid by the hour.",8.0,0.0,0.0,8.0,511
a big winter means big things!,8.0,0.0,0.0,8.0,511
I'm willing to read today's newspaper online just this once.,9.0,0.0,0.0,9.0,511
"Oh, s'now you get off the iPad.",9.0,0.0,0.0,9.0,511
"Whadya mean ""What am I doing here""? I'm the latest conceptual art installation from the Museum of Contemporary Art.",8.0,0.0,0.0,8.0,511
No wonder my underpants felt so small lately.,8.0,0.0,0.0,8.0,511
"What do you think I,m trying to say?",8.0,0.0,0.0,8.0,511
Don't give me that look I couldn't find the other shovel.,9.0,0.0,0.0,9.0,511
paper says rain,8.0,0.0,0.0,8.0,511
"Hi Mr. Gibbs, my Dad borrowed your shovel.",9.0,0.0,0.0,9.0,511
It's mostly the perspective!,9.0,0.0,0.0,9.0,511
You should have said you didn't take iPay before you started.,9.0,0.0,0.0,9.0,511
I started doing this when I was your age...,9.0,0.0,0.0,9.0,511
"It's all about the motion in the ocean, son.",9.0,0.0,0.0,9.0,511
"Building a wall won't make you any safer, Son, so let's trade shovels.",9.0,0.0,0.0,9.0,511
"Maybe you need this for your windshield, buddy.",8.0,0.0,0.0,8.0,511
"Say, could I borrow your gloves?",9.0,0.0,0.0,9.0,511
Don't tell your mother what I've done with her spatula.,8.0,0.0,0.0,8.0,511
There's no white flag. You're still fair game sonny.,8.0,0.0,0.0,8.0,511
"We got a foot, or if you will, twelve inches.",8.0,0.0,0.0,8.0,511
"Junior, this is what I mean by counter intuitive!",9.0,0.0,0.0,9.0,511
I think I used the last of your little blue pills.,9.0,0.0,0.0,9.0,511
Why do I have to use the non-GMO shovel?,9.0,0.0,0.0,9.0,511
"This is as good a time as any, and better than most, to have my second childhood.",9.0,0.0,0.0,9.0,511
I'll be done by March.,8.0,0.0,0.0,8.0,511
"Our HOA requires paths to be sculpted, not shoveled",8.0,0.0,0.0,8.0,511
"It is quality, not quantity, that is the most personally satisfying.",8.0,0.0,0.0,8.0,511
I told you our therapist is wrong -- size does matter!,8.0,0.0,0.0,8.0,511
Your shovel dramatically captures the essence of pure winter bliss.,9.0,0.0,0.0,9.0,511
How 'bout *you* start paying *me* allowance?,8.0,0.0,0.0,8.0,511
I got this shovel at the Republican convention.,8.0,0.0,0.0,8.0,511
"I told you, it's not what you have, it's how you use it",8.0,0.0,0.0,8.0,511
This doesn't make any sense!,9.0,0.0,0.0,9.0,511
"Son, someday when you grow up it will be important to remember that size is not everything.",9.0,0.0,0.0,9.0,511
Back in my day we hand shoveled and we like it !,9.0,0.0,0.0,9.0,511
Your mother has some explaining to do.,9.0,0.0,0.0,9.0,511
So... size does matter?,8.0,0.0,0.0,8.0,511
"I see the cartoonist drew you the wrong size shovel, too.",8.0,0.0,0.0,8.0,511
Get used to it son. I'll always expect you to do more than me.,9.0,0.0,0.0,9.0,511
"See son, I told you it's not the size that matters, it's how well you use it that counts!",9.0,0.0,0.0,9.0,511
So where was it?,8.0,0.0,0.0,8.0,511
"After I conquer this shovel, do I get the big one Master?",9.0,0.0,0.0,9.0,511
Keep burying yourself John. You can't make snowballs until your testicles are properly frozen.,9.0,0.0,0.0,9.0,511
"Your allowance is shrinking by the minute, Tom.",9.0,0.0,0.0,9.0,511
"Dad, use this. Trump comes on in five ten minutes.",9.0,0.0,0.0,9.0,511
"Good work, keep it up!",9.0,0.0,0.0,9.0,511
"""It's called, 'Zen Shoveling' son. Watch and learn!",8.0,0.0,0.0,8.0,511
"Get used to it, son. We live iin Siberia.""",8.0,0.0,0.0,8.0,511
"Well, it's easier than that escherian stairwell game...",8.0,0.0,0.0,8.0,511
You knew going into this business venture that I was the brains and YOU were the muscle!,9.0,0.0,0.0,9.0,511
Have you seen Goldilocks?,9.0,0.0,0.0,9.0,511
Get on the walkway dummy!,8.0,0.0,0.0,8.0,511
You're handling it with kid gloves.,7.0,0.0,0.0,7.0,511
"Oh no, life's nothing but an Etcha-a-S . . .",9.0,0.0,0.0,9.0,511
Don't judge a man by its cover. A little man can sometimes do more than a big man.,9.0,0.0,0.0,9.0,511
I had to win the gambling with a son and get bigger one...,9.0,0.0,0.0,9.0,511
But Mom told me size really *does* matter,9.0,0.0,0.0,9.0,511
when I though I have it all,8.0,0.0,0.0,8.0,511
You millennials and your high-tech gadgets.,8.0,0.0,0.0,8.0,511
You're sure your mother's inside?,8.0,0.0,0.0,8.0,511
Straight A's = small shovel.,9.0,0.0,0.0,9.0,511
"Yes Bobby, that's the one that gave your mother her bad back",8.0,0.0,0.0,8.0,511
"Compensating? No, I'm not 'compensating'. You?",8.0,0.0,0.0,8.0,511
See? Manual labor is not at all like Minecraft.,8.0,0.0,0.0,8.0,511
Do you have to condensate for something over there?,9.0,0.0,0.0,9.0,511
I'm part of the 99percent.,9.0,0.0,0.0,9.0,511
A good workman never complains of his tools.,9.0,0.0,0.0,9.0,511
"Bend at the knees, son.",8.0,0.0,0.0,8.0,511
That's foolish. You pick the one right tool.,9.0,0.0,0.0,9.0,511
That's what she said.,8.0,0.0,0.0,8.0,511
I told you before size doesn't always matter.,9.0,0.0,0.0,9.0,511
"Drop dead, you useless midget!",9.0,0.0,0.0,9.0,511
"shut up, I know I should of called heads",7.0,0.0,0.0,7.0,511
"Sydney, I have a better idea. Lets go buy a snowblower.",9.0,0.0,0.0,9.0,511
"It's been 10 minutes, time to switch?",9.0,0.0,0.0,9.0,511
Upstate Ergonomics 101,8.0,0.0,0.0,8.0,511
You'll learn. My father died of a heart attack.,8.0,0.0,0.0,8.0,511
Precision and follow through get you better distance than brute strength!,8.0,0.0,0.0,8.0,511
"Dad, ""How does the guy who drives the snowplow get to work in the mornings?""",8.0,0.0,0.0,8.0,511
I'm defecting to Cuba. Don't tell your mother.,9.0,0.0,0.0,9.0,511
This new app is great !,9.0,0.0,0.0,9.0,511
Bernie Sanders Weekly Press Release: Youth Equity,9.0,0.0,0.0,9.0,511
Thanks for your good deed! See ya around sometime!,8.0,0.0,0.0,8.0,511
"I will shovel your social security check and you shovel mine, son.",9.0,0.0,0.0,9.0,511
I guess you're right. Every family has one over achiever and a one under achiever.,9.0,0.0,0.0,9.0,511
"For my audition, I'll be tap dancing as I shovel off to Buffalo.",9.0,0.0,0.0,9.0,511
"And, the far too late, it dawned on Mr. Friedman: ""Perhaps the market doesn't always efficiently allocate resources.""",7.0,0.0,0.0,7.0,511
"Come on, kid, it's not the size of the dog in the fight...",9.0,0.0,0.0,9.0,511
All I did was put a few big ones on the Cardinals,9.0,0.0,0.0,9.0,511
"I keep hearing your Mom, she needs you inside.",9.0,0.0,0.0,9.0,511
Santa's finally starting to dig out!,9.0,0.0,0.0,9.0,511
"""My Lazy Eye does NOT run all the way down to my boots!",7.0,0.0,0.0,7.0,511
Would you believe I have a bigger Johnson.,9.0,0.0,0.0,9.0,511
Are you sure the Amazon drone got the right addresses?,9.0,0.0,0.0,9.0,511
You know what? Let's move.,9.0,0.0,0.0,9.0,511
"One day, you'll have a little one. Just like this.",9.0,0.0,0.0,9.0,511
I take back what I said. Never share.,8.0,0.0,0.0,8.0,511
"Don't worry, we'll make it one scoop at a time.",9.0,0.0,0.0,9.0,511
How's that book report on Tom Sawyer going?,7.0,0.0,0.0,7.0,511
It's called seniority son.check with your union rep.,8.0,0.0,0.0,8.0,511
When people take opposite day really seriously.,9.0,0.0,0.0,9.0,511
"So, if the little shovel can move twenty percent of what the big shovel can move, but the big shovel moves no snow at all, then how much of the snow does the little shovel move?",8.0,0.0,0.0,8.0,511
"Okay, it's time to give Grandpa the Big Boy shovel.",9.0,0.0,0.0,9.0,511
It's a myth: size does NOT matter!,8.0,0.0,0.0,8.0,511
I'm from Buffalo.,9.0,0.0,0.0,9.0,511
Size matters.,9.0,0.0,0.0,9.0,511
"It's the newest shovel, global warming edition.",8.0,0.0,0.0,8.0,511
"S.O.S., you bet! Same old--same old snow!",7.0,0.0,0.0,7.0,511
No ad hominem.,8.0,0.0,0.0,8.0,511
You know what they say about small shovels.,8.0,0.0,0.0,8.0,511
Make the sidewalk great again,9.0,0.0,0.0,9.0,511
Harvey wanted his back scratched.,9.0,0.0,0.0,9.0,511
All work and no play makes Jack a dull boy. All work and no play makes Jack a dull boy. All work and no play makes Jack a dull boy. All work and no play makes Jack a dull boy. All work and no play makes Jack a dull boy. All work and ...,9.0,0.0,0.0,9.0,511
"Home Depot may have implemented affirmative action, but I'm still a better shoveller",8.0,0.0,0.0,8.0,511
"Hey, the project is shovel-ready.",9.0,0.0,0.0,9.0,511
I think I finally know how you feel,9.0,0.0,0.0,9.0,511
"Son, may I please borrow your SUV today? My Smartcar is horrible in the snow.",9.0,0.0,0.0,9.0,511
Watch me for a minute. See? You've gotta use your LEGS.,9.0,0.0,0.0,9.0,511
'We were somewhere around Barstow on the edge of the desert when the drugs began to take hold.',8.0,0.0,0.0,8.0,511
You said you wanted equality of opportunity,9.0,0.0,0.0,9.0,511
Opposites attract.,8.0,0.0,0.0,8.0,511
"I'm being paid by the hour, not the job.",9.0,0.0,0.0,9.0,511
"Get your head out of the gutter, son!",8.0,0.0,0.0,8.0,511
Still working on that first shovel full?,9.0,0.0,0.0,9.0,511
"If we switch back again then you'd be no better than Trump, is that what you want?",9.0,0.0,0.0,9.0,511
"It's not the size of your snow shovel, it's what you do with it.",9.0,0.0,0.0,9.0,511
It's just shrinkage.,9.0,0.0,0.0,9.0,511
My milkshake brought all the boys to the yard.,9.0,0.0,0.0,9.0,511
All that work to die a virgin!,9.0,0.0,0.0,9.0,511
"Don't look at me like that, there's a reason why I want to stay out here longer.",8.0,0.0,0.0,8.0,511
So much for 'size matters.',8.0,0.0,0.0,8.0,511
"No, mine is under here somewhere.",9.0,0.0,0.0,9.0,511
"Once I'm done here, it's off to the beach for the sun and sand.",9.0,0.0,0.0,9.0,511
"You don't have to understand me now son, but someday when you're living with someone, you will.",8.0,0.0,0.0,8.0,511
"Trust me, son, artisan hand forged snow shovels are part of the new economic paradigm.",8.0,0.0,0.0,8.0,511
Pretend I'm the CEO.Think of this as a reality check for the American dream.,8.0,0.0,0.0,8.0,511
I found him on Angie's List,8.0,0.0,0.0,8.0,511
Walk loudly and carry a small shovel,9.0,0.0,0.0,9.0,511
"Your allowance is 10,000 shovelfuls that way.",8.0,0.0,0.0,8.0,511
"Who is your father, he is way too harsh.",9.0,0.0,0.0,9.0,511
"Shovelling snow is hard work, at least from my perspective.",9.0,0.0,0.0,9.0,511
Left my other shovel at the beach house.,8.0,0.0,0.0,8.0,511
I wish I never took him to see Trump's helicopter.,9.0,0.0,0.0,9.0,511
Good way to make up for last year's coal error.,9.0,0.0,0.0,9.0,511
"Like I said, you were very fortunate to use the large snow shovel after I fliped the coin. Heads you won and tails I lost.",8.0,0.0,0.0,8.0,511
Have you seen the little guy with the lantern?,9.0,0.0,0.0,9.0,511
"I wish, son. You’ll understand this demonstration and hate me for it when you get older.",8.0,0.0,0.0,8.0,511
"Don't think of it as a big shovel, as much as a big character builder.",9.0,0.0,0.0,9.0,511
"Biggest computer, biggest ice cream, biggest toy...but OH NO!",9.0,0.0,0.0,9.0,511
You continue to be a massive disappointment.,9.0,0.0,0.0,9.0,511
Martha is teaching her 7-year-old son the value of speaking softly but carrying a big stick.,9.0,0.0,0.0,9.0,511
Now you can understand the dangers of big government! Your mother is the one who insisted on buying you that subsidized shovel!,9.0,0.0,0.0,9.0,511
"Yes, I could use a bigger shovel but I want to see if I can get the feel of what it is like to go through life with a micro penis.",9.0,0.0,0.0,9.0,511
"No, you little dweeb, size does NOT matter.",8.0,0.0,0.0,8.0,511
I also found this in the sandbox.,8.0,0.0,0.0,8.0,511
Can I get you an orange syrup?,8.0,0.0,0.0,8.0,511
School starts next month.,8.0,0.0,0.0,8.0,511
I don't want to look like I'm overcompensating.,8.0,0.0,0.0,8.0,511
Now you know what it's like to be a man.,8.0,0.0,0.0,8.0,511
Body image issues?,9.0,0.0,0.0,9.0,511
You see now how my suggestion of the shovel as a conceptual tool really works .,8.0,0.0,0.0,8.0,511
"""Heart-healthy California Walnuts"" to you, too!",9.0,0.0,0.0,9.0,511
Didn't I tell you on your first birthday that life wasn't fair?,9.0,0.0,0.0,9.0,511
"Where's you ox, Paul?",8.0,0.0,0.0,8.0,511
I'd rather be grilling.,8.0,0.0,0.0,8.0,511
I'm practicing for the civil service exam.,8.0,0.0,0.0,8.0,511
"Repeat after me; ""Government contract!""",9.0,0.0,0.0,9.0,511
Busted Crystal Balls,8.0,0.0,0.0,8.0,511
"Go see if Mom has warmed your cocoa, and remind her I'd like my reward shaken...",8.0,0.0,0.0,8.0,511
Would you call this the Jonas Brothers?,8.0,0.0,0.0,8.0,511
"Good ""d"" but I'm doin' the alley-oop for the second floor.",8.0,0.0,0.0,8.0,511
Mom's got her glasses on backwards again.,9.0,0.0,0.0,9.0,511
My doctor told me that using a snow shovel could lead to a heart attack.,9.0,0.0,0.0,9.0,511
I may have to reconsider my belief in global warming.,9.0,0.0,0.0,9.0,511
Shut-up! I did the walkway to the house with this.,9.0,0.0,0.0,9.0,511
"They say that, ""Little strokes fell mighty oaks,"" but I think you might be onto something!",9.0,0.0,0.0,9.0,511
"...and I bet it's your bra I'm wearing, too.",9.0,0.0,0.0,9.0,511
"People are like pigs” JP's muttered during a rush-hour epiphany, “We look up only when we get knocked flat on our backs.",9.0,0.0,0.0,9.0,511
I'll just be over here till spring...don't mind me,9.0,0.0,0.0,9.0,511
Your seem quite happy with that bat!,8.0,0.0,0.0,8.0,511
"Too want your father to avoid a massive heart attack, don't you?",9.0,0.0,0.0,9.0,511
At that moment Harokd had both a deep feeling of pride and foreboding,9.0,0.0,0.0,9.0,511
I'm paid by the hour how about you?,9.0,0.0,0.0,9.0,511
Stop your bitching--I keep telling you that you need to lift weights at the gym,9.0,0.0,0.0,9.0,511
Just once I'd like to see you finish a snowjob!,9.0,0.0,0.0,9.0,511
Does Santa know you are moonlighting?,9.0,0.0,0.0,9.0,511
"I said ""No, thank you."", not ""Snow? Thank you!""",9.0,0.0,0.0,9.0,511
It's your Mom's idea.,9.0,0.0,0.0,9.0,511
Mom says size doesn't matter.,9.0,0.0,0.0,9.0,511
That's too big for snow cones,9.0,0.0,0.0,9.0,511
I just heard spring is right around the corner.,8.0,0.0,0.0,8.0,511
"That's a buck a shovel full, Sonny--minimum ten.",9.0,0.0,0.0,9.0,511
Just lift with your legs son.,8.0,0.0,0.0,8.0,511
I'm gonna miss this stuff.,9.0,0.0,0.0,9.0,511
"See son--it's not how big it is, it's how you use it.",8.0,0.0,0.0,8.0,511
"""It's quite simple: Quality over Quantity.",9.0,0.0,0.0,9.0,511
"After the neighbors caught Dale fetching the paper naked, their mocking grew merciless.",9.0,0.0,0.0,9.0,511
The guy at the hardware store said size doesn't matter,9.0,0.0,0.0,9.0,511
Stop telling me to check my privilege.,8.0,0.0,0.0,8.0,511
Tooth fairy don't pay for lost.,8.0,0.0,0.0,8.0,511
What is this thing in my left hand?,8.0,0.0,0.0,8.0,511
Suddenly Mr. Jones realized he had never paid little Jimmy for all the snow shoveling all winter long and now it was payback time.,7.0,0.0,0.0,7.0,511
We'll get more done when Mom gets here,9.0,0.0,0.0,9.0,511
Why is his spade is bigger than mine?,9.0,0.0,0.0,9.0,511
I'm sure the counselor will hear about this next week.,9.0,0.0,0.0,9.0,511
"Remember, son, size isn't everything.",9.0,0.0,0.0,9.0,511
"Crikey, Littl' Pawn, look! Our sidewalk resembles a chess Knight's move!",9.0,0.0,0.0,9.0,511
Millennials...,9.0,0.0,0.0,9.0,511
Take my advice. It's not about size; it's about how you use it.,9.0,0.0,0.0,9.0,511
"You're the best, Mrs. G! Thanks for having my favorite popsicle on hand for me!",8.0,0.0,0.0,8.0,511
"It's all I can afford, living on Bank Interest!",9.0,0.0,0.0,9.0,511
Now do you believe in ergonomics?,9.0,0.0,0.0,9.0,511
Ain't know one got time for dat,9.0,0.0,0.0,9.0,511
But Bernie says this is the only fair way to share the labor!!!,7.0,0.0,0.0,7.0,511
"Thus, you see, son, coffee is God!",9.0,0.0,0.0,9.0,511
You just have to put your back into it.,9.0,0.0,0.0,9.0,511
"Don't gloat, son, that you got to the garage first.",8.0,0.0,0.0,8.0,511
Laugh! I like to make my fun in the snow to last.,9.0,0.0,0.0,9.0,511
"The poor and the under educated have to do the heavy lifting, that's how America works son.",9.0,0.0,0.0,9.0,511
Extremes are not cool.,9.0,0.0,0.0,9.0,511
Marty got the extra large because he had something to prove.,9.0,0.0,0.0,9.0,511
"There are no shortcuts to success, son.",9.0,0.0,0.0,9.0,511
This looks good Junior. Now it's time we tackle that roof.,9.0,0.0,0.0,9.0,511
"It's not the size of the shovel, it's the scraping of the paving.",8.0,0.0,0.0,8.0,511
Consider it a $5.00 upgrade with a Sig.given That Where were you last week when I started this project?,9.0,0.0,0.0,9.0,511
So much for disruptive technology.,7.0,0.0,0.0,7.0,511
How do you feel about global warming?,9.0,0.0,0.0,9.0,511
You'll understand when you have your own kids.,9.0,0.0,0.0,9.0,511
"so, how do you pronounce it again? Florida?",9.0,0.0,0.0,9.0,511
"Put that back, it violates the HOA's 'Small Community' theme.",8.0,0.0,0.0,8.0,511
You seen the medium guy?,8.0,0.0,0.0,8.0,511
"Son: Santa is a myth! You want to sweep the roof, go for it!",9.0,0.0,0.0,9.0,511
Call the Obesity Police: I've found the Abdomenable Showman.,8.0,0.0,0.0,8.0,511
Pitch one of them snowballs in here.,9.0,0.0,0.0,9.0,511
"You know what they say, ""It's not the size of a man's shovel. but the size of the 'shovel' in a man""...or something like that.",9.0,0.0,0.0,9.0,511
Really? Where was it?,9.0,0.0,0.0,9.0,511
I love the smell of global warming in the morning.,8.0,0.0,0.0,8.0,511
"Dad, not THAT kind of compensation.",9.0,0.0,0.0,9.0,511
"Am I going to the right? No, I'm just turning to smile at the audience. You think I should I use a big shovel?",9.0,0.0,0.0,9.0,511
"I tried flipping the pancakes with this, but I would really prefer that spatula.",9.0,0.0,0.0,9.0,511
"Two out of three ain't bad is bull, Jeb!",9.0,0.0,0.0,9.0,511
"Like I keep telling you, it's confidence not size that matters!",8.0,0.0,0.0,8.0,511
But my one per cent is very important.,9.0,0.0,0.0,9.0,511
"Hey kid face it, you lost the coin toss.",8.0,0.0,0.0,8.0,511
I see you've found the pool.,9.0,0.0,0.0,9.0,511
Less disappointment when the plow comes by.,8.0,0.0,0.0,8.0,511
"If you think that's big, you should see my...",8.0,0.0,0.0,8.0,511
"I am leaving, going to Florida",9.0,0.0,0.0,9.0,511
"I know you're from Atlanta, but that's ridiculous.",8.0,0.0,0.0,8.0,511
Are you sure you still want the big shovel?,9.0,0.0,0.0,9.0,511
Not what I expected when you said I could trade for new hand tools.,8.0,0.0,0.0,8.0,511
El Nino made me do it,9.0,0.0,0.0,9.0,511
"Hi-tech my ass! I'll bet, you can't slide down a chimney with that thing!",9.0,0.0,0.0,9.0,511
"To the confident, son, size doesn’t matter.",8.0,0.0,0.0,8.0,511
Is your mother sure this will help me shovel off the pounds?,7.0,0.0,0.0,7.0,511
"I want tone, not bulk.",9.0,0.0,0.0,9.0,511
What are you looking at? I only have a townhome.,8.0,0.0,0.0,8.0,511
No thanks Hun. The lack of NFL has unleashed the Sisyphus in me.,8.0,0.0,0.0,8.0,511
"It's not the size that matters, it's how you use it.",8.0,0.0,0.0,8.0,511
"If anyone trips, call me today for a free legal consultation.",9.0,0.0,0.0,9.0,511
"I know, baby - you'll dig it the most...",8.0,0.0,0.0,8.0,511
Now you shovel the side walk.,9.0,0.0,0.0,9.0,511
Now you understand how our tax system works.,9.0,0.0,0.0,9.0,511
Hard work is the greatest tool.,9.0,0.0,0.0,9.0,511
"It's from Costco, duh.",9.0,0.0,0.0,9.0,511
Here she is son... I'll dig her out.,8.0,0.0,0.0,8.0,511
Jack Sprat thought it was time to mix things up,9.0,0.0,0.0,9.0,511
"You wanted 'big shovel.' You got 'big shovel.' Now, just shovel!",8.0,0.0,0.0,8.0,511
"Sir, would you still need my shovel?",9.0,0.0,0.0,9.0,511
"""Now you understand that size doesn't matter. It's what you do with the tool you have,"" he explained to his son with the full knowledge that if genetics were to be trusted, it was a lesson he would use again later in life.",9.0,0.0,0.0,9.0,511
"Hey!, you wanted the big shovel",9.0,0.0,0.0,9.0,511
I still can't tell if size matters!,8.0,0.0,0.0,8.0,511
It's cheaper than the sessions with my Mistress.,9.0,0.0,0.0,9.0,511
No more calling 'Shotgun',8.0,0.0,0.0,8.0,511
You are so disappointing.,9.0,0.0,0.0,9.0,511
Are political ideologies going on here?,7.0,0.0,0.0,7.0,511
"Dang, if he tries to switch shovels with me I'll lose my excuse to be outside to blow gas.",8.0,0.0,0.0,8.0,511
I knew this weird combo-deal I got would make sense one day.,9.0,0.0,0.0,9.0,511
Tell your mother that size isn't everything.,8.0,0.0,0.0,8.0,511
Compensating?,8.0,0.0,0.0,8.0,511
"Nice try. Go back inside and tell your mother that she said to shovel the walk, so I'm shoveling the walk.",9.0,0.0,0.0,9.0,511
You'll be done in no time.,9.0,0.0,0.0,9.0,511
You realize there's an app for that. Right?,9.0,0.0,0.0,9.0,511
"No bombs Grandma, snowballs.",9.0,0.0,0.0,9.0,511
"Son, when you're married you will understand.",8.0,0.0,0.0,8.0,511
"It's not the size of the shovel that matters, is's how you use it.",9.0,0.0,0.0,9.0,511
"Yes, I know what your other grandmother thinks!",8.0,0.0,0.0,8.0,511
"Your mother didn't say, ""size never matters?",8.0,0.0,0.0,8.0,511
"Butt out, kid, I'm on a roll...",9.0,0.0,0.0,9.0,511
"It's okay, no need to help, it's just stuck in snow.",9.0,0.0,0.0,9.0,511
When I started shoveling this walk there was no snow.,8.0,0.0,0.0,8.0,511
"Let this be a lesson to you, son. Never bite off more than you can chew.",9.0,0.0,0.0,9.0,511
"Somehow the trade seemed inevitable, albeit a bit late.",8.0,0.0,0.0,8.0,511
I could have sworn the keys fell out on the path.,8.0,0.0,0.0,8.0,511
I wish your brother were here to use the medium shovel.,9.0,0.0,0.0,9.0,511
Typical government overreach,9.0,0.0,0.0,9.0,511
"No, I said 'chisel-tip'",8.0,0.0,0.0,8.0,511
better clean up before I get my coffee,9.0,0.0,0.0,9.0,511
"c'mon, Ma...cigarette break's over",7.0,0.0,0.0,7.0,511
Whoever said life was fair?,9.0,0.0,0.0,9.0,511
It's speak softly and carry a big STICK,8.0,0.0,0.0,8.0,511
Can you hand me the strawberry syrup please?,9.0,0.0,0.0,9.0,511
You just finished 'Tom Sawyer' ? How did you like it ?,9.0,0.0,0.0,9.0,511
"We're the 'Lenny' and 'George' of 'Snow And Miniscule Tools' eh? Enjoy, my friend.",8.0,0.0,0.0,8.0,511
"Hey Buddy, feeling a bit of 'trowel envy' are we?",8.0,0.0,0.0,8.0,511
I thought I told you to grab the big shovel.,8.0,0.0,0.0,8.0,511
"We all die in the end anyway, so what difference does it make?",9.0,0.0,0.0,9.0,511
Summer 2020,8.0,0.0,0.0,8.0,511
... and that's why the marginal tax rate doesn't make sense either.,7.0,0.0,0.0,7.0,511
"And on that day, Maurice taught his son a lesson that all the men of the Sorenson family have had to learn before him... it's not about the size, it's how you use it.",8.0,0.0,0.0,8.0,511
You must have been trained by an undertaker!,8.0,0.0,0.0,8.0,511
Young Sigmund found relationships confusing,8.0,0.0,0.0,8.0,511
"No, the point is avoiding mommy.",9.0,0.0,0.0,9.0,511
I told her it wasn't the size of the shovel that mattered!,9.0,0.0,0.0,9.0,511
You're good.,9.0,0.0,0.0,9.0,511
Looks like we each had a coupon at the Shoddy Shovel Shop.,8.0,0.0,0.0,8.0,511
"Good Lord, how many cats do you have?",9.0,0.0,0.0,9.0,511
"Hey you better watch out, I think my old eyes see an avalanche headin' our way.",9.0,0.0,0.0,9.0,511
