caption,unfunny,somewhat_funny,funny,count,contest
"I know taking the plane is faster, but how can you beat this leg room?",6.0,0.0,0.0,6.0,515
If it backs over us we can sue for double!,6.0,0.0,0.0,6.0,515
"Don't worry, they're just testing the whistle on this one.",6.0,0.0,0.0,6.0,515
"You're right, this is way better than taking the F.",5.0,0.0,0.0,5.0,515
"If we can make it here, we can make it anywhere.",6.0,0.0,0.0,6.0,515
"We got off real lucky, Ernest Borgnine might have been on duty.",6.0,0.0,0.0,6.0,515
"We'll be safe here, if the train goes any further it goes into the washing station.",4.0,0.0,0.0,4.0,515
How do we know this isn't Virtual Reality?,5.0,0.0,0.0,5.0,515
"If at first you don't succeed, try, try, TRY AGAINNNNNNN...",6.0,0.0,0.0,6.0,515
We've cured your fear of death!,6.0,0.0,0.0,6.0,515
"Your thought is, risk should not be avoided?",6.0,0.0,0.0,6.0,515
Even the wrong side of the tracks would be better than this.,6.0,0.0,0.0,6.0,515
It's transference not transference,5.0,0.0,0.0,5.0,515
"When I said 'we were going to catch the train,' I didn't think you would take me literally!",6.0,0.0,0.0,6.0,515
Are you sure this is what the doctor meant when he said we should be on track for a full recovery?,6.0,0.0,0.0,6.0,515
"If ""D"" stands for ""Decisive Death""...why is there only one....",6.0,0.0,0.0,6.0,515
I hope like hell they get the lighting right on this take.,5.0,0.0,0.0,5.0,515
"""Boy, our last session was a train wreck!. I think we're on the right track now"".",6.0,0.0,0.0,6.0,515
One can only hope that the second time around will be more successful,6.0,0.0,0.0,6.0,515
Why do we always miss the D-train?,6.0,0.0,0.0,6.0,515
I knew we should have used the express the first time.,6.0,0.0,0.0,6.0,515
Don't get too comfortable.,6.0,0.0,0.0,6.0,515
"What the hell? Yeah, I'll give you a refund if this doesn't work!",6.0,0.0,0.0,6.0,515
So much of life is just down to luck.,6.0,0.0,0.0,6.0,515
This is definitely the most injuries I've ever received during Spring Training,6.0,0.0,0.0,6.0,515
"So, in our last session we discussed wish fulfillment.",6.0,0.0,0.0,6.0,515
We're safe here. The 'D' train never backs up.,6.0,0.0,0.0,6.0,515
Where's Fearless Fosdick when you need him?,6.0,0.0,0.0,6.0,515
This is gonna hurt...,6.0,0.0,0.0,6.0,515
We've got to get our obamacare in before the election frank!,6.0,0.0,0.0,6.0,515
This would have been much faster in Oregon.,6.0,0.0,0.0,6.0,515
Being an immigrant sucks,6.0,0.0,0.0,6.0,515
"You know why they call it the ""D"" train don't you? Because we're f@cked.",6.0,0.0,0.0,6.0,515
Here's hoping we'll miss the next one.,6.0,0.0,0.0,6.0,515
will it hurt?,5.0,0.0,0.0,5.0,515
. . . HR said the company had a new fast-track accident recovery plan . . .,5.0,0.0,0.0,5.0,515
You idiot! I said I wanted to go TO Subway!,5.0,0.0,0.0,5.0,515
I'm beginning to question the wisdom of LOCATION LOCATION LOCATION,5.0,0.0,0.0,5.0,515
"Same time next week, but maybe a different location?",6.0,0.0,0.0,6.0,515
I believe the D train is a bit early today......,6.0,0.0,0.0,6.0,515
Just missed us!,6.0,0.0,0.0,6.0,515
This should cure your D-Trainaphobia.,5.0,0.0,0.0,5.0,515
Failure of the euthanasia activists makes life harder.,6.0,0.0,0.0,6.0,515
Maybe this time we'll get it right.,5.0,0.0,0.0,5.0,515
Betcha they put the other wheels on before we heal.,6.0,0.0,0.0,6.0,515
"Third time's a charm, right Phil?",6.0,0.0,0.0,6.0,515
You wait till now to tell me their liability insurance is capped?,6.0,0.0,0.0,6.0,515
So Superman vs. Batman has come down to this?,6.0,0.0,0.0,6.0,515
I call it 'extreme rebirthing.',6.0,0.0,0.0,6.0,515
We will be on Easy Street...no really that's the next stop.,6.0,0.0,0.0,6.0,515
"Yes, well, terrorists are much more likely there than here, Dudley.",5.0,0.0,0.0,5.0,515
"Again, the Choo Choo Train is NOT going to stop.",6.0,0.0,0.0,6.0,515
You've been hearing things...aanndd...,4.0,0.0,0.0,4.0,515
So that's what was causing all the rumbling.,6.0,0.0,0.0,6.0,515
I think this is our stop,6.0,0.0,0.0,6.0,515
whose your lawyer ?,6.0,0.0,0.0,6.0,515
It's like waiting for the Republican presidential nominee to be announced,6.0,0.0,0.0,6.0,515
I sure hope collision avoidance works better this time.,6.0,0.0,0.0,6.0,515
"It's immersion therapy. No risk, no gain.",5.0,0.0,0.0,5.0,515
I cannot tell if the train is coming or going,6.0,0.0,0.0,6.0,515
"No, I don't think you're on the right track yet.",5.0,0.0,0.0,5.0,515
I heard the renovated Medacaid office is quite efficient.,6.0,0.0,0.0,6.0,515
"The beaten in their natural habitat, the beaten path.",6.0,0.0,0.0,6.0,515
It does halfway work but these other consequences are a pain.,5.0,0.0,0.0,5.0,515
I put all my chips on this one.,5.0,0.0,0.0,5.0,515
Preoccupy yourself enough to relax.,6.0,0.0,0.0,6.0,515
Do you smell urine?,6.0,0.0,0.0,6.0,515
They say the third time's the charm.,6.0,0.0,0.0,6.0,515
At least we'll have coverage in prison.,5.0,0.0,0.0,5.0,515
Thought you said the worst was over,4.0,0.0,0.0,4.0,515
"?? ""Pardon me, boy, is that the Chattanooga choo-choo?"" ??",6.0,0.0,0.0,6.0,515
"We sure 'kicked the tires' on that one, didn't we?",6.0,0.0,0.0,6.0,515
I told the ambulance driver that I won't be able to train for a while! I'm not sure he understood!,6.0,0.0,0.0,6.0,515
My pain management doctor says I'm on the right track to recovery.,6.0,0.0,0.0,6.0,515
I heard the new R-211's will have digital video screens.,6.0,0.0,0.0,6.0,515
All this medical care is free now. So happy!,5.0,0.0,0.0,5.0,515
"'The lower cost of underground psychotherapy is a result of increased risk.""",6.0,0.0,0.0,6.0,515
I still believe it: what doesn't kill you ...,6.0,0.0,0.0,6.0,515
"See? I told you. If we had taken the LIRR we still won't be home by now, and we'd be outdoors in the snow. That's how it could ""get any worse.""",6.0,0.0,0.0,6.0,515
"Dang it, Slim. This posse rocks!",5.0,0.0,0.0,5.0,515
That may stand for deja vu--and what's gonna happen this time to us.,6.0,0.0,0.0,6.0,515
"I don't think it's so much the bandages, our our proximity to the trains, I just don't think we're catching the kind of rays in here we had expected.",6.0,0.0,0.0,6.0,515
"I hate to say 'I told you so,' but you just had to vote for a candidate who promised to cut Medicare.",6.0,0.0,0.0,6.0,515
"agreed, the last track did have impact, but let's skip this one!",5.0,0.0,0.0,5.0,515
"This last time will conclude your desensitization treatment, your fear of trains will finally be gone.",6.0,0.0,0.0,6.0,515
At least we gave as good as we got.,5.0,0.0,0.0,5.0,515
Are you sure you signed up for Obamacare?,5.0,0.0,0.0,5.0,515
Our other clinic is in Monument Valley,6.0,0.0,0.0,6.0,515
the new armchair traveling,6.0,0.0,0.0,6.0,515
Try to relax... another train should be coming through soon.,6.0,0.0,0.0,6.0,515
You said you also have nightmares of falling out of airplanes?,6.0,0.0,0.0,6.0,515
D train D train the train is coming.,5.0,0.0,0.0,5.0,515
"I am pretty pumped to make the 'playing chicken' final, but must admit that the wear and tear is getting to me",5.0,0.0,0.0,5.0,515
You should see his bookshelf on GoodReads. No wonder he hasn't gotten to the ADA.,5.0,0.0,0.0,5.0,515
"I've tested a lot of products for a lot of purposes, but who's going to buy train proof outdoor furniture?",6.0,0.0,0.0,6.0,515
I always feel worse going to Brooklyn than arriving from it.,6.0,0.0,0.0,6.0,515
This is the only thing that alleviates my depression.,6.0,0.0,0.0,6.0,515
You're repeating the same mistake.,6.0,0.0,0.0,6.0,515
"Better not take that HMO train, it could be worse!",5.0,0.0,0.0,5.0,515
It's outside of network. But it has been precertified.,6.0,0.0,0.0,6.0,515
"Next year, I pick the vacation spot.",6.0,0.0,0.0,6.0,515
I wonder what the D stands for?,6.0,0.0,0.0,6.0,515
Just get us out of our misery please,6.0,0.0,0.0,6.0,515
"Unfortunately, the hour is up, but I think your life is back on track.",5.0,0.0,0.0,5.0,515
I don't think this will get them the results they were looking for,5.0,0.0,0.0,5.0,515
I don't think this is what the boss meant when he told you to train me.,5.0,0.0,0.0,5.0,515
"We're trying to be the first New Yorkers to get hit by every train. 3 down, 19 to go.",6.0,0.0,0.0,6.0,515
"After all we've been through, you picked one hell of a way to get to the Bronx!",5.0,0.0,0.0,5.0,515
This is the ONLY way to get a free ride!,6.0,0.0,0.0,6.0,515
Well that just D-alined my bones,5.0,0.0,0.0,5.0,515
"Is this where Trump, going to rail us ????with the D????",5.0,0.0,0.0,5.0,515
"""Easy come,easy go"".",6.0,0.0,0.0,6.0,515
I think our hour is up. Same time next week ?,6.0,0.0,0.0,6.0,515
"I am positive that I said that I wanted the ""D"" train; not that I wanted to be detrained!",4.0,0.0,0.0,4.0,515
Now THIS therapy should do the trick!,6.0,0.0,0.0,6.0,515
"Maybe giving Dinah that banjo was a mistake. Why, she hasn't blown her horn in MONTHS!",5.0,0.0,0.0,5.0,515
"I don't know why, but ever since our accident I feel like my life is about to go off the rails.",6.0,0.0,0.0,6.0,515
Tell me again why the test dummies need a vacation?,4.0,0.0,0.0,4.0,515
Just sit back and enjoy the ride.,6.0,0.0,0.0,6.0,515
"Remember the phrase, ""first come, first serve?""",6.0,0.0,0.0,6.0,515
D Train: Train of the damned.,6.0,0.0,0.0,6.0,515
I regret nothing!,6.0,0.0,0.0,6.0,515
"""Relax, the ""Mobile Hospital' is just as good"".",5.0,0.0,0.0,5.0,515
Did you leave a note for the therapist?,5.0,0.0,0.0,5.0,515
Maybe this one won't hit me as hard as my divorce.,4.0,0.0,0.0,4.0,515
"No doubt about it, healthcare is the third rail.",6.0,0.0,0.0,6.0,515
I thought you said third trail.,6.0,0.0,0.0,6.0,515
"Is the ""D"" train going to make ""us"" great again?",5.0,0.0,0.0,5.0,515
"SAY ""LITERALLY"" AGAIN.",5.0,0.0,0.0,5.0,515
Sign my cast for good luck.,6.0,0.0,0.0,6.0,515
Is this the train waiting for the wrecks that have already happened?,6.0,0.0,0.0,6.0,515
Maybe we should switch to the local.,5.0,0.0,0.0,5.0,515
1. Watch out for the third rail. 2. This commute is killing me.,6.0,0.0,0.0,6.0,515
Passed by as if we were not even here.,5.0,0.0,0.0,5.0,515
This is the second case of crash test dummy delusion that I've seen today!,5.0,0.0,0.0,5.0,515
I hope we get seats together.,6.0,0.0,0.0,6.0,515
Not MY president.,5.0,0.0,0.0,5.0,515
If we cause a wreck we're screwed.,6.0,0.0,0.0,6.0,515
It gets ya comin' and goin'.,5.0,0.0,0.0,5.0,515
Nothing like a little more pain to start the morning.,6.0,0.0,0.0,6.0,515
Yet another failure in reconnaissance.,6.0,0.0,0.0,6.0,515
"""The conductor's first and last words to me were ""hello"" and goodbye"".",5.0,0.0,0.0,5.0,515
"huh, what? You sure now how to pick to noisiest places to spend time at",6.0,0.0,0.0,6.0,515
This exposure therapy is really dangerous.,6.0,0.0,0.0,6.0,515
"Oh God, here we go again.",6.0,0.0,0.0,6.0,515
"See you on the other side, Frank.",6.0,0.0,0.0,6.0,515
I hope this is the end of the line.,5.0,0.0,0.0,5.0,515
Dont worry. We know breaks.,6.0,0.0,0.0,6.0,515
"So tell me, my dear analyst, does this cartoon make any sense?",5.0,0.0,0.0,5.0,515
I thought you said we would have time to recuperate!,6.0,0.0,0.0,6.0,515
"So once again, I think it's time to stop.",6.0,0.0,0.0,6.0,515
"Well, I'm glad that's over!",6.0,0.0,0.0,6.0,515
Big Apple ingenuity--not owning a car doesn't mean you can't play Chicken.,4.0,0.0,0.0,4.0,515
"3 down 99,997 to go.",6.0,0.0,0.0,6.0,515
I know! But they tell me my deductibles are right on track.,6.0,0.0,0.0,6.0,515
"If at first you don't succumb,try, try again.",4.0,0.0,0.0,4.0,515
Who knew the Bronx was up and the Battery down,5.0,0.0,0.0,5.0,515
Something tells me Congress just voted on that bill extending MedEvac funding.,5.0,0.0,0.0,5.0,515
"If this doesn't cure you of your fear of trains, I don't know what will.",6.0,0.0,0.0,6.0,515
You say 'it felt like being hit by a train' too often.,6.0,0.0,0.0,6.0,515
When Trump is presidente he'll make it all beautiful and great again!,6.0,0.0,0.0,6.0,515
I can't believe the insurance company only pays for full body casts.,6.0,0.0,0.0,6.0,515
When is something interesting gonna happen?,3.0,0.0,0.0,3.0,515
Aren't you happy? This way we save the airfare to Oregon.,6.0,0.0,0.0,6.0,515
I told you we should've signed up for Medicare,6.0,0.0,0.0,6.0,515
"I just hate when there's ""train traffic ahead""",6.0,0.0,0.0,6.0,515
"Go ahead and shoot, we're all carrying cap guns.",5.0,0.0,0.0,5.0,515
"Look Doc, I DO want to face my fears, but when I spoke of the light at the end of the tunnel, this is not what I meant.",6.0,0.0,0.0,6.0,515
At least we don't have to worry about getting a seat.,6.0,0.0,0.0,6.0,515
We're just a couple of guys with some LOCO motives.,5.0,0.0,0.0,5.0,515
What if I were to say there is no such thing as an accident?,5.0,0.0,0.0,5.0,515
Obamacare works!,6.0,0.0,0.0,6.0,515
At least the A train blew the whistle and put on the brakes,6.0,0.0,0.0,6.0,515
This wasn't the breakthrough I had in mind.,5.0,0.0,0.0,5.0,515
The doctor said we shouldn't move.,6.0,0.0,0.0,6.0,515
Looks like the New Yorker is insensitive to the innocent lives lost in the subway to terrorism in Brussels.,6.0,0.0,0.0,6.0,515
They always return to the scene of the crime.,6.0,0.0,0.0,6.0,515
Do you find the near miss less exhilarating than it once was?,5.0,0.0,0.0,5.0,515
To take or to catch a train?,6.0,0.0,0.0,6.0,515
I think that lawyer sent us to the wrong track.,6.0,0.0,0.0,6.0,515
"I know that I was wrong about the freeway, but we should be safe here.",5.0,0.0,0.0,5.0,515
Sooner or later we need to find Zoe!,6.0,0.0,0.0,6.0,515
Perhaps we should reschedule?,6.0,0.0,0.0,6.0,515
"Uh oh. If the ""B"" train stood for broken bones...",5.0,0.0,0.0,5.0,515
Thanks Obama.,5.0,0.0,0.0,5.0,515
I'm telling you...The NTSB said that all he had was a poppy seed bagel.,6.0,0.0,0.0,6.0,515
"they don't call it the ""track lounge"" for nothing",6.0,0.0,0.0,6.0,515
I don't think I like this the new Medicare Part D prescription plan.,6.0,0.0,0.0,6.0,515
I prefer F train.,6.0,0.0,0.0,6.0,515
Stop me if you've heard this one,6.0,0.0,0.0,6.0,515
"You know, Harvey, I've always loved your proactive spirit.",6.0,0.0,0.0,6.0,515
The lawyer called about our eminent domain appeal,5.0,0.0,0.0,5.0,515
At that speed we should get where we are going in a New York minute,5.0,0.0,0.0,5.0,515
They said physical therapy might hurt.,6.0,0.0,0.0,6.0,515
Good thing psychiatrists a required to be M.D.s.,5.0,0.0,0.0,5.0,515
At least the primaries are over. The general election shouldn't be as bad.,6.0,0.0,0.0,6.0,515
We have to stop meeting like this.,6.0,0.0,0.0,6.0,515
"Barry, It's cheaper than amputation by a surgeon.",5.0,0.0,0.0,5.0,515
I think our last gig was too risky,5.0,0.0,0.0,5.0,515
I'm pretty sure they said the MTA have the best coverage,6.0,0.0,0.0,6.0,515
"Sometimes you just need to kick back, relax, and let the D come to you.",6.0,0.0,0.0,6.0,515
Still think the Low Line is the next High Line?,6.0,0.0,0.0,6.0,515
Talk about Paris! They have just announced another strike on line D of the RER!,5.0,0.0,0.0,5.0,515
Worth it. Just love trains.,5.0,0.0,0.0,5.0,515
"Earl, did you remember to turn off the lights?",6.0,0.0,0.0,6.0,515
"Remember, just avoid the third rail and we'll be okay.",6.0,0.0,0.0,6.0,515
I don't understand what's holding up the lounge car.,5.0,0.0,0.0,5.0,515
"Don't worry, I'll only bill you we survive.",5.0,0.0,0.0,5.0,515
Are you certain the furniture isn't going to get in the way this time?,6.0,0.0,0.0,6.0,515
"I don't know about you, but it make ME feel terrible.",5.0,0.0,0.0,5.0,515
But sometimes it takes two big shocks to awaken our preconscious memories.,6.0,0.0,0.0,6.0,515
Do you know what the odds are of getting struck by a train twice are.,5.0,0.0,0.0,5.0,515
And you're sure you haven't heard back from Uber?,5.0,0.0,0.0,5.0,515
"Okay, featherbedding break is over.",6.0,0.0,0.0,6.0,515
Really? I prefer Blonde on Blon.....oh.,5.0,0.0,0.0,5.0,515
With a little help we can take this to Coney Island.,6.0,0.0,0.0,6.0,515
This should meet my health insurance deductible.,6.0,0.0,0.0,6.0,515
It's all so random.,5.0,0.0,0.0,5.0,515
Here comes the trai......,5.0,0.0,0.0,5.0,515
"...I got $20,000. You?",6.0,0.0,0.0,6.0,515
It oughta be the F train. That cartoonist really got upset when you told him he left off the right rear bogie.,6.0,0.0,0.0,6.0,515
We are back on track.,4.0,0.0,0.0,4.0,515
"In our second meeting of the Lazy Person's Fight Club, we rumble with the D train.",6.0,0.0,0.0,6.0,515
Desensitization program,5.0,0.0,0.0,5.0,515
Rock faster. They're gaining on us!,5.0,0.0,0.0,5.0,515
So this is the new CDC rules for pain control!,6.0,0.0,0.0,6.0,515
You'd think we'd be smart enough not to try this again...,6.0,0.0,0.0,6.0,515
Service at bit rushed. 3 stars.,6.0,0.0,0.0,6.0,515
One last game of chicken?,5.0,0.0,0.0,5.0,515
"No problem!"" ""The A train last week was going at twice the speed!",6.0,0.0,0.0,6.0,515
I thought you said the next train was not an express.,6.0,0.0,0.0,6.0,515
"So tell me, how often do you hear trains?",6.0,0.0,0.0,6.0,515
Wish my wheelset had come on time... Somehow I feel calmer with the Northbound D Train... This is usually more fun with pennies...,6.0,0.0,0.0,6.0,515
Did the A train go by already?,6.0,0.0,0.0,6.0,515
"Forget the sidelines, we're sitting on the line.",6.0,0.0,0.0,6.0,515
Exposure therapy isn't working. Why don't you just get a car?,6.0,0.0,0.0,6.0,515
Those Emergency Ward doctors and nurses got us back out here incredibly quickly!,6.0,0.0,0.0,6.0,515
The real cause of rising healthcare costs,6.0,0.0,0.0,6.0,515
Why did I procrastinate on my suicide note?,6.0,0.0,0.0,6.0,515
They really need to update their emergency brake test.,5.0,0.0,0.0,5.0,515
Not to worry. Donald said he was going to take great care of the wounded vets.,6.0,0.0,0.0,6.0,515
"I don't forsee that being an issue. But, I'm not exactly known for my foresight.",6.0,0.0,0.0,6.0,515
Is that the downtown or uptown train?,6.0,0.0,0.0,6.0,515
I continue to be haunted by my recent past.,5.0,0.0,0.0,5.0,515
I'm sure glad our year of living dangerously is almost over.,6.0,0.0,0.0,6.0,515
Coming home is always the best part.,5.0,0.0,0.0,5.0,515
"We're sure lucky, we missed that Third Rail !",5.0,0.0,0.0,5.0,515
You would think it had learned by now,5.0,0.0,0.0,5.0,515
"Medical euthanasia would have been less painful, don't you think?",6.0,0.0,0.0,6.0,515
"What did you expect? The ad said, I was a trained therapist!",6.0,0.0,0.0,6.0,515
"As Dorothy Parker said, 'The Bronx, no thonx.'",6.0,0.0,0.0,6.0,515
"(Sound of train screeching to a halt) ""Previously on Subway Post-Op...""",5.0,0.0,0.0,5.0,515
We have more to worry about than being politically correct!,5.0,0.0,0.0,5.0,515
And we thought there'd be nothing to worry about once we got on to the tenure track.,5.0,0.0,0.0,5.0,515
I'm beginning to feel as if living on the edge IS our comfort zone,5.0,0.0,0.0,5.0,515
I am being rail lazy today! I wish there wouldn't be any trains going through every 5 seconds.,6.0,0.0,0.0,6.0,515
"that's the last time I buy ""baggage class""!!!",6.0,0.0,0.0,6.0,515
"I thought it might be less painful for us both, if we shifted track away from your mother.",6.0,0.0,0.0,6.0,515
"No, really, we have to stop meeting like this.",6.0,0.0,0.0,6.0,515
"Like I told ya Frank, cast itch, is covered by Obamacare !",6.0,0.0,0.0,6.0,515
Who said political correctness was boring?,5.0,0.0,0.0,5.0,515
"Yep, I remember when they took you to a hospital. Sometimes you even got a room.",4.0,0.0,0.0,4.0,515
"If you hurt me, i'm telling my mother.",6.0,0.0,0.0,6.0,515
"""Bro,lets do this.do a video tape"".",4.0,0.0,0.0,4.0,515
Trust me - My healthcare is gonna be SO great.,5.0,0.0,0.0,5.0,515
Early attempts at an Uber-subway ambulance required GPS tweaking.,6.0,0.0,0.0,6.0,515
Oh well. See you on the other side!,6.0,0.0,0.0,6.0,515
"Our work together has certainly been rough but now, really, our time is up!",5.0,0.0,0.0,5.0,515
What's Clark Kent doing differently that we're not???,6.0,0.0,0.0,6.0,515
The Obamacare-Amtrack merger has a few kinks.,5.0,0.0,0.0,5.0,515
"Well Priebus , nothing will de-rail our plan for a contested nominee",5.0,0.0,0.0,5.0,515
Have some faith - we stopped it the first time,6.0,0.0,0.0,6.0,515
This new company training program is costing me an arm and a leg.,6.0,0.0,0.0,6.0,515
The view is not too good but it is close to Metro.,6.0,0.0,0.0,6.0,515
So THIS is the Donald's Endlösung.,5.0,0.0,0.0,5.0,515
I don't think this is a good palace to rest,6.0,0.0,0.0,6.0,515
Fell in front of a train. You?,6.0,0.0,0.0,6.0,515
I told you !This line is always on time.,5.0,0.0,0.0,5.0,515
Millie said I could have a caboose cave.,6.0,0.0,0.0,6.0,515
Scooch over. I'll hook on. It won't hurt this time. Promise.,6.0,0.0,0.0,6.0,515
I couldn't imagine being anything other than a stuntman.,5.0,0.0,0.0,5.0,515
Let me guess! Pelham 4-5-6?,6.0,0.0,0.0,6.0,515
Maybe we should try the samurai sword next time.,6.0,0.0,0.0,6.0,515
You getting any R & R ?,5.0,0.0,0.0,5.0,515
At least we're not on the third rail.,5.0,0.0,0.0,5.0,515
The Power of Two,6.0,0.0,0.0,6.0,515
"Ralph, it just hit me how unlucky we are!",5.0,0.0,0.0,5.0,515
I'm hearing you're right on track for that promotion...,6.0,0.0,0.0,6.0,515
"Wouldn't my siderodromophobia be best cured from inside the train, doc?",6.0,0.0,0.0,6.0,515
"Eminent domain can take my land, but never my home!",5.0,0.0,0.0,5.0,515
Come back and fight! We'll bite off your caboose!,5.0,0.0,0.0,5.0,515
You say I am always in this recurring dream of yours?,5.0,0.0,0.0,5.0,515
D-Troit,6.0,0.0,0.0,6.0,515
No one saw the movie either.,6.0,0.0,0.0,6.0,515
It feels like our relationship left the rails a long time ago.,5.0,0.0,0.0,5.0,515
I should really consider raising my hourly rate for a safer neighborhood.,4.0,0.0,0.0,4.0,515
Ya sure they're gonna take our word for it?,6.0,0.0,0.0,6.0,515
Your witty remarks about the nurses bandaging technique seem to have backfired.,5.0,0.0,0.0,5.0,515
Maybe this time I'll be lucky.,5.0,0.0,0.0,5.0,515
Are you sure the doctor wrote T-R-A-C-K-T-I-O-N?,5.0,0.0,0.0,5.0,515
Are you sure this is the way we fill find the God Particle like they do in Europe's tunnels,6.0,0.0,0.0,6.0,515
Are you really sure we're bound?,6.0,0.0,0.0,6.0,515
That was the Bloods train,6.0,0.0,0.0,6.0,515
This should increase our chances of a higher disability check.,6.0,0.0,0.0,6.0,515
I can't find the time to relax anymore.,5.0,0.0,0.0,5.0,515
"It's fine, the circle means it's local.",6.0,0.0,0.0,6.0,515
"If this video doesn't go viral on YouTube, I may need to go back to work.",6.0,0.0,0.0,6.0,515
Termination in psychoanalysis can be challenging to both the patient and the analyst!,5.0,0.0,0.0,5.0,515
I think that we might be on the right track in discovering your irrational fear of trains.,6.0,0.0,0.0,6.0,515
You opted for the 'put-out-to-pasture PPO' too? At least there's no deductible.,6.0,0.0,0.0,6.0,515
I told you we were on the wrong side of the tracks.,6.0,0.0,0.0,6.0,515
Are you sure this is an express train....?,5.0,0.0,0.0,5.0,515
Leave nothing to my wife.,6.0,0.0,0.0,6.0,515
"You know, I don't like to brag but...",5.0,0.0,0.0,5.0,515
You were my destiny.,6.0,0.0,0.0,6.0,515
Its the last train to Clarksville,6.0,0.0,0.0,6.0,515
"So in our last session you likened your divorce to being in a plane crash. Today, you say it feels like a train wreck. Walk me through what that's like.",5.0,0.0,0.0,5.0,515
I feel railroaded into this therapy session.,5.0,0.0,0.0,5.0,515
"""Just a little disappointed in our physical therapy cover"".",5.0,0.0,0.0,5.0,515
"It's the same dream doc, it's Opening Day and the Yanks will win the Series if they don't get hit with injuries.",6.0,0.0,0.0,6.0,515
They must be improving service!,6.0,0.0,0.0,6.0,515
"Yeah, I suppose you could call it an obsession.",6.0,0.0,0.0,6.0,515
It's supposed to encourage quicker mobility...,5.0,0.0,0.0,5.0,515
"I can do this all day, you know!",6.0,0.0,0.0,6.0,515
"This is what life feels like when you don't go to college. Kids, do yoursleves a favor and do good in school!",6.0,0.0,0.0,6.0,515
I can connect the dots from A to C but not to D.,5.0,0.0,0.0,5.0,515
It is a boo-boo choo-choo.,6.0,0.0,0.0,6.0,515
Maybe we'll reach our deductible now,5.0,0.0,0.0,5.0,515
That's the last time I take Uber.,5.0,0.0,0.0,5.0,515
"I know it doesn't feel like progress, but I feel like we're very close to getting you over this whole ""fear of trains"" thing.",5.0,0.0,0.0,5.0,515
"See I told you, we get way better rays on the D Line!",5.0,0.0,0.0,5.0,515
Tell me again Doc. How is this going to cure my fear of trains?,5.0,0.0,0.0,5.0,515
"I think this only worked in ""Inception.""",5.0,0.0,0.0,5.0,515
"When did you first notice these ""feelings"" ?",6.0,0.0,0.0,6.0,515
I just can't continue to repeat your past with you...,5.0,0.0,0.0,5.0,515
"Cognitive dissonance be damned, this new evidence is beginning to convince me that things are never going to be great again.",4.0,0.0,0.0,4.0,515
This should get 'er done.,5.0,0.0,0.0,5.0,515
"The partners say it's all about billable hours, dude.",6.0,0.0,0.0,6.0,515
Trust me. I've had excellent results with this kind of trauma re-enactment therapy.,5.0,0.0,0.0,5.0,515
We were just relaxing and minding our own business.,4.0,0.0,0.0,4.0,515
It's a good training.,6.0,0.0,0.0,6.0,515
Don't worry.. Insurance will pay for everything except the chairs,5.0,0.0,0.0,5.0,515
I think it's time to find a new man cave.,6.0,0.0,0.0,6.0,515
I think we would be happier if we lived on the wrong side of the tracks.,5.0,0.0,0.0,5.0,515
We may not be on the right track to recovery!,6.0,0.0,0.0,6.0,515
Isn't this a little extreme doc...couldn't we just move from America to get away from Trump?,6.0,0.0,0.0,6.0,515
This should help relieve your trainophobia.,6.0,0.0,0.0,6.0,515
It's brake time!,6.0,0.0,0.0,6.0,515
The Doctor told us how lucky we were ...,6.0,0.0,0.0,6.0,515
I told you the wrapping was just a waste of time.,4.0,0.0,0.0,4.0,515
