caption,unfunny,somewhat_funny,funny,count,contest
"Suddenly, being on the wrong side of the tracks doesn't sound so bad!",4.0,2.0,0.0,6.0,515
The victory of hope over experience.,5.0,0.0,1.0,6.0,515
"On a scale of 0 to 10, how content are you with your life?",5.0,0.0,1.0,6.0,515
At least it was nice of them to give us their seats.,5.0,0.0,1.0,6.0,515
"I really hope that ""D"" stands for ""death"". Cuz' we have already tried ""A"", ""B"", and ""C"" trains. Ya know what i'm saying?",5.0,0.0,1.0,6.0,515
Let's talk about who might be enabling your suicidal tendencies....,4.0,2.0,0.0,6.0,515
There’s no better way to conquer your fear of injuries.,4.0,2.0,0.0,6.0,515
Sorry—I got priced out of the A tunnel.,4.0,2.0,0.0,6.0,515
"Déjà vu. I remember now, it means...",5.0,0.0,1.0,6.0,515
"The thing is, none of these captions that win are actually funny or witty in any way. So here's to life. Cross my heart and hope to die.",5.0,0.0,1.0,6.0,515
It's really best to face these fears head on...,5.0,0.0,1.0,6.0,515
"Now in this dream, you say you always wake up before the train hits?",4.0,2.0,0.0,6.0,515
How many rounds is a game of chicken supposed to last?,5.0,0.0,1.0,6.0,515
What doesn't kill you...,4.0,2.0,0.0,6.0,515
"You promise that getting in front of this train will pay off even bigger than the car thing, right?",4.0,2.0,0.0,6.0,515
You said there'd be wheels.,4.0,2.0,0.0,6.0,515
"Fear of intimacy is the ""Third Rail"" of Freudian Psychoanalysis.",5.0,0.0,1.0,6.0,515
I'm Jake. From State Farm.,4.0,2.0,0.0,6.0,515
And you thought your life was a train wreck before...,5.0,0.0,1.0,6.0,515
These sitdown strikes sure have improved.,5.0,0.0,1.0,6.0,515
I double-checked the schedule. This time we'll have the whole hour.,4.0,2.0,0.0,6.0,515
I thought Rx stood for Railroad crossing!,5.0,0.0,1.0,6.0,515
Can you believe this weather we're having?,4.0,2.0,0.0,6.0,515
How many times do you think we can do this before they call it insurance fraud?,4.0,2.0,0.0,6.0,515
"But, if they do back it up...",5.0,0.0,1.0,6.0,515
I warned you I was a train wreck waiting to happen.,5.0,0.0,1.0,6.0,515
It's never as bad as you remember.,4.0,2.0,0.0,6.0,515
This is the last time we use Airbnb.,5.0,0.0,1.0,6.0,515
I hate reruns.,4.0,2.0,0.0,6.0,515
"Bob, our relationship is really going off the rails.",5.0,0.0,1.0,6.0,515
"So I dreamt that your office was on the subway tracks, and we were both wearing large casts, and we were about to be obliterated by a D train car with wheels on only one side. And right now, I'm feeling a strong sense of deja vu.",4.0,2.0,0.0,6.0,515
The menu on this train is offers duck or squash. Your choice.,5.0,0.0,1.0,6.0,515
I hear they're hiring at the airport.,5.0,0.0,1.0,6.0,515
"The doctor recommended that I get direct exposure to ""D"" to increase bone density.",4.0,2.0,0.0,6.0,515
I feel so lucky to have found someone with similar interests.,4.0,2.0,0.0,6.0,515
"Yes, getting a free ride into the city saves money, but couldn't we just take a cab once in a while?",5.0,0.0,1.0,6.0,515
Assisted Suicide is no longer the third rail of the health care debate.,4.0,2.0,0.0,6.0,515
Why move? It's an easy commute.,4.0,2.0,0.0,6.0,515
I can't help but feel sooner or later our luck is going to run out.,5.0,0.0,1.0,6.0,515
"It's not a great job, but somebody's gotta do it.",4.0,2.0,0.0,6.0,515
THIS assisted suicide will work!,5.0,0.0,1.0,6.0,515
"Forget the consequences. It is the principal of the matter. Sure, we may lose another battle, but we will win the war.",5.0,0.0,1.0,6.0,515
We need to find a new place to watch the game.,4.0,2.0,0.0,6.0,515
"I wouldn't want to arouse you angst any further, but did you notice that the train has no wheels on that side?",5.0,0.0,1.0,6.0,515
And I was just getting comfortable.,5.0,0.0,1.0,6.0,515
We're being held because of train traffic ahead of us.,4.0,2.0,0.0,6.0,515
Let go of fear and trust the process.,5.0,0.0,1.0,6.0,515
I know it didn't work out so well the last time we tried this…,4.0,2.0,0.0,6.0,515
"``If you say `wrong place, wrong time' once more, I'll scream.''",4.0,2.0,0.0,6.0,515
"I've decided to switch to a therapist who doesn't keep saying ""things could be worse"".",4.0,2.0,0.0,6.0,515
"Is it me or do you hear something, too?",5.0,0.0,1.0,6.0,515
I'll admit I was a little skeptical about having this reunion.,5.0,0.0,1.0,6.0,515
So... last time we worked on your fear of heights...,5.0,0.0,1.0,6.0,515
"Yes, I do have violent dreams.",4.0,2.0,0.0,6.0,515
"No, I'm not feeling suicidal. Are you feeling suicidal?",5.0,0.0,1.0,6.0,515
"Describe to me again, the moment you saw the light.",4.0,2.0,0.0,6.0,515
"I support universal healthcare, but the waiting rooms have really taken a toll",4.0,2.0,0.0,6.0,515
I'm afraid we've run over again.,5.0,0.0,1.0,6.0,515
I think these lounge chairs hurt our credibility in court,4.0,2.0,0.0,6.0,515
"Yeah, but it's still safer than playing football.",5.0,0.0,1.0,6.0,515
Facing fear - finally,5.0,0.0,1.0,6.0,515
I've decided cognitive therapy is probably the way to go,4.0,2.0,0.0,6.0,515
The disability train comes to the trauma track with tricked up treatment again.,5.0,0.0,1.0,6.0,515
My medical diagnosis is finally on track.,5.0,0.0,1.0,6.0,515
These one-side wheeled trains from New Zealand just don't run anymore.,5.0,0.0,1.0,6.0,515
This aversion therapy will definitely help you get over your fear of trains.,4.0,2.0,0.0,6.0,515
They say you need to get back on track for a full recovery.,5.0,0.0,1.0,6.0,515
Again ?!?!,5.0,0.0,1.0,6.0,515
My lawyer is in the caboose.,4.0,2.0,0.0,6.0,515
"Honey, I still think we need to sell this timeshare",4.0,2.0,0.0,6.0,515
I think we're both suffering from a one-track mind.,4.0,2.0,0.0,6.0,515
So I guess next week it's automobiles ?,5.0,0.0,1.0,6.0,515
I thought you said it would be the A train.,5.0,0.0,1.0,6.0,515
Did you call the trial lawyers?,4.0,2.0,0.0,6.0,515
Freudian.,4.0,2.0,0.0,6.0,515
I'm thinking our creator has tunnel vision.,4.0,2.0,0.0,6.0,515
"So when you said you have an irrational fear of subways B, L and T you were talking about a sandwich?",5.0,0.0,1.0,6.0,515
Careful. Don't touch the third rail.,4.0,2.0,0.0,6.0,515
"I guess we should've known the D stood for ""Donald"" when the wheels started falling off but it still somehow managed to stay on track and break us.",4.0,2.0,0.0,6.0,515
What's the definition of insanity again?,4.0,2.0,0.0,6.0,515
You thought Obamacare was bad? Well welcome to Trumpcare!,5.0,0.0,1.0,6.0,515
I think you're afraid of confrontation,5.0,0.0,1.0,6.0,515
"Don't worry, it's the D train. We still have an eternity.",4.0,2.0,0.0,6.0,515
Fool me once ...,4.0,2.0,0.0,6.0,515
"Nobody said exposure therapy was quick or easy, but trust me -- it works.",4.0,2.0,0.0,6.0,515
It's hard to die.,5.0,0.0,1.0,6.0,515
Tell him to stop!,5.0,0.0,1.0,6.0,515
At least we aren't on the third rail.,4.0,2.0,0.0,6.0,515
"Through this whole Batman v Superman argument, what have we gained?",4.0,2.0,0.0,6.0,515
This isn't working.,4.0,2.0,0.0,6.0,515
Life should only be so easy !,5.0,0.0,1.0,6.0,515
Couch or coach ?,4.0,2.0,0.0,6.0,515
We'll take another look at his issue in recovery.,4.0,2.0,0.0,6.0,515
"You've had your office here, what, seven years now? And I'm the crazy one?",4.0,2.0,0.0,6.0,515
Watch out for the third rail this time.,4.0,2.0,0.0,6.0,515
"Well, my wife thinks I'm just accident-prone.",4.0,2.0,0.0,6.0,515
So how is your peripheral vision coming along?,4.0,2.0,0.0,6.0,515
Everyday it gets harder to be a trained therapist.,4.0,2.0,0.0,6.0,515
My hearing's coming back...finally!!,4.0,2.0,0.0,6.0,515
Whiteout!,5.0,0.0,1.0,6.0,515
I'm beginning to suspect our wives' retirement suggestions.,5.0,0.0,1.0,6.0,515
Sticking my thumb out doesn't seem to be working either.,4.0,2.0,0.0,6.0,515
I feel like a train wreck!,5.0,0.0,1.0,6.0,515
Why are we here? i mean in the metaphysical sense?,4.0,2.0,0.0,6.0,515
See? Doesn't it feel good to face things head on?,5.0,0.0,1.0,6.0,515
Another untimely end,4.0,2.0,0.0,6.0,515
I'm seriously thinking of taking your therapy on a different track.,4.0,2.0,0.0,6.0,515
What do you say next trip we skip the Club Car!,5.0,0.0,1.0,6.0,515
Did you get the license number ?,5.0,0.0,1.0,6.0,515
That's the last time I use Craigslist.,4.0,2.0,0.0,6.0,515
I find this setting gives my patients a greater sense of urgency.,4.0,2.0,0.0,6.0,515
But surely Mr. Johnson you realize that doing the same thing over and over again and expecting a different outcome is just plain--,4.0,2.0,0.0,6.0,515
We really should move our seats.,5.0,0.0,1.0,6.0,515
At least he's in-network.,4.0,2.0,0.0,6.0,515
Might as well enjoy while we can.,4.0,2.0,0.0,6.0,515
Not to worry honey---our insurgence covers pre-existing conditions.,4.0,2.0,0.0,6.0,515
"On the other hand, it's rent controlled.",4.0,2.0,0.0,6.0,515
Now for our final Systematic Desensitization session.,5.0,0.0,1.0,6.0,515
I finally feel like we're on track.,5.0,0.0,1.0,6.0,515
"Before retiring, I never understood it when they would say that 'Medicare is the third rail of American Politics.'",4.0,2.0,0.0,6.0,515
"So, you have seen Double Indemnity.",5.0,0.0,1.0,6.0,515
Trust me!,4.0,2.0,0.0,6.0,515
These vacations were much worse before Obamacare.,4.0,2.0,0.0,6.0,515
"I told you, even if we are on the right track, we will get run over !",5.0,0.0,1.0,6.0,515
If at first you don't succeed ...,4.0,2.0,0.0,6.0,515
Looks like we've run over again.,5.0,0.0,1.0,6.0,515
Maybe I should try skydiving.,4.0,2.0,0.0,6.0,515
"The good news is, after years of therapy, I think we are finally seeing the light at the end of the tunnel!",4.0,2.0,0.0,6.0,515
"Hopefully, this goes better than last time.",5.0,0.0,1.0,6.0,515
Trust me Art this is going to be much easier than base jumping!,4.0,2.0,0.0,6.0,515
So you're saying sometimes a train going through a tunnel is just a train going through a tunnel?,5.0,0.0,1.0,6.0,515
Well done We have conquered your fear of trains,4.0,2.0,0.0,6.0,515
You feel as though something catastrophic is bearing down on you. Hmmm...tell me more about that.,4.0,2.0,0.0,6.0,515
"Next, we should try the E train.",4.0,2.0,0.0,6.0,515
I'd say you're doomed.,4.0,2.0,0.0,6.0,515
Being in training is harder than I thought.,5.0,0.0,1.0,6.0,515
I'm giving up on subway assisted suicide.,5.0,0.0,1.0,6.0,515
"Don't worry, third time's the charm.",5.0,0.0,1.0,6.0,515
"So, Dr. Siegfried, how much aversion therapy before I conquer my subway fear?",4.0,2.0,0.0,6.0,515
But people always said we had tunnel vision.,4.0,2.0,0.0,6.0,515
Rail travel cost an arm and a leg these days,4.0,2.0,0.0,6.0,515
Let's see the insurance adjuster pull that 'pre-existing condition' crap on us now!,4.0,2.0,0.0,6.0,515
I just don't know if people outside of New York can relate to this.,4.0,2.0,0.0,6.0,515
"Took a few tries, but I think we're finally on the right track.",5.0,0.0,1.0,6.0,515
And how did you feel toward the train when it hit you?,4.0,2.0,0.0,6.0,515
A Duke Ellington song just came to mind.,5.0,0.0,1.0,6.0,515
"Hooray, they stopped - third time lucky.",4.0,2.0,0.0,6.0,515
"My, is the 2 o'clock early again?",4.0,2.0,0.0,6.0,515
"I know we've been over this, but let's see where it goes.",4.0,2.0,0.0,6.0,515
Allahu akbar!,5.0,0.0,1.0,6.0,515
Part of me is starting to think this was a bad idea.,4.0,2.0,0.0,6.0,515
"Like I told you last time, we hold sessions here because your insurance will only cover counselling as part of an emergency department visit.",4.0,2.0,0.0,6.0,515
Next stop: Tell me about your mother.,5.0,0.0,1.0,6.0,515
"The question we have to ask ourselves is, 'Have we learned anything?'",5.0,0.0,1.0,6.0,515
We'll continue next week.,4.0,2.0,0.0,6.0,515
What are the odds it will happen again in exactly the same place?,5.0,0.0,1.0,6.0,515
Do you hear the roar of the ocean?,4.0,2.0,0.0,6.0,515
What's that noise?,4.0,2.0,0.0,6.0,515
We should have taken the express the first time around.,4.0,2.0,0.0,6.0,515
This still isn't quite the way I thought we could explore your inner fears.,4.0,2.0,0.0,6.0,515
The fourth train's the charm.,5.0,0.0,1.0,6.0,515
Next time we gotta bring the outdoor furniture.,5.0,0.0,1.0,6.0,515
Don't you think we need a break?,4.0,2.0,0.0,6.0,515
"According to my financial advisor, this is the only I get to retire before 60.",4.0,2.0,0.0,6.0,515
I thought you said reliving the experience would take the fear away.,5.0,0.0,1.0,6.0,515
I'm pretty sure we are at the end of our sessions.,5.0,0.0,1.0,6.0,515
"Okay, today's exercise should clear up your siderodromophobia",4.0,2.0,0.0,6.0,515
I think we got it this time.,4.0,2.0,0.0,6.0,515
I don't know Doc; it certainly feels real.,4.0,2.0,0.0,6.0,515
It's the price you pay for living life in the fast lane.,4.0,2.0,0.0,6.0,515
Do you have anything else you want to say?,4.0,2.0,0.0,6.0,515
We'll be fine this time with the chairs.,5.0,0.0,1.0,6.0,515
"But as we established last week, the Subway DOES exist.",4.0,2.0,0.0,6.0,515
It's possible that applied behavioral therapy is not the right approach for you.,5.0,0.0,1.0,6.0,515
"Like you, I'm always bowled over by trains...",4.0,2.0,0.0,6.0,515
Perhaps next time we should try the High Line.,4.0,2.0,0.0,6.0,515
"Other than some minor loss of peripheral vision, my doctor says I'll make a complete recovery.",5.0,0.0,1.0,6.0,515
I still say the exposed brick walls are worth it.,4.0,2.0,0.0,6.0,515
I'm starting to wish you'd responded to guided image therapy,4.0,2.0,0.0,6.0,515
"On the bright side, this rental is close to everything.",4.0,2.0,0.0,6.0,515
"I SAID, ""I THINK THE TRAIN IS COMING!""",4.0,2.0,0.0,6.0,515
Second time is the charm.,5.0,0.0,1.0,6.0,515
We may have gone too far with you confronting your fear of trains.,5.0,0.0,1.0,6.0,515
"Don't worry , it's just the deductible .",5.0,0.0,1.0,6.0,515
What was I saying? I lost my train of thought.,4.0,2.0,0.0,6.0,515
"Well, at least he made the trains run on time.",5.0,0.0,1.0,6.0,515
Practice makes perfect,4.0,2.0,0.0,6.0,515
It's what you take away from the experience that counts.,4.0,2.0,0.0,6.0,515
"Be careful not to touch the third rail, I heard it could be fatal",4.0,2.0,0.0,6.0,515
"We'll be fine, it's the D train it'll be out of service for at least an hour.",4.0,2.0,0.0,6.0,515
We can only be pushed so far.,5.0,0.0,1.0,6.0,515
"Doctor, seems we're not on the right track this session.",5.0,0.0,1.0,6.0,515
Those Trump people really hold a grudge.,4.0,2.0,0.0,6.0,515
My caboose is killing me!,4.0,2.0,0.0,6.0,515
"I've empathized with you and I've sympathized with you. Now, for once, you are going to feel my pain.",4.0,2.0,0.0,6.0,515
We're past third time lucky. What now?,4.0,2.0,0.0,6.0,515
They said we should take the A train,4.0,2.0,0.0,6.0,515
"It's time we finished, my 3:10 is here.",4.0,2.0,0.0,6.0,515
"Doc, I admit the Fight Club therapy sessions were good, but I think we're on the wrong track with this one...",5.0,0.0,1.0,6.0,515
What are the chances of it happening 7 times in a row?,4.0,2.0,0.0,6.0,515
I figure one more personal injury claim and I can retire.,5.0,0.0,1.0,6.0,515
"They say the best way to recover from trauma is to face it again, head-on.",4.0,2.0,0.0,6.0,515
This better work this time.,4.0,2.0,0.0,6.0,515
Be very careful not to touch the third rail.,4.0,2.0,0.0,6.0,515
They were really nice about helping us off the train.,4.0,2.0,0.0,6.0,515
"Our last session of systematic desensitization of my fear of trains proves you are taking my ""therapy"" a little too seriously.",4.0,2.0,0.0,6.0,515
Don't worry. It's the third rail that kills you.,5.0,0.0,1.0,6.0,515
"We might not like it, but Pres. Trump's made the trains run on time.",5.0,0.0,1.0,6.0,515
The 'limited' transportation option had a lower deductible.,5.0,0.0,1.0,6.0,515
This is why I always sit upright. All I have to do is tilt back and I'm safe.,5.0,0.0,1.0,6.0,515
"Sure it looks bad, but I could have been hit by a giant metaphor.",4.0,2.0,0.0,6.0,515
I'd like you to switch tracks for a moment here.,4.0,2.0,0.0,6.0,515
I love life on the fast track.,5.0,0.0,1.0,6.0,515
"Well, hopefully this is the last time we get hit by the D",5.0,0.0,1.0,6.0,515
I still don't think this qualifies as an extreme sport.,5.0,0.0,1.0,6.0,515
Do you think our YouTube video of this will get one million hits?,4.0,2.0,0.0,6.0,515
The D stands for Dummy.,4.0,2.0,0.0,6.0,515
"Now that we've conquered your fear of skydiving, let's work on your fear of trains!",4.0,2.0,0.0,6.0,515
Most of my patients have trust issues.,4.0,2.0,0.0,6.0,515
I’m hoping to get my life back on track.,3.0,1.0,0.0,4.0,515
We worked through the base jumping and rock climbing phobias. I think i can live with the train thing.,3.0,1.0,0.0,4.0,515
This is gonna be one helluva law suit!,3.0,1.0,0.0,4.0,515
"OK, now concentrate and visualize what the train wheels looked like on the other side",3.0,1.0,0.0,4.0,515
"Another figment of my imagination, doc?",3.0,1.0,0.0,4.0,515
This is a handicap sitting zone.,3.0,1.0,0.0,4.0,515
I'm considering retirement.,3.0,1.0,0.0,4.0,515
"We'll get more from them this time, I promise.",3.0,1.0,0.0,4.0,515
"I'm telling you for the last time, no more double dares!",3.0,1.0,0.0,4.0,515
Let's get back to your dream about missing the Brooklyn local.,3.0,1.0,0.0,4.0,515
We were supposed to be in the hospital.,3.0,1.0,0.0,4.0,515
It's still better than the bus station.,3.0,1.0,0.0,4.0,515
Now you're on the right track for a big breakthrough.,3.0,1.0,0.0,4.0,515
With our HMO we should have paid for the private room.,3.0,1.0,0.0,4.0,515
Now this better get us into 'Hamilton.',3.0,1.0,0.0,4.0,515
"Some people just have bad luck, is that what you said?",3.0,1.0,0.0,4.0,515
"Dear God, keep us safe...just as you always have. Amen",3.0,1.0,0.0,4.0,515
Is that the front or the back.,3.0,1.0,0.0,4.0,515
It could always be worse.,3.0,1.0,0.0,4.0,515
Perhaps we should try a different approach,3.0,1.0,0.0,4.0,515
Waiting for the chaise lounge car,3.0,1.0,0.0,4.0,515
"To paraphrase Freud, sometimes a tunnel is just a tunnel.",3.0,1.0,0.0,4.0,515
Relax - we're nowhere near the third rail.,3.0,1.0,0.0,4.0,515
This is a step up from our usual slip-and-fall scam.,3.0,1.0,0.0,4.0,515
I still can't believe we got these couches through the turnstiles,3.0,1.0,0.0,4.0,515
Remember when the subway was safe?,3.0,1.0,0.0,4.0,515
"No, I don't think that train is going to Hogwarts.",3.0,1.0,0.0,4.0,515
Two more sessions should rid you of your Siderodromophobia.,3.0,1.0,0.0,4.0,515
And yet our furniture comes out unscathed each time.,3.0,1.0,0.0,4.0,515
I think we've covered this issue enough.,3.0,1.0,0.0,4.0,515
"Well, it looks like our time is about up again.",3.0,1.0,0.0,4.0,515
What else do we have to lose?,3.0,1.0,0.0,4.0,515
"Yeah, 'Blood On The Tracks' was my favorite Dylan album too!",3.0,1.0,0.0,4.0,515
When's the last time this train got anywhere so fast?,3.0,1.0,0.0,4.0,515
We should have moved when our legs worked.,3.0,1.0,0.0,4.0,515
I think we're getting off track here.,3.0,1.0,0.0,4.0,515
I don't know how they missed us that time.,3.0,1.0,0.0,4.0,515
This will be a quickie.,3.0,1.0,0.0,4.0,515
We ended last session with your keen sense of deja vu. Let's pick it up from there.,3.0,1.0,0.0,4.0,515
Don't be silly! Everyone knows lightning doesn't strike twice.,3.0,1.0,0.0,4.0,515
Next year I say we upgrade our room to the station platform.,3.0,1.0,0.0,4.0,515
"If you're genuinely committed to therapy, you’ll agree it’s time to intensify our trust exercises.",3.0,1.0,0.0,4.0,515
"So I thought, ""Why am I in such pain?"" Then, it hit me.",3.0,1.0,0.0,4.0,515
I make terrible decisions when I'm plastered.,3.0,1.0,0.0,4.0,515
It's just ridiculous how high transit fares have gotten.,3.0,1.0,0.0,4.0,515
The good news is it's rent controlled but you have to watch for schedule changes.,3.0,1.0,0.0,4.0,515
"As your therapist, I have a legal obligation to be here.",4.0,1.0,0.0,5.0,515
Now I know why my aversion therapy technique went wrong the last time.,4.0,1.0,0.0,5.0,515
I'm happy it's not a car.,4.0,1.0,0.0,5.0,515
The gift card is never worth it.,4.0,1.0,0.0,5.0,515
"Don't worry, we're covered for pre-existence injury.",4.0,1.0,0.0,5.0,515
Is this what you call my 'repetition compulsion'?,4.0,1.0,0.0,5.0,515
I don't care how much it costs - next time we're riding on the inside.,4.0,1.0,0.0,5.0,515
Does that D stand for doomed ?,4.0,1.0,0.0,5.0,515
Oh look my four o'clock is early again.,4.0,1.0,0.0,5.0,515
I think we're on the right track now.,4.0,1.0,0.0,5.0,515
"When we're at work, we train with no breaks.",4.0,1.0,0.0,5.0,515
"Ok, I agree, you're the better ""chicken"" player.",4.0,1.0,0.0,5.0,515
"See, train watching isn't safer than bungee jumping.",4.0,1.0,0.0,5.0,515
I still can't figure out what I did wrong.,4.0,1.0,0.0,5.0,515
What we really need is a platform bed.,4.0,1.0,0.0,5.0,515
One more round of desensitization should do it.,4.0,1.0,0.0,5.0,515
"This time, let's try to not run from your fears.",4.0,1.0,0.0,5.0,515
This might be my last psychology experiment.,4.0,1.0,0.0,5.0,515
"Looks like breakneck speed to me, but we'll see.",4.0,1.0,0.0,5.0,515
Ya' can't beat the rent!,4.0,1.0,0.0,5.0,515
"Gradual exposure, Bob. That's the key.",4.0,1.0,0.0,5.0,515
Sometimes a train in a tunnel isn’t just a metaphor.,4.0,1.0,0.0,5.0,515
My political handlers said I'd be safe so long as I avoided the third rail.,4.0,1.0,0.0,5.0,515
It’s normal for a patient to resist termination.,4.0,1.0,0.0,5.0,515
Trainspotting is less pleasurable than I imagined it!,4.0,1.0,0.0,5.0,515
Ever read 'Anna Karenina'?,4.0,1.0,0.0,5.0,515
Tis only a flesh wound!,4.0,1.0,0.0,5.0,515
"Doc, the price of convenience for our session's location costs an arm and a leg.",4.0,1.0,0.0,5.0,515
You mentioned feeling like you keep getting run over by a train. Tell me more about that.,4.0,1.0,0.0,5.0,515
It's right on time!,4.0,1.0,0.0,5.0,515
I've always been accident-prone. I can't explain it,4.0,1.0,0.0,5.0,515
This reminds me of getting your hopes up in the caption contest.,4.0,1.0,0.0,5.0,515
When Trump gets elected its all you can do,4.0,1.0,0.0,5.0,515
"Want to up the bet to ten bucks, who's got the better coverage ?",4.0,1.0,0.0,5.0,515
Next we'll tackle your fear of skydiving.,4.0,1.0,0.0,5.0,515
Sometimes immersion therapy can be a tad intense.,4.0,1.0,0.0,5.0,515
This one track conversation is going nowhere quickly!,4.0,1.0,0.0,5.0,515
'Hitchcockian'? Hardly.,4.0,1.0,0.0,5.0,515
...it did get worse.,4.0,1.0,0.0,5.0,515
"If this guy slams on the brakes too, I'm not doing this a third time, pact or no pact!",4.0,1.0,0.0,5.0,515
"I fear the ""D"" means dumb luck.",4.0,1.0,0.0,5.0,515
My attorney thought class action was a good idea - there is always a ghost of a chance!,4.0,1.0,0.0,5.0,515
"Relax, we've already met our deductible.",4.0,1.0,0.0,5.0,515
"Trust me, this time it'll work.",4.0,1.0,0.0,5.0,515
"Here we go, pal! It's crunch time!",4.0,1.0,0.0,5.0,515
Good thing it is going the other way.,4.0,1.0,0.0,5.0,515
"If you remember dear your ""persistence"" was the reason I feel in love with you.",4.0,1.0,0.0,5.0,515
"Donald Trump said he built this train, a beautiful train, and paid for by Mexico.",4.0,1.0,0.0,5.0,515
Let's hold that thought for next week.,4.0,1.0,0.0,5.0,515
We seem to be stuck on the same track.,4.0,1.0,0.0,5.0,515
"Remember, Doc said to stay on track!",4.0,1.0,0.0,5.0,515
I sure thought our time was up. Good thing we were wearing our helmets.,4.0,1.0,0.0,5.0,515
I think we should go back to Avoidance Therapy Mr. Spangler,4.0,1.0,0.0,5.0,515
I've heard travel is broadening,4.0,1.0,0.0,5.0,515
My HMO suggested this treatment.,4.0,1.0,0.0,5.0,515
This feels like one of those new reality shows.,4.0,1.0,0.0,5.0,515
I wasn't into rehab either.,4.0,1.0,0.0,5.0,515
"When she said the pain management clinic is on the D Line, she didn't mean ON THE D LINE.",4.0,1.0,0.0,5.0,515
We've made great progress - this time it will be different.,4.0,1.0,0.0,5.0,515
I've got a great P.I. lawyer if the D train doesn't stop here.,4.0,1.0,0.0,5.0,515
There's gotta be an easier way to wake up without coffee.,4.0,1.0,0.0,5.0,515
"Sorry doc, my insurance doesn't have triple indemnity.",4.0,1.0,0.0,5.0,515
What did you expect? We are at the outpatient ward for Highlines D.,4.0,1.0,0.0,5.0,515
Do you think the Union Lawyers will believe us?,4.0,1.0,0.0,5.0,515
At least I'll still have my personality.,4.0,1.0,0.0,5.0,515
Perhaps skydiving is a better extreme sport.,4.0,1.0,0.0,5.0,515
90-10 he doesn't stop in time.,4.0,1.0,0.0,5.0,515
Let's get your life back off track.,4.0,1.0,0.0,5.0,515
This is going to cost us an arm and a leg!,4.0,1.0,0.0,5.0,515
Ready? Maybe we'll get luckier this time.,4.0,1.0,0.0,5.0,515
I think it's time we had another break.,4.0,1.0,0.0,5.0,515
You said you wanted a recliner that vibrates.,4.0,1.0,0.0,5.0,515
We should just call in sick next time.,4.0,1.0,0.0,5.0,515
"He did say it was ""On the D-train"".",4.0,1.0,0.0,5.0,515
This is 'Psycho' therapy,4.0,1.0,0.0,5.0,515
Stranger Under A Train,4.0,1.0,0.0,5.0,515
"No, I said airbnB.",4.0,1.0,0.0,5.0,515
I hope they appreciate performance art.,4.0,1.0,0.0,5.0,515
"Harry, this is not the beach!",4.0,1.0,0.0,5.0,515
"Just stay clear of the third rail, you'll be fine.",4.0,1.0,0.0,5.0,515
The one time it's on time.,4.0,1.0,0.0,5.0,515
Ssshhh! You are breaking my train of thought!,4.0,1.0,0.0,5.0,515
This is nothing compared to a Trump rally.,4.0,1.0,0.0,5.0,515
"Yup, life is good; we can't even jump on the 'D' train.",4.0,1.0,0.0,5.0,515
I'm telling you... you've GOT to face your fears,4.0,1.0,0.0,5.0,515
"If I go down, we'll all get splinters!",4.0,1.0,0.0,5.0,515
It was either this or living off welfare,4.0,1.0,0.0,5.0,515
"Next time, let's just call in sick.",4.0,1.0,0.0,5.0,515
Exposure therapy can be hit-or-miss.,4.0,1.0,0.0,5.0,515
"The Republicans say they are going to repeal Obama-Care, so lets get our money's worth!",4.0,1.0,0.0,5.0,515
One more after this and we'll be able to meet our deductible.,4.0,1.0,0.0,5.0,515
