caption,unfunny,somewhat_funny,funny,count,contest
"I swear, those Obamacare deductibles will be the death of us!",5.0,1.0,0.0,6.0,515
Accidents waiting to happen.,5.0,1.0,0.0,6.0,515
The policy did say death AND disability.,5.0,1.0,0.0,6.0,515
The brochure said there are great views of the C.,5.0,1.0,0.0,6.0,515
I don't see things getting any WORSE! Do you?,5.0,1.0,0.0,6.0,515
The Grim Reaper always rides the D train - it's an express.,5.0,1.0,0.0,6.0,515
"Didn't hear the train a comin', didn't see it rollin' around the bend and we aint seen sunshine since we got hit in the head.",5.0,1.0,0.0,6.0,515
Google map said it was the Highline.,5.0,1.0,0.0,6.0,515
"Yes, but we ARE living in Brooklyn!",5.0,1.0,0.0,6.0,515
I am confident our pre-bandaging techniques will finally make us rich.,5.0,1.0,0.0,6.0,515
"I just feel, Nathan, that we're not quite on the right track with your therapy.",5.0,1.0,0.0,6.0,515
...and why do you think you carry this sense of impending doom?,5.0,1.0,0.0,6.0,515
No wonder my insurance doesn't cover this therapist.,5.0,1.0,0.0,6.0,515
My phone charges quickly on that third rail.,5.0,1.0,0.0,6.0,515
I'm going downtown--on the express.,5.0,1.0,0.0,6.0,515
"Well the pamphlet did say, 'Training! For a speedy retirement.'",5.0,1.0,0.0,6.0,515
It's a D-line fracture.,5.0,1.0,0.0,6.0,515
"What do YOU think it means that you constantly see ""trains moving in tunnels""?",5.0,1.0,0.0,6.0,515
"I told you this was the one without the ""disabled passenger "" car.",5.0,1.0,0.0,6.0,515
I thought that was the end of it.,5.0,1.0,0.0,6.0,515
Remember the last time we tried to flag down the D train?,5.0,1.0,0.0,6.0,515
"Honey,wheres my eyeglasses?",5.0,1.0,0.0,6.0,515
You look like a train wreck,5.0,1.0,0.0,6.0,515
"As careful as I am, I never seem to get out of harms way",5.0,1.0,0.0,6.0,515
"As Freud observed, we are pathologically drawn back to the scene of our trauma.",5.0,1.0,0.0,6.0,515
We're not on the right track,5.0,1.0,0.0,6.0,515
It turned out that our insurance claim is invalid unless we get a statement from the driver.,5.0,1.0,0.0,6.0,515
"Doctor, I went along with your fear of heights therapy, but I’m having second thought about this.",5.0,1.0,0.0,6.0,515
"Yeah, but this way we are not violating anyone's religious liberties.",5.0,1.0,0.0,6.0,515
The final meeting of the Death Wish Club is now called to order,5.0,1.0,0.0,6.0,515
We should've waited for the express.,5.0,1.0,0.0,6.0,515
I hope they fixed those back up lights.,5.0,1.0,0.0,6.0,515
Okay ... my pocket watch stopped running last week.,5.0,1.0,0.0,6.0,515
"Yes, I recognize the Freudian symbolism, but is there anything else in your past that might explain why trains keep appearing in your nightmares?",5.0,1.0,0.0,6.0,515
Let's wait for the F.,5.0,1.0,0.0,6.0,515
"It pains me to say it, but this is the end of D line.",5.0,1.0,0.0,6.0,515
"I said Travelby coach, not couch!",5.0,1.0,0.0,6.0,515
Push.,5.0,1.0,0.0,6.0,515
Yes. 'D Train' is coming. Ho ho. How clever... Now I know why you were expelled from The Union Club.,5.0,1.0,0.0,6.0,515
Your transference neurosis is likely to manifest in hallucinations.,5.0,1.0,0.0,6.0,515
Maybe next week we can move our session to my office?,5.0,1.0,0.0,6.0,515
Your training is almost complete.,5.0,1.0,0.0,6.0,515
"Might get a little chilly at night but wait til they crank her up, it's positively invigorating.",5.0,1.0,0.0,6.0,515
I thought you said this was the caboose.,5.0,1.0,0.0,6.0,515
"I know I'm the one lying on the couch, but I'm not sure if this is how exposure therapy works.",5.0,1.0,0.0,6.0,515
If my calculations are right he's five minutes early,5.0,1.0,0.0,6.0,515
"They say that the economy is about to collapse......but, we don't have to worry now that we're on disability.",5.0,1.0,0.0,6.0,515
"It's as if I was on the subway tracks with a train coming right at me. So, how does that make you feel? Don't worry doc, it'll all be over soon.",5.0,1.0,0.0,6.0,515
"Next time, mind the gap.",5.0,1.0,0.0,6.0,515
"Well, I'm not going to take this lying down.",5.0,1.0,0.0,6.0,515
Well I think this new Obamacare plan sucks!,5.0,1.0,0.0,6.0,515
Here we go again.,5.0,1.0,0.0,6.0,515
Let's start where we left off when the A-train hit us.,5.0,1.0,0.0,6.0,515
The odds are that they'll go forward this time...,5.0,1.0,0.0,6.0,515
"Look, it's missing one of its front wheels!",5.0,1.0,0.0,6.0,515
"Ok, who's the wise guy with the eraser?",5.0,1.0,0.0,6.0,515
We've been railroaded in the literal sense of the word.,5.0,1.0,0.0,6.0,515
"You just HAD to try the little red button, huh? Feel better?",5.0,1.0,0.0,6.0,515
"The ad said, ""open layout and close to the train.""",5.0,1.0,0.0,6.0,515
Fasten your seatbelt...it's going to be a bumpy night.,5.0,1.0,0.0,6.0,515
Wow...Medicare Plan D is more expensive than I thought.,5.0,1.0,0.0,6.0,515
I miss the old days. Carrying signs. Maybe throwing a rock or two.,5.0,1.0,0.0,6.0,515
Huh. Train's late.,5.0,1.0,0.0,6.0,515
"Doctor, I don't think this train aversion therapy is working",5.0,1.0,0.0,6.0,515
"Hey, the D train is on time fore once. Go figure.",5.0,1.0,0.0,6.0,515
We need to rethink this rest stop.,5.0,1.0,0.0,6.0,515
I paid extra for the lounge car.,5.0,1.0,0.0,6.0,515
The modern day version of an old classic.,5.0,1.0,0.0,6.0,515
I'm starting to question our physical therapist's tactics.,5.0,1.0,0.0,6.0,515
I think we're at the point where we can put your fear of getting hit by a subway train to rest.,5.0,1.0,0.0,6.0,515
When they said it would be an arm and a leg they really meant it!,5.0,1.0,0.0,6.0,515
And how did that impact you?,5.0,1.0,0.0,6.0,515
I'm not sure heckling The Donald is worth the risk.,5.0,1.0,0.0,6.0,515
These disability payments really add up.,5.0,1.0,0.0,6.0,515
I told you. The look on the enginer's face makes it all worthwhile!,5.0,1.0,0.0,6.0,515
"Last time they said lie between the tracks, see where that got us....",5.0,1.0,0.0,6.0,515
I think we're about to make another connection.,5.0,1.0,0.0,6.0,515
"Yeah, I asked for my insurance claim to be fast-tracked, too.",5.0,1.0,0.0,6.0,515
Do you feel a breeze,5.0,1.0,0.0,6.0,515
"You see, doc, I keep hearing these loud whistles then I wake up in the hospital.",5.0,1.0,0.0,6.0,515
I'll ask you one more time. Two plus two equals...?,5.0,1.0,0.0,6.0,515
"Well, Jim, the nightmare's almost over.",5.0,1.0,0.0,6.0,515
Curing your fear of women was much less painful.,5.0,1.0,0.0,6.0,515
"Don't worry, as soon as you finish your training you'll be first aid qualified.",5.0,1.0,0.0,6.0,515
You're transferring again!,5.0,1.0,0.0,6.0,515
Do you think we'll make it to E?,5.0,1.0,0.0,6.0,515
"Blimey mate, we’ve gotten into the wrong cartoon!",5.0,1.0,0.0,6.0,515
Bum wheel?,5.0,1.0,0.0,6.0,515
I think I hear by watch beeping.,5.0,1.0,0.0,6.0,515
I feel another breakthrough coming.,5.0,1.0,0.0,6.0,515
This beats being harassed by the cops on the platform.,5.0,1.0,0.0,6.0,515
"Come on ya dumb train, double or nothin'.",5.0,1.0,0.0,6.0,515
Looks like we're out of time.,5.0,1.0,0.0,6.0,515
Just when I thought the MTA could not be a more painful experience,5.0,1.0,0.0,6.0,515
Hey what does that D in the windows stand for? Oh it stands for d- ...,5.0,1.0,0.0,6.0,515
So you forgot the remote again?,5.0,1.0,0.0,6.0,515
This time I really need you to believe that we're safe and sound in my office.,5.0,1.0,0.0,6.0,515
Are you sure this is how you become a wizard?,5.0,1.0,0.0,6.0,515
If at first you don't succeed try again.,5.0,1.0,0.0,6.0,515
"Well, we tried the high road.",5.0,1.0,0.0,6.0,515
#TBT,5.0,1.0,0.0,6.0,515
"In all fairness, Craigslist did say this would cost us an arm and a leg.",5.0,1.0,0.0,6.0,515
"We might not like it, but President Trump has made the trains run on time.",5.0,1.0,0.0,6.0,515
"Okay, quit derailing the conversation!",5.0,1.0,0.0,6.0,515
"move the engine back a bit Fred,you can see it in the frame!!!",5.0,1.0,0.0,6.0,515
"You were supposed to take the ""A"" train.",5.0,1.0,0.0,6.0,515
Do you think they forgot about us?,5.0,1.0,0.0,6.0,515
Weekend service is the worst.,5.0,1.0,0.0,6.0,515
I guess we shouldn't have told her the sandwiches were soggy.,5.0,1.0,0.0,6.0,515
I hope this is a flashback and if not that there is no reverse on his gearbox.,5.0,1.0,0.0,6.0,515
Some morons call it the Death train,5.0,1.0,0.0,6.0,515
You sure this is the new underground railroad to Canada's free healthcare?,5.0,1.0,0.0,6.0,515
"Sure the furniture is nice, but still I'm a little uncomfortable.",5.0,1.0,0.0,6.0,515
"This time we're going to get REALLY BIG compensation!""",5.0,1.0,0.0,6.0,515
This should resolve your trust issues once and for all.,5.0,1.0,0.0,6.0,515
You and your outside dineing request.,5.0,1.0,0.0,6.0,515
I'd say we're both feeling a little run down.,5.0,1.0,0.0,6.0,515
I guess we missed thr Club Car.,5.0,1.0,0.0,6.0,515
And another thing--I'm voting for Trump!,5.0,1.0,0.0,6.0,515
Is this what they mean by deja vu?,5.0,1.0,0.0,6.0,515
"Look, Dave! It's the same driver who hit us here last week.",5.0,1.0,0.0,6.0,515
I told you we're on the wrong track. This is the D train.,5.0,1.0,0.0,6.0,515
"I had a great job and a wonderful girlfriend in Paris, but I missed all this.",5.0,1.0,0.0,6.0,515
She's right - it could be a double entendre,5.0,1.0,0.0,6.0,515
Just a couple of virgins would be nice ...,5.0,1.0,0.0,6.0,515
"Aren't they two minutes early, or is my watch wrong?",5.0,1.0,0.0,6.0,515
Would you PLEASE stop singing Folsom Prison Blues!,5.0,1.0,0.0,6.0,515
...and how does this make you feel?,5.0,1.0,0.0,6.0,515
You were right Harry when you said that we are first in line for the train.,5.0,1.0,0.0,6.0,515
I'm afraid that's all the time we have. Again.,5.0,1.0,0.0,6.0,515
"But besides this, how are you?",5.0,1.0,0.0,6.0,515
Ugh -- I think my health insurance only covers the A and C uptown trains.,5.0,1.0,0.0,6.0,515
we must find a new meeting area,5.0,1.0,0.0,6.0,515
Maybe this time it will finish the job,5.0,1.0,0.0,6.0,515
"The insurance agent said get comfortable, he would be right back with a check.",5.0,1.0,0.0,6.0,515
"Alright, last one, you have one second to live, what do you do?",5.0,1.0,0.0,6.0,515
Shall we order takeout?,5.0,1.0,0.0,6.0,515
I think we're poised for another breakthrough.,5.0,1.0,0.0,6.0,515
"This time, are you sure, sure, sure the train is about to leave, not back up?",5.0,1.0,0.0,6.0,515
You've got to understand physical pain. After that we can move on to your childhood.,5.0,1.0,0.0,6.0,515
Next time we'll be ready.,5.0,1.0,0.0,6.0,515
I thought we were on the track to recovery but I can see your having a set back.,5.0,1.0,0.0,6.0,515
Let's pick up where we were last time...you saw a big 'D' coming towards you...,5.0,1.0,0.0,6.0,515
"When I said that I would give an arm and a leg for a seat, this wasn't what I had in mind.",5.0,1.0,0.0,6.0,515
Training for the 2020 X-Games,5.0,1.0,0.0,6.0,515
"...and still, not even a scratch on this new line of train-proof furniture.",5.0,1.0,0.0,6.0,515
Just to say - this is the last time I'm going along with your 'no pain no gain' theory,5.0,1.0,0.0,6.0,515
SOMETIMES LESS IS NOT MORE.,5.0,1.0,0.0,6.0,515
"If we survive this one, we get into the Guiness Book of Records.",5.0,1.0,0.0,6.0,515
"It's a local, and I have a local anesthetic.",5.0,1.0,0.0,6.0,515
"Now, as I was saying, before we were so rudely interrupted...",5.0,1.0,0.0,6.0,515
Psychoanalytic training.,5.0,1.0,0.0,6.0,515
You're right doctor. This is helping me overcome my fear of death.,5.0,1.0,0.0,6.0,515
Let's hope we are so lucky this time!,5.0,1.0,0.0,6.0,515
Being a Crash Test Dummy isn't the same as the brochure describes.,5.0,1.0,0.0,6.0,515
It used to be more fun robbing trains,5.0,1.0,0.0,6.0,515
"You said the B line, right Ralph?",5.0,1.0,0.0,6.0,515
Sticks and stones will break my bones but trains will never hurt me.,5.0,1.0,0.0,6.0,515
Three D's,5.0,1.0,0.0,6.0,515
I'm just glad we get to go out as a penis joke.,5.0,1.0,0.0,6.0,515
Theses train fares cost an arm and a leg!,5.0,1.0,0.0,6.0,515
Now I get it...the Moron Olympics Committee told us to get some 'training'.,5.0,1.0,0.0,6.0,515
We miscalculated; I don't think that is Henry driving.,5.0,1.0,0.0,6.0,515
This reminds me of a dream I had last night.,5.0,1.0,0.0,6.0,515
Are you sure it isn't lightning that never strikes twice?,5.0,1.0,0.0,6.0,515
Let's just call it March madness.,5.0,1.0,0.0,6.0,515
Why does the D train hurt more than the others?,5.0,1.0,0.0,6.0,515
"Next time, don't forget the TRAINING wheels!",5.0,1.0,0.0,6.0,515
"Good thing we don't have jobs, cuz protesting is hard work.",5.0,1.0,0.0,6.0,515
D Train's latest hits.,5.0,1.0,0.0,6.0,515
What made you think this would be an extension of the High Line?,5.0,1.0,0.0,6.0,515
I'm getting subliminal vibes.,5.0,1.0,0.0,6.0,515
I'd rather it be this D-train than Trump's.,5.0,1.0,0.0,6.0,515
I think we need a new spot for the sit-in strike.,5.0,1.0,0.0,6.0,515
Trump won't win.,5.0,1.0,0.0,6.0,515
Let's hope it works this time.,5.0,1.0,0.0,6.0,515
I really hate exposure therapy.,5.0,1.0,0.0,6.0,515
See - it can't be real if it doesn't have wheels in both sides.,5.0,1.0,0.0,6.0,515
Really? Must they do that right here?,5.0,1.0,0.0,6.0,515
"Once Again, I told you that timeshare deal was too good to be true!",5.0,1.0,0.0,6.0,515
I know this costs an arm and a leg but we're really making progress.,5.0,1.0,0.0,6.0,515
There were more people at our last meeting.,5.0,1.0,0.0,6.0,515
There has to be an easier way to make a living other that suing the subway company for pain and suffering.,5.0,1.0,0.0,6.0,515
"I don't appreciate the implication in the label ""train chaser"".",5.0,1.0,0.0,6.0,515
Once we meet the deductible it won't be so bad,5.0,1.0,0.0,6.0,515
What were we thinking hanging out *in front of* the train before?,5.0,1.0,0.0,6.0,515
"On the bright side, I've already met my insurance deductible.",5.0,1.0,0.0,6.0,515
I told you we should have never gone in the bar car!,5.0,1.0,0.0,6.0,515
"""Relax.. It can't happen again till the express comes by.",5.0,1.0,0.0,6.0,515
"You can relax this time, Phil. Sometimes the end of dline is just the end of dline.",5.0,1.0,0.0,6.0,515
The rest of the furniture arrives tomorrow.,5.0,1.0,0.0,6.0,515
There aren't many lifetime jobs like this around anymore.,5.0,1.0,0.0,6.0,515
"Well, here's hoping the express packs more of a punch than the local.",5.0,1.0,0.0,6.0,515
I thought deja vu all over again was supposed to be funny.,5.0,1.0,0.0,6.0,515
I think this election year preparation might be too easy.,5.0,1.0,0.0,6.0,515
I don't know about this work hardening program they're putting us through.,5.0,1.0,0.0,6.0,515
"It's a draw!! You lost a leg, I lost and arm and it lost a wheel. Do you think the car has Medicare?",5.0,1.0,0.0,6.0,515
We're going to cure your siderodromophobia or die trying!,5.0,1.0,0.0,6.0,515
It's better to get hit with it all at once.,5.0,1.0,0.0,6.0,515
I'm not in it for the money.,5.0,1.0,0.0,6.0,515
"Doc, I think your methods are too extreme for me.",5.0,1.0,0.0,6.0,515
This isn't a tenure track position.,5.0,1.0,0.0,6.0,515
"So, do you still think our infrastructures aren't that bad? I swear, if it doesn't work this time I'm moving to London.",5.0,1.0,0.0,6.0,515
Now might be a good time to mention that I no longer accept Blue Cross Blue Shield.,5.0,1.0,0.0,6.0,515
This time I'm betting on Zeno's paradox.,5.0,1.0,0.0,6.0,515
The secret is to set the chairs after the train goes by.,5.0,1.0,0.0,6.0,515
"Well, he did say he would tear up Obamacare on his first day in office.",5.0,1.0,0.0,6.0,515
"I'm telling you, the C train never comes down this track.",5.0,1.0,0.0,6.0,515
"Easy Carl, you're touching the third rail here.",5.0,1.0,0.0,6.0,515
"Well Randy, it appears that we are the definition of insanity.",5.0,1.0,0.0,6.0,515
"Well yes, your dreams certainly are realistic",5.0,1.0,0.0,6.0,515
I think one more session should cure your fear of subway trains.,5.0,1.0,0.0,6.0,515
I met with my last patient on the turnpike. This is much more comfortable.,5.0,1.0,0.0,6.0,515
Are you sure we're on the right track?,5.0,1.0,0.0,6.0,515
"After this, we transfer to the B at West 4th.",5.0,1.0,0.0,6.0,515
"Somehow, I feel like an accident just waiting to happen.",5.0,1.0,0.0,6.0,515
"""D""etails matter.",5.0,1.0,0.0,6.0,515
"Aah yes, siderodromophobia, the fear of trains ...although, I'm less versed on the fear of broken bones.",5.0,1.0,0.0,6.0,515
So have you had any traumatic experiences in your past?,5.0,1.0,0.0,6.0,515
Can't afford to move. We're broke.,5.0,1.0,0.0,6.0,515
I hear the drivers will meet the track workers soon to go over our complaint.,5.0,1.0,0.0,6.0,515
Seems the emergency brakes have failed again.,5.0,1.0,0.0,6.0,515
"If he backs up, our health care insurance carrier will drop us for sure.",5.0,1.0,0.0,6.0,515
Beats our last session under the train,5.0,1.0,0.0,6.0,515
"Maybe we should find a bullet train,and get this over with.",5.0,1.0,0.0,6.0,515
Your session is about to expire.,5.0,1.0,0.0,6.0,515
"...a hair better than blackjack, Frank. 50/50.",5.0,1.0,0.0,6.0,515
Funnily enough Jung postulated a possible link between Deja Vu and dissociative identity disorder,5.0,1.0,0.0,6.0,515
Have you overcome your fear of train tracks yet?,5.0,1.0,0.0,6.0,515
This was the only recovery room in the city that our insurance plan covered.,5.0,1.0,0.0,6.0,515
Maybe we should go back to being Batman and Robin,5.0,1.0,0.0,6.0,515
"The D train ""X"" Games 2016",5.0,1.0,0.0,6.0,515
Here we are again. You were just as sure they wouldn't back up last time.,5.0,1.0,0.0,6.0,515
Most people really can't comprehend what it means 'to be thrown under the train.',5.0,1.0,0.0,6.0,515
I don't think it's the train operator who needs to learn from history.,5.0,1.0,0.0,6.0,515
And then they give you an aspirin and bill your insurance company for six CAT scans.,5.0,1.0,0.0,6.0,515
And why do you think continuing our sessions is contributing to this unreasoning fear that they are bad for you?,5.0,1.0,0.0,6.0,515
"They never talk about the dangers of ""staycations.""",5.0,1.0,0.0,6.0,515
Another round of gambling therapy? We're due for a win!,5.0,1.0,0.0,6.0,515
I can't tell which way the train is going either.,5.0,1.0,0.0,6.0,515
Next week let's try returning to your comfort zone.,5.0,1.0,0.0,6.0,515
That must have been painful for you.,5.0,1.0,0.0,6.0,515
I always get the drafty room,5.0,1.0,0.0,6.0,515
Let's try getting your life off track instead.,5.0,1.0,0.0,6.0,515
"Thankfully, the doctor put us on the fast track to recovery.",5.0,1.0,0.0,6.0,515
It's hit and miss.,5.0,1.0,0.0,6.0,515
Are you absolutely sure eminent domain works like this?,5.0,1.0,0.0,6.0,515
Kinda sad how they sidetrack their broken-down equipment and working stiffs.,5.0,1.0,0.0,6.0,515
I think I need to raise my rates,5.0,1.0,0.0,6.0,515
We're finally off the grid.,5.0,1.0,0.0,6.0,515
So what do you think about the new Adele song?,5.0,1.0,0.0,6.0,515
I tell ya we grew up on the wrong side of the tracks.,5.0,1.0,0.0,6.0,515
It's tough living on the wrong side of the tracks.,5.0,1.0,0.0,6.0,515
Do you smell the roses?,5.0,1.0,0.0,6.0,515
You really feel the action in these seats.,5.0,1.0,0.0,6.0,515
I must have missed the memo!,5.0,1.0,0.0,6.0,515
"But Obamacare covers it, right?",5.0,1.0,0.0,6.0,515
"Alright, let's try this again.",5.0,1.0,0.0,6.0,515
It's the only office I could afford the rent on.,5.0,1.0,0.0,6.0,515
"I thought that ""third rail"" thing was simply a figure of speech.......",5.0,1.0,0.0,6.0,515
It's the only place in the city where I feel completely safe.,5.0,1.0,0.0,6.0,515
It is deja vu all over again.,5.0,1.0,0.0,6.0,515
"I hear that ""Sick Passenger"" is a leading cause of train delays.",5.0,1.0,0.0,6.0,515
I'm beginning to wonder if your sense of foreboding is more than mere resistance to my ground-breaking therapy.,5.0,1.0,0.0,6.0,515
They really should put the bike lane somewhere else.,5.0,1.0,0.0,6.0,515
A hundred bucks says it misses us.,5.0,1.0,0.0,6.0,515
We're on the right track for a workman's comp settlement.,5.0,1.0,0.0,6.0,515
"Might as well add ""flat"" to ""broke.""",5.0,1.0,0.0,6.0,515
Perhaps there is something to your 'fear of trains' phobia.,5.0,1.0,0.0,6.0,515
"Psychologically, we've made progress. Physically however...",5.0,1.0,0.0,6.0,515
Jumping's overrated.,5.0,1.0,0.0,6.0,515
Don't take this lying down.,5.0,1.0,0.0,6.0,515
I didn't know it was that kind of crash course.,5.0,1.0,0.0,6.0,515
Are you feeling run down?,5.0,1.0,0.0,6.0,515
This might derail our recuperation.,5.0,1.0,0.0,6.0,515
There's nothing to worry about. This train's never on time.,5.0,1.0,0.0,6.0,515
Are you still having that recurring dream about a light at the end of a tunnel?,5.0,1.0,0.0,6.0,515
"Trust me, it won't come this way again.",5.0,1.0,0.0,6.0,515
This particular painting best represents his blank canvas phase.,5.0,1.0,0.0,6.0,515
I'm not sure about this Obamacare outpatient treatment...,5.0,1.0,0.0,6.0,515
Still beats riding the G.,5.0,1.0,0.0,6.0,515
Pulling Tolstoy with class.,5.0,1.0,0.0,6.0,515
Last time we did this the train went the wrong way,5.0,1.0,0.0,6.0,515
"The good news is, you're about to meet your deductible.",5.0,1.0,0.0,6.0,515
Wouldn't it just be easier to touch the third rail?,5.0,1.0,0.0,6.0,515
"Well, I guess I wouldn't be afraid to get on a plane right now.",5.0,1.0,0.0,6.0,515
Are you sure they said to wait here for the worker's comp guy?,5.0,1.0,0.0,6.0,515
"Well, I DID tell you I was a therapist in training.",5.0,1.0,0.0,6.0,515
"Yessir, driving an automobile is a dangerous thing.",5.0,1.0,0.0,6.0,515
The doctor recommended I get my health on track.,5.0,1.0,0.0,6.0,515
"The nurse said this is the waiting room, right?",5.0,1.0,0.0,6.0,515
I told you not to get the cheap sleeper.,5.0,1.0,0.0,6.0,515
"Sure, it's noisy, but you can't beat the rent.",5.0,1.0,0.0,6.0,515
"AT LEAST, THEY COULD HAVE MOVED US TO THE PLATFORM!",5.0,1.0,0.0,6.0,515
Do you have to be alive to sue?,5.0,1.0,0.0,6.0,515
Are you sure Medicare Part D will cover this event?,5.0,1.0,0.0,6.0,515
I don't think this is what doc meant by traction.,5.0,1.0,0.0,6.0,515
The Mindfullness Gap,5.0,1.0,0.0,6.0,515
"The ""D"" stands for ""dignitas""...",5.0,1.0,0.0,6.0,515
"Ah, I’ve always wanted to try indoor trainspotting.",5.0,1.0,0.0,6.0,515
Good thing we are on the right side of the track this time.,5.0,1.0,0.0,6.0,515
I feel like our country is on the wrong track.,5.0,1.0,0.0,6.0,515
"Wonder what that ""D"" stands for?",5.0,1.0,0.0,6.0,515
But why do you feel we're not on the right track?,5.0,1.0,0.0,6.0,515
"You're my shrink, you should appreciate an unnatural fear of the D train.",5.0,1.0,0.0,6.0,515
It was wise of you to buy us the extra legroom.,5.0,1.0,0.0,6.0,515
Things could be worse!,5.0,1.0,0.0,6.0,515
They did say there was a good view of the monorail. - Sam age 8,5.0,1.0,0.0,6.0,515
Maybe we should rethink the whole 'safety first' thing.,5.0,1.0,0.0,6.0,515
I'm very invested in my patients.,5.0,1.0,0.0,6.0,515
So I'm just trying to pass the time away all the live-long day.,5.0,1.0,0.0,6.0,515
Sometimes I feel like my train has left the station.,5.0,1.0,0.0,6.0,515
So much for 'third-time-lucky'.,5.0,1.0,0.0,6.0,515
Dr. Leventhal recommended I get direct exposure to 'D' to stay on track.,5.0,1.0,0.0,6.0,515
Don't you think our lawyer is going a little too far on this one?,5.0,1.0,0.0,6.0,515
I guess we taught it a lesson it won't forget.,5.0,1.0,0.0,6.0,515
I thought you said the ER not the IRT!,5.0,1.0,0.0,6.0,515
Something tells me we're on the wrong track once again.,5.0,1.0,0.0,6.0,515
"Knowing what kind of a temper Cheney has, you still had to mention the missing wheels.",5.0,1.0,0.0,6.0,515
Now would be a good time for a breakthrough.,5.0,1.0,0.0,6.0,515
"If we can't die with dignity, at least we can die comfortably.",5.0,1.0,0.0,6.0,515
"So, what you were saying? Something about the randomness and unfairness of the universe, wasn't it?",5.0,1.0,0.0,6.0,515
From the schedule I still can't tell if the D train is going north or south?,5.0,1.0,0.0,6.0,515
Does it feel a little breezy to you?,5.0,1.0,0.0,6.0,515
We got it made this time. NO train can go backwards.,5.0,1.0,0.0,6.0,515
"People can learn, you know.",5.0,1.0,0.0,6.0,515
This should work better than sitting in the bike lane did.,5.0,1.0,0.0,6.0,515
"Tell me about the rats, George",5.0,1.0,0.0,6.0,515
I don't care how crude he is or who he insults: He says he'll keep the trains running on time.,5.0,1.0,0.0,6.0,515
"Two polar bears were on an iceberg. One turned on the radio, the other fell off.",5.0,1.0,0.0,6.0,515
"Maybe we should just meet at a coffee shop, like everyone else?",5.0,1.0,0.0,6.0,515
How the heck do I know who's backing up this train; you're the Engineer!,5.0,1.0,0.0,6.0,515
"I did not see that coming...the ""D"" train on the IRT tracks!",5.0,1.0,0.0,6.0,515
How'd that miss?,5.0,1.0,0.0,6.0,515
These walk in clinics are popping up everywhere.,5.0,1.0,0.0,6.0,515
Sometimes a dream is NOT just a dream.,5.0,1.0,0.0,6.0,515
I think I sprained my ankle.,5.0,1.0,0.0,6.0,515
Instant cast removal coming up!,5.0,1.0,0.0,6.0,515
"I promise . . . if it doesn't work this time, we'll go straight to Oregon.",5.0,1.0,0.0,6.0,515
Don't you think it's time we gave up train spotting.,5.0,1.0,0.0,6.0,515
"Still, they promise a job for life.",5.0,1.0,0.0,6.0,515
Stunt doubles still on strike?,5.0,1.0,0.0,6.0,515
"Hey, what happened to the wheels on the right side?",5.0,1.0,0.0,6.0,515
It's true. Electromagnetic forces mend bones.,5.0,1.0,0.0,6.0,515
"Been doing some research for a Big Book, finished the jay-walking part....",5.0,1.0,0.0,6.0,515
"I was just thinking, the ""El"" with it all.",5.0,0.0,0.0,5.0,515
"Yep, it's all about being mindful and noticing.",6.0,0.0,0.0,6.0,515
I still miss Johnny Carson.,6.0,0.0,0.0,6.0,515
I love living at the last stop. You don't have to rush to catch the train. It always travels in your direction.,6.0,0.0,0.0,6.0,515
Here comes our nemesis!,6.0,0.0,0.0,6.0,515
