caption,unfunny,somewhat_funny,funny,count,contest
I wish that nimrod would stop tweeting.,16.0,4.0,2.0,22.0,519
"So close, yet so far.",16.0,4.0,2.0,22.0,519
Sycophant.,15.0,6.0,1.0,22.0,519
"Shhh, don't fall for it. It's Wayne LaPierre trying to pull off the old Charles Schulz and Woodstock impersonation again.",16.0,4.0,2.0,22.0,519
"See Ethel , there's one of 'em pro-gun democrat socialist doves I was warnin' you about...!",16.0,4.0,2.0,22.0,519
"Well, now he can't grouse about never finding a perch.",16.0,4.0,2.0,22.0,519
"Now watch, he's about to fire off another tweet.",16.0,4.0,2.0,22.0,519
I hope that plan doesn't backfire on him.,16.0,4.0,2.0,22.0,519
I'm hoping one on the gun is worth two in the bush.,16.0,4.0,2.0,22.0,519
Wow! Looks like Herb bagged a human with that gun lure.,15.0,6.0,1.0,22.0,519
Be patient. We attack on his signal.,15.0,6.0,1.0,22.0,519
I TOLD you that our son needs glasses!,15.0,6.0,1.0,22.0,519
"Keep your friends close , and the NRA closer.",14.0,8.0,0.0,22.0,519
He's part dodo on his father's side.,16.0,4.0,2.0,22.0,519
"The sparrow is in the nest. Repeat, the sparrow is in the nest.",16.0,4.0,2.0,22.0,519
He's calling the shots now.,14.0,8.0,0.0,22.0,519
"Hunters: they love you at sparrow size, but put on a few pounds and suddenly you're a piece of meat",15.0,6.0,1.0,22.0,519
We're safe.,16.0,4.0,2.0,22.0,519
I told you it was a cult.,16.0,4.0,2.0,22.0,519
That's not what I meant by 'Keep your enemies close.',15.0,6.0,1.0,22.0,519
I know Bob is really a quail... but he sure looks like a sitting duck!,16.0,4.0,2.0,22.0,519
That's what I'd call 'hunting blind.',17.0,2.0,3.0,22.0,519
It's still better than two in the bush. I think we're safe.,15.0,6.0,1.0,22.0,519
I call shotgun.,16.0,4.0,2.0,22.0,519
Tonight we deal with the turncoat.,17.0,2.0,3.0,22.0,519
She's a peace activist.,16.0,4.0,2.0,22.0,519
Animal extreme sports,17.0,2.0,3.0,22.0,519
Thank God! A bird on the gun is worth two on the bush.,16.0,4.0,2.0,22.0,519
What a turncoat.,16.0,4.0,2.0,22.0,519
"No harm, no fowl.",16.0,4.0,2.0,22.0,519
Tweetie pulled a thorn out of his foot once.,15.0,6.0,1.0,22.0,519
It's Dick Cheney again.,17.0,2.0,3.0,22.0,519
He better not tweet about this.,16.0,4.0,2.0,22.0,519
It's gonna be a bird bath.,16.0,4.0,2.0,22.0,519
He's never been afraid to live life on the edge.,15.0,6.0,1.0,22.0,519
He called shotgun first.,16.0,4.0,2.0,22.0,519
Wait for it... wait for it... this is my favorite part.,15.0,6.0,1.0,22.0,519
"It's not even loaded, just an excuse to get out of the house.",12.0,4.0,1.0,17.0,519
We'll do that when he carries the double barrel.,13.0,2.0,2.0,17.0,519
Don't fall for her mating call--I think it could be a trap.,14.0,5.0,1.0,20.0,519
Maybe we shouldn't have lined the nest with 'Field and Stream.',14.0,5.0,1.0,20.0,519
"But is it ""Ha Ha"" funny?",14.0,5.0,1.0,20.0,519
"No, you tell him NRA doesn't mean National Robin Association!",15.0,3.0,2.0,20.0,519
She's doesn't give a shoot.,13.0,7.0,0.0,20.0,519
"Not too bright, but our boy's sure got some moxie.",14.0,5.0,1.0,20.0,519
I hadn't heard of Stockholm Syndrome before.,15.0,3.0,2.0,20.0,519
He started off as a bad egg.,13.0,7.0,0.0,20.0,519
Cheney's out again,14.0,5.0,1.0,20.0,519
I keep telling him it's time for contact lenses.,14.0,5.0,1.0,20.0,519
He's probably not in season.,15.0,3.0,2.0,20.0,519
"Last time it was the coal mine, now it's riding shotgun.",14.0,5.0,1.0,20.0,519
I remember when being a bird brain stood for something.,14.0,5.0,1.0,20.0,519
Which one do you think is going to be more surprised?,14.0,5.0,1.0,20.0,519
Phew-- glad that's better than 2 in the bush.,15.0,3.0,2.0,20.0,519
Best seat in the house.,14.0,5.0,1.0,20.0,519
Not a peep,14.0,5.0,1.0,20.0,519
This is one time when being two birds in a bush beats all other options hands down.,14.0,5.0,1.0,20.0,519
He always calls 'shotgun' first.,15.0,3.0,2.0,20.0,519
They're both bird brains,14.0,5.0,1.0,20.0,519
Nobody's aim can be that bad.,14.0,5.0,1.0,20.0,519
I hear he's loaded.,14.0,5.0,1.0,20.0,519
Tell me more about Maslow,16.0,1.0,3.0,20.0,519
"Come to think of it, that's a pretty safe place to be.",14.0,5.0,1.0,20.0,519
Teenagers,15.0,3.0,2.0,20.0,519
I've heard ' Keep your enemy close ' was the enemy's idea.,14.0,5.0,1.0,20.0,519
Hillary is still the safer choice.,15.0,3.0,2.0,20.0,519
I don't think I can watch when they reach ten paces!,16.0,1.0,3.0,20.0,519
Trust Ted to land on the safest place in the forest.,15.0,3.0,2.0,20.0,519
You know he was voted 'most likely to be in the hand' in high school.,15.0,3.0,2.0,20.0,519
Wow! A Nonetoo Swift. You understandably don't see many of those.,13.0,7.0,0.0,20.0,519
Why am I so attracted to him?,15.0,3.0,2.0,20.0,519
"I don't care what he's worth Carl, I'm staying here.",15.0,3.0,2.0,20.0,519
He thinks the guy is Elmer Fudd.,15.0,3.0,2.0,20.0,519
We need to review the lesson on situation awareness,13.0,7.0,0.0,20.0,519
"He turned to me and said, ""Keep your friends close and your enemies closer,"" and then just took off!",14.0,5.0,1.0,20.0,519
Poor turnout at the sit-in.,14.0,5.0,1.0,20.0,519
She's always protesting something.,13.0,7.0,0.0,20.0,519
I told her if she feeds and takes care of him we can keep him.,16.0,1.0,3.0,20.0,519
who would have thought he was worth two of us,15.0,3.0,2.0,20.0,519
Uber comes to the jungle.,15.0,3.0,2.0,20.0,519
"Behold, the yellow-bellied tern-coat in his natural environment.",14.0,5.0,1.0,20.0,519
His tweet just went viral,14.0,5.0,1.0,20.0,519
It's part of their mating ritual. Which explains the whole endangered thing.,13.0,7.0,0.0,20.0,519
Elmer just isn't the same since that silly rabbit left.,15.0,3.0,2.0,20.0,519
Sometimes I wish I was a mocking bird.,14.0,5.0,1.0,20.0,519
Riding shotgun is for the birds.,14.0,5.0,1.0,20.0,519
I'd say he's fallen pretty far from the tree ...,15.0,3.0,2.0,20.0,519
Well....he is an NRA member!,14.0,5.0,1.0,20.0,519
Look at the pecker on that one.,15.0,3.0,2.0,20.0,519
"Live by the gun, die by the gun.",14.0,5.0,1.0,20.0,519
Just because it's different doesn't mean it's wrong.,14.0,5.0,1.0,20.0,519
That's one helluva decoy!,14.0,5.0,1.0,20.0,519
He must be a mocking bird.,13.0,7.0,0.0,20.0,519
"If he looks at you and says watch the birdie, fly!",14.0,5.0,1.0,20.0,519
Looks like Elmer has a new twitter follower.,16.0,1.0,3.0,20.0,519
I see Frank's been working through his trust issues.,13.0,7.0,0.0,20.0,519
He plans to live-tweet every shot.,14.0,5.0,1.0,20.0,519
Only a mockingbird would have the nerve!,15.0,3.0,2.0,20.0,519
"We should have been more specific with our ""Where to Land"" instructions",14.0,5.0,1.0,20.0,519
She had better poop.,16.0,1.0,3.0,20.0,519
I knew it...he sold us out...,15.0,3.0,2.0,20.0,519
Riding shotgun sure looks cool.,15.0,3.0,2.0,20.0,519
It's your fault he's overconfident!,14.0,5.0,1.0,20.0,519
"Apparently he just finished the first Chapter in Sun Tzu’s book, Keep Your Friends Close and Your Enemies Closer.",14.0,5.0,1.0,20.0,519
"Canaries are brave. Not very bright, but brave.",14.0,5.0,1.0,20.0,519
The Millennium Pigeon. Classic.,15.0,3.0,2.0,20.0,519
I've got to 'tweet' this!,15.0,3.0,2.0,20.0,519
That hare-brained son of ours is always pushing the envelope.,14.0,5.0,1.0,20.0,519
I had a hunch Phil was sleeping with the enemy.,15.0,3.0,2.0,20.0,519
He's been live tweeting the hunter's movements all morning.,13.0,7.0,0.0,20.0,519
He'll never look there...,14.0,5.0,1.0,20.0,519
She supports the Second Amendment.,14.0,5.0,1.0,20.0,519
Rumor has it that she's a double agent.,15.0,3.0,2.0,20.0,519
Kurtz has gone rogue.,15.0,3.0,2.0,20.0,519
Wonder what that's worth..,14.0,5.0,1.0,20.0,519
I would like to believe that's fake.,14.0,5.0,1.0,20.0,519
Looks like he has developed Stockholm Syndrome.,15.0,3.0,2.0,20.0,519
Looks like Stockholm syndrome to me,14.0,5.0,1.0,20.0,519
I thought he wanted the front seat when he said shotgun,15.0,3.0,2.0,20.0,519
His NRA membership is clearly paying off.,14.0,5.0,1.0,20.0,519
Tim's always got to jump the gun.,15.0,3.0,2.0,20.0,519
"He's no threat, a little bird told me.",14.0,5.0,1.0,20.0,519
He's literally riding shotgun.,16.0,6.0,1.0,23.0,519
"Look at her, acting like she's better than two of us in the bush!",16.0,6.0,1.0,23.0,519
"Well, I guess what you don't know may actually hurt you.",17.0,4.0,2.0,23.0,519
Hope he doesn't see us or he'll sing like a…….never mind.,17.0,4.0,2.0,23.0,519
He always gets to sit shotgun.,17.0,4.0,2.0,23.0,519
Yea! Keep your enemies close.,15.0,8.0,0.0,23.0,519
She's getting paid to live tweet his hunt.,18.0,2.0,3.0,23.0,519
He's too old for her.,17.0,4.0,2.0,23.0,519
"I knew our girl would bring us honor. First, that noble call for peace on Bernie's podium, and now fearlessly standing up to the gun lobby. What injustice will she challenge next?",17.0,4.0,2.0,23.0,519
Don't worry it's deer season,17.0,4.0,2.0,23.0,519
"Well, I, for one, say she is relying too much on her membership card to the NRA.",16.0,6.0,1.0,23.0,519
Maybe WE should join the N.R.A..,16.0,6.0,1.0,23.0,519
A bird on the gun is worth two in the bush.,16.0,6.0,1.0,23.0,519
With balls that big he won't be able to fly away,16.0,6.0,1.0,23.0,519
Someday we'll sing songs about him.,17.0,4.0,2.0,23.0,519
Now that's hootspa.,15.0,8.0,0.0,23.0,519
Where is the loyalty?,16.0,6.0,1.0,23.0,519
I like his tweets.,16.0,3.0,2.0,21.0,519
"He's cheaper than a Labrador and works for peanuts, but to me he's still a traitor.",15.0,5.0,1.0,21.0,519
That sparrow sold out again this hunting season.,14.0,7.0,0.0,21.0,519
"Well, he did call riding shotgun.",14.0,7.0,0.0,21.0,519
"So, what exactly is that one worth?",15.0,5.0,1.0,21.0,519
"I believe it's what they call ""leaning in"".",15.0,5.0,1.0,21.0,519
I love it when that baby mockingbird does the baby deer sound.,16.0,3.0,2.0,21.0,519
You know it's all fun and games until someone gets hurt,16.0,3.0,2.0,21.0,519
I'm afraid that Tweetie has gone over to the dark side.,14.0,2.0,2.0,18.0,519
That Sanders bird has gone too far this time,16.0,3.0,2.0,21.0,519
"To tweet, or not to tweet...",16.0,3.0,2.0,21.0,519
I told you that small egg looked cuckoo to me.,16.0,3.0,2.0,21.0,519
"He's no canary and that ain't no coal mine, but I still get a bad vibe.",16.0,3.0,2.0,21.0,519
"Bertie, do you think he knows that we've got him surrounded?",15.0,5.0,1.0,21.0,519
I told him to stay in the nest until the eye drops wore off.,15.0,5.0,1.0,21.0,519
I'm afraid Jack has turned into a bit of a daredevil since that Sanders stunt of his.,15.0,5.0,1.0,21.0,519
Clearly a Sanders supporter.,16.0,3.0,2.0,21.0,519
Nothing is safer than being a rifle sight,17.0,1.0,3.0,21.0,519
A delegate in the hand is worth two in the bush.,14.0,7.0,0.0,21.0,519
Now that's a Twitter moment!,15.0,5.0,1.0,21.0,519
His dream has always been to be a bird of prey.,16.0,3.0,2.0,21.0,519
"Wow, the gun lobby sure has him over a barrel.",15.0,5.0,1.0,21.0,519
I told you he's got some huevos.,16.0,3.0,2.0,21.0,519
We should keep OUR enemies close.,15.0,5.0,1.0,21.0,519
"The hunter has him over a barrel, we should send him a tweet.",16.0,3.0,2.0,21.0,519
He's getting seed money from the NRA.,14.0,7.0,0.0,21.0,519
Another self-hating chickadee.,17.0,1.0,3.0,21.0,519
Let's hope he's a bird in hand type of guy.,16.0,3.0,2.0,21.0,519
She'll tweet twice when he loads it,16.0,3.0,2.0,21.0,519
It's the Stockholm effect.,15.0,5.0,1.0,21.0,519
It's tough for a coal mine canary to find work today.,14.0,7.0,0.0,21.0,519
"Wait, it gets better. He just ate.",15.0,5.0,1.0,21.0,519
We've successfully embedded a tweet in the NRA.,14.0,7.0,0.0,21.0,519
Junior's new friend worries me.,16.0,3.0,2.0,21.0,519
That one works for the NRA.,14.0,7.0,0.0,21.0,519
One day it will all backfire on him.,13.0,4.0,1.0,18.0,519
He's watched too many Bugs Bunny cartoons.,16.0,3.0,2.0,21.0,519
"So much for that ""birds of a feather"" stuff.",15.0,5.0,1.0,21.0,519
Just one little tweet and there'll be no more twitter...,16.0,3.0,2.0,21.0,519
It's a twitter challenge.,15.0,5.0,1.0,21.0,519
I didn't know Fred was a Republican,15.0,5.0,1.0,21.0,519
The birdbrain volunteered to ride shotgun.,16.0,3.0,2.0,21.0,519
"Dear, all I said to her was 'lookout for the hunter!""",16.0,3.0,2.0,21.0,519
I told you your ex was crazy!,15.0,5.0,1.0,21.0,519
It's not that surprising. Robins always have had strong feelings about the the right to perch arms.,15.0,5.0,1.0,21.0,519
Not the hunter he once was.,14.0,7.0,0.0,21.0,519
Must be some type of fraternity pledge.,15.0,5.0,1.0,21.0,519
I thought he was hunting... what a turn-around.,15.0,5.0,1.0,21.0,519
Keep your friends close and your executioner closest.,15.0,5.0,1.0,21.0,519
"Dave, have you seen a better analogy for this year's election?",15.0,5.0,1.0,21.0,519
"Hard to believe, but that guy's deadly with a fishing rod.",15.0,5.0,1.0,21.0,519
He's the ultimate bird of prey.,15.0,5.0,1.0,21.0,519
He's changed since that gig with Bernie,14.0,2.0,2.0,18.0,519
Where have we failed as parents?,14.0,7.0,0.0,21.0,519
Doesn't look like he'll be contributing to the gene pool,14.0,2.0,2.0,18.0,519
Her mother was the same way. Anything for attention.,15.0,5.0,1.0,21.0,519
They exchanged tweets and have followed each other ever since.,14.0,7.0,0.0,21.0,519
Where have we failed?,14.0,7.0,0.0,21.0,519
Can you believe that! A moustache!,17.0,1.0,3.0,21.0,519
"He distinctly said ""two in the bush.""",15.0,5.0,1.0,21.0,519
It's nice that someone finally answered his mating call.,16.0,3.0,2.0,21.0,519
These millennials think they can just perch themselves on anything.,15.0,5.0,1.0,21.0,519
I believe that's what they call cavorting with the enemy.,16.0,3.0,2.0,21.0,519
We pushed him out of the nest too early.,15.0,5.0,1.0,21.0,519
He called shotgun.,15.0,5.0,1.0,21.0,519
You'll never see a pheasant do that,15.0,5.0,1.0,21.0,519
These Millennials are so uninformed.,15.0,5.0,1.0,21.0,519
He's the smartest and safest bird in the forest.,16.0,3.0,2.0,21.0,519
Good thing we breed by numbers.,13.0,4.0,1.0,18.0,519
Do you think it's wise for him to to mock the NRA?,15.0,5.0,1.0,21.0,519
Betty and Arthur discuss the dangers of free-range parenting.,14.0,7.0,0.0,21.0,519
And they call us 'birdbrains'.,16.0,3.0,2.0,21.0,519
But what if the bird isn't actually in the hand?,15.0,5.0,1.0,21.0,519
He's had this Wild West fantasy to ride shotgun.,16.0,3.0,2.0,21.0,519
Now that's what I call chutzpah!,14.0,7.0,0.0,21.0,519
It's always the last place you think to look.,15.0,5.0,1.0,21.0,519
Is she cuckoo?,13.0,4.0,1.0,18.0,519
The best defense is a good offense.,13.0,4.0,1.0,18.0,519
He's a double agent.,15.0,5.0,1.0,21.0,519
They've been playing hard to get with each other all season.,16.0,3.0,2.0,21.0,519
He's so vain - probably thinks he's worth two of us.,16.0,3.0,2.0,21.0,519
Brilliant! He's hiding in plain gun-sight.,15.0,5.0,1.0,21.0,519
Well if that isn't a Birds eye-view I don't know what is,16.0,3.0,2.0,21.0,519
All he's really saying is give peace a chance.,16.0,3.0,2.0,21.0,519
They met at a Bernie Sanders rally.,17.0,1.0,3.0,21.0,519
He's moonlighting as a scope.,15.0,5.0,1.0,21.0,519
He's a stool pigeon for the NRA,15.0,5.0,1.0,21.0,519
"He called it first, so he gets to ride shotgun.",16.0,3.0,2.0,21.0,519
"As the saying goes, ""Ignorance is bliss.""",15.0,5.0,1.0,21.0,519
The perching market's tighter than we thought.,12.0,6.0,0.0,18.0,519
He's on the hunt for whoever sent out that Tweet he didn't like.,16.0,3.0,2.0,21.0,519
"Egret or regret, amiright?",15.0,5.0,1.0,21.0,519
I think Julian's fear of flying has gone too far.,16.0,3.0,2.0,21.0,519
He does that to everybody Dick Cheney takes hunting.,16.0,3.0,2.0,21.0,519
He's always been known for his strategic planning.,16.0,3.0,2.0,21.0,519
"Et tu, Tootie?",16.0,3.0,2.0,21.0,519
Are you tweeting this?,16.0,3.0,2.0,21.0,519
I'm just grateful we have birds like him on the front line.,15.0,5.0,1.0,21.0,519
Where did we go wrong? our youngest has joined the NRA.,17.0,1.0,3.0,21.0,519
He's supporting Bernie.,16.0,3.0,2.0,21.0,519
Bugs Bunny should show up any minute now.,13.0,4.0,1.0,18.0,519
We're in trouble. He's got that new-fangled sight.,14.0,7.0,0.0,21.0,519
I sense neither one lives in the present.,14.0,7.0,0.0,21.0,519
It's time we had 'The Talk' with junior.,15.0,5.0,1.0,21.0,519
Oh look hun! It's the endangered Spotted Hunter Taunter!,14.0,2.0,2.0,18.0,519
You need an app to get the ride.,13.0,4.0,1.0,18.0,519
Others would soon gather to witness Kevin's annual act of defiance.,16.0,3.0,2.0,21.0,519
I don't expect many more tweets from him.,15.0,5.0,1.0,21.0,519
"Birdie, promise me you'll never ride shotgun.",16.0,3.0,2.0,21.0,519
Can you believe she joined the NRA?,15.0,5.0,1.0,21.0,519
Thinking inside the box is so underrated.,16.0,3.0,2.0,21.0,519
I am definitely going to tweet about this.,16.0,3.0,2.0,21.0,519
Why do kids insist on doing the exact opposite of what you teach them?,15.0,5.0,1.0,21.0,519
"Yeah, he works for the other side, but I hear they pay him bird feed...!",15.0,5.0,1.0,21.0,519
It looks like Blinky forgot his contacts again.,15.0,5.0,1.0,21.0,519
I hear that he's part stool pigeon.,16.0,3.0,2.0,21.0,519
"I've always told him, 'Keep your friends close and your enemies closer.' But this might be taking it a bit too far.",15.0,5.0,1.0,21.0,519
That chick has balls.,16.0,3.0,2.0,21.0,519
I always thought our son was a bit of a strange bird.,15.0,5.0,1.0,21.0,519
What an Uncle Tomtit,15.0,5.0,1.0,21.0,519
I don't think Bill understood when we told him to go where they'd least expect to see you.,17.0,1.0,3.0,21.0,519
He's from Stockholm.,15.0,5.0,1.0,21.0,519
I can't not look.,15.0,5.0,1.0,21.0,519
Cuckoo or Stool pigeon?,13.0,4.0,1.0,18.0,519
If he comes home with any more pets . . .,15.0,5.0,1.0,21.0,519
No wonder bird brains get a bad rap.,14.0,7.0,0.0,21.0,519
There goes that guy who always has a chirp on his shoulder.,15.0,5.0,1.0,21.0,519
He's practicing for Twick or Tweet.,13.0,4.0,1.0,18.0,519
There goes Bernie again.,15.0,5.0,1.0,21.0,519
I think we are safe.,16.0,3.0,2.0,21.0,519
"""One of these days, Harold's going to go too far"".",16.0,3.0,2.0,21.0,519
She was raised by cats...,15.0,5.0,1.0,21.0,519
Must be a Democrat.,15.0,5.0,1.0,21.0,519
He always was a problem child.,14.0,7.0,0.0,21.0,519
Double Agent,16.0,3.0,2.0,21.0,519
Almost makes you rethink opposition to the 2nd Amendment.,15.0,5.0,1.0,21.0,519
"He's still worth the two of us, when you adjust for inflation.",14.0,2.0,2.0,18.0,519
I didn't know bobolinks went in for extreme sports.,15.0,5.0,1.0,21.0,519
Reminds me of seeing a dog holding a biscuit on his nose,15.0,5.0,1.0,21.0,519
"If you ask me, they're both birdbrains.",14.0,7.0,0.0,21.0,519
Always showing off...,15.0,5.0,1.0,21.0,519
"He prefers the backward facing seat in train cars, too.",14.0,7.0,0.0,21.0,519
Don't worry. He's riding shotgun.,13.0,4.0,1.0,18.0,519
My son is no genius but always finds friends that make him seem smart.,15.0,5.0,1.0,21.0,519
An unnecessary sequel to Birdman or The Unexpected Virtue of Ignorance,16.0,5.0,1.0,22.0,519
"Tell me, Joe, what's the bet again?",16.0,5.0,1.0,22.0,519
He'll see us in a moment. I hope he's not a stool pigeon!,16.0,5.0,1.0,22.0,519
Is he still worth two in the bush?,16.0,5.0,1.0,22.0,519
"""Keep your friends close...your enemies closer.",16.0,5.0,1.0,22.0,519
I always knew he was a turn feather.,16.0,5.0,1.0,22.0,519
Her true calling is mine safety.,16.0,5.0,1.0,22.0,519
Benedict Arnold!!!,17.0,3.0,2.0,22.0,519
Let's not get too optimistic.,16.0,5.0,1.0,22.0,519
Talk about a great seat for the wedding.,16.0,5.0,1.0,22.0,519
Now that's what I call chirps-pah.,16.0,5.0,1.0,22.0,519
Why does that man have such small legs?,16.0,5.0,1.0,22.0,519
Can you imagine getting paid to tweet?,17.0,3.0,2.0,22.0,519
A bird on the gun could be worth more than two in the bush.,17.0,3.0,2.0,22.0,519
"Ever since they exchanged tweets, she's had his back.",17.0,3.0,2.0,22.0,519
The heart wants what the heart wants.,17.0,3.0,2.0,22.0,519
Not to worry-The location of the decoy tells me he's a novice hunter.,18.0,1.0,3.0,22.0,519
I wish I was ridin' shotgun; this is for the birds.,17.0,3.0,2.0,22.0,519
Lionel always had boundary issues,16.0,5.0,1.0,22.0,519
Why tweet it? They'd never believe us.,17.0,3.0,2.0,22.0,519
"Jeez, always has to ride shotgun.",15.0,7.0,0.0,22.0,519
I wish they could solve their problems without resorting to a duel every time.,16.0,5.0,1.0,22.0,519
Worst. Hunter. Ever.,17.0,3.0,2.0,22.0,519
It's called a peep sight.,16.0,5.0,1.0,22.0,519
He's got nerves of steel.,16.0,5.0,1.0,22.0,519
These crazy kids nowadays. They call it a 'perch-in.',15.0,7.0,0.0,22.0,519
Now knock him out and take the gun!,17.0,3.0,2.0,22.0,519
Let's see him chirp his way out of this one.,17.0,3.0,2.0,22.0,519
Walter acts like he is so brave. Let's see him move 9 inches down the barrel.,16.0,5.0,1.0,22.0,519
"She's being paid as a decoy, but we all know it's a ploy to go viral.",15.0,7.0,0.0,22.0,519
My money's on the bullet.,16.0,5.0,1.0,22.0,519
She volunteered to be the neighborhood's early warning system.,16.0,5.0,1.0,22.0,519
Now that’s a great example of keeping your friends close and your enemies closer.,17.0,3.0,2.0,22.0,519
Those smart-alec teenagers think they’re indestructible.,16.0,5.0,1.0,22.0,519
I bet him two worms that he couldn't get close enough to poop on his gun. Looks like it's time to start digging!,15.0,7.0,0.0,22.0,519
I think the hazing has crossed the line.,16.0,5.0,1.0,22.0,519
"No, Jerry! Don't look inside! ITS NOT A BIRD FEEDER!",18.0,1.0,3.0,22.0,519
Fred always seems to know the blind spots.,16.0,5.0,1.0,22.0,519
Are you live tweeting this?,17.0,3.0,2.0,22.0,519
When do you think he'll realize the branch is moving?,16.0,5.0,1.0,22.0,519
"I don't care if he identifies as human, Eggbert, he's still my baby bird.",16.0,5.0,1.0,22.0,519
I hope we chose the right summer camp.,15.0,7.0,0.0,22.0,519
"Well, the strange thing is that birds aren't afraid of him but no humans will hunt with him and they say that he used to be some kind of vice president.",17.0,3.0,2.0,22.0,519
"It's like my father always says, 'stay close to your friends, stay closer to your enemies'.",16.0,5.0,1.0,22.0,519
I hate playing Truth or Dare with that guy.,16.0,5.0,1.0,22.0,519
Ralph is such a show- off.,16.0,5.0,1.0,22.0,519
This just seems like another one of his calls for help.,17.0,3.0,2.0,22.0,519
"Well, mother, not every thing can be taught.",15.0,7.0,0.0,22.0,519
You've got to admire his beakmanship.,15.0,7.0,0.0,22.0,519
He's always free loading something. That's just the way he is.,17.0,3.0,2.0,22.0,519
Early bird catches Warren.,17.0,3.0,2.0,22.0,519
Friggin' Smartass!,17.0,3.0,2.0,22.0,519
I still can't believe our kid joined the N.R.A!,16.0,5.0,1.0,22.0,519
"Like my dad used to say, ""keep your wrens close, but your enemies closer.""",18.0,1.0,3.0,22.0,519
Then it's true. Our own son has been radicalized!,16.0,5.0,1.0,22.0,519
The fun part is when the guy finally sees him and Mort doesn’t let go.,16.0,5.0,1.0,22.0,519
You should see what it looks like what it looks like when he goes hunting for hippos.,18.0,1.0,3.0,22.0,519
Does he know that man's a friend of Dick Cheney?,16.0,5.0,1.0,22.0,519
It’s a cheep shot.,17.0,3.0,2.0,22.0,519
"""Did you define ""limb""?",16.0,5.0,1.0,22.0,519
You're right.... we're the ones who need to worry.,17.0,3.0,2.0,22.0,519
He was always a bird brain.,17.0,3.0,2.0,22.0,519
That Fred! He always was a kidder.,17.0,3.0,2.0,22.0,519
Irv has always been a risk taker.,16.0,5.0,1.0,22.0,519
"He inherited that thrill-seeker gene from his father, may he rest in peace.",17.0,3.0,2.0,22.0,519
He's so out of your league.,16.0,5.0,1.0,22.0,519
I knew this day would come Maribel. He's gone to the other side. Not even he thinks Bernie can win anymore.,18.0,1.0,3.0,22.0,519
"For once I would like him to choose ""truth"" in our Truth or Dare.",16.0,5.0,1.0,22.0,519
Lucky for him its not stupid season yet,16.0,5.0,1.0,22.0,519
He's got student loans,17.0,3.0,2.0,22.0,519
She's not to be rifled with.,17.0,3.0,2.0,22.0,519
I always thought he was a title cuckoo!,16.0,5.0,1.0,22.0,519
It's hard to decide who's more clueless.,15.0,7.0,0.0,22.0,519
Is that bird shot?,16.0,5.0,1.0,22.0,519
"At least WE'LL be safe, since we're the 2 in the bush...",15.0,7.0,0.0,22.0,519
"Bold move, hiding in plain site.",15.0,7.0,0.0,22.0,519
Worms! They're hunting worms!,16.0,5.0,1.0,22.0,519
Last time he pulled that stunt he lost his tail feathers,15.0,7.0,0.0,22.0,519
"As Sun Tzu said, 'Keep your friends close, and your enemies closer.'",16.0,5.0,1.0,22.0,519
"He's the bird in the hand, right?",16.0,5.0,1.0,22.0,519
He's as crazy as a loon....literally.,18.0,1.0,3.0,22.0,519
"When he stops singing, duck!",17.0,3.0,2.0,22.0,519
When he says look at the birdie. Don!t.,16.0,5.0,1.0,22.0,519
We always knew he was a son of a gun!,16.0,5.0,1.0,22.0,519
I knew it when he stopped tweeting.,16.0,5.0,1.0,22.0,519
Icarus would be proud.,16.0,5.0,1.0,22.0,519
Son of a bitch!! That's the little little birdie that tells him where to hunt!,17.0,3.0,2.0,22.0,519
A bird on a gun is worth two in the bush?,16.0,5.0,1.0,22.0,519
I cry fowl. He's using a decoy.,18.0,1.0,3.0,22.0,519
"Sure they did a great job capturing your likeness, but posing for hunting decoys seems like a morally-questionable way to start off your modeling career.",16.0,5.0,1.0,22.0,519
This is a classic case of miscommunication,16.0,5.0,1.0,22.0,519
He called it.,17.0,3.0,2.0,22.0,519
Even the NRA's on Twitter now.,16.0,5.0,1.0,22.0,519
He did always fly to the beat of his own gunner.,15.0,7.0,0.0,22.0,519
140 word obit coming up.,15.0,7.0,0.0,22.0,519
Midlife crisis. He just turned three and a half.,15.0,7.0,0.0,22.0,519
AND he's tweeting about it. Show-off!,16.0,5.0,1.0,22.0,519
Don't respond to his tweet.,18.0,1.0,3.0,22.0,519
Let's face it. They're both oblivious.,18.0,1.0,3.0,22.0,519
One of these days he'll go too far...,18.0,1.0,3.0,22.0,519
The belly of the beast!,16.0,5.0,1.0,22.0,519
