caption,unfunny,somewhat_funny,funny,count,contest
"It's too bad, he's got her over a barrel.",17.0,3.0,1.0,21.0,519
I don't think either knows.,18.0,1.0,2.0,21.0,519
I never expected Jackson to sell himself out like that.,17.0,3.0,1.0,21.0,519
"After the bird dog, I suppose the dog bird was inevitable.",17.0,3.0,1.0,21.0,519
He said he'll blow it up on Twitter.,17.0,3.0,1.0,21.0,519
Not just a nuthatch – a gun nuthatch.,18.0,1.0,2.0,21.0,519
See? The open-carry ones are clueless. It's the ones who try to conceal their shotguns in their pants legs that you have to watch out for.,16.0,5.0,0.0,21.0,519
Seems that camo pattern works better than we thought.,16.0,5.0,0.0,21.0,519
"Great, now we'll get a thousand tweets telling us what an idiot he is.",17.0,3.0,1.0,21.0,519
I think we need to send him away to boarding school.,16.0,5.0,0.0,21.0,519
Last week he started meditating. This week he is the reincarnation of Charlton Heston.,18.0,1.0,2.0,21.0,519
If they both had half a brain they'd be twice as dangerous.,17.0,3.0,1.0,21.0,519
The way he shoots it is the safest place to be,17.0,3.0,1.0,21.0,519
He has suicidal thoughts.,17.0,3.0,1.0,21.0,519
She must be one of those peacenik doves.,16.0,5.0,0.0,21.0,519
Like I've said...stay close to your enemies.,17.0,3.0,1.0,21.0,519
Which one is the bigger birdbrain?,17.0,3.0,1.0,21.0,519
""" It could be a decoy""!",17.0,3.0,1.0,21.0,519
"Trust me, we're better off as two in the bush than a finch on a barrel.",17.0,3.0,1.0,21.0,519
He's a chutzparrot.,17.0,3.0,1.0,21.0,519
"5 more seconds and we lose the bet; quick, squawk at him!",17.0,3.0,1.0,21.0,519
Look at him. Beak in the air. He thinks he is worth both of us put together.,17.0,3.0,1.0,21.0,519
Quisling.,18.0,1.0,2.0,21.0,519
"Was that the signal, or was that just regular whistling?",16.0,5.0,0.0,21.0,519
Her tweets could kill.,18.0,1.0,2.0,21.0,519
His vision is better.,17.0,3.0,1.0,21.0,519
I never pictured Frank as a stool pigeon.,17.0,3.0,1.0,21.0,519
Look! A red-backed Quisling!,17.0,3.0,1.0,21.0,519
He's trying the Looney Tunes approach to not getting shot.,16.0,5.0,0.0,21.0,519
Our editor wants another Trump caption. Any thoughts?,17.0,3.0,1.0,21.0,519
"OK, stop me if you have heard this one before.",17.0,3.0,1.0,21.0,519
"Nope, that's a Nark.",17.0,3.0,1.0,21.0,519
No worries. A bird in the hand is worth two in the bush.,18.0,1.0,2.0,21.0,519
"He's Chinese, so he's reenacting Tiananmen square.",16.0,5.0,0.0,21.0,519
I hear he's worth both of us.,17.0,3.0,1.0,21.0,519
"God, I hate that guy!",18.0,1.0,2.0,21.0,519
"Yep, Fred found the safest place.",18.0,1.0,2.0,21.0,519
Kids today!,16.0,5.0,0.0,21.0,519
". . . and I always thought the Quisling Quail was just a myth, like the Loch Ness monster.",16.0,5.0,0.0,21.0,519
And they laugh at us for having bird brains...,17.0,3.0,1.0,21.0,519
He'd always rather ride shotgun than fly.,16.0,5.0,0.0,21.0,519
The youngsters just can't do camouflage.,17.0,3.0,1.0,21.0,519
He won't rest until he finds her killer.,17.0,3.0,1.0,21.0,519
"I know the hand, and the bush, but what's the sight worth?",16.0,5.0,0.0,21.0,519
I guess some guys just wanna become extinct.,16.0,5.0,0.0,21.0,519
So all he wanted was three night crawlers and some mealworms?,18.0,1.0,2.0,21.0,519
Supposedly they have an agreed safe word,18.0,1.0,2.0,21.0,519
"He's no Dick Cheney, that's for sure",17.0,3.0,1.0,21.0,519
"That's not exactly what I meant when I said to him: 'Keep your friends close, and your enemies closer.'",16.0,5.0,0.0,21.0,519
They exchanged tweets!,17.0,3.0,1.0,21.0,519
"It's okay, he has Obamacare...",16.0,5.0,0.0,21.0,519
I wonder what camouflage he uses,16.0,5.0,0.0,21.0,519
*sigh* . . . you think you know a bird.,17.0,3.0,1.0,21.0,519
I call shotgun next.,17.0,3.0,1.0,21.0,519
There goes my nest egg.,16.0,5.0,0.0,21.0,519
And our little Berty's constipation gone in 3...2...1...,17.0,3.0,1.0,21.0,519
Do you think our son understands the tweets about hunting season we sent him?,18.0,1.0,2.0,21.0,519
It's nice to see him take a strong stance on gun issues.,16.0,5.0,0.0,21.0,519
Looks like a Winchester Retweeter,17.0,3.0,1.0,21.0,519
Imbedded. But starting to go soft on them.,18.0,1.0,2.0,21.0,519
Looks like he's got a chirp on his shoulder.,18.0,1.0,2.0,21.0,519
Tweetlee Dee Tweetlee Dum,17.0,3.0,1.0,21.0,519
"As they say "" if you can't beat them, join them""",17.0,3.0,1.0,21.0,519
He probably thinks it's a water gun...,16.0,5.0,0.0,21.0,519
Clueless.,17.0,3.0,1.0,21.0,519
Well I certainly didn't raise her that way.,16.0,5.0,0.0,21.0,519
Why do women stay in abusive relationships?,18.0,1.0,2.0,21.0,519
He's taking this Hamilton craze a bit too far.,16.0,5.0,0.0,21.0,519
"You know what they say ,"" A bird on the barrel is worth two on the branch"".",16.0,5.0,0.0,21.0,519
"You know, I say let 'em have a gun or two. Can't get up off the ground to save their lives, and their neck-rotation ability is just plain sad.",17.0,3.0,1.0,21.0,519
Actually they're both assholes.,17.0,3.0,1.0,21.0,519
"Report back to HQ that our ""Little Birdie"" is in.",16.0,5.0,0.0,21.0,519
Getting worms the old fashioned way is still good enough for me.,17.0,3.0,1.0,21.0,519
We're safe - a bird in the hand is worth two in the bush.,14.0,2.0,1.0,17.0,519
Should we call him a traitor or a whistle blower?,13.0,4.0,0.0,17.0,519
What's the spot exchange rate for birds-in-bush to birds-with-a-death-wish?,14.0,2.0,1.0,17.0,519
"Woodstock, honey, you were so much cuter on that guitar back in '69.",14.0,2.0,1.0,17.0,519
"You can tell, he is not one of us.",14.0,2.0,1.0,17.0,519
What's the worst that could happen if we said hi?,14.0,2.0,1.0,17.0,519
It's the bluebird of political incorrectness.,14.0,2.0,1.0,17.0,519
He's never distracted by a tweet.,13.0,4.0,0.0,17.0,519
Call it art.,18.0,3.0,1.0,22.0,519
"No, look at the mustache - all of the Ubers are switching to Lyft.",17.0,5.0,0.0,22.0,519
He's never been clear on the decoy concept.,17.0,5.0,0.0,22.0,519
Stool pigeon,17.0,5.0,0.0,22.0,519
I told you he would sing like a canary.,18.0,3.0,1.0,22.0,519
'There goes the Great Cat Hunter.',18.0,3.0,1.0,22.0,519
"So typical with her - new week, new hunter.",17.0,5.0,0.0,22.0,519
"Yes, but so last season.",17.0,5.0,0.0,22.0,519
Our baby unfortunately joined the NRA.,18.0,3.0,1.0,22.0,519
Naked is the best disguise.,18.0,3.0,1.0,22.0,519
"""He once said 'If ya' can't beat 'em, join 'em'"".",17.0,5.0,0.0,22.0,519
UBER's background checks worry me.,18.0,3.0,1.0,22.0,519
The bird won't live the day to see Hilary make that gun illegal.,18.0,3.0,1.0,22.0,519
And then he doesn't understand why we call him Benedict Arnold...,18.0,3.0,1.0,22.0,519
He's not so much IN the crosshairs as he IS the crosshairs.,17.0,5.0,0.0,22.0,519
"Not only that, he gets the worm without even being early!",18.0,3.0,1.0,22.0,519
This has gone too far. Stop spiking the birdbath.,18.0,3.0,1.0,22.0,519
You gotta give her credit...denial suites her,18.0,3.0,1.0,22.0,519
"First Bernie's podium, now some NRA guy...What does your nephew have against Hillary?",18.0,3.0,1.0,22.0,519
Hunters are basically so stupid.,18.0,3.0,1.0,22.0,519
I wouldn't fancy riding shotgun…,18.0,3.0,1.0,22.0,519
Eggs Benedict anyone?,19.0,1.0,2.0,22.0,519
"It beats flying,I guess.",17.0,5.0,0.0,22.0,519
Peacenick.,17.0,5.0,0.0,22.0,519
Lucky Duck would be an understatement.,18.0,3.0,1.0,22.0,519
He's gauging the wisdom of flying straight ahead.,18.0,3.0,1.0,22.0,519
And I thought I was a lucky bird when I found the first worm of the day!,17.0,5.0,0.0,22.0,519
Tweeted he joined the NRA.,18.0,3.0,1.0,22.0,519
I don't know what's wrong with me. There was a time when that would've struck me as funny.,17.0,5.0,0.0,22.0,519
Sweet bird of youth- his endangered species status came thru.,18.0,3.0,1.0,22.0,519
One on the gun is better than us in the brush.,17.0,5.0,0.0,22.0,519
"To Kill a Mockingbird is a book, not a suicide suggestion, Tweety!",18.0,3.0,1.0,22.0,519
"Duck, it's a stool pigeon.",17.0,5.0,0.0,22.0,519
She's getting another 'Bird's eye view',17.0,5.0,0.0,22.0,519
He's the NRA's newest memebr.,18.0,3.0,1.0,22.0,519
I love it when Chuck plays chicken.,17.0,5.0,0.0,22.0,519
Let's hope he can fly in the face of danger.,17.0,5.0,0.0,22.0,519
Hitch hiking can be dangerous.,18.0,3.0,1.0,22.0,519
That's Bernie Sanders' P.R. guy.,19.0,1.0,2.0,22.0,519
"""Do you think ,dear, we should distract the hunter before the kid finds out he's not sitting on a tree branch?",18.0,3.0,1.0,22.0,519
Ralph has turned to the Dark Side!,19.0,1.0,2.0,22.0,519
He really pushes the envelope.,17.0,5.0,0.0,22.0,519
"Yes, I agree- the spitting image of American politics.",17.0,5.0,0.0,22.0,519
A bird on the barrel of a gun is worth a pair of birds in densely branch shrubbery,17.0,5.0,0.0,22.0,519
He's not fooling anyone with that decoy.,18.0,3.0,1.0,22.0,519
His latest tweet was that he's trying to work within the system.,19.0,1.0,2.0,22.0,519
Two turtle doves and a partridge on a pear shaped man.,18.0,3.0,1.0,22.0,519
Better call the suicide hotline.,18.0,3.0,1.0,22.0,519
"Pff, what a bird-brain.",18.0,3.0,1.0,22.0,519
I can't believe our own son took a decoy job.,18.0,3.0,1.0,22.0,519
"He's got guts, but he'll lose them if he stays there!",18.0,3.0,1.0,22.0,519
Looks to me like he is just exercising his right to bird arms...,18.0,3.0,1.0,22.0,519
"Well, he's got her back.",18.0,3.0,1.0,22.0,519
Look Chirpy's been flying without his glasses again.,18.0,3.0,1.0,22.0,519
"As is said, ""Keep your friends close....""",17.0,5.0,0.0,22.0,519
Newbie.,18.0,3.0,1.0,22.0,519
Pass the word. We've a stool pigeon.,18.0,3.0,1.0,22.0,519
Our sister is cleaver! She helps the hunter spot game and at the same time she has no more problems with bullies.,18.0,3.0,1.0,22.0,519
"""Look Charlie has finally been accepted as a member of the NRA #2",18.0,3.0,1.0,22.0,519
"I wonder if passenger pigeons have considered riding in cars, or even taking the train?",17.0,5.0,0.0,22.0,519
I'll tweet and you can retweet.,17.0,5.0,0.0,22.0,519
He clearly needs a refresher on how to use decoys.,19.0,1.0,2.0,22.0,519
"Well if smoking doesn't kill him, this probably will...",18.0,3.0,1.0,22.0,519
"Relax, dear. It's just another graduate from the Plaxico Burress Gun Safety School.",18.0,3.0,1.0,22.0,519
Guess someone is practicing to be a decoy again.,18.0,3.0,1.0,22.0,519
"I'd say that's taking the expression ""keeping your enemies closer"" a little too far.",17.0,5.0,0.0,22.0,519
That guy again--always walking the fine line on gun control.,17.0,5.0,0.0,22.0,519
He always wanted to be a hawk.,17.0,5.0,0.0,22.0,519
"Working for the enemy, I see. Ain't many jobs for the young'uns since they closed the coal mines.",18.0,3.0,1.0,22.0,519
Next winter we're going somewhere less divisive.,18.0,3.0,1.0,22.0,519
She'll do almost anything to get someone to listen.,19.0,1.0,2.0,22.0,519
Sometime in life it's who you know that counts.,17.0,5.0,0.0,22.0,519
That boy ain't right...,18.0,3.0,1.0,22.0,519
Not effective camo.,19.0,1.0,2.0,22.0,519
"I'll be dammed, Hank and Artie's counselling sessions are finally paying off.",18.0,3.0,1.0,22.0,519
"He obviously was the first to call ""shotgun.""",18.0,3.0,1.0,22.0,519
Hasn't he learned from Bambi?,18.0,3.0,1.0,22.0,519
"Fortunately, a bird with the gun is worth two in the bush!",18.0,3.0,1.0,22.0,519
They negotiated a temporary cessation of hostility.,17.0,5.0,0.0,22.0,519
That is one bird in the hand that is absolutely not worth two in the bush!!!!,18.0,3.0,1.0,22.0,519
I told that sucker he'd be worth more over there than with us 2 in the bush.,17.0,5.0,0.0,22.0,519
I guess it's his swan song.,18.0,3.0,1.0,22.0,519
He's s about the size of that guy's brain.,18.0,3.0,1.0,22.0,519
some people never stop hunting for retweets,18.0,3.0,1.0,22.0,519
I'm glad Junior has found a safe place to hide.,18.0,3.0,1.0,22.0,519
Worst use of a decoy ever.,18.0,3.0,1.0,22.0,519
You go girl!,18.0,3.0,1.0,22.0,519
He certainly isn't helping to continue our species population.,18.0,3.0,1.0,22.0,519
``There's no precedent. It's downright visionary.'',18.0,3.0,1.0,22.0,519
"Tell headquarters, I think we're safe!",18.0,3.0,1.0,22.0,519
Should we be concerned or entertained that he's giving us the bird?,18.0,3.0,1.0,22.0,519
"He went vegan years ago, but he hasn't told his wife.",19.0,1.0,2.0,22.0,519
Should we tell him his grandfather really didn't perch on a pirate's shoulder?,18.0,3.0,1.0,22.0,519
I hope he doesn't assume there is a light at the end of the tunnel.,18.0,3.0,1.0,22.0,519
The kid is hitchhiking again.,17.0,5.0,0.0,22.0,519
From the pear tree to the dark side in one swoop...,18.0,3.0,1.0,22.0,519
Blind Bill's newly cleaned gun,18.0,3.0,1.0,22.0,519
"Ah, the innocence of youth.",17.0,5.0,0.0,22.0,519
You think canary would rat us out?,18.0,3.0,1.0,22.0,519
I never figured Ted would turn out to be the stoolpigeon.,19.0,1.0,2.0,22.0,519
Do you think we should call that idiot songbird over here?,19.0,1.0,2.0,22.0,519
I thought you said he was a stool pigeon.,18.0,3.0,1.0,22.0,519
"It's a decoy, I can tell by the whistle!",17.0,5.0,0.0,22.0,519
Do we really need empirical evidence that a bird in the hand is worth two in the bush?,19.0,1.0,2.0,22.0,519
I told you he couldn't turn down a dare.,17.0,5.0,0.0,22.0,519
That's gotta be worth at least three.,17.0,5.0,0.0,22.0,519
He gives new meaning to driving shotgun.,17.0,5.0,0.0,22.0,519
I heard he's worth as much as both of us,17.0,5.0,0.0,22.0,519
It's something to tweet about.,17.0,5.0,0.0,22.0,519
Thats why I stopped following her tweets.,18.0,3.0,1.0,22.0,519
He's either a decoy or he's stupid.,18.0,3.0,1.0,22.0,519
"Well, honey, you raise 'em the best you can, but sooner or later they have to make their own decisions.",18.0,3.0,1.0,22.0,519
Peep sight!,17.0,5.0,0.0,22.0,519
"Cuckoo. NRA member. Take flight, girlfriend.",18.0,3.0,1.0,22.0,519
Using decoys maybe unethical but it evens out when he tries to aim that thing.,17.0,5.0,0.0,22.0,519
"OK, Eddie will tweet three times - then we rush in and peck the guy's eyes out.",17.0,5.0,0.0,22.0,519
Who is the bird brain now?,18.0,3.0,1.0,22.0,519
It's a plastic bird for NRA propaganda.,18.0,3.0,1.0,22.0,519
Boy....that Todd was never one to be gun shy.,17.0,5.0,0.0,22.0,519
Let's not judge him for going for Trump; we went for Bush.,18.0,3.0,1.0,22.0,519
...got chutzpah?,18.0,3.0,1.0,22.0,519
"That's Flip, the bird",18.0,3.0,1.0,22.0,519
I don't mind his species fluidity. What disturbs me is his support of the NRA.,18.0,3.0,1.0,22.0,519
What's a bird on the gun worth?,18.0,3.0,1.0,22.0,519
That Rooster kid is so cocky.,18.0,3.0,1.0,22.0,519
A fowl traitorous act indeed!,18.0,3.0,1.0,22.0,519
the decoys get dummer every year.,18.0,3.0,1.0,22.0,519
"Well, there are ""bird dogs"" so I guess he's a ""dog bird.""",15.0,2.0,1.0,18.0,519
How many birds in the bush are worth a bird on a barrel?,15.0,2.0,1.0,18.0,519
"After seeing that dumb decoy pasted to his rifle, I now know what the expression ""A Schmuck with ear-laps means!""",15.0,2.0,1.0,18.0,519
I think his plan is about to backfire.,14.0,4.0,0.0,18.0,519
Great likeness of Aunt Birdie.,14.0,4.0,0.0,18.0,519
That's the worst decoy I've ever seen.,15.0,2.0,1.0,18.0,519
I'm not sure. I left my binoculars back at the nest.,14.0,4.0,0.0,18.0,519
He seemed oblivious. Surely a bird on the gun was worth two on a branch.,14.0,4.0,0.0,18.0,519
Peter also saw him at a Trump rally.,14.0,4.0,0.0,18.0,519
There's Bird-a-dict Arnold!,15.0,2.0,1.0,18.0,519
She’s practicing riding shotgun for when we fly south.,14.0,4.0,0.0,18.0,519
Do you think he had to join the NRA?,15.0,2.0,1.0,18.0,519
Tweety always wanted the trophy lifestyle.,14.0,4.0,0.0,18.0,519
Talk about a bird in the hand!,15.0,2.0,1.0,18.0,519
"It's ok Mildred, he's shooting blanks anyway.",14.0,4.0,0.0,18.0,519
"Guys, I think it's a bird feeder!",15.0,2.0,1.0,18.0,519
Relax. They only shoot each other now.,14.0,4.0,0.0,18.0,519
"Whatever you do, don't retweet.",14.0,4.0,0.0,18.0,519
Looks like another little grouse for gun control.,15.0,2.0,1.0,18.0,519
Next comes the tweets wondering why she's attracted to the wrong type of men.,15.0,2.0,1.0,18.0,519
Now do you believe me dear? He's so not ready to go flying unsupervised...,18.0,5.0,0.0,23.0,519
He thinks he's part of the 1 percent,19.0,3.0,1.0,23.0,519
Did you start the timer?,18.0,5.0,0.0,23.0,519
"Irony, it's a beautiful thing.",18.0,5.0,0.0,23.0,519
Looks like entrapment to me.,19.0,3.0,1.0,23.0,519
Looks like Junior has a new shtick.,19.0,3.0,1.0,23.0,519
"Well, one in three IS pro-gun.",18.0,5.0,0.0,23.0,519
"I don't want to get philosophical, but we're only worth half as much as him.",18.0,5.0,0.0,23.0,519
Now I'm not sure what to believe about Bernie Sanders and guns.,19.0,3.0,1.0,23.0,519
He just loves messing with them!,18.0,5.0,0.0,23.0,519
Shouldn't they BOTH be pacing......,20.0,1.0,2.0,23.0,519
I thought YOU did the stay away from humans training!,18.0,5.0,0.0,23.0,519
She's exercising her right to sit on whatever stick she chooses.,19.0,3.0,1.0,23.0,519
She's gone to the Dark Side!,20.0,1.0,2.0,23.0,519
She's going to the NRA protest.,18.0,5.0,0.0,23.0,519
She needs to stop falling for the first guy who cocks a finger at her.,19.0,3.0,1.0,23.0,519
Good thing Robin sends out tweets constantly.,19.0,3.0,1.0,23.0,519
That's that 'brown-noser thrush.',19.0,3.0,1.0,23.0,519
He's got the fool going for 2 in the bush.,15.0,4.0,0.0,19.0,519
I guess that is the safest place to take a break.,15.0,4.0,0.0,19.0,519
I feel so betrayed! Leonard promised me the NRA membership application I found was just fodder for our nest.,15.0,4.0,0.0,19.0,519
We should teach him the meaning of a bird's eye view.,15.0,4.0,0.0,19.0,519
"Well, looks like Hank has become the sell-out I always knew he was...",15.0,4.0,0.0,19.0,519
He really traded his hunting dog in for that?,15.0,4.0,0.0,19.0,519
He told me he was inspired by the Tiananmen Square protester.,16.0,2.0,1.0,19.0,519
Looks like he is enjoying the sites.,16.0,2.0,1.0,19.0,519
"your kid has learned to fly, Muzzle Tov !",15.0,4.0,0.0,19.0,519
He better hide.............someone else may shoot both of them!,16.0,2.0,1.0,19.0,519
What on earth do you suppose she sees in him?,15.0,4.0,0.0,19.0,519
How's that for dramatic irony?,16.0,2.0,1.0,19.0,519
I still think military school was a bad idea,15.0,4.0,0.0,19.0,519
Do you think the bird's-eye view is better?,16.0,2.0,1.0,19.0,519
"No, we don't always have to flock together.",16.0,2.0,1.0,19.0,519
It's what the kids do Doris its a new thing they put a Bern on it,16.0,2.0,1.0,19.0,519
That's the old 'bird on the barrel' ploy. We're supposed to think he's bird friendly.,16.0,2.0,1.0,19.0,519
She's a spy.,16.0,2.0,1.0,19.0,519
So which one's the dumber animal?,16.0,2.0,1.0,19.0,519
Camouflage.,15.0,4.0,0.0,19.0,519
That poor bird doesn't know a perch from a birch!,16.0,2.0,1.0,19.0,519
"See, it's a cardinal sin.",17.0,0.0,2.0,19.0,519
we need to fly after two tweets and a squawk,15.0,4.0,0.0,19.0,519
They met at a Trump rally. She's always making choices against her own self-interest.,16.0,2.0,1.0,19.0,519
I didn't know you could get Twitter out here.,16.0,2.0,1.0,19.0,519
"He knows that's not a branch, right?",16.0,2.0,1.0,19.0,519
That stupid cousin of yours went over to their side.,15.0,4.0,0.0,19.0,519
hipsters...,16.0,2.0,1.0,19.0,519
Never trust double agents.,15.0,4.0,0.0,19.0,519
No telling what some will do for a free ride.,15.0,4.0,0.0,19.0,519
A bird on the gun beats two in the bush.,15.0,4.0,0.0,19.0,519
Rudy always seems to find the most unusual Internet travel sites.,15.0,4.0,0.0,19.0,519
They're both in existential crises,15.0,4.0,0.0,19.0,519
Stockholm syndrome strikes again!,15.0,4.0,0.0,19.0,519
A seeing eye bird?,16.0,2.0,1.0,19.0,519
I'll bet you 5 bucks he lasts the season.,15.0,4.0,0.0,19.0,519
Amazing! What did Bernie Sanders call him? The dove of world peace?,16.0,2.0,1.0,19.0,519
To the left!,17.0,0.0,2.0,19.0,519
Don't talk. He's trained his parakeet to listen for our calls.,16.0,2.0,1.0,19.0,519
Why do you think she likes him? I can't imagine them seeing eye to eye on anything.,15.0,4.0,0.0,19.0,519
"Smart, too close to shoot.",15.0,4.0,0.0,19.0,519
"Watch out, he's trying that old ""bird in the hand"" decoy again.",15.0,4.0,0.0,19.0,519
Damn starlings. Always showing off.,16.0,2.0,1.0,19.0,519
Do you think he thinks that decoy is going to work?,15.0,4.0,0.0,19.0,519
"Ballsy perch, eh?",15.0,4.0,0.0,19.0,519
It's that 'put a bird on it' meme.,15.0,4.0,0.0,19.0,519
I can't wait to read his tweet.,16.0,2.0,1.0,19.0,519
He's pulling a Bernie.,15.0,4.0,0.0,19.0,519
What a show-off.,15.0,4.0,0.0,19.0,519
"He said it's his Twitter handle.""",16.0,2.0,1.0,19.0,519
"You can hang him and lard him with bacon, but he just doesn't roast well.",17.0,0.0,2.0,19.0,519
Quid pro quo?,17.0,2.0,1.0,20.0,519
"He was triple-dog dared, so yeah...",16.0,4.0,0.0,20.0,519
He's a strong believer in the right to arm birds.,18.0,0.0,2.0,20.0,519
That's one ballsy bird.,17.0,2.0,1.0,20.0,519
She was anti NRA until he told her it meant No Robins Allowed.,17.0,2.0,1.0,20.0,519
Clearly a textbook example of a symbiotic relationship,16.0,4.0,0.0,20.0,519
We don't need to be quiet - he's hunting wabbits.,17.0,2.0,1.0,20.0,519
"''Well a bird in hand ...is worth us.""marshek3",17.0,2.0,1.0,20.0,519
I think she's drunk.,17.0,2.0,1.0,20.0,519
I'm going to twitter about it.,17.0,2.0,1.0,20.0,519
He's trying to see who has been shooting at us.,16.0,4.0,0.0,20.0,519
"You know, Chirpee always has Elmer's back.",16.0,4.0,0.0,20.0,519
He learned that trick by watching Looney Toons.,16.0,4.0,0.0,20.0,519
"For such a pretty little thing, she sure knows how to rub it in.",18.0,0.0,2.0,20.0,519
Whar hubris even for a stool pigeon!,17.0,2.0,1.0,20.0,519
Looks like Cindy has broken the glass ceiling at retriever school!,16.0,4.0,0.0,20.0,519
"Either he's one of those trained 'rear guard' service birds or he can't stand looking at that stupid hat.""",16.0,4.0,0.0,20.0,519
I can't wait until we're out of season.,16.0,4.0,0.0,20.0,519
"I heard he turned, and become a scout.",16.0,4.0,0.0,20.0,519
My compliments. He's your most lifelike decoy yet.,17.0,2.0,1.0,20.0,519
"Next up is Trevor, attempting the reverse piggy-back, otherwise known as ""Look behind you, stupid"".",17.0,2.0,1.0,20.0,519
"See, I told you that dog wasn't gonna last if he kept laughing at him.",17.0,2.0,1.0,20.0,519
His Twitter feed isn't nearly as interesting as you'd think it would be.,17.0,2.0,1.0,20.0,519
"Well, he is a purebred stool pigeon.",17.0,2.0,1.0,20.0,519
She'll do anything to get out of the nest and have fun and games with a guy she hasn't even met!,17.0,2.0,1.0,20.0,519
At least he didn't get into marijuana.,18.0,0.0,2.0,20.0,519
"As all wrens, he likes to brag.",17.0,2.0,1.0,20.0,519
One's cuckoo and the other's a bird brain,17.0,2.0,1.0,20.0,519
Larry always did like living on the edge.,16.0,4.0,0.0,20.0,519
Let's see how many of us they say HE'S worth.,17.0,2.0,1.0,20.0,519
I taught him to stay very close to his enemies.,17.0,2.0,1.0,20.0,519
What a traitor.,16.0,4.0,0.0,20.0,519
Send him another tweet.,17.0,2.0,1.0,20.0,519
"I can't tell if she's trying to be edgy, or is she edgy?",16.0,4.0,0.0,20.0,519
"The game’s out there, and it’s play or get played.",17.0,2.0,1.0,20.0,519
"He may be crazy, but I tell you, embedded journalists get all the chicks.",16.0,4.0,0.0,20.0,519
This is going south real quick.,17.0,2.0,1.0,20.0,519
That must be Bernie Sanders' bird.,17.0,2.0,1.0,20.0,519
Touch the butt!,17.0,2.0,1.0,20.0,519
I don't trust his Zip-a-Dee-Doo-Dah.,17.0,2.0,1.0,20.0,519
It's like Moby-Dick was stuck to the bottom of the Pequod.,18.0,0.0,2.0,20.0,519
Have gun will travel.,17.0,2.0,1.0,20.0,519
I heard he donated a great deal of birdseed to her foundation.,17.0,2.0,1.0,20.0,519
Look whose singing praises about the 2nd amendment.,16.0,4.0,0.0,20.0,519
Wow. Ted was not lying when he said the hunter's eyesight was bad...,17.0,2.0,1.0,20.0,519
You guys take the bush. I'll take the barrel.,16.0,4.0,0.0,20.0,519
"...No , it's still too close for comfort .",16.0,4.0,0.0,20.0,519
Our kid is bird-brained,16.0,4.0,0.0,20.0,519
She's waiting for him to reply to her tweet,17.0,2.0,1.0,20.0,519
"Looks like our son, Dan Quail, is standing firm.",17.0,2.0,1.0,20.0,519
It's his way of 'flipping the bird.' He calls it the gun barrel boogie.,16.0,4.0,0.0,20.0,519
He's a big supporter of gun control.,17.0,2.0,1.0,20.0,519
"Call me a dove, but the new background check law looks to be toothless.",17.0,2.0,1.0,20.0,519
"Ignorance is bliss, so let's keep quiet.",16.0,4.0,0.0,20.0,519
I have decided to take a different approach.,17.0,2.0,1.0,20.0,519
He always was a risk-taker.,17.0,2.0,1.0,20.0,519
"Duck, duck, goose.",16.0,4.0,0.0,20.0,519
I told you that there was a spy in our midst.,16.0,4.0,0.0,20.0,519
I don't think all is Zip-A-Dee-Doo-Dah satisfactual...,17.0,2.0,1.0,20.0,519
"They shoot horses, don't they?",17.0,2.0,1.0,20.0,519
Jeez. And I thought Fudd didn't have a clue.,17.0,2.0,1.0,20.0,519
"But he's not in hand, so how could we be...",16.0,4.0,0.0,20.0,519
He just has no foresight!,16.0,4.0,0.0,20.0,519
Larry likes to live on the edge.,17.0,2.0,1.0,20.0,519
A pilot bird. They never go extinct.,17.0,2.0,1.0,20.0,519
That's the latest Tweet from the NRA,17.0,2.0,1.0,20.0,519
See that Judith? They call that the 1%,17.0,2.0,1.0,20.0,519
I hear he's got his own bird bath.,17.0,2.0,1.0,20.0,519
"""Give us a TWEET when you get there.",16.0,4.0,0.0,20.0,519
"Ever since we were kids, he's always been first to call shotgun.",17.0,2.0,1.0,20.0,519
They're replacing us with younger birds who don't know sh*t from shinola.,17.0,2.0,1.0,20.0,519
I guess the early bird gets the buck,17.0,2.0,1.0,20.0,519
"As you said before, not every kernel pops.",17.0,2.0,1.0,20.0,519
I like her style.,16.0,4.0,0.0,20.0,519
Glad to see he's putting all that unpheasantness behind him.,17.0,2.0,1.0,20.0,519
