caption,unfunny,somewhat_funny,funny,count,contest
I fear he's a sitting duck.,19.0,3.0,0.0,22.0,519
He's a yellow-bellied stool pigeon and a red-breasted Benedict Arnold.,20.0,1.0,1.0,22.0,519
What time does junior go off duty?,19.0,3.0,0.0,22.0,519
"Going forward, let's not hang out with Mike anymore.",19.0,3.0,0.0,22.0,519
That's it. Next season we're writing Junior out of The Partridge Family.,19.0,3.0,0.0,22.0,519
"Apparently, he is a French pigeon.",19.0,3.0,0.0,22.0,519
Don´t pay any attention. It´s just a decoy.,19.0,3.0,0.0,22.0,519
That little twerp always calls shotty.,20.0,1.0,1.0,22.0,519
He's refusing to respond; he must be drawing a blank!,20.0,1.0,1.0,22.0,519
Don't be fooled. He does want two in the bush.,19.0,3.0,0.0,22.0,519
Wasn't he at Woodstock?,20.0,1.0,1.0,22.0,519
"Now, who's here a bird brain?!",19.0,3.0,0.0,22.0,519
The best offense is a good defense.,19.0,3.0,0.0,22.0,519
"Well, Jay always said ""The best defense is a shotgun offense.""",20.0,1.0,1.0,22.0,519
He must have tweeted our location.,19.0,3.0,0.0,22.0,519
"It,s the latest thing in bird watching.",20.0,1.0,1.0,22.0,519
Looks like Bertie decided to go with Tree-Mobile.,19.0,3.0,0.0,22.0,519
He's riding birdshot.,19.0,3.0,0.0,22.0,519
I'll never understand why they go for one in the hand.,20.0,1.0,1.0,22.0,519
"Oh crap, a canary.",20.0,1.0,1.0,22.0,519
She hasn't been able to stop showing off since she began the South Beach diet.,19.0,3.0,0.0,22.0,519
Now tell her to reguritate the worm into the barrell,20.0,1.0,1.0,22.0,519
I hear he works on commission.,19.0,3.0,0.0,22.0,519
Cousin Leroy's love of gun barrels will be the death of him yet!,20.0,1.0,1.0,22.0,519
A bird on a gun is better than two in a bun.,20.0,1.0,1.0,22.0,519
"I'm not surprised, he's no Birdie Sanders.",19.0,3.0,0.0,22.0,519
Good idea; let's all hop on that rifle barrel ...,19.0,3.0,0.0,22.0,519
"That's him, Elmers's stool pigeon.",19.0,3.0,0.0,22.0,519
"you have to admire George,he always like to live life in the fast lane",19.0,3.0,0.0,22.0,519
You know what they say: One on the gun is worth two of us.,20.0,1.0,1.0,22.0,519
"He doesn't care how many of us go down, he supports the 2nd Amendment....",20.0,1.0,1.0,22.0,519
Apostate!,19.0,3.0,0.0,22.0,519
That's a red breasted quisling.,19.0,3.0,0.0,22.0,519
It's the bluebird of happiness -- trust me it won't stay.,19.0,3.0,0.0,22.0,519
Probably should have told him I'm his mother...,19.0,3.0,0.0,22.0,519
Must be our lucky day.,19.0,3.0,0.0,22.0,519
I always told him to be brave and follow his dreams.,19.0,3.0,0.0,22.0,519
"""Shhh. It's a full-fledged male Eastern Checkered Hosap.",19.0,3.0,0.0,22.0,519
Putting oneself on the crosshairs is sometimes the safest position.,19.0,3.0,0.0,22.0,519
"NO, I said it first--Darwin Award! Darwin Award!",20.0,1.0,1.0,22.0,519
"Well, Henry guess our necks are saved today, that's one way to use a tweeter.",20.0,1.0,1.0,22.0,519
Would you believe he's a Bird Watcher?,20.0,1.0,1.0,22.0,519
Oh the irony of it all.,19.0,3.0,0.0,22.0,519
I think this vegan trend is finally catching on.,19.0,3.0,0.0,22.0,519
"One pheasant says to the other pheasant whispering ""I'm gonna go out on a limb here... that looks safe to me!""",19.0,3.0,0.0,22.0,519
"Two chirps from that war bird, and I advise we hit the dirt.",20.0,1.0,1.0,22.0,519
I told him the gun would just get stolen.,20.0,1.0,1.0,22.0,519
"I'd say he has a ""death wish""",20.0,3.0,0.0,23.0,519
He used to hunt for ducks.,20.0,3.0,0.0,23.0,519
I hear he joined the NRA.,20.0,3.0,0.0,23.0,519
"That Charlie, he'll go to the john wherever he feels like, no matter what.",20.0,3.0,0.0,23.0,519
Best D-U-C-K player I have ever seen.,21.0,1.0,1.0,23.0,519
He never buckles up. So reckless with guns!,20.0,3.0,0.0,23.0,519
Her last perch was on a podium.,21.0,1.0,1.0,23.0,519
Tweety always did like to live dangerously.,20.0,3.0,0.0,23.0,519
"Again, Freddy yelled ""Shotgun!"" before the others.",21.0,1.0,1.0,23.0,519
Little smarty called shotgun.,20.0,3.0,0.0,23.0,519
"When you think about it, maybe he's not so crazy after all.",20.0,3.0,0.0,23.0,519
See how safe guns are in the the good ole USA? I told you so!,21.0,1.0,1.0,23.0,519
He won't find us using a stool pigeon.,20.0,3.0,0.0,23.0,519
Send him a tweet saying the hunter has him over a barrel!,20.0,3.0,0.0,23.0,519
I guess he couldn't find a duck decoy.,20.0,3.0,0.0,23.0,519
This adds a new paradigm to the sanctuary debate.,14.0,2.0,0.0,16.0,519
Hope he's got more in that rifle than birdshot.,16.0,0.0,1.0,17.0,519
Don't you think Tweet is taking this Second Amendment thing a bit too far?,15.0,2.0,0.0,17.0,519
His chirp is our alert.,15.0,2.0,0.0,17.0,519
"He's a dirty violent no good son of a bitch,but he's our dirty violent no good son of a bitch .",15.0,2.0,0.0,17.0,519
He said he got the idea for a traveling home from that guy's RV.,16.0,2.0,0.0,18.0,519
They got him doing background checks.,16.0,2.0,0.0,18.0,519
"He is obsessed with that line from the Godfather Part II, ""Keep your friends close but your enemies closer.""",16.0,2.0,0.0,18.0,519
"Marge, I didn't realize that natural selection took the weekends off.",16.0,2.0,0.0,18.0,519
He insulted his mother.,17.0,0.0,1.0,18.0,519
He must be a left winger? You think!,17.0,0.0,1.0,18.0,519
He never forgave us when we told him that he was adopted.,16.0,2.0,0.0,18.0,519
A bird on the gun is worth two...,16.0,2.0,0.0,18.0,519
"Try new things, challenge yourself, and take control of your life!",16.0,2.0,0.0,18.0,519
I hear tweets better check Twitter.,16.0,2.0,0.0,18.0,519
Her branch moves.,16.0,2.0,0.0,18.0,519
"When she was tweeting ""I got you babe"" it was harmless enough, but ""If I could turn back time"" will be the end of her.",16.0,2.0,0.0,18.0,519
He's our resident canary.,16.0,2.0,0.0,18.0,519
He was never good at shooting the bird.,17.0,0.0,1.0,18.0,519
"How does he keep passing the background checks? Wait, what background checks?",17.0,0.0,1.0,18.0,519
"Is that the ""little birdie"" they are always talking about?",17.0,0.0,1.0,18.0,519
"Real bird brain, ain't he? Which one? Both of 'em.",16.0,2.0,0.0,18.0,519
We must be in 'Portlandia.',16.0,2.0,0.0,18.0,519
The decoys are more original this year.,16.0,2.0,0.0,18.0,519
"Obviously, Bert's running out of ideas for his suicide attempts.",17.0,0.0,1.0,18.0,519
I esteem myself more highly than that one on a gun.,17.0,2.0,0.0,19.0,519
It's the Brown-Nosed variety of the Yellow-Bellied Flycatcher.,17.0,2.0,0.0,19.0,519
"No worries, he's on our payroll now. He will lead him away from us!",18.0,0.0,1.0,19.0,519
'If only he knew......',17.0,2.0,0.0,19.0,519
"You can shoot now, Harvey, they aren't suspecting it.",17.0,2.0,0.0,19.0,519
"It makes sense. The old guy can't afford a real scope, and Fred hates ducks.",17.0,2.0,0.0,19.0,519
"Tell me again, what's the difference between commenselism and amensalism?",17.0,2.0,0.0,19.0,519
I've got $20 on Fred.,18.0,0.0,1.0,19.0,519
"Okay, your affair with that parakeet has its benefits.",17.0,2.0,0.0,19.0,519
"I agree, a bird in hand is worth two in the bush.",18.0,0.0,1.0,19.0,519
He's obsessed with that movie 'Dr. Strangelove',17.0,2.0,0.0,19.0,519
"Yeah, I guess it could be Storkholm's, but she looks more like a duck, no?",17.0,2.0,0.0,19.0,519
Thank goodness for the bluebird of safety.,18.0,0.0,1.0,19.0,519
That's how we put a bird on it.,17.0,2.0,0.0,19.0,519
"Don't blame the dove, it's the economy. He hasn't had work since Woodstock.",17.0,2.0,0.0,19.0,519
That still doesn't make you a Cuckoo bird!,17.0,2.0,0.0,19.0,519
Must be a right-wing.,17.0,2.0,0.0,19.0,519
"Don't worry, Daisy! Fear Exposure Therapy has been proven to work.",17.0,2.0,0.0,19.0,519
This life is for the birds.,17.0,2.0,0.0,19.0,519
I thought they cut Rifle Barrel Balance Beam from The Bird Olympics.,17.0,2.0,0.0,19.0,519
He only hunts Wabbits,17.0,2.0,0.0,19.0,519
What a suck-up!,17.0,2.0,0.0,19.0,519
"'Look, they're not speaking! She's giving him the cold tail feather.""",17.0,2.0,0.0,19.0,519
Now do you believe me when I told Burt was pretty clueless?,18.0,0.0,1.0,19.0,519
He's gun-shy. That's his new therapist.,17.0,2.0,0.0,19.0,519
"A yellow-bellied stool pigeon, if I'm not mistaken.",17.0,2.0,0.0,19.0,519
Did you hear? Blue hired that hunter for a song!,17.0,2.0,0.0,19.0,519
The hunt is rifling my feathers.,18.0,0.0,1.0,19.0,519
Uh oh...Tweddy's turned into the wind and you know what that means.,17.0,2.0,0.0,19.0,519
Son of a gun!,17.0,2.0,0.0,19.0,519
He is blinded by the camouflage.,17.0,2.0,0.0,19.0,519
I think he's technically still worth two of us.,17.0,2.0,0.0,19.0,519
I guess Frankie IS a big shot now.,17.0,2.0,0.0,19.0,519
"You're right, they're both clueless.",17.0,2.0,0.0,19.0,519
"Vilma, don't worry, our boy just likes making fun of these humans. He is warning our neighbors that humans with sticks on their shoulders could potentially hurt themselves.",17.0,2.0,0.0,19.0,519
I TOLD her not to up with that on-line dating service.,17.0,2.0,0.0,19.0,519
"Well, SO FAR he's kept his supporter under control",17.0,2.0,0.0,19.0,519
"I refuse to be his dinner! When Junior signals 'all clear,' grab his gun and shoot the old foggy dead!",18.0,0.0,1.0,19.0,519
There goes Tweety taunting the tourists again.,17.0,2.0,0.0,19.0,519
He will grow out of the rebellion soon.,17.0,2.0,0.0,19.0,519
"i am not sure which one is more clueless, either way they look relaxed and are enjoying the day.",17.0,2.0,0.0,19.0,519
"Fred is going to get in trouble trying to hook up with that decoy."" "" Yea. Let's stay and watch.",17.0,2.0,0.0,19.0,519
A bird on a gun is worth two in a bush.,17.0,2.0,0.0,19.0,519
aa,18.0,0.0,1.0,19.0,519
That looks to me like deconstructed birdshot.,17.0,2.0,0.0,19.0,519
Be assured: we will get a bang out of this!!!,17.0,2.0,0.0,19.0,519
Josh needs to check his nongame privilege.,17.0,2.0,0.0,19.0,519
She thinks she's the decoy's girl friend.,17.0,2.0,0.0,19.0,519
I'm not going for that jailbait!,17.0,2.0,0.0,19.0,519
He's hiding in plain sight.,17.0,2.0,0.0,19.0,519
"It likes guns, so it must be a Bernie Bird.",17.0,2.0,0.0,19.0,519
He'd better not sing like a canary.,17.0,2.0,0.0,19.0,519
I hope Uncle Eddy feels better about his manhood.,17.0,2.0,0.0,19.0,519
Larry's the best dog bird around.,17.0,2.0,0.0,19.0,519
One on a barrel is worth two in the bush.,17.0,2.0,0.0,19.0,519
"If that's what belongs to the NRA, not to be concerned.",17.0,2.0,0.0,19.0,519
The skinny ones have it so easy.,17.0,2.0,0.0,19.0,519
Junior is taking bird dog to a new level.,17.0,2.0,0.0,19.0,519
"Yeah, right, a bird on the barrel beats two in the bush—but doesn’t that guy look like Mark Twain?",17.0,2.0,0.0,19.0,519
My sense of worth is halved every time I see him.,17.0,2.0,0.0,19.0,519
"He makes a pretty good mole, for a bird.",17.0,2.0,0.0,19.0,519
He always tries to be the oddball.,18.0,0.0,1.0,19.0,519
"It's like my grandpappy used to say.....""a bird on the rifle is worth two on the branch!""",17.0,2.0,0.0,19.0,519
What a bird brain that guy has.,17.0,2.0,0.0,19.0,519
"He really goes on a limb, doesn't he?",17.0,2.0,0.0,19.0,519
"And they disparage us as ""bird brains.""",17.0,2.0,0.0,19.0,519
She looks single -- care to be my wingman?,17.0,2.0,0.0,19.0,519
"Too soon the companion, too late the target.",17.0,2.0,0.0,19.0,519
"Do you think hunters fear inner ear problems, and thus, the flaps?",17.0,2.0,0.0,19.0,519
All Right !!! Rusty's In The Club!,17.0,2.0,0.0,19.0,519
"You can call me crazy all you want, but this is the one place I CAN'T get shot, so...",17.0,2.0,0.0,19.0,519
I hope he's there to warn us.,17.0,2.0,0.0,19.0,519
It's Elmer and he's a pacifist.,17.0,2.0,0.0,19.0,519
"You can tell it's a South Korean Warbler. They always look north.""",17.0,2.0,0.0,19.0,519
"As my Dad always said, ""A Mate's Never Won on a Registered Gun""",19.0,0.0,1.0,20.0,519
He fell out of the nest.,18.0,2.0,0.0,20.0,519
One in the hand is worth two in the bush.,18.0,2.0,0.0,20.0,519
A bird on the gun is better than two in the bush.,18.0,2.0,0.0,20.0,519
Finch's friend is off to kill a mockingbird.,18.0,2.0,0.0,20.0,519
They appointed him 'bird protector' for our forest!,19.0,0.0,1.0,20.0,519
Sometimes you need a better outlook to live a better life.,18.0,2.0,0.0,20.0,519
"You know, he has been incorrigible ever since we let him hang with those showoff eagles up the tree.",19.0,0.0,1.0,20.0,519
"Oh, don't be chicken!",18.0,2.0,0.0,20.0,519
Talk about a lame duck,18.0,2.0,0.0,20.0,519
Do you think he's going to break out a spontaneous rendition of Purple Rain?,18.0,2.0,0.0,20.0,519
Relax. He only gets two shots to make birdie.,19.0,0.0,1.0,20.0,519
Let's call them Hillary and Donald,18.0,2.0,0.0,20.0,519
"That's not Jerry, is it? Actually, yeah. I think that is Jerry.",18.0,2.0,0.0,20.0,519
Should I tell him or should you?,18.0,2.0,0.0,20.0,519
He must be related to Bernie Sanders.,18.0,2.0,0.0,20.0,519
I dunno. Must have something to do with Trump.,18.0,2.0,0.0,20.0,519
"PSYCHO BIRD POOPS ON HUNTER PRANK!!!! - 1 month ago • 10,000,000 views PLEASE SUBSCRIBE TO MY CHANNEL",19.0,0.0,1.0,20.0,519
What an egghead.,19.0,0.0,1.0,20.0,519
"Hold your horses, I saw her first.",18.0,2.0,0.0,20.0,519
"He's nuts!"" ""I guess he really is qualified to run for POTUS.",18.0,2.0,0.0,20.0,519
I'm afraid that Jim has grown tired of seed.,19.0,0.0,1.0,20.0,519
Cuckold!,19.0,0.0,1.0,20.0,519
How can you Trump that?,18.0,2.0,0.0,20.0,519
"That way, when he tweets, he can see who his followers are.",18.0,2.0,0.0,20.0,519
"I guess it's better than a hunting dog, but still...",18.0,2.0,0.0,20.0,519
She always did try to lord her position over everyone.,18.0,2.0,0.0,20.0,519
He calls himself: Jack Sparrow.,18.0,2.0,0.0,20.0,519
"""Gee Marilyn isn't it lovely out during rabbit season!",18.0,2.0,0.0,20.0,519
I've told him more than once--ever since we moved to Wyoming his go-to strategy no longer qualifies as foolproof.,18.0,2.0,0.0,20.0,519
That's feeding the hand that bites you!,18.0,2.0,0.0,20.0,519
"I don't understand the appeal, but it's her life.",18.0,2.0,0.0,20.0,519
That's the bravest form of protest.,18.0,2.0,0.0,20.0,519
Penny for your thoughts.,18.0,2.0,0.0,20.0,519
Isn't that your nephew.....the lazy one who he hates to flap his wings!,18.0,2.0,0.0,20.0,519
hunter and the hunted can get along,19.0,0.0,1.0,20.0,519
Miranda always had a thing for old coots.,18.0,2.0,0.0,20.0,519
I don't think Edward is clear on the concept of bird hunting.,18.0,2.0,0.0,20.0,519
"Thinks he's safe, but never saw Dick Cheney hunt.",18.0,2.0,0.0,20.0,519
"Don't fall for it, he's coming for us!",18.0,2.0,0.0,20.0,519
Looks like two twits!,18.0,2.0,0.0,20.0,519
We needed a way to continue natural selection,18.0,2.0,0.0,20.0,519
"Now that takes balls, great big, tiny bird balls.",18.0,2.0,0.0,20.0,519
"Say what you like, but he really puts his money where his mouth is when it comes to Second Amendment rights.",18.0,2.0,0.0,20.0,519
"Look, it's a bird's eye view of the NRA",18.0,2.0,0.0,20.0,519
Don’s strong sense of opportunism allows him to overcome his small talons and ride that gun barrel to his destination.,18.0,2.0,0.0,20.0,519
"You had to tell her that we left her everything in our will!""",18.0,2.0,0.0,20.0,519
Harold never was too 'fly.,18.0,2.0,0.0,20.0,519
Her song is beautiful enough to soothe the savage breast.,18.0,2.0,0.0,20.0,519
"It's a gun, fly away! Haven't u learned anything from watching bambi",18.0,2.0,0.0,20.0,519
"It's only temporary. Hallelujah bye and bye, he'll fly away.",18.0,2.0,0.0,20.0,519
"Arms dealer? Nice job, if you can get it.",18.0,2.0,0.0,20.0,519
Why does our son have to act so wild?,18.0,2.0,0.0,20.0,519
"""Gotta love those ""Make Squabs Not War"" guys.",19.0,0.0,1.0,20.0,519
I think our net worth has just been greatly diminished.,18.0,2.0,0.0,20.0,519
I can see you didn't tell him about the downside of the birds and the bees,18.0,2.0,0.0,20.0,519
I never trusted Henry.,18.0,2.0,0.0,20.0,519
"He's been coming here for years, never fired a shot. He is not a very good NRA member in my opinion.",18.0,2.0,0.0,20.0,519
No one that I know considers Mr. WInslow a threat,18.0,2.0,0.0,20.0,519
One bad tweet and it's all over.,18.0,2.0,0.0,20.0,519
He must be from Portland.,19.0,0.0,1.0,20.0,519
Witness our son's coming of age,18.0,2.0,0.0,20.0,519
"What do you think Mabel, Darwin award winner or mate?",18.0,2.0,0.0,20.0,519
When did you first suspect that Tweety was a stool pigeon?,18.0,2.0,0.0,20.0,519
Didn't I read we are now an endangered species?,18.0,2.0,0.0,20.0,519
"Well, that gun has basically become an extension of his hand.",19.0,0.0,1.0,20.0,519
"We're about to see if ,""A bird in the hand is worth two in the bush.""",18.0,2.0,0.0,20.0,519
I thought you told him not to play chicken,18.0,2.0,0.0,20.0,519
Must be that Vermonter.,18.0,2.0,0.0,20.0,519
Now is not the time to feed Junior!,18.0,2.0,0.0,20.0,519
"It will be just like Cyrano, I'll whistle and you fly out.",18.0,2.0,0.0,20.0,519
Remember when the species barrier was inviolable?,18.0,2.0,0.0,20.0,519
She's a firm believer in gun patrol.,18.0,2.0,0.0,20.0,519
It's part of the initiation.,18.0,2.0,0.0,20.0,519
Tweet!,18.0,2.0,0.0,20.0,519
"Now, if that ain't the ultimate tweet!",18.0,2.0,0.0,20.0,519
Bird in the bush 1: Wait...shouldn't that bird be in his hand??? Bird in the bush 2: WAIT a MINUTE...that's a decoy !!!!!,18.0,2.0,0.0,20.0,519
"Stay alert - technically, he's not 'in hand.'",18.0,2.0,0.0,20.0,519
He's safe. There is no app yet.,18.0,2.0,0.0,20.0,519
Pamina thinks she's so hot 'cause Herr Mozart takes her everywhere.,18.0,2.0,0.0,20.0,519
"That's Doug. You know, ""from his cold dead talons"" Doug.",18.0,2.0,0.0,20.0,519
Jr. has really taken to hunting.,18.0,2.0,0.0,20.0,519
"…so I told Jerry, ‘That’s Bernie Sanders!’",19.0,0.0,1.0,20.0,519
I guess a bird in the hand is really worth more than two in the bush.,18.0,2.0,0.0,20.0,519
"Think he'll regret calling ""Shotgun!""?",18.0,2.0,0.0,20.0,519
He'll need more than one gun to kill the two of us!,19.0,0.0,1.0,20.0,519
I think his plan is to build a nest out of the mustache.,18.0,2.0,0.0,20.0,519
Looks like Bob White is now Peep the sight.,19.0,0.0,1.0,20.0,519
He's dumber than Elmer Fudd.,19.0,0.0,1.0,20.0,519
"The hunter's looking to find birds to kill, and we're the ones with the ""bird brains.",18.0,2.0,0.0,20.0,519
He thinks he's a bird colonel.,18.0,2.0,0.0,20.0,519
He must be an animal rights hunter.,18.0,2.0,0.0,20.0,519
Hey Tweety - Tweet This !,18.0,2.0,0.0,20.0,519
"We may have to re-evalutate this ""two-in-the bush"" approach.",18.0,2.0,0.0,20.0,519
"Oh look, Walter launched his manned satellite branch.",19.0,0.0,1.0,20.0,519
Know thy enemy. Shi. No Tzu.,18.0,2.0,0.0,20.0,519
Her parents think she is some kind of genius.,18.0,2.0,0.0,20.0,519
"Polly's decided to seek re-election, I see.",18.0,2.0,0.0,20.0,519
"""I hear she left a bald eagle for him"".",18.0,2.0,0.0,20.0,519
So a little birdie told him so.,18.0,2.0,0.0,20.0,519
See - feeling disenfranchised can make one a traitor,18.0,2.0,0.0,20.0,519
"i guess that's what they call a ""peep sight"".",18.0,2.0,0.0,20.0,519
Are you going to tweet him or shall I?,18.0,2.0,0.0,20.0,519
I guess you're not being paranoid; he IS targeting us specifically.,18.0,2.0,0.0,20.0,519
We're a little more gun-shy.,18.0,2.0,0.0,20.0,519
They met when he was skydiving over Yellowstone. They share a love of danger.,18.0,2.0,0.0,20.0,519
he's never just one in the hand or two in the bush.,18.0,2.0,0.0,20.0,519
"Once he finds bird crap on his rifle, he'll be so angry he won't be able to shoot straight.",18.0,2.0,0.0,20.0,519
"I've heard of ""a bird in hand,"" but this is ridiculous.",19.0,0.0,1.0,20.0,519
He traded his life for a position as rear guard.,18.0,2.0,0.0,20.0,519
Turncoat! I bet he used to be a Democrat!,19.0,0.0,1.0,20.0,519
Another NRA member: National Robin Association,19.0,0.0,1.0,20.0,519
He ain't worth us!,18.0,2.0,0.0,20.0,519
I'll never understand why we signed that extradition treaty with Ted Nugent.,18.0,2.0,0.0,20.0,519
He was always a social climber,19.0,2.0,0.0,21.0,519
"First Bernie gets one, now everybody wants one.",20.0,0.0,1.0,21.0,519
I guess that's always the risk with public rush tickets.,19.0,2.0,0.0,21.0,519
"He has no fear. Last week, he took a dump on Trump.",19.0,2.0,0.0,21.0,519
"Dude, I bet that it is an interesting rear sight aiming experience.",19.0,2.0,0.0,21.0,519
When doves cry.,20.0,0.0,1.0,21.0,519
The other two are still in the bush.,19.0,2.0,0.0,21.0,519
I always knew he was a bit of a Judas,19.0,2.0,0.0,21.0,519
Life on the edge. She's probably safer there than we are here.,19.0,2.0,0.0,21.0,519
"Why didn't we think of that, pose as decoy.",19.0,2.0,0.0,21.0,519
They're on sentry duty as a team.,19.0,2.0,0.0,21.0,519
"I told that bird he needs his eye's checked, but is too vain to wear glasses.",20.0,0.0,1.0,21.0,519
Tattle Tit,19.0,2.0,0.0,21.0,519
"Just go give her a little peck. Trust me, it will blow your mind!",19.0,2.0,0.0,21.0,519
got to be a decoy.,19.0,2.0,0.0,21.0,519
Woodstock he's not.,19.0,2.0,0.0,21.0,519
A bird on the barrel never quailifiess.,20.0,0.0,1.0,21.0,519
I think it will take more than that one to make two in the bush.,19.0,2.0,0.0,21.0,519
And to think he used to terrorize the neighborhood!,19.0,2.0,0.0,21.0,519
"Some type of young pigeon---a stoolie, I think.",19.0,2.0,0.0,21.0,519
Never heed the call of the Judas Bird.,19.0,2.0,0.0,21.0,519
How many birds in the bush are worth one on the gun?,19.0,2.0,0.0,21.0,519
Birdie Sanders seems to be changing his tone.,19.0,2.0,0.0,21.0,519
Don't move!,20.0,0.0,1.0,21.0,519
"You have to hand it to clay, he's always up for a challenge.",19.0,2.0,0.0,21.0,519
Bernie? Naw!,20.0,0.0,1.0,21.0,519
Robin actually convinced him to go vegan except for the occasional worm.,19.0,2.0,0.0,21.0,519
Global warming is creating some strange bedfellows!,19.0,2.0,0.0,21.0,519
Backfire!,19.0,2.0,0.0,21.0,519
Always grabs the safest spot for himself.,19.0,2.0,0.0,21.0,519
I've got to stop snacking at that nearby marijuana farm.,19.0,2.0,0.0,21.0,519
What's the saying -- a bird on the gun is worth two in the bush?,20.0,0.0,1.0,21.0,519
Kids are so reckless these days.,19.0,2.0,0.0,21.0,519
Relax! Wire the two in the bush.,19.0,2.0,0.0,21.0,519
Do you think he has any idea where he's perched?,19.0,2.0,0.0,21.0,519
Cheeky mockingbird.,19.0,2.0,0.0,21.0,519
Brown beaker,19.0,2.0,0.0,21.0,519
There goes that snitch,19.0,2.0,0.0,21.0,519
He's worth as much as both of us put together.,20.0,0.0,1.0,21.0,519
Now That's A Real Cuckoo Bird.,19.0,2.0,0.0,21.0,519
Background checks for American gun owners are quite minimal.,19.0,2.0,0.0,21.0,519
Rumor has it he shot her partner.,19.0,2.0,0.0,21.0,519
Not in season show-off!,20.0,0.0,1.0,21.0,519
Watch out! He's a shill.,19.0,2.0,0.0,21.0,519
She was impressed by Tiananmem Square,19.0,2.0,0.0,21.0,519
How does that saying go again?,19.0,2.0,0.0,21.0,519
I've heard of symbiotic relationships but that's just a plain death wish.,19.0,2.0,0.0,21.0,519
You think she's got his back?,19.0,2.0,0.0,21.0,519
You can't tweet something like that.,20.0,0.0,1.0,21.0,519
I'm not sure encouraging his inner bird was such a good idea.,19.0,2.0,0.0,21.0,519
I always knew Frank was a real Benechick Arnold.,19.0,2.0,0.0,21.0,519
I wonder what the world would be like if there was no inherited wealth.,19.0,2.0,0.0,21.0,519
Your delusion is encroaching on our recess.,20.0,0.0,1.0,21.0,519
IT'S IN HIS NRA,19.0,2.0,0.0,21.0,519
Looks like junior heard us talking about how much we enjoy barrel tasting!,19.0,2.0,0.0,21.0,519
nope that decoy just ain't working,19.0,2.0,0.0,21.0,519
"We’re safe, Cheney looking for Harry Whittington",20.0,0.0,1.0,21.0,519
PSSSSST..hey Harvey look left! look left!,19.0,2.0,0.0,21.0,519
That little bird won't tell him very much if he doesn't turn around.,19.0,2.0,0.0,21.0,519
"Doesn't he understand what ""One in the hand"" means?",19.0,2.0,0.0,21.0,519
"There goes Junior again, getting a free ride instead of flying.",19.0,2.0,0.0,21.0,519
Ira's last tweet mentioned Stockholm Syndrome ..poor guy.,19.0,2.0,0.0,21.0,519
Bob lives on the edge. He is the one that got Dick Cheney to shoot Harry Whittington in 2006.,20.0,0.0,1.0,21.0,519
Nuts . . . We forgot to caution our naive new flyer about some real flight risks!,19.0,2.0,0.0,21.0,519
Phil thinks he's such a rebel. Wait until the mustached man gets a load of this.,19.0,2.0,0.0,21.0,519
Now I can see the benefit of a symbiotic relationship.,20.0,0.0,1.0,21.0,519
This is so bizarre -- we're not in a Trump cartoon.,19.0,2.0,0.0,21.0,519
Let's be grateful that junior didn't fly away to join ISIS!,19.0,2.0,0.0,21.0,519
"She said, ""Hi-ho, the derry-o. I'll take a shot to land that farmer in the dell.""",19.0,2.0,0.0,21.0,519
Elena's just not the same without Nino.,19.0,2.0,0.0,21.0,519
I wonder which bathroom he is going to use.,19.0,2.0,0.0,21.0,519
Don't be fooled. It's a Pileated Gunsight.,19.0,2.0,0.0,21.0,519
Shhhh...Not a PEEP!,19.0,2.0,0.0,21.0,519
Do you think he knows he's a hotshot?,19.0,2.0,0.0,21.0,519
"I don't think he got what we meant by ""tweeting out activism.""",19.0,2.0,0.0,21.0,519
They call it a 'shotgun roost.' They're all the rage in New Orleans.,19.0,2.0,0.0,21.0,519
Bird tweets aim so he just misses.,19.0,2.0,0.0,21.0,519
"You know, I thought she was acting just a little too flirty and asking too many questions the last time we were over at the corn field.",20.0,0.0,1.0,21.0,519
He's doing it for the vine.,20.0,0.0,1.0,21.0,519
We really need to get glasses for Junior!,19.0,2.0,0.0,21.0,519
That probably will work better than our lame camouflage plumage.,20.0,0.0,1.0,21.0,519
If only he had a bird's eye view.,19.0,2.0,0.0,21.0,519
I wonder who won the caption contest,19.0,2.0,0.0,21.0,519
I knew her yellow feathers spelt trouble.,19.0,2.0,0.0,21.0,519
Sometimes the things you're looking for are right next to you.,19.0,2.0,0.0,21.0,519
