If I didn't bake the pie, and you didn't bake the pie, I think we're not alone!
Now you're sure: no peanuts, gluten, lactose, apples?
Now we just need a kitchen.
I remember nothing in His admonition about cooked apples.
He didn't say nothin' about apple pies.
I dunno, it's sure tempting.
Looks delicious, but I'm not supposed to eat apple.
Oy, it couldn't be cherry or blueberry?
I asked for a sandwich.
Of course he'll like it, why wouldn't he?
Smells delicious, but I heard the after-taste stays with you.
I love a bake sale !
It's tempting, but I'm on a diet.
Pot pie? Again?!
I got this recipe from the cookbook "101 Ways to Eat Forbidden Fruit".
I guess now that it's cooked it shouldn't disagree with me.
SNAKE said it was sinfully delicious and gluten-free!
So you have yet another headache..?!
Is it Thanksgiving already?
Have you seen my phone any where?
Alright, but you still can't sew or do laundry.
But that pie has no topping... it's NAKED!
You used the last of the apples? This changes His myth.
Just a passionate prelude to the BIG apple?
How did you peel the apples? How did you bake it? Is this some kind of anachronistic joke?
This "Mom" guy is getting our asses kicked outta here.
This is my cheat eternity.
Snake says just do the apple. The pi will never end
I dunno...I still think calling it "apple pie" instead of "Forbidden Tree-fruit pie" isn't going to get us off on a technicality.
Forbidden pie !!!!!
It’s tempting, Eve. But I’m already maxed out on my weight watcher points.
Smells like apple to me.
That is soooo tempting...is there a gluten free option?
I suspected the old man's idea about apples were half baked.
First, let's get something straight. Er, gluten-free?
Oh, Eve, how lovely, but I really don't deserve this!
Eternal paradise for a peach pie? I tell you what. Make it an apple pie, and you got a deal.
It's just not possible, Eve...there's no oven here!
Tempting, but is it paleo?
Tempting, but you know what He said about gluten.
That's some hot piece of pie baby!
But the landlord said any more baking and we loose our lease.
I guess it's paleo since we're paleo.
How do you even know about teen sex comedies?
What am I supposed to do with this? I'm gluten free.
"Say No To This", he thought.
It's gluten free? Well, I'm sure He'll let this one slide.
I'll google if it counts baked into a pie.
Eve, you know I've gone gluten free.
I don't know, I've never eaten peach pie before.
Could we just once have blueberry?
The first Phyllo-stines.
A bun in the oven?
Here we are getting second chance and you are bringing me a freshly baked pie?
But I'm doing gluten free...
I guess one slice can't hurt since it's gluten free
Oh, no! How many apples
Yes, it is tempting, but is the fruit sustainable?
Tempting. You say it's glutton-free?
How can I be sure there's no gluten?
I prefer pumpkin.
Our naked dating show was bought by Pat Robertson?
Is having it a'la mode a sin?
You said you didn't like raw.
Where did you get the recipe for a mock apple pie?
Apple pie? Well, if you insist.
You obviously don’t have Tom Brady’s jersey.
Oh good, I was getting tired of all those berries.
I love your apple pie, but whoever writes and prints the Bible in the future is going to have to do alot of editing
You were supposed to make LEMONADE!
I'm not sure if I like rhubarb.
It can't be sinful. We haven't eaten the apple yet.
It looks great, but I'm on a gluten-free diet
Is it American pie?
That better be gluten-free.
How good is it?
I don't know, I think Eve will be pissed is she smells that pie on my breath when I get home.
OK. Zero transfat, but is it paleo?
Is that your apple pie?
Original Sin and Forbidden Fruit are both great names for a pie, I just don't think that's the big issue here.
Pie my asp! You can't snake charm your way out of this.
Didn't we try that last week?? All I got was diarrhea - not any smarter at all!
What ... a dish!?
forbidden fruit pie?
Wow the Easy Bake Oven hasn't been invented yet.
You're suggesting I'm not patriotic? I don't even know what that means.
Diet schmiet, what's one more slice in the grand scheme of things?
HAPPY PIE DAY
And so the serpent realized it was too late, Eve had already sold her soul for a baking oven.
Tempting...but you know I'm gluten-free, right?
I think you missed the rule about baking on Sundays.
Is it apple? Please tell me it's apple.
It doesn't count if it's in pastry.
It's the gluten I'm worried about.
Eve, it was just a raunchy late night comedy and that looks really hot,
iWantyou.
Oh Eve, not that aphrodisiac pie again!
Are you sure it is blueberry?
Oh, more apple? I was longing for a cherry.
The serpent swears it's gluten-free?
Does this mean I'm your huckleberry?
Apple pie is an anachronism.
I'll have mine a-la-mode please.
Here you go again, trying to get us in trouble...
I don't care if it is gluten free. It's still not right.
I dunno - it doesn't smell like meat pie.
So you're the one who used up the last of the flour.
--" Special delivery from Las Vegas, courtesy of the snake".
Ok already, Let's get on with it!
But I thought carbs were forbidden?
Ahhh Honey it looks and smells great but you know I am gluten free
Save the pie until the travel ban's been lifted.
You got the fruit from the big tree?
But it doesn't smell like rhubarb.
Ehh, I'm partial to pumpkin.
Apple flavor.....right?
Damn it Eve, it is not supposed to be forbidden fruit pie!
It doesn't smell like chicken pot pie.
Since it's just the two of us, I guess we're going to need a to go bag.
Eve, which version of Apple pie is this?
So it's a trade?
If that's not Vegan then one of us is gonna have Hell to pay!
Something different?
The Fruit of knowledge won't increase your ability to do math in p form...
It's not me, it's you
Aw Geez, I'm allergic to gluten
So, it's not banana cream, and it's not blueberry...
God didn't say anything about apple pie....did he?
I only wanted an apple.
Eve, Please tell me that is a meat pie.
Just like mother used to make.
Have a bite. It won't spoil your appetite.
Trying one of my Mother's recipes was just a suggestion.
Don't worry, it is not apple pie.
I really don't know what to say.
Let us call the ratio of the circumference to the diameter "Pie". And then let's tell people that it's exactly 3.
Where did you find cornstarch?
You're spoiling me--Lilith never set foot in the kitchen.
Tarte Tatin? You shouldn't have.
Did you make that for show or for Eden?
I thought I told you--I don't like apple.
Can you come up with something other than apple pie?
I love apple pie, but are you sure it's gluten free?
Fig pie? The leaves gave me a rash!
I can do forbidden fruit, but no gluten, right?
Thanks, but an Apple will do.
This is tremendous rhubarb pie, believe me.
Is it an apple pie ?
So you're saying they are better baked? What do I know...
That had better be peach!
You know I'm gluten free, right?
Technically, it's now compote.
Any spoon on you?
A la mode again?
But I'm on the paleo diet. I can't have Original Sin.
But God said, "No carbohydrates"!
Instead of sex, yeah I'll try a piece
"It's an apple pie, Eve! Like, just -- apples! As in... you know -- what you ate to get us kicked out of Eden? Geez, God clearly didn't make you out of one of my funny bones, did he? Have a sense of humor, why don't ya!?" #FirstCreationProblems
The actual 'original sin.'
Looks tempting but I'm gluten free.
Apple Pie - Go ahead taste it
Seasoning a cast iron skillet is intense these days!
I'm hoping it's apple?
I thought you said it comes with vanilla ice cream.
I don't like surprises.
I might not have taken the plain apple, but now.
You think that's not a bad apple pie?
What did God say about gluten, again?
A Mac would have been cleverer
I don't think the apple pie was a good idea.
This is the real deal Adam, enjoy it while you can. One day all we will have to choose from are macaroons, cupcakes and cake pops and everyone will forget how it all started."
If it's not low fat, low sugar, and gluten free I just can't eat it.
Did I see the "Original Sin" dessert on the menu?
It came from the Tree of Knowledge? Better not.
I am gluten-free now. How about an apple?
I am trying out the Snake's pie recipe.
So that's what you did with my stash!
Are you sure it's apple? Smells like Kiwi.
Why do you always insist on showing me what you had for lunch? There's an app for that.
Did you make the crust gluten free?
I eat only fresh apples
Dear, it smells divine, but will it be difficult to digest?
Looks good, but I was hoping for snake tarts.
Pie is the new forbidden fruit.
Wow babe, you're something-- Knowledge and Splenda!
I thought you knew that I'm gluten-free.
You got it wrong. That's not the way to my heart.
Pot Pie is not a good idea, we should just smoke the weed in our garden .
There is no shame or sin in your pie game.
But a plain apple would've been gluten free.
Hopefully it's not just another strawberry rhubarb!
I'm sorry but I don't like cinnamon. How about a plain apple next time.
Clever dodge on the apples but I'm gluten free.
Honey, you know I'm gluten free...
Forbidden fruit aside, does it contain gluten?
Just a guess, but I'd say its circumference is right around 3.14.
When you're given lemons you make lemonade and when you're given apples...you make apple pie!!
That is the most precious thing I've ever seen!
Thanks, but it's too hot to wear.
It's mock apple pie.
umm, is this vegan AND gluten free? You know how gluten makes me bloat.
It smells delicious but I don't think I can eat that all by myself.
I hope that's boisenberry!
Were you Abel to add any sugar Cain?
Did you eat one to get the recipe?
The presentation is indeed tempting, Eve, but is it gluten-free?
OK, now can I have a little ice cream on it?
Uh, reminds me of my first wife.
Just like mom's.
Does that pie fit my new Paleo diet?
While I agree there's always room for dessert, is it really worth the shame at our nakedness?
Are there nuts in that?
Does the president really believe we'd fall for that?
That apple pie sure looks hot, Eve!
Does this set a bad precedent?
The real story here is why are there so many illegal leaks coming out of Washington?
Sorry, baby -- I'm cutting out carbs.
No! No! No!..I said apple pie, not blueberry pie!
My little serpent friend here says you can have the leftover apple.
I bought it down the street at Adams Apple Bakery and Pie Shop.
Let me apologize in advance.
Sorry, babe. I'm doing this Paleo diet.
Gluten-free or not, I still think it's wrong.
Yes, Adam, artisan...A-R-I-T-I-S-A-N
Eve... where did you get the apples for that pie?
Is it a Antony Bourdain moveable feast ?
I appreciate that you made it gluten-free, but I a rather stick with Paleo.
I just feel like it's a sin to make it with anything other than a Granny Smith.
Whoa, I gotta stop doing VR porn when I'm hungry.
Honey, how did you get the fire going without me?
How can this be?
I hope that isn't one of Lilith's old recipes.
Are you sure it's allowed on our paleo diet?
You want me to stick my what, into where?!?
Apple turnover ? No, thanks...apples do not agree with me.
Apple spy.
pssssssss a little gluten just this once won't kill you.
Is that gluten free?
Those apples smell great, but is the shell gluten free?
But, we just got approved by the co-op board.
Look on the bright side, we're both into fashion.
so that's a vagina?
It's like - we do love you, Lord. And we FEAR you. But - we really wanna to eat you.
...What a riboff.
The tree of the knowledge of good and evil pie DOES have a certain ring to it.
And it's gluten free?
I was hoping for one like mom used to make.
You have found a way to my heart.
Where did you learn to do that with apples?
Actually... I'm off carbs. But thanks!
I thought pie was in the sky.
Whoa, I think I better eat one of them apples too!
Apple pie, really?
Sorry Eve, Marie Callender was just here.
Are you sure? The label said "made with real fruit"...
It smells real good, but did you use organic apples and full grain flower?
He didn't say anything about byproducts.
Is it too late to eat out?
If it is strawberry, thank you. If it is apple, give it to the asp.
the forbidden pie
Is there gluten in it? You know I shouldn't eat gluten...
Oh right, whipped cream and clothes.
A pastry exception? If only He hadn't repealed those regulations.
I'm not sure gluten-free is going to cut it.
Is it still forbidden if it's been at 350 for an hour?
Yet another version of the same temptation?
It looks and smells so good, wherever did you get the recipe!
They were all out of forbidden fruitcake.
I said I wanted lemon meringue, and you bought apple. Typical.
The Tree of the Knowledge of Good and Evil pie...now that's a mouthful
Could we say the filling not from THAT tree?
Let's eat it seriously and not literally.
I like the part about acquiring wisdom. But I'm not sure about taking you shopping for clothes for the rest of our lives.
I suppose that's one way to get around to eating an apple
Well, we don't have a grandma, so this will have to do.
Wow it sure smells like apple pie, but it didn't brown at all.
You wouldn't be tricking me would ya?
Take and eat...
I like a homeless man with style.
Hey, I signed up to lie for one apple. Now what?a
I get the whole "American as apple pie" thing, but I'm pretty sure alternate facts don't apply here.
With all that gluten, now it's really forbidden.
How sweet of you, but I don't do gluten.
Too complicated.
Is that snake turd pie??
I'm not so sure. God said I was already 'great.'
Don't tempt me into sabotaging my resolution.
Trying to tempt me with a forbidden fruit PIE this time? Now t hat's a lot of crust!
God warned me about gluten.
I don't want it to come between us.
What knowledge you have gained. Apple pie and microwave. What more does mankind need?
But 'pre-heat' sounded so wrong, honey.
Hey Sugar, your overture to our Sin-phoney?
Who can say whether fruit pie is fruit or not?
The first advertiser.
Sure, apple pie is tempting. But where can you go to get a good cigar around here?
So no longer a fruit, technically speaking, let alone forbidden fruit?
Is that the apple pie of wisdom? I know someone out in DC who could really use some of that about now.
I'm sorry honey, but that's not on the Paleo diet. Did my mother give you that recipe?
Trust me, it's organic and non-gmo.
I say beware of pythons bearing pies.
Are you sure it's He won't punish us on our cheat day? I still think it's a half baked idea...
I totally would but I'm off gluten
Trump built the wall. There is no fresh produce.
You sure know how to please a fella!
Oh, you were talking about this cherry pie.
Hope that is apple pie
You have no idea how long it took to cook with no oven.
That God created convection ovens before he created television kind of tempts me to do something I might regret.
Honey, are you sure that's gluten-free?
Cherry pie? My favorite.
That better be a blue berry pie!
What, no fork?
Not that forbidden fruit.
Apple pie I presume?
Please tell me that's gluten free.
Geez, I don't know...I'm trying to count my apostasies this week
That's great. Maybe we can stay 'cause you made a pie.
Despite our enduring and profound intimacy, I never suspected you had a solar oven.
Wait. Are you sure it's gluten free?
Pi o us....Now?
Mmm... apple. My favourite.
Well, if you're absolutely certain it's gluten-free . . .
I think He'll understand since I've gone gluten-free
An American Pie ? Won't be biting into that.
I'm sorry. I've had to give up gluten.
Now I'm supposed to take a bite of your cream pie?
It's my first hyper-local pie.
I was told He was crusty.
All that knowledge, and all you come up with is a @#*!%$z pie?
So it's only seven percent eternal damnation?
Hath it no gluten?
I hope it is an apple pie.
Did you ever feel you were just on the most fertile ground to drop a good "pick-up" line, but still might blow it?
It's blueberry.
Very tempting, but I'm watching my weight.
I'm about ready to be done with this raw food kick too but is it our cheat day already?
Well, I think its okay if it's gluten free.
You baked Him another apple pie? Goodbye for good, Eden.
Is that gluten free?
Whoa!! A value-added product!
That's impressive, but I'm gluten-free.
Actually it could be any kind of pie.
You’re going to burn your hands, sweetheart—they haven’t invented potholders yet.
I'd love to, but God told me to avoid gluten.
Is that apple pie?
Is that ANOTHER recipe you found on Sinterest??
Is it American pie?
We can outsmart that serpent. Let's create a smash-hit comedy and not actually eat the pie.
Do you have any flavors other than apple?
I'd like to make a counter-offer.
let's see, pi equals 3.14159, so....
Seems chancy... ya know with the whole nakedness and paradise thing.
Are you sure you picked the right berries? I see the vultures heading this way!
Meat, vegetables, and...apples! How did you bake it?
What that snake serves up is NOT 'As American As Apple Pie'.
I guess you're right, he only said not to eat it raw right off the tree, he'd didn't say anything not eating it cooked.
Never mind, I'm not hungry.
That looks tempting, but I'm gluten-free these days.
He'll have to forgive us after tasting this forbidden fruit pie
Why am I thinking Snake Oil
Uh oh. Give that to the snake. I have to run to the orchard.
Sorry, I'm in a cherry mood today.
A la mode?
I hope that is not a fruit pie
Can I have ice cream with it?
That better be a dam good pie.
Um, did I say apple? I meant peach.
It's so like Him to forget the fork.
I can't remember. What is the ratio of a circle's circumference to its diameter called?
Oh, I forgot to mention . . . I only like apple!
I'm trying to cut back on gluten.
Eve, is that gluten free crust!
OK, you're right. I can be tempted by the flakey crust recipe from the Food Network
If you make a gluten-free version, THEN I'll be tempted to eat it.
Is that your pie?
As Eden as apple pie
you little snake..what a surprise!
Well, the McIntosh apples aren't exactly forbidden, but they are lousy for baking.
I was hoping for a figgy pudding pie.
It's tempting but too many carbs.
Where does It go?
Gee...let me guess... is it an apple pie??!!
OMG! I forgot the ice cream.
"??p!" - " WTF!" ??
Did you already eat one? Cuz how do you know how to bake?
Um... I prefer cherry.
Thanks very much, but I have already had dessert.
I appreciate the effort. But, I already said I'd eat the apple.
Unfortunately, I don't think the ability to make an apple pie will convince U.S. Immigration that we aren't a threat.
Decisions! Decisions!....Where's the blond with the apple?
Gosh, Eve, that's really sweet, but is it gluten-free?
I'm not that crazy about apples but I will try it.
Fried, boiled or baked, Snake is splitting hairs. The warning was, "No apple eating."
O.K.? Now I'm totally confused?
So, Satan presumes knowledge enters finite creatures in slices.
''Apple? Didn't you say cherry this morning?''
Well, it certainly is tempting. And you're sure it was not made from THAT apple!
Come on, you know you want to
OMG, this is sinfully delicious!
Nice pie.
Did you say Apple Pie!
MayI have that ala mode?
I prefer mine half-baked.
I understand about not eating them from the tree, but no one can resist fresh baked goods.
Something tells me the pie's not gluten free either.
Any chance that's gluten free?
We won't have enough so lets split that before we create civilization.
Let me guess. Peach? Blueberry?
You know I prefer peach.
Original Tin
I hope it's gluten-free,
For me? You really shouldn't have.
Adam, freshly baked apple pie from McDonalds!!
See tasting that apple wasn't all bad!
Oh, come on. It's gluten free.
Can't you just bake a cake for once in your life?
Well, my trainer told me it does not count as a fruit if it is in a pie.
No. Cooking obliterates most of the vitamins in food.
What do we eat it with?
Please tell me its a cheery pie
Ok I know it's a peach pie but...
Darnit! I should have picked up some ice cream when I was at the Mini-Mart!
Tell me it's gluten free.
I sure hope you didn't use those apples from that beady eyed neighbor of ours.
I can't eat that right now, I'm in a state of ketosis.
Sorry, I only consume gluten-free food products and ethically-sourced produce.
I know apple pies are forbidden, but this a fine-apple pie.
You didn't bake this the Oven of the Knowledge of Good and Evil, right?
Don't worry, it's organic, local strawberry-rhubarb.
Yeah, technically it's not "an apple" but it the principle of the thing that counts.
Oh no! I forgot my Viagra!
I thought we weren't supposed to have gluten..
Is it pear?
Not al a mode? Uh, no thanks.
And you are absolutely sure it does not contain any Gluten?
Apple IS my favorite Eve, but you know I’m gluten intolerant.
Oh no, not apple pie!
This is not what I had in mind when you said let's have a picnic in the park.
Correct me if I'm wrong, but doesn't apple pie contain apples?
I swear it'll be worth it, it even has gluten.
Do we have any ice cream in the fridge?
Tempting, doll, but I got a shot at being Trump's new press guy, and I gotta go get a dark suit.
"The disclaimer says...Eat the pie leave the garden." # Nahash pie shop
I said Pecan Pie, not Apple!
I don't remember you saying that having sex for the first time would be a piece of pie.
I hope you didn't use the organic apples.
March, 14, in paradise.
I can't that with that snake hanging hanging around!
Are you sure it's a pear pie? God said I'm allergic to apples.
I prefer blueberry.
I hope this works!
I can't think of anything that would trump this day in America.
I've never heard of a dingleberry pie. What's in it?
Smells tempting, but where did you get the recipe for that?
I'm apple intolerant!
Another pie? I wanted to celebrate with cake.
Thanks for the pie, and do I have something for you.
Does it have gluten?
Yes your profile did mention a pie fetish
Your reconstruction theory is certainly not half baked.
Oh dear, is it gluten-free?
Uh, wow looks tempting, you did say it's blueberry right?
Since when does a femme fatale like to cook?
Uh, I don't know. Is it gluten free?
After dinner, do you mind if I put on some of your things?
Do I have to know what's inside?
Hey, that's not made from those apples, is it?
Oh my heavens, is that gooseberry?
Try it! You'll like it!
I'm worried we're becoming too traditional.
You're sure there aren't any apples in there
Uh, gluten free right?
You bake?
The snake’s order for you was an apple, not a blueberry pie, and it was for just one apple, because sadly, you’re no longer a 10.
"I'm trying to avoid the carbs but I'll have a bite anyway".
There is no note. I think we can eat it.
My mom's recipe had less cinnamon.
Um...sorry Eve but you know I'm gluten free.
Well...since you say it's gluten-free, it couldn't hurt to try a piece...
Are you sure? ... I explicitly remember Him saying something about the pie of the knowledge of good and evil.
Should I name it America or apple pie?
Lemme get this straight. The snake said if we eat this pie, we'll become world-famous desserters?
Uh, gluten free right?
What is it's glycemic index?
well... He didn't say anything about baking the fruit
That would be so much better with some ice cream on top, which I haven't gotten around to inventing yet.
Okay, okay, but are you sure it's gluten free?
I'm having a Deja vu.
Pi? Isn't it a bit early for Greeks bearing gifts?
I think I'll pass.
I was looking for 24 blackbirds when I came across an apple tree.
He didn't tell you? We're sugar- and gluten-free now.
Sex begins in the kitchen.
No, you have it all wrong. I said I wanted to have my cake and eat it, too.
The apple alone I was able to resist, but now pie. Maybe. But don't dare put a scoop of ice cream on it.
Apple Pie? I love the crust.
What the devil is this pie-shaped object?
This is going to lead to a series of teen gross-out comedies
Pie aren't round -- pie are square.
What a perfect pie!
American Pie? Your friend says I should put what in it?
Gluten? Mightn't we be banished?
Mincemeat? Ok, as long as it isn't apple.
Looks great, but does it have gluten?
Let's just have the fruit, not the fruit pie.
The hell with apple pie, give me the Chevy.
Here, have some of this then we need to talk about "bad naked".
Forbidden fruit pie, huh? Is it organic?
I did not know you could bake
Wish I waited for the pie!
How to win the war.
Forget what you know and do what you feel.
Forbidden is okay, but are there pine nuts?
Apple? He said he hates apple.
To bite or not to bite ...
Is it gluten-free, though?
Love at first sniff.
As long as it's no-gluten, I guess.
No garden ingredients. Looks delicious!
If we eat now, we can still dress before we leave for our vacation out east.
Is that the snake's apple pie? I'd like a bite of that."
I am so done with this vegan diet....
'Definitely a conundrum!'
How'd you learn to bake like that?
Apple pie? What is an apple pie?
Take it, pal. Trust me, it's a lot better than the first one.
Relax. It's gluten-free.
It’s just what my mom would have made.
Where's the ice cream?
A tragic misunderstanding that will haunt all men for eternity!
Smells great, but where's my fork?
But then, who gave the cooking class?
I bet you'd like it if your Father made it.
I'm supposed to be tempted by a apple, not an alternative apple!
Pie are square eve, cornbread are round
Where is the silverware?
Don't worry, it's gluten-free.
Don't tempt me, you know I'm gluten free.
Gee, uh, Thanks, but I'm Paleo.
Woah, so you're saying that I'm too patriarchal AND naked?
You know I'm gluten free!
Any GMOs?
It's my mom's recipe?
I'm just not sure about your idea for a new Food Network show, Eve...
I guess a derivative work would be OK, then.
Me Tarzan. You Jane. Tarzan no eat pie.
If it's Delicious, I might be tempted.
What the hell is an açaí?
I thought it might go nicely with your new espresso machine
Lilith, your really shouldn't have!
You better indulge or it's, as usual, no sex tonight.
Holy Cow! It smells like the ones Mom used to bake."
Better than Lilith's? She couldn't make a mud pies to save her soul.
