Sweetie, please don't take everything literally I say in bed.
No! No! He said, “Let the water teem with living creatures, and let birds fly above the earth across the vault of the sky, not pie!”
Once bitten, twice pie.
Eat from the pie of knowledge of good and evil carbs.
It's our anniversary isn’t it?
I dunno, my doc says it's forbidden.
Apple pie again? THAT's original!
Fine. I admit it. My real hang up is the gluten.
Gee whiz Eve, we were already punished for that damn apple, what will he do to us for eating cherry pie?
Four and twenty blackbirds again?
I'm having a Deja vu.
I'm tempted but Steve has a gluten allergy.
I said naked, not baked!
Who told you these Tree-of-Knowledge fruit pies should be half-baked?
Darn, I was hoping Banana Creme.
I forgot to mention I'm on a raw diet.
Hmm, if I had a Mom would she have made it this way?
Is this Mom's apple pie?
Does that come with ice cream?
I thought I said "Go make me a sandwich."
Neither of us eat pie Eve.
So why the hesitation? It's gluten-free!
Apple pie, the 2nd best feeling in the world!!
Welcome to the neighborhood!
Don't punk me Eve. You swear that's cherry cobbler?
Well, if you put it that way.
You are not the pizza man and I'm not taking a chance.
Then God said, "Let there be gender norms."
Screw the couple's therapist! Can't we just admit I'm gay?
Compliments of the python?
Talk about original sin!! Forbidden pie without ice cream?
The forbidden fruit is OK if it is baked in a pie
I'm confused. That's not what the book said.
Jeez, rhubarb, seems off somehow.
No thanks, I'm on a cleanse.
I really don't want a bite. I'm trying to eliminate glutens.
What, peach again! Why don't you listen to this guy and try apple for a change?
That's looks like tempting piety.
Didn't He say no sugar, or no dessert, or something like that?
I'm getting a weird vibe here.
Honey, I would, but I'm gluten-free.
You don't happen to have any vanilla ice cream to go with that Apple pie?
Ooh, an apple pie! That's original.
Hmmm, is that crust paleo?
Wow...I wonder if it's baked will it still count?
Is there butter in the crust? I'm a vegan.
They're not cooking apples!
I'm not sure I want to know what a calorie is.
Good try Eve but I'm still allergic.
I guess it's OK now that the fruit's been cooked.
I feel the sudden need to put clothes on.
Gee ... Microsoft or apple?
You burned it again.
I told you CHERRY pie!
Sure. Just one slice. I think this paleo diet is probably just a fad anyway.
Honey, come try this. I baked the devil out of it.
Nothing goes better with ribs.
You're sure it's gluten-free right?
Wow- you even sprinkled it with Original Cinnamon!
I don't know. Looks too American to be sinful.
Is it recipe from my thigh?
APPLE PIE!! My favorite!
Is that really apple?
How do you like them "alternative apples."
aaaaand what is in this again?
You want me to stick my what in it??
You say it's peach pie?
He did say not to eat the fruit, does a pie count?
I hope that's mock apple
Do you have apple?
No, it looks delicious. I guess I was just hoping for à la mode.
What do you mean by "pie"?
Oh Evie! So sinful, that gluten crust but maybe just one bite. How bad could it be?
Are Amy and Steve still coming for dinner?
I thought you ate it.
Maybe I should go back to sleep and see if he'll make silverware.
Apple pie, or apple piety?
The crust makes it seem a little decadent.
Stand back, I don't know how big this thing is going to get!
Is it still "forbidden" if it's in a pie?
I'm really more of a cake person, but...
Gosh, hun, you didn't have to go to all that trouble.
Since we name stuff, let's name it Trojan horse.
So... I stick my dick in that?
Tempting . . . but is it gluten free?
Let me guess...apple, from the ...you know.
So what am I supposed to eat it with?
You go ahead; apples make me gassy.
Well it certainly seems wholesome enough.
Actually, the apple I'm good with - it's just that I'm not really eating carbs right now
Just the smell of gluten makes my head itch.
It's ungodly good.
Seems legit.
He says it's entirely locally sourced.
Please understand, I'm gay!
I hope you used the organic apples?
Please God, make it French-Apple.
I don't know - doesn't baking take some of the good and evil out of it?
"But, but ... are you sure it's peach?
I don't know, I was more in the mood for apple fritters.
Pi? What's pi?
Are you SURE this is ok in our paleo diet?
Looks fresh from the Garden of Eat-en
I'm sure it's delicious but it sure brings up some complex questions about Paleo.
Hey guys, you're getting ahead of me here.
Not the baked Four and twenty again!
Blackberry, I hope?
Where's the ice cream? Or, did you forget we're living in Paradise?
I thought we were going gluten-free.
Better call it quiche.
How did you manage to bake a pie? Everything is ferns
So you say you checked out this "pie exception" with the Big Guy?
Did He really say "Thou shall have pie?"
Eve, please tell me the apples were locally sourced.
You couldn't have made a blueberry pie?!
Don't worry, it's only pecan!
But what if I don't want to be great again?
I hope it wasn't made in a facility that may also process peanuts
Are those GMO apples?
Not dinosaur pie. Again.
I don't remember this being on the paleo diet.
are you sure this is organic
You know I like blueberry!
I could have resisted the apple, but this is just too much. Who taught you to do that?
I'm trying to stay away from gluten, but boy, that looks tempting.
Wait... lemme go grab my fig leaf.
Did you bake that all by your lonesome?
Umm, well that's really great, Honey. I guess I should hurry and invent the 'Fork' before it cools off..
Sorry, I can't have gluten.
Already?
Tempting but I will resist. Eating store-bought crust is an unforgivable sin.
Knowledge of good and evil, plus the entire Betty Crocker library?
When the pie is opened will the birds begin to twitter?
I dunno... maybe we should try apple instead?
Alternative snacks
"Round? Haven't you ever heard that 'Pie are squared'?
Your name is Eve, the first woman, and from now on you shall cook clean and bake.
But Eve, apples aren't in season until the Fall!
I don't know how to tell you this, but I've gone gluten-free.
But I'm gluten free.
He had been warned that she didn't like apples, nevertheless, he persisted.
Oh, wow. I'm not really ready for a serious relationship.
Thank you, really, but between the snake and your nakedness, who can eat?
What do you mean, "I know what it is once I've tried it?"
This must be eaten.
It looks delicious darling, but is it glutten free?
Baked apple pie. Wow. I guess global warming is worse than I thought.
So, it's not apples, it's a what -- a pie?
Come on, you know I'm watching what I eat!
Smells like original sin...I mean cinnamon.
If it's rhubarb again, I'M throwing you out.
Geez....apple pie already? Didn't we miss the fun part?
Apple Pie Is Still Sinful....
Finally--a suitable companion!
The words that come to mind are "ala mode".
Now I know why it's called the Garden of Eatin'
Wow. I am tempted but gluten is a no no.
I'd eat the apples but I may have to draw the line at a crust with gluten.
Did he say anything about "alternative" apple pie?
But is it paleo?
I don't know, I heard that stuff will kill you.
I have a gluten thing.
Newest version of Apple? Even I can't pass.
He said that's gonna cost you birth pains AND the Presidency.
I don;t really like pie. Why don't you have the first slice.
Looks dangerously delicious!
I made it myself
Could it really be that forbidden sautéed in brown sugar and butter, under that warm, flaky dome?
Whoa...I'm pretty sure this is gonna hurt in the morning
When life gives you apples...
What happened to me eating more fresh fruit?
If life gives you apples, make apple pie.
err, umm... uh oh. so i was just given an apple, you don't happen to have a sister do you?
whrtr did you get an oven? what's an oven?
Interested in a warm tart?
Let's go out tonight.
I don't know. Haven't you heard Him bandy the word "omniscient" about?
Please tell me you didn't get that from a snake.
Uhhh... these are organic apples right?
I admit it's a lot more tempting than the apple, but if I eat it, you're still going to put clothes on aren't you?.
Wow! Forbidden fruit pie. Do you think that baking it releases any cannanbinoids ??
You found more than one apple so you made me a pie?
Do you think the so-called judge might get mad at us?
What do you think that is?
Rodent & insect pie... Yeah I think you've got me confused with your ex.
Did the tree teach you how to bake that?
where in the world did you get butter?
He says that this will, "Make Creation Sweet Again."
She never said anything about pie.
What's the worst that can happen? For chrissake, a Cheeto is president.
Celiacs: A History
I'm certainly tempted, dear, but I can't help wondering what you baked that in?
That looks hot! What is it?
How did you learn to do that?
I personally don't think you should try to upgrade God's plan.
Guiltless pleasure!
Let me guess - Apple pie again?
Aren't you rushing things, sweetheart? We haven't even gotten to motherhood!
Last time we were over His place He hated pumpkin, so it couldn't hurt to try.
I preferred the soufflé before the fall.
You bet I welcome this tasty chance to work on my trust and control issues.
If life gives you apples...
How long was I sleeping? What's a cooking show?
If I have a slice of this, will I know what a double entendre is?
This is important, did you taste the apples?
No apples, right, Eve?
Can't do it -- way too many points on Weight Watcher's point scale. Got an apple?
Tempting--but let's say no to carbs.
But it's not gluten-free?
Darn! I knew I was forgetting something ... ice cream.
So, you're claiming that it's not forbidden if its baked?
Ok, I'll try it cuz peach may be only a venial sin.
Are you sure it's Guilt-Free?
I knew you belonged in Slyterin.
How about them what?
I guess a processed apple is OK.
A brilliant repeat offense.
I could live with the sin, but you know I have a gluten allergy.
When he puts it that way, even I am a bit tempted.
Déjà vu?
Apple pie I presume?
Wait....did He say no apple or no Snapple?
I hope this is more filling than the one rib you cooked!
Hmmm, definitely not cherry.
Hmm, looks a little gluten-heavy, if you know what I mean?
Well. ok, if you're sure it's gluten-free...
Do you really think He won’t notice?
Please tell me that's berry, not apple pie.
You know I can't eat apple pie without ice cream!
I can't keep up with the pace of technology.
So this is how you got your half-baked idea of eating the apple.
I can't remember if he forbade apples or gluten.
Technically, He didn’t say anything about the OVEN in the middle of the garden.
Is that Fruit of the Tree of Knowledge of Good and Evil Pie?
Wait, did He say eat of the fruit of the Garden, or did He say bake it?
Gluten-free, really?
You baked what kind of pie?
Eve, that is one weird looking pizza ... it could be a trick!
But I asked for a la mode
You're sure this is just like Mother's?
On second thought I think I really should stick to my diet
I am on a diet. I just rather have an apple.
The snake is telling me he didn't say anything about trying gluten.
If the knowledge is 'cooked', we might get away with it..
Yeah sure, you made a pie. But, did you hear? Saturday Night Live has the highest ratings ever; more than Trump ever made on the Apprentice!
I hope that's gluten free.
Adam's apple pie, whole.
Madam, I'm adamant.
Did you use my mom's recipe?
Processed food? Aren't we going to be expelled for that?!
Eve, is this another one of your half-baked ideas again?
I mean, I really feel like it does have gluten.
Is this the Garden of Eden or Eatin'?
Should I thank you for the pie of knowledge of good and evil?
He never said anything about an Apple Pie.
You're the apple of my pie.
Betty Crocker, I presume?
Oh well, in that case, it's my fault.
An American pie with no bad apples? Thanks Kellyanne.
Okay, He did say you couldn't eat the apple. . .
Mock Apple you say?
How many calories?
Sorry Eve, I'm just not into 'Bad Girls'
I'm starving, wait.. it's blueberry? Never mind
All of a sudden I know the difference between good and bad cooking!
Tempting, but I'm on a cleanse...
Smells fishy but the snake says it's apple.
The more complicated these apple products get, the less they appeal to me.
Please, please! Tell me that is blueberry pie!
In for a penny, in for a pound, I guess.
Apple pie might be OK.
Just the apple. I'm gluten intolerant.
Someday your innovative genius may be misinterpreted.
Nice try. But I still prefer bananas.
Do you think it is too much since I already ate the apple?
What's a mother-in-law?
It's bad, Adam. No way to sugarcoat this.
It's time for some game theory
But isn’t this the forbidden pie?
It's half-baked, Eve.
It's leverage for making a deal to stay on the property and I know how to make deals.
I would have been just as happy with Entenmann's.
If those apples came from the Tree of Knowledge, you should have made a pi...
God won't mind as long as the apples are baked.
The First Use of Metaphor: "I'd like a piece of your pie, if you know what I mean."
There is no temptation equal to a baked one
Eve, you promised me ribs!“n
Just trust me. It's apple.
Well, it is half-baked and what could be more American?
I know it looks like a pie, but at the end of the day it's still dinosaur poop.
I really hope that crust is gluten free.
That seems like a lot of butter.
And work on motherhood right after ?
Well, Eve, I guess we're cooked
I'm on a Paleo diet.
For Father's Day? Wow. What are you hoping for in return?
Ever since you appointed the snake to your cabinet, I've had a feeling you want me to do something.
I don't think baking them makes it any less sinful.
"Early Processed Food" from alt-textbook.
Eve, what the hell? Where is the apple, and what is that thing?
It's tempting! But forbidden fruit pie that`s not free of original sin and gluten gives me eternal heartburn...
Babe, is that gluten free?
Sorry babe, don't like apple pie.
Maybe Forbidden Fruitcake instead?
its hard being rational with pie
I'd love to Eve, but I'm gluten free.
Are you sure this is what the serpent had in mind?
What's next? A computer?
Do I have to choose?
They never said you couldn't have your pie and eat it too...
I feel like I'm having that recurring dream where I'm falling.
I don't remember anything about an exemption for baked goods
what's chicken?
Eve, I'm sorry, but I didn't get you anything for our anniversary.
Have we invented fire yet?
Is it vegan ?
He said we must not eat from the tree of complex sugars and cholesterol.
There must be a middle ground here.
You're more of a rebel than I thought.
I was hoping for chocolate!
Think different.
My concern is that it will be sinfully good!
Wow! Is this your original recipe? Looks sinfully good!
I can't find my wallet.
Oh, for Heaven's sake, I was going to bake you something.
No thanks, it's forbidden.
Does it have to be apple?
I hope it's cherry.
Blueberry? Peach? Anything but apple.
O.k., but only if it is gluten free.
Let me guess, ...vegetable...five letters...begins with an A..!
I suppose He won't mind an apple pie instead?
My mom made it with a lattice-work crust on top.
Ill pass...I'm more body conscious since we got rid of the clothes
I asked for cherry.
Is that apple? No! Hot dogs, no! Chevrolet gets us the hell out of this snake infested place.
What kind of fruit did you say was in that?
Am I supposed to ask for a piece, or are you going to offer me one?
Mmmmm forbidden apple pie just for you!
Origional Miscomunication
A moment in my mouth, our future will go south...
Um, is it non GMO and gluten free?
You're sure that the pie is one fruit exchange?
I'm trying to remember if it was don't eat apples or don't eat gluten . . .
Gee Eve, you think God will be less angry.
So I'll have to wear a robe around guests?
But it might have gluten.
No thanks. I've eaten your cooking before.
Let's see. Which sin is worse: disobedience or gluttony?
Any dispensation for baked goods?
Just like who's apple pie?
What kind of pie was this again?
I'm gonna say...fig?
Gluten? That could get us expelled from here.
Just sinful!
I prefer spare ribs.
That doesn't look like pizza to me.
OK, lets get laid, but I think I know where you found an oven.
I guess it's okay. I mean what's he going to do? Ban us from entering?
The Pielapsarian view troubles many American theologians.
Oh don't get so uptight, it's cherry this time.
Are you sure it's a mock apple pie?
Go ahead and get changed for dinner.
it smells ... existential ...
It's gluten- and evil-free
If I eat that whole thing I'm going to be REALLY aware of my nakedness.
That's not apple pie, is it?
It doesn't matter how you dress it up, it's still forbidden.
Oh, I heard if you stick your dick in one of these things, it feels just like having sex -- whatever that is!
She went through all that trouble. What was I suppose to do?
Well, since it's American...
Wait, is it gluten free?
. . . But not a word was spoken, the church bells all were broken.
Okay, I bet you'll eat the apple now.
I prefer a lattice top so I can identify the fruit.
I forget, did He say it's OK in pie?
Did you know that the serpent is a dietitian?
You think God would give us a break if the pie is blueberry.
As innocent as apple pie
You substituted what for apples?
is this what you meant by alternative facts?
Babe, no. There's literally no one else.
It doesn't get any better than this.
If we are going to banned, we might as well enjoy an apple pie before we go.
Is it organic, vegan, and gluten free ?
That's *peach* pie, right?
Pie I meant pi .
Ah...Where'd ya get the recipe?
Eve, your mother didn't give you the recipe for that wonderful pie. Your mother was my rib.
Anthony Bourdain said what?
Please don't tell me it's apple.
Devil's Food cake ! Another first
As long as it's all organic.
That's one hell of a delivery
Cherry?
It's the calories that are evil.
I hope it's not from the fruit of the tree of the knowledge of good and evil; I'm allergic.
Who's Prometheus, and what's a mixed metaphor?
I'm more concerned about the gluten.
Does this mean I'm gonna have an Adam's apple pie?
The first miscommunication
Mrs. Smith? But we've always been on a first name basis.
Certainly more enticing that a raw apple, but I'm still not sure we should go through with this.
Eve honey, that's not the kind of pie I had in mind...
Origin of obesity
Who's "Betty Crocker"? There's only the two of us...
I believe God was pretty clear about us needing to follow a Paleo diet.
Where did you find an oven? I didn't know they'd been invented yet.
I think when God considers your painstaking labor in the kitchen he will re-consider.
Could you sew together some fig leaves for us as well?
What, no vanilla ice cream on the side?
Sure it isn't apple pie?
I'd rather have pancakes
I'm sorry world,I'm taking the pie.
Are those apples from the ones we just picked?
I forgot what God said about the apples, but how bad could it be?
Now what do we do?
But I'm on a strict paleo diet.
Eureka, this will be the origin of alternative facts!
Thanks, but I don't know how I explain this to Eve.
I suppose just one bite won't ruin my diet.
Sorry, no pie for me. It will be a few millennia before we can get off this damn Paleo diet.
Let's go dutch!
Are those apples I smell?
This is for the ribs.
OH YEAH! More like the Garden of Eatin'
Do you have anything gluten free?
What ? No .. I ordered pepperoni .
Actually I prefer pecan pie.
You sure that cooking it keeps it from being an apple?
Trust me, it's paleo.
I'm pretty sure we won't win on appeal.
Ugh...Eve, I think that's considered the same thing.
Unfortunately, I can't eat gluten. Could I just have an apple instead?
Now what is it that God said about Motherhood and Apple Pie?
Don't tell me you're now gluten free?
No, no...I didn't mean motherhood and apple pie either...
Remind me...do I like apple pie?
Is it fresh or frozen forbidden fruit pie.
I thought you said that we were taking things slow
Pie? I thought if we ate the apple we would "die".
Uh oh, I don't know whose wrath I fear most - God's or Eve's!
Let me guess, God made 7th day was Cheat Day right?
Don't tell me the filling--I love to live dangerously.
well if it's Mock apple pie...I guess it'll be ok.
I know something good when I see it.
Didn't God say that's not Paleo?
Humble pie?
I did have my heart set on peach pie.
Whole Foods is open on the Sabbath now?
Were the apples organic?
I loved to, but I was told there were consequences if you ate desert before dinner.
Cherry or apple?
Oh-a devil's foods pie
It's American Pie... Everything that makes America great.
I don't know, Eve... a minute on the lips...
So "forbidden" in German just means "freshly baked"?
As you can see, we're only missing the Chevrolet.
I forgot the ice cream.
Are you SURE He didn't say anything about gluten?
works for me! Rationalization or not,
Seems like a half-baked idea to me.
Gluten-free crust, I hope?
Welcome to the New World Adam and Steve.
So, knowledge of good, evil and home economics?
I wonder if pie of knowledge would be ok.
But our nutritionist said it is forbidden.
That's nice but we have to wait 10,000 years for the ala mode part .
Oh, who could turn that down?
I suppose an apple in a pie is just as sinful.
Apple or cherry?
If the oven is self-cleaning then this really is paradise.
Are you sure the apples are organic?
Got any ice cream?
When Eve saw that the tree was good for food, she and Adam only wished that there was a good place to get coffee nearby.
Wherever did you find the apples? I thought we ate them all.
So, just what kind of fruit is a Viagra?
...but I don't have a Mom?
Is that the pie of half baked knowledge?
Adam, Eve and Apple Pie -- Making America Great Again!
An apple is an apple is an apple.
I don't want to be too much trouble, but is it gluten-free?
At last my cooking practice bears forbidden fruit.
Please tell me it's a frozen Mrs. Smith's!
Is this our cheat day on the paleo diet?
That better be huckleberry.
Wow it doesn't get any better than this, a hot chick and a hot apple pie.
Is it pear?
Nice try, but I shalt not be the one to give into temptation.
It smells great, but none for me. I'm on the paleo diet.
I'm not worried about the apple filling, is the crust gluten free?
It was a little on the tart side so I made a pie
It's a deal - I'll try a bite if you stop trying to play with my winkie.
Wait--did you put nutmeg in it?
Oh, to hell with my gluten allergy.
Don't tempt me, Eve--you know I can't eat wheat!
I thought we agreed on dumplings.
I really hope that's not apple....
Once again you are overreaching.
"Ugh, no, Eve, honey, I didn't say I wanted you to bake, love.
'Alternative Fruit'? I'm just going to say that I have a good feeling about this.
Oh God, I don't have faith I am gonna be able to say No to that
How much for the pie? Is it for biddin?
Please tell me it's not an apple pie.
How did you get so smart as to come up with this apple pie thingy?
"Thank you- but only if it's Strawberry Rhubbarb".
Are you trying to tempt me with gluten ?
Is this the beguiling part?
This Adam"s apple pie is sinfully good.
Do you think He'll notice?
It's cherry.
I can't. I have to wash my hair tonight.
I don't know, it might be rhubarb.
Gluten-free?
But consider this alternative fact...
Where'd ya get the apples?
Yeah, I'm guessing apples are theologically okay when baked with cinnamon, sugar, and doughy stuff.
But what about my Paleo diet?
And on the 8th day God created the Cooking Channel?
I thought a pi had to be squared.
Are you sure that's what it will feel like?
Nice idea... but first, a cup of coffee.
Don't worry, you can work it off tomorrow.
The snake's apple pie is so good it just molts in your mouth.
Alternative apple? That should work.
I don't know, I was warned off pastries.
Is it gluten-free, vegan, and Holy?
The snake also told me you're making us dinner.
666 calories doesn't equal a lifetime of damnation
Why do I have the feeling something not so great happened?
But how do you know it's my favorite?
I don't care if it's a sequel or a prequel. Count me out.
If I say no, the Bible will report fake news.
I realize it is your pie and your choice, but still it doesn't strike me as right.
It looks just like Mom's! .
Don't worry, it's Paleo.
Please wait until I check to see whether the Affordable Health Care Act is still in effect.
Well, it's definitely not a fruit.
Seriously tempted, Babe, but is the crust gluten free?
That smells so much better than the spare ribs you made last week.
The Bible never actually stated what type of pie it was. We just all assumed apple.
I'm really tempted, Eve, but I haven't even had breakfast, for God's sake.
Thanks, but I'm allergic to apples.
You mean the snake says if I won't eat it you can shove it in my face?
OK, I guess, but I prefer something more rational.
Oh, I forgot I grabbed something in the valley.
Sorry, but I'm gluten-free.
I don't know if I should, Eve--is it gluten-free?
I think we're okay if it's blueberry
Oh good! I've had about enough of this "themed" nudist colony.
Well, He didn't say anything about it being baked.
So, you do have a mother.
Steam 'n' Buns
I dunno. Do you think He'll smell a coverup?
I meant the knowledge of pi.
The creation of Martha Stewart.
Where'd you get a pie tin?
It's an "alternative" apple
I'm not ready to choose between boxers or briefs.
I can't believe you're better at this than me!
The lawyers say this night work
Two wrongs don't make a right.
Pssst. When you're a star, you can grab her by the pie.
Convection or conviction?
So; if the apple falls from the tree of knowledge to the ground naturally and you pick it up and bake it in a gluten, nut, and dairy free recipe its safe to eat?
Nice try, but I can still see your unnecessary navel.
But Charles Beard says using cinnamon in apple pie is a sin.
I hope that's gluten free.
Eve, you're amazing. Apple pie! A miracle! Where should we eat it?
Thanks, but I'm thinking of going paleo.
