Well, I'll be damned...
I'll be damned.
I'll be damned.
Well, I'll be damned...
You're naked AND you bake?
We have an oven ???
Phew... when you said you had something in the oven, I thought you meant something else.
'When you said you had one in the oven that's not what I thought you meant."
How about them apples?
Wait -- what going away party?
I see you've found a loophole.
Mom's apple pie? What's a Mom?
God knows I shouldn't.
You mean I can have my pie and Eden too?
I think you've just invented the loophole.
What family recipe?
What do you mean 'to die for'?
Then again, it'd also be a sin to waste it.
Mom's apple pie? Who's mom?
God knows I really shouldn't.
Wait, we have an oven?
What's the worst that could happen?
Apple? Well I'll be damned!
Sure, I'll try it. What's the worst that could happen?
How much sin would some ice cream add?
I guess after this we'll start dressing for dinner.
Ooh, that looks sinful.
Could be a recipe for disaster...
An apple pie, well I'll be damned.
Ok I'll try it. What's the worst that can happen?
We have a kitchen?
This pie for another rib.
It smells delicious, but there'll be hell to pay later.
Apple pie? Well I'll be damned!
I think I may have found a loophole.
God knows I shouldn't.
An apple pie, well I'll be damned.
Well, how 'bout them apples.
That's some loophole.
Oooo. Mom's apple pie! ... Wait..Who's Mom?
What do you mean, you think you found a loophole?
What's the worst that could happen?
Apple pie? I'll be damned!
It'd be a sin to waste it.
Pie and a naked woman, I must have died and gone to Heaven.
What if we just ate the crust?
Like WHOSE mother used to make?
What do you mean by "It may contain traces of the forbidden fruit"?
Eve invents the loophole.
I'm not sure that's a valid loophole.
It's better than sex? What's sex?
God has desserted us?
It would also be a sin not to eat it
Mom's apple pie? What's a Mom?
I'm tempted.
Oh great. Original sin AND carbs!
Might as well make that to go
You're right...its a sin NOT to eat it.
Is that the original tin?
You sure this is a loophole?
Seems like a perfectly legal loophole to me.
Eve creates the first recipe for disaster.
Wait a minute, we have an oven?
Wait...we've had an oven this whole time?
I smell a loophole
Wow! You baked a loophole!
I really shouldn't---but what the hell.
A knife? I don't even have pants.
I smell trouble.
You think you found a loophole?
I don't think that's going to fool him...
It's forbidden fruit no matter how you slice it, Eve.
Whew! When you said you had one in the oven I thought...
What do you mean 'just like mom used to make?'
What's a loophole?
Oh no, the temptation of crust.
Eve, it's the "to die for" part that worries me.
I don't know, Eve... I think it still counts.
That's tempting.
A moment on the lips, a lifetime in the mortal abyss.
You baked me a delicious loophole?
That's original.
Mmm, apple pie!? Damned if I do, damned if I don't.
What do you mean, "This pie is to die for?"
Sure. What's the worst could happen?
I think I found a loophole.
I hope I don't regret this tomorrow.
Let's see now... Live together in paradise forever OR condemn humanity to unimaginable suffering. Hmmm... Is that a hand made crust?
Wait, we have an oven?
How could it be your mother's recipe?
What do you mean it's your mother's recipe?
And on the eighth day, man expected dinner.
"This is exactly why we'll need lawyers in the very near future".
What do you mean it's "to die for"?
Whew! That's not the "one in the oven" I thought you meant.
Your desserts are going to be my downfall.
To be clear, when you say 'it's to die for'...?
Come on, Eve, I wasn't born yesterday.
This could be our ticket out of here.
Maybe we should get that to go.
You have an oven?
You had to make it even more tempting, didn't you?
I guess it would also be a sin to let it get cold.
I'm confused. How can this be your mother's recipe?
Let's hope we've got him on a technicality.
I'm tempted.
No -- I mean you REALLY shouldn't have.
When you said 'something in oven,' I thought you meant . . . .
I didn't even know that we had an oven.
It's to die for!
We're in big trouble--any way you slice it.
Now we need clothes AND oven mitts.
It would be a sin not to try it.
Wait, has fire been discovered yet?
So the deal is I can either eat this, or I can continue to have you walk around naked?
Why do women make things so complicated?
I don't know, it sorta sounds like a recipe for disaster.
It's just like who's? What's a 'mom'?
On the day after this, God created oven mitts.
It's mom's apple pie? What's a mom?
Sure. What could go wrong?
You found a loophole?
Yikes ... When you said you had one in the oven ...
Wow, that's to die for!
Where did you find an oven?
Mom's apple pie? You don't have a Mom.
Well, he didn't say I couldn't have pie.....
Sure, what's the worst that could happen?
I think you've found a recipe for disaster!
No thanks, I want to look good naked.
Apple? Well I'll be damned!
You don't give up, do you?
We've invented fire?
I suspect we'll need it to-go.
Oh, so that's what you meant by 'loophole.'
Let me get this straight - if I eat this pie, I get to see that you're naked?
Ah - what the hell.
I'm thinking we can get by on a technicality.
What do you mean 'just like mom used to make?'
God forbid!
Your mom's recipe? Wait, what's a mom?
What's a loophole?
When you said "I have one in the oven" I was thinking of something else.
When were you going to tell me about the oven?
Pretty sure this is still going to count.
OK, now I'm tempted
Sinfully delicious, I suppose.
No, really, you shouldn't have.
I think I found a loophole.
When did you get an oven?
What do you mean " sinfully delicious"?
Pie, why not! What could go possibly go wrong?
What do you mean "mom's apple pie"
I think it's a recipe for disaster.
May contain traces of nuts and forbidden fruit
That looks tempting.
Are the apples local?
Don't tempt me.
The Origin of the Legal Loophole
If we're going to commit original sin, we might as well add vanilla ice cream.
We may have to eat this on the road.
Oh God ... I'm going to pay for this later!
Is this to make up for the rib?
Eh... a moment on your lips, eternity on your hips.
That looks sinful.
What part of forbidden didn't you understand?
Well, that looks positively sinful!
Eve, I hope you baked the hell out of it.
This could be a recipe for disaster!
It'd be a sin NOT to eat it.
You're right. He never mentioned pie.
I'm going to go out on a limb here and guess "apple."
I hope you baked the hell out of it
I'm not sure 'getting God on a technicality' is such a good idea.
Is this another half-baked idea from that serpent?
Wait! You have an oven ?
So the fruit is from the tree of alternative knowledge?
... and you're sure the forbidden fruit thing was fake news?
Skip fruitful. Let's multiply.
That voice you heard? Fake news.
Just like who used to make?
Oh my, that looks sinful.
Oy, now a whole pie?! You saw how He got over one flippin' apple.
Now THAT'S tempting
I can't keep up with all these Apple updates, Eve.
Wait, how can it be an "old family recipe?"
I'm guessing apple.
I hate these letter of the law-spirit of the law conundrums.
What family recipe?
Were those apples locally sourced?
I don't eat gluten.
Good looks, a hot body and you can cook, this must be paradise.
You're always one step ahead, aren't you
Wait—where did you find an oven?
Your mother's recipe? What's a 'mother'?
I know I'll regret this.
"Pie"? Sure, I'll try some, but is it to die for?
"Who is "Mom"?
Well I suppose one cheat day can't hurt. What's the worst that could happen?
Maybe we can get off on a technicality.
That looks sinful.
Just like who used to make?
Mom's apple pie?
I asked you to be more pious, not to make a pie for us.
um..Eve.. where did you find an oven?
Well, if we are going to be bad, let's be VERY bad.
There is a god.
No -- I mean you REALLY shouldn't have.
Where did you find a fork for the holes?
So, technically we're ok.
Have we always had an oven?
You had me at 'apple'.
Wow, that's super nice, but I think we're still going to blame everything on you.
Please tell me it's a chicken pot pie.
That's tempting.
And on the eighth day, Eve became the first person to ever read the Apple terms and conditions.
Whew! When you said you had one in the oven I thought...
What exactly do you mean 'sinfully good'?
Shouldn't we invent Mom and America first?
I have a feeling I'm gonna pay for this later.
You shouldn't have -- it was just a rib.
I can't resist a good loophole.
Is that from Hell's Kitchen?
Oh my, that looks positively sinful!
Adam's original sin was his inability to resist the offering of a tart.
Wait...when did we discover fire?
Technically, He didn't mention anything about pie
It is tempting.
It's an alternative fruit, you say?
It just might work. It gives us plausible denial.
Well that's tempting!
You sure 45 minutes at 350 kills all the sin?
To die for?
Thanks, but I've already Eden.
Now explain it to me again, exactly what is a guilty pleasure ?
I guess I'm just as damned if I don't?
Well ... he didn't say anything about pies.
Oh god. This is a trick question, isn't it?
What would happen if I just eat the crust?
What do you mean, it's from an old family recipe?
I guess you're right; I don't think He said anything about apple pie.
I'll start packing
Better than sex?
What do you mean "mom's apple pie"
We can't go to Hell for rhubarb, right?
This or run around naked forever....hmmmm
I think we have found the first loophole.
I don't think that's going to fool him...
That looks tempting.
I don't think using them in a pie counts as a loophole.
He didn't say anything about pie, right?
So the fruit is forbidden, but what if I just eat the crust?
We don't even have clothes. Where did you find an oven?
Tell me it's not apple.
Hmmm...it is tempting...
You sure know how to tempt a guy.
What do you mean it's your mom's recipe?
Am I going to regret this?
Forget the forbidden fruit. God taught you to bake?
Well, I'm sure of one thing. It's not your mother's recipe.
Looks tempting.
Maybe just a bite.
I'll never be able to fit into my leaf after eating this.
Brilliant idea to eat the evidence.
Gender roles already?
Any more pie, and I won't be able to squeeze into my fig leaf.
I guess you're right He didn't say "No forbidden fruit PIES."
You go ahead. I've Eden.
I'm not sure if this counts as a loophole.
That smells positively sinful!
Oh my God, Eve, that looks positively SINFUL!!
Smells sinful.
Well, He did say to be fruitful...
Oh my god....gosh....what a relief! When you said you had one in the oven....
Not what I was expecting when you said you have "something in the oven"
You shouldn't have. No, really -- you shouldn't have.
Well that's tempting!
Seemed a waste to throw the apple out after just one bite.
What would Jesus do?
Ooh, I'm tempted...
No, thank you. That was enough knowledge for one day.
Actually, no -- I don't think you've found a loophole.
Relax Adam... It's Peach Cobbler
Where'd you get an oven?
"Who is "Mom"?
How did you spot the legal loophole?
To die for?
When did you get an oven?
Well okay, if you're positive that you baked the Hell out of it.
No, I think technically it's still an apple.
First it's apple pie. The next thing I know, you'll be raising Cain.
You misunderstood when I said you need to be more pious.
You make falling from grace and eternal damnation so attractive
Locally sourced ingredients have always been my downfall.
I suppose a little slice couldn't hurt.
It can't possibly be your mother's recipe.
Am I going to catch hell for this?
Do you mind telling me who gave you the recipe?
You've taken sin to a whole new level
I think this makes for plausible deniability on our part.
Yeah, I think that still counts
Wait, how could it be your mother's recipe?
Ooh, it smells sinful.
No, I don't think you can "bake the hell" out of that apple.
You're really making this hard.
What do you mean "As good as Mom's apple pie?"
I have to admit it's tempting, Eve.
So if I admit to evolution I can have a slice?
That looks positively sinful!
I preferred it when you invented sex.
Smells tempting
Any way you slice it, I still think it's a bad idea.
The pie is tempting, but your outfit is amazing!
Wait. Where did you get an oven?
So, you're looking to get off on a technicality?
And you think he won't see through that?
Pie comes before the Fall
Fool me once, shame on you...
Please tell me that you're not trying to trick me into eating kale.
Damned if I eat this, damned if I don't.
What do you mean "sinfully good?"
You didn't need to do that. I don't even miss the rib.
This pie is to die for.
You really shouldn't have.
It's literally to die for.
Where did you find the pie tree?
'That looks really tempting.'
Oh my God, you shouldn't have.
I am not sure what you mean by "loophole". Just hand me a fork.
Who's Granny Smith?
Since when did we have an oven?
Should I dress for dinner?
How do you know that baking it makes it okay?
Always with the Forbidden Fruit. Just once I'd like a Lemon Meringue!
Since when did we get an oven?
Don't you think we're in enough trouble?
What do you mean, it's sinfully good?
Whaddaya mean, "Snake 'n bake"?
Eyes on the pie Adam, keep your eyes on the pie.
Oh God, that's tempting!
At least wear oven mitts
Honey, keep this up and pretty soon I won't be able to see my fig leaf.
I hope this isn't another one of your half baked ideas, Eve.
If He asks, tell Him it's peach.
You found apples? Well, I'll be damned!
How is this paradise if we can’t have pie?
Well, he never said s thing about pie...
Hell hath no oven mitts.
It's called Apple Pie. It's to die for.
When you say, "May contain apples..."
You bought an oven?
I'm guessing apple.
Somehow I get the impression we're still screwed.
And on the sixth day, God also created irony
Aren't we in enough trouble already?
I baked the hell out of it
Honestly I prefer your ribs.
Hell yes!
I get apple pie, but what is "mom"?
Well gluttony wasn't exactly the first sin I wanted to commit
What I really want is sex.
That's one way of disposing of the evidence.
This looks like a recipe for disaster...
Wait...this can't be your mom's apple pie.
When you said you had something in the oven, I was expecting a baby!
How can you say, it's your mother's recipe?
Tempting, but I probably shouldn't.
And you have one in the oven, you say?
How original!
What do you mean it's an old family recipe?
Tempting—but when did we get an oven?
I know it's a pie, is that the original tin?
That's not what I meant about being pious.
Now this is tempting.
Now THAT'S tempting
If we're going to do something wrong, let's do it right.
Yes, I was worried for a second when you said you had one in the oven.
When were you going to tell me about the oven?
Maybe its the pie, but suddenly you look very sexy.
I kinda think He's still going to notice.
Now THAT'S what I call temptation!
I found a loophole
Maybe just a bite.
Wrap it up and I'll start packing.
Now that's original!
What did the lawyer say?
"Let me guess, it's to die for".
When did he invent ovens?
Define sinful.
I think we will have to take that to go.
I thought you were making a devils food cake
Who the hell is Sara Lee?
The forbidden apples aren't the concern here. Where did you find an oven?
Oh, you shouldn't have.
Just a pinch of sin-namon.
Just promise me you cooked the hell out of them.
I don't think your loophole will be acceptable to Him.
You aren't making this easy.
Well that's original!
So... You did what with the apple?
No clothes, but an oven?
Oh, that looks absolutely sinful!
You know, you'd think in Paradise it wouldn't always have to be, "Damned if you do and damned if you don't."
Milk from the forbidden cow would go great with this.
Ok, so it was from the tree of fake knowledge?
No, it smells like a technicality.
Why not? Let's make Paradise great again!
You've got fire?
I can't. I'm doing this Paleo thing.
The pie is nice but I'm more interested in your buns.
It looks tempting, but then again, what do I know?
You're sure that loophole will work?
I'm concerned it violates the spirit of the agreement.
God only knows where this came from!
But I thought we were having ribs.
Is it okay if I just eat the crust?
On this day, man learned to never eat hot food naked
I think you misunderstood "piety."
Apple, again?
Eve, you shouldn't have. No, I mean it, you shouldn't have.
It looks delicious, but are you sure it's guilt-free?
You're sure it's kosher?
A family recipe? What's a family?
The snake wanted to welcome us to the neighborhood.
Shouldn't we get dressed first?
I thought you were going to make the Devil's food cake...
Do I smell sinnamon?
The downside is we may have to eat and run.
Come to think of it, He never did say anything about pie.
How on God's green earth did you do that?
Wow! That looks to die for!
Smells like trouble!
We'll regret this in the morning.
So I get both pie and sex?
As if I wasn't already tempted.
Maybe it came from the tree of Alternative Knowledge?
Wow? Where do you find an oven?
I don't see this ending well.
What do you mean, your mother's recipe?
Very tempting.
Are you sure this doesn't count?
It's not the calories I'm worried about.
I know where you got the apples, but the oven?
The way to a man's rib is through his stomach.
She was warned. Nevertheless, she persisted.
'Mom's Apple Pie'? But we don't have a Mom.
Fool me once...
It's humble pie... what's the worst that could happen?
Hmm ... who would I rather have mad at me for eternity?
Looks sinful.
God may forgive us. Our thighs will not.
"Oh jeez, was that 'be fruitful and multiply' or 'be fruitful and multi-pie'?
Now THAT'S what I call temptation!
I have to admit it is tempting.
Wait a minute—like WHOSE mother used to make?
But I don't have a birthday.
I really shouldn't...
What's the catch?
I don't feel like I explained this very well .
It's to die for!
And your father is OK with this?
Well, he didn't say pie.
Tempting, isn't it?
Smells heavenly
I don't know about the letter, but this might violate the spirit of the law.
Let's get this over with so we can finally put on some clothes.
It does look tempting.
They say your apple pie is to die for
Wow! Eve only gave me an apple.
And I’ll offer you ribs.
And who pray tell is Granny Smith?
Hmmm. Tempting.
I'm not sure that this changes the theological implications.
I'll bite...
What do you mean, "Mom's famous recipe?"
How about I just eat the crust?"
Mmm, smells like the fall.
I just know I'm going to feel self conscious about my body after eating this.
Honey, you shouldn't have.
Wow, just like mom used to... wait!
Where the hell did you bake that?
You get knowledge. I get a pie. I like where this is going.
That looks more appealing than your devils food cake.
Don't worry, the snake says it will make us great again!
The devil is in the details.
Only if it's kosher.
Thanks, but you had me at the tiny fig leaf.
Are you ribbing me?
Looks positively sinful.
Wasting it would be a sin, right?
I think it's still forbidden.
Pie goeth before the fall.
You're getting ahead of the story.
What do you mean "granny" Smith?
Nevertheless, she persisted.
And you cook too...this is awesome!
Don't tempt me.
Well, I guess one bite won't hurt.
Is this some kind of workaround?
Your mom's recipe?
Ooh, that looks sinful.
Wait—where did you find an oven?
So you're saying it's an alternative apple, and not really an apple?
I see you've upped the ante.
Oh, it is tempting, but I am watching my fate.
Sinfully delicious, you say?
..and from that moment on man loved woman.
What do you mean, 'Let's put the sin in cinnamon?'
On second thought, I'd rather not know.
This is why I have trust issues
If we're going to be banished, we might as well indulge.
It's not a pie; it's a loophole.
Where'd you get an oven?
When did you invent the oven?
Did you say this is your Grandma's recipe?
Tell me it's blueberry.
What do you mean it's your grandmother's recipe?
Well, I'll be damned, but I want a bite.
You devil you.
Please say it's not apple.
What do you mean "Hell's Kitchen?"
Immaculate Convection
Maybe later. Just ate an apple.
FUCK YOU COCKSUCKERS AND ALL YOUR ANTI-TRUMP BULLSHIT. YOU ARE FUCKING ASSHOLES. DO YOUR OWN JUDGING. THAT'S WHAT YOU GET PAID FOR, LAZY FUCK BRAIN. I WANT NO PART OF YOUR CHEAP FUCKING SHITTY MAGAZINE CRAP. TRUMP IS YOUR PRESIDENT. DEAL WITH IT.
"Wait... Now, I'm Adam... And you're Eve... Who's Granny Smith?
Let there be loopholes
Sinful in a good way, though, right?
Oh, that looks absolutely sinful!
This changes everything.
OK. This just got tough.
Three questions: Who are you? Where's my rib? Is that apple?
Well I guess there's always room for pie.
I'm trying to remember exactly what we were told.
Garden of Eatin'
I'm not sure this is what God had in mind when he said our sins would lead to just deserts.
It does look positively sinful
Good thing I saved my appetite by not eating that apple.
Such a tart.
It's not so much the sin I'm worried about--it's the gluten.
I'm not sure apple was the best choice.
Wow, you really want to move don't you?
I'm not even going to ask what you did to get an oven!
Darling, that smells positively sinful!
Wait, who's coming over?
I see you've taken this forbidden fruit thing to the next level
I guess one bite can't hurt anything.
You baked it? Now we'll really catch hell!
Smells tempting, but it'll go straight to my conscience.
You really think he's not going to notice?
Adam and Sarah Lee, the real story.
Thank God . I thought you were going to make me eat one of those apples
No, no, the pie looks good. I was just looking for my rib?
Sure, we'll be doomed to an eternity of doubt and existential anguish, but... pie.
This might be worth it.
Is this what you meant by "going all the way."
It isn't the sin that concerns me so much as the gluten.
Better make it to go.
No, really, you shouldn't have.
It does add a new twist to the story.
It is tempting.
When life gives you apples...
You really know how to push His buttons.
I'm not sure that eliminates the original sin problem.
I'm really trying to be good this week.
Where did you find an oven?
Uh, I had something else warm and sweet in mind.
Eve, you gotta let it go.
Well, I guess when life gives you apples...
You sure it's just a metaphor?
My God! You found an oven!
I'm not going to fall for that.
It would be a bigger sin to let an apple pie go to waste?
Well, if the snake said it's okay, I suppose it's okay.
I really shouldn't but it'd be a sin not to eat it.
Just like Mom's? Oh wait...
It smells really good, but something about it just doesn't seem kosher.
Did you bake the hell out of it?
Eve, does this mean we must dress for dinner?
I don't know, 'The Fruit of Eternal Damnation' sounds tempting, but can we just go back to 'Death by Chocolate?'
Wow, looks sinful...whatever that means!
apples to apples... crust to crust...
That's not the temptation I expected.
Somehow, this still feels wrong.
Tart.
Are you sure He designated the 7th day as "Cheat Day?"
Actually, I'm Steve.
Any chance that's cherry?
Well this is a first.
Good try! But that just not what's on my mind at the moment.
Apple or cherry? It matters.
Yah, it smells good but it will surely taste like hell.
This smells like entrapment.
Tell me it's not apple.
Aw, you shouldn't have. REALLY, you shouldn't have.
Smells sinful.
This takes temptation to a whole new level
Wow, I'd like a piece of that.
I can't remember what God said not to eat, but it sure wasn't pie!
God only knows how you baked that pie!
It would be a sin not to eat that.
...As long as it isn't apple...
Next week on "Naked and Afraid"
I don't understand, what do you mean it's your mother's recipe?
I think it still counts.
That looks sinfully good.
Looks tempting.
Does it count if i just smell it?
Sinfully delicious, you say?
Well, I can't say Mom's was better.
You shouldn't have. No, really -- you shouldn't have.
I was thinking you should have the first bite.
She was warned. She was given an explanation. Nevertheless, she persisted.
You cook, too?
Well, it does look sinful.
Are the apples locally sourced?
Sorry Eve, it's just not that tempting.
I'm guessing it's apple.
Let me guess: apple.
It would be even more tempting with vanilla ice cream.
God hath forbid eating of ... wait a minute ... is that a caramel streusel topping I smell?
