Son, your Mom and I want you back in the picture.
Whatever you do, don’t take the stairs near the Escher painting!
The Demoiselles d’Avignon are out to lunch. We’re the McMurrays of Hackensack.
Imitating life. What are YOU doing?
It's creepy how his eyes are following us.
Well you're no masterpiece yourself, pal.
It says "Man Looking Stupid". What does yours say?
We kinda got drawn into it.
Due to NEA budget cuts, the painting you would have seen here will be described by my wife, Ethel, her sister, Irene, and myself.
We're life, imitating art.
Hey look, it's Art.
Well, you're no masterpiece yourself.
We don't get it either.
You’re better off over there, in this reality Trump is president.
Whatever you do, don't take the behind-the-scenes tour!
We're in the lower floor of IKEA....where are you?
It really captures the desperation and hopelessness of middle age.
Three against one says you're the painting.
We're just enjoying our 15 minutes of frame.
Most visitors find that this picture speaks to them.
Really? Ours is also titled 'The Museum Visitor!'
Notice how his eyes seem to follow you.
Yeah, well, from our side it say's "Coat Check."
Oh yeah? Well you're no masterpiece either.
Finally, something that speaks to me.
Notice how the eyes seem to follow you around the room.
Hey look, it's Art.
Well, what did you expect for five dollars? This is Mona...and Lisa is right behind me.
And here we have an excellent example of 'Expressionlessism'.
Oh, yeah? Well, we don't get you either.
It’s disturbing how his eyes seem to follow you around the room.
?muesum eht ot yaw hcihw ,ydduB ,yeH
Art? That's not Art. I know Art.
It’s almost like he’s looking right at us.
Imagine how we feel. You get to walk away
I want my Monet back.
Oh yeah? Well, I think you're banal and derivative, too!
Lack of perspective is the least of our problems.
It's an Andy Wall Hole.
We were looking for the Escher exhibit, but I think we took the wrong staircase.
We were framed!
I think we've both been framed.
That's my wife you're calling derivative.
This one's titled 'Adjoining Room', and it looks real as hell.
That's not Art. That's Dave.
We hope to return to the other side following the 2020 election.
Welcome to the Museum of American Art. I'm Art.
It's an Andy Wall Hole.
We are behind you dummy! this is a mirror.
You know this is the first time art has ever spoken to me
This one's entitled: "Stunned Voter, November 2016"
No, we’re imitating life. You’re the one who’s imitating art.
It's so creepy when the eyes follow you like that
According to this, you’re a fifteenth century nude.
Can you take our picture?
Beware the fine print of the museum's lifetime membership policy.
It says it’s titled “lonely man looking at painting.”
Is it just me or do his eyes seem to follow you?
My God! He looks so real!
Modern art looks a lot like Norm, from church.
I could swear his eyes are following me.
You call it art, I call it a window.
?ecilA nees uoy evaH
Sure, you have time to go to an art gallery, but not to call your poor mother and father
This one really speaks to me.
Hey, it’s Art.
Hey, want to join us? Trump's not president in our universe.
Damn it, Diane. We're performance art again.
Check out how his eyes follow you around the room.
I think it represents the futility of man trying to understand art.
This one's called "Here's Looking At You."
No matter where he went, Stu could never shake the sense that he was always outside looking in.
I liked it better when life imitated art
I'm telling you... We've been framed!
And I'm telling YOU that we want a bucket of fried chicken and three large Cokes!
As far as our daughter is concerned, Fred, you're completely out of the picture.
Can you tell if we’re life imitating art or art imitating life?
And just to be clear, this is no reflection on you.
We don't really know. We were in Surrealism and suddenly we were in Surrealism.
"We've been framed. Can you help us?
This painting not only speaks to me, it has a list of complaints.
What am I looking at? What are YOU looking at?
Do you have a minute to talk about our lord and savior, Jesus Christ?
Oh, great. Even if we get out of this painting, we'll still be in a cartoon!
It is amazing the way the eyes seem to follow us.
It appears we’ve been framed.
Excuse me, do you know the way to the surrealist exhibit?
We're as unimpressed as you are, buddy.
Demand number one: we will not appear nude. Demand number two: we will not appear cubist...
Notice how the eyes seem to follow you around the room.
You'll note the eyes seem to follow you.
Ah,our program says: Man with Glasses; what does yours say?
It's called "Here's looking at you."
Notice how his eyes seem to follow you.
You wouldn't know a masterpiece from a hole in the wall.
He looks so life like.
It's called 'Nude with Clothes On.'
Just lift your legs and climb over, Herb. The guard's not looking.
Honey, come quick! This one really speaks to me.
It doesn't look any better from this side.
I can't get out. Can you mail this for me?
Steer clear of the Escher exhibit!
Maybe you could help us -- we think we've been framed
Well you are no 'Work of Art' either.
I guess you could say this picture really captured us...
What do you expect when they cut funding for the arts?
Are you conceptual art or are we?
It says here its a man staring at painting.
We're in Contemporary Realism. Where are you?
Notice how his eyes seem to follow us when we move.
Which side are you on?
You're no work of art, either!
I prefer art that doesn't speak to me.
This one's call "Life imitates art imitates life."
This is a window, idiot!
I don't think this is Art. I think it's Fred
At least it’s not a nude
So eerie. It's like the eyes follow you.
Finally, art that speaks to me.
My guide says "CPA in Mid-Life Crisis." What's your's say?
Art, is that you?
We didn’t steal the painting. We were framed.
We're here to look at Art. Is that you?
It's creepy how his eyes follow you when you move.
It's a still life, but it pays the bills.
Hey! Whose side are you on?
I don't get it, but I don't think it gets me either.
Says here it's called 'Mother's Disappointment.'
Who are you calling surreal?
We’re innocent, we’ve been framed.
I thought this was a museum, not some hole in the wall.
Note how the artist has been able to convey the subject's complete lack of understanding.
If they ask you to be part of the "Live Exhibit", run! We've been here three days.
It’s amazing how the eyes seem to follow you!
I don’t know how to tell you this, Bernard, but you’ve been framed.
See how the eyes follow you across the room.
It’s from his voyeuristic period.
Get us out of here! We've been framed!
I don't get you, either.
Oh, yeah? Well, I 'don't get it' either, buddy.
No, YOU’RE in a painting!
He almost looks real.
Get back in here!
No, YOU'RE a painting!
It's titled, "Young Unmarried Man Not Likely to Give His Parents Grandchildren."
You're right, his eyes do seem to follow you around the room.
It speaks to me.
Our description reads "An entitled snob's view of a typical family"... what does yours say?
It’s creepy how his eyes follow us!
I swear, the eyes are following me.
"Reality Art" is even worse than Reality TV.
Hey, we saw this one in the other room.
“Window”, Anderson, Glass and Extruded Aluminum, 1995
This one’s called “Guy Who Thinks He’s At An Art Museum.”
You’ve gotta help us, we’ve been framed.
Harry, we'll never forgive you for framing your family.
It's not a museum from this side. It's the customer complaints desk.
Just whose side are you on?
Who are you gonna believe, the audio guide or me?
Notice how the eyes seem to follow you as you move.
‘The Scream’ is down the hall. This is ‘The Rant.’
Please call our lawyer, we've been framed!
Three double cheeseburgers, two large fries and a chocolate shake.
Art? What are you doing here?
I dare say it's a little pedestrian.
Hey, who's side are you on, anyway?
We just saw this portrait in the other room.
I think this is from his dull period.
I want my Monet back.
Help. We were framed.
Mr. Frumby, putting a nice decorative frame around our living room window still makes you a peeping Tom!
We’re just as disappointed as you.
Art? What are you doing here?
not a pretty picture, is it?
This just says, "Maintain Eye Contact & Back Away Slowly."
This says it's a Picasso, but it looks more like Fred....
Breathtaking.
What happened to his wife? And the pitchfork?
If you look closely, it's as if the eyes are following you.
Is it Art? Of course it is, hey Art, how ya' been?
Did you notice how his eyes seem to follow us when we move?
Wow, it's like the eyes follow you from any angle.
Would you consider it " art" if I came to your house and stared at your family?
Apparently, he's on loan from the Modern."
We're three characters in search of an artist.
This only makes sense if we're both named Art.
You’ve heard of art for art’s sake? I’m Art.
Look...it's Art!
The difference between a "hole in the wall" and "art" is a good frame.
According to our docent, you're supposed to be naked and reclining.
This one is especially interesting. I see something new each time I view it.
Are we even in the IKEA anymore?
Is this what your mother and I have to do to get you to visit?
"I love how this work somehow completely captures the sheer banality of life, the meaninglessness of existence, the torpidity of its subject, and leaves the viewer questioning, 'Can there be a God?'
Yeah, I'm Art. Who's asking?
Do you also not have pants on?
No, you’re the painting.
There was no collusion, we were framed.
This one speaks to me.
Which side are you on?
Amazing. You can't even see the brushstrokes!
I have always believed that great art should speak to the viewer
He looks so real.
Three burgers, two fries and three small cokes.
Hey look you guys! It's Art!
Yea, well, we don’t know what you’re supposed to be either.
Every time I look at this painting, I see something different.
This is the last time I'm using groupons for museum tickets.
This piece is called, "Old Man Looking at Us Looking at Him."
This one's called "One Way Mirror" ... I don't get it.
Now THIS is trompe l'oeil !
I'm all for transparency in art, but this is too much.
Who you calling Rubenesque?!
It's just uncanny how his eyes seem to follow you.
It’s called. “Window”
Bad news, buddy. There's a grumpy woman with a pitchfork looking for you in the Midwest Gallery.
It says here, "solitary man looking at art".
This piece speaks to me.
Ah, to see ourselves as others see us.
The eyes follow you wherever you go
I would not recommend hanging this one in the bathroom.
The eyes really follow you around the room.
We’re out of toothpaste, shampoo, and laundry detergent.
Yes, Tom, this is a portal to another dimension. No, you won't be the life of the party on this side, either.
I paid as much as you and I'm also disappointed.
They say art imitates life. Well, he looks as disappointed as we do.
Call my lawyer. We've been framed.
It's creepy the way his eyes seem to follow you.
Dada?
It says here that the artist's work is renowned for its transparency.
Don't give us that look like it's all our fault. We were framed.
Man with glasses. See, we don't need a tour guide to figure this out.
It's called "Portrait of a man looking at a family who is looking at his portrait."
This one speaks to me.
I think it's a fake.
This one's titled, 'A View From The Other Side'. I don't get it!
Neat !! We can make faces at him and all he can see is his reflection.
It says, the meaning of this piece is transparent.
Howard, it's me. Art.
You need to decide which side you're on !
This one is titled, "Man who thinks he really exists."
You think this is bad? Go see the one by the washroom.
The “Mirror of Multiple Personalities” revealed to Bob what he had always sensed but could never admit.
We've all been framed!
Notice how his eyes seem to follow you around the room?
If you’re the artist, I don’t get it. If you aren’t, I still don’t get it.
Get dressed, Sweetie! This isn't a mirror.
Wait a minute. This isn't modern art. It's Uncle Art.
I see the NEA defunding has begun.
This painting really speaks to me.
That's odd - it's a painting of the guy that stole my parking spot.
Creepy how the eyes tend to follow you.
We're here to talk about your membership status.
How did they do that? His eyes follow us everywhere!
That isn't Art, it's Marvin!
Come on, Jack, you really need to see the big picture here.
Oh wow. Art really does imitate life.
"Staring Contest", 2018 Mixed media. Window pane, hole, and tourists.
And you'll notice that his eyes appear to follow you regardless of the angle from which you view the painting.
We'll have two burgers with fries and a small drink.
As he aged, Dorian Gray increasingly resembled his in-laws.
Relax Ethel, it's a one way mirror so he can't see us looking at him.
It says here his name is Art.
I finally found a painting that talks to me.
No, WE are in an art gallery
This one's called 'Window Replacement by Dan, 212-555-1212.'
He looks more middle aged than modern.
I thought you were on our side.
Creepy how his eyes seem to follow you wherever you go!
Fake news, now fake art.
Whistler's in-laws
Stop marveling at how realistic we look and get us out of here!
Be happy you're on the outside looking in.
It’s called “Art Contemplating Bob”
Being trapped in a picture? Surprising. You know what's not surprising––how much Ken saved with Geico!
That must be one of those abstract expressions.
And here's a classic specimen from the dumbstruck tourist period
Yeah, I’m Art. Who are you?
Move along buddy, nothin' to contemplate here.
Swipe left to see the next painting!
Is this the "behind the scenes" tour?
Look at the way his eyes follow you around the room!
Well, this is surreal.
Just because someone cut a hole in the wall and framed it, doesn't mean it's art.
We now know exactly what a “lifetime membership” to this art museum means.
It’s not our fault! We were framed!
It says, Alternate Universe, unsigned.
Yeah, well... we ain't looking at fine art either.
When you said you'd like a still life, I was thinking roses, not an accountant.
We are looking for a dimension where Trump didn't win.
What do you mean we’re on permanent loan?
Now that you’re out of the picture, stay out of the picture.
You see, Emma, that there's the sign of a good painting--when you walk by and his eyes seem to follow you.
You know what? We don’t find you very interesting either!
Oh yeah? Well you dont look like the girl with the pearl ear ring either
This one's called 'Man With an Envelope.'
I don't understand this painting-there are two women but the man is talking???!!!
I stood beside him in the men's room. Believe me, his eyes follow you.
It’s titled ‘Budget Cuts’.
We are NOT weird art. We're in the room next door.
Eerie the way his eyes follow us around the room.
Hello, I'm Art.
This one really speaks to me.
We paid extra for the "behind-the-scenes look at the gallery" for THIS?
I told you we shouldn't have taken the self-guided tour!
Due to cuts to the National Endowment for the Arts, all foreign paintings have been removed and replaced with portraits of proud Trump supporters.
It says it's a painting from Picasso's Voyeur Period.
This piece is not really speaking to me
Hey, I thought we saw the last of you at The Whitney.
The art is speaking to me.
The museum is fundraising. Until we hear from 10 new or renewing members you cannot see any more art.
Didn't we see that guy in the last painting?!?
You're right, Helen. He looks incredibly lifelike.
This one looks just like Fred. By the way, where's Fred?
I thought we were done with realism.
It's really not our fault - we were framed!
This one doesn't speak to me at all.
Look, honey, that's Art!
It's not Dada, it's Dad.
It says here that he's probably equally confused.
We would like 3 cheeseburgers, 2 fries, and an order of onion rings, please.
You're no Mona Lisa yourself, pal.
“We’ll take a Rembrandt, two Monets, and large fries to go”.
Framed, I tell you. We were framed.
Is this the Surrealism gallery or the Realism gallery?
This picture speaks to me.
No matter where I stand his eyes are always following me.
No, no, it wasn't us. We were framed!
Finally, one I can figure out!
It doesn't matter where you stand, he always seems to be looking right at you.
It speaks to me.
It's creepy the way his eyes follow you around the room.
We're just window shopping.
It says you're 'Portrait of a contemporary art lover' – what does ours say?
Why is it called 'Clueless Tourists' if there's only one of him?
It says here it's called "Window"
Hey, wait, I know him, that's Art!
Oh look...another one who thinks he's living in the real world!
I didn't pay good money to see reality.
It DOES feel like the eyes are following you.
If you walk from side to side, its eyes follow you.
You have to look at us from our point of view.
I never understood Folk Art.
It’s not exactly like you’re a masterpiece either!
At least it’s not another nude.
It says he's on loan from Yonkers.
He looks so real.
Amazing how his eyes seem to follow you!
"No sir! YOU are the hologram!
What, you expected a still life?
'His eyes seem to follow you around the room.'
No, you're the tromper l'oeil!
We don't belong here. We've been framed.
Sorry, Harry. We got lost somewhere around the Escher gallery.
And here's the one they titled "Your Fifteen Minutes of Frame"
Well, you aren't much to look at either.
I can't distinguish this painting from a hole in the wall.
For an impressionist, it's kinda real.
So sometimes art imitates life. Get over it.
The eyes just seem to follow ya 'round the room...
Somehow, this one just speaks to me.
Says here this is Surrealism. He looks pretty normal to me.
Well, we think You are mundane and lacking depth!
I'm telling you Margie, it's not just the eyes that follow you.
Isn't the artist's intention a little transparent?
Ours is captioned - "Awkward." What is yours?
This dates back to the twentieth century and is noted for its melancholy, disappointment, and the fact that he never calls his mother.
...and this is the Realism section I guess
See how his eyes seem to follow you around the room? Now that's great art!
Help, we’ve been framed!
No, YOU'RE on the inside of a painting!
It's called, 'Middle-aged Guy on a Free Afternoon at The Met.
We are being framed I tell you!
I’m no connoisseur, but this one really speaks to me.
This is one of the best examples of realism I have seen.
It's an exhibit on Realism. What did you expect?
It's eerie how his eyes seem to follow you around the room.
I've never thought I'd want a painting to not speak to me.
I think this one's a depressionist
Can you tell us where the restroom painting is?
This one’s called ‘Perplexed Museum-Goers’
Says here it's art. Art Shenkman to be specific.
His eyes are definitely following me around the room!
We didn't find any deeper meaning back here either.
Oh yeah? Well your not exactly Mona Lisa yourself, pal.
We did not do it..we were framed!
Please tell the docent we're ready to be quiet now.
Amazing! It's so lifelike.
Eye of the beholder, my ass!
We got framed!!
This artist has opportunistically captured the increasing loneliness of the white male in our society.
One of the paintings is missing, and they’re looking for someone to frame.
Amazing detail! Look at the nose hairs.
Says here, “average man with nothing better to do.”
We were at the Guggenheim, but then the appellate judge sentenced us to hang at the Met.
It says he's on loan from the Guggenheim.
Don't bother splurging on the behind-the-scenes tour.
It's like he really sees me.
It says it’s called, “Man in Museum.”
Immerse yourself in the picture, the guide says.
Harriett, please don't look desperate! Remember how you scared away our last bidder?
It's creepy how his eyes follow you.
I don't know! Last thing I remember was the guide saying, 'Immerse yourself in the art!'
Is this what Krishnamurti meant by: "The Observer Is The Observed ?"
Haven't you ever seen life imitating art?
Is this where we find the Realists?
Art, is that you?
Yelling father, judging mother, inquisitive sister. 1993. Oil on Canvas. Artist Unknown.
It says we can touch this one.
What are you staring at?
Well, if it isn't our son who was too busy to take us to the pop art exhibit.
''Are you in or are you out?"
Well this is what it looks like when art speaks to you!
It’s eerie how his eyes seem to follow you.
Are you on the 'other side' or are we?
Whistler's in-laws
He looks almost life-like!
My card says: "Aristotle with a Bust of Homer" by Rembrandt, but you look like you're from Minnesota.
Who you calling abstract?
Are you Art?
I don't get insider art.
For a still life, it sure moves a lot.
Looks like a hole in the wall to me, and I know Art when I see him.
You've got to help us! We've been framed!
Disregard the guide's instruction to exit through the gift shop at your peril.
This one is called, “Right back at ya.”
Could you tell us where the bathroom is?
The Gallery Guide says it’s called ‘The Other Room’.
It says, "Alternate dimension," by some artist name Hawking. I don't get it.
My God, that's Art! Hi Art.
Whoa—the eyes really do look like they’re following you.
We 3 agreed you’re a painting not us.
We waited in line for an hour and a half to see Frank??
It says it's on permanent loan from Deborah.
I believe this is where life imitates art.
The guide says it's 'Inside Looking Out.' Don't get it.
I could have done that.
Whistler's Brother In-Law
No, we're not the Rembrants.
You want our advice? Before you sign up for the lifetime membership be sure to read the fine print in the agreement.
Look...it's Art!
Waddya mean this piece doesn't speak to you?
The guide says this one's called The Confused Observer.
"That's not,'Nude Descending a Staircase,' That's, Bernie!
Too abstract. Without the frame. he'd be nothing.
Honestly, we don't know how it disappeared. Obviously we're being framed.
Yes, of course I'm innocent. Can't you see I was framed?
Hey, where's the old lady in the chair who was here last week?
This is more surreal than I thought it would be.
His eyes really follow you.
The eyes seem to follow you.
Let’s keep moving honey. I think this is the renovation they were talking about.
This would have freaked me out before FaceTime.
Dada?
It's eyes really do follow you.
I said, "Famous", not "Frame us"!
Creepy ... It's like the eyes are following our every move.
I thought this was an expressionist, not an expressionless.
So lifelike. Look how his eyes follow you.
In this piece, life imitates life.
Don't go to the surrealist exhibit. It's a trap!
I told you to stay with the guide!!
No, it says here that YOU'RE the painting.
These days, they'll put a frame around ANYTHING, and try to call it ART.
It's one of those paintings where the eyes seem to follow you around the room
Get out before it's too late!
Are you going to take our order or what?
:"Can you get us out? Dali's driving us crazy"
According to the artist’s notes, this work should be considered as a reflection of ourselves.
This one is moving.
"Move, please - you're blocking our view !".
In what parallel universe is this considered art.
We've obviously been framed.
You idiot, you´re on the wrong side.
Art. What's yours?
If we are going to be the subjects of ‘living art’, we have a list of demands
Can you tell us how to get to the surrealism exhibit?
"This one is called 'On the Outside Looking In'.
You're not crazy, Larry. You just forgot to take your meds.
I like you, but are you Art?
It's American insider art, we're inside.
It's uncanny how his eyes seem to follow us as we move.
Is this really an exhibit or have we been framed?
Can you move about two feet to the left?
This one is called “I’m On The Outside Looking In”.
This one is so alive!
He looks better from further away.
I don't know if it's art, but I wouldn't want it in my living room.
…And have you noticed how our eyes seem to follow you around the room?
I love art that speaks to me.
At least this one kept his clothes on.
We're three characters in search of a painter.
Art??
It says here that it changes the longer you look at it.
How do we exit the inter-active art installation?
We know your type -- you thought art could never speak to you.
We're here just for your sake, Art.
Sometimes art imitates life. Other times art intimidates Lyle.
We're lost. Is this the Interactive Wing?
Looked way better in the brochure...
Relative Expressionism
We’re just as confused as you are.
He looks so realistic.
I think it's a portrait of the artist as an old man.
This one looks just like our neighbor.
This is not the real me. The real me is at the Met.
Oh, hi Art.
Dad, I know you feel you've been left out of the picture...
It's not his best work but it speaks to me.
You're no Adonis either, buddy.
We took a wrong turn in the surrealism section.
Well, to be honest, I don't think you look very realistic either.
Your mother and I agree, why don't you get a REAL JOB ?
The guide says the missing drywall symbolizes the breakdown of barriers between the lingual now and the meta-real. So... which one is he?
This canvas has really come to life.
Martha! We've been framed!
Last week we were standing where you are!
Very funny. Now let us out.
Where is the exit?
We are the Botticellis and who are you?
Yeah? Well you're no oil painting yourself.
I just don't get it, Ethel; maybe we should have gone in on the other side.
This one's called "Man Looking at a Painting..."
This one's called 'The Guy Outside The Window.'
Let us out. We’ve been framed!
Well you're not so special-looking yourself!
That’s Art.
The Museum of Parallel Universes? This is not what I was expecting.
The following is our list of demands for the return of this painting: ...
Says here this is a clear-glass conceptual piece titled "Window".
