rank,funny,somewhat_funny,unfunny,count,score,precision,contest,caption
812,0,6,29,35,1.1714285714285715,0.0646349059597627,563,Getting nowhere fast. How ya doing on that ladder?
812,1,4,30,35,1.1714285714285715,0.07653981537301309,563,Soulless Cycle.
812,1,4,30,35,1.1714285714285715,0.07653981537301309,563,"I can't believe I agreed to be his press secretary."""
812,0,6,29,35,1.1714285714285715,0.0646349059597627,563,This promotion changes everything...
812,2,2,31,35,1.1714285714285715,0.08682750489471924,563,Just the same old rat race. How about you?
812,1,4,30,35,1.1714285714285715,0.07653981537301309,563,"if there's a wheel, there's a way."
812,2,2,31,35,1.1714285714285715,0.08682750489471924,563,I preferred the rat race.
812,1,4,30,35,1.1714285714285715,0.07653981537301309,563,I still think we should go solar.
812,1,4,30,35,1.1714285714285715,0.07653981537301309,563,Do you ever just feel like you're running in place?
812,2,2,31,35,1.1714285714285715,0.08682750489471924,563,I have officially joined the rat race.
812,2,2,31,35,1.1714285714285715,0.08682750489471924,563,I have a feeling this deal won't get us anywhere.
812,0,6,29,35,1.1714285714285715,0.0646349059597627,563,"Honey, if I'm not home in four hours call the police."
812,2,2,31,35,1.1714285714285715,0.08682750489471924,563,"Phil would regularly use the gym at Sisyphus, Inc."
812,2,2,31,35,1.1714285714285715,0.08682750489471924,563,"if I keep doing this, my reward may be an easy confirmation by the House and Senate."
812,1,4,30,35,1.1714285714285715,0.07653981537301309,563,I just hate being trapped in a metaphor.
812,1,4,30,35,1.1714285714285715,0.07653981537301309,563,Honey I'm almost home
812,0,6,29,35,1.1714285714285715,0.0646349059597627,563,Management wouldn't settle for the stand-up desk.
812,1,4,30,35,1.1714285714285715,0.07653981537301309,563,It makes me feel like a big wheel.
812,1,4,30,35,1.1714285714285715,0.07653981537301309,563,"It's like working for SoulCycle, only it's Soul-Sucking."
983,0,5,27,32,1.15625,0.06521328221627366,563,Sure am glad this new Trumpcare is keeping me in shape!
983,0,5,27,32,1.15625,0.06521328221627366,563,"Karyn, when you have a minute my cedar bedding needs freshening."
983,2,1,29,32,1.15625,0.091022141492801,563,I'm walking out that door and quitting.
983,1,3,28,32,1.15625,0.07917639300749574,563,"Sorry dear, I'm running late."
983,1,3,28,32,1.15625,0.07917639300749574,563,I usually do four hours of cardio followed by four hours of cardio.
983,0,5,27,32,1.15625,0.06521328221627366,563,It's called soulless cycling.
983,0,5,27,32,1.15625,0.06521328221627366,563,I've been spinning my wheel for hours on this.
983,1,3,28,32,1.15625,0.07917639300749574,563,Are we there yet?
983,1,3,28,32,1.15625,0.07917639300749574,563,I am big. It's the hamsters that got small.
983,0,5,27,32,1.15625,0.06521328221627366,563,I never thought that HR would be so touchy about the shag carpet!
983,1,3,28,32,1.15625,0.07917639300749574,563,This rat race is doing wonders for my glutes.
983,0,5,27,32,1.15625,0.06521328221627366,563,The GlassDoor reviews said I'd end up spinning my wheels.
983,1,3,28,32,1.15625,0.07917639300749574,563,"'....no hun, I haven't seen your car keys.'"
983,1,3,28,32,1.15625,0.07917639300749574,563,The worlds smallest man working off some extra ounces.
983,0,5,27,32,1.15625,0.06521328221627366,563,"It may seem demeaning, but I'm making 21 cents on the dollar more than the hamster I replaced."
983,0,5,27,32,1.15625,0.06521328221627366,563,You're still using a standing desk?
983,1,3,28,32,1.15625,0.07917639300749574,563,The Matrix: The Analog Years
983,2,1,29,32,1.15625,0.091022141492801,563,"I'm on my way, dear."
983,1,3,28,32,1.15625,0.07917639300749574,563,"Well, yeah, of course I'm going somewhere here at Headquarters. What kind of question is that??!"
983,1,3,28,32,1.15625,0.07917639300749574,563,"Funny, unfunny, unfunny, somewhat funny, . . . ."
983,1,3,28,32,1.15625,0.07917639300749574,563,At least it's air conditioned.
983,0,5,27,32,1.15625,0.06521328221627366,563,I'll get back to you later — gotta run.
983,1,3,28,32,1.15625,0.07917639300749574,563,"I can't believe it, I got such a great deal - $80 a month, and they have showers too!"
983,1,3,28,32,1.15625,0.07917639300749574,563,"Not much. Just spinning my wheel. And, you?"
983,1,3,28,32,1.15625,0.07917639300749574,563,"I don't mind powering the building, but I'm gonna need the chips changed more often"
983,2,1,29,32,1.15625,0.091022141492801,563,How the Secret Service in the Trump Hotel both stays in shape and supplies the cheap energy to cool the Yuge Bannon Beer Cave in the penthouse.
983,0,5,27,32,1.15625,0.06521328221627366,563,Quick! Someone close the door before the cat gets in.
983,0,5,27,32,1.15625,0.06521328221627366,563,"I'm going for 100,000 on my Fitbit."
983,0,5,27,32,1.15625,0.06521328221627366,563,It's a new system they're testing out. I'm just the guinea pig.
983,1,3,28,32,1.15625,0.07917639300749574,563,I'd rather you refer to it as the wheel of fortune.
983,1,3,28,32,1.15625,0.07917639300749574,563,Forgot to feed Squeaky when he was six. Reincarnation understandable.
983,0,5,27,32,1.15625,0.06521328221627366,563,Some call it a rat race. I call it 10000 steps a day.
983,2,1,29,32,1.15625,0.091022141492801,563,I tried the stand-up desk but this stimulates more endorphins and better ideas.
983,1,3,28,32,1.15625,0.07917639300749574,563,"The Spicer Spin, an alternative way to lose facts"
983,1,3,28,32,1.15625,0.07917639300749574,563,SoulCycle is for suckers.
983,2,1,29,32,1.15625,0.091022141492801,563,Can you hear me now? Can you hear me now? Can you hear me now?. . .
983,0,5,27,32,1.15625,0.06521328221627366,563,The boss will never know we lost the last one and replaced him with another.
983,1,3,28,32,1.15625,0.07917639300749574,563,Keeping up with the Sisyphus's
983,0,5,27,32,1.15625,0.06521328221627366,563,Four legs good--two legs almost as good.
983,2,1,29,32,1.15625,0.091022141492801,563,Hate it when I forget my Fitbit!
983,0,5,27,32,1.15625,0.06521328221627366,563,"Yeah, it's a bit harder to read email, but I can pee in the corner!"
983,1,3,28,32,1.15625,0.07917639300749574,563,Proof that the Fitbit is turning men into mice.
983,0,5,27,32,1.15625,0.06521328221627366,563,I've got you on handsfree cause I'm at the wheel.
983,0,5,27,32,1.15625,0.06521328221627366,563,"Well, they told me if I keep working really hard, I can make my way up to CEO."
983,1,3,28,32,1.15625,0.07917639300749574,563,"My brain says get another job, but my Fitbit says stay here."
983,1,3,28,32,1.15625,0.07917639300749574,563,Can you check if the boss's room is cool now?
983,1,3,28,32,1.15625,0.07917639300749574,563,Trump action...no progress.
983,1,3,28,32,1.15625,0.07917639300749574,563,...I'll circle back to you on that one
983,0,5,27,32,1.15625,0.06521328221627366,563,"Hello, you're through to David in the Government Progress Department..."
983,2,1,29,32,1.15625,0.091022141492801,563,You should see him at crossfit.
983,0,5,27,32,1.15625,0.06521328221627366,563,Hi honey. Remember when they said I'd get the office reserved for the 'big wheel'?
983,2,1,29,32,1.15625,0.091022141492801,563,"Honey, I'll be home in about thirty minutes if I clear the doorway and don't crash into the wall."
983,0,5,27,32,1.15625,0.06521328221627366,563,I decided to reinvent myself.
983,0,5,27,32,1.15625,0.06521328221627366,563,When do we break for lunch?
983,1,3,28,32,1.15625,0.07917639300749574,563,"Dave, I gotta run. We still on for yogurt drops later?"
983,1,3,28,32,1.15625,0.07917639300749574,563,"Yes boss, I’m working on the Habitrail account."
983,0,5,27,32,1.15625,0.06521328221627366,563,"Is it just me, or is this conversation continuing to go in circles?"
983,2,1,29,32,1.15625,0.091022141492801,563,Someone stop this thing!
983,0,5,27,32,1.15625,0.06521328221627366,563,"Though generally happy at his new job, Bill did at times wonder about the prospects for advancement."
983,1,3,28,32,1.15625,0.07917639300749574,563,All this wheelin & dealin was making Joe thirsty
983,1,3,28,32,1.15625,0.07917639300749574,563,Our company finally renovated the employee gym - no more treadmills!
983,0,5,27,32,1.15625,0.06521328221627366,563,I'm in the wheel house.
983,1,3,28,32,1.15625,0.07917639300749574,563,It's the hamster efficiency program. I've also got a protein bar stored in my cheeks.
983,0,5,27,32,1.15625,0.06521328221627366,563,"It is soul crushing, but somehow I like it."
983,2,1,29,32,1.15625,0.091022141492801,563,Thank you for calling Alternate Energy Inc. How may I help you?
983,0,5,27,32,1.15625,0.06521328221627366,563,You ever have one of those days where you feel like you just can't get ahead?
983,1,3,28,32,1.15625,0.07917639300749574,563,A glimpse into the R&D labs at RedBull.
983,1,3,28,32,1.15625,0.07917639300749574,563,When does the whole privilege thing kick in?
983,0,5,27,32,1.15625,0.06521328221627366,563,Can't talk now - gotta run.
983,0,5,27,32,1.15625,0.06521328221627366,563,"Actually some people would be offended by the expression, ""I don't give a rat's ass""."
983,1,3,28,32,1.15625,0.07917639300749574,563,Act now and we'll include this bag of cedar chips for free!
983,1,3,28,32,1.15625,0.07917639300749574,563,I'd rather join the rat race!
983,1,3,28,32,1.15625,0.07917639300749574,563,Sometimes I feel like I'm just going in circles.
983,2,1,29,32,1.15625,0.091022141492801,563,"Yes, it's working perfectly so far productivity wise but I just can't get that damn ""I'm Chip, He's Dale"" song out of my head!"
983,2,1,29,32,1.15625,0.091022141492801,563,We should have just told him he was fired instead of letting him run in circles.
983,0,5,27,32,1.15625,0.06521328221627366,563,I assumed it was a typo when I saw our new fitness center called 'state of the rat.'
983,1,3,28,32,1.15625,0.07917639300749574,563,It looked smaller on TV.
983,1,3,28,32,1.15625,0.07917639300749574,563,"Oh yeah, you feel you're on the treadmill of life. Tell me about it."
983,1,3,28,32,1.15625,0.07917639300749574,563,I try not to think about it when I'm running.
983,1,3,28,32,1.15625,0.07917639300749574,563,YOU think it's easy getting to the top!
983,1,3,28,32,1.15625,0.07917639300749574,563,"100,000 steps this week and it's only Wednesday."
983,1,3,28,32,1.15625,0.07917639300749574,563,Dyslexic Sisyphus
983,2,1,29,32,1.15625,0.091022141492801,563,"That's right, Honey. I'm on a hamster wheel in an office ... indoors ... there's no breeze. But my tie is sticking straight out, like it's caught in the wind."
983,0,5,27,32,1.15625,0.06521328221627366,563,"If the hamster calls in sick tomorrow, I'm not doing this again."
983,0,5,27,32,1.15625,0.06521328221627366,563,It’s called Soulless Cycle. I think they’re gonna IPO.
983,1,3,28,32,1.15625,0.07917639300749574,563,Buy small cube of apple futures asap.
983,0,5,27,32,1.15625,0.06521328221627366,563,We have openings right now with unlimited opportunity for advancement.
983,1,3,28,32,1.15625,0.07917639300749574,563,Sorry. Can't talk now. Gotta run.
983,2,1,29,32,1.15625,0.091022141492801,563,"However, the worksite gym is bringing a decline in my mental health."
983,1,3,28,32,1.15625,0.07917639300749574,563,I dunno. I'll get there when I get there!
983,1,3,28,32,1.15625,0.07917639300749574,563,"Well, I bet the hamster isn't feeling any more rewarded sitting my cubicle, either."
983,1,3,28,32,1.15625,0.07917639300749574,563,I liked my old spin class better
983,0,5,27,32,1.15625,0.06521328221627366,563,"Running a little late, Dear. I'll be home soon."
983,2,1,29,32,1.15625,0.091022141492801,563,Middle management training for the rat race.
983,1,3,28,32,1.15625,0.07917639300749574,563,Sometimes I feel like I'm just spinning my wheel.
983,1,3,28,32,1.15625,0.07917639300749574,563,"The last time I saw your stupid dog, he was chasing his tail."
983,1,3,28,32,1.15625,0.07917639300749574,563,Hamster appreciation month
983,0,5,27,32,1.15625,0.06521328221627366,563,It's not exactly my dream job but my office has a window.
983,0,5,27,32,1.15625,0.06521328221627366,563,The door is always open...The door is always open...The door is always open...
983,1,3,28,32,1.15625,0.07917639300749574,563,Yes sir I understand the metaphor but are the cedar chips really necessary?
983,1,3,28,32,1.15625,0.07917639300749574,563,More fresh news please.
983,0,5,27,32,1.15625,0.06521328221627366,563,"I've been spinning my wheel all day, but I just don't see a way out."
983,1,3,28,32,1.15625,0.07917639300749574,563,All this running around has got me thinking...
983,1,3,28,32,1.15625,0.07917639300749574,563,It all started with a stand up desk.
983,0,5,27,32,1.15625,0.06521328221627366,563,My work-life balance is spinning out of control!
983,1,3,28,32,1.15625,0.07917639300749574,563,Manster
983,0,5,27,32,1.15625,0.06521328221627366,563,"Actually, I've always dreamed of working from home."
983,0,5,27,32,1.15625,0.06521328221627366,563,"Yea, at my old job I felt like I was just treading water, but in this new position I feel like I'm finally getting somewhere."
983,1,3,28,32,1.15625,0.07917639300749574,563,I think I'm done here. Get the maze ready.
983,1,3,28,32,1.15625,0.07917639300749574,563,Just the same old rat race. How about you?
983,0,5,27,32,1.15625,0.06521328221627366,563,Donald Trump's alternative energy plan
983,1,3,28,32,1.15625,0.07917639300749574,563,Climbing the corporate ladder takes forever.
983,1,3,28,32,1.15625,0.07917639300749574,563,99 Bottles of Beer on the Wall 99 Bottles of Beer
983,1,3,28,32,1.15625,0.07917639300749574,563,My boss said that if I do this everyday I might actually get somewhere.
983,0,5,27,32,1.15625,0.06521328221627366,563,"Hang on guys, I'm almost there."
983,1,3,28,32,1.15625,0.07917639300749574,563,This is my year!
983,0,5,27,32,1.15625,0.06521328221627366,563,Am I there yet?
983,1,3,28,32,1.15625,0.07917639300749574,563,"Pet Smart, rodent health. How may I help you."
983,1,3,28,32,1.15625,0.07917639300749574,563,How many more revolutions until I'm a real corporate rat?
983,0,5,27,32,1.15625,0.06521328221627366,563,"Sorry honey, but I'll be late for dinner. Traffic at the office is a nightmare."
983,0,5,27,32,1.15625,0.06521328221627366,563,"Every day, as Frank worked his way up the corporate ladder, things seemed to get more and more pointless."
983,0,5,27,32,1.15625,0.06521328221627366,563,I just feel like I'm always running and never getting anywhere at work.
983,0,5,27,32,1.15625,0.06521328221627366,563,"The Maze is next, I think."
983,0,5,27,32,1.15625,0.06521328221627366,563,"Hon, I'll be late, been running in circles."
983,0,5,27,32,1.15625,0.06521328221627366,563,"With my clear ball in the shop, it's the green tube for me today."
983,2,1,29,32,1.15625,0.091022141492801,563,Trump's Immigration Bill is starting to gain some traction.
983,0,5,27,32,1.15625,0.06521328221627366,563,"Yeah, the hours are good, but there's really no room for advancement here."
983,0,5,27,32,1.15625,0.06521328221627366,563,"You've got to trust me on this, I'm making real progress."
983,0,5,27,32,1.15625,0.06521328221627366,563,"I've been thinking, it's time I quit this rat race."
983,1,3,28,32,1.15625,0.07917639300749574,563,I'm tired of running this by myself!
983,0,5,27,32,1.15625,0.06521328221627366,563,Are you sure this will kick start the sump pump?
1114,1,2,27,30,1.1333333333333333,0.0792686880439847,563,Help! I'm trapped in the Congressional investigation into Russian meddling!
1114,1,2,27,30,1.1333333333333333,0.0792686880439847,563,Making America great. And you?
1114,1,2,27,30,1.1333333333333333,0.0792686880439847,563,I finally feel like I'm getting somewhere at work.
1114,0,4,26,30,1.1333333333333333,0.06312427686319992,563,Welcome to the Rat Race
1114,1,2,27,30,1.1333333333333333,0.0792686880439847,563,"And to think, I only have $50,000.00 left to pay on my student loans!"
1114,0,4,26,30,1.1333333333333333,0.06312427686319992,563,Beats me; something about 'running this Department like a great American company'.
1114,0,4,26,30,1.1333333333333333,0.06312427686319992,563,The GOP's alternative energy plan is going great so far.
1114,0,4,26,30,1.1333333333333333,0.06312427686319992,563,"Hi, who just joined the call?"
1114,1,2,27,30,1.1333333333333333,0.0792686880439847,563,I'm telling you t's not a metaphor.
1114,1,2,27,30,1.1333333333333333,0.0792686880439847,563,Do you think we're just spinning our wheels in here?
1114,0,4,26,30,1.1333333333333333,0.06312427686319992,563,"Although some people insisted that it was a metaphor, Dan simply referred to it as ""great cardio."""
1114,0,4,26,30,1.1333333333333333,0.06312427686319992,563,I prefer to think of it as multi-tasking.
1114,1,2,27,30,1.1333333333333333,0.0792686880439847,563,Tell my manager that Sisyphus had it easier!
1114,1,2,27,30,1.1333333333333333,0.0792686880439847,563,What Time Is The Meeting ?
1114,1,2,27,30,1.1333333333333333,0.0792686880439847,563,Don't give me that runaround.
1114,0,4,26,30,1.1333333333333333,0.06312427686319992,563,"Hi, I'm calling from Hamsterdam."
1114,1,2,27,30,1.1333333333333333,0.0792686880439847,563,This year's bonus could be $100K and a really long drink of water.
1114,0,4,26,30,1.1333333333333333,0.06312427686319992,563,"Sure, it's tough, but I found a job that the robots aren't going to want to take."
1114,1,2,27,30,1.1333333333333333,0.0792686880439847,563,"He's big, brown and white, and is in fantastic shape."
1114,1,2,27,30,1.1333333333333333,0.0792686880439847,563,Sometimes I feel like I am getting nowhere.
1114,1,2,27,30,1.1333333333333333,0.0792686880439847,563,When do we vest again?
1114,0,4,26,30,1.1333333333333333,0.06312427686319992,563,"Another day, another scoop of hamster kibble."
1114,1,2,27,30,1.1333333333333333,0.0792686880439847,563,I'm in my wheelhouse.
1114,0,4,26,30,1.1333333333333333,0.06312427686319992,563,3.14159 26535 89793 23846 26433 83279 50288 41971 69399 37510 58209 74944 59230 78164 06286 20899 86280 34825 34211 70679 82148 08651 32823 06647 09384 46095 50582 23172 53594 08128 48111 74502 84102 70193 85211 05559 64462 29489 54930 38....
1114,1,2,27,30,1.1333333333333333,0.0792686880439847,563,I'll never win this damn contest!
1114,0,4,26,30,1.1333333333333333,0.06312427686319992,563,Keeping up with the Trump News cycle.
1114,0,4,26,30,1.1333333333333333,0.06312427686319992,563,"Nah, I've gotten out of the rat race."
1114,0,4,26,30,1.1333333333333333,0.06312427686319992,563,"It is not the destination, it is not the destination, it is not the destination..."
1114,0,4,26,30,1.1333333333333333,0.06312427686319992,563,"Half a pound of apple, carrot and cucumber cubes, a small cauliflower and a Diet Coke."
1114,0,4,26,30,1.1333333333333333,0.06312427686319992,563,"Yes, available on QVC. You get the wheel, water bottle---all inclusive. We're calling it Hamster Health!"
1114,0,4,26,30,1.1333333333333333,0.06312427686319992,563,They weren't kidding about that rat race thing.
1114,1,2,27,30,1.1333333333333333,0.0792686880439847,563,Promise you'll call when the power comes back.
1114,0,4,26,30,1.1333333333333333,0.06312427686319992,563,I need a spin doctor.
1114,0,4,26,30,1.1333333333333333,0.06312427686319992,563,An office with an adjoining washroom. What more could I want?
1114,2,0,28,30,1.1333333333333333,0.09264111117062017,563,The wheel's spinning but the hamster's dead.
1114,1,2,27,30,1.1333333333333333,0.0792686880439847,563,It was a hostile takeover.
1114,0,4,26,30,1.1333333333333333,0.06312427686319992,563,Sisyphus was an amateur.
1114,0,4,26,30,1.1333333333333333,0.06312427686319992,563,I can talk the talk. What I need is a job where I only have to walk the walk.
1114,1,2,27,30,1.1333333333333333,0.0792686880439847,563,Running desks are the next big thing.
1114,0,4,26,30,1.1333333333333333,0.06312427686319992,563,My last office was in a tube.
1114,1,2,27,30,1.1333333333333333,0.0792686880439847,563,I can't wait until I get promoted to the maze.
1114,1,2,27,30,1.1333333333333333,0.0792686880439847,563,"Hey, it beats the 'rat race'!."
1114,1,2,27,30,1.1333333333333333,0.0792686880439847,563,The intern is running just fine.
1114,1,2,27,30,1.1333333333333333,0.0792686880439847,563,Your overqualified resume is not a problem as long as you can pass our wheel test.
1114,0,4,26,30,1.1333333333333333,0.06312427686319992,563,God I hate Pi..!
1114,1,2,27,30,1.1333333333333333,0.0792686880439847,563,Hello? United States Congress. Please hold.
1114,0,4,26,30,1.1333333333333333,0.06312427686319992,563,They're just spinning their wheels in HR.
1114,1,2,27,30,1.1333333333333333,0.0792686880439847,563,Let me call you back - I need to take a dump in the corner.
1114,0,4,26,30,1.1333333333333333,0.06312427686319992,563,"A politician's day: spin, spin, spin, with no forward movemen."
1114,0,4,26,30,1.1333333333333333,0.06312427686319992,563,"Hey genie? ... my wish was to BECOME a big wheel, not to BE in one!"
1114,0,4,26,30,1.1333333333333333,0.06312427686319992,563,The squeaking sound must be at your end.
1114,1,2,27,30,1.1333333333333333,0.0792686880439847,563,I get the sense that we're running in circles here.
1114,1,2,27,30,1.1333333333333333,0.0792686880439847,563,"I can't attend the conference Gary, I'm currently in Aspen training for the Rat Race."
1114,0,4,26,30,1.1333333333333333,0.06312427686319992,563,I'm never going to get ahead!
1114,0,4,26,30,1.1333333333333333,0.06312427686319992,563,I think I'm just going to stay home and nibble around the house tonight.
1114,1,2,27,30,1.1333333333333333,0.0792686880439847,563,And it's safer than a treadmill.
1114,1,2,27,30,1.1333333333333333,0.0792686880439847,563,Department of Labor.
1114,1,2,27,30,1.1333333333333333,0.0792686880439847,563,I was always to short to ride the Ferris Wheel.
1114,1,2,27,30,1.1333333333333333,0.0792686880439847,563,I don't believe in multi-tasking.
1114,1,2,27,30,1.1333333333333333,0.0792686880439847,563,Has he released his tax returns yet?
1114,1,2,27,30,1.1333333333333333,0.0792686880439847,563,Don't worry. I'll get around to it.
1114,1,2,27,30,1.1333333333333333,0.0792686880439847,563,"....special offer just for you. This fund is going to so successful, you too can spend your days just running on the beach."
1114,0,4,26,30,1.1333333333333333,0.06312427686319992,563,Circle of life or circle of ex wife?
1114,0,4,26,30,1.1333333333333333,0.06312427686319992,563,I'll have the car charged in 30 minutes. See you in 31.
1114,1,2,27,30,1.1333333333333333,0.0792686880439847,563,I feel we're getting nowhere fast.
1114,1,2,27,30,1.1333333333333333,0.0792686880439847,563,And they stock the kitchen with free pellets!
1114,0,4,26,30,1.1333333333333333,0.06312427686319992,563,"Yes, I'm getting around to it."
1114,1,2,27,30,1.1333333333333333,0.0792686880439847,563,"Let's not try and reinvent the hamster wheel, okay?"
1114,1,2,27,30,1.1333333333333333,0.0792686880439847,563,I like to stay hydrated while exercising.
1114,1,2,27,30,1.1333333333333333,0.0792686880439847,563,"The stand-up desk was fine, but now I get more done AND I power the entire office"
1114,1,2,27,30,1.1333333333333333,0.0792686880439847,563,I see now why you never see a fat hamster.
1114,2,0,28,30,1.1333333333333333,0.09264111117062017,563,'It's called Shred-bit'
1114,2,0,28,30,1.1333333333333333,0.09264111117062017,563,"I'm working on a remake of ""As the World Turns"""
1114,1,2,27,30,1.1333333333333333,0.0792686880439847,563,"I came, I saw, I spun my wheels."
1114,1,2,27,30,1.1333333333333333,0.0792686880439847,563,"Honey, don't wait up...The lab rats are on strike again!"
1114,1,2,27,30,1.1333333333333333,0.0792686880439847,563,When did the make the treadmills round?
1114,0,4,26,30,1.1333333333333333,0.06312427686319992,563,All dressed up and nowhere to go.
1114,1,2,27,30,1.1333333333333333,0.0792686880439847,563,Not much. Singularity keeping me crazy busy as always. You?
1114,1,2,27,30,1.1333333333333333,0.0792686880439847,563,Just an Ambien. Why?
1114,1,2,27,30,1.1333333333333333,0.0792686880439847,563,"My cholesterol is down, but I have the overwhelming urge to breed."
1114,1,2,27,30,1.1333333333333333,0.0792686880439847,563,The good news is I got that job at the E.P.A...
1114,1,2,27,30,1.1333333333333333,0.0792686880439847,563,"The job may be run of the mill, but the benefits are oh so youge!"
1114,1,2,27,30,1.1333333333333333,0.0792686880439847,563,A metaphor he said. It'll be good he said.
1114,0,4,26,30,1.1333333333333333,0.06312427686319992,563,Am I a mouse or am I a man?
1114,1,2,27,30,1.1333333333333333,0.0792686880439847,563,"Bob, its so much more rewarding than the elliptical."
1114,0,4,26,30,1.1333333333333333,0.06312427686319992,563,"I can assure you sir, this is not a pyramid scheme."
1114,1,2,27,30,1.1333333333333333,0.0792686880439847,563,Employee Training Lab
1114,0,4,26,30,1.1333333333333333,0.06312427686319992,563,Giving the hamsters a chance to run things seemed like the logical next step at the time.
1114,0,4,26,30,1.1333333333333333,0.06312427686319992,563,Standing desks are so 2016.
1114,0,4,26,30,1.1333333333333333,0.06312427686319992,563,Dr. Pavlov's coffee break
1114,0,4,26,30,1.1333333333333333,0.06312427686319992,563,"Sure, come on over and we can go for a spin."
1114,2,0,28,30,1.1333333333333333,0.09264111117062017,563,"I'm your congressman, working for you."
1114,0,4,26,30,1.1333333333333333,0.06312427686319992,563,"Sorry, I was on mute."
1114,1,2,27,30,1.1333333333333333,0.0792686880439847,563,"Take that, gerbils!"
1114,1,2,27,30,1.1333333333333333,0.0792686880439847,563,"This is a test - to show someone I care for, that we're not just stuck in some pigeon-holed existence."
1114,1,2,27,30,1.1333333333333333,0.0792686880439847,563,"Despite all of his effort, Brad felt like he was getting nowhere."
1114,1,2,27,30,1.1333333333333333,0.0792686880439847,563,Ow! I think I just pulled a hamsterstring.
1114,1,2,27,30,1.1333333333333333,0.0792686880439847,563,I'm always in training for the the rat race.
