rank,funny,somewhat_funny,unfunny,count,score,precision,contest,caption
1778,0,2,22,24,1.0833333333333333,0.0576303395673437,563,We have a pay for performance culture here
1778,0,2,22,24,1.0833333333333333,0.0576303395673437,563,Can't believe they finally gave me a key to the executive bathroom.
1778,1,0,23,24,1.0833333333333333,0.08333333333333331,563,"Have I gotten to 10,000 yet?"
1778,0,2,22,24,1.0833333333333333,0.0576303395673437,563,But did I mention it's a corner office?
1778,0,2,22,24,1.0833333333333333,0.0576303395673437,563,I should've gone to SoulCycle.
1778,0,2,22,24,1.0833333333333333,0.0576303395673437,563,I always knew I'd be running this place one day.
1778,0,2,22,24,1.0833333333333333,0.0576303395673437,563,"Sell. No, buy. No, mate. No, sell."
1778,0,2,22,24,1.0833333333333333,0.0576303395673437,563,"Hello Donald, I got this at a garage sale."
1778,0,2,22,24,1.0833333333333333,0.0576303395673437,563,Is not going in reverse the promotion part?
1778,0,2,22,24,1.0833333333333333,0.0576303395673437,563,"Yes, boss, the energy-saving plan is in full motion"
1778,0,2,22,24,1.0833333333333333,0.0576303395673437,563,"Twenty pounds of cedar chips and five pounds of peanuts, next day delivery please"
1778,0,2,22,24,1.0833333333333333,0.0576303395673437,563,When's lunch?
1778,1,0,23,24,1.0833333333333333,0.08333333333333331,563,At least I'm getting my steps in.
1778,0,2,22,24,1.0833333333333333,0.0576303395673437,563,"Okay Miss, try turning on the light now."
1778,0,2,22,24,1.0833333333333333,0.0576303395673437,563,Before hiring a new employee we test them to see how they handle stress.
1778,0,2,22,24,1.0833333333333333,0.0576303395673437,563,Which treaty did you say this was for?
1778,0,2,22,24,1.0833333333333333,0.0576303395673437,563,"At last, I'm out of the rat race."""
1778,0,2,22,24,1.0833333333333333,0.0576303395673437,563,I'm getting in shape by embracing the true nature of my job.
1778,0,2,22,24,1.0833333333333333,0.0576303395673437,563,Hold the door. I'll be there in a minute.
1778,0,2,22,24,1.0833333333333333,0.0576303395673437,563,Gives masterclasses to gerbils.
1778,0,2,22,24,1.0833333333333333,0.0576303395673437,563,I still think solar power was the way to go!
1778,1,0,23,24,1.0833333333333333,0.08333333333333331,563,... Just on my 10:00 mindfulness practice now... being present...
1778,0,2,22,24,1.0833333333333333,0.0576303395673437,563,"Hello, PETA? I'd like to get an opinion . . ."
1778,0,2,22,24,1.0833333333333333,0.0576303395673437,563,"He's really big, has red eyes, and as far as I can tell, is in terrific shape."
1778,0,2,22,24,1.0833333333333333,0.0576303395673437,563,So far..So good.
1778,0,2,22,24,1.0833333333333333,0.0576303395673437,563,"At the 3 mile mark, my drug works"
1778,0,2,22,24,1.0833333333333333,0.0576303395673437,563,Marketing suggested I run through the presentation.
1778,0,2,22,24,1.0833333333333333,0.0576303395673437,563,"Boy, after analyzing all the useless things we do in a day, you don't feel like hitting the wheel."
1778,0,2,22,24,1.0833333333333333,0.0576303395673437,563,"I like to say, ""hamster,"" and leave the rat and Mr. Sisyphus alone."
1778,0,2,22,24,1.0833333333333333,0.0576303395673437,563,Now I know how our gerbil felt.
1778,0,2,22,24,1.0833333333333333,0.0576303395673437,563,Can I call you back when I'm done with this metaphor?
1778,0,2,22,24,1.0833333333333333,0.0576303395673437,563,When Sam realized the wheel was the only consistent predictor in the mouse longevity experiment
1778,0,2,22,24,1.0833333333333333,0.0576303395673437,563,"The best investment in my mind is 'Water'. It's getting harder to reach every day. I'm telling everyone ""Buy Water""."
1778,0,2,22,24,1.0833333333333333,0.0576303395673437,563,I'm never joining a gym/animal shelter again.
1778,0,2,22,24,1.0833333333333333,0.0576303395673437,563,New CEO's first pet. Life expectancy: Two years
1778,0,2,22,24,1.0833333333333333,0.0576303395673437,563,I'm almost done here. Home in a few months.
1778,0,2,22,24,1.0833333333333333,0.0576303395673437,563,Can I call you back? I'm running fate.
1778,0,2,22,24,1.0833333333333333,0.0576303395673437,563,"The worst of it was over, thought Jared, freshly neutered."
1778,0,2,22,24,1.0833333333333333,0.0576303395673437,563,When the stand-up desk just isn't enough.
1778,0,2,22,24,1.0833333333333333,0.0576303395673437,563,Can we go back to testing animals?
1778,1,0,23,24,1.0833333333333333,0.08333333333333331,563,"Bob Mankoff will never rest on his plaudits, he will keep spinning his wheel..."
1778,0,2,22,24,1.0833333333333333,0.0576303395673437,563,"The rat race meets a 10,000 step daily goal."
1778,0,2,22,24,1.0833333333333333,0.0576303395673437,563,"I evolved this way because there used to be something called dry land, before the bipedals messed it up."
1778,0,2,22,24,1.0833333333333333,0.0576303395673437,563,"On this week's teleconference, Bob was too chatty to realize the cage door had been left wide open."
1778,0,2,22,24,1.0833333333333333,0.0576303395673437,563,"No, Gus is just my pet name."
1778,0,2,22,24,1.0833333333333333,0.0576303395673437,563,Wait a minute .... I'm coming.
1778,1,0,23,24,1.0833333333333333,0.08333333333333331,563,"Yeah, I'm working from home these days, but it's still a rat race."
1778,0,2,22,24,1.0833333333333333,0.0576303395673437,563,This conversation is going nowhere.
1778,0,2,22,24,1.0833333333333333,0.0576303395673437,563,"Yes, it is 'me' again. Why is it that every time I call about my cable bill your company leaves me feeling like I'm running in circles?"
1778,0,2,22,24,1.0833333333333333,0.0576303395673437,563,A day without a hamster.
1778,0,2,22,24,1.0833333333333333,0.0576303395673437,563,"Yes, I'm working from home now. I hated the confines of an office."
1778,0,2,22,24,1.0833333333333333,0.0576303395673437,563,Get Pavlov on the line...now!
1778,0,2,22,24,1.0833333333333333,0.0576303395673437,563,The corporate ladder was better.
1778,0,2,22,24,1.0833333333333333,0.0576303395673437,563,"Sharktank said ""It's not big enough and build it in Pink""."
1778,0,2,22,24,1.0833333333333333,0.0576303395673437,563,"Helen, please put out a memo that the board approved the roll out of plastic balls starting next quarter."
1778,0,2,22,24,1.0833333333333333,0.0576303395673437,563,So glad I'm not in the mail room anymore. Finally feeling some dignity.
1778,0,2,22,24,1.0833333333333333,0.0576303395673437,563,I'm starting a revolution!
1778,0,2,22,24,1.0833333333333333,0.0576303395673437,563,The next Aid Station is only two miles away.
1778,0,2,22,24,1.0833333333333333,0.0576303395673437,563,Walking desks are for wimps.
1778,0,2,22,24,1.0833333333333333,0.0576303395673437,563,I always get the run-around at work.
1778,0,2,22,24,1.0833333333333333,0.0576303395673437,563,Honey! Two more minutes and we should have enough power to toast the bagels!
1778,1,0,23,24,1.0833333333333333,0.08333333333333331,563,They told me I'm in line for a corner wheel.
1778,0,2,22,24,1.0833333333333333,0.0576303395673437,563,"Just another Monday, spinning my wheel."
1778,0,2,22,24,1.0833333333333333,0.0576303395673437,563,"I'm calling to let you know about a ""wheel revolution"" in office furniture."
1778,1,0,23,24,1.0833333333333333,0.08333333333333331,563,"New day, same old human race."
1778,0,2,22,24,1.0833333333333333,0.0576303395673437,563,"Let me get Back to you, I'm in the middle of something"
1778,0,2,22,24,1.0833333333333333,0.0576303395673437,563,This is what I get for trying to lower my premiums.
1778,0,2,22,24,1.0833333333333333,0.0576303395673437,563,I'm just not getting anywhere with this job.
1778,0,2,22,24,1.0833333333333333,0.0576303395673437,563,listen I'm trying but I just can't seem to get any where.
1778,1,0,23,24,1.0833333333333333,0.08333333333333331,563,"Trump denies his spin doctor, Spicer, is in fact a hamster."
1778,0,2,22,24,1.0833333333333333,0.0576303395673437,563,Keep Away from Runaround Stu
1778,0,2,22,24,1.0833333333333333,0.0576303395673437,563,They say this will make me outlive Methuselah
1778,0,2,22,24,1.0833333333333333,0.0576303395673437,563,I'm looking forward to a nice warm tunnel after this.
1778,0,2,22,24,1.0833333333333333,0.0576303395673437,563,"Honey, I promise I'll be home just as soon as I finish the rat race."
1778,0,2,22,24,1.0833333333333333,0.0576303395673437,563,Let me introduce you to our company's new wellness program.
1778,0,2,22,24,1.0833333333333333,0.0576303395673437,563,We implemented an open door policy to prevent burnout.
1778,0,2,22,24,1.0833333333333333,0.0576303395673437,563,His one and only request for gym membership as a perk did not turn out well.
1778,1,0,23,24,1.0833333333333333,0.08333333333333331,563,No I don't need a break. Replacing the water with vodka was genius!
1778,0,2,22,24,1.0833333333333333,0.0576303395673437,563,To hell with the stand-up desk.
1778,0,2,22,24,1.0833333333333333,0.0576303395673437,563,Me? Busy. You?
1778,0,2,22,24,1.0833333333333333,0.0576303395673437,563,I thought this would stop after I accepted all those Linked-In requests.
1778,0,2,22,24,1.0833333333333333,0.0576303395673437,563,"Yeah, the Intern is a no-show again."
1778,0,2,22,24,1.0833333333333333,0.0576303395673437,563,Moving to D.C. has definitely opened doors for me.
1778,1,0,23,24,1.0833333333333333,0.08333333333333331,563,It's one way to drink on the job
1778,0,2,22,24,1.0833333333333333,0.0576303395673437,563,The testosterone spray is much better than the estrogen!
1778,0,2,22,24,1.0833333333333333,0.0576303395673437,563,"Please inform Drew that this is technically a hamster wheel, not a rat race..."
1778,0,2,22,24,1.0833333333333333,0.0576303395673437,563,"Hon, I think my boss is beginning to notice me--he just told me to keep up the good pace."
1778,0,2,22,24,1.0833333333333333,0.0576303395673437,563,Going Ham(ster) on your workout.
1778,0,2,22,24,1.0833333333333333,0.0576303395673437,563,"Marx was wrong, Marx was wrong, Marx was wrong..."
1778,0,2,22,24,1.0833333333333333,0.0576303395673437,563,"Help, how do you stop this wheel?"
1778,1,0,23,24,1.0833333333333333,0.08333333333333331,563,"Alexa, order more wood chips and find a ENT doctor to come over and clean my cheek pouches."
1778,0,2,22,24,1.0833333333333333,0.0576303395673437,563,"I think the ""We Know Hamsters"" campaign's losing steam."
1778,0,2,22,24,1.0833333333333333,0.0576303395673437,563,Standing desks are for losers.
1778,0,2,22,24,1.0833333333333333,0.0576303395673437,563,The American Dream?
1778,0,2,22,24,1.0833333333333333,0.0576303395673437,563,Then I discovered that all progress is just an illusion.
1778,0,2,22,24,1.0833333333333333,0.0576303395673437,563,"Yeah, this could be it...they said I'm inner circle material."
1778,0,2,22,24,1.0833333333333333,0.0576303395673437,563,I hope they fix the treadmill soon.
1778,0,2,22,24,1.0833333333333333,0.0576303395673437,563,And schedule a lunch meeting at that new Alfalfa place.
1778,0,2,22,24,1.0833333333333333,0.0576303395673437,563,Is this what we look like to God?
1778,0,2,22,24,1.0833333333333333,0.0576303395673437,563,"3,000,001, 3,000,002, 3,000,003'........."
1778,0,2,22,24,1.0833333333333333,0.0576303395673437,563,"For the fish/pigeon cartoon: ""Ok, I'm a rat with wings. I've decided to own it."""
1778,0,2,22,24,1.0833333333333333,0.0576303395673437,563,"Honey, if I leave work early tonight I'll never get ahead."
1778,0,2,22,24,1.0833333333333333,0.0576303395673437,563,C-a-d-m-e-a-n!
1778,0,2,22,24,1.0833333333333333,0.0576303395673437,563,The flip side of the future seen in 2017's Doodle 4 Google...
1778,0,2,22,24,1.0833333333333333,0.0576303395673437,563,I'm on my lunch break.
1778,1,0,23,24,1.0833333333333333,0.08333333333333331,563,I still don't understand why I need this tie!
1778,0,2,22,24,1.0833333333333333,0.0576303395673437,563,Training for yet another rat race...
1778,0,2,22,24,1.0833333333333333,0.0576303395673437,563,Husbands always treated like an animal.
1778,0,2,22,24,1.0833333333333333,0.0576303395673437,563,I don't get it why would the hamster run away from such a luxurious amenity
1778,0,2,22,24,1.0833333333333333,0.0576303395673437,563,My cellphone is almost charged
1778,0,2,22,24,1.0833333333333333,0.0576303395673437,563,"Is this why the call it ""the rat race""?"
1778,0,2,22,24,1.0833333333333333,0.0576303395673437,563,The modern Sisyphus.
1778,0,2,22,24,1.0833333333333333,0.0576303395673437,563,Fitbit sales employee of the month
1778,0,2,22,24,1.0833333333333333,0.0576303395673437,563,Invest in pedometer stock.
1778,1,0,23,24,1.0833333333333333,0.08333333333333331,563,America! America. God shed his grace on thee!
1778,0,2,22,24,1.0833333333333333,0.0576303395673437,563,"The market is cyclical."""
1778,0,2,22,24,1.0833333333333333,0.0576303395673437,563,It's for science they said... It'll be fun they said...
1778,0,2,22,24,1.0833333333333333,0.0576303395673437,563,"I know the meeting is at two, but this required medical treatment won't allow me out the door."
1778,0,2,22,24,1.0833333333333333,0.0576303395673437,563,Big wheels keep on turning!
1778,0,2,22,24,1.0833333333333333,0.0576303395673437,563,I really feel like I'm going places.
1778,0,2,22,24,1.0833333333333333,0.0576303395673437,563,"If you think this is bad, wait till you taste one of the food pellets."
1778,0,2,22,24,1.0833333333333333,0.0576303395673437,563,"Progress is great, but nothing fills the day like activity."
1778,0,2,22,24,1.0833333333333333,0.0576303395673437,563,Trying to keep ahead of investigations.
1778,1,0,23,24,1.0833333333333333,0.08333333333333331,563,"guns, taxes, deregulation"
1778,0,2,22,24,1.0833333333333333,0.0576303395673437,563,''The job's gone from being a joke to a metaphor. Just like everything else.''
1778,1,0,23,24,1.0833333333333333,0.08333333333333331,563,David really wanted to be Employee of the Month
1778,0,2,22,24,1.0833333333333333,0.0576303395673437,563,"When Trump said he'd bring more jobs to town, this isn't what I had in mind."
1778,0,2,22,24,1.0833333333333333,0.0576303395673437,563,"Um, I know it's sustainable but do you have anything softer than cedar?"
1778,1,0,23,24,1.0833333333333333,0.08333333333333331,563,They told me that I'd be out of the rat race....
1778,0,2,22,24,1.0833333333333333,0.0576303395673437,563,Progress on this deal has been slow in coming.
1778,0,2,22,24,1.0833333333333333,0.0576303395673437,563,"Sorry, I can't leave work yet. My boss has me running in circles"
1778,0,2,22,24,1.0833333333333333,0.0576303395673437,563,Sorry about all the noise. I'm calling from my home office.
1778,0,2,22,24,1.0833333333333333,0.0576303395673437,563,"Yes, I quit the rat race to work from home."
1778,1,0,23,24,1.0833333333333333,0.08333333333333331,563,"Well, ok. I'll take the global warming."
1778,0,2,22,24,1.0833333333333333,0.0576303395673437,563,It's definitely a multitasking breakthrough but sometimes I can't resist dropping down on all fours to relieve myself in the wood chips...
1778,0,2,22,24,1.0833333333333333,0.0576303395673437,563,"Sure, but it's just until December. I'm up for a bigger wheel."
1778,1,0,23,24,1.0833333333333333,0.08333333333333331,563,I'll find that damn hamster even if it takes all day!
1778,0,2,22,24,1.0833333333333333,0.0576303395673437,563,Cancel my one o'clock--I think I'm getting somewhere.
1778,0,2,22,24,1.0833333333333333,0.0576303395673437,563,Just think...in thirty years I can retire...
1778,0,2,22,24,1.0833333333333333,0.0576303395673437,563,"Hello, Humane Society?...I have a complaint..."
1778,0,2,22,24,1.0833333333333333,0.0576303395673437,563,"After this, I'm getting a huge hunk of cheese."
1778,0,2,22,24,1.0833333333333333,0.0576303395673437,563,"I'm not getting anywhere in this job, but the perks are good."
1778,0,2,22,24,1.0833333333333333,0.0576303395673437,563,Same old! Same old!
1778,1,0,23,24,1.0833333333333333,0.08333333333333331,563,Tell those hamsters their bathroom break is over!!
1778,1,0,23,24,1.0833333333333333,0.08333333333333331,563,The boss has a different definition of 'telecommute.'
1778,0,2,22,24,1.0833333333333333,0.0576303395673437,563,"Dr. Johnson, when will this stress be over? Dr. Johnson?"
1778,0,2,22,24,1.0833333333333333,0.0576303395673437,563,The politician that will one day have to drink the water from Flint.
1778,1,0,23,24,1.0833333333333333,0.08333333333333331,563,Sisyphus Redux--Wall Street Version
1778,0,2,22,24,1.0833333333333333,0.0576303395673437,563,What a rat race!
1778,0,2,22,24,1.0833333333333333,0.0576303395673437,563,This is an awesome break from my daily routine's vicious circle!
1778,0,2,22,24,1.0833333333333333,0.0576303395673437,563,"Nope, just the seeds."
1778,0,2,22,24,1.0833333333333333,0.0576303395673437,563,"How is ""always""? Is ""always"" good for you?"
1778,0,2,22,24,1.0833333333333333,0.0576303395673437,563,"Okay,I'm leading the gerbil.But by how much?"
1778,0,2,22,24,1.0833333333333333,0.0576303395673437,563,We just launched a corporate truth-telling initiative.
1778,0,2,22,24,1.0833333333333333,0.0576303395673437,563,Wheeling and dealing
1778,1,0,23,24,1.0833333333333333,0.08333333333333331,563,I hear they're adding a tower to our office tomorrow.
1778,0,2,22,24,1.0833333333333333,0.0576303395673437,563,That's not workers on the roof.
1778,0,2,22,24,1.0833333333333333,0.0576303395673437,563,When do I turn to unwind this thing?
1778,0,2,22,24,1.0833333333333333,0.0576303395673437,563,"For those in the corner office, turn-over was common."
1778,1,0,23,24,1.0833333333333333,0.08333333333333331,563,John thought of himself as quite the wheeler dealer
1778,0,2,22,24,1.0833333333333333,0.0576303395673437,563,"Yes, still tracking the source."
1778,0,2,22,24,1.0833333333333333,0.0576303395673437,563,Yup! Livin' the dream.
1778,0,2,22,24,1.0833333333333333,0.0576303395673437,563,Enough already! I swear never again I tell 'Putin on the ritz' joke'!
1778,0,2,22,24,1.0833333333333333,0.0576303395673437,563,They told me I was joining the rat race...someone told me wrong.
1778,0,2,22,24,1.0833333333333333,0.0576303395673437,563,Is he the new guinea pig?
1778,0,2,22,24,1.0833333333333333,0.0576303395673437,563,Gerbil? Who said gerbil?
1778,0,2,22,24,1.0833333333333333,0.0576303395673437,563,"That's your toothbrush charged, Sally. Now attach the car."
1778,0,2,22,24,1.0833333333333333,0.0576303395673437,563,"Shoot, I'm late for work! Can't this thing go any faster?!"
1778,0,2,22,24,1.0833333333333333,0.0576303395673437,563,These workplace health programs are getting out of control.
1778,0,2,22,24,1.0833333333333333,0.0576303395673437,563,"Like rodents, humans are highly motivated to run in wheels. Voluntary wheel-running is an indicator of workplace satisfaction, ambition and focus."
1778,0,2,22,24,1.0833333333333333,0.0576303395673437,563,"Mom, you won't believe my new office."
1778,1,0,23,24,1.0833333333333333,0.08333333333333331,563,Must...continue...to pursue...the Russia hacking the election...story.
1778,0,2,22,24,1.0833333333333333,0.0576303395673437,563,They promoted me from gopher to hamster.
1778,0,2,22,24,1.0833333333333333,0.0576303395673437,563,Management uses Milo as a guinea pig in sales.
1778,0,2,22,24,1.0833333333333333,0.0576303395673437,563,Have I made it to success yet?
1778,0,2,22,24,1.0833333333333333,0.0576303395673437,563,I'm here on a rotating basis. The pay is peanuts but the benefits are cushy.
1778,1,0,23,24,1.0833333333333333,0.08333333333333331,563,Your new running wheel will decrease healthcare costs and provide clean energy. Buy yours today.
1778,0,2,22,24,1.0833333333333333,0.0576303395673437,563,I'm faster than the hamsters and I don't eat the plants!
1778,0,2,22,24,1.0833333333333333,0.0576303395673437,563,Dan's working on renewable energy
1778,1,0,23,24,1.0833333333333333,0.08333333333333331,563,"No, boss, that's not the sound of a big wheel. My office is right next to the railroad tracks."
1778,0,2,22,24,1.0833333333333333,0.0576303395673437,563,"To hell with the rat race, I joined the gerbil race."
1778,0,2,22,24,1.0833333333333333,0.0576303395673437,563,Water? It's suposed to be vodka!
1778,0,2,22,24,1.0833333333333333,0.0576303395673437,563,"Yeah, it's a rat race, but it's a lot better than the boiler room."
1778,0,2,22,24,1.0833333333333333,0.0576303395673437,563,You'd think think this gig would be a bit more dress casual !?
1778,0,2,22,24,1.0833333333333333,0.0576303395673437,563,"Now, if you will follow me into the next room, we find a rare example of commuter still preserved in its wild state, running late for its train."
1778,0,2,22,24,1.0833333333333333,0.0576303395673437,563,Now I know how a gerbil feels!
1778,1,0,23,24,1.0833333333333333,0.08333333333333331,563,A new spin on Spin.
1778,0,2,22,24,1.0833333333333333,0.0576303395673437,563,Being the Announcer on Wheel of Fortune has gotten much trickier these days
1778,0,2,22,24,1.0833333333333333,0.0576303395673437,563,I think I pulled a hammy!
1778,1,0,23,24,1.0833333333333333,0.08333333333333331,563,"Honey, I'll be home next May 21st."
1778,0,2,22,24,1.0833333333333333,0.0576303395673437,563,"Well, if it's done nothing else, at least it's increased my sense of déjà vu."
1778,0,2,22,24,1.0833333333333333,0.0576303395673437,563,alright then. Just let me know when your phone is charged.
1778,0,2,22,24,1.0833333333333333,0.0576303395673437,563,"Most days my job feels like a rat race, but that God it's only 9 to 5."
1778,0,2,22,24,1.0833333333333333,0.0576303395673437,563,I just feel like I'm running in circles
1778,0,2,22,24,1.0833333333333333,0.0576303395673437,563,"Look, as long as the hamster's numbers stay this good, no need to tell the boss about the job switch."
1778,0,2,22,24,1.0833333333333333,0.0576303395673437,563,I'm just trying to get in better shape in case I lose my White House job and am impersonated by someone on Saturday Night Live.
1778,0,2,22,24,1.0833333333333333,0.0576303395673437,563,"I'll meet you at the tube, cheerio!"
1778,0,2,22,24,1.0833333333333333,0.0576303395673437,563,"Help me! This wheel is stuck- the water bottle spout and window sill extension go right through it."""
1778,0,2,22,24,1.0833333333333333,0.0576303395673437,563,I don't seem to be getting any closer to the door.
1778,0,2,22,24,1.0833333333333333,0.0576303395673437,563,"If I have to be in the rat race, I might as well enjoy it."
1778,0,2,22,24,1.0833333333333333,0.0576303395673437,563,"Yikes, am I a man or a mouse?"
1778,0,2,22,24,1.0833333333333333,0.0576303395673437,563,It's great for my productivity and puts a positive spin on the whole rat race concept.
1778,0,2,22,24,1.0833333333333333,0.0576303395673437,563,Wish I had brought my trainers.
1778,0,2,22,24,1.0833333333333333,0.0576303395673437,563,So you’re sure this cures cancer?
1778,0,2,22,24,1.0833333333333333,0.0576303395673437,563,The Unexamined Life Is Not Worth Living
1778,0,2,22,24,1.0833333333333333,0.0576303395673437,563,Weeeeeeeeeee
1778,0,2,22,24,1.0833333333333333,0.0576303395673437,563,Let me run some figures by you.
1778,0,2,22,24,1.0833333333333333,0.0576303395673437,563,I'm going to win this rat race.
1778,0,2,22,24,1.0833333333333333,0.0576303395673437,563,"I dont mind it so much, it's the only exercise that I get..."
1778,1,0,23,24,1.0833333333333333,0.08333333333333331,563,I gave the gerbil the week off.
1778,0,2,22,24,1.0833333333333333,0.0576303395673437,563,No metaphor at all. I literally can't get off this hamster wheel.
1778,1,0,23,24,1.0833333333333333,0.08333333333333331,563,"Listen, I'm gonna have to let you go, my cedar chip guy is calling."
1778,0,2,22,24,1.0833333333333333,0.0576303395673437,563,Memo to self: Update the dress code.
1778,0,2,22,24,1.0833333333333333,0.0576303395673437,563,Only 20 more years to retirement.
1778,1,0,23,24,1.0833333333333333,0.08333333333333331,563,A look into the American Ninja offices.
1778,1,0,23,24,1.0833333333333333,0.08333333333333331,563,"Hi Hon, I've just gotten the prototype working!"
1778,0,2,22,24,1.0833333333333333,0.0576303395673437,563,I had to get out of the rat race!
1778,0,2,22,24,1.0833333333333333,0.0576303395673437,563,"It was the only way I could get my daily 10,000 steps in."
1778,0,2,22,24,1.0833333333333333,0.0576303395673437,563,Wow! This is exactly where I saw myself in five years!
1778,0,2,22,24,1.0833333333333333,0.0576303395673437,563,"As the king of turnaround specialists, I've returned countless unicorns to solvency."
1778,0,2,22,24,1.0833333333333333,0.0576303395673437,563,"Apparently, it wasn't cute to ask for a ""pro-motion"""
1778,1,0,23,24,1.0833333333333333,0.08333333333333331,563,"Give me a few more days, I feel like I'm really starting to make some progress"
1778,0,2,22,24,1.0833333333333333,0.0576303395673437,563,BodyShredder! Work out! Have fun! All while disappearing those pesky records linking you to Russia.
1778,0,2,22,24,1.0833333333333333,0.0576303395673437,563,Apartment available. Modern living setup perfect for those who work from home.
1778,0,2,22,24,1.0833333333333333,0.0576303395673437,563,Ok. I'll meet you at the White House as soon as I'm done here.
1778,0,2,22,24,1.0833333333333333,0.0576303395673437,563,"I'm going to need the flea powder in a minute, Angie."
1778,0,2,22,24,1.0833333333333333,0.0576303395673437,563,Success is right around the corner!
1778,0,2,22,24,1.0833333333333333,0.0576303395673437,563,You gotta get one! My fitness tracker put me back in control of my life...
1778,0,2,22,24,1.0833333333333333,0.0576303395673437,563,Why don't I take the tube and meet you at Charing Cross?
1778,0,2,22,24,1.0833333333333333,0.0576303395673437,563,"Everyone says New York apartments are small, but mine goes on for days!"
1778,0,2,22,24,1.0833333333333333,0.0576303395673437,563,"Sir, I'm sorry but you misunderstood when the staff requested an exercise room."
1778,0,2,22,24,1.0833333333333333,0.0576303395673437,563,"Yes, sir. I'm running those numbers as we speak."
1778,0,2,22,24,1.0833333333333333,0.0576303395673437,563,"Martha, I want that auto-feeder yesterday."
