rank,funny,somewhat_funny,unfunny,count,score,precision,contest,caption
2901,0,3,30,33,1.0909090909090908,0.05081972676135885,570,That's what you get for shopping at Whole Foods.
2901,0,3,30,33,1.0909090909090908,0.05081972676135885,570,That wasn't cologne. It was worm juice.
2901,0,3,30,33,1.0909090909090908,0.05081972676135885,570,"Well, it's because I'm a failed scarecrow."
2901,1,1,31,33,1.0909090909090908,0.06690727929036247,570,Maybe you should back off on the granola.
2901,0,3,30,33,1.0909090909090908,0.05081972676135885,570,That's not what I meant by a tweet storm!
2901,0,3,30,33,1.0909090909090908,0.05081972676135885,570,"Damn, Bill. You should really slow down on the tweeting."
2901,0,3,30,33,1.0909090909090908,0.05081972676135885,570,I said you'd look good in Barleycorn 'tweeds.'
2901,1,1,31,33,1.0909090909090908,0.06690727929036247,570,"Just before Passover, you are supposed to be crumb free."
2901,0,3,30,33,1.0909090909090908,0.05081972676135885,570,"Friend, you really have gone to seed"
2901,0,3,30,33,1.0909090909090908,0.05081972676135885,570,I'd say you're? more of a chickadee magnet.
2901,1,1,31,33,1.0909090909090908,0.06690727929036247,570,Feelin' cumby?
2901,0,3,30,33,1.0909090909090908,0.05081972676135885,570,That suet-scented cologne is really doing it for you.
2901,0,3,30,33,1.0909090909090908,0.05081972676135885,570,"Like I said, ""Flock you!"""
2901,0,3,30,33,1.0909090909090908,0.05081972676135885,570,"Well, this one is for the birds!"
2901,0,3,30,33,1.0909090909090908,0.05081972676135885,570,I preferred 'Psycho'.
2901,0,3,30,33,1.0909090909090908,0.05081972676135885,570,"Yes, when you sat down, I thought you looked seedy."
2901,1,1,31,33,1.0909090909090908,0.06690727929036247,570,Tuppence a bag eh?
2901,0,3,30,33,1.0909090909090908,0.05081972676135885,570,"Catchy tune, Katniss."
2901,1,1,31,33,1.0909090909090908,0.06690727929036247,570,"Baby, what is a three-letter word for a sticky substance?"
2901,0,3,30,33,1.0909090909090908,0.05081972676135885,570,"When the kindly old woman singing ""tuppence a bag"" turns out to be a hired assassin..."
2901,0,3,30,33,1.0909090909090908,0.05081972676135885,570,Are you trying to do TWEETS again? I thought you learned your lesson last time.
2901,0,3,30,33,1.0909090909090908,0.05081972676135885,570,"""Maybe you should have brushed the crumbs off your shirt""'"
2901,0,3,30,33,1.0909090909090908,0.05081972676135885,570,Maybe an occasional shower would help
2901,1,1,31,33,1.0909090909090908,0.06690727929036247,570,"""Your friends missed Capistrano by a long shot""."
2901,0,3,30,33,1.0909090909090908,0.05081972676135885,570,"So, just when did you get out of Alcatraz?"
2901,0,3,30,33,1.0909090909090908,0.05081972676135885,570,Looks like you've gone to seed.
2901,0,3,30,33,1.0909090909090908,0.05081972676135885,570,"Okay, ""Camp Town Races"" works, too. Try whistling the theme to ""Bonanza."""
2901,0,3,30,33,1.0909090909090908,0.05081972676135885,570,"I warned you, Mr. Peanut."
2901,0,3,30,33,1.0909090909090908,0.05081972676135885,570,"So, Mr. Hitchcock, what will your next movie be about?"
2901,0,3,30,33,1.0909090909090908,0.05081972676135885,570,I use eau de feline.
2901,0,3,30,33,1.0909090909090908,0.05081972676135885,570,I told you not to touch them right after they hatch.
2901,1,1,31,33,1.0909090909090908,0.06690727929036247,570,Noah? Is that you?
2901,1,1,31,33,1.0909090909090908,0.06690727929036247,570,I told you that cool beard would come to no good
2901,1,1,31,33,1.0909090909090908,0.06690727929036247,570,I knew they'd reject your panko substitute.
2901,1,1,31,33,1.0909090909090908,0.06690727929036247,570,Cinderella will be so jealous.
2901,0,3,30,33,1.0909090909090908,0.05081972676135885,570,I told you not to retweet.
2901,1,1,31,33,1.0909090909090908,0.06690727929036247,570,Your after shave attracts chicks. Happy now?
2901,1,1,31,33,1.0909090909090908,0.06690727929036247,570,"You might want to cut back on your Tweeting, Mr. President."
2901,1,1,31,33,1.0909090909090908,0.06690727929036247,570,"Eaten up by Pacifism, are you. Would you like to talk about it?"
2901,0,3,30,33,1.0909090909090908,0.05081972676135885,570,I was a statue in a previous life.
2901,1,1,31,33,1.0909090909090908,0.06690727929036247,570,"If you think this is unpleasant, wait for the falcons show up."
2901,0,3,30,33,1.0909090909090908,0.05081972676135885,570,Don't feed the humans!
2901,1,1,31,33,1.0909090909090908,0.06690727929036247,570,Bard College? More like Bird College if you ask me.
2901,0,3,30,33,1.0909090909090908,0.05081972676135885,570,Not so nice being pixelated is it Bob?
2901,0,3,30,33,1.0909090909090908,0.05081972676135885,570,It says right here only 69 percent of of your carbon came from corn.
2901,0,3,30,33,1.0909090909090908,0.05081972676135885,570,New suet of clothes?
2901,0,3,30,33,1.0909090909090908,0.05081972676135885,570,"You're supposed to throw them! You hold onto the bread pieces, well........"
2901,0,3,30,33,1.0909090909090908,0.05081972676135885,570,Mind your own flocking business!
2901,0,3,30,33,1.0909090909090908,0.05081972676135885,570,Boy that guy must be covered in birdseed...or they think he's a statue
2901,0,3,30,33,1.0909090909090908,0.05081972676135885,570,You really are a chick magnet.
2901,0,3,30,33,1.0909090909090908,0.05081972676135885,570,"Oh sure, they would take your side."
2901,0,3,30,33,1.0909090909090908,0.05081972676135885,570,Ticks or fleas?
2901,0,3,30,33,1.0909090909090908,0.05081972676135885,570,Blame it on those organic crumbs!
2901,0,3,30,33,1.0909090909090908,0.05081972676135885,570,"You can get on a ""do not call"" list if you want."
2901,1,1,31,33,1.0909090909090908,0.06690727929036247,570,How long have you been working at the granary?
2901,1,1,31,33,1.0909090909090908,0.06690727929036247,570,"I think I know you...'Home Alone 2', right?"
2901,1,1,31,33,1.0909090909090908,0.06690727929036247,570,Are you nuts?
2901,0,3,30,33,1.0909090909090908,0.05081972676135885,570,That bird call app really works!
2901,0,3,30,33,1.0909090909090908,0.05081972676135885,570,You really are a worm.
2901,1,1,31,33,1.0909090909090908,0.06690727929036247,570,And which Hitchcock film are you referring to?
2901,0,3,30,33,1.0909090909090908,0.05081972676135885,570,Maybe you should stop tweeting so much.
2901,0,3,30,33,1.0909090909090908,0.05081972676135885,570,DO YOU REALLY THINK THAT SUIT MADE FROM BIRD SEED WILL CATCH ON?
2901,0,3,30,33,1.0909090909090908,0.05081972676135885,570,I see your habit of rolling in bird seed is finally paying off.
2901,0,3,30,33,1.0909090909090908,0.05081972676135885,570,Have you tried reporting them to Twitter?
2901,1,1,31,33,1.0909090909090908,0.06690727929036247,570,Alfred's Epiphany
2901,1,1,31,33,1.0909090909090908,0.06690727929036247,570,"So, I hear you're high on the pecking order."
2901,0,3,30,33,1.0909090909090908,0.05081972676135885,570,I suggest wearing something other than Civil War uniforms.
2901,0,3,30,33,1.0909090909090908,0.05081972676135885,570,The Rubber Band Man has nothing on you.
2901,1,1,31,33,1.0909090909090908,0.06690727929036247,570,"The book is called ""Without Feathers."" I'll be glad to loan it to you when I'm done."
2901,1,1,31,33,1.0909090909090908,0.06690727929036247,570,Audubon is that you?
2901,0,3,30,33,1.0909090909090908,0.05081972676135885,570,"New Cologne, Stan?"
2901,0,3,30,33,1.0909090909090908,0.05081972676135885,570,Another tweetstorm?
2901,0,3,30,33,1.0909090909090908,0.05081972676135885,570,How's that vegan suit working out for you?
2901,0,3,30,33,1.0909090909090908,0.05081972676135885,570,.....and that's why I don't buy my clothing at Old Navy.
2901,0,3,30,33,1.0909090909090908,0.05081972676135885,570,I told you you smell fowl.
2901,0,3,30,33,1.0909090909090908,0.05081972676135885,570,I thought you were gluten free.
2901,0,3,30,33,1.0909090909090908,0.05081972676135885,570,"No, I would not advise putting the nuts in your pocket."
2901,0,3,30,33,1.0909090909090908,0.05081972676135885,570,Too many tweets?
2901,0,3,30,33,1.0909090909090908,0.05081972676135885,570,"Are you wearing something different this morning, dear?"
2901,1,1,31,33,1.0909090909090908,0.06690727929036247,570,Can you turn the pages quieter? You are kind of distracting me.
2901,1,1,31,33,1.0909090909090908,0.06690727929036247,570,Tell me more about this new weight loss program.
2901,0,3,30,33,1.0909090909090908,0.05081972676135885,570,Didn't I read somewhere that Melanie Griffith's your daughter?
2901,0,3,30,33,1.0909090909090908,0.05081972676135885,570,"""Et tu?"" Mr. Hitchcock?"
2901,0,3,30,33,1.0909090909090908,0.05081972676135885,570,Has anyone ever told you that you're pigeon-toed?
2901,0,3,30,33,1.0909090909090908,0.05081972676135885,570,"You may want to consider a trade, Mr. Harvey. New York isn't for everyone."
2901,0,3,30,33,1.0909090909090908,0.05081972676135885,570,"I told you you were Tweeting too much, Carl. Look at all the unwanted followers you have now."
2901,1,1,31,33,1.0909090909090908,0.06690727929036247,570,"It says here ""Try changing your seedy clothes."""
2901,0,3,30,33,1.0909090909090908,0.05081972676135885,570,Try not to sit so still.
2901,1,1,31,33,1.0909090909090908,0.06690727929036247,570,"""Miss Hedren, I think you have something on your shoe""."
2901,0,3,30,33,1.0909090909090908,0.05081972676135885,570,At least you can't say they don't like you!
2901,0,3,30,33,1.0909090909090908,0.05081972676135885,570,That's another disadvantage of those biodegradable books that nobody talks about.
2901,0,3,30,33,1.0909090909090908,0.05081972676135885,570,You clearly went too far with that last tweet!
2901,0,3,30,33,1.0909090909090908,0.05081972676135885,570,Did you read the warning on the Eco Clothing fabric?
2901,1,1,31,33,1.0909090909090908,0.06690727929036247,570,There's a great laundromat around the corner that can get rid of those crumbs.
2901,0,3,30,33,1.0909090909090908,0.05081972676135885,570,"My brother has a dry cleaning business, and by the way St Francis never used seeds."
2901,0,3,30,33,1.0909090909090908,0.05081972676135885,570,Psh. What a pizza face.
2901,1,1,31,33,1.0909090909090908,0.06690727929036247,570,I'd cut back on tweeting.
2901,1,1,31,33,1.0909090909090908,0.06690727929036247,570,There seems to be a mutual attraction.
2901,0,3,30,33,1.0909090909090908,0.05081972676135885,570,"You're taking this 'birds of a feather' thing just a bit too seriously, Hank!"
2901,0,3,30,33,1.0909090909090908,0.05081972676135885,570,"Actually, it's The Peterson Field Guide to Eastern Birds"
2901,0,3,30,33,1.0909090909090908,0.05081972676135885,570,Love birds I presume.
2901,1,1,31,33,1.0909090909090908,0.06690727929036247,570,"So, is this your worst nightmare, Mr. Hitchcock?"
2901,1,1,31,33,1.0909090909090908,0.06690727929036247,570,Are you a seedy character?
2901,0,3,30,33,1.0909090909090908,0.05081972676135885,570,Tweet storm?
2901,0,3,30,33,1.0909090909090908,0.05081972676135885,570,I told you not to eat a whole bag of popcorn.
2901,0,3,30,33,1.0909090909090908,0.05081972676135885,570,I told you that you had a crummy personality.
2901,0,3,30,33,1.0909090909090908,0.05081972676135885,570,That's enough seven seed bread.
2901,0,3,30,33,1.0909090909090908,0.05081972676135885,570,Excuse me. Where do I find the Gingerbread Man?
2901,0,3,30,33,1.0909090909090908,0.05081972676135885,570,So feathers are the new fur?
2901,0,3,30,33,1.0909090909090908,0.05081972676135885,570,I told you this park is seedy.
2901,0,3,30,33,1.0909090909090908,0.05081972676135885,570,It looks like you've been flocked!
2901,0,3,30,33,1.0909090909090908,0.05081972676135885,570,"Next time, wash off all the bagel seeds before you come here."
2901,0,3,30,33,1.0909090909090908,0.05081972676135885,570,I'm having flashbacks of a terrifying Alfred Hitchcock movie I once saw.
2901,0,3,30,33,1.0909090909090908,0.05081972676135885,570,"So, what's all the "" flap"" about?"
2901,0,3,30,33,1.0909090909090908,0.05081972676135885,570,You are bread inside.
2901,1,1,31,33,1.0909090909090908,0.06690727929036247,570,Looks like you're the statue and the pigeon.
2901,0,3,30,33,1.0909090909090908,0.05081972676135885,570,Covering yourself with suet is not the same as a bird landing on your podium.
2901,1,1,31,33,1.0909090909090908,0.06690727929036247,570,Try not to dwell on the negative side of being statuesque.
2901,0,3,30,33,1.0909090909090908,0.05081972676135885,570,Maybe you should try changing your after shave lotion.
2901,1,1,31,33,1.0909090909090908,0.06690727929036247,570,The book is better than the movie.
2901,0,3,30,33,1.0909090909090908,0.05081972676135885,570,I warned you about wearing that silly feather hat.
2901,0,3,30,33,1.0909090909090908,0.05081972676135885,570,I wish my Twitter feed was that popular.
2901,0,3,30,33,1.0909090909090908,0.05081972676135885,570,"I've heard of seedy personalities, but this is absurd"
2901,1,1,31,33,1.0909090909090908,0.06690727929036247,570,Does your wife Robin know about this?
2901,1,1,31,33,1.0909090909090908,0.06690727929036247,570,"The Twitter Manual says you should delete your account, Mr. President."
2901,0,3,30,33,1.0909090909090908,0.05081972676135885,570,You should have taken Jim Lehrer's advice.
2901,0,3,30,33,1.0909090909090908,0.05081972676135885,570,I thought you were just being dramatic when you said you were going to seed.
2901,0,3,30,33,1.0909090909090908,0.05081972676135885,570,"Was it like this in Alcatraz, too?"
2901,1,1,31,33,1.0909090909090908,0.06690727929036247,570,"So, is this your first slime in New York?"
2901,0,3,30,33,1.0909090909090908,0.05081972676135885,570,It appears that you have gone to seed.
2901,0,3,30,33,1.0909090909090908,0.05081972676135885,570,Why don't you give up those crummy books?
2901,0,3,30,33,1.0909090909090908,0.05081972676135885,570,You might want to rethink the bread crumb body wash.
2901,0,3,30,33,1.0909090909090908,0.05081972676135885,570,I see you bought your suet at Barney's.
2901,1,1,31,33,1.0909090909090908,0.06690727929036247,570,Careless tweeting can have consequences.
2901,0,3,30,33,1.0909090909090908,0.05081972676135885,570,Have you seen the latest Hitchcock movie?
2901,0,3,30,33,1.0909090909090908,0.05081972676135885,570,"May I suggest Instagram, Mr. President."
2901,0,3,30,33,1.0909090909090908,0.05081972676135885,570,Lucky I wasn’t reading what that guy was reading.
2901,1,1,31,33,1.0909090909090908,0.06690727929036247,570,No I'm sorry I don't have a handkerchief.
2901,0,3,30,33,1.0909090909090908,0.05081972676135885,570,"Why do birds suddenly appear Every time you are near? Just like me, they long to be Close to you"
2901,0,3,30,33,1.0909090909090908,0.05081972676135885,570,Oh they match your shirt!
2901,0,3,30,33,1.0909090909090908,0.05081972676135885,570,Birdwatching?
2901,0,3,30,33,1.0909090909090908,0.05081972676135885,570,"You know, I have a similar problem -- only with mosquitoes."
2901,1,1,31,33,1.0909090909090908,0.06690727929036247,570,Immolation by birds - is that a new Occupy Park Bench protest strategy.
2901,0,3,30,33,1.0909090909090908,0.05081972676135885,570,I bet it tastes like chicken.
2901,0,3,30,33,1.0909090909090908,0.05081972676135885,570,"The bird-seed suit was a bad idea, I see"
2901,0,3,30,33,1.0909090909090908,0.05081972676135885,570,They have lint rollers as low as $1.99 at IKEA.
2901,0,3,30,33,1.0909090909090908,0.05081972676135885,570,I loved you in Mary Poppins.
2901,0,3,30,33,1.0909090909090908,0.05081972676135885,570,you've gotta real good whistle there buddy.
2901,1,1,31,33,1.0909090909090908,0.06690727929036247,570,I'm not sure you've really understood the key principles of camouflage
2901,0,3,30,33,1.0909090909090908,0.05081972676135885,570,"No, Mr Hitchcock, I don't have the time."
2901,0,3,30,33,1.0909090909090908,0.05081972676135885,570,Michael Keaton?
2901,0,3,30,33,1.0909090909090908,0.05081972676135885,570,I take it you're a regular here?
2901,0,3,30,33,1.0909090909090908,0.05081972676135885,570,"""You are the bread of their eye""."
2901,1,1,31,33,1.0909090909090908,0.06690727929036247,570,Your suit will go well with whatever perfume you're wearing
2901,0,3,30,33,1.0909090909090908,0.05081972676135885,570,I wouldn't pigeon hole you like that.
2901,1,1,31,33,1.0909090909090908,0.06690727929036247,570,"It can be a burden to have a lot of dough, huh?"
2901,0,3,30,33,1.0909090909090908,0.05081972676135885,570,"Crumbs, now that name makes sense!"
2901,1,1,31,33,1.0909090909090908,0.06690727929036247,570,"Mr Trump, I think carrier pigeons may be immigrants."
2901,0,3,30,33,1.0909090909090908,0.05081972676135885,570,Looks to me like you're flocked
2901,1,1,31,33,1.0909090909090908,0.06690727929036247,570,"Did I mention, I hate free range pigeons!"
2901,0,3,30,33,1.0909090909090908,0.05081972676135885,570,And then Miss Poppins said...
2901,0,3,30,33,1.0909090909090908,0.05081972676135885,570,I'm wondering mate if that bloody wizard might not have been British after all.
2901,0,3,30,33,1.0909090909090908,0.05081972676135885,570,That's why I stopped packing peanut butter sandwiches for lunch
2901,1,1,31,33,1.0909090909090908,0.06690727929036247,570,Maybe you should dial down your animal magnetism!
2901,0,3,30,33,1.0909090909090908,0.05081972676135885,570,If only I was tastier.
2901,0,3,30,33,1.0909090909090908,0.05081972676135885,570,you are undocumented?
2901,0,3,30,33,1.0909090909090908,0.05081972676135885,570,"Sir, the Special Counsel has been appointed, and you can't hide behind tweets forever."
2901,0,3,30,33,1.0909090909090908,0.05081972676135885,570,"I have a Tom Lehrer song on my I-Pod which you might find helpful."""
2901,0,3,30,33,1.0909090909090908,0.05081972676135885,570,Anything for attention.
2901,1,1,31,33,1.0909090909090908,0.06690727929036247,570,"Congressman, there are a few things I'd like to discuss with you"
2901,0,3,30,33,1.0909090909090908,0.05081972676135885,570,That's why I gave up Twitter.
2901,0,3,30,33,1.0909090909090908,0.05081972676135885,570,These Hitchcock stories are quite something.
2901,1,1,31,33,1.0909090909090908,0.06690727929036247,570,"Well, at least they're not buzzards."
2901,0,3,30,33,1.0909090909090908,0.05081972676135885,570,That's why I stopped ordering the everything bagel
2901,0,3,30,33,1.0909090909090908,0.05081972676135885,570,"Maybe if you changed your last name from ""Capistrano""?"
2901,1,1,31,33,1.0909090909090908,0.06690727929036247,570,This is why I don't eat bread.
2901,1,1,31,33,1.0909090909090908,0.06690727929036247,570,Tweeting in the park is not a good idea.
2901,1,1,31,33,1.0909090909090908,0.06690727929036247,570,Recycling?
2901,1,1,31,33,1.0909090909090908,0.06690727929036247,570,I loved Rear Window. Which Hitchcock movie was your favorite?
2901,0,3,30,33,1.0909090909090908,0.05081972676135885,570,Why can't you just let it go?
2901,1,1,31,33,1.0909090909090908,0.06690727929036247,570,This time you're really flocked!
2901,1,1,31,33,1.0909090909090908,0.06690727929036247,570,"Really? I, for one, love Hitchcock!"
2901,0,3,30,33,1.0909090909090908,0.05081972676135885,570,So you're looking for seed money?
2901,0,3,30,33,1.0909090909090908,0.05081972676135885,570,You must be feeding them gluten free grain.
2901,0,3,30,33,1.0909090909090908,0.05081972676135885,570,Did you not realize that the bird whistle holds the force?
2901,0,3,30,33,1.0909090909090908,0.05081972676135885,570,It says here they are attracted to seedy sorts who spend inordinate amounts of time on park benches and it's incurable.
2901,0,3,30,33,1.0909090909090908,0.05081972676135885,570,...another chapter in the weaponizing of everything.
2901,0,3,30,33,1.0909090909090908,0.05081972676135885,570,"You're right, they clearly show a preference for the gluten-free!"
2901,0,3,30,33,1.0909090909090908,0.05081972676135885,570,Yet another reason the book is better than the movie.
2901,1,1,31,33,1.0909090909090908,0.06690727929036247,570,"To be honest, I still think people will notice you."
2901,0,3,30,33,1.0909090909090908,0.05081972676135885,570,Any relation to the Bird Man of Alcatraz?
2901,0,3,30,33,1.0909090909090908,0.05081972676135885,570,I told you looking too statuesque would get you into trouble.
2901,0,3,30,33,1.0909090909090908,0.05081972676135885,570,I'm pretty sure you're tweeting wrong
2901,0,3,30,33,1.0909090909090908,0.05081972676135885,570,"Entry #1: I can give you the name of a good dry cleaner on East 73rd. Entry #2: Too much tweeting, eh Mr. President?"
2901,0,3,30,33,1.0909090909090908,0.05081972676135885,570,"Is your name Patsy, by chance?"
2901,0,3,30,33,1.0909090909090908,0.05081972676135885,570,Its becuase your clothes look so seedy.
2901,0,3,30,33,1.0909090909090908,0.05081972676135885,570,I told you that suit looked seedy.
2901,0,3,30,33,1.0909090909090908,0.05081972676135885,570,What's the pecking order?
2901,1,1,31,33,1.0909090909090908,0.06690727929036247,570,I TOLD YOU YOU'RE LOOKING SEEDY..
2901,0,3,30,33,1.0909090909090908,0.05081972676135885,570,"I used to share a bench with a guy covered in parakeets. Yeah, you heard me right, parakeets."
2901,0,3,30,33,1.0909090909090908,0.05081972676135885,570,When do you feed the squirrels?
2901,0,3,30,33,1.0909090909090908,0.05081972676135885,570,Life is like a box of chocolates. You just have to remember not to leave it open.
2901,0,3,30,33,1.0909090909090908,0.05081972676135885,570,It's the flaxseed in your vegan sunscreen.
2901,0,3,30,33,1.0909090909090908,0.05081972676135885,570,"There may be a downside to ""Briciole De Pane"" designer clothing"
2901,0,3,30,33,1.0909090909090908,0.05081972676135885,570,I see you're learning the pecking order.
2901,0,3,30,33,1.0909090909090908,0.05081972676135885,570,"Hitchcock, Alfred Hitchcock."
2901,0,3,30,33,1.0909090909090908,0.05081972676135885,570,I warned you about that bug repellent.
2901,0,3,30,33,1.0909090909090908,0.05081972676135885,570,Did you see the latest tweets?
2901,0,3,30,33,1.0909090909090908,0.05081972676135885,570,It's my environmentally friendly T-shirt.
2901,0,3,30,33,1.0909090909090908,0.05081972676135885,570,Do you Tweet?
2901,0,3,30,33,1.0909090909090908,0.05081972676135885,570,You look crumby...
2901,0,3,30,33,1.0909090909090908,0.05081972676135885,570,"Well , your suit is somewhat seedy."
2901,0,3,30,33,1.0909090909090908,0.05081972676135885,570,I guess seeding is believing!?
2901,0,3,30,33,1.0909090909090908,0.05081972676135885,570,"On page 63, It says you need to cut back on your consumption of peanuts!"
2901,0,3,30,33,1.0909090909090908,0.05081972676135885,570,"FYI, your You Tube video - ""The Birds - Part II"" has made the most viewed list."
2901,0,3,30,33,1.0909090909090908,0.05081972676135885,570,Is that the new Hitchcock biography?
2901,0,3,30,33,1.0909090909090908,0.05081972676135885,570,You said you are a descendent of St. Francis?
2901,0,3,30,33,1.0909090909090908,0.05081972676135885,570,The promise to 'attract more birds' is more literal here than in Britain.
2901,0,3,30,33,1.0909090909090908,0.05081972676135885,570,"Is that you, Tippi?"
2901,0,3,30,33,1.0909090909090908,0.05081972676135885,570,"Well, 'Flock' to you too!"
2901,0,3,30,33,1.0909090909090908,0.05081972676135885,570,Ah......a bird whisperer.
2901,0,3,30,33,1.0909090909090908,0.05081972676135885,570,"You look like Orville Redenbacher, that's why."
2901,0,3,30,33,1.0909090909090908,0.05081972676135885,570,Please stay still while I look-up each species.
2901,0,3,30,33,1.0909090909090908,0.05081972676135885,570,I had no idea you did bird calls.
2901,1,1,31,33,1.0909090909090908,0.06690727929036247,570,So there IS downside to being Mr. Peanut.
2901,0,3,30,33,1.0909090909090908,0.05081972676135885,570,Have you considered adjusting your gluten intake?
2901,0,3,30,33,1.0909090909090908,0.05081972676135885,570,I warned you not to get in a Twitter war with Trump.
2901,0,3,30,33,1.0909090909090908,0.05081972676135885,570,I guess you have reserved seed-ing.
2901,0,3,30,33,1.0909090909090908,0.05081972676135885,570,It means you eat too many carbs.
2901,0,3,30,33,1.0909090909090908,0.05081972676135885,570,That Hitchcock was stranger than fiction.
2901,1,1,31,33,1.0909090909090908,0.06690727929036247,570,"Mama always said, life is like a flock of hawklets."
2901,0,3,30,33,1.0909090909090908,0.05081972676135885,570,I told you not to jog in a suet suit.
2901,1,1,31,33,1.0909090909090908,0.06690727929036247,570,I have the name of a good cleaners if you need it.
2901,0,3,30,33,1.0909090909090908,0.05081972676135885,570,Wow! You're lucky! That's a yellow-bellied sap-sucker!
2901,0,3,30,33,1.0909090909090908,0.05081972676135885,570,I guess you're glad that cows don't fly.
2901,0,3,30,33,1.0909090909090908,0.05081972676135885,570,"Wow, this beats the internet."
2901,0,3,30,33,1.0909090909090908,0.05081972676135885,570,"Yeah, I thought his outfit looked a bit seedy."
2901,0,3,30,33,1.0909090909090908,0.05081972676135885,570,"You've convinced me of your animal magnetism, but I'm still not interested."
2901,0,3,30,33,1.0909090909090908,0.05081972676135885,570,"Let me guess... President of the ""Tippi Hedren"" fan club?"
2901,1,1,31,33,1.0909090909090908,0.06690727929036247,570,"See, "" I told you it was a ""seedy"" looking suit""!!"
2901,0,3,30,33,1.0909090909090908,0.05081972676135885,570,Audubon.com. Why?
2901,0,3,30,33,1.0909090909090908,0.05081972676135885,570,I hope you're sitting on newspaper.
2901,1,1,31,33,1.0909090909090908,0.06690727929036247,570,"Too much flaxseed on your granola again, Albert?"
2901,0,3,30,33,1.0909090909090908,0.05081972676135885,570,i hate it when he tweets via pigeon post.
2901,0,3,30,33,1.0909090909090908,0.05081972676135885,570,"I see you're busy at moment, sir, but do you have the time?"
2901,0,3,30,33,1.0909090909090908,0.05081972676135885,570,Holy shit!
2901,1,1,31,33,1.0909090909090908,0.06690727929036247,570,Maybe building a wall would help.
2901,0,3,30,33,1.0909090909090908,0.05081972676135885,570,What was that about a box of chocolates?
2901,1,1,31,33,1.0909090909090908,0.06690727929036247,570,Is that suet after shave lotion you have on?
