rank,funny,somewhat_funny,unfunny,count,score,precision,contest,caption
4250,0,1,24,25,1.04,0.040824829046386304,570,"I told you Fred, with these carrier pidgeons, you need to check your inbox every day."
4250,0,1,24,25,1.04,0.040824829046386304,570,"Hey, Mr. Audubon, would you please stop singing?"
4250,0,1,24,25,1.04,0.040824829046386304,570,"Okay, okay, this proves it -- you're the king of twitter."
4250,0,1,24,25,1.04,0.040824829046386304,570,Are you working undercover for the Environmental Protection Agency?
4250,0,1,24,25,1.04,0.040824829046386304,570,"I said wear a Suit, not Suet."
4250,0,1,24,25,1.04,0.040824829046386304,570,And Hitchcock still wouldn't take a meeting?
4250,0,1,24,25,1.04,0.040824829046386304,570,Hi Alfred
4250,0,1,24,25,1.04,0.040824829046386304,570,This book says the Bird Man of Alcatraz has reincarnated . . . Can I see your face?
4250,0,1,24,25,1.04,0.040824829046386304,570,"Wow, he sure fits in the pecking order."
4250,0,1,24,25,1.04,0.040824829046386304,570,Could you repeat that? All I hear are tweets.
4250,0,1,24,25,1.04,0.040824829046386304,570,Not quite what I meant when I asked if you could spare a Dove Bar.
4250,0,1,24,25,1.04,0.040824829046386304,570,Is anybody in there?
4250,0,1,24,25,1.04,0.040824829046386304,570,I told you not to wear your suet suit.
4250,0,1,24,25,1.04,0.040824829046386304,570,Getting back on the booze would be healthier.
4250,0,1,24,25,1.04,0.040824829046386304,570,I used to be henpecked too until I learned to assert myself. I still miss her.
4250,0,1,24,25,1.04,0.040824829046386304,570,"I know a bird in hand is worth two in the bush, but why take it to such extremes?"
4250,0,1,24,25,1.04,0.040824829046386304,570,"If you feed them, they forget how to survive on their own."
4250,0,1,24,25,1.04,0.040824829046386304,570,Which proves that pigeons really like the peanuts in caramel corn.
4250,0,1,24,25,1.04,0.040824829046386304,570,"""Your sitting on their mother!,Damn it""."
4250,0,1,24,25,1.04,0.040824829046386304,570,Eau de Black-Oil Sunflower might have been a bad choice...
4250,0,1,24,25,1.04,0.040824829046386304,570,you lawyers should not say sue it in the park.
4250,0,1,24,25,1.04,0.040824829046386304,570,"Alfred, is that you?"
4250,0,1,24,25,1.04,0.040824829046386304,570,I see you've sold them on your nest egg.
4250,0,1,24,25,1.04,0.040824829046386304,570,"No, no! Says right here: ""Seedy"": ""Sordid and Shabby"" not ""Yummy and nutritious!"""
4250,0,1,24,25,1.04,0.040824829046386304,570,I would stop tweeting if I were you.
4250,0,1,24,25,1.04,0.040824829046386304,570,And you say it is because you are covered with Gluten Free Bird feed?
4250,0,1,24,25,1.04,0.040824829046386304,570,I thought that guy looked a little seedy.
4250,0,1,24,25,1.04,0.040824829046386304,570,I told you to stop being so crumby.
4250,0,1,24,25,1.04,0.040824829046386304,570,Next time stay away from the Iced Coconut Milk Mocha Macchiato!
4250,0,1,24,25,1.04,0.040824829046386304,570,"'eau de cat', 'eau de worm', if your trying to read, guess what's 'eau de stupid'."
4250,0,1,24,25,1.04,0.040824829046386304,570,'Cote'? It's a homonym.
4250,0,1,24,25,1.04,0.040824829046386304,570,You might rethink choosing pine-scented aftershave.
4250,0,1,24,25,1.04,0.040824829046386304,570,What have you got that I haven't got?
4250,0,1,24,25,1.04,0.040824829046386304,570,That's what a pishing ventriloquist does. Other questions?
4250,0,1,24,25,1.04,0.040824829046386304,570,I see you've really got that call of the Buffed Tit perfected.
4250,0,1,24,25,1.04,0.040824829046386304,570,Maybe the Eau de Popcorn was a bad idea.
4250,0,1,24,25,1.04,0.040824829046386304,570,So you consider yourself a real chick magnet?
4250,0,1,24,25,1.04,0.040824829046386304,570,This is great practice for my ebook recording. Do you want to hear it again?
4250,0,1,24,25,1.04,0.040824829046386304,570,Thaat must be some feedback for your Twitter message.
4250,0,1,24,25,1.04,0.040824829046386304,570,"""HITCHCOCK IS THAT YOU "" ?"
4250,0,1,24,25,1.04,0.040824829046386304,570,You might want to drop the seedy cologne.
4250,0,1,24,25,1.04,0.040824829046386304,570,Love birds?
4250,0,1,24,25,1.04,0.040824829046386304,570,There is no conference table.
4250,0,1,24,25,1.04,0.040824829046386304,570,I'm beginning to think this bus will never arrive.
4250,0,1,24,25,1.04,0.040824829046386304,570,You gotta stop tweeting
4250,0,1,24,25,1.04,0.040824829046386304,570,Are you enjoying your visit from Alcatraz?
4250,0,1,24,25,1.04,0.040824829046386304,570,"This is where Hitchcock made the film, you know."
4250,0,1,24,25,1.04,0.040824829046386304,570,Probably a hormonal response to your body wash. So you know they are all males.
4250,0,1,24,25,1.04,0.040824829046386304,570,Maybe it's because you tweet too much.
4250,0,1,24,25,1.04,0.040824829046386304,570,My gene analysis confirmed it - I really am part bird.
4250,0,1,24,25,1.04,0.040824829046386304,570,I'd be more careful if I were you. You can never tell which ones carry canarial diseases.
4250,0,1,24,25,1.04,0.040824829046386304,570,"Seriously typecast, Tippi. (Too subtle?)"
4250,0,1,24,25,1.04,0.040824829046386304,570,"Bird Lovers, Jesus...poor sap."
4250,0,1,24,25,1.04,0.040824829046386304,570,I told you not to wear that sesame seed tie
4250,0,1,24,25,1.04,0.040824829046386304,570,You're the first person I've met who wanted to be a birdbath.
4250,0,1,24,25,1.04,0.040824829046386304,570,Stop telling corny jokes.
4250,0,1,24,25,1.04,0.040824829046386304,570,It's why I never feed birds of a feather.
4250,0,1,24,25,1.04,0.040824829046386304,570,"Reading another seedy novel, eh?"
4250,0,1,24,25,1.04,0.040824829046386304,570,You need to come out of your shell.
4250,0,1,24,25,1.04,0.040824829046386304,570,What app are you using?
4250,0,1,24,25,1.04,0.040824829046386304,570,The Audubon Society must have cashed my check...
4250,0,1,24,25,1.04,0.040824829046386304,570,You really need to come out of your shell.
4250,0,1,24,25,1.04,0.040824829046386304,570,Are you sure the white residue is dandruff?
4250,0,1,24,25,1.04,0.040824829046386304,570,Last Christmas? But I thought your own true love was just sending you two!
4250,0,1,24,25,1.04,0.040824829046386304,570,"Are you sure this is what it means to be a ""birder""?"
4250,0,1,24,25,1.04,0.040824829046386304,570,You must smell fowl!
4250,0,1,24,25,1.04,0.040824829046386304,570,I'd heard that millet was the new quinoa. Is this an unanticipated consequence?
4250,0,1,24,25,1.04,0.040824829046386304,570,"yea,well they insulate nice but, very high maintainence."
4250,0,1,24,25,1.04,0.040824829046386304,570,Have you just been tarred?
4250,0,1,24,25,1.04,0.040824829046386304,570,You're a rare species. You're going to attract the Audubons.
4250,0,1,24,25,1.04,0.040824829046386304,570,"So it says here you get your best movie ideas from real life events. Is that true, Mr. Hitchcock?"
4250,0,1,24,25,1.04,0.040824829046386304,570,It must be that Dove Cologne.
4250,0,1,24,25,1.04,0.040824829046386304,570,"Surely, you should sue your suet suit sewer."
4250,0,1,24,25,1.04,0.040824829046386304,570,I'm looking for a guy they call Birdman. -OR- I prefer just one in the hand.
4250,0,1,24,25,1.04,0.040824829046386304,570,Moderation in all things Snow White.
4250,0,1,24,25,1.04,0.040824829046386304,570,I warned you about showering with that birdseed scented soap
4250,0,1,24,25,1.04,0.040824829046386304,570,"I'm sorry Mr. Hitchcock, this script is completely implausible."
4250,0,1,24,25,1.04,0.040824829046386304,570,"' I heard that you had gone to seed."""
4250,0,1,24,25,1.04,0.040824829046386304,570,I'll have what you had for breakfast!
4250,0,1,24,25,1.04,0.040824829046386304,570,I thought I told you to get the flock out of here!
4250,0,1,24,25,1.04,0.040824829046386304,570,"What's a few bread crumbs? Just pay up, capiche?"
4250,0,1,24,25,1.04,0.040824829046386304,570,I think they wanted more.
4250,0,1,24,25,1.04,0.040824829046386304,570,I wonder how many Weight Watchers points that is.
4250,0,1,24,25,1.04,0.040824829046386304,570,So this is what it sounds like...when they make US cry.
4250,0,1,24,25,1.04,0.040824829046386304,570,I wish you would stop wearing those seedy outfits
4250,0,1,24,25,1.04,0.040824829046386304,570,The difference between a casual reader and a book worm
4250,0,1,24,25,1.04,0.040824829046386304,570,Looks like you got your tuppins worth
4250,0,1,24,25,1.04,0.040824829046386304,570,"I'm sorry, but what did you say your name was?"
4250,0,1,24,25,1.04,0.040824829046386304,570,I guess you really are feeling crumby today.
4250,0,1,24,25,1.04,0.040824829046386304,570,I'm gluten free.
4250,0,1,24,25,1.04,0.040824829046386304,570,"Lots of folks feed pigeons, but I am impressed by your generosity."
4250,0,1,24,25,1.04,0.040824829046386304,570,He said his name was Tom Lehrer and he kept bragging about poisoning pigeons in the park.
4250,0,1,24,25,1.04,0.040824829046386304,570,"Can you think of something that rhymes with ""words""?"
4250,0,1,24,25,1.04,0.040824829046386304,570,Is that a sesame seed suit?
4250,0,1,24,25,1.04,0.040824829046386304,570,STOP IT! This is worse than a Hitchcock movie!
4250,0,1,24,25,1.04,0.040824829046386304,570,"No, this novel 'To Kill A Mocking Bird' is not a 'how-to' guide. Why do you ask?"
4250,0,1,24,25,1.04,0.040824829046386304,570,Are you the seedy character I'm reading about?
4250,0,1,24,25,1.04,0.040824829046386304,570,Did I hear you say 'sea-salt caramel popcorn-peanut-pecan mix'?
4250,0,1,24,25,1.04,0.040824829046386304,570,Here often?
4250,0,1,24,25,1.04,0.040824829046386304,570,Perhaps you should change your after shave.
4250,0,1,24,25,1.04,0.040824829046386304,570,It must be that ne after shave you are wearing.
4250,0,1,24,25,1.04,0.040824829046386304,570,Looks like your vacation rental site that you use for subletting your coop overbooked the number of guests arriving.
4250,0,1,24,25,1.04,0.040824829046386304,570,Told you that new cologne was for the birds.
4250,0,1,24,25,1.04,0.040824829046386304,570,"""What a"
4250,0,1,24,25,1.04,0.040824829046386304,570,And you may wish you had brought your umbrella.
4250,0,1,24,25,1.04,0.040824829046386304,570,"I know you're lonely, but that's no reason to go overboard with the crumbs."
4250,0,1,24,25,1.04,0.040824829046386304,570,I'm gluten free.
4250,0,1,24,25,1.04,0.040824829046386304,570,Your body tattoo really fooled them.
4250,0,1,24,25,1.04,0.040824829046386304,570,You're gonna have to reduce the price from tuppence a bag
4250,0,1,24,25,1.04,0.040824829046386304,570,Maybe you should just go by R. Crumb instead of B. 'Red' Crumb.
4250,0,1,24,25,1.04,0.040824829046386304,570,I warned about whistling Blue Birds of Happiness!
4250,0,1,24,25,1.04,0.040824829046386304,570,"Reverend, you seem popular with the new congregation."
4250,0,1,24,25,1.04,0.040824829046386304,570,This is exactly why I never whistle.
4250,0,1,24,25,1.04,0.040824829046386304,570,Who knew? Even birds want to try butter coffee.
4250,0,1,24,25,1.04,0.040824829046386304,570,You're gonna need a new suet of clothes.
4250,0,1,24,25,1.04,0.040824829046386304,570,Has anyone told you that you look statuesque?
4250,0,1,24,25,1.04,0.040824829046386304,570,Everything I am reading says you should be a cat person.
4250,0,1,24,25,1.04,0.040824829046386304,570,This is why I told you not to wear your breadcrumb suit today.
4250,0,1,24,25,1.04,0.040824829046386304,570,Holier than thou catholic?
4250,0,1,24,25,1.04,0.040824829046386304,570,I told you not to install the squab ringtone.
4250,0,1,24,25,1.04,0.040824829046386304,570,"So, you must have a lot of followers on Twitter?"
4250,0,1,24,25,1.04,0.040824829046386304,570,"I heard they were doing a remake of ""The Birds""...You must be an Extra"
4250,0,1,24,25,1.04,0.040824829046386304,570,"""The Birdman of Alcatraz,"" what are you reading?"
4250,0,1,24,25,1.04,0.040824829046386304,570,I told you birdseed isn't the new polka.
4250,0,1,24,25,1.04,0.040824829046386304,570,It's more than likely the multi-grain bread you're eating.
4250,0,1,24,25,1.04,0.040824829046386304,570,"You know, birds flock to boxes of chocolate."
4250,0,1,24,25,1.04,0.040824829046386304,570,Your one seedy fellow with a hell of a following.
4250,0,1,24,25,1.04,0.040824829046386304,570,Wow this 5D reading is pretty awesome
4250,0,1,24,25,1.04,0.040824829046386304,570,Munchery?
4250,0,1,24,25,1.04,0.040824829046386304,570,"Just turned 65, the ""horror"", chillin at the park - but don't fill the bird seeder at home in your valor jumpsuit before you come, you'll catch all the stray crumbs!"
4250,0,1,24,25,1.04,0.040824829046386304,570,Eco-friendly clothing made from recycled bird seed probably sounded like a good idea.
4250,0,1,24,25,1.04,0.040824829046386304,570,You're sitting in the pigeon's seat on this park bench!
4250,0,1,24,25,1.04,0.040824829046386304,570,Didn't I say you were sending too many tweets?
4250,0,1,24,25,1.04,0.040824829046386304,570,"Chirpies, eh? Too bad - there's no known tweetment."
4250,0,1,24,25,1.04,0.040824829046386304,570,Your name is Eliot Nest.
4250,0,1,24,25,1.04,0.040824829046386304,570,"Oh, the perils of tweeting!"
4250,0,1,24,25,1.04,0.040824829046386304,570,You a Buffalo Tom fan?
4250,0,1,24,25,1.04,0.040824829046386304,570,Have you got alight?
4250,0,1,24,25,1.04,0.040824829046386304,570,"Bob had finally convinced his homebody neighbor Al to come sit in the park. On reflection, what happened next was really not so surprising."
4250,0,1,24,25,1.04,0.040824829046386304,570,"You can stop tweeting now, Donald."
4250,0,1,24,25,1.04,0.040824829046386304,570,"They think your shirt said, ""Root-Rooster."""
4250,0,1,24,25,1.04,0.040824829046386304,570,"Maybe the park wasn't such a good icea, Ginger, er Mr.Breadman"
4250,0,1,24,25,1.04,0.040824829046386304,570,"''I said bookworm, not book of worms."""
4250,0,1,24,25,1.04,0.040824829046386304,570,Too much Birdma Shave?
4250,0,1,24,25,1.04,0.040824829046386304,570,That's for the birds!
4250,0,1,24,25,1.04,0.040824829046386304,570,My heart fluttered when I first saw her.
4250,0,1,24,25,1.04,0.040824829046386304,570,Have you tried going to b  Have you tried calling Tippi Hedren?
4250,0,1,24,25,1.04,0.040824829046386304,570,"Okay, so I won't call you 'honey' any more."
4250,0,1,24,25,1.04,0.040824829046386304,570,"I told you if you kept cursing at me, I'd give you the bird !"
4250,0,1,24,25,1.04,0.040824829046386304,570,How many times have I warned you about your tweets?
4250,0,1,24,25,1.04,0.040824829046386304,570,"Wow-- since you lost that job, you've really gone to seed."
4250,0,1,24,25,1.04,0.040824829046386304,570,"Don't look at me, Jane, I invested my tuppence with Dad."
4250,0,1,24,25,1.04,0.040824829046386304,570,D you think it's your wiry hair?
4250,0,1,24,25,1.04,0.040824829046386304,570,Sh-sh! Stay still. They're vision is based on movement.
4250,0,1,24,25,1.04,0.040824829046386304,570,Is your gluten-free diet still corn-based?
4250,0,1,24,25,1.04,0.040824829046386304,570,"Well, there that IS a drawback to wearing all natural fibers."
4250,0,1,24,25,1.04,0.040824829046386304,570,Didn't anyone warn you not to tweet?
4250,0,1,24,25,1.04,0.040824829046386304,570,What did I tell you about tweets and phones?
4250,0,1,24,25,1.04,0.040824829046386304,570,I think it's God's way of letting you know how much of a pigeon you were for voting for Donald Trump.
4250,0,1,24,25,1.04,0.040824829046386304,570,Try changing your cologne.
4250,0,1,24,25,1.04,0.040824829046386304,570,Are you Mr. Peanut?
4250,0,1,24,25,1.04,0.040824829046386304,570,I read the obits this morning and guess what? You're in it.
4250,0,1,24,25,1.04,0.040824829046386304,570,I told you. Gluten free feed...they love it.
4250,0,1,24,25,1.04,0.040824829046386304,570,I told you they wouldn't be amused...
4250,0,1,24,25,1.04,0.040824829046386304,570,D you think it's your wiry hair?
4250,0,1,24,25,1.04,0.040824829046386304,570,Odd; you don't look seedy.
4250,0,1,24,25,1.04,0.040824829046386304,570,I understand you a decendant of the Noah family?
4250,0,1,24,25,1.04,0.040824829046386304,570,I loved the Odd Couple. Was your mother Cecily or Gwendolyn Pigeon?
4250,0,1,24,25,1.04,0.040824829046386304,570,I told you not to wear that tshirt from Capistrano to the park.
4250,0,1,24,25,1.04,0.040824829046386304,570,"Yeah, I guess the birdseed suit is less distracting than last week's milkbone suit."
4250,0,1,24,25,1.04,0.040824829046386304,570,Is your suet bespoke?
4250,0,1,24,25,1.04,0.040824829046386304,570,I think you are going to seeds.
4250,0,1,24,25,1.04,0.040824829046386304,570,Rookie mistake. The Sunflower Suit from Banana Republic is not a great idea in Central Park.
4250,0,1,24,25,1.04,0.040824829046386304,570,I told you not to wear the corn suit.
4250,0,1,24,25,1.04,0.040824829046386304,570,"So, what were you saying about your organic clothing?"
4250,0,1,24,25,1.04,0.040824829046386304,570,"Boy, you must be feeling crummy."
4250,0,1,24,25,1.04,0.040824829046386304,570,"Is that you, Sean?"
4250,0,1,24,25,1.04,0.040824829046386304,570,You should really stop wearing that Bernie For President t-shirt.
4250,0,1,24,25,1.04,0.040824829046386304,570,"I don't mean to be a downer, but this is too much PDA"
4250,0,1,24,25,1.04,0.040824829046386304,570,"I told you not to use the ""natural"" moisturizer"
4250,0,1,24,25,1.04,0.040824829046386304,570,I always make sure my suits are gluten free.
4250,0,1,24,25,1.04,0.040824829046386304,570,When did you first consider yourself a Peacenik?
4250,0,1,24,25,1.04,0.040824829046386304,570,Say you once served time on Alcatraz?
4250,0,1,24,25,1.04,0.040824829046386304,570,"So, what screenplay are you writing now, Mr. Hitchcock?"
4250,0,1,24,25,1.04,0.040824829046386304,570,You must be the new press secretary.
4250,0,1,24,25,1.04,0.040824829046386304,570,Do you think I'm flighty?
4250,0,1,24,25,1.04,0.040824829046386304,570,"Run, Forrest. Run."
4250,0,1,24,25,1.04,0.040824829046386304,570,Let me guess. You're for the birds?
4250,0,1,24,25,1.04,0.040824829046386304,570,You must be a pretty seedy character!
4250,0,1,24,25,1.04,0.040824829046386304,570,You said that you were from Alca where?
4250,0,1,24,25,1.04,0.040824829046386304,570,I'm not sure New York is the best place to be selling pigeon pheromones.
4250,0,1,24,25,1.04,0.040824829046386304,570,Yep. It says right here...mixing breadcrumbs with tanning lotion gives you an extra layer of protection against the sun's harmful rays.
4250,0,1,24,25,1.04,0.040824829046386304,570,That's why there are laws against feeding the pigeons.
4250,0,1,24,25,1.04,0.040824829046386304,570,"um...excuse me sir, do you have any bread on you by any chance?"
4250,0,1,24,25,1.04,0.040824829046386304,570,Enough with the birds already.
4250,0,1,24,25,1.04,0.040824829046386304,570,So how come they call you Pigeon Joe?
4250,0,1,24,25,1.04,0.040824829046386304,570,"Would you mind keeping it down? I only get 20 minutes for lunch, and I'm near THE END.... You read the sign, yes?"
4250,0,1,24,25,1.04,0.040824829046386304,570,"No, I wouldn't fry them. Try broiling, instead."
4250,0,1,24,25,1.04,0.040824829046386304,570,sounds like a great idea for a movie Mr. Hitchcock
4250,0,1,24,25,1.04,0.040824829046386304,570,You better get a selfie or no one will believe you.
4250,0,1,24,25,1.04,0.040824829046386304,570,May the doves of peace decend on you as Manna from Heaven
4250,0,1,24,25,1.04,0.040824829046386304,570,Sue it!
4250,0,1,24,25,1.04,0.040824829046386304,570,Do you always feed the birds this time of day?
4250,0,1,24,25,1.04,0.040824829046386304,570,"Hi,stranger. You remind me of a fellow from Assisi"
4250,0,1,24,25,1.04,0.040824829046386304,570,"You are a really seedy fellow, Jay."
4250,0,1,24,25,1.04,0.040824829046386304,570,"Who do you think was the more accurate, Du Maurier or Hitchcock?"
4250,0,1,24,25,1.04,0.040824829046386304,570,I could not help noticing you are wearing Wing Tip shoes and I would love a pair. Where ever did you get them?
4250,0,1,24,25,1.04,0.040824829046386304,570,The Perch
4250,0,1,24,25,1.04,0.040824829046386304,570,"I have kids that took advantage of me, too."
4250,0,1,24,25,1.04,0.040824829046386304,570,Am I seeing what I`am seeing?
4250,0,1,24,25,1.04,0.040824829046386304,570,Do you mind? It's hard to read when you're tweeting so much.
4250,0,1,24,25,1.04,0.040824829046386304,570,New suet?
4250,0,1,24,25,1.04,0.040824829046386304,570,I told you they weren't gluten intolerant.
4250,0,1,24,25,1.04,0.040824829046386304,570,If you weren't such a crummy guy this might not happen so often.
4250,0,1,24,25,1.04,0.040824829046386304,570,Those really are for the birds.
4250,0,1,24,25,1.04,0.040824829046386304,570,There must be dozens and dozens in the bush
4250,0,1,24,25,1.04,0.040824829046386304,570,I can't concentrate with all that tweeting
4250,0,1,24,25,1.04,0.040824829046386304,570,"Well, you do look a lot like Hans Christian Andersen."
4250,0,1,24,25,1.04,0.040824829046386304,570,That's why I prefer singing the Don Giovanni.
4250,0,1,24,25,1.04,0.040824829046386304,570,"I always said, birds of a feather flock together."
4250,0,1,24,25,1.04,0.040824829046386304,570,It appears they've taken to your hemp suit.
4250,0,1,24,25,1.04,0.040824829046386304,570,I told you cologne called ‘bird seed’ was a bad idea.
4250,0,1,24,25,1.04,0.040824829046386304,570,"What a funny outfit you have on today, Delores."
4250,0,1,24,25,1.04,0.040824829046386304,570,"By chance, are you a Hitchcock?"
4250,0,1,24,25,1.04,0.040824829046386304,570,Welcome to Bodega Bay.
4250,0,1,24,25,1.04,0.040824829046386304,570,Would you like me to read you a story?
4250,0,1,24,25,1.04,0.040824829046386304,570,"Me. President, they are sending a message"
4250,0,1,24,25,1.04,0.040824829046386304,570,"Alfred, I thought it was your finest."
4250,0,1,24,25,1.04,0.040824829046386304,570,Pro-tip: next time don't wear a seed-covered shirt.
4250,0,1,24,25,1.04,0.040824829046386304,570,They can detect a seedy character.
4250,0,1,24,25,1.04,0.040824829046386304,570,I think you are overdoing the sunflower seed smoothies.
4250,0,1,24,25,1.04,0.040824829046386304,570,You really need to stop with the tweeting.
4250,0,1,24,25,1.04,0.040824829046386304,570,"Not ""crumbly."" I'm feeling crummy, CRUMMY."
4250,0,1,24,25,1.04,0.040824829046386304,570,That's what you get for wearing a seedsucker suit to the park.
4250,0,1,24,25,1.04,0.040824829046386304,570,Weren't you also the bird man of Alcatraz?
4250,0,1,24,25,1.04,0.040824829046386304,570,I guess that's why they call it Pigeon Park.
4250,0,1,24,25,1.04,0.040824829046386304,570,Why are you always first in the pecking order?
4250,0,1,24,25,1.04,0.040824829046386304,570,When did you switch from horse whisperer to birds?
4250,0,1,24,25,1.04,0.040824829046386304,570,"Coup, coup."
4250,0,1,24,25,1.04,0.040824829046386304,570,"I told you you'd have trouble in the park today, Mr. Capistrano."
4250,0,1,24,25,1.04,0.040824829046386304,570,"Welcome to Washington, bub."
4250,0,1,24,25,1.04,0.040824829046386304,570,"Why Bert Federman, what've you been up to?"
4250,0,1,24,25,1.04,0.040824829046386304,570,"Peter, pickled peppers get pecked."
4250,0,1,24,25,1.04,0.040824829046386304,570,What do you know? Alfred Hitchcock was right.
4250,0,1,24,25,1.04,0.040824829046386304,570,Tweeting about it isn't going to change anything!
4250,0,1,24,25,1.04,0.040824829046386304,570,"Nice to meet you, Mr. Gano. And is there a Mama Gano as well?"
4250,0,1,24,25,1.04,0.040824829046386304,570,That stopped for me soon after I went gluten-free.
4250,0,1,24,25,1.04,0.040824829046386304,570,"I thought doves make peace, not break into pieces"
4250,0,1,24,25,1.04,0.040824829046386304,570,"So then Tippi Hedren says, ""They're coming! They're coming!"""
4250,0,1,24,25,1.04,0.040824829046386304,570,"You only go around once, Dick."
4250,0,1,24,25,1.04,0.040824829046386304,570,They know that people reading books aren't going to feed them.
4250,0,1,24,25,1.04,0.040824829046386304,570,It may be the Essence of Popcorn after shave
4250,0,1,24,25,1.04,0.040824829046386304,570,"Don't get excited, no rare sightings according to my bird book."
4250,0,1,24,25,1.04,0.040824829046386304,570,Got a tuppence you could spare?
4250,0,1,24,25,1.04,0.040824829046386304,570,Now I know why linseed oil is such an effective sunblock!
4250,0,1,24,25,1.04,0.040824829046386304,570,"Hitch, is that you?"
4250,0,1,24,25,1.04,0.040824829046386304,570,Either they knew you were an ornithologist or it was that bag of seeds in your pocket!
4250,0,1,24,25,1.04,0.040824829046386304,570,What did you just tweet to get you so many followers?
4250,0,1,24,25,1.04,0.040824829046386304,570,"Excuse me, I think you sat on my peanut butter and sesame seed sandwich."
4250,0,1,24,25,1.04,0.040824829046386304,570,"I hate retweeting, too."
4250,0,1,24,25,1.04,0.040824829046386304,570,"Joe, it's you! If you don't mind my saying so, you really have let yourself go to seed."
4250,0,1,24,25,1.04,0.040824829046386304,570,Looks to me like you are going to seed
4250,0,1,24,25,1.04,0.040824829046386304,570,It must be the gourmet bird seed.
4250,0,1,24,25,1.04,0.040824829046386304,570,So how often do you have to smear the peanut butter and seeds on your body?
4250,0,1,24,25,1.04,0.040824829046386304,570,Those who don't deny it refer to it as global-local birding.
4250,0,1,24,25,1.04,0.040824829046386304,570,"Oh, I thought you said 'a frock.'"
4250,0,1,24,25,1.04,0.040824829046386304,570,I'm beginning to think 'To Kill a Mockingbird' might be a metaphor.
4250,0,1,24,25,1.04,0.040824829046386304,570,When I was a kid I had this really neat parakeet...
4250,0,1,24,25,1.04,0.040824829046386304,570,I should have told you.... Michael Keaton was just sitting there.
4250,0,1,24,25,1.04,0.040824829046386304,570,You'll never criticize Hitchcock again.
4250,0,1,24,25,1.04,0.040824829046386304,570,I stopped going to the Bread Crumb Cafe. The food is good but you need to vacuum afterwards.
4250,0,1,24,25,1.04,0.040824829046386304,570,"So, that's what zen looks like."
