rank,funny,somewhat_funny,unfunny,count,score,precision,contest,caption
1517,3,2,42,47,1.1702127659574468,0.07645685835683208,570,"Like I said, you’re an emotional statue."
1517,2,4,41,47,1.1702127659574468,0.07014685887189226,570,Still trending on Twitter?
1517,0,8,39,47,1.1702127659574468,0.055411578656325414,570,"Would you go somewhere else, all that tweeting is driving me nuts!"
1517,0,8,39,47,1.1702127659574468,0.055411578656325414,570,Isn't it wonderful how nature comes alive in the Spring?
1517,1,6,40,47,1.1702127659574468,0.0632100658866106,570,I told you to stop tweeting.
1517,2,4,41,47,1.1702127659574468,0.07014685887189226,570,"So, they heard about your Hamilton tickets?"
1517,1,6,40,47,1.1702127659574468,0.0632100658866106,570,"Step 3: if you haven't already, remove suet from your pockets."
1517,1,6,40,47,1.1702127659574468,0.0632100658866106,570,I actually preferred Duran Duran.
1517,2,4,41,47,1.1702127659574468,0.07014685887189226,570,Have you considered adopting a cat....?
1517,2,4,41,47,1.1702127659574468,0.07014685887189226,570,"Tippi, is that you?"
1517,2,4,41,47,1.1702127659574468,0.07014685887189226,570,Your gravitational force is off the scale today.
1517,1,6,40,47,1.1702127659574468,0.0632100658866106,570,Worth 72 in the bush
1517,1,6,40,47,1.1702127659574468,0.0632100658866106,570,"Oh no, Mr Bread!"
1517,0,8,39,47,1.1702127659574468,0.055411578656325414,570,"So, Alfred, got any ideas for your next movie?"
1517,1,6,40,47,1.1702127659574468,0.0632100658866106,570,So is it a sin to kill a mockingbird?
1517,1,6,40,47,1.1702127659574468,0.0632100658866106,570,"Geez, Tom, you've really gone to seed."
1517,1,6,40,47,1.1702127659574468,0.0632100658866106,570,"By Jove, I too, am feeling a bit peckish!"
1517,2,4,41,47,1.1702127659574468,0.07014685887189226,570,"Sorry, I thought they had been baked into a pie."
1517,0,8,39,47,1.1702127659574468,0.055411578656325414,570,You might want to stop eating granola bars.
1517,2,4,41,47,1.1702127659574468,0.07014685887189226,570,I always thought you looked very statuesque.
1517,1,6,40,47,1.1702127659574468,0.0632100658866106,570,Have you considered what comes after the feeding?
1517,1,6,40,47,1.1702127659574468,0.0632100658866106,570,"Not to worry, they'll be migrating north in about two weeks."
1517,2,4,41,47,1.1702127659574468,0.07014685887189226,570,Why not just give them the popcorn?
1517,2,4,41,47,1.1702127659574468,0.07014685887189226,570,"And just like that, Sean was gone and the interview was over......."
1517,2,4,41,47,1.1702127659574468,0.07014685887189226,570,I hope you won't be tempted to feed the porcupines!
1517,0,8,39,47,1.1702127659574468,0.055411578656325414,570,So you must be the Birdman of Gramercy Park.
1517,1,6,40,47,1.1702127659574468,0.0632100658866106,570,You should really stop using that organic birdseed exfoliator.
1517,3,2,42,47,1.1702127659574468,0.07645685835683208,570,Mitch?
1517,0,8,39,47,1.1702127659574468,0.055411578656325414,570,So how long have you been out of Alcatraz?
1517,1,6,40,47,1.1702127659574468,0.0632100658866106,570,"Pardon me, but aren't you Tippi Hedren?"
1517,0,8,39,47,1.1702127659574468,0.055411578656325414,570,You must be made of dough.
1517,2,4,41,47,1.1702127659574468,0.07014685887189226,570,"Bird flu season, eh."
1517,2,4,41,47,1.1702127659574468,0.07014685887189226,570,Not a bird in the sky today Fred.
1517,2,4,41,47,1.1702127659574468,0.07014685887189226,570,You're supposed to throw the rice
1517,1,6,40,47,1.1702127659574468,0.0632100658866106,570,I'd change my deodorant if I were you.
1517,1,6,40,47,1.1702127659574468,0.0632100658866106,570,The next recommendation is to get a cat.
1517,3,2,42,47,1.1702127659574468,0.07645685835683208,570,You say this happens every so often Mr. Capistrano?
1517,3,2,42,47,1.1702127659574468,0.07645685835683208,570,It seems they find you statuesque.
1517,2,4,41,47,1.1702127659574468,0.07014685887189226,570,Michael Keaton?
1517,1,6,40,47,1.1702127659574468,0.0632100658866106,570,"Wow, that was some birdcall."
1517,2,4,41,47,1.1702127659574468,0.07014685887189226,570,Dove skin care is so hot right now.
1517,2,4,41,47,1.1702127659574468,0.07014685887189226,570,Quite a chickadee magnet you are!
1517,2,4,41,47,1.1702127659574468,0.07014685887189226,570,"Now that ransomware has destroyed our phones, carrier pigeon is the only way to go."
1517,2,4,41,47,1.1702127659574468,0.07014685887189226,570,Wait till they all have to go to the bathroom.
1517,1,6,40,47,1.1702127659574468,0.0632100658866106,570,I'd say your tweet has gone viral.
1517,1,6,40,47,1.1702127659574468,0.0632100658866106,570,Weren't you in that Hitchcock movie?
1517,2,4,41,47,1.1702127659574468,0.07014685887189226,570,"You never saw that Hitchcock film, did ya?"
1517,1,6,40,47,1.1702127659574468,0.0632100658866106,570,That's the trouble with meditating in the park.
1517,0,8,39,47,1.1702127659574468,0.055411578656325414,570,"Don't be so smug, I think the Hamilton statue is just as popular."
1517,3,2,42,47,1.1702127659574468,0.07645685835683208,570,The salesperson said it would make me a real chick magnet.
1517,1,6,40,47,1.1702127659574468,0.0632100658866106,570,Let me guess where you are in the pecking order.
1517,1,6,40,47,1.1702127659574468,0.0632100658866106,570,To be seed and not heard.
1517,1,6,40,47,1.1702127659574468,0.0632100658866106,570,You should have stopped tweeting when you had the chance.
1517,0,8,39,47,1.1702127659574468,0.055411578656325414,570,You're actually not supposed to feed the birds.
1517,1,6,40,47,1.1702127659574468,0.0632100658866106,570,"You've totally gone to seed, man."
1517,2,4,41,47,1.1702127659574468,0.07014685887189226,570,Would you and your pals mind moving to another bench? I'm trying to read.
1517,0,8,39,47,1.1702127659574468,0.055411578656325414,570,Pardon me. May I find you a cat?
1517,2,4,41,47,1.1702127659574468,0.07014685887189226,570,Still need that tuppence?
1517,2,4,41,47,1.1702127659574468,0.07014685887189226,570,You are a real chick magnet.
1517,1,6,40,47,1.1702127659574468,0.0632100658866106,570,This book has me all a flutter too.
1517,1,6,40,47,1.1702127659574468,0.0632100658866106,570,"Then she told me that she was a big Alfred Hitchcock fan, and I knew it'd never work out between us. His films are just too implausible!"
1517,1,6,40,47,1.1702127659574468,0.0632100658866106,570,"Well, they aren't chicks, but you're certainly a magnet."
1517,1,6,40,47,1.1702127659574468,0.0632100658866106,570,So how long have you been out of Alcatraz?
1517,1,6,40,47,1.1702127659574468,0.0632100658866106,570,"Just like me, they long to be close to you."
1517,2,4,41,47,1.1702127659574468,0.07014685887189226,570,Did you know Alfred Hitchcock made a movie about bird 'Flash Mobs?'
1517,1,6,40,47,1.1702127659574468,0.0632100658866106,570,"No avian flu shot, huh?"
1517,2,4,41,47,1.1702127659574468,0.07014685887189226,570,You have a seed stuck in your teeth
1517,1,6,40,47,1.1702127659574468,0.0632100658866106,570,"Quick!! Get off Twitter, Mr. President!!!"
1517,1,6,40,47,1.1702127659574468,0.0632100658866106,570,I guess they finally caught up with the Gingerbread Man.
1517,0,8,39,47,1.1702127659574468,0.055411578656325414,570,"They're pigeons. You dropped them some crumbs six months ago, they love you forever."
1517,1,6,40,47,1.1702127659574468,0.0632100658866106,570,How's that peanut butter based skin lotion working for you?
1517,1,6,40,47,1.1702127659574468,0.0632100658866106,570,I see that Trump's flights of fancy are rapidly adding up.
1517,1,6,40,47,1.1702127659574468,0.0632100658866106,570,Check your retweet settings.
1517,1,6,40,47,1.1702127659574468,0.0632100658866106,570,You can't hide from your problems that way.
1517,1,6,40,47,1.1702127659574468,0.0632100658866106,570,You've got some work to do before you're a chick magnet.
1517,2,4,41,47,1.1702127659574468,0.07014685887189226,570,Shall I continue?
1517,2,4,41,47,1.1702127659574468,0.07014685887189226,570,You ever read this?
1517,1,6,40,47,1.1702127659574468,0.0632100658866106,570,I told you not to pull out your fidget spinner.
1517,1,6,40,47,1.1702127659574468,0.0632100658866106,570,Is everything still satisfactual?
1517,2,4,41,47,1.1702127659574468,0.07014685887189226,570,"It doesn't seem like such a good idea anymore, does it?"
1517,0,8,39,47,1.1702127659574468,0.055411578656325414,570,So how was your time in Alcatraz?
1517,0,8,39,47,1.1702127659574468,0.055411578656325414,570,Angel investors with seed capital. What did you expect?
1517,0,8,39,47,1.1702127659574468,0.055411578656325414,570,"Give a bird a crumb, you feed him for a day...Teach a bird to make bread...I think you can see where I'm going with this."
1517,3,2,42,47,1.1702127659574468,0.07645685835683208,570,"No, an asshole would have said ""feeling peckish?"" I merely commented ""dovely day out."""
1517,2,4,41,47,1.1702127659574468,0.07014685887189226,570,Still feeling impeccable?
1517,1,6,40,47,1.1702127659574468,0.0632100658866106,570,"No, but I saw the movie."
1517,1,6,40,47,1.1702127659574468,0.0632100658866106,570,"Personally, I use DEET to keep off ticks."
1517,2,4,41,47,1.1702127659574468,0.07014685887189226,570,My mom always said life was like a box of Dove's...chocolates.
1517,2,4,41,47,1.1702127659574468,0.07014685887189226,570,"Step 2: ""Whistle a happy tune."""
1517,0,8,39,47,1.1702127659574468,0.055411578656325414,570,"After all, they are the indigenous population."
1517,1,6,40,47,1.1702127659574468,0.0632100658866106,570,"I know how it is. I was once in a boy band, myself."
1517,2,4,41,47,1.1702127659574468,0.07014685887189226,570,Do they come back every year?
1517,2,4,41,47,1.1702127659574468,0.07014685887189226,570,I'm hoping your imitation of an eagle mating call isn't so good.
1517,2,4,41,47,1.1702127659574468,0.07014685887189226,570,Oh...Wow..!!...is that how twitter works..??
1517,1,6,40,47,1.1702127659574468,0.0632100658866106,570,They say you should never feed them.
1517,0,8,39,47,1.1702127659574468,0.055411578656325414,570,"Well, I'll be darned, birds of a feather do flock together."
1517,1,6,40,47,1.1702127659574468,0.0632100658866106,570,"My book? It's called ""Characters of Central Park."" Supposed to be real people, but I've been here all morning and haven't seen a single freak."
1517,1,6,40,47,1.1702127659574468,0.0632100658866106,570,"He got the bird seed and peanut butter, but poor Marvin couldn't find a pinecone to save his life."
1517,1,6,40,47,1.1702127659574468,0.0632100658866106,570,Somehow they can always spot an ornithologist.
1517,0,8,39,47,1.1702127659574468,0.055411578656325414,570,To feed and to kill a mockingbird.
1517,1,6,40,47,1.1702127659574468,0.0632100658866106,570,You must be the bread winner in your family
1517,2,4,41,47,1.1702127659574468,0.07014685887189226,570,Wow! Are those your peeps?
1517,0,8,39,47,1.1702127659574468,0.055411578656325414,570,"Birds of a feather, love designer leather."
1517,2,4,41,47,1.1702127659574468,0.07014685887189226,570,"My bad, that ring tone was the mating call."
1517,2,4,41,47,1.1702127659574468,0.07014685887189226,570,Human Birdfeeder? Can't wait to see your Human Birdbath.
1517,0,8,39,47,1.1702127659574468,0.055411578656325414,570,"Gee, the birds flock to you Brits wherever you go. Must be the foreign accent."
1517,0,8,39,47,1.1702127659574468,0.055411578656325414,570,"Well, that's one way to pick up chicks."
1517,1,6,40,47,1.1702127659574468,0.0632100658866106,570,This is supposed to be a No Tweeting bench.
1517,3,2,42,47,1.1702127659574468,0.07645685835683208,570,Thank goodness those aren't crows or I'd have to call in a murder...
1517,1,6,40,47,1.1702127659574468,0.0632100658866106,570,These are New York birds: They can sense people who make a lot of bread.
1517,3,2,42,47,1.1702127659574468,0.07645685835683208,570,"She told me get out, I was for the birds. What do you think?"
1517,1,6,40,47,1.1702127659574468,0.0632100658866106,570,I didn't believe you when you said you could do fifty different bir4d calls.
1517,1,6,40,47,1.1702127659574468,0.0632100658866106,570,Here comes two more
1517,2,4,41,47,1.1702127659574468,0.07014685887189226,570,"Is that you, Jack Sparrow?"
1517,2,4,41,47,1.1702127659574468,0.07014685887189226,570,That's not quite what I had in mind when I wished I was irresistible.
1517,1,6,40,47,1.1702127659574468,0.0632100658866106,570,"I don't mean to draw any unwanted attention, Ms. Gaga, but I have to say- huge fan of your work."
1517,2,4,41,47,1.1702127659574468,0.07014685887189226,570,You never heard of it? It's a Hitchcock classic.
1517,2,4,41,47,1.1702127659574468,0.07014685887189226,570,I'd say it's your statuesque appearance.
1517,2,4,41,47,1.1702127659574468,0.07014685887189226,570,You must be a hot destination for some frequent flier program.
1517,1,6,40,47,1.1702127659574468,0.0632100658866106,570,Your tweeting habit is consuming you.
1517,2,4,41,47,1.1702127659574468,0.07014685887189226,570,"Sorry, but Tippi Hedren did it better."
1517,1,6,40,47,1.1702127659574468,0.0632100658866106,570,Just let it happen.
1517,2,4,41,47,1.1702127659574468,0.07014685887189226,570,Trying a smaller airline?
1517,1,6,40,47,1.1702127659574468,0.0632100658866106,570,I told you to chew with your mouth closed!
1517,1,6,40,47,1.1702127659574468,0.0632100658866106,570,What a fuss over one hotdog!
1517,0,8,39,47,1.1702127659574468,0.055411578656325414,570,You should cut down on the tweeting.
1517,1,6,40,47,1.1702127659574468,0.0632100658866106,570,I warned you that you looked seedy today.
1517,2,4,41,47,1.1702127659574468,0.07014685887189226,570,"Honestly, when you mentioned feeling inspired by the Met Gala this year I assumed you were talking about philanthropy."
1517,1,6,40,47,1.1702127659574468,0.0632100658866106,570,"Yeah, that's why I never feed them."
1517,0,8,39,47,1.1702127659574468,0.055411578656325414,570,I'd say you've got that bird call down.
1517,1,6,40,47,1.1702127659574468,0.0632100658866106,570,"If you're going to let yourself go to seed, you have to accept the consequences."
1517,1,6,40,47,1.1702127659574468,0.0632100658866106,570,"So, the Paleo diet has been going well?"
1517,0,8,39,47,1.1702127659574468,0.055411578656325414,570,"Excuse me, Mr. Hitchcock, do you have the time?"
1517,0,8,39,47,1.1702127659574468,0.055411578656325414,570,So do you still think it isn't a book on bird hypnotism?
1517,2,4,41,47,1.1702127659574468,0.07014685887189226,570,"Sorry, but my reference source only states that ""birds of a feather flock together."" I can not find anything definitive for why, when, or where they flock together!"
1517,1,6,40,47,1.1702127659574468,0.0632100658866106,570,"I told you it was SEER Sucker, not Seed-sucker..."
1517,1,6,40,47,1.1702127659574468,0.0632100658866106,570,You had them at tuppence.
1517,1,6,40,47,1.1702127659574468,0.0632100658866106,570,Pigeons are the new black.
1517,2,4,41,47,1.1702127659574468,0.07014685887189226,570,"So, is this a Pentacostal thing?"
1517,2,4,41,47,1.1702127659574468,0.07014685887189226,570,Probably best not to eat crackers in the park.
1517,1,6,40,47,1.1702127659574468,0.0632100658866106,570,What's eating you
1517,1,6,40,47,1.1702127659574468,0.0632100658866106,570,Erlich et al. suggest that flocking behavior is uncommon in this species.
1517,1,6,40,47,1.1702127659574468,0.0632100658866106,570,"House sparrows, a couple of robins, several starlings but mostly pigeons."
1517,1,6,40,47,1.1702127659574468,0.0632100658866106,570,I told you if you did not stop Tweeting you would have a following.
1517,1,6,40,47,1.1702127659574468,0.0632100658866106,570,Says here they can smell high cholesterol from a mile away.
1517,1,6,40,47,1.1702127659574468,0.0632100658866106,570,Psycho is my favorite.
1517,2,4,41,47,1.1702127659574468,0.07014685887189226,570,"Yes, but frankly, that's what the Flockr app is designed for."
1517,1,6,40,47,1.1702127659574468,0.0632100658866106,570,How was Alcatraz?
1517,0,8,39,47,1.1702127659574468,0.055411578656325414,570,It says here they sense generosity.
1517,1,6,40,47,1.1702127659574468,0.0632100658866106,570,It says here you are supposed to hold the food away from your body.
1517,1,6,40,47,1.1702127659574468,0.0632100658866106,570,It's why the 'caged' bird sings.
1517,1,6,40,47,1.1702127659574468,0.0632100658866106,570,Maybe next time a small cup of seed would be better than bringing the ten pound bag!
1517,0,8,39,47,1.1702127659574468,0.055411578656325414,570,"I think you've been pigeon-holed at your new job, Frank."
1517,2,4,41,47,1.1702127659574468,0.07014685887189226,570,Never in the annals of ornithology ...
1517,0,8,39,47,1.1702127659574468,0.055411578656325414,570,So you said you were looking for seed funding?
1517,1,6,40,47,1.1702127659574468,0.0632100658866106,570,How do you get anything done with all that tweeting?
1517,1,6,40,47,1.1702127659574468,0.0632100658866106,570,"Good news is, you're not pigeon-toed."
1517,3,2,42,47,1.1702127659574468,0.07645685835683208,570,Oh no! Here comes the cat lady!
1517,2,4,41,47,1.1702127659574468,0.07014685887189226,570,Did you pack bread-on-bread for lunch again?
1517,1,6,40,47,1.1702127659574468,0.0632100658866106,570,That's a very inconspicuous bird suit Mr. Comey.
1517,1,6,40,47,1.1702127659574468,0.0632100658866106,570,"Posing for your statue, Mr. President?"
1517,1,6,40,47,1.1702127659574468,0.0632100658866106,570,now I'm interested - I'll follow your tweets
1517,2,4,41,47,1.1702127659574468,0.07014685887189226,570,What was the name of that cologne again?
1517,0,8,39,47,1.1702127659574468,0.055411578656325414,570,So how carried away did you get with this hemp seed diet?
1517,0,8,39,47,1.1702127659574468,0.055411578656325414,570,I don't get fashion these days.
1517,0,8,39,47,1.1702127659574468,0.055411578656325414,570,How's that St. Francis Eau de Cologne working out for you?
1517,2,4,41,47,1.1702127659574468,0.07014685887189226,570,Can't you see I'm tryin' to read here? Why don't you just flock off?
1517,2,4,41,47,1.1702127659574468,0.07014685887189226,570,I wish I were popular.
1517,1,6,40,47,1.1702127659574468,0.0632100658866106,570,Fine! Ignore me!!
1517,1,6,40,47,1.1702127659574468,0.0632100658866106,570,"I know it's uncomfortable, Mr. Hitchcock, but maybe it'll give you an idea for another movie."
1517,1,6,40,47,1.1702127659574468,0.0632100658866106,570,Me? I stick to lotion sun screens.
1517,2,4,41,47,1.1702127659574468,0.07014685887189226,570,That bird seed cologne is overwhelming.
1517,2,4,41,47,1.1702127659574468,0.07014685887189226,570,do you need help?
1517,3,2,42,47,1.1702127659574468,0.07645685835683208,570,Now it says to focus your attention on the point between your eye brows.
1517,1,6,40,47,1.1702127659574468,0.0632100658866106,570,"No, I am not a birder."
1517,0,8,39,47,1.1702127659574468,0.055411578656325414,570,You might want to consider tweeting less.
1517,0,8,39,47,1.1702127659574468,0.055411578656325414,570,"Do you call them a flock, a gaggle, a cluster or a covey?"
1517,3,2,42,47,1.1702127659574468,0.07645685835683208,570,A small pair of hands is worth two terms of Bush
1731,1,6,42,49,1.163265306122449,0.060797833101086655,570,"I understand that it was half-price, but why would you even consider buying ""suet-fragrance"" body wash?"
1731,1,6,42,49,1.163265306122449,0.060797833101086655,570,I'm sure glad I'm not a statute of a man sitting on a park bench.
1733,0,8,42,50,1.16,0.05237229365663817,570,Crumby outfit.
1734,1,5,39,45,1.1555555555555554,0.06321005190772531,570,I am reading the illustrated book of cats. Why do you ask?
1734,2,3,40,45,1.1555555555555554,0.07075034750641399,570,"Yes, I guess reading a book in a park is unusual these days."
1734,1,5,39,45,1.1555555555555554,0.06321005190772531,570,You shouldn’t have tweeted.
1734,1,5,39,45,1.1555555555555554,0.06321005190772531,570,Excessive tweeting attracts too many followers.
1734,1,5,39,45,1.1555555555555554,0.06321005190772531,570,I guess I misunderstood when you said the females flock to you.
1734,2,3,40,45,1.1555555555555554,0.07075034750641399,570,"Nope, nothing in here about pigeons....."
1734,1,5,39,45,1.1555555555555554,0.06321005190772531,570,Well you're still more of a chick magnet than I am.
1734,2,3,40,45,1.1555555555555554,0.07075034750641399,570,"How's it going, Mr. Peanut?"
1734,0,7,38,45,1.1555555555555554,0.05463890236888291,570,My understanding is it takes thousands of followers to be considered an influencer.
1734,0,7,38,45,1.1555555555555554,0.05463890236888291,570,And I always saw you as impeccable.
1734,2,3,40,45,1.1555555555555554,0.07075034750641399,570,What am I reading? The Birdman of Alcatraz.
1734,2,3,40,45,1.1555555555555554,0.07075034750641399,570,"Stay still, I think you have a mosquito on you."
1734,0,7,38,45,1.1555555555555554,0.05463890236888291,570,You should see what I hey did to General Sherman
1734,0,7,38,45,1.1555555555555554,0.05463890236888291,570,You were right! Females flock to a man who has bread.
1734,2,3,40,45,1.1555555555555554,0.07075034750641399,570,But did you actually say no?
1734,1,5,39,45,1.1555555555555554,0.06321005190772531,570,I'd steer clear of hemp clothing while in the park.
1734,1,5,39,45,1.1555555555555554,0.06321005190772531,570,Wow! Aristophanes really comes to life on an e-reader.
1734,0,7,38,45,1.1555555555555554,0.05463890236888291,570,Hitchcock fan?
1734,3,1,41,45,1.1555555555555554,0.07756102553718168,570,"It seemed romantic to use pigeon post for our wedding invitations, but I am not that thrilled about these R.S.V.P.s."
1734,0,7,38,45,1.1555555555555554,0.05463890236888291,570,Any second thoughts Mr. Pruitt?
1734,1,5,39,45,1.1555555555555554,0.06321005190772531,570,They're not as much fun in real life.
1734,1,5,39,45,1.1555555555555554,0.06321005190772531,570,Do you have the time?
1734,2,3,40,45,1.1555555555555554,0.07075034750641399,570,Mind if I smoke?
1734,0,7,38,45,1.1555555555555554,0.05463890236888291,570,"BY ANY CHANCE, ARE YOU READING UPDIKE'S ""PIDGEON FEATHERS""?"
1734,2,3,40,45,1.1555555555555554,0.07075034750641399,570,You're on their seat.
1734,1,5,39,45,1.1555555555555554,0.06321005190772531,570,Incessant tweeting.
1734,1,5,39,45,1.1555555555555554,0.06321005190772531,570,Are you certified as comfort person?
1734,1,5,39,45,1.1555555555555554,0.06321005190772531,570,"I didn't initially see you as ""seedy""."
1734,2,3,40,45,1.1555555555555554,0.07075034750641399,570,I told you that you looked a little seedy.
1734,1,5,39,45,1.1555555555555554,0.06321005190772531,570,"See, most people don't know what birds really eat like."
1734,1,5,39,45,1.1555555555555554,0.06321005190772531,570,Can you keep it down? I'm trying to read.
1734,1,5,39,45,1.1555555555555554,0.06321005190772531,570,You must be nuts.
1734,2,3,40,45,1.1555555555555554,0.07075034750641399,570,I told you 'Pigeon' by Ralph Lauren was a bad choice for the park.
1734,1,5,39,45,1.1555555555555554,0.06321005190772531,570,Could you please keep them quiet. I'm trying to read.
1734,1,5,39,45,1.1555555555555554,0.06321005190772531,570,"well, they are ""of a feather""..."
1734,1,5,39,45,1.1555555555555554,0.06321005190772531,570,Really??? You worked with Hitchcock?
1734,0,7,38,45,1.1555555555555554,0.05463890236888291,570,I guess this place really is for the birds.
1734,1,5,39,45,1.1555555555555554,0.06321005190772531,570,Must be my new flax seed cologne.
1734,1,5,39,45,1.1555555555555554,0.06321005190772531,570,It's all in your head.
1734,1,5,39,45,1.1555555555555554,0.06321005190772531,570,How was Alcatraz?
1734,1,5,39,45,1.1555555555555554,0.06321005190772531,570,What happens when you sneeze?
1734,0,7,38,45,1.1555555555555554,0.05463890236888291,570,"Well, it looks like you are at the top of the pecking order."
1734,1,5,39,45,1.1555555555555554,0.06321005190772531,570,So how's that new Trump aftershave working for you then ?
1734,0,7,38,45,1.1555555555555554,0.05463890236888291,570,This is the single greatest finch hunt of a politician in American history.
1734,0,7,38,45,1.1555555555555554,0.05463890236888291,570,I like your organic mode of transportation
1734,1,5,39,45,1.1555555555555554,0.06321005190772531,570,Is it contagious?
1734,0,7,38,45,1.1555555555555554,0.05463890236888291,570,How was the crumb cake?
1734,0,7,38,45,1.1555555555555554,0.05463890236888291,570,I presume you missed the Hitchcock film..
1734,1,5,39,45,1.1555555555555554,0.06321005190772531,570,"""Oh, you thought it was a 'Tweed' suit, not a 'Seed' suit."
1734,1,5,39,45,1.1555555555555554,0.06321005190772531,570,"This just can't be real, I am reading The Birds..."
1734,0,7,38,45,1.1555555555555554,0.05463890236888291,570,Larry...when did I go from a babe magnet to a bird magnet?
1734,0,7,38,45,1.1555555555555554,0.05463890236888291,570,"Tippi Hedren, is that really you?"
1734,1,5,39,45,1.1555555555555554,0.06321005190772531,570,Your book must really be crumby.
1734,1,5,39,45,1.1555555555555554,0.06321005190772531,570,"Man, that's a lot to swallow."
1734,2,3,40,45,1.1555555555555554,0.07075034750641399,570,"Well, you must feel crumby."
1734,1,5,39,45,1.1555555555555554,0.06321005190772531,570,Who knew that your new underarm deodorant would also act as a powerful pigeon attractant.
1734,1,5,39,45,1.1555555555555554,0.06321005190772531,570,Still working on bird pheromone synthesis I take it?
1734,1,5,39,45,1.1555555555555554,0.06321005190772531,570,I don't do Twitter
1734,1,5,39,45,1.1555555555555554,0.06321005190772531,570,Feelin' cumby?
1734,1,5,39,45,1.1555555555555554,0.06321005190772531,570,I didn't like the movie either.
1734,2,3,40,45,1.1555555555555554,0.07075034750641399,570,"You're welcome to borrow my copy of ""To Kill a Mockingbird"" any time."
1734,1,5,39,45,1.1555555555555554,0.06321005190772531,570,That's the second time this week Ms Hedren.
1734,1,5,39,45,1.1555555555555554,0.06321005190772531,570,"No, I did not say, 'Go flock yourself.'"
1734,1,5,39,45,1.1555555555555554,0.06321005190772531,570,"""Well if you will try and read ""Wings of the Dove""."
