target_id,precision,count,score,caption,contest,funny,somewhat_funny,unfunny,rank
2870,0.06263791695329897,62,1.2258064516129032,Hey! I just spotted an endandered species.,594,2,10,50,841
2879,0.06263791695329897,62,1.2258064516129032,I read a book that says they feel and communicate just like us... But I really wanted to know if there sap can be boiled down into sugar.,594,2,10,50,841
2895,0.05826395035075953,62,1.2258064516129032,"What happened to us? We used to do that, and then we somehow grew apart",594,1,12,49,841
2944,0.06672577740289717,62,1.2258064516129032,Ooooo! I love the color their plaids turn this time of year!,594,3,8,51,841
2952,0.05826395035075953,62,1.2258064516129032,Seems like only yesterday they were climbing us!,594,1,12,49,841
3126,0.06263791695329897,62,1.2258064516129032,I love seeing them in their fall colors and I try not to think about them dying..,594,2,10,50,841
3129,0.06263791695329897,62,1.2258064516129032,You can tell their age by counting their wrinkles.,594,2,10,50,841
3174,0.06263791695329897,62,1.2258064516129032,I love it when they change colors this time of year.,594,2,10,50,841
3223,0.05826395035075953,62,1.2258064516129032,"Well, isn't that refreshing? A consensual relationship.",594,1,12,49,841
3314,0.06672577740289717,62,1.2258064516129032,"We're not listening, just leaves-dropping",594,3,8,51,841
3331,0.06263791695329897,62,1.2258064516129032,I'm rooting for them.,594,2,10,50,841
3444,0.05826395035075953,62,1.2258064516129032,Love makes my leaves drop.,594,1,12,49,841
2647,0.059474920590783416,67,1.2238805970149254,Look1 The new L.L. Bean shirts,594,2,11,54,891
137,0.06173977251921359,63,1.2222222222222223,"Cute, but I'm not crazy about the lumberjack style.",594,2,10,51,892
199,0.05744359616725745,63,1.2222222222222223,Look at all the different colors! The changing of the flannels is my favorite time of year.,594,1,12,50,892
261,0.07312932258004377,63,1.2222222222222223,"If a tree smiles at you in the forest and you don't sees it, is it really happy?",594,5,4,54,892
299,0.05744359616725745,63,1.2222222222222223,Somehow they know I’m a certified arborist.,594,1,12,50,892
669,0.06954038431673219,63,1.2222222222222223,They're so beautiful... I just want to carve our initials into them.,594,4,6,53,892
1574,0.06292801266165045,54,1.2222222222222223,"This can't be a New Yorker cartoon, it's too normal.",594,1,10,43,892
1933,0.06173977251921359,63,1.2222222222222223,I wish we could do plaid.,594,2,10,51,892
1966,0.06173977251921359,63,1.2222222222222223,We can stop dropping leaves now. Eve must've finally got approved for that LL Bean credit card.,594,2,10,51,892
3080,0.05744359616725745,63,1.2222222222222223,“I don’t think her mother meant marrying a tree surgeon.”’,594,1,12,50,892
3145,0.05744359616725745,63,1.2222222222222223,These millennials just can't seem to put down any roots.,594,1,12,50,892
3365,0.06575585358598524,63,1.2222222222222223,Thank goodness he’s found someone else to chain himself to!,594,3,8,52,892
190,0.05866531842313125,60,1.2166666666666666,"I just love the autumn plaids, don't you?",594,1,11,48,903
210,0.05866531842313125,60,1.2166666666666666,"I told you, Chris, not everyone wearing plaid is mean to us.",594,1,11,48,903
229,0.05866531842313125,60,1.2166666666666666,Do you ever get the feeling that you're being watched?,594,1,11,48,903
288,0.06761333513821251,60,1.2166666666666666,"I remember us like that, before our reincarnation.",594,3,7,50,903
343,0.0716696228532331,60,1.2166666666666666,"""Yeah, but my sap is good on pancakes"".",594,4,5,51,903
565,0.05866531842313125,60,1.2166666666666666,"If you ignore the disgusting way they reproduce, it's almost cute.",594,1,11,48,903
627,0.06761333513821251,60,1.2166666666666666,"Awww, that's so sweet. It makes me want to leave.",594,3,7,50,903
664,0.06329764084940143,60,1.2166666666666666,It's hilarious when they plant seeds.,594,2,9,49,903
670,0.06329764084940143,60,1.2166666666666666,They only love us for our CO2.,594,2,9,49,903
689,0.05866531842313125,60,1.2166666666666666,"Our leaves fall on lovers again, but hey, we'll outlive them both!",594,1,11,48,903
699,0.06329764084940143,60,1.2166666666666666,"I love when the autumn colors come out, especially the plaids.",594,2,9,49,903
701,0.05866531842313125,60,1.2166666666666666,They make me want to reach your roots.,594,1,11,48,903
867,0.05866531842313125,60,1.2166666666666666,Reminds me when we were mere saplings,594,1,11,48,903
902,0.0716696228532331,60,1.2166666666666666,If I could I would.,594,4,5,51,903
994,0.05866531842313125,60,1.2166666666666666,This squirrel is really tickling,594,1,11,48,903
1013,0.05866531842313125,60,1.2166666666666666,Do not take Denial if you are allergic to any of its ingredients.,594,1,11,48,903
1059,0.0716696228532331,60,1.2166666666666666,Are they still watching?,594,4,5,51,903
1061,0.06329764084940143,60,1.2166666666666666,I love it when they change colors in autumn -- such pretty plaids,594,2,9,49,903
1109,0.06761333513821251,60,1.2166666666666666,You see the faces too?,594,3,7,50,903
1175,0.06329764084940143,60,1.2166666666666666,"My wager? Married in a year, divorced in three. How 'bout you?",594,2,9,49,903
1186,0.06761333513821251,60,1.2166666666666666,"He's a lumberjack, but he's o.k.",594,3,7,50,903
1195,0.06761333513821251,60,1.2166666666666666,If a human falls in the woods does it make a sound?,594,3,7,50,903
1240,0.05866531842313125,60,1.2166666666666666,Falling for you,594,1,11,48,903
1270,0.06329764084940143,60,1.2166666666666666,Don't you love fall and giving these people Lyme Disease.,594,2,9,49,903
1341,0.05866531842313125,60,1.2166666666666666,At some point we have to tell them that they’re on the site of our new dream house.,594,1,11,48,903
1352,0.06329764084940143,60,1.2166666666666666,"If a tree falls on a couple in the park, do they make a sound?",594,2,9,49,903
1436,0.06329764084940143,60,1.2166666666666666,Whose woods these are you think they know?,594,2,9,49,903
1472,0.05866531842313125,60,1.2166666666666666,"Okay, just drop a few more leaves --- there. Perfect romantic setting.",594,1,11,48,903
1485,0.06329764084940143,60,1.2166666666666666,I wonder if they'll last through the flannel phase,594,2,9,49,903
1487,0.06329764084940143,60,1.2166666666666666,Will we be like that three hundred years from now?,594,2,9,49,903
1535,0.06761333513821251,60,1.2166666666666666,Humans look so amazing in the fall.,594,3,7,50,903
1547,0.06329764084940143,60,1.2166666666666666,I love the pretty colors humans wear in the fall.,594,2,9,49,903
1607,0.06761333513821251,60,1.2166666666666666,"Every fall, trees travel to the Northeast to watch relationships change.",594,3,7,50,903
1626,0.05866531842313125,60,1.2166666666666666,Why don't you make like a tree and leave- hahaha,594,1,11,48,903
1650,0.06329764084940143,60,1.2166666666666666,"Maybe we can't walk, but at least we having matching tops.",594,2,9,49,903
1703,0.05363439040648224,60,1.2166666666666666,"I like her because she calls him ""Woody.""",594,0,13,47,903
1706,0.05866531842313125,60,1.2166666666666666,And he hasn't swung an axe since.,594,1,11,48,903
1768,0.06329764084940143,60,1.2166666666666666,The way they dress alike reminds me of us.,594,2,9,49,903
1834,0.06761333513821251,60,1.2166666666666666,"Don’t worry Peggy, global warming will make it all go away soon.” “The trees or matching flannel?",594,3,7,50,903
1867,0.06329764084940143,60,1.2166666666666666,"Don't you just love fall, when they change to their plaid doors?",594,2,9,49,903
1906,0.05866531842313125,60,1.2166666666666666,Awww ... they'll be putting down roots any day now.,594,1,11,48,903
1916,0.06329764084940143,60,1.2166666666666666,They're about to cross-pollinate!,594,2,9,49,903
1948,0.06761333513821251,60,1.2166666666666666,"They're whispering to you, Louise.",594,3,7,50,903
1959,0.05866531842313125,60,1.2166666666666666,Every fall it's fun to leavesdrop on their conversation.,594,1,11,48,903
1987,0.05866531842313125,60,1.2166666666666666,They remind me of us as saplings.,594,1,11,48,903
2021,0.05363439040648224,60,1.2166666666666666,They can be so lovely. I just wish they would go to another planet.,594,0,13,47,903
2030,0.06761333513821251,60,1.2166666666666666,Symptoms may include bleeding from the mouth and intense vomiting.,594,3,7,50,903
2096,0.06329764084940143,60,1.2166666666666666,Ahhh... My favorite time of year is leavesdropping.,594,2,9,49,903
2274,0.07550832133836045,60,1.2166666666666666,Ah. Looks like we all got wood.,594,5,3,52,903
2291,0.06761333513821251,60,1.2166666666666666,Plaid is the new black.,594,3,7,50,903
2367,0.06329764084940143,60,1.2166666666666666,Don't you love their bright colors this time of year?,594,2,9,49,903
2415,0.06329764084940143,60,1.2166666666666666,"Autumn is so romantic. The cool, crisp days, the humans turning plaid...",594,2,9,49,903
2449,0.06329764084940143,60,1.2166666666666666,They are a sweet couple. I have no scars from their relationship.,594,2,9,49,903
2502,0.06329764084940143,60,1.2166666666666666,Their so beautiful when there shirts change to plaid,594,2,9,49,903
2506,0.06329764084940143,60,1.2166666666666666,"I'm happy for him, I miss his hugs.",594,2,9,49,903
2536,0.06329764084940143,60,1.2166666666666666,They grow up so fast. Don’t they ?,594,2,9,49,903
2538,0.06761333513821251,60,1.2166666666666666,May the leaves of love fall at your feet.,594,3,7,50,903
2595,0.06329764084940143,60,1.2166666666666666,"Except for us, nobody does Autumn better than LL Bean and J Crew.",594,2,9,49,903
2701,0.06329764084940143,60,1.2166666666666666,Nature and chill,594,2,9,49,903
2729,0.06761333513821251,60,1.2166666666666666,"We're ALL plaid inside, dear.",594,3,7,50,903
2775,0.06329764084940143,60,1.2166666666666666,I'm glad Elisabetta and Bartholomew only carved their initials.,594,2,9,49,903
2778,0.06761333513821251,60,1.2166666666666666,"Honestly, it just sounds boring Bob — nobody wants to watch a guy painting on tv.",594,3,7,50,903
2779,0.06329764084940143,60,1.2166666666666666,Love me or leaf me.,594,2,9,49,903
2880,0.06329764084940143,60,1.2166666666666666,Do you think the trees ever wish they could wear plaid?,594,2,9,49,903
2903,0.06329764084940143,60,1.2166666666666666,"I'm hugging you too, but it's with my roots!",594,2,9,49,903
2918,0.05866531842313125,60,1.2166666666666666,Let's branch out and make our own little twigs,594,1,11,48,903
2930,0.05866531842313125,60,1.2166666666666666,happy little people,594,1,11,48,903
2956,0.07550832133836045,60,1.2166666666666666,"Once he leaves, want to have a treesome?",594,5,3,52,903
2970,0.06761333513821251,60,1.2166666666666666,Their plaids don't hold a candle to ours.,594,3,7,50,903
2998,0.06761333513821251,60,1.2166666666666666,Why don't you ever put your limb around me?,594,3,7,50,903
3006,0.06329764084940143,60,1.2166666666666666,Plaid season is so colorful!,594,2,9,49,903
3058,0.06329764084940143,60,1.2166666666666666,The Autumn plaids are so vibrant this year!,594,2,9,49,903
3352,0.0716696228532331,60,1.2166666666666666,Do you think I would look good with a beard?,594,4,5,51,903
3382,0.05866531842313125,60,1.2166666666666666,"What a cool guy, his hair is just like ours.",594,1,11,48,903
3478,0.06329764084940143,60,1.2166666666666666,They're so cute I can almost forgive the lumberjack look.,594,2,9,49,903
3496,0.06761333513821251,60,1.2166666666666666,"It stumps me, but I just feel sappy when lumberjacks fall in love.",594,3,7,50,903
3510,0.05363439040648224,60,1.2166666666666666,I'll never leaf you.,594,0,13,47,903
1915,0.06602973412408396,56,1.2142857142857142,"Imagine how awkward - four trunks, joined at the top, and moving.",594,2,8,46,980
2258,0.06602973412408396,56,1.2142857142857142,"On day, they’ll make a house out of us.",594,2,8,46,980
59,0.06659047872652428,61,1.213114754098361,"What do you think... if a human falls in love in the forest and no one is there to hear it, does it still make a sound?",594,3,7,51,982
234,0.06235257628675809,61,1.213114754098361,I like the silent type too.,594,2,9,50,982
2014,0.057804806739269465,61,1.213114754098361,Sometimes different plaids crossbreed.,594,1,11,49,982
2145,0.06659047872652428,61,1.213114754098361,"Looks like true leaf, to me.",594,3,7,51,982
2369,0.06659047872652428,61,1.213114754098361,I wood.,594,3,7,51,982
2661,0.057804806739269465,61,1.213114754098361,"I've taken my medication . . I'm telling you the trees are saying, ""Follow the Yellow Brick Road.""",594,1,11,49,982
2696,0.06235257628675809,61,1.213114754098361,"On day, they’ll make a house out of us.",594,2,9,50,982
43,0.05902320792875933,58,1.206896551724138,I’m secretly planning to accuse you of inappropriate contact thirty years from now.,594,1,10,47,989
52,0.0727916279998561,58,1.206896551724138,"They all look like lumberjacks, but not one of them knows one end of an axe from the other.",594,4,4,50,989
127,0.05902320792875933,58,1.206896551724138,"If this isn't a ""Cialis Moment"", then I don't know what is!",594,1,10,47,989
332,0.06851029433095054,58,1.206896551724138,"And to think, only one Giving Tree had to give its life for their happiness.",594,3,6,49,989
348,0.06394294137555384,58,1.206896551724138,Doesn't that guy remind you of Bob Ross?,594,2,8,48,989
350,0.06394294137555384,58,1.206896551724138,Did you just bark?,594,2,8,48,989
458,0.06394294137555384,58,1.206896551724138,A pair of plaids. Don't we just love the fall colors.,594,2,8,48,989
478,0.06394294137555384,58,1.206896551724138,You may also wish to submit your thesis online.,594,2,8,48,989
499,0.05902320792875933,58,1.206896551724138,I wish we could hug each other too.,594,1,10,47,989
642,0.05902320792875933,58,1.206896551724138,Are you getting sappy too?,594,1,10,47,989
694,0.06394294137555384,58,1.206896551724138,I didn’t know they come without wires.,594,2,8,48,989
725,0.06394294137555384,58,1.206896551724138,"as I was saying, to have something sweet, you have to get the lid offf the Maple syrup ....",594,2,8,48,989
757,0.06394294137555384,58,1.206896551724138,"Chuck, don’t worry: your secret’s good with me.",594,2,8,48,989
818,0.05902320792875933,58,1.206896551724138,Pretend you don't hear them. We're almost home.,594,1,10,47,989
822,0.06851029433095054,58,1.206896551724138,Let's make like a lumberjack and split.,594,3,6,49,989
844,0.06394294137555384,58,1.206896551724138,I know they’re creepy - just keep smiling...,594,2,8,48,989
848,0.06851029433095054,58,1.206896551724138,"I'm not positive, but the shrooms might be kicking in now.",594,3,6,49,989
916,0.05902320792875933,58,1.206896551724138,I'm glad that lumberjack found someone else to occupy his time with,594,1,10,47,989
964,0.05902320792875933,58,1.206896551724138,"Someday, I would like to take a walk among the people",594,1,10,47,989
970,0.05902320792875933,58,1.206896551724138,"He’s pretty sweet, for a lumberjack.",594,1,10,47,989
1016,0.06851029433095054,58,1.206896551724138,They met on TreeHarmony.com,594,3,6,49,989
1325,0.05902320792875933,58,1.206896551724138,I love all the plaids at this time of year.,594,1,10,47,989
1388,0.06394294137555384,58,1.206896551724138,They dropped a branch on my last boyfriend--they approve.,594,2,8,48,989
1420,0.05902320792875933,58,1.206896551724138,True love.... I just hope they don't carve their initials on me.,594,1,10,47,989
1464,0.05365424863555168,58,1.206896551724138,Aren't the colors of the plaids lovely this time of year?,594,0,12,46,989
1486,0.05902320792875933,58,1.206896551724138,"Oh, they’re both wearing plaid! I love the autumn colors.",594,1,10,47,989
1540,0.06394294137555384,58,1.206896551724138,"Look, he's falling for her...",594,2,8,48,989
1585,0.05902320792875933,58,1.206896551724138,It's just their way of telling you to get rid of the beard.,594,1,10,47,989
1659,0.06394294137555384,58,1.206896551724138,So nice to see them putting down roots.,594,2,8,48,989
1667,0.06394294137555384,58,1.206896551724138,"Is it just me, or do you also feel like pelting them with acorns?",594,2,8,48,989
1724,0.06851029433095054,58,1.206896551724138,It's cute how Autumn brings out their colors...,594,3,6,49,989
1725,0.06394294137555384,58,1.206896551724138,"Sensible shoes? Check.... L. L. Bean shirts? Check.... Silver hair among the gold? Check.... Still friends after 20 years of marriage? Check.... Well, Sassafras, you're absolutely right! They DO match the demographic profile for tree-huggers.",594,2,8,48,989
1729,0.05902320792875933,58,1.206896551724138,They grow up so quickly!,594,1,10,47,989
1748,0.06394294137555384,58,1.206896551724138,Those two have never seen their love fall like our leaves in an Autumn breeze. What you got a woody?,594,2,8,48,989
1800,0.06394294137555384,58,1.206896551724138,Another romance for Eddie Bauer.,594,2,8,48,989
1924,0.06851029433095054,58,1.206896551724138,If only we were closer.,594,3,6,49,989
1941,0.06851029433095054,58,1.206896551724138,The urban lumberjacks are much less dangerous than their forest dwelling counterparts,594,3,6,49,989
1945,0.05902320792875933,58,1.206896551724138,They look pretty happy for being so rootless.,594,1,10,47,989
2023,0.06394294137555384,58,1.206896551724138,They're getting sarcastic. It's time to leave.,594,2,8,48,989
2038,0.06851029433095054,58,1.206896551724138,Is that you playing with my roots?,594,3,6,49,989
2045,0.06851029433095054,58,1.206896551724138,I never really wanted to be a thesis adviser anyway.,594,3,6,49,989
2113,0.05902320792875933,58,1.206896551724138,no electronics is a lot like LSD,594,1,10,47,989
2118,0.05365424863555168,58,1.206896551724138,When are they going to put down roots?,594,0,12,46,989
2176,0.06851029433095054,58,1.206896551724138,"It's quite obvious, she used to be coniferous but now they're both deciduous.",594,3,6,49,989
2200,0.06394294137555384,58,1.206896551724138,I'm so glad they added emojis to the I-trees!,594,2,8,48,989
2245,0.05902320792875933,58,1.206896551724138,Some day I will tell you what they said about us,594,1,10,47,989
2250,0.06851029433095054,58,1.206896551724138,"During mating season, lumberjacks are called ""hipsters"" and are perfectly harmless.",594,3,6,49,989
2260,0.06851029433095054,58,1.206896551724138,I guess our photosynthesis is pretty much history...,594,3,6,49,989
2448,0.06394294137555384,58,1.206896551724138,"If your wood that lasts more than four hours, please consult a physician.",594,2,8,48,989
2620,0.06851029433095054,58,1.206896551724138,"I love plaids, I wish I could wear them.",594,3,6,49,989
2677,0.06851029433095054,58,1.206896551724138,Seek immediate medical help if you experience nausea during sex or falling leaves.,594,3,6,49,989
2704,0.06394294137555384,58,1.206896551724138,Every time all our leaves fall off people pretend to get along for like a month.,594,2,8,48,989
2878,0.05902320792875933,58,1.206896551724138,I love it when they don’t carve initials.,594,1,10,47,989
2951,0.06394294137555384,58,1.206896551724138,All we need is for Maggie to add color!,594,2,8,48,989
3007,0.05902320792875933,58,1.206896551724138,They'll be having a little sapling soon.,594,1,10,47,989
3023,0.06394294137555384,58,1.206896551724138,I can't help feeling sappy this time of year.,594,2,8,48,989
3112,0.05902320792875933,58,1.206896551724138,Plaid has always been my favorite season.,594,1,10,47,989
3185,0.06851029433095054,58,1.206896551724138,What do you say we cut their hearts out and carve our initials on them?,594,3,6,49,989
3284,0.06851029433095054,58,1.206896551724138,"To be perfectly honest, branches and leaves aren't Maggie's strong suit, and yes, we do look more like giant cauliflowers.",594,3,6,49,989
3488,0.05902320792875933,58,1.206896551724138,I like ‘em much better when they don’t carve their eternal love into our flesh.,594,1,10,47,989
315,0.06294757226340743,59,1.2033898305084745,"If they do get married, I hope I become their coffee table.",594,2,8,49,1049
598,0.06294757226340743,59,1.2033898305084745,"Remember; plastic, metal, concrete or stone.....no wood!",594,2,8,49,1049
661,0.05812007671977909,59,1.2033898305084745,Such a shame that next week several women will come out and say how he has harassed and groped them over the years.,594,1,10,48,1049
803,0.06294757226340743,59,1.2033898305084745,I love to see their clothes changing. Such lovely blend of colors.,594,2,8,49,1049
1049,0.05812007671977909,59,1.2033898305084745,It's about time those two starting hugging something else besides us trees.,594,1,10,48,1049
1337,0.06294757226340743,59,1.2033898305084745,"Of course you're dreaming...I'm 5'5"", weigh 300 lbs., smoke smelly cigars, and don't wear GAP - ever.",594,2,8,49,1049
1561,0.06743033731044798,59,1.2033898305084745,Looks like someone's feeling a little woody.,594,3,6,50,1049
2076,0.06294757226340743,59,1.2033898305084745,"Just think, in 150 years that will be us.",594,2,8,49,1049
2320,0.06294757226340743,59,1.2033898305084745,Let's just leaf them.,594,2,8,49,1049
2391,0.06294757226340743,59,1.2033898305084745,"Ah finally, the plaid anniversary.",594,2,8,49,1049
2484,0.06743033731044798,59,1.2033898305084745,Follow the mellow chick road.,594,3,6,50,1049
2642,0.05812007671977909,59,1.2033898305084745,I think that I shall never see a pair as lovely as a tree.,594,1,10,48,1049
2997,0.06294757226340743,59,1.2033898305084745,I don't think I felt that acid,594,2,8,49,1049
77,0.06564879518897745,55,1.2,They're so like us before we put down roots.,594,2,7,46,1062
102,0.05443310539518173,55,1.2,And to think we’re plotting to assassinate this lumberjack.,594,0,11,44,1062
105,0.06564879518897745,55,1.2,I love the Fall colors.,594,2,7,46,1062
144,0.0705915362006309,55,1.2,"They look so beautiful now in their fall colors, but when you see them through a window after they drop them it's a whole different story",594,3,5,47,1062
183,0.06030226891555272,55,1.2,"...and to think, it wasn’t long ago that people in plaid flannel spelled certain death for us. God bless Kurt Cobain!",594,1,9,45,1062
193,0.05443310539518173,55,1.2,"Don't turn around, but I think we're being watched.",594,0,11,44,1062
230,0.06030226891555272,55,1.2,These must be the Happy Trees that Bob Ross was always putting in his paintings.,594,1,9,45,1062
237,0.06564879518897745,55,1.2,I just love the colors this time of year!,594,2,7,46,1062
270,0.06564879518897745,55,1.2,"Remember son, you can always time the coming of Autumn by when the flannel appears",594,2,7,46,1062
281,0.06030226891555272,55,1.2,They're so beautiful this time of year.,594,1,9,45,1062
289,0.06564879518897745,55,1.2,How nice to see plaids and it not be a lumberjack!,594,2,7,46,1062
317,0.06564879518897745,55,1.2,They are an indigenous species.,594,2,7,46,1062
444,0.06564879518897745,55,1.2,"That's what we need - less lumberjacks, more 'Love her, Jack.'",594,2,7,46,1062
475,0.0705915362006309,55,1.2,They look so delicious already! I almost can’t wait until they’re ripe…,594,3,5,47,1062
509,0.06564879518897745,55,1.2,"Oh, they're leafing us.",594,2,7,46,1062
574,0.05443310539518173,55,1.2,Don't you just love those Fall sweater colors?,594,0,11,44,1062
578,0.06030226891555272,55,1.2,I wish someone touched me like that.,594,1,9,45,1062
599,0.06030226891555272,55,1.2,They're so pretty. It's a pity their time is so brief.,594,1,9,45,1062
626,0.06564879518897745,55,1.2,I'm looking forward to wrapping my limb around you in a few decades,594,2,7,46,1062
631,0.05443310539518173,55,1.2,"I'm so glad they aren't the ""sitting in a tree"" type!",594,0,11,44,1062
706,0.05724365605193376,60,1.2,"You know, maybe I should finally give TreeHarmony.com a try.",594,1,10,49,1062
739,0.06030226891555272,55,1.2,I always wanted my life to be like a Bob Ross painting.,594,1,9,45,1062
1025,0.06564879518897745,55,1.2,There’s magic in the air whenever I see them without their dog.,594,2,7,46,1062
1033,0.06030226891555272,55,1.2,Ever have the feeling you're being watched?,594,1,9,45,1062
1073,0.06564879518897745,55,1.2,I love seeing their leaves change colors every Fall!,594,2,7,46,1062
1194,0.06564879518897745,55,1.2,"Aww, they untucked it.",594,2,7,46,1062
1228,0.06564879518897745,55,1.2,"Are you the ""Louise"" whose name we keep hearing whispered?",594,2,7,46,1062
1255,0.06564879518897745,55,1.2,"See dear, even the trees smile as we walk in the woods in a non-Republican world",594,2,7,46,1062
1305,0.06030226891555272,55,1.2,"Hey, it looks like they met on Match too.",594,1,9,45,1062
1382,0.06564879518897745,55,1.2,"Without roots, their future won't be like ours.",594,2,7,46,1062
1466,0.06564879518897745,55,1.2,I just love fall fashion colors.,594,2,7,46,1062
1483,0.06564879518897745,55,1.2,"No, she's the one with the ties to Russia. He's an orthodontist.",594,2,7,46,1062
1520,0.06030226891555272,55,1.2,They seem com-plaid-ible.,594,1,9,45,1062
1527,0.06564879518897745,55,1.2,"Look Peter, even the trees are friendlier upstate",594,2,7,46,1062
1571,0.05443310539518173,55,1.2,Oh phew! They’re just New Yorkers trying to look like loggers.,594,0,11,44,1062
1602,0.06030226891555272,55,1.2,Sappy.,594,1,9,45,1062
1663,0.06564879518897745,55,1.2,oooooh...my leaves are turning red,594,2,7,46,1062
1742,0.06564879518897745,55,1.2,That was us before our branches were trimmed back.,594,2,7,46,1062
1751,0.0705915362006309,55,1.2,Do you ever get the feeling you're being watched?,594,3,5,47,1062
1771,0.05443310539518173,55,1.2,They look like such a lovely couple -- and they're both tree huggers!,594,0,11,44,1062
1817,0.06030226891555272,55,1.2,I think I'm falling in leaf with you...,594,1,9,45,1062
1832,0.06564879518897745,55,1.2,Looks like they’re peaking,594,2,7,46,1062
1844,0.06564879518897745,55,1.2,"Ha, those tartans don't match....not a good sign.",594,2,7,46,1062
1973,0.06388765649999399,50,1.2,"Well plaid, young lovers. Well plaid.",594,1,8,41,1062
