target_id,precision,count,score,caption,contest,funny,somewhat_funny,unfunny,rank
823,0.014733757799852056,3013,1.8954530368403584,I remember them from last year. They must be perennials.,594,844,1010,1159,1
3134,0.01604353710317449,2378,1.86080740117746,"Relax, they're just DRESSED like lumberjacks.",594,585,877,916,2
1332,0.02595146523398896,886,1.8577878103837469,I love the fall when all their shirts turn plaid.,594,210,340,336,3
2401,0.015429006589336566,2532,1.8507109004739333,"Honestly? He's like, ten rings too old for her.",594,602,950,980,4
1070,0.015895733565530232,2530,1.8430830039525687,They've been in love since 1992. I know. Their initials are carved in my ass.,594,641,851,1038,5
1870,0.02579284457570176,874,1.836384439359268,I just love watching them turn plaid in the fall.,594,194,343,337,6
673,0.016079632095896478,2754,1.8097312999273785,Could I interest you in a treesome?,594,768,694,1292,7
213,0.03572833820350239,497,1.8028169014084507,"You think that's weird, you should watch them pollinate.",594,118,163,216,8
2774,0.018002688981703402,2016,1.7881944444444444,"Look, Kevin, we're in a Cialis commercial!",594,490,609,917,9
2282,0.027215202907130576,817,1.780905752753978,"... And then their hair begins to lose its color, eventually falling off ...",594,177,284,356,10
3158,0.016722425419636956,2088,1.771072796934866,There was a time when a beard and a checkered shirt would have made me nervous,594,425,760,903,11
1097,0.02074568790641507,1417,1.7473535638673254,"Hey look, you can see her roots.",594,298,463,656,12
2080,0.02591083948066289,816,1.7463235294117647,"It's still my favorite time of the year, when the weather gets cold and they all turn plaid.",594,146,317,353,13
302,0.02176433052973265,1301,1.7386625672559568,They met on Timber.,594,275,411,615,14
2802,0.017386777286475967,1888,1.7335805084745763,"Ah, to be young and rootless.",594,354,677,857,15
3539,0.02265006613397059,1132,1.730565371024735,"I'm with you, if they trip and fall down, I think they would make a sound.",594,217,393,522,16
1289,0.01869314722748297,1759,1.7276861853325751,This is the sixth pharmaceutical commercial we've been in this year!,594,366,548,845,17
966,0.019330678440064697,1488,1.721774193548387,I love autumn when their colors turn to plaid.,594,264,546,678,18
2864,0.022830875607212503,1103,1.7089755213055304,Must be love. Neither's got a smartphone out.,594,203,376,524,19
2466,0.017807274990071467,1761,1.706984667802385,I love how they turn plaid in Autumn.,594,309,627,825,20
1161,0.024974450979156588,955,1.6900523560209424,Don't you just want to carve your initials in them?,594,182,295,478,21
1223,0.02240573991429885,1103,1.6844968268359022,That's how people make acorns.,594,186,383,534,22
543,0.02842986068680545,684,1.6769005847953216,You can relax now; they just looked like lumberjacks.,594,114,235,335,23
2917,0.01772308136749419,1720,1.6726744186046512,I love it when the shirts turn plaid.,594,275,607,838,24
3140,0.024672292296965246,974,1.6652977412731007,I bet they don't know his wife jogs up this path every morning.,594,180,288,506,25
744,0.022355551613963097,993,1.6344410876132933,You used to look at me like that 20 rings ago!,594,131,368,494,26
180,0.025302293645406097,850,1.6305882352941177,That was us before we grew apart.,594,132,272,446,27
767,0.025995665515819628,1094,1.6188299817184644,He likes her bush.,594,275,127,692,28
1169,0.023487996541108683,998,1.6122244488977957,Their cell phones must be broken.,594,156,299,543,29
1489,0.029418202014937764,622,1.6077170418006432,"Sure makes you feel sappy, doesn't it?",594,93,192,337,30
3260,0.02369011933606744,909,1.6050605060506051,They’re adorable until they carve their initials into you.,594,123,304,482,31
842,0.0283994571328977,843,1.5990510083036773,"It looks consensual now, but give it forty years.",594,185,135,523,32
1037,0.031388282275755124,511,1.598825831702544,Don't you love how they change colors in the fall?,594,67,172,272,33
2094,0.025180378832558255,794,1.5957178841309825,The autumn flannels are spectacular this year!,594,104,265,425,34
2025,0.02579883026831024,782,1.59462915601023,"They're so cute, with their short little lives.",594,109,247,426,35
2769,0.025298002790016955,787,1.5933926302414232,Ah--flannel--the first sign of autumn.,594,103,261,423,36
533,0.026737448299644626,766,1.5926892950391645,I hear this week is peak flannel.,594,117,220,429,37
2128,0.0298618524771885,777,1.5920205920205919,I'll give it six months.,594,175,110,492,38
2454,0.030578577105546213,549,1.5846994535519126,Checks and plaid? I give it six weeks.,594,74,173,302,39
710,0.02837446965003628,661,1.5779122541603632,Reminds me of us. Before we grew apart.,594,95,192,374,40
489,0.02798274139948241,643,1.5738724727838258,It's better now that they tattoo their names on each other instead of on us.,594,83,203,357,41
2508,0.029416504141620038,622,1.572347266881029,"I'm happy for him, but I miss his hugs.",594,91,174,357,42
453,0.029604533292506507,605,1.5702479338842976,"""Lumberjacks in love. Maybe now the killing will stop.'",594,86,173,346,43
154,0.03194268533391588,584,1.5667808219178083,Have you seen the size of his wood-pecker?,594,102,127,355,44
886,0.030711619933303725,575,1.5652173913043481,If we weren't here and one of those people fell over do you think they would make a sound?,594,85,155,335,45
3509,0.03011387506401772,575,1.5652173913043481,It's so nice to see someone without a dog.,594,79,167,329,45
1856,0.033369422161006954,571,1.5639229422066552,"For the record, he's not touching her butt.",594,111,100,360,47
2781,0.02999316344604408,568,1.5633802816901408,"Sure, they may look happy, but they are still not quite out of the woods.",594,75,170,323,48
313,0.02939521553612385,548,1.5602189781021898,Their flannels are so beautiful this time of year!,594,62,183,303,49
2458,0.030030979028471474,507,1.5522682445759368,I love when the plaids come out. The reds and greens are just gorgeous.,594,53,174,280,50
2518,0.033473019554110715,462,1.5432900432900434,I wish I could carve our initials in one of them.,594,62,127,273,51
3489,0.03539405469874185,432,1.5416666666666667,I understand that they engrave words into their own trunks these days.,594,63,108,261,52
97,0.0335515004799291,453,1.5408388520971303,Thank God they are not walking their dogs today.,594,59,127,267,53
1525,0.03375720338011695,431,1.5359628770301623,It almost makes you forget they're destroying us.,594,52,127,252,54
2327,0.034238079084836635,423,1.5342789598108748,"Phew, I thought they were lumberjacks.",594,52,122,249,55
2130,0.03458910105239715,412,1.5315533980582523,"Is it me, or does everything seem nicer since Seattle legalized pot?",594,50,119,243,56
1609,0.034814766491648406,403,1.5310173697270468,It's fun to see him with someone different each week.,594,48,118,237,57
3273,0.03987482562801044,386,1.523316062176166,It’s de-leavely.,594,70,62,254,58
1262,0.03689731584724669,368,1.5190217391304348,"They seem nice--for rootless, self-absorbed creatures.",594,46,99,223,59
3143,0.03608569285600994,368,1.5190217391304348,Lucky day !! No dogs so far.,594,42,107,219,59
3104,0.03532708233783602,364,1.5164835164835164,I love when the fall plaids come out.,594,37,114,213,61
1212,0.037389003932316894,359,1.5153203342618384,"Enjoy your walk, future mulch.",594,45,95,219,62
3401,0.0360540799981371,351,1.5128205128205128,Look at those two lovebirds. I'm getting all sappy.,594,36,108,207,63
3074,0.03635114971370503,353,1.5127478753541077,I love this time of year when all the plaid flannel colors come out.,594,38,105,210,64
2955,0.03751994193999225,341,1.5102639296187683,"They're okay, but their four legged children are disrespectful.",594,39,96,206,65
3048,0.03012452968350187,341,1.5102639296187683,I imagine he wood kiss her if he had the balsa,594,10,154,177,65
937,0.03729965801580517,338,1.5088757396449703,I'm so glad that 'lumberjack' is more a look than an occupation these days.,594,37,98,203,67
531,0.039159432656211066,330,1.5060606060606059,Third girl this week. And they say we’re shady.,594,42,83,205,68
218,0.040641672043240526,329,1.5045592705167172,I wonder where he'll bury this one.,594,48,70,211,69
321,0.03790340565888451,322,1.5031055900621118,"I'm no expert on humans, but I think they're about to exchange pollen.",594,34,94,194,70
2676,0.040158514590721714,314,1.5,"Is this your first pharmaceutical advertisement, too?",594,40,77,197,71
307,0.038250907419376895,309,1.4983818770226538,"I'm no human expert, but I think they're about to exchange pollen.",594,31,92,186,72
1649,0.040388718615187384,309,1.4983818770226538,It's funny to see them without their phones.,594,39,76,194,72
1101,0.044232094750331435,308,1.4967532467532467,"If she's looking for majestic wood, she won't find it with him.",594,54,45,209,74
633,0.03926829724492052,301,1.495016611295681,Lucky them. They get to pollinate year-around.,594,32,85,184,75
716,0.043035760570661184,301,1.495016611295681,Please give generously to the Association of Cartoonists Who Can't Draw Hands.,594,46,57,198,75
3199,0.03992560901130777,300,1.4933333333333334,"Phew.. not lumberjacks, just hipsters.",594,34,80,186,77
2850,0.03828216876895822,296,1.489864864864865,They're so colorful this time of year.,594,27,91,178,78
1390,0.0406469818437495,290,1.4896551724137932,I always love being in the city for the changing of the wardrobes.,594,33,76,181,79
254,0.04036022905520116,287,1.4878048780487805,I love the smell of L.L. Bean in the fall.,594,31,78,178,80
3183,0.040670679735696914,284,1.4859154929577465,"Sure, they're a cute couple but lumberjack shirts scare the xylem out of me!",594,31,76,177,81
1877,0.04471561146994256,282,1.4858156028368794,"What do you think, Cialis or Viagra?",594,44,49,189,82
2224,0.04098711093904886,281,1.4839857651245552,"It’s so nice to see them like this, before the onset of Seasonal Affective Disorder.",594,31,74,176,83
1774,0.047155363281811434,272,1.4816176470588236,Too bad she's 13 years old.,594,48,35,189,84
2807,0.0408707951858994,267,1.4794007490636705,And to think they met through Timber.,594,26,76,165,85
1354,0.04378723589907893,265,1.4792452830188678,"He's a lumberjack, but he's o.k.",594,34,59,172,86
2818,0.041092820689106004,265,1.4792452830188678,they look so harmless without their chainsaws,594,26,75,164,86
3096,0.04178271701386424,265,1.4792452830188678,Did you ever notice how there are no Black people in these smug New Yorker drawings!!,594,28,71,166,86
2313,0.04013882256930573,264,1.4772727272727273,I love this time of year when the shirts turn plaid.,594,23,80,161,89
719,0.042816689759208236,262,1.4770992366412214,He has a ring? I have 287.,594,30,65,167,90
2344,0.04035513204609871,262,1.4770992366412214,I think those two are getting ready to put down some roots.,594,23,79,160,90
3348,0.04349441168128953,262,1.4770992366412214,"If they fall down and we are not around, will it make a sound?",594,32,61,169,90
2476,0.040094223427019966,261,1.475095785440613,"From deep red tartans to bright yellow plaids, I just love the changing of their colors in the fall.",594,22,80,159,93
2203,0.04053193903988327,257,1.4747081712062258,"""Oh, no....it's ok, they're harmless, they only dress like lumberjacks these days",594,22,78,157,94
1001,0.04430157966507229,236,1.4745762711864407,"That's weird, they were both here yesterday with someone else.",594,25,62,149,95
3116,0.04354971553163154,256,1.47265625,I love watching the clothes change in fall.,594,30,61,165,96
404,0.04185464248755009,252,1.4722222222222223,"Aah, empty nesters, just like us.",594,24,71,157,97
391,0.04382614992172635,251,1.4701195219123506,"Wow, two people who are actually not looking at their phones!",594,29,60,162,98
1883,0.040813617057060256,251,1.4701195219123506,It's so hard to tell the male and female of the species apart ...,594,21,76,154,98
1453,0.04143589996559005,249,1.4698795180722892,Can you believe we’re going to be in the Lands End catalog,594,22,73,154,100
2800,0.04472104071109,247,1.4696356275303644,Nice but I thought the colors were more vibrant last year.,594,30,56,161,101
47,0.045584862779113146,246,1.4674796747967482,I Love watching the shirts turn plaid.,594,32,51,163,102
933,0.04410491688409368,246,1.4674796747967482,Sometimes I wonder if they have feelings too!,594,28,59,159,102
2783,0.04767015046754741,244,1.4672131147540983,...and ask your doctor if your heart is healthy enough for sexual activity.,594,37,40,167,104
1007,0.04426374177494991,239,1.4644351464435146,"As touching as that is, those shirts smack of chain-saws.",594,26,59,154,105
1812,0.043727068995729056,237,1.4641350210970463,"You know when the plaid flannels come out, it's officially time to start shedding",594,24,62,151,106
1138,0.04523306773008187,232,1.4612068965517242,They make the most wonderful fertilizer.,594,26,55,151,107
2732,0.04312117115864264,232,1.4612068965517242,It's Fall! Their LLBean order came in.,594,21,65,146,107
2734,0.04481865028576753,232,1.4612068965517242,I remember when we were courting: just a couple of nuts in love...,594,25,57,150,107
223,0.042365431682040426,231,1.4588744588744589,I like it better when they don't bring the dogs.,594,19,68,144,110
396,0.04324484747821879,231,1.4588744588744589,"Ah, to be young and rootless.",594,21,64,146,110
1099,0.04324484747821879,231,1.4588744588744589,"Reminds me of us, 267 years ago.",594,21,64,146,110
2155,0.041010965044637485,231,1.4588744588744589,The sight of them makes me a little sappy,594,16,74,141,110
1683,0.04523673599692764,226,1.4557522123893805,I'm so glad I found you on Timber.,594,24,55,147,114
3148,0.04346305116528002,226,1.4557522123893805,I’m jealous ... of his beard !!,594,20,63,143,114
3492,0.043765386904329684,227,1.4537444933920705,"We were once like that, but then we grew apart.",594,21,61,145,116
2935,0.04320346170964093,221,1.4524886877828054,We are definitely in peak flannel season.,594,18,64,139,117
1931,0.047045753705417984,217,1.4516129032258065,And to think a plaid shirt used to be the last thing a tree ever saw.,594,25,48,144,118
832,0.04594561839652899,212,1.44811320754717,"Don’t you just love the dogless ones, Hazel?",594,21,53,138,119
1756,0.04642963031804701,212,1.44811320754717,"That could be us, you know, if you were willing to uproot.",594,22,51,139,119
2184,0.04496196622232361,212,1.44811320754717,That's so sweet. I give them until our leaves fall.,594,19,57,136,119
2435,0.04690864838280418,212,1.44811320754717,I hope that’s us in a hundred years.,594,23,49,140,119
3238,0.04395630743494357,212,1.44811320754717,"Hey, I remember those folks, they're the ones who turned mom into a cozy log cabin.",594,17,61,134,119
3283,0.04738282404767159,212,1.44811320754717,You should see how they pollenate.,594,24,47,141,119
3384,0.04545645309753518,212,1.44811320754717,That's leaf... leaves leave lovers lean.,594,20,55,137,119
1914,0.04324100827681232,217,1.4470046082949308,"Is it just me, but I get all sappy when I see young love.",594,17,63,137,126
2356,0.0446760066780916,207,1.4444444444444444,At times like this I wish I weren't self-pollinating.,594,17,58,132,127
951,0.04871925758140978,204,1.4411764705882353,I love the Fall. The people turn such pretty plaid colors.,594,24,42,138,128
1182,0.04511651358756127,204,1.4411764705882353,"Ah, love... Sorry, I turn into such a sap this time of year.",594,17,56,131,128
2841,0.04292224455608669,204,1.4411764705882353,I love watching the flannel change colors.,594,13,64,127,128
3235,0.047025489870112416,202,1.4405940594059403,It's so romantic when the flannels change color.,594,20,49,133,131
963,0.0423196736030578,200,1.44,It's lovely when the fall plaids come out.,594,11,66,123,132
1690,0.044064822054713536,200,1.44,This is going to sound sappy...,594,14,60,126,132
1878,0.0457434400931739,200,1.44,"See? I knew you'd like it. It's called ""walking"", and they do it everywhere outside of Los Angeles.",594,17,54,129,132
3077,0.0429092767376794,200,1.44,I am so glad they don't own a dog.,594,12,64,124,132
940,0.0466469317233406,201,1.4378109452736318,"How sweet, they’re grafting.",594,19,50,132,136
1414,0.047107370551349725,195,1.4358974358974361,"Thank God they don't read newspapers, magazines or books anymore!",594,18,49,128,137
2085,0.048134573067903266,186,1.435483870967742,So nice to see a wanted sexual advance for a change.,594,17,47,122,138
3123,0.04570909765068875,200,1.435,I love it when they turn plaid in October.,594,17,53,130,139
1129,0.04525951434096339,192,1.4322916666666667,"Awww, I was beginning to think the ones without cell phones were extinct.",594,14,55,123,140
2103,0.05553950443481682,192,1.4322916666666667,"Amazingly, their kind must grow the woody before they can plant it.",594,33,17,142,140
2174,0.04585805447459453,192,1.4322916666666667,Who would've thought we'd end up as extras in a Viagra commercial.,594,15,53,124,140
2255,0.0476085467709308,192,1.4322916666666667,They met on plaid.com.,594,18,47,127,140
1818,0.0485405279616715,190,1.431578947368421,The plaid is much nicer when they don't have axes.,594,19,44,127,144
1991,0.04306889506320928,190,1.431578947368421,Courtship looks ridiculous. Thank God for pollination!,594,10,62,118,144
2764,0.04591054979008973,188,1.4308510638297869,I wait all year to see those vibrant Fall plaids.,594,14,53,121,146
1162,0.046245682142345784,186,1.4301075268817205,I love when they turn all plaid this time of year.,594,14,52,120,147
1400,0.04432037004028146,186,1.4301075268817205,Did you ever notice that when our leaves turn colors their shirts turn plaid?,594,11,58,117,147
2791,0.04987383030626062,186,1.4301075268817205,They have emotions and can even feel pain. Listen when I drop this branch on them.,594,20,40,126,147
3026,0.04542663198366459,187,1.4278074866310158,"Gosh, it seems like only yesterday that they were hugging us.",594,13,54,120,150
1052,0.047642687186267935,185,1.4270270270270269,"Oh, I so love watching the fall plaidiage.",594,16,47,122,151
2031,0.045755463308626856,185,1.4270270270270269,I love when they get their fall colors.,594,13,53,119,151
998,0.04673771678676049,183,1.4262295081967211,I remember when he used to 'climb' me!,594,14,50,119,153
1011,0.050445114854682296,183,1.4262295081967211,"Cheer up, your hair loss is only seasonal.",594,20,38,125,153
2746,0.04862676106395285,183,1.4262295081967211,I see a sapling in their future.,594,17,44,122,153
1307,0.049005798232084535,181,1.4254143646408841,Such beautiful plaid this time of year!,594,17,43,121,156
1503,0.04643294997675298,181,1.4254143646408841,Plaid is my favorite season.,594,13,51,117,156
2182,0.052629767105640726,181,1.4254143646408841,Tell your doctor if you have botanical hallucinations lasting longer than four hours,594,23,31,127,156
3069,0.043000954321020315,181,1.4254143646408841,It won't last - they have no roots.,594,8,61,112,156
3366,0.0470893427194379,181,1.4254143646408841,I see she managed to spruce him up a bit.,594,14,49,118,156
1213,0.0488658246649206,168,1.4226190476190477,You can tell how old they are by the width of their tummies.,594,13,45,110,161
1772,0.05100712517356667,168,1.4226190476190477,See! I told you that they cross pollinate. That's clearly a different guy from last week!,594,16,39,113,161
480,0.050420673267121706,180,1.4222222222222225,"Just makes you want to carve your initials in them, doesn't it.",594,19,38,123,163
3211,0.048266751620756033,178,1.4213483146067416,Don't you just love people-huggers?,594,15,45,118,164
660,0.04996309145433401,176,1.4204545454545454,Just a few more years and they will become a boxed meal for us.,594,17,40,119,165
3290,0.04864607258354999,176,1.4204545454545454,You may call me a sap. But that never gets old.,594,15,44,117,165
1752,0.044784293622116056,174,1.4195402298850577,It will never last. They have no roots.,594,9,55,110,167
2656,0.04765916519886832,174,1.4195402298850577,The plaids are particularly colorful this year.,594,13,47,114,167
1522,0.049202089525637316,173,1.416184971098266,"He's a hipster, not a lumberjack. Close call!",594,15,42,116,169
1687,0.04851424820156591,173,1.416184971098266,"You grab the tall one, and I'll carve our initials.",594,14,44,115,169
192,0.051398420106589716,169,1.4142011834319526,They fell in love on a bridge made from mom.,594,17,36,116,171
975,0.05070853193811472,169,1.4142011834319526,And just think a few years ago he was happy just to take a pee on me.,594,16,38,115,171
1125,0.04784961545070197,169,1.4142011834319526,This area is the best for viewing the fall plaids.,594,12,46,111,171
1620,0.05070853193811472,169,1.4142011834319526,"I really like these new kindler, gentler lumberjacks",594,16,38,115,171
1704,0.05207917018912813,169,1.4142011834319526,Love is so much more enjoyable when it’s not being carved it into my side.,594,18,34,117,171
1754,0.04710778407700124,169,1.4142011834319526,Reminds me of our sapling days.,594,11,48,110,171
2441,0.04784961545070197,169,1.4142011834319526,"Ahhhhh, they're going to pollinate.",594,12,46,111,171
2806,0.04858012018217681,169,1.4142011834319526,I'm glad they left their dog home this time.,594,13,44,112,171
862,0.05370614749627104,156,1.4102564102564104,I'd give ten nuts to keep a head of hair like that through December,594,16,32,108,179
604,0.0483931576912195,166,1.4096385542168677,"Did you know, they can do it - without bees!",594,12,44,110,180
623,0.0498792182334768,166,1.4096385542168677,Just think...in 30 more years our branches will be close enough to do that,594,14,40,112,180
898,0.0498792182334768,166,1.4096385542168677,I love this part of the commercial before the announcer mentions the four-hour rule.,594,14,40,112,180
1688,0.04763274463223228,166,1.4096385542168677,"We're almost there, just keep pretending like those trees don't have any faces.",594,11,46,109,180
1699,0.05202878493647682,166,1.4096385542168677,Isn't it beautiful how they change to plaid every fall?,594,17,34,115,180
2135,0.050605886631009525,166,1.4096385542168677,We're not the only ones who will be adding a ring this year.,594,15,38,113,180
3268,0.05341379187271508,166,1.4096385542168677,Let's carve our initials in the bearded one.,594,19,30,117,180
3421,0.04685999371608653,166,1.4096385542168677,"Sure they look happy now, but give them a couple hundred years.",594,10,48,108,180
3543,0.0491418056389366,166,1.4096385542168677,I’ll miss them when they move to Brooklyn.,594,13,42,111,180
2129,0.048014618508029794,164,1.4085365853658536,Remember when we were just twigs?,594,11,45,108,189
687,0.052270897280421856,152,1.4078947368421053,"No dog, that's a relief",594,13,36,103,190
896,0.053663827877626566,162,1.4074074074074074,"Aw, remember when we cross-pollinated?",594,18,30,114,191
2425,0.04760626569756676,162,1.4074074074074074,Looks like he finally talked with his doctor about Cialis.,594,10,46,106,191
2641,0.049963989452123415,162,1.4074074074074074,"Ah, to be 150 again.",594,13,40,109,191
3408,0.050725550544803606,162,1.4074074074074074,I just love autumn. Humans in plaid are spectacular this time of year.,594,14,38,110,191
377,0.046401080366729575,155,1.4064516129032258,I heard they have a funny way of pollinating.,594,7,49,99,195
986,0.05267742929000782,160,1.40625,They make a lovely couple. I hope his wife doesn't find out.,594,16,33,111,196
1482,0.04960288447055012,160,1.40625,I love peak-flannel season!,594,12,41,107,196
128,0.04921210609434201,158,1.4050632911392404,"No one knows why the shirts turn plaid in the fall, but I'm sure glad they do.",594,11,42,105,198
1312,0.05681626472301087,158,1.4050632911392404,Young love. How sweet! I see the cartoonist can't draw hands.,594,21,22,115,198
3135,0.05627620262574823,149,1.4026845637583891,Side effects include hallucinations about talking trees and the desire to wear plaid.,594,17,26,106,200
253,0.052263391454255986,155,1.4,I love watching the flannel change colors this time of year,594,14,34,107,201
532,0.04980060787396751,155,1.4,Times like these make me really wish we could warn them about the wolves.,594,11,40,104,201
1320,0.0514555624373053,155,1.4,It's nice to see L. L. Bean doing so well again this Fall!,594,13,36,106,201
3387,0.04980060787396751,155,1.4,I told you not everyone in flannel is evil.,594,11,40,104,201
153,0.05191538496931679,153,1.3986928104575165,The flannel has come late this year.,594,13,35,105,205
420,0.054343400082520366,153,1.3986928104575165,Ever thought about having a “treesome”?,594,16,29,108,205
2010,0.05023154957296615,153,1.3986928104575165,"Oh, to be plaid and rootless, if only for a day.",594,11,39,103,205
2290,0.05108040607225886,153,1.3986928104575165,"If a couple falls in love in a forest, do they make a sound?",594,12,37,104,205
2817,0.05191538496931679,153,1.3986928104575165,Must be fall. The shirts are turning plaid.,594,13,35,105,205
3490,0.05108040607225886,153,1.3986928104575165,Sure he’s older - cut him open I bet he’s got 20-25 more rings than she does.,594,12,37,104,205
162,0.05067271097792322,151,1.3973509933774837,"Oh, thank god. I thought they were lumberjacks.",594,11,38,102,211
984,0.05404557818040573,151,1.3973509933774837,"Aww, he has his limb around her.",594,15,30,106,211
1207,0.04889911242907214,151,1.3973509933774837,I think the LSD is kicking in.,594,9,42,100,211
2179,0.04705871603486365,151,1.3973509933774837,Let's just enjoy them while they're still here.,594,7,46,98,211
3229,0.0572199738190831,151,1.3973509933774837,Loving in fall again.,594,19,22,110,211
819,0.05085107146415842,150,1.393333333333333,"Awww, I hope that’s us in 500 years.",594,11,37,102,216
118,0.051306819215643874,148,1.391891891891892,I love seeing the plaid colors this time of year.,594,11,36,101,217
1267,0.0521950032223775,148,1.391891891891892,You can tell their age by counting the stripes.,594,12,34,102,217
1322,0.0521950032223775,148,1.391891891891892,I just love it when the plaid colors come out in the fall.,594,12,34,102,217
1460,0.05306832411845349,148,1.391891891891892,I've never seen trees happier since we got rid of our dogs.,594,13,32,103,217
