target_id,precision,count,score,caption,contest,funny,somewhat_funny,unfunny,rank
2204,0.05045276771256948,38,1.1052631578947372,"C'mon, the joke wasn't that good",594,0,4,34,2193
2212,0.05045276771256948,38,1.1052631578947372,It looks like there going to branch out.,594,0,4,34,2193
2228,0.05045276771256948,38,1.1052631578947372,It's times like these you forget what they did to our fore fathers and mothers.,594,0,4,34,2193
2281,0.0629917206983912,38,1.1052631578947372,"It's contagious my love, even the trees are Falling for you.",594,1,2,35,2193
2287,0.0629917206983912,38,1.1052631578947372,see? the suburbs are just as much fun as brooklyn when you’re tripping on acid.,594,1,2,35,2193
2297,0.0629917206983912,38,1.1052631578947372,How did we ever grow so far apart Honeybun?,594,1,2,35,2193
2304,0.05045276771256948,38,1.1052631578947372,"There smiling now, but when they lose their leaves they won't show their face.",594,0,4,34,2193
2307,0.05045276771256948,38,1.1052631578947372,"Ah, the happy golden years.",594,0,4,34,2193
2308,0.05045276771256948,38,1.1052631578947372,Look around--not a weeping willow in sight.,594,0,4,34,2193
2324,0.05045276771256948,38,1.1052631578947372,"Chestnut, remember when we were young saplings.",594,0,4,34,2193
2329,0.0629917206983912,38,1.1052631578947372,Even the trees know how beautiful you are.,594,1,2,35,2193
2335,0.05045276771256948,38,1.1052631578947372,Falling in love is my favorite season.,594,0,4,34,2193
2336,0.05045276771256948,38,1.1052631578947372,So sweet! They make the sap run through my veins!,594,0,4,34,2193
2343,0.0629917206983912,38,1.1052631578947372,"I love the Universalist side of Unitarian-Universalist, don't you?",594,1,2,35,2193
2353,0.0629917206983912,38,1.1052631578947372,Looks like they're getting ready to drop their leaves!,594,1,2,35,2193
2357,0.0629917206983912,38,1.1052631578947372,The one with the moss on his face TOTALLY reminds me of you.,594,1,2,35,2193
2374,0.05045276771256948,38,1.1052631578947372,"Woody,I feel the love.",594,0,4,34,2193
2378,0.05045276771256948,38,1.1052631578947372,Reminds me of when we were young saplings in love.,594,0,4,34,2193
2398,0.05045276771256948,38,1.1052631578947372,And to think they used to throw apples.,594,0,4,34,2193
2402,0.05045276771256948,38,1.1052631578947372,They look so pretty in fall.,594,0,4,34,2193
2432,0.05045276771256948,38,1.1052631578947372,I think I’m finally ready to talk about the Russian connection.,594,0,4,34,2193
2434,0.0629917206983912,38,1.1052631578947372,What were you saying about your immigration status?,594,1,2,35,2193
2440,0.05045276771256948,38,1.1052631578947372,I love middle aged colors.,594,0,4,34,2193
2474,0.05045276771256948,38,1.1052631578947372,I just Love all the bright gingham colors that come out in Autumn,594,0,4,34,2193
2477,0.05045276771256948,38,1.1052631578947372,If ever I should leaf you . . .,594,0,4,34,2193
2487,0.0629917206983912,38,1.1052631578947372,Orange is the new plaid.,594,1,2,35,2193
2492,0.05045276771256948,38,1.1052631578947372,Leaving so soon?,594,0,4,34,2193
2497,0.05045276771256948,38,1.1052631578947372,I always look forward to plaid peeping season.,594,0,4,34,2193
2521,0.0629917206983912,38,1.1052631578947372,The trees must think I’m gonna get p-laid.,594,1,2,35,2193
2525,0.05045276771256948,38,1.1052631578947372,"Before all the leaves have fallen, you will have forgotten everything you have just said.",594,0,4,34,2193
2528,0.05045276771256948,38,1.1052631578947372,Opioid trees,594,0,4,34,2193
2547,0.05045276771256948,38,1.1052631578947372,Keep an eye out for the flying monkeys.,594,0,4,34,2193
2549,0.0629917206983912,38,1.1052631578947372,"""Time Magazine called to say that I was PROBABLY going to be named “Man (Person) of the Year,” like last year, but I would have to agree to an interview and a major photo shoot. I said probably is no good and took a pass."" (DJT)",594,1,2,35,2193
2554,0.05045276771256948,38,1.1052631578947372,"Toto, I have a feeling that we’re not under 65 anymore.",594,0,4,34,2193
2565,0.05045276771256948,38,1.1052631578947372,You'll never make like a tree and . . .. Will you honey?,594,0,4,34,2193
2584,0.0629917206983912,38,1.1052631578947372,Get the New Yorker online,594,1,2,35,2193
2596,0.05045276771256948,38,1.1052631578947372,"Cute, but I can't get over the fact they both wore plaid",594,0,4,34,2193
2601,0.0629917206983912,38,1.1052631578947372,Do you think they planned to match outfits or are just hipsters?,594,1,2,35,2193
2614,0.05045276771256948,38,1.1052631578947372,DO YOU THINK TREE'S HAVE A LIFE?,594,0,4,34,2193
2639,0.05045276771256948,38,1.1052631578947372,I love when their tops change.,594,0,4,34,2193
2657,0.05045276771256948,38,1.1052631578947372,Will you marry me if I promise to shave off my beard come Spring?,594,0,4,34,2193
2663,0.05045276771256948,38,1.1052631578947372,I’m glad to see them sticking together. I’m rooting fur them!,594,0,4,34,2193
2695,0.0629917206983912,38,1.1052631578947372,Aww... Nothing funny here… Let’s move on..,594,1,2,35,2193
2714,0.05045276771256948,38,1.1052631578947372,Forever plaid.,594,0,4,34,2193
2722,0.05045276771256948,38,1.1052631578947372,Remember when the tree huggers conference was held in town?,594,0,4,34,2193
2744,0.0629917206983912,38,1.1052631578947372,"I love this time of year, especially the change to flannel colors.",594,1,2,35,2193
2748,0.0629917206983912,38,1.1052631578947372,Why don't you ever grow a beard?,594,1,2,35,2193
2755,0.0629917206983912,38,1.1052631578947372,"Hello honey, I forgot where you told me you put the grocery list.",594,1,2,35,2193
2777,0.05045276771256948,38,1.1052631578947372,I feel another nest coming!,594,0,4,34,2193
2782,0.0629917206983912,38,1.1052631578947372,"I'm trending on ecocarve.com with ""Jack + Edna, 2017"" photoshopped into my bark.",594,1,2,35,2193
2785,0.05045276771256948,38,1.1052631578947372,Don't you just love flannel?,594,0,4,34,2193
2787,0.0629917206983912,38,1.1052631578947372,Logger shirts look so much better on hipsters.,594,1,2,35,2193
2805,0.05045276771256948,38,1.1052631578947372,If we wear flannel and grow beards its like 2016 never happened.,594,0,4,34,2193
2824,0.05045276771256948,38,1.1052631578947372,Looks like photosynthesis to me.,594,0,4,34,2193
2827,0.05045276771256948,38,1.1052631578947372,They met at LLBeanlove.com.,594,0,4,34,2193
2832,0.05045276771256948,38,1.1052631578947372,Jack and Mary decided they would rather live in this dream than wake up to another Trump scandal,594,0,4,34,2193
2837,0.05045276771256948,38,1.1052631578947372,I hope they carve their initials in me!,594,0,4,34,2193
2860,0.05045276771256948,38,1.1052631578947372,"Finally, Hillary and Bill are going to act like a tree and leave.",594,0,4,34,2193
2865,0.05045276771256948,38,1.1052631578947372,I think L.L. Bean has taken the happiness theme a step too far.,594,0,4,34,2193
2871,0.05045276771256948,38,1.1052631578947372,Two tree huggers walking down memory lane,594,0,4,34,2193
2881,0.05045276771256948,38,1.1052631578947372,"Honey, I do love you, but it's just that I'm gay.",594,0,4,34,2193
2885,0.05045276771256948,38,1.1052631578947372,Do you have the feeling we're being watched?,594,0,4,34,2193
2887,0.05045276771256948,38,1.1052631578947372,The shirts are so colorful this time of the year!,594,0,4,34,2193
2892,0.05045276771256948,38,1.1052631578947372,Remember when we used to touch limbs?,594,0,4,34,2193
2896,0.05045276771256948,38,1.1052631578947372,This dropping seeds business is for the birds.,594,0,4,34,2193
2901,0.0629917206983912,38,1.1052631578947372,"Smile, I think their filming a drug commercial",594,1,2,35,2193
2905,0.05045276771256948,38,1.1052631578947372,"Awwwww, what is the site you use? I'm looking for tree of my own.",594,0,4,34,2193
2913,0.05045276771256948,38,1.1052631578947372,Time to get naked.,594,0,4,34,2193
2927,0.05045276771256948,38,1.1052631578947372,Wood is a many splintered thing. Don't you mean love is a many splendered thing?,594,0,4,34,2193
2934,0.0629917206983912,38,1.1052631578947372,Leafs you sentimental ...,594,1,2,35,2193
2966,0.05045276771256948,38,1.1052631578947372,It's almost as if Bob Ross is still with us.,594,0,4,34,2193
2978,0.05045276771256948,38,1.1052631578947372,Who said anything about long-term insurance?,594,0,4,34,2193
2980,0.0629917206983912,38,1.1052631578947372,This guy is a loser. I hope she dumps him.,594,1,2,35,2193
2990,0.05045276771256948,38,1.1052631578947372,All the wood loves a lover.,594,0,4,34,2193
2991,0.05045276771256948,38,1.1052631578947372,They grow up so fast. I remember when they barely came up to my waist.,594,0,4,34,2193
2993,0.05045276771256948,38,1.1052631578947372,"What a nice young couple, they haven't yet put down roots like us.",594,0,4,34,2193
3022,0.05045276771256948,38,1.1052631578947372,Remember when they were just kids and they carved their initials on you?,594,0,4,34,2193
3025,0.05045276771256948,38,1.1052631578947372,"Even though we can't be as close as they are, I hope we're still as happy.",594,0,4,34,2193
3031,0.05045276771256948,38,1.1052631578947372,And both of you will want to visit the Enchanted Boomer Shoppe at the end of the path.,594,0,4,34,2193
3044,0.0629917206983912,38,1.1052631578947372,"When you said lumbersexual, you didn't mean...",594,1,2,35,2193
3050,0.05045276771256948,38,1.1052631578947372,Remember when we were just saplings?,594,0,4,34,2193
3054,0.05045276771256948,38,1.1052631578947372,You're welcome for the hair!,594,0,4,34,2193
3062,0.05045276771256948,38,1.1052631578947372,When do you think they will drop their leaves?,594,0,4,34,2193
3066,0.05045276771256948,38,1.1052631578947372,"Oh, Rootginia, the plaid stories of our sapling years were true after all.",594,0,4,34,2193
3068,0.05045276771256948,38,1.1052631578947372,Don't you just love what they've done with the lumberjack look? So benign!,594,0,4,34,2193
3100,0.0629917206983912,38,1.1052631578947372,Who's woods these are I think I know.,594,1,2,35,2193
3106,0.05045276771256948,38,1.1052631578947372,"Ever since he met her, Paul Bunyan's been a much nicer guy.",594,0,4,34,2193
3128,0.05045276771256948,38,1.1052631578947372,I'll wager their sap is runnin' too!,594,0,4,34,2193
3132,0.05045276771256948,38,1.1052631578947372,Trees have feelings too.,594,0,4,34,2193
3144,0.0629917206983912,38,1.1052631578947372,Don't you love how the flannels change color in autumn?,594,1,2,35,2193
3164,0.05045276771256948,38,1.1052631578947372,Last week he was hugging me. Hope he don’t carve her initials in me.,594,0,4,34,2193
3190,0.0629917206983912,38,1.1052631578947372,"Honey, it's deja vu again, as we stroll the same park an hour ago.",594,1,2,35,2193
3191,0.0629917206983912,38,1.1052631578947372,Sweet Movember.,594,1,2,35,2193
3194,0.05045276771256948,38,1.1052631578947372,"Don't worry, they're just lumbersexuals.",594,0,4,34,2193
3196,0.05045276771256948,38,1.1052631578947372,"""I hope they don't build around here, or else our great views are over!"".",594,0,4,34,2193
3201,0.05045276771256948,38,1.1052631578947372,"Logging hours with her instead of me, this will throw an axe in our relationship",594,0,4,34,2193
3207,0.05045276771256948,38,1.1052631578947372,"Don't worry, Woody. He won't chop us down. He thinks he is a lumbersexual this week.",594,0,4,34,2193
3212,0.05045276771256948,38,1.1052631578947372,"Here comes another wanna-be hipster couple, but where is the PSL?",594,0,4,34,2193
3213,0.05045276771256948,38,1.1052631578947372,"No... the moral of that fable was this: ""If you walk down the path where trees once stood, you will forever dress alike.""",594,0,4,34,2193
3218,0.0629917206983912,38,1.1052631578947372,I don't know what it is but I just feel so at home here.,594,1,2,35,2193
3224,0.05045276771256948,38,1.1052631578947372,= As you went away the days grow long? - They know nothing about autumn leaves. Everyone knows the days grow short!,594,0,4,34,2193
3233,0.05045276771256948,38,1.1052631578947372,Their lottle clothes are so cute this time of year.,594,0,4,34,2193
3252,0.05045276771256948,38,1.1052631578947372,I remember when they were just young sprouts.,594,0,4,34,2193
3274,0.05045276771256948,38,1.1052631578947372,"I'm feeling better, but I'm still feeling like I'm being watched",594,0,4,34,2193
3275,0.0629917206983912,38,1.1052631578947372,"Enjoy it now kids, autumn springs eternal.",594,1,2,35,2193
3288,0.05045276771256948,38,1.1052631578947372,They get romantic around us this time of year. Apparently our losing our leaves reminds them of discarding their clothes.,594,0,4,34,2193
3292,0.05045276771256948,38,1.1052631578947372,"Elllie, Ellie Frijole! Gotta love those woodsy outfits.",594,0,4,34,2193
3294,0.05045276771256948,38,1.1052631578947372,I could fall for you.,594,0,4,34,2193
3305,0.05045276771256948,38,1.1052631578947372,"Call me sappy, but ain't love grand?",594,0,4,34,2193
3332,0.05045276771256948,38,1.1052631578947372,"They look happy now, but they always break up in winter",594,0,4,34,2193
3339,0.05045276771256948,38,1.1052631578947372,Legs and hair! Why didn’t we think of them?,594,0,4,34,2193
3347,0.05045276771256948,38,1.1052631578947372,I just hope they don't stab me in the back and carve a heart with their initials into me.,594,0,4,34,2193
3357,0.05045276771256948,38,1.1052631578947372,"I'm proud they call us tree-huggers, honey.",594,0,4,34,2193
3364,0.0629917206983912,38,1.1052631578947372,I've always loved the plaid season.,594,1,2,35,2193
3368,0.0629917206983912,38,1.1052631578947372,I think that I shall never see A cartoon caption lovely as a tree.,594,1,2,35,2193
3370,0.05045276771256948,38,1.1052631578947372,That's how we used to look before we were turned into trees.,594,0,4,34,2193
3373,0.0629917206983912,38,1.1052631578947372,They're elmojis.,594,1,2,35,2193
3377,0.0629917206983912,38,1.1052631578947372,Look! Fall is for lovers. Spring and full moons are just fake news.,594,1,2,35,2193
3385,0.05045276771256948,38,1.1052631578947372,"Hey, welcome to the enchanted forest... prepare to die",594,0,4,34,2193
3386,0.0629917206983912,38,1.1052631578947372,"Hey, welcome to the enchanted forest... prepare to die",594,1,2,35,2193
3394,0.05045276771256948,38,1.1052631578947372,"Yes, I'm able to relax out here. . But I still feel like I'm being watched.",594,0,4,34,2193
3409,0.05045276771256948,38,1.1052631578947372,The hipsters are so colorful this time of year.,594,0,4,34,2193
3420,0.05045276771256948,38,1.1052631578947372,"So, they decided to turn over a new leaf. We both know what that means.",594,0,4,34,2193
3434,0.05045276771256948,38,1.1052631578947372,Maybe it could be an adobe dream house.,594,0,4,34,2193
3439,0.05045276771256948,38,1.1052631578947372,I bet they can't see our faces through the forest.,594,0,4,34,2193
3442,0.0734195613118858,38,1.1052631578947372,"See, that's why I almost don't mind going bald.",594,2,0,36,2193
3470,0.0629917206983912,38,1.1052631578947372,They're even cuter than those two squirrels we saw earlier.,594,1,2,35,2193
3494,0.05045276771256948,38,1.1052631578947372,I love drawing tree faces with you .,594,0,4,34,2193
3500,0.05045276771256948,38,1.1052631578947372,"I give it ten years, fifteen if he hits the barbershop.",594,0,4,34,2193
3502,0.0629917206983912,38,1.1052631578947372,Their roots are showing.,594,1,2,35,2193
3527,0.0629917206983912,38,1.1052631578947372,Couples from Vermont are even more identical than we are.,594,1,2,35,2193
3540,0.05045276771256948,38,1.1052631578947372,There's a bit of a rake if I ever saw one.,594,0,4,34,2193
3546,0.05045276771256948,38,1.1052631578947372,The beard changed his life and he never looked back.,594,0,4,34,2193
51,0.04921614717627653,39,1.1025641025641026,What note?,594,0,4,35,2572
72,0.061414630245520914,39,1.1025641025641026,How romantic. They met at the checkers tournament.,594,1,2,36,2572
159,0.061414630245520914,39,1.1025641025641026,"I'd invite you home to sit before the fireplace, but I'm a treegan.",594,1,2,36,2572
222,0.04921614717627653,39,1.1025641025641026,It's like they turned all these brilliant colors just for us. Next year the pipeline will be here. Sad.,594,0,4,35,2572
375,0.04921614717627653,39,1.1025641025641026,"They look real, too.",594,0,4,35,2572
416,0.061414630245520914,39,1.1025641025641026,A lot has changed since Dorothy and Toto traveled this road...,594,1,2,36,2572
432,0.04921614717627653,39,1.1025641025641026,Oh look she's groping him!,594,0,4,35,2572
462,0.04921614717627653,39,1.1025641025641026,Don't you just love the intricate patterns of their fall workshirts.,594,0,4,35,2572
563,0.061414630245520914,39,1.1025641025641026,"Call me a sap, but I do like the emoji trees gushing over our first VR date.",594,1,2,36,2572
601,0.04921614717627653,39,1.1025641025641026,I love being in pharmaceutical commercials.,594,0,4,35,2572
723,0.061414630245520914,39,1.1025641025641026,I'm glad we carved our love for each other on these trees.,594,1,2,36,2572
759,0.061414630245520914,39,1.1025641025641026,I heard one of the crew members hung himself back there.,594,1,2,36,2572
789,0.04921614717627653,39,1.1025641025641026,They're so cute. I hope they put down roots here!,594,0,4,35,2572
878,0.061414630245520914,39,1.1025641025641026,"Ooh, sweet. I wish they would be buried underneath me.",594,1,2,36,2572
897,0.04921614717627653,39,1.1025641025641026,"Yes, I'd like to order the ""Let's Get Started with Carrier Pigeons"" kit.",594,0,4,35,2572
922,0.04921614717627653,39,1.1025641025641026,All our wisdom is stored in the humans.,594,0,4,35,2572
945,0.04921614717627653,39,1.1025641025641026,New Yorker's readers will not be expecting a sweet caption.,594,0,4,35,2572
1028,0.04921614717627653,39,1.1025641025641026,Lovebirds at 6 o'clock.,594,0,4,35,2572
1038,0.04921614717627653,39,1.1025641025641026,I feel we're moving with the zeitgeist.,594,0,4,35,2572
1141,0.061414630245520914,39,1.1025641025641026,Looks like I'm not the only one falling for you.,594,1,2,36,2572
1250,0.04921614717627653,39,1.1025641025641026,At least our Fall colors don't clash,594,0,4,35,2572
1286,0.04921614717627653,39,1.1025641025641026,"Don't look now, Bob, but a couple of happy little trees are watching us.",594,0,4,35,2572
1402,0.061414630245520914,39,1.1025641025641026,They look so cute in those tree killer shirts.,594,1,2,36,2572
1409,0.04921614717627653,39,1.1025641025641026,"I wish we could be as close as they are, but at least our roots are touching.",594,0,4,35,2572
1573,0.04921614717627653,39,1.1025641025641026,Remember how we'd intertwine branches when we were saplings?,594,0,4,35,2572
1603,0.061414630245520914,39,1.1025641025641026,I'd even settle for wearing tasteless plaid since they left off our bark,594,1,2,36,2572
1636,0.04921614717627653,39,1.1025641025641026,How sweet. Let's call the wind and fall on them.,594,0,4,35,2572
1705,0.04921614717627653,39,1.1025641025641026,I think the tree-hugging finally paid off.,594,0,4,35,2572
1733,0.04921614717627653,39,1.1025641025641026,Nice to see them taking time off from logging.,594,0,4,35,2572
1918,0.04921614717627653,39,1.1025641025641026,I'm glad you came back Dorothy. This place has a whole different feel since the Wicked Witch died.,594,0,4,35,2572
2086,0.04921614717627653,39,1.1025641025641026,The walls have ears too,594,0,4,35,2572
2108,0.04921614717627653,39,1.1025641025641026,This is almost as good as a NY bagel with a schmear.,594,0,4,35,2572
2138,0.04921614717627653,39,1.1025641025641026,Oh Treety. What a cute couple.,594,0,4,35,2572
2254,0.061414630245520914,39,1.1025641025641026,I love this time of year when the flannel shirts come out and the slow walks through the park.,594,1,2,36,2572
2283,0.04921614717627653,39,1.1025641025641026,"Awww . . . look at those love birds. You know what they say: ""Birds of a feather flock together!""",594,0,4,35,2572
2310,0.04921614717627653,39,1.1025641025641026,"No, I did not read the fine print.",594,0,4,35,2572
2420,0.04921614717627653,39,1.1025641025641026,You see that? They just stepped in it.,594,0,4,35,2572
2444,0.04921614717627653,39,1.1025641025641026,Isn't better when they hug each other and not us!,594,0,4,35,2572
2457,0.04921614717627653,39,1.1025641025641026,"Lovely, yes but their plaids clash.",594,0,4,35,2572
2526,0.04921614717627653,39,1.1025641025641026,Aren't they cute?,594,0,4,35,2572
2545,0.04921614717627653,39,1.1025641025641026,My divorce papers arrived!,594,0,4,35,2572
2555,0.04921614717627653,39,1.1025641025641026,"Gee, I wish we could do that!",594,0,4,35,2572
2683,0.04921614717627653,39,1.1025641025641026,"Hey, Larry. Let's comingle our branches like thee two. I've got wood !",594,0,4,35,2572
2740,0.04921614717627653,39,1.1025641025641026,Cover Art of 'A Walk in the Park - Stories of White Privilege & Heteronormative Values',594,0,4,35,2572
2798,0.04921614717627653,39,1.1025641025641026,"Hey, Mary, do you want to carve our initials on them?",594,0,4,35,2572
2921,0.04921614717627653,39,1.1025641025641026,Nothing gold can stay,594,0,4,35,2572
3014,0.04921614717627653,39,1.1025641025641026,They look like a good match . They both obviously like checkers .,594,0,4,35,2572
3130,0.061414630245520914,39,1.1025641025641026,Did we...did we find it? It’s the last cartoon without cynicism!,594,1,2,36,2572
3197,0.04921614717627653,39,1.1025641025641026,"Aww, come over here you!",594,0,4,35,2572
3375,0.061414630245520914,39,1.1025641025641026,"Don't kid yourself, their bite is worse than their bark.",594,1,2,36,2572
3465,0.04921614717627653,39,1.1025641025641026,Would you mind if I wore a dress next time?,594,0,4,35,2572
3515,0.04921614717627653,39,1.1025641025641026,They go together: plaid and simple.,594,0,4,35,2572
238,0.0480384461415261,40,1.1,"Maybe we can be that close one day, but we are NEVER wearing matching plaid.",594,0,4,36,2624
279,0.0480384461415261,40,1.1,"No, I'm not crying, it's...just Autumn.",594,0,4,36,2624
528,0.0480384461415261,40,1.1,Look how much they're enjoying their final autumn.,594,0,4,36,2624
1795,0.0480384461415261,40,1.1,Now I'll never get that Steve Miller song out of my head.,594,0,4,36,2624
1979,0.0480384461415261,40,1.1,Bliss,594,0,4,36,2624
2193,0.0480384461415261,40,1.1,"Oh, c’mon, even the educated fleas do it!",594,0,4,36,2624
2241,0.0480384461415261,40,1.1,Would you like a root rub later tonight,594,0,4,36,2624
2263,0.0480384461415261,40,1.1,"one cool thing about this time of year is everybody turns into their dad, or someone who fucks their dad",594,0,4,36,2624
2360,0.0480384461415261,40,1.1,A brisk walk will show you that your fantasies are deeply rooted.,594,0,4,36,2624
2436,0.05991446895152777,40,1.1,Sophie is wearing Lands End and Jason is sporting a vintage Eddie Bauer ensemble.,594,1,2,37,2624
534,0.04691557088212523,41,1.0975609756097562,They'll be even happier when they see our Skivvies.,594,0,4,37,2634
1956,0.04691557088212523,41,1.0975609756097562,That's what we call tree huggers,594,0,4,37,2634
2551,0.04691557088212523,41,1.0975609756097562,It would be quite the game changer if they only knew it was autumn love that dropped our leaves.,594,0,4,37,2634
3467,0.04691557088212523,41,1.0975609756097562,Nature's Tears of Happiness.,594,0,4,37,2634
1496,0.050819726761358916,33,1.0909090909090908,"Last fall, she wore the beard.",594,0,3,30,2638
3,0.048009602880960366,35,1.0857142857142856,All I said to her was that she could do a better job at juggling household chores and her knife-selling business.,594,0,3,32,2639
9,0.048009602880960366,35,1.0857142857142856,I love watching their colors change. Especially the graying around the temples.,594,0,3,32,2639
27,0.048009602880960366,35,1.0857142857142856,"Luther, indulge me one last time.",594,0,3,32,2639
30,0.048009602880960366,35,1.0857142857142856,Please tell Fat Tony that I keep getting his mail by mistake.,594,0,3,32,2639
44,0.048009602880960366,35,1.0857142857142856,"Is it just me, or are we trapped in a Bob Ross painting?",594,0,3,32,2639
62,0.048009602880960366,35,1.0857142857142856,Look they’re branching out just like us!,594,0,3,32,2639
71,0.06313156292770741,35,1.0857142857142856,"After giving him her lumber, Jack finally axed her out on a date.",594,1,1,33,2639
89,0.048009602880960366,35,1.0857142857142856,Forever young,594,0,3,32,2639
134,0.06313156292770741,35,1.0857142857142856,I just farted.,594,1,1,33,2639
163,0.048009602880960366,35,1.0857142857142856,Woody... would you like to go for a sway?,594,0,3,32,2639
172,0.048009602880960366,35,1.0857142857142856,Don't you just love it when the colors start to change. Plaid is my favorite time of year.,594,0,3,32,2639
191,0.048009602880960366,35,1.0857142857142856,They are all voyeurs!,594,0,3,32,2639
228,0.048009602880960366,35,1.0857142857142856,My love for you is so amazing I feel the trees talk about us.,594,0,3,32,2639
233,0.048009602880960366,35,1.0857142857142856,Those new human genes make me feel all sentimental.,594,0,3,32,2639
245,0.06313156292770741,35,1.0857142857142856,If a tree falls in love in the forest...would you notice?,594,1,1,33,2639
301,0.048009602880960366,35,1.0857142857142856,April really is the cruelist month.,594,0,3,32,2639
344,0.048009602880960366,35,1.0857142857142856,They seem much healthier than that Giving Tree.,594,0,3,32,2639
355,0.048009602880960366,35,1.0857142857142856,Don't make eye contact or they'll give you a leaflet.,594,0,3,32,2639
411,0.048009602880960366,35,1.0857142857142856,They’ll grow apart. Just like you and I.,594,0,3,32,2639
447,0.048009602880960366,35,1.0857142857142856,Excuse me. I have to answer the call of nature.,594,0,3,32,2639
455,0.048009602880960366,35,1.0857142857142856,"I know he's a lumberjack, but he's still okay.",594,0,3,32,2639
466,0.048009602880960366,35,1.0857142857142856,"Well, it officially hipster season.",594,0,3,32,2639
542,0.048009602880960366,35,1.0857142857142856,"Maybe it's just the leaves that are my neurons falling, but I don't have anything snarky to say.",594,0,3,32,2639
