,Unnamed: 0,target_id,mean,precision,count,score,caption,contest,funny,somewhat_funny,unfunny,counts,rank
2534,2534,1766,1.180327868852459,0.05963548986123849,61,1.180327868852459,So much for ditching the water bottle.,601,2,7,52,61,2515
2535,2535,2110,1.180327868852459,0.05963548986123849,61,1.180327868852459,And I thought I had a thorn in my side...,601,2,7,52,61,2515
2536,2536,2346,1.180327868852459,0.05963548986123849,61,1.180327868852459,All I said was 'aloe' and now it appears to be following us.,601,2,7,52,61,2515
2537,2537,2461,1.180327868852459,0.05963548986123849,61,1.180327868852459,Worst California theme park ever.,601,2,7,52,61,2515
2538,2538,2683,1.180327868852459,0.06405341316761795,61,1.180327868852459,you're being paranoid again.,601,3,5,53,61,2515
2539,2539,2751,1.180327868852459,0.054862952559611516,61,1.180327868852459,Go faster! He's really trying to stick it to us!,601,1,9,51,61,2515
2540,2540,2983,1.180327868852459,0.049633612362253984,61,1.180327868852459,"I get it, Coach. We need to stay hydrated.",601,0,11,50,61,2515
2541,2541,3058,1.180327868852459,0.049633612362253984,61,1.180327868852459,"Don't look now, Hon, but I think we're being followed.",601,0,11,50,61,2515
2542,2542,3124,1.180327868852459,0.054862952559611516,61,1.180327868852459,"Faster!, I think it's arms are moving toward a hug",601,1,9,51,61,2515
2543,2543,3215,1.180327868852459,0.05963548986123849,61,1.180327868852459,"There was a cowboy, a construction worker...but I don't remember a cactus as part of the Village People.",601,2,7,52,61,2515
2544,2544,3287,1.180327868852459,0.054862952559611516,61,1.180327868852459,Climate change must be real. He followed us to Oregon!,601,1,9,51,61,2515
2545,2545,3875,1.180327868852459,0.05963548986123849,61,1.180327868852459,Your smart assistant has sent a ton of water alright...,601,2,7,52,61,2515
2546,2546,3961,1.180327868852459,0.06405341316761795,61,1.180327868852459,"What are you running from?. It is I, your border security.",601,3,5,53,61,2515
2547,2547,4023,1.180327868852459,0.049633612362253984,61,1.180327868852459,"Look, he's trying to follow in our footsteps...",601,0,11,50,61,2515
2548,2548,4229,1.180327868852459,0.054862952559611516,61,1.180327868852459,"Huh. Apparently, they don't run out of steam either.",601,1,9,51,61,2515
2549,2549,4337,1.180327868852459,0.06405341316761795,61,1.180327868852459,It's a bit spineless for a half marathon.,601,3,5,53,61,2515
2550,2550,4353,1.180327868852459,0.05963548986123849,61,1.180327868852459,I suppose we are getting our just deserts.,601,2,7,52,61,2515
2551,2551,4394,1.180327868852459,0.054862952559611516,61,1.180327868852459,I think it knows we're made of water.,601,1,9,51,61,2515
2552,2552,4534,1.180327868852459,0.05963548986123849,61,1.180327868852459,We know it’s you Wile E.,601,2,7,52,61,2515
2553,2553,4537,1.180327868852459,0.05963548986123849,61,1.180327868852459,"Watch out, it’s a succulent!",601,2,7,52,61,2515
2554,2554,4753,1.180327868852459,0.049633612362253984,61,1.180327868852459,Coyote on our six.,601,0,11,50,61,2515
2555,2555,4761,1.180327868852459,0.054862952559611516,61,1.180327868852459,"See? I told you if we try to blend in and stay still, the wonders of nature will come to us.",601,1,9,51,61,2515
2556,2556,4925,1.1785714285714286,0.05164277182008721,56,1.1785714285714286,He definitely could improve his times if he didn't keep his arms so stiff.,601,0,10,46,56,2557
2557,2557,87,1.1774193548387095,0.054049126391304346,62,1.1774193548387095,Ignore him Bob. It's attention seeking behaviour at its finest.,601,1,9,52,62,2558
2558,2558,757,1.1774193548387095,0.058737796974655074,62,1.1774193548387095,"GLOBAL WARMING IS GETTING PRETTY BAD , WHEN A CACTUS ... IS THRISTY!!!",601,2,7,53,62,2558
2559,2559,1131,1.1774193548387095,0.058737796974655074,62,1.1774193548387095,It hurts! It hurts!,601,2,7,53,62,2558
2560,2560,1160,1.1774193548387095,0.054049126391304346,62,1.1774193548387095,I wish it weren't so friendly.,601,1,9,52,62,2558
2561,2561,1585,1.1774193548387095,0.058737796974655074,62,1.1774193548387095,"Ahhh, now it wants a hug!",601,2,7,53,62,2558
2562,2562,3073,1.1774193548387095,0.058737796974655074,62,1.1774193548387095,Maybe it's just thirsty,601,2,7,53,62,2558
2563,2563,4038,1.1774193548387095,0.058737796974655074,62,1.1774193548387095,I told you not to hug him.,601,2,7,53,62,2558
2564,2564,4581,1.1774193548387095,0.054049126391304346,62,1.1774193548387095,"Say, Spikes, pick up the pace or you'll be left behind",601,1,9,52,62,2558
2565,2565,437,1.1754385964912282,0.0566549100524176,57,1.1754385964912282,"I know it sounds crazy, Mark ... but my spiny sense is tingling.",601,1,8,48,57,2566
2566,2566,563,1.1754385964912282,0.0566549100524176,57,1.1754385964912282,"Between you and me, I never thought we'd have a son who would be so prickly.",601,1,8,48,57,2566
2567,2567,1095,1.1754385964912282,0.0566549100524176,57,1.1754385964912282,He sick of waiting to be held up.,601,1,8,48,57,2566
2568,2568,1126,1.1754385964912282,0.0566549100524176,57,1.1754385964912282,He said he just wants a little water.,601,1,8,48,57,2566
2569,2569,3691,1.1754385964912282,0.0566549100524176,57,1.1754385964912282,Keep running! It wants to hug us!,601,1,8,48,57,2566
2570,2570,279,1.1746031746031746,0.04821271851032602,63,1.1746031746031746,"I wouldn't say he's the cute fuzzy kind, no.",601,0,11,52,63,2571
2571,2571,15,1.1724137931034482,0.06093608879319741,58,1.1724137931034482,Even I didn’t think crazy Joe Arpaio would stoop this low to chase us Progressives out of Arizona before the election.,601,2,6,50,58,2572
2572,2572,22,1.1724137931034482,0.050032844835173236,58,1.1724137931034482,So much for the motivation myth.,601,0,10,48,58,2572
2573,2573,40,1.1724137931034482,0.05575164786673556,58,1.1724137931034482,"Cactus see, cactus do?",601,1,8,49,58,2572
2574,2574,50,1.1724137931034482,0.06093608879319741,58,1.1724137931034482,Are you going to needle me about my form too?,601,2,6,50,58,2572
2575,2575,73,1.1724137931034482,0.05575164786673556,58,1.1724137931034482,A cactus stalk is stalking us.,601,1,8,49,58,2572
2576,2576,100,1.1724137931034482,0.06093608879319741,58,1.1724137931034482,"I don't care if your screen name is the Tuscon Tickler, I'm not Stormy Daniels!",601,2,6,50,58,2572
2577,2577,130,1.1724137931034482,0.05575164786673556,58,1.1724137931034482,Stop! All I want is a hug.,601,1,8,49,58,2572
2578,2578,149,1.1724137931034482,0.06571276584476107,58,1.1724137931034482,This place must be a real shit hole.,601,3,4,51,58,2572
2579,2579,152,1.1724137931034482,0.05575164786673556,58,1.1724137931034482,Remember that baby cactus you transplanted in our garden last week?,601,1,8,49,58,2572
2580,2580,182,1.1724137931034482,0.06093608879319741,58,1.1724137931034482,"Wait, wait take me to your leader, I've got a birth certificate and everything. It's not true that I only speak cactus. Who said that!",601,2,6,50,58,2572
2581,2581,189,1.1724137931034482,0.06093608879319741,58,1.1724137931034482,Don't tell me you're thirsty!,601,2,6,50,58,2572
2582,2582,193,1.1724137931034482,0.06093608879319741,58,1.1724137931034482,That giant prick is still chasing us.,601,2,6,50,58,2572
2583,2583,228,1.1724137931034482,0.06093608879319741,58,1.1724137931034482,Slow down. We're sweating too much.,601,2,6,50,58,2572
2584,2584,237,1.1724137931034482,0.05575164786673556,58,1.1724137931034482,You misunderstood.Look behind us.I did not call you a big prick!,601,1,8,49,58,2572
2585,2585,252,1.1724137931034482,0.05575164786673556,58,1.1724137931034482,What was it that guide at Yucca Flats say about changes in the flora?,601,1,8,49,58,2572
2586,2586,372,1.1724137931034482,0.05575164786673556,58,1.1724137931034482,You know you could run faster with if you try putting your arms down...,601,1,8,49,58,2572
2587,2587,395,1.1724137931034482,0.05575164786673556,58,1.1724137931034482,The guy behind us looks dehydrated.,601,1,8,49,58,2572
2588,2588,403,1.1724137931034482,0.06093608879319741,58,1.1724137931034482,Mr. Prickles got out of the backyard again.,601,2,6,50,58,2572
2589,2589,411,1.1724137931034482,0.050032844835173236,58,1.1724137931034482,If you can't keep up we are putting you back in yur pot.,601,0,10,48,58,2572
2590,2590,436,1.1724137931034482,0.05575164786673556,58,1.1724137931034482,Watch out! He's gaining on us!,601,1,8,49,58,2572
2591,2591,444,1.1724137931034482,0.05575164786673556,58,1.1724137931034482,I think we should have brought more water.,601,1,8,49,58,2572
2592,2592,461,1.1724137931034482,0.05575164786673556,58,1.1724137931034482,Finally! We have discovered an emotionally intelligent life-form in the universe!,601,1,8,49,58,2572
2593,2593,475,1.1724137931034482,0.05575164786673556,58,1.1724137931034482,That border wall won't come quickly enough.,601,1,8,49,58,2572
2594,2594,536,1.1724137931034482,0.05575164786673556,58,1.1724137931034482,"Joe, jog faster!",601,1,8,49,58,2572
2595,2595,541,1.1724137931034482,0.05575164786673556,58,1.1724137931034482,"Death by running cactus...tragically, Flora always knew her name would be destiny.",601,1,8,49,58,2572
2596,2596,585,1.1724137931034482,0.050032844835173236,58,1.1724137931034482,You remind me of my boss and I'm not the least bit interested in him either.,601,0,10,48,58,2572
2597,2597,655,1.1724137931034482,0.05575164786673556,58,1.1724137931034482,I'm dying for a glass of water! Your friend seems to be doing just fine though.,601,1,8,49,58,2572
2598,2598,656,1.1724137931034482,0.06093608879319741,58,1.1724137931034482,"Honey, have you been talking too suggestively to the plants again?",601,2,6,50,58,2572
2599,2599,677,1.1724137931034482,0.06093608879319741,58,1.1724137931034482,I think we may have the start of a new fitness fad!,601,2,6,50,58,2572
2600,2600,724,1.1724137931034482,0.05575164786673556,58,1.1724137931034482,Some of these mirages come a little too close for comfort.,601,1,8,49,58,2572
2601,2601,821,1.1724137931034482,0.050032844835173236,58,1.1724137931034482,"I know it's the latest in hydration solutions, but couldn't you just carry some water?",601,0,10,48,58,2572
2602,2602,852,1.1724137931034482,0.05575164786673556,58,1.1724137931034482,"fred, don't look now, but i think there is a cactus following us",601,1,8,49,58,2572
2603,2603,910,1.1724137931034482,0.06571276584476107,58,1.1724137931034482,"Sorry, we're not the hugging type.",601,3,4,51,58,2572
2604,2604,972,1.1724137931034482,0.050032844835173236,58,1.1724137931034482,Anyone thirsty?,601,0,10,48,58,2572
2605,2605,982,1.1724137931034482,0.06093608879319741,58,1.1724137931034482,What kind of stick-up is this?,601,2,6,50,58,2572
2606,2606,1137,1.1724137931034482,0.06093608879319741,58,1.1724137931034482,"But I’m telling you, it’s not my shadow!",601,2,6,50,58,2572
2607,2607,1150,1.1724137931034482,0.05575164786673556,58,1.1724137931034482,"Josh, we have a thorny problem...",601,1,8,49,58,2572
2608,2608,1210,1.1724137931034482,0.05575164786673556,58,1.1724137931034482,Keep running. It's gaining on us.,601,1,8,49,58,2572
2609,2609,1214,1.1724137931034482,0.06093608879319741,58,1.1724137931034482,The Desert Survival app didn't cover this.,601,2,6,50,58,2572
2610,2610,1267,1.1724137931034482,0.05575164786673556,58,1.1724137931034482,Climate Change is truly gaining on us...,601,1,8,49,58,2572
2611,2611,1278,1.1724137931034482,0.05575164786673556,58,1.1724137931034482,"Hurry, if he follows us home, we'll have to keep him!",601,1,8,49,58,2572
2612,2612,1295,1.1724137931034482,0.06093608879319741,58,1.1724137931034482,This trainer never gives us a water break.,601,2,6,50,58,2572
2613,2613,1323,1.1724137931034482,0.06093608879319741,58,1.1724137931034482,"""Honey, that big prick is still following us."" .... (I apologize -- I couldn't help myself) ...",601,2,6,50,58,2572
2614,2614,1366,1.1724137931034482,0.05575164786673556,58,1.1724137931034482,I think the border patrol guy needs help.,601,1,8,49,58,2572
2615,2615,1399,1.1724137931034482,0.050032844835173236,58,1.1724137931034482,"So strange, only he is leaving footprints",601,0,10,48,58,2572
2616,2616,1461,1.1724137931034482,0.05575164786673556,58,1.1724137931034482,"SNL was right Tom, Gumby is for real.",601,1,8,49,58,2572
2617,2617,1519,1.1724137931034482,0.05575164786673556,58,1.1724137931034482,He's asking for our immigration permits.,601,1,8,49,58,2572
2618,2618,1543,1.1724137931034482,0.05575164786673556,58,1.1724137931034482,"You are retaining water..yadda, yadda....the wedding is in three months...MOVE!",601,1,8,49,58,2572
2619,2619,1550,1.1724137931034482,0.05575164786673556,58,1.1724137931034482,Stick with me!,601,1,8,49,58,2572
2620,2620,1560,1.1724137931034482,0.05575164786673556,58,1.1724137931034482,I knew I would regret that margarita.,601,1,8,49,58,2572
2621,2621,1580,1.1724137931034482,0.06093608879319741,58,1.1724137931034482,"He's a bit plodding, but won't need a hydration break.",601,2,6,50,58,2572
2622,2622,1595,1.1724137931034482,0.06093608879319741,58,1.1724137931034482,I just kind of feel like we should let the local jogger lead the trail.,601,2,6,50,58,2572
2623,2623,1618,1.1724137931034482,0.050032844835173236,58,1.1724137931034482,"Hear me out, folks. I’m in a bit of a prickle...",601,0,10,48,58,2572
2624,2624,1731,1.1724137931034482,0.05575164786673556,58,1.1724137931034482,He's stuck to us for the last mile.,601,1,8,49,58,2572
2625,2625,1740,1.1724137931034482,0.06571276584476107,58,1.1724137931034482,"What? Who says ""succs running""? It is ""running sucks"".",601,3,4,51,58,2572
2626,2626,1749,1.1724137931034482,0.05575164786673556,58,1.1724137931034482,Does someone need a hug?,601,1,8,49,58,2572
2627,2627,1771,1.1724137931034482,0.06571276584476107,58,1.1724137931034482,"'hurry it's going to cac-tus""",601,3,4,51,58,2572
2628,2628,1791,1.1724137931034482,0.05575164786673556,58,1.1724137931034482,Let's put the us in Cactus.,601,1,8,49,58,2572
2629,2629,1800,1.1724137931034482,0.05575164786673556,58,1.1724137931034482,Don't look back. We are being followed by a guy on spikes.,601,1,8,49,58,2572
2630,2630,1882,1.1724137931034482,0.05575164786673556,58,1.1724137931034482,Something about a wall,601,1,8,49,58,2572
2631,2631,1883,1.1724137931034482,0.05575164786673556,58,1.1724137931034482,Friday night flashback... that prick is following me home.,601,1,8,49,58,2572
2632,2632,1888,1.1724137931034482,0.050032844835173236,58,1.1724137931034482,It's like we're running in sand.,601,0,10,48,58,2572
2633,2633,1954,1.1724137931034482,0.06093608879319741,58,1.1724137931034482,"Hey, isn't that Y.M.C.A.?",601,2,6,50,58,2572
2634,2634,1967,1.1724137931034482,0.05575164786673556,58,1.1724137931034482,Can we talk about this witness protection program you agreed to?,601,1,8,49,58,2572
2635,2635,2007,1.1724137931034482,0.05575164786673556,58,1.1724137931034482,"I know you're feeling all prickly, but you've got to keep up.",601,1,8,49,58,2572
2636,2636,2010,1.1724137931034482,0.07435111935996871,58,1.1724137931034482,Don’t look now. The Republican Party is short two votes.,601,5,0,53,58,2572
2637,2637,2048,1.1724137931034482,0.050032844835173236,58,1.1724137931034482,Don't look back. We are being followed by that runner who never stops at the water stations.,601,0,10,48,58,2572
2638,2638,2074,1.1724137931034482,0.06093608879319741,58,1.1724137931034482,- No need to keep checking on him. The doctor said he is in excellent health.,601,2,6,50,58,2572
2639,2639,2082,1.1724137931034482,0.05575164786673556,58,1.1724137931034482,"Sorry, it's Burning MAN.",601,1,8,49,58,2572
2640,2640,2201,1.1724137931034482,0.06093608879319741,58,1.1724137931034482,Run!!! It thinks we are illegals.,601,2,6,50,58,2572
2641,2641,2221,1.1724137931034482,0.05575164786673556,58,1.1724137931034482,It should be disqualified for illegal hydration.,601,1,8,49,58,2572
2642,2642,2227,1.1724137931034482,0.05575164786673556,58,1.1724137931034482,"'Honey, do you owe the landscaper any money?""",601,1,8,49,58,2572
2643,2643,2228,1.1724137931034482,0.05575164786673556,58,1.1724137931034482,Looks like one of us pre-hydrated.,601,1,8,49,58,2572
2644,2644,2252,1.1724137931034482,0.06093608879319741,58,1.1724137931034482,Please leave me alone. I said I loved the album The Joshua Tree.,601,2,6,50,58,2572
2645,2645,2255,1.1724137931034482,0.05575164786673556,58,1.1724137931034482,""" We are near the border, and that name, Saguaro, doesn't even sound English, to me.",601,1,8,49,58,2572
2646,2646,2265,1.1724137931034482,0.06093608879319741,58,1.1724137931034482,"No, we don’t want a hug.",601,2,6,50,58,2572
2647,2647,2291,1.1724137931034482,0.050032844835173236,58,1.1724137931034482,This will work wonders for Arizona tourism.,601,0,10,48,58,2572
2648,2648,2296,1.1724137931034482,0.06571276584476107,58,1.1724137931034482,Running makes me thorney.,601,3,4,51,58,2572
2649,2649,2299,1.1724137931034482,0.06093608879319741,58,1.1724137931034482,"When we get home, he'll look great in the front yard",601,2,6,50,58,2572
2650,2650,2314,1.1724137931034482,0.05575164786673556,58,1.1724137931034482,Cactus Gump.,601,1,8,49,58,2572
2651,2651,2350,1.1724137931034482,0.05575164786673556,58,1.1724137931034482,Our water supply is still with us!!.,601,1,8,49,58,2572
2652,2652,2360,1.1724137931034482,0.05575164786673556,58,1.1724137931034482,I don't think it's signaling touchdown.,601,1,8,49,58,2572
2653,2653,2366,1.1724137931034482,0.05575164786673556,58,1.1724137931034482,"I'm not sure he's gaining on us, but he definitely looks more exasperated.",601,1,8,49,58,2572
2654,2654,2460,1.1724137931034482,0.050032844835173236,58,1.1724137931034482,"There's no ""I"" in cactus.",601,0,10,48,58,2572
2655,2655,2641,1.1724137931034482,0.05575164786673556,58,1.1724137931034482,"This could be, a prickly situation.",601,1,8,49,58,2572
2656,2656,2644,1.1724137931034482,0.050032844835173236,58,1.1724137931034482,I never knew cacti were so slow.,601,0,10,48,58,2572
2657,2657,2669,1.1724137931034482,0.06571276584476107,58,1.1724137931034482,"Wait, come back, you forgot the hug!",601,3,4,51,58,2572
2658,2658,2671,1.1724137931034482,0.050032844835173236,58,1.1724137931034482,Hands down. You are free to go.,601,0,10,48,58,2572
2659,2659,2687,1.1724137931034482,0.05575164786673556,58,1.1724137931034482,We better not stick around or we’ll never get rid of him.,601,1,8,49,58,2572
2660,2660,2689,1.1724137931034482,0.05575164786673556,58,1.1724137931034482,Told you to that guac wasn't right!,601,1,8,49,58,2572
2661,2661,2740,1.1724137931034482,0.06093608879319741,58,1.1724137931034482,It picked us up at the wall.,601,2,6,50,58,2572
2662,2662,2745,1.1724137931034482,0.05575164786673556,58,1.1724137931034482,I have a prickly feeling that someone is following us...,601,1,8,49,58,2572
2663,2663,2775,1.1724137931034482,0.050032844835173236,58,1.1724137931034482,"Honey, did you remember to bring the limes and salt?",601,0,10,48,58,2572
2664,2664,2814,1.1724137931034482,0.06093608879319741,58,1.1724137931034482,"Fine, pass me and act all superior! But did you properly hydrate?",601,2,6,50,58,2572
2665,2665,2817,1.1724137931034482,0.06093608879319741,58,1.1724137931034482,Take me with you! Agave get outta here!,601,2,6,50,58,2572
2666,2666,2828,1.1724137931034482,0.06571276584476107,58,1.1724137931034482,I hope he put deodorant on the inside of those thighs.,601,3,4,51,58,2572
2667,2667,2858,1.1724137931034482,0.050032844835173236,58,1.1724137931034482,He doesn't seem to understand that no means no!,601,0,10,48,58,2572
2668,2668,2881,1.1724137931034482,0.05575164786673556,58,1.1724137931034482,You weren't kidding when you said our new coach was a stickler!,601,1,8,49,58,2572
2669,2669,2889,1.1724137931034482,0.06571276584476107,58,1.1724137931034482,Jogging in Arizona is sure different than in Alaska.,601,3,4,51,58,2572
2670,2670,2910,1.1724137931034482,0.05575164786673556,58,1.1724137931034482,HAHAHAHA CACT-ASS,601,1,8,49,58,2572
2671,2671,2919,1.1724137931034482,0.05575164786673556,58,1.1724137931034482,"We are tree huggers, not cactus!",601,1,8,49,58,2572
2672,2672,2932,1.1724137931034482,0.06093608879319741,58,1.1724137931034482,"When you said, ""Stick with me,"" you should have been more specific.",601,2,6,50,58,2572
2673,2673,2945,1.1724137931034482,0.05575164786673556,58,1.1724137931034482,"Yikes, looks like the Haitians' voodoo did a number on Trump.",601,1,8,49,58,2572
2674,2674,2958,1.1724137931034482,0.06571276584476107,58,1.1724137931034482,"I swear it just said, ""Saguaro you headed?""",601,3,4,51,58,2572
2675,2675,2978,1.1724137931034482,0.05575164786673556,58,1.1724137931034482,I get the feeling that the baby Saguaro we passed thinks we're it's parents.,601,1,8,49,58,2572
2676,2676,3023,1.1724137931034482,0.05575164786673556,58,1.1724137931034482,Do you think it's the peyote we ate?,601,1,8,49,58,2572
2677,2677,3024,1.1724137931034482,0.06093608879319741,58,1.1724137931034482,How far away did you say that water station was?,601,2,6,50,58,2572
2678,2678,3034,1.1724137931034482,0.06093608879319741,58,1.1724137931034482,Why do I have this prickly feeling we are being followed....?,601,2,6,50,58,2572
2679,2679,3046,1.1724137931034482,0.06093608879319741,58,1.1724137931034482,"Honey, isn't that the new cheerleader for the Las Vegas Raiders foot ball team?",601,2,6,50,58,2572
2680,2680,3056,1.1724137931034482,0.050032844835173236,58,1.1724137931034482,I am getting a prickly feeling,601,0,10,48,58,2572
2681,2681,3071,1.1724137931034482,0.050032844835173236,58,1.1724137931034482,Guess it overdid the mescaline!,601,0,10,48,58,2572
2682,2682,3099,1.1724137931034482,0.050032844835173236,58,1.1724137931034482,Follow us to your cousin Wavy at the car dealership!,601,0,10,48,58,2572
2683,2683,3104,1.1724137931034482,0.05575164786673556,58,1.1724137931034482,Omg Ted....Your ex wife is stalking us again!,601,1,8,49,58,2572
2684,2684,3114,1.1724137931034482,0.05575164786673556,58,1.1724137931034482,"'I'm not a Botanophobe, I just think all cacti look the same...'",601,1,8,49,58,2572
2685,2685,3138,1.1724137931034482,0.05575164786673556,58,1.1724137931034482,"C'mon guys, I know I can be prickly at times...",601,1,8,49,58,2572
2686,2686,3182,1.1724137931034482,0.06571276584476107,58,1.1724137931034482,oh shit...oh shit....shitshitshit.....fuck,601,3,4,51,58,2572
2687,2687,3186,1.1724137931034482,0.06571276584476107,58,1.1724137931034482,Yes... the cactus is still behind us. But I can't tell if it's a boy or a girl.,601,3,4,51,58,2572
2688,2688,3190,1.1724137931034482,0.05575164786673556,58,1.1724137931034482,New costume for illegal immigrant,601,1,8,49,58,2572
2689,2689,3214,1.1724137931034482,0.05575164786673556,58,1.1724137931034482,Arpaio! Rápido!,601,1,8,49,58,2572
2690,2690,3243,1.1724137931034482,0.05575164786673556,58,1.1724137931034482,Awww...I think he’s trying to follow us home.,601,1,8,49,58,2572
2691,2691,3354,1.1724137931034482,0.06093608879319741,58,1.1724137931034482,Anyone else need a water break?,601,2,6,50,58,2572
2692,2692,3362,1.1724137931034482,0.06093608879319741,58,1.1724137931034482,It thinks we have water...,601,2,6,50,58,2572
2693,2693,3379,1.1724137931034482,0.06093608879319741,58,1.1724137931034482,I fear he's determined to get his hug today.,601,2,6,50,58,2572
2694,2694,3394,1.1724137931034482,0.06093608879319741,58,1.1724137931034482,I think it smells your camel pack!,601,2,6,50,58,2572
2695,2695,3396,1.1724137931034482,0.06093608879319741,58,1.1724137931034482,And I thought 'Goat Yoga' was strange...,601,2,6,50,58,2572
2696,2696,3421,1.1724137931034482,0.06093608879319741,58,1.1724137931034482,Whoever heard of the abominable cactus.,601,2,6,50,58,2572
2697,2697,3446,1.1724137931034482,0.07016500746472101,58,1.1724137931034482,"Go faster, it seems to be sticking with us.",601,4,2,52,58,2572
2698,2698,3452,1.1724137931034482,0.06093608879319741,58,1.1724137931034482,"Come on, let's go... this dude's being a real prick.",601,2,6,50,58,2572
2699,2699,3477,1.1724137931034482,0.050032844835173236,58,1.1724137931034482,"Before we really get started, let's go for a dry run.",601,0,10,48,58,2572
2700,2700,3480,1.1724137931034482,0.05575164786673556,58,1.1724137931034482,I don't think he takes many water breaks.,601,1,8,49,58,2572
2701,2701,3482,1.1724137931034482,0.050032844835173236,58,1.1724137931034482,This is what happens when you let your kids make your costume.,601,0,10,48,58,2572
2702,2702,3538,1.1724137931034482,0.050032844835173236,58,1.1724137931034482,We should consider running suits with the new internal hydration technology.,601,0,10,48,58,2572
2703,2703,3552,1.1724137931034482,0.050032844835173236,58,1.1724137931034482,His dry humor was not for everyone.,601,0,10,48,58,2572
2704,2704,3561,1.1724137931034482,0.050032844835173236,58,1.1724137931034482,I think our therapist is on Amazon again Karl.,601,0,10,48,58,2572
2705,2705,3587,1.1724137931034482,0.050032844835173236,58,1.1724137931034482,He sure gets prickly when he falls behind.,601,0,10,48,58,2572
2706,2706,3602,1.1724137931034482,0.06093608879319741,58,1.1724137931034482,"Come on now, take me to your leader. I wanna meet the prick.",601,2,6,50,58,2572
2707,2707,3640,1.1724137931034482,0.05575164786673556,58,1.1724137931034482,"Larry, you can take off your costume now. Larry? Never mind.",601,1,8,49,58,2572
2708,2708,3704,1.1724137931034482,0.05575164786673556,58,1.1724137931034482,I told you to drink more water.,601,1,8,49,58,2572
2709,2709,3741,1.1724137931034482,0.05575164786673556,58,1.1724137931034482,"You just had to say it didn't look that dangerous, didn't you?",601,1,8,49,58,2572
2710,2710,3748,1.1724137931034482,0.06093608879319741,58,1.1724137931034482,It's a special suit to help you preserve water.,601,2,6,50,58,2572
2711,2711,3756,1.1724137931034482,0.06093608879319741,58,1.1724137931034482,Hey hon! Some prick is following us!,601,2,6,50,58,2572
2712,2712,3770,1.1724137931034482,0.050032844835173236,58,1.1724137931034482,Next time think twice about giving some of your trail mix to a cactus.,601,0,10,48,58,2572
