,Unnamed: 0,target_id,mean,precision,count,score,caption,contest,funny,somewhat_funny,unfunny,counts,rank
1252,1252,3905,1.255813953488372,0.06445827399666161,86,1.255813953488372,ARE YOU CRAZY !!!! A THREE-WAY IS OUT OF THE QUESTION !!!,601,7,8,71,86,1221
1253,1253,4050,1.255813953488372,0.05532158567646685,86,1.255813953488372,We’re not the only ones who resolved to get more exercise this year.,601,3,16,67,86,1221
1254,1254,4076,1.255813953488372,0.05279090859741999,86,1.255813953488372,Tell me if you need water,601,2,18,66,86,1221
1255,1255,4113,1.255813953488372,0.05774145523777671,86,1.255813953488372,It says its not armed,601,4,14,68,86,1221
1256,1256,4119,1.255813953488372,0.06006391149595306,86,1.255813953488372,I thought you said what happens in Oaxaca stays in Oaxaca.,601,5,12,69,86,1221
1257,1257,4262,1.255813953488372,0.05532158567646685,86,1.255813953488372,"But sweetie, when you said stick’em up, he did!",601,3,16,67,86,1221
1258,1258,4288,1.255813953488372,0.05774145523777671,86,1.255813953488372,"Honey, don't look now, but your prickly past is catching up with us.",601,4,14,68,86,1221
1259,1259,4355,1.255813953488372,0.06006391149595306,86,1.255813953488372,"Hurry up, it’s cactusing up with us.",601,5,12,69,86,1221
1260,1260,4397,1.255813953488372,0.05279090859741999,86,1.255813953488372,What did you say to it?,601,2,18,66,86,1221
1261,1261,4455,1.255813953488372,0.05279090859741999,86,1.255813953488372,It wants your water bottle !!,601,2,18,66,86,1221
1262,1262,4641,1.255813953488372,0.06006391149595306,86,1.255813953488372,"I am never running another ""adventure"" marathon again.",601,5,12,69,86,1221
1263,1263,4728,1.255813953488372,0.05013264624297865,86,1.255813953488372,Let's name him Spike,601,1,20,65,86,1221
1264,1264,4823,1.255813953488372,0.06006391149595306,86,1.255813953488372,You're the one who said I needed to find us a cheaper personal trainer.,601,5,12,69,86,1221
1265,1265,4833,1.255813953488372,0.05774145523777671,86,1.255813953488372,You shouldn't have needled him. He's prickly about his weight.,601,4,14,68,86,1221
1266,1266,4875,1.255813953488372,0.05279090859741999,86,1.255813953488372,"He’s built for speed, not for comfort.",601,2,18,66,86,1221
1267,1267,4893,1.255813953488372,0.05013264624297865,86,1.255813953488372,Wait! I think he just wants a hug.,601,1,20,65,86,1221
1268,1268,4931,1.255813953488372,0.05532158567646685,86,1.255813953488372,Pump your arms — it’ll look more natural.,601,3,16,67,86,1221
1269,1269,895,1.2555555555555555,0.058189734672459324,90,1.2555555555555555,I think we should stop doing our jog in Area 51.,601,5,13,72,90,1270
1270,1270,3996,1.2533333333333334,0.0632265576921407,75,1.2533333333333334,I think you gave it too much water.,601,4,11,60,75,1271
1271,1271,46,1.2530120481927711,0.058993849806645786,83,1.2530120481927711,I don’t trust him. He looks a bit rootless.,601,4,13,66,83,1272
1272,1272,564,1.2530120481927711,0.06143397004328656,83,1.2530120481927711,Prick up the pace.,601,5,11,67,83,1272
1273,1273,620,1.2530120481927711,0.05644834767058051,83,1.2530120481927711,"Yep, he's still trying to stick to us.",601,3,15,65,83,1272
1274,1274,676,1.2530120481927711,0.05378250267948101,83,1.2530120481927711,But his gesture suggests he means us no harm!,601,2,17,64,83,1272
1275,1275,680,1.2530120481927711,0.05644834767058051,83,1.2530120481927711,I wish we had just bought Fitbits.,601,3,15,65,83,1272
1276,1276,710,1.2530120481927711,0.06143397004328656,83,1.2530120481927711,Do you believe in global warming NOW?,601,5,11,67,83,1272
1277,1277,717,1.2530120481927711,0.05644834767058051,83,1.2530120481927711,Don't you want to see the rest of my routine?,601,3,15,65,83,1272
1278,1278,763,1.2530120481927711,0.06143397004328656,83,1.2530120481927711,Is it really necessary for your bodyguard to wear a disguise?,601,5,11,67,83,1272
1279,1279,802,1.2530120481927711,0.05644834767058051,83,1.2530120481927711,Run faster & he won't cact-us!,601,3,15,65,83,1272
1280,1280,892,1.2530120481927711,0.05378250267948101,83,1.2530120481927711,Uh Oh! Sticker shock.,601,2,17,64,83,1272
1281,1281,950,1.2530120481927711,0.058993849806645786,83,1.2530120481927711,"You're wearing sweatpants in the desert! Stop! Cut me open and drink some water! Touchdown! God, it's hot out here. What kind of shithole country is this?",601,4,13,66,83,1272
1282,1282,964,1.2530120481927711,0.058993849806645786,83,1.2530120481927711,Are saguaros carnivorous?,601,4,13,66,83,1272
1283,1283,988,1.2530120481927711,0.058993849806645786,83,1.2530120481927711,This new trainer is a real prick,601,4,13,66,83,1272
1284,1284,998,1.2530120481927711,0.058993849806645786,83,1.2530120481927711,It's almost as if it has been storing water for exactly this purpose.,601,4,13,66,83,1272
1285,1285,1009,1.2530120481927711,0.058993849806645786,83,1.2530120481927711,You don’t suck. I said you were a succulent.,601,4,13,66,83,1272
1286,1286,1087,1.2530120481927711,0.06143397004328656,83,1.2530120481927711,Just my imagination running away with me..,601,5,11,67,83,1272
1287,1287,1125,1.2530120481927711,0.06143397004328656,83,1.2530120481927711,Don't move! This is a stick up.,601,5,11,67,83,1272
1288,1288,1241,1.2530120481927711,0.06823274694815151,83,1.2530120481927711,"If this is a new border wall patrol tactic, it's working!",601,8,5,70,83,1272
1289,1289,1293,1.2530120481927711,0.06378080460099088,83,1.2530120481927711,There's been a spike in crime in this neighborhood. I found a dirty needle last week and I'm pretty sure this prick is following us.,601,6,9,68,83,1272
1290,1290,1326,1.2530120481927711,0.06378080460099088,83,1.2530120481927711,At least its not running for congress,601,6,9,68,83,1272
1291,1291,1629,1.2530120481927711,0.05644834767058051,83,1.2530120481927711,What does this prick want from us?,601,3,15,65,83,1272
1292,1292,1662,1.2530120481927711,0.05644834767058051,83,1.2530120481927711,No fair-you have to count to ten first.,601,3,15,65,83,1272
1293,1293,1829,1.2530120481927711,0.05644834767058051,83,1.2530120481927711,He's less of a slasher and more of a prick.,601,3,15,65,83,1272
1294,1294,2043,1.2530120481927711,0.058993849806645786,83,1.2530120481927711,This brings new meaning to the word ‘Stalker’...,601,4,13,66,83,1272
1295,1295,2096,1.2530120481927711,0.058993849806645786,83,1.2530120481927711,"Honey, we're being followed by some prick.",601,4,13,66,83,1272
1296,1296,2102,1.2530120481927711,0.058993849806645786,83,1.2530120481927711,"If only I had known this is what the climatologists meant when they said, ""some plants will expand their ranges in a warmer world.""",601,4,13,66,83,1272
1297,1297,2406,1.2530120481927711,0.05644834767058051,83,1.2530120481927711,Do you think he's just trying to needle us?,601,3,15,65,83,1272
1298,1298,2556,1.2530120481927711,0.06143397004328656,83,1.2530120481927711,"When the wall gets built, we can stop worrying about all this undercover surveillance.",601,5,11,67,83,1272
1299,1299,2601,1.2530120481927711,0.05644834767058051,83,1.2530120481927711,I told you we should stay away from the old nuclear test site.,601,3,15,65,83,1272
1300,1300,2652,1.2530120481927711,0.05378250267948101,83,1.2530120481927711,The border control vigilantes are not fooling around.,601,2,17,64,83,1272
1301,1301,2710,1.2530120481927711,0.06143397004328656,83,1.2530120481927711,I warned you not to water it Bill.,601,5,11,67,83,1272
1302,1302,2799,1.2530120481927711,0.05378250267948101,83,1.2530120481927711,Mother Nature's definitely on the run.,601,2,17,64,83,1272
1303,1303,3000,1.2530120481927711,0.05378250267948101,83,1.2530120481927711,I think someone else is thirsty.,601,2,17,64,83,1272
1304,1304,3030,1.2530120481927711,0.058993849806645786,83,1.2530120481927711,Looks like Jerry's coming down with a bad case of prickly heat again...,601,4,13,66,83,1272
1305,1305,3089,1.2530120481927711,0.05644834767058051,83,1.2530120481927711,"Hey, he didn't get funding for the fence but this moving cactus is impressive.",601,3,15,65,83,1272
1306,1306,3168,1.2530120481927711,0.05644834767058051,83,1.2530120481927711,Hurry. I only wanted a selfie. I didn't want to adopt him. Hurry.,601,3,15,65,83,1272
1307,1307,3347,1.2530120481927711,0.05644834767058051,83,1.2530120481927711,Wait!! I'll bloom in a few months!,601,3,15,65,83,1272
1308,1308,3419,1.2530120481927711,0.058993849806645786,83,1.2530120481927711,"Hmm, maybe I should reconsider my position on climate change",601,4,13,66,83,1272
1309,1309,3534,1.2530120481927711,0.05378250267948101,83,1.2530120481927711,"All right, we're leaving. No need to get all prickly about it.",601,2,17,64,83,1272
1310,1310,3635,1.2530120481927711,0.05378250267948101,83,1.2530120481927711,"His base may be soft, but he’s spiking in the polls!",601,2,17,64,83,1272
1311,1311,3884,1.2530120481927711,0.05644834767058051,83,1.2530120481927711,But all it wants is a hug!,601,3,15,65,83,1272
1312,1312,4000,1.2530120481927711,0.05378250267948101,83,1.2530120481927711,"He'd go faster if he used his ""arms"" like we do.",601,2,17,64,83,1272
1313,1313,4030,1.2530120481927711,0.058993849806645786,83,1.2530120481927711,"If that big cactus catches up with us, we'll be stuck with him!",601,4,13,66,83,1272
1314,1314,4176,1.2530120481927711,0.05378250267948101,83,1.2530120481927711,Wait--I think he's in pain! Hand me your tweezers.,601,2,17,64,83,1272
1315,1315,4310,1.2530120481927711,0.06378080460099088,83,1.2530120481927711,Last one in is a rotten monotypic genus Carnegiea!,601,6,9,68,83,1272
1316,1316,4460,1.2530120481927711,0.058993849806645786,83,1.2530120481927711,Is this just a dry run?,601,4,13,66,83,1272
1317,1317,4765,1.2530120481927711,0.0660442987381964,83,1.2530120481927711,But we're so green! We're not leaving even actual footprints!,601,7,7,69,83,1272
1318,1318,4768,1.2530120481927711,0.05378250267948101,83,1.2530120481927711,"Well, honey, now we know ""who cares"" if you step on the cryptobiotic soil.",601,2,17,64,83,1272
1319,1319,4797,1.2530120481927711,0.06143397004328656,83,1.2530120481927711,Huh. I always thought it was the fern that would be clingy.,601,5,11,67,83,1272
1320,1320,4863,1.2530120481927711,0.05644834767058051,83,1.2530120481927711,I'm not sure I like these new fitness trackers...,601,3,15,65,83,1272
1321,1321,4945,1.2530120481927711,0.05644834767058051,83,1.2530120481927711,Where did you pour out your energy drink?,601,3,15,65,83,1272
1322,1322,1428,1.2528735632183907,0.059442277353480615,87,1.2528735632183907,It's scary - even in this heat he never sweats!,601,5,12,70,87,1323
1323,1323,880,1.25,0.06308887810420713,84,1.25,"I know he's a prick, but we can't desert him.",601,6,9,69,84,1324
1324,1324,947,1.25,0.06532280056069527,84,1.25,I was hoping the whole 'women being chased by little pricks thing' would end in 2017.,601,7,7,70,84,1324
1325,1325,1035,1.25,0.062478066326750424,76,1.25,Remember that energy drink you poured out?,601,4,11,61,76,1324
1326,1326,1164,1.25,0.060772895338322,84,1.25,Who made that mushroom pizza?,601,5,11,68,84,1324
1327,1327,1422,1.25,0.05322367527583983,84,1.25,I think it wants to give up.,601,2,17,65,84,1324
1328,1328,1900,1.25,0.05585357054399395,84,1.25,"Leave him in the desert, you said He’d be better of wild, you said.",601,3,15,66,84,1324
1329,1329,2136,1.25,0.058365084384054265,84,1.25,"...AND, he just called us a prickly pair!",601,4,13,67,84,1324
1330,1330,2269,1.25,0.06308887810420713,84,1.25,It doesn't want to be deserted.,601,6,9,69,84,1324
1331,1331,2440,1.25,0.05322367527583983,84,1.25,Did that cactus just say... Don't shoot.?,601,2,17,65,84,1324
1332,1332,2452,1.25,0.060772895338322,84,1.25,The acupuncture did wonders for his spine condition.,601,5,11,68,84,1324
1333,1333,2487,1.25,0.05322367527583983,84,1.25,"Honey, did you leave a tip at that last rest stop?",601,2,17,65,84,1324
1334,1334,3266,1.25,0.05322367527583983,84,1.25,"Oh, I see what you mean about getting stuck out here.",601,2,17,65,84,1324
1335,1335,3316,1.25,0.060772895338322,84,1.25,"If you raise your arms, it's easier to breathe.",601,5,11,68,84,1324
1336,1336,3545,1.25,0.06308887810420713,84,1.25,"Saguaro, smaguaro; who cares. Just hurry, he's catching up.",601,6,9,69,84,1324
1337,1337,4090,1.25,0.05585357054399395,84,1.25,Remind me to shave my underarms when we're done jogging!,601,3,15,66,84,1324
1338,1338,4253,1.25,0.05585357054399395,84,1.25,You can have the first hug.,601,3,15,66,84,1324
1339,1339,4722,1.25,0.05322367527583983,84,1.25,"First it was the polar bears, now these guys are heading to more hospitable climes.",601,2,17,65,84,1324
1340,1340,4739,1.25,0.05585357054399395,84,1.25,I told you the wall wouldn't keep out those catixicans.,601,3,15,66,84,1324
1341,1341,4811,1.25,0.06308887810420713,84,1.25,"It’s not you, it’s all the pricks around you.",601,6,9,69,84,1324
1342,1342,2209,1.2470588235294118,0.060125644246543875,85,1.2470588235294118,This acid trip is getting more succulent by the minute!,601,5,11,69,85,1343
1343,1343,2590,1.2470588235294118,0.0624115785802593,85,1.2470588235294118,This won't happen once Trump gets his wall.,601,6,9,70,85,1343
1344,1344,4565,1.2470588235294118,0.05527086941984991,85,1.2470588235294118,Remind me why peyote Gatorade was a good idea?,601,3,15,67,85,1343
1345,1345,9,1.2469135802469136,0.06218963481361076,81,1.2469135802469136,Honey watch out- it's an Attacktus!,601,5,10,66,81,1346
1346,1346,169,1.2469135802469136,0.054236747250589634,81,1.2469135802469136,Honey-I think he is surrendering!,601,2,16,63,81,1346
1347,1347,269,1.2469135802469136,0.05965658976962751,81,1.2469135802469136,"Well, you did ask the genie for running water.",601,4,12,65,81,1346
1348,1348,325,1.2469135802469136,0.0570111105630559,81,1.2469135802469136,Don't forget to hydrate!,601,3,14,64,81,1346
1349,1349,390,1.2469135802469136,0.0570111105630559,81,1.2469135802469136,I think the runner's high is kicking in,601,3,14,64,81,1346
1350,1350,439,1.2469135802469136,0.054236747250589634,81,1.2469135802469136,This could turn into a prickly situation,601,2,16,63,81,1346
1351,1351,466,1.2469135802469136,0.05965658976962751,81,1.2469135802469136,"Come on, slow poke.",601,4,12,65,81,1346
1352,1352,497,1.2469135802469136,0.05965658976962751,81,1.2469135802469136,Feels like we're running in place.,601,4,12,65,81,1346
1353,1353,662,1.2469135802469136,0.06218963481361076,81,1.2469135802469136,"Honey, remember that baby cactus you had in college?",601,5,10,66,81,1346
1354,1354,729,1.2469135802469136,0.0570111105630559,81,1.2469135802469136,"Slow down, you know the story of the cactus and the hair, don't you?",601,3,14,64,81,1346
1355,1355,744,1.2469135802469136,0.06218963481361076,81,1.2469135802469136,I've noticed more cactus creep from Mexico since The Wall was announced.,601,5,10,66,81,1346
1356,1356,766,1.2469135802469136,0.06218963481361076,81,1.2469135802469136,Not a bad pace for a Succulent...,601,5,10,66,81,1346
1357,1357,850,1.2469135802469136,0.05965658976962751,81,1.2469135802469136,Eventually the Saguaro-Gumby hybrid experiment went horribly wrong.,601,4,12,65,81,1346
1358,1358,853,1.2469135802469136,0.0570111105630559,81,1.2469135802469136,Hydrate! Hydrate! Hydrate!,601,3,14,64,81,1346
1359,1359,921,1.2469135802469136,0.0570111105630559,81,1.2469135802469136,"Once we pass through that nudist camp ahead, we'll be okay.",601,3,14,64,81,1346
1360,1360,937,1.2469135802469136,0.054236747250589634,81,1.2469135802469136,The mirage is gaining on us!,601,2,16,63,81,1346
1361,1361,967,1.2469135802469136,0.05965658976962751,81,1.2469135802469136,Who paid for the wall?,601,4,12,65,81,1346
1362,1362,994,1.2469135802469136,0.05965658976962751,81,1.2469135802469136,I can skip the water stop.,601,4,12,65,81,1346
1363,1363,1067,1.2469135802469136,0.054236747250589634,81,1.2469135802469136,Where's the nearest Taco Bell? I'm applying to be their mascot.,601,2,16,63,81,1346
1364,1364,1127,1.2469135802469136,0.06218963481361076,81,1.2469135802469136,So this is what the border wall has come to?,601,5,10,66,81,1346
1365,1365,1223,1.2469135802469136,0.05965658976962751,81,1.2469135802469136,Arizona will stay with you forever,601,4,12,65,81,1346
1366,1366,1352,1.2469135802469136,0.06218963481361076,81,1.2469135802469136,All I want is a hug.,601,5,10,66,81,1346
1367,1367,1512,1.2469135802469136,0.0570111105630559,81,1.2469135802469136,"Actually, I'm less afraid of walking cacti than I am of driverless cars.",601,3,14,64,81,1346
1368,1368,1536,1.2469135802469136,0.05965658976962751,81,1.2469135802469136,You give it a hug and I'll run away and get help .,601,4,12,65,81,1346
1369,1369,1563,1.2469135802469136,0.054236747250589634,81,1.2469135802469136,I told you we would have been better off with a border wall.,601,2,16,63,81,1346
1370,1370,1576,1.2469135802469136,0.05131259861881583,81,1.2469135802469136,I am thinking that maybe I shouldn't have eaten that button off the cactus.,601,1,18,62,81,1346
1371,1371,1636,1.2469135802469136,0.0570111105630559,81,1.2469135802469136,. Let's hope our mirage has to pee soon.,601,3,14,64,81,1346
1372,1372,1691,1.2469135802469136,0.06218963481361076,81,1.2469135802469136,RUN! I think it came from a shit hole!,601,5,10,66,81,1346
1373,1373,1726,1.2469135802469136,0.05131259861881583,81,1.2469135802469136,I think it just wants a hug.,601,1,18,62,81,1346
1374,1374,1872,1.2469135802469136,0.05965658976962751,81,1.2469135802469136,"No matter which way you look at it, it follows you.",601,4,12,65,81,1346
1375,1375,1907,1.2469135802469136,0.05965658976962751,81,1.2469135802469136,It's sticking right with us.,601,4,12,65,81,1346
1376,1376,2059,1.2469135802469136,0.0570111105630559,81,1.2469135802469136,It looks too intelligent to be human.,601,3,14,64,81,1346
1377,1377,2073,1.2469135802469136,0.05131259861881583,81,1.2469135802469136,I warned you to stop staring at it.,601,1,18,62,81,1346
1378,1378,2089,1.2469135802469136,0.05965658976962751,81,1.2469135802469136,"OK, you can jog with us if you can keep up.",601,4,12,65,81,1346
1379,1379,2166,1.2469135802469136,0.0570111105630559,81,1.2469135802469136,Why can't you be normal and carry a canteen to hike in the desert?,601,3,14,64,81,1346
1380,1380,2308,1.2469135802469136,0.05965658976962751,81,1.2469135802469136,It really does thrive on neglect.,601,4,12,65,81,1346
1381,1381,2331,1.2469135802469136,0.0570111105630559,81,1.2469135802469136,"Hey, wait up...please don’t desert me.",601,3,14,64,81,1346
1382,1382,2334,1.2469135802469136,0.05965658976962751,81,1.2469135802469136,"No,... I don't want to try acupuncture!",601,4,12,65,81,1346
1383,1383,2347,1.2469135802469136,0.06218963481361076,81,1.2469135802469136,Keep up or you'll never lose that water weight.,601,5,10,66,81,1346
1384,1384,2402,1.2469135802469136,0.0570111105630559,81,1.2469135802469136,Adding mezcal to our canteens for local flavor might've been a mistake...,601,3,14,64,81,1346
1385,1385,2424,1.2469135802469136,0.06218963481361076,81,1.2469135802469136,Forget it -- the last time I let you run along side me it felt like I was having acupuncture.,601,5,10,66,81,1346
1386,1386,2539,1.2469135802469136,0.06218963481361076,81,1.2469135802469136,Looks like we can't run away from this prickly situation.,601,5,10,66,81,1346
1387,1387,2548,1.2469135802469136,0.054236747250589634,81,1.2469135802469136,And you complained about chafing while running?,601,2,16,63,81,1346
1388,1388,2639,1.2469135802469136,0.0570111105630559,81,1.2469135802469136,You're it!,601,3,14,64,81,1346
1389,1389,2697,1.2469135802469136,0.05965658976962751,81,1.2469135802469136,"Darn it, I told you not to pee on that cactus.",601,4,12,65,81,1346
1390,1390,2703,1.2469135802469136,0.0570111105630559,81,1.2469135802469136,"Honey, I'm getting a prickly sensation that someone is following us.",601,3,14,64,81,1346
1391,1391,2780,1.2469135802469136,0.06218963481361076,81,1.2469135802469136,Anything can be a dildo if you're brave enough,601,5,10,66,81,1346
1392,1392,2908,1.2469135802469136,0.054236747250589634,81,1.2469135802469136,You can stop running. It just signaled a touchdown.,601,2,16,63,81,1346
1393,1393,3084,1.2469135802469136,0.06218963481361076,81,1.2469135802469136,"Pace yourself, our friend behind us can go a long way without hydrating.",601,5,10,66,81,1346
1394,1394,3098,1.2469135802469136,0.05965658976962751,81,1.2469135802469136,I was told that this personal trainer may seem rough on the outside but soft on the inside.,601,4,12,65,81,1346
1395,1395,3133,1.2469135802469136,0.06218963481361076,81,1.2469135802469136,"Just ignore it, Martha. It's nothing but another attention-seeking prick.",601,5,10,66,81,1346
1396,1396,3157,1.2469135802469136,0.05965658976962751,81,1.2469135802469136,"oh come on, just one hug",601,4,12,65,81,1346
1397,1397,3160,1.2469135802469136,0.06218963481361076,81,1.2469135802469136,Can we keep him?,601,5,10,66,81,1346
1398,1398,3312,1.2469135802469136,0.0570111105630559,81,1.2469135802469136,You dumped me for a jogger?,601,3,14,64,81,1346
1399,1399,3353,1.2469135802469136,0.06218963481361076,81,1.2469135802469136,This wouldn’t have happened … if he built that wall!,601,5,10,66,81,1346
1400,1400,3390,1.2469135802469136,0.05965658976962751,81,1.2469135802469136,Looking sharp man,601,4,12,65,81,1346
1401,1401,3814,1.2469135802469136,0.0570111105630559,81,1.2469135802469136,Apparently the wall wasn't approved.,601,3,14,64,81,1346
1402,1402,3847,1.2469135802469136,0.054236747250589634,81,1.2469135802469136,"Wait up guys, I got a thorn in my shoe.",601,2,16,63,81,1346
1403,1403,3852,1.2469135802469136,0.05131259861881583,81,1.2469135802469136,What test site was it again we were jogging past?,601,1,18,62,81,1346
1404,1404,3870,1.2469135802469136,0.0570111105630559,81,1.2469135802469136,"Don't panic, but we're in a bit of a prickly situation...",601,3,14,64,81,1346
1405,1405,4008,1.2469135802469136,0.0570111105630559,81,1.2469135802469136,These new border guards are real pricks.,601,3,14,64,81,1346
1406,1406,4032,1.2469135802469136,0.0570111105630559,81,1.2469135802469136,"I know you drank a cup of water last month, but staying hydrated is important.",601,3,14,64,81,1346
1407,1407,4035,1.2469135802469136,0.05965658976962751,81,1.2469135802469136,And Lot's wife turned into a stone for The Wall,601,4,12,65,81,1346
1408,1408,4073,1.2469135802469136,0.054236747250589634,81,1.2469135802469136,I don't think we're in Jersey Anymore,601,2,16,63,81,1346
1409,1409,4091,1.2469135802469136,0.06218963481361076,81,1.2469135802469136,"Quick, he is hot on our trail....well, at least its' a dry heat",601,5,10,66,81,1346
1410,1410,4187,1.2469135802469136,0.05965658976962751,81,1.2469135802469136,A local cactus chases founders of Albuquerque's Annual Mezcal Festival out of town.,601,4,12,65,81,1346
1411,1411,4204,1.2469135802469136,0.06218963481361076,81,1.2469135802469136,So much for the wall...,601,5,10,66,81,1346
1412,1412,4315,1.2469135802469136,0.05965658976962751,81,1.2469135802469136,I guess Mexico responded to the Wall.,601,4,12,65,81,1346
1413,1413,4360,1.2469135802469136,0.054236747250589634,81,1.2469135802469136,I told you not to use so much Miracle Gro!,601,2,16,63,81,1346
1414,1414,4479,1.2469135802469136,0.05965658976962751,81,1.2469135802469136,"Actually, I think we’re about to feel even more alive.",601,4,12,65,81,1346
1415,1415,4510,1.2469135802469136,0.06218963481361076,81,1.2469135802469136,Here they come again! Cactus if you can!,601,5,10,66,81,1346
1416,1416,4591,1.2469135802469136,0.06218963481361076,81,1.2469135802469136,"In case one of us doesn't make it, we need to decide right now which social media site this goes on.",601,5,10,66,81,1346
1417,1417,4596,1.2469135802469136,0.054236747250589634,81,1.2469135802469136,I tried to tell you that the national parks were closed and that not ALL security personnel had been furloughed!,601,2,16,63,81,1346
1418,1418,4692,1.2469135802469136,0.06218963481361076,81,1.2469135802469136,"For such a prick, he's so friendly.",601,5,10,66,81,1346
1419,1419,4862,1.2469135802469136,0.054236747250589634,81,1.2469135802469136,Probably just an ICE agent in disguise.,601,2,16,63,81,1346
1420,1420,4883,1.2469135802469136,0.05965658976962751,81,1.2469135802469136,That’s Gumby. He got tired of being stopped for autographs.,601,4,12,65,81,1346
1421,1421,4892,1.2469135802469136,0.05965658976962751,81,1.2469135802469136,I guess not all of the locals like snowbirds.,601,4,12,65,81,1346
1422,1422,4902,1.2469135802469136,0.054236747250589634,81,1.2469135802469136,"Oh my God, I think he needs a hug!",601,2,16,63,81,1346
1423,1423,4903,1.2469135802469136,0.0570111105630559,81,1.2469135802469136,He pricked up at the word water,601,3,14,64,81,1346
1424,1424,4913,1.2469135802469136,0.05965658976962751,81,1.2469135802469136,"No, I don’t think those raised arms don’t mean he’s surrendered!",601,4,12,65,81,1346
1425,1425,4971,1.2469135802469136,0.05965658976962751,81,1.2469135802469136,They are taking back New Mexico!,601,4,12,65,81,1346
1426,1426,4992,1.2469135802469136,0.054236747250589634,81,1.2469135802469136,"Ah man, I could really use a hug...",601,2,16,63,81,1346
1427,1427,5003,1.2469135802469136,0.06218963481361076,81,1.2469135802469136,It's obviously been taken in by the global warming conspiracy.,601,5,10,66,81,1346
1428,1428,3017,1.2465753424657535,0.06100634345154056,73,1.2465753424657535,These fitness apps keep coming up with more creative ways of keeping you active!,601,3,12,58,73,1429
1429,1429,3491,1.2465753424657535,0.0640491330552764,73,1.2465753424657535,Come on I just want a hug!,601,4,10,59,73,1429
1430,1430,973,1.244186046511628,0.059491797849697776,86,1.244186046511628,"Run faster, it's cactusing up.",601,5,11,70,86,1431
1431,1431,168,1.2439024390243902,0.053655799114426375,82,1.2439024390243902,These mirages are getting stranger and stranger.,601,2,16,64,82,1432
1432,1432,183,1.2439024390243902,0.056392010966625515,82,1.2439024390243902,I think ICE is following us.,601,3,14,65,82,1432
