target_id,rank,funny,somewhat_funny,unfunny,count,score,precision,contest,caption
4856,2266,2,8,53,63,1.1904761904761905,0.05925438255602429,601,Do you think it’s a responding to climate change?
4794,2266,1,10,52,63,1.1904761904761905,0.054763574408528054,601,"Wow, this ""Running Scared"" virtual reality exercise app is really helping us stick to our New Year's resolutions."
4763,2266,3,6,54,63,1.1904761904761905,0.06342802710311082,601,This prick won't stop following us!
4666,2266,2,8,53,63,1.1904761904761905,0.05925438255602429,601,I wish it were as spineless as I feel.
4665,2266,2,8,53,63,1.1904761904761905,0.05925438255602429,601,Try throwing your water bottle at it.
4647,2266,2,8,53,63,1.1904761904761905,0.05925438255602429,601,This is a prickly situation.
4618,2266,3,6,54,63,1.1904761904761905,0.06342802710311082,601,Arizona really does have a water problem!
4552,2266,4,4,55,63,1.1904761904761905,0.06734350297014736,601,Have you noticed how FOMO is everywhere these days?
4491,2266,1,10,52,63,1.1904761904761905,0.054763574408528054,601,A penny for your hallucinations.
3531,2266,1,10,52,63,1.1904761904761905,0.054763574408528054,601,"So that's why they call it the cactus ""stalk""!"
4476,2266,2,8,53,63,1.1904761904761905,0.05925438255602429,601,'Hurry! It's trying to steal my moisturizer.'
4382,2266,1,10,52,63,1.1904761904761905,0.054763574408528054,601,There must be a goal line around here. He's signaling touchdown.
4376,2266,2,8,53,63,1.1904761904761905,0.05925438255602429,601,So that’s why they call it Death Valley.
4344,2266,2,8,53,63,1.1904761904761905,0.05925438255602429,601,Maybe we should let him pass.
4301,2266,1,10,52,63,1.1904761904761905,0.054763574408528054,601,"He won't fit in the jeep, and he'd scare the dog. So no, you can't take him home."
4192,2266,1,10,52,63,1.1904761904761905,0.054763574408528054,601,He reminds me of someone.
4149,2266,1,10,52,63,1.1904761904761905,0.054763574408528054,601,"John, wait up. The saguaro wants a drink."
3988,2266,2,8,53,63,1.1904761904761905,0.05925438255602429,601,I told you not to feed him trail mix; now we'll never be rid of him
3942,2266,2,8,53,63,1.1904761904761905,0.05925438255602429,601,Uh oh. Arpaio is back.
3923,2266,2,8,53,63,1.1904761904761905,0.05925438255602429,601,It's that prick again!
3876,2266,1,10,52,63,1.1904761904761905,0.054763574408528054,601,"That's the one that's 6'3"" and weighs 239 pounds."
2626,2266,1,10,52,63,1.1904761904761905,0.054763574408528054,601,"Slow down guys, I'm feeling a little dehydrated."
3791,2266,1,10,52,63,1.1904761904761905,0.054763574408528054,601,He's not that fast but we better be careful at the next water stop...
3788,2266,3,6,54,63,1.1904761904761905,0.06342802710311082,601,"Honey, he says you’re spineless."
4401,2266,2,8,53,63,1.1904761904761905,0.05925438255602429,601,"Cactus today, soreguaro tomorrow."
2596,2266,3,6,54,63,1.1904761904761905,0.06342802710311082,601,We did move to the desert to get away from pricks.
2448,2266,3,6,54,63,1.1904761904761905,0.06342802710311082,601,I'm not sticking around to find out
2554,2266,2,8,53,63,1.1904761904761905,0.05925438255602429,601,Remember that Twitter account Cactus you unfollowed ? It's following us.
1373,2266,2,8,53,63,1.1904761904761905,0.05925438255602429,601,Ah...Honey did you say Cactus or Catch us?
1344,2266,2,8,53,63,1.1904761904761905,0.05925438255602429,601,Something tells me we're not in Kansas anymore.
1318,2266,2,8,53,63,1.1904761904761905,0.05925438255602429,601,Should i tell it you get more power if you pump your arms by your sides?
1316,2266,2,8,53,63,1.1904761904761905,0.05925438255602429,601,You go on ahead Jeremy. I'll be fine. I'm just gonna run with Chad for a little while.
1239,2266,1,10,52,63,1.1904761904761905,0.054763574408528054,601,He's always been a prickly sonfoabitch.
1238,2266,1,10,52,63,1.1904761904761905,0.054763574408528054,601,I think we are running too slow.
1206,2266,3,6,54,63,1.1904761904761905,0.06342802710311082,601,"Really, we don't drink Tequila!"
1141,2266,2,8,53,63,1.1904761904761905,0.05925438255602429,601,"Look—it's me, not you. I'm sorry, OK?"
1019,2266,1,10,52,63,1.1904761904761905,0.054763574408528054,601,These organic water bottles are scary
996,2266,4,4,55,63,1.1904761904761905,0.06734350297014736,601,"Honey, the mirage is requesting a comfort break."
989,2266,2,8,53,63,1.1904761904761905,0.05925438255602429,601,I keep telling you that wasn't our dog.
962,2266,1,10,52,63,1.1904761904761905,0.054763574408528054,601,"Wait, don't desert me!"
827,2266,3,6,54,63,1.1904761904761905,0.06342802710311082,601,I wouldn't have mentioned it if I weren't sure.
824,2266,3,6,54,63,1.1904761904761905,0.06342802710311082,601,Does this make us deserters?
775,2266,2,8,53,63,1.1904761904761905,0.05925438255602429,601,"Guys I’m not a regular plant, I’m a cool plant!"
727,2266,0,12,51,63,1.1904761904761905,0.04986999410368025,601,"Miracle of science or not, he's slowing us down."
715,2266,2,8,53,63,1.1904761904761905,0.05925438255602429,601,RE-CRIMINALIZE. MARIJUANA. NOW.
540,2266,3,6,54,63,1.1904761904761905,0.06342802710311082,601,Braaaad...are there such things as carnivorous cactus?
468,2266,1,10,52,63,1.1904761904761905,0.054763574408528054,601,Hurry! He's hot on our trail.
445,2266,3,6,54,63,1.1904761904761905,0.06342802710311082,601,"I know runners can be surly, but that guy's a real prick."
438,2266,1,10,52,63,1.1904761904761905,0.054763574408528054,601,"Bob, I have had it with your followers and their organic reaching. I see you ad. I see you."
421,2266,2,8,53,63,1.1904761904761905,0.05925438255602429,601,Whomever came up with these new border security requirements is a real prick
275,2266,1,10,52,63,1.1904761904761905,0.054763574408528054,601,We're also trying to lose some water weight.
144,2266,1,10,52,63,1.1904761904761905,0.054763574408528054,601,Following us is one thing.Taunting us is another matter.
85,2266,2,8,53,63,1.1904761904761905,0.05925438255602429,601,"Slow down, Bob. I think Mr. Sessions is running out of breath."
23,2266,2,8,53,63,1.1904761904761905,0.05925438255602429,601,It shouldn't be allowed to race - such an unfair hydration advantage.
2564,2266,3,6,54,63,1.1904761904761905,0.06342802710311082,601,It's such a close race... let's call it a cac-tie.
1383,2266,4,4,55,63,1.1904761904761905,0.06734350297014736,601,A good waxing and your love life is bound to improve.
1446,2266,3,6,54,63,1.1904761904761905,0.06342802710311082,601,"Hi, y'all!"
1334,2266,3,6,54,63,1.1904761904761905,0.06342802710311082,601,Make sure you stay hydrated!
1511,2266,2,8,53,63,1.1904761904761905,0.05925438255602429,601,I guess John forgot to hydrate.
2522,2266,2,8,53,63,1.1904761904761905,0.05925438255602429,601,Cacti just tag along?
2496,2266,0,12,51,63,1.1904761904761905,0.04986999410368025,601,I don't find barefoot runners as impressive as I used to.
2371,2266,1,10,52,63,1.1904761904761905,0.054763574408528054,601,FASTER !
2325,2266,2,8,53,63,1.1904761904761905,0.05925438255602429,601,No fair. It doesn't need to hydrate
2312,2266,3,6,54,63,1.1904761904761905,0.06342802710311082,601,You think this is bad? I gave birth to you.
2284,2266,2,8,53,63,1.1904761904761905,0.05925438255602429,601,You're such a prick.
2281,2266,2,8,53,63,1.1904761904761905,0.05925438255602429,601,Our new fitness instructor is a prick.
2264,2266,3,6,54,63,1.1904761904761905,0.06342802710311082,601,Joshua Tree sucks...
2210,2266,2,8,53,63,1.1904761904761905,0.05925438255602429,601,Don't forget to stay hydrated!
1502,2266,2,8,53,63,1.1904761904761905,0.05925438255602429,601,"honey , I think I spotted a deserter on the run"
2085,2266,0,12,51,63,1.1904761904761905,0.04986999410368025,601,Tequilla!
2070,2266,1,10,52,63,1.1904761904761905,0.054763574408528054,601,I still think it’s a mirage
2046,2266,2,8,53,63,1.1904761904761905,0.05925438255602429,601,Who's a good boy?
2037,2266,1,10,52,63,1.1904761904761905,0.054763574408528054,601,Strange. I've never seen a two legged cactus before.
2149,2266,3,6,54,63,1.1904761904761905,0.06342802710311082,601,"I'm keeping a cacti on you, mister!"
1971,2266,2,8,53,63,1.1904761904761905,0.05925438255602429,601,Are you sure it's a mirage?
1518,2266,4,4,55,63,1.1904761904761905,0.06734350297014736,601,Saguaro ya from?
2016,2266,1,10,52,63,1.1904761904761905,0.054763574408528054,601,"Who knew the Siguaro were so sensitive about their name? I told you the ""g"" was silent!"
1530,2266,2,8,53,63,1.1904761904761905,0.05925438255602429,601,We can tell our friends that we spotted Big Foot in Arizona.
1621,2266,1,10,52,63,1.1904761904761905,0.054763574408528054,601,See...I told you jogging was for pricks.
1703,2266,2,8,53,63,1.1904761904761905,0.05925438255602429,601,I thought 'Cactus Jack' was a myth.
1787,2266,0,12,51,63,1.1904761904761905,0.04986999410368025,601,Do you get the feeling that we’re getting nowhere?
1529,2266,2,8,53,63,1.1904761904761905,0.05925438255602429,601,You really shouldn't have relieved yourself by that cactus!
1837,2266,1,10,52,63,1.1904761904761905,0.054763574408528054,601,Did you say your trainer was a transplant?
1873,2266,1,10,52,63,1.1904761904761905,0.054763574408528054,601,He always brings up thorny issues.
1889,2266,1,10,52,63,1.1904761904761905,0.054763574408528054,601,I'm sorry I called you prickly.
1950,2266,2,8,53,63,1.1904761904761905,0.05925438255602429,601,"Uh, was Gumby by any chance a ten-foot tall cactus?"
1965,2266,2,8,53,63,1.1904761904761905,0.05925438255602429,601,"I’m saguaro for what I said, I’m not a prick."
1819,2266,1,10,52,63,1.1904761904761905,0.054763574408528054,601,I guess it's catch as cactus can...
3174,2389,2,8,54,64,1.1875,0.058397074018894594,601,""" I think he is signaling a right turn""."
3384,2389,2,8,54,64,1.1875,0.058397074018894594,601,Reverse tree hugging
3448,2389,2,8,54,64,1.1875,0.058397074018894594,601,Can we at least speed up to a snail's pace?!
3782,2389,4,4,56,64,1.1875,0.06634969288573796,601,"You did get the lubricant, didn't you?"
4251,2389,3,6,55,64,1.1875,0.0625,601,I officially hate the person who invented Free Hug Day.
4297,2389,1,10,53,64,1.1875,0.053983205795288855,601,He's such a slowpoke.
4804,2389,3,6,55,64,1.1875,0.0625,601,"We knew they were a protected species, but I guess we shouldn't have taken the saguaro cactus's photo."
4927,2389,0,12,52,64,1.1875,0.0491747370293402,601,Should I get my phone out and try to capture it?
2975,2389,1,10,53,64,1.1875,0.053983205795288855,601,You're it!
3995,2389,0,12,52,64,1.1875,0.0491747370293402,601,Runners really DO come in all shapes and sizes!
2846,2389,1,10,53,64,1.1875,0.053983205795288855,601,"Remember that goofy sci-fi thriller called ""The Cactus Attacked Us?"""
1467,2389,3,6,55,64,1.1875,0.0625,601,Can we keep him? He won't take any care at all and I just know he'll get along great with the gardener!
2170,2389,3,6,55,64,1.1875,0.0625,601,Do you think he knows?
1818,2389,3,6,55,64,1.1875,0.0625,601,Don’t look now but a big prick is following us!
1774,2389,4,4,56,64,1.1875,0.06634969288573796,601,Next time we should each just carry a camelback with water.
1482,2389,3,6,55,64,1.1875,0.0625,601,"Jim, either I'm hallucinating or we've over shot our goal."
1415,2389,1,10,53,64,1.1875,0.053983205795288855,601,This could turn into a rather prickly situation
1253,2389,2,8,54,64,1.1875,0.058397074018894594,601,Not strange as we're jogging along a boarder. Agreed. But this is the boarder with Canada.
1135,2389,4,4,56,64,1.1875,0.06634969288573796,601,"Yep, still there. What a prick!"
1066,2389,1,10,53,64,1.1875,0.053983205795288855,601,It looks like Charlie didn't hydrate enough.
796,2389,2,8,54,64,1.1875,0.058397074018894594,601,look at this prick
414,2389,2,8,54,64,1.1875,0.058397074018894594,601,Looks like we're being tailed by some tall pricks.
2519,2389,2,8,54,64,1.1875,0.058397074018894594,601,Global warming… the northern migration.
3255,2412,1,9,50,60,1.1833333333333333,0.05570131537800454,601,Red light!
3338,2412,2,7,51,60,1.1833333333333333,0.060560781750670575,601,I heard jogging might help me lose some of this water weight.
3346,2412,1,9,50,60,1.1833333333333333,0.05570131537800454,601,I think it's trying to surrender to us.
3349,2412,3,5,52,60,1.1833333333333333,0.06505828185300302,601,"I know it was an emergency, but you should've held it til came to a rest stop."
3442,2412,0,11,49,60,1.1833333333333333,0.05037523978531016,601,"Slow down, I think he’s rooting."
3434,2412,1,9,50,60,1.1833333333333333,0.05570131537800454,601,"We can stop running, he's got his hands up."
3438,2412,2,7,51,60,1.1833333333333333,0.060560781750670575,601,"Hey honey, do you someone by the name 'Spike'?"
3251,2412,1,9,50,60,1.1833333333333333,0.05570131537800454,601,I told you not to wear your Free Hugs t-shirt!
3429,2412,1,9,50,60,1.1833333333333333,0.05570131537800454,601,I warned you about prickly heat.
3207,2412,2,7,51,60,1.1833333333333333,0.060560781750670575,601,I need a drink of water.
2821,2412,1,9,50,60,1.1833333333333333,0.05570131537800454,601,"Jogging has become a real adventure, now that marijuana is legal."
3146,2412,2,7,51,60,1.1833333333333333,0.060560781750670575,601,I think his weight loss is mainly water.
3009,2412,1,9,50,60,1.1833333333333333,0.05570131537800454,601,"Wow, it’s a giant Weinstenium species of cactus. They’re all over LA but I’ve never seen one in the wild before."
2912,2412,4,3,53,60,1.1833333333333333,0.06926436160881881,601,another unfunny cartoon
3628,2412,2,7,51,60,1.1833333333333333,0.060560781750670575,601,"You know, something about this new friend of yours just gives me pins and needles."
2801,2412,2,7,51,60,1.1833333333333333,0.060560781750670575,601,"I think I am getting now this idea of, you know ,""global warming"" ...."
2691,2412,0,11,49,60,1.1833333333333333,0.05037523978531016,601,I just told him to speed up a little and he got all prickly. Let's bring our dog instead next time.
2638,2412,1,9,50,60,1.1833333333333333,0.05570131537800454,601,That pervert is following us again!
2569,2412,2,7,51,60,1.1833333333333333,0.060560781750670575,601,It's really sticking with us.
2540,2412,2,7,51,60,1.1833333333333333,0.060560781750670575,601,I think we've been jogging in the desert too long.
2491,2412,0,11,49,60,1.1833333333333333,0.05037523978531016,601,We're really only 5% water!
2381,2412,2,7,51,60,1.1833333333333333,0.060560781750670575,601,At this moment Jeff realizes his private investigation career may be over.
3171,2412,3,5,52,60,1.1833333333333333,0.06505828185300302,601,Desert lives matter.
3646,2412,2,7,51,60,1.1833333333333333,0.060560781750670575,601,"Hurry, Hector - I think ICE is onto us!"
3844,2412,2,7,51,60,1.1833333333333333,0.060560781750670575,601,But I never got hugs growing up!
3731,2412,2,7,51,60,1.1833333333333333,0.060560781750670575,601,I told you it was bad karma to try the cucumber trick on the cat.
2277,2412,0,11,49,60,1.1833333333333333,0.05037523978531016,601,"Don’t worry, it’s got small feet."
5001,2412,3,5,52,60,1.1833333333333333,0.06505828185300302,601,We should've stayed in New York.
4991,2412,2,7,51,60,1.1833333333333333,0.060560781750670575,601,You need to lean in.
4987,2412,1,9,50,60,1.1833333333333333,0.05570131537800454,601,Yikes! The Abominable Cactus Man!
4859,2412,0,11,49,60,1.1833333333333333,0.05037523978531016,601,Your directions are very vague.
4664,2412,2,7,51,60,1.1833333333333333,0.060560781750670575,601,I told you we shouldn't have fed him!
4532,2412,0,11,49,60,1.1833333333333333,0.05037523978531016,601,Why so prickly? We're leaving!
4463,2412,1,9,50,60,1.1833333333333333,0.05570131537800454,601,Isn't it what's on the inside that counts?
4422,2412,1,9,50,60,1.1833333333333333,0.05570131537800454,601,Saguaro you want?
4354,2412,1,9,50,60,1.1833333333333333,0.05570131537800454,601,"You know, we have a bunch of senators and representatives who could use some spines."
4188,2412,3,5,52,60,1.1833333333333333,0.06505828185300302,601,"Hey! There is no ""us"" in Cacti."
4128,2412,2,7,51,60,1.1833333333333333,0.060560781750670575,601,Global Warming has sure changed since I was a kid.
4127,2412,2,7,51,60,1.1833333333333333,0.060560781750670575,601,"Look, honey, we just passed a nine-foot prick."
4097,2412,1,9,50,60,1.1833333333333333,0.05570131537800454,601,"Don't worry, you only need to outrun the slowest cactus."
4054,2412,2,7,51,60,1.1833333333333333,0.060560781750670575,601,He'll stop chasing us when he gets thirsty
4010,2412,2,7,51,60,1.1833333333333333,0.060560781750670575,601,But the sign said no cactus harassment within park limits.
3985,2412,1,9,50,60,1.1833333333333333,0.05570131537800454,601,This wouldn't have happened if we had just gotten a succulent.
3966,2412,2,7,51,60,1.1833333333333333,0.060560781750670575,601,This dry run was a bad idea!
3924,2412,0,11,49,60,1.1833333333333333,0.05037523978531016,601,Heel to toe! Heel to toe!
3900,2412,3,5,52,60,1.1833333333333333,0.06505828185300302,601,Not to worry. It's just trying to escape global warming
3831,2412,1,9,50,60,1.1833333333333333,0.05570131537800454,601,Want to rethink that restraint order?
3816,2412,4,3,53,60,1.1833333333333333,0.06926436160881881,601,I bet it is chasing you. Let's split..
3789,2412,1,9,50,60,1.1833333333333333,0.05570131537800454,601,We'll try your hydration tips.
3657,2412,0,11,49,60,1.1833333333333333,0.05037523978531016,601,"Apparently, the agave used for all the tequila we’ve been drinking are distant cousins of hers."
2194,2412,2,7,51,60,1.1833333333333333,0.060560781750670575,601,I told you that guy at the costume party was a creep.
4361,2412,0,11,49,60,1.1833333333333333,0.05037523978531016,601,"Keep moving, global warming is gaining on us."
2132,2412,3,5,52,60,1.1833333333333333,0.06505828185300302,601,Honey. Did you relieve you self on a cactus before our morning run?
919,2412,0,11,49,60,1.1833333333333333,0.05037523978531016,601,His friends keep deserting him.
914,2412,2,7,51,60,1.1833333333333333,0.060560781750670575,601,I'm starting to feel that prick on my back .
862,2412,2,7,51,60,1.1833333333333333,0.060560781750670575,601,"darling, why is there a cactus following us?"" ""You remember Micheal our new bodyguard don't you sweetheart..."
784,2412,1,9,50,60,1.1833333333333333,0.05570131537800454,601,Puta Madre
741,2412,2,7,51,60,1.1833333333333333,0.060560781750670575,601,"Honey, when you said I was succulent, did you have your glasses on?"
685,2412,2,7,51,60,1.1833333333333333,0.060560781750670575,601,Prick up the pace.
666,2412,3,5,52,60,1.1833333333333333,0.06505828185300302,601,It’s true: desertification is advancing rapidly.
562,2412,2,7,51,60,1.1833333333333333,0.060560781750670575,601,Go faster! I know a prick when I see one!
558,2412,1,9,50,60,1.1833333333333333,0.05570131537800454,601,I think I need to step up my jogging goals.
546,2412,2,7,51,60,1.1833333333333333,0.060560781750670575,601,Please just tell me why I have footprints and you don’t.
954,2412,0,11,49,60,1.1833333333333333,0.05037523978531016,601,About that feeling of being followed...
538,2412,1,9,50,60,1.1833333333333333,0.05570131537800454,601,We should capture this thing and charge people get chased by it - I've never been more motivated to exercise in my life!
482,2412,2,7,51,60,1.1833333333333333,0.060560781750670575,601,Everyone seems to be doing cactusthenics these days.
389,2412,1,9,50,60,1.1833333333333333,0.05570131537800454,601,Don't let it give you a consensual hug.
2169,2412,2,7,51,60,1.1833333333333333,0.060560781750670575,601,Saguaro you guys off to so fast?
387,2412,1,9,50,60,1.1833333333333333,0.05570131537800454,601,"Despite a perfect record in testing, Sally was still unsure whether the rape-proof jogging suit would prove to be a commercial success."
320,2412,0,11,49,60,1.1833333333333333,0.05037523978531016,601,"Well, this jogging in the desert idea of yours certainly has attracted a following."
292,2412,1,9,50,60,1.1833333333333333,0.05570131537800454,601,That's poor runner form.
265,2412,5,1,54,60,1.1833333333333333,0.07322925331102074,601,"This is late, but for the contest in Jan 15 issue: ""I said to beam me up a Scottie!"""
251,2412,3,5,52,60,1.1833333333333333,0.06505828185300302,601,I knew we never should’ve gone to Burning Man!
148,2412,1,9,50,60,1.1833333333333333,0.05570131537800454,601,"Yes, it's a dry town. I know where you can get a drink."
19,2412,3,5,52,60,1.1833333333333333,0.06505828185300302,601,"Caption #600 - ""I said to beam me up a Scotty"" Submitted prior to 11:59 1/14 (11:37 ET) and not sure why #601 is already posted. TY."
527,2412,2,7,51,60,1.1833333333333333,0.060560781750670575,601,He hasn't stopped at a single water station!
965,2412,1,9,50,60,1.1833333333333333,0.05570131537800454,601,"Honey, are you wearing your Cool Water cologne?"
243,2412,1,9,50,60,1.1833333333333333,0.05570131537800454,601,Honey... I think we need to pick it up a bit...
1115,2412,1,9,50,60,1.1833333333333333,0.05570131537800454,601,"""These desert mirages sure are scary-lifelike ""."
2033,2412,0,11,49,60,1.1833333333333333,0.05037523978531016,601,"I've already told you, you're not getting my water"
1997,2412,2,7,51,60,1.1833333333333333,0.060560781750670575,601,"This is more of a dry run for me, ahead of the big race."
1986,2412,2,7,51,60,1.1833333333333333,0.060560781750670575,601,Keep those hands where I can see them.
1983,2412,1,9,50,60,1.1833333333333333,0.05570131537800454,601,"Doris, those tequila shots are catching up with us."
1941,2412,1,9,50,60,1.1833333333333333,0.05570131537800454,601,"I don't care what you think, I'm not a plant lady!"
1909,2412,0,11,49,60,1.1833333333333333,0.05037523978531016,601,I think it is a Catchtus
1881,2412,2,7,51,60,1.1833333333333333,0.060560781750670575,601,I liked my mirage better.
1048,2412,3,5,52,60,1.1833333333333333,0.06505828185300302,601,"The date palm oil is working.....just 50 yards to the truck, and 20,000 smackers!"
1758,2412,2,7,51,60,1.1833333333333333,0.060560781750670575,601,I think he just needs a hug. He's worried Trump is going to deport him.
1737,2412,2,7,51,60,1.1833333333333333,0.060560781750670575,601,Looks like we've found ourselves in a prickle
1655,2412,1,9,50,60,1.1833333333333333,0.05570131537800454,601,It seems to think we're off to see the Wizard of Albuquerque.
1868,2412,2,7,51,60,1.1833333333333333,0.060560781750670575,601,Do you ever get the feeling you're being followed?
1617,2412,1,9,50,60,1.1833333333333333,0.05570131537800454,601,If he's trying to surrender why is he still following us?
1159,2412,1,9,50,60,1.1833333333333333,0.05570131537800454,601,We're being stalked.
1647,2412,2,7,51,60,1.1833333333333333,0.060560781750670575,601,"Yes, but we need to stop for water, you don't!"
1281,2412,1,9,50,60,1.1833333333333333,0.05570131537800454,601,Wouldn’t a dog be better?
1309,2412,2,7,51,60,1.1833333333333333,0.060560781750670575,601,Don't let it needle you.
1338,2412,1,9,50,60,1.1833333333333333,0.05570131537800454,601,You are very prickly today!
1183,2412,1,9,50,60,1.1833333333333333,0.05570131537800454,601,I have a prickly feeling someone is following us.
1418,2412,2,7,51,60,1.1833333333333333,0.060560781750670575,601,Hurry! I think the undercover border patrol guard is on to us!
1524,2412,0,11,49,60,1.1833333333333333,0.05037523978531016,601,It kind of gives me the creeps when they use me as their pacesetter.
1568,2412,2,7,51,60,1.1833333333333333,0.060560781750670575,601,I give up!
1581,2412,1,9,50,60,1.1833333333333333,0.05570131537800454,601,I just want to be friends. I'm not the prick you think I am.
1360,2412,1,9,50,60,1.1833333333333333,0.05570131537800454,601,The flora in this state are so competitive!
2461,2515,2,7,52,61,1.180327868852459,0.05963548986123849,601,Worst California theme park ever.
2683,2515,3,5,53,61,1.180327868852459,0.06405341316761795,601,you're being paranoid again.
2751,2515,1,9,51,61,1.180327868852459,0.05486295255961152,601,Go faster! He's really trying to stick it to us!
2983,2515,0,11,50,61,1.180327868852459,0.04963361236225398,601,"I get it, Coach. We need to stay hydrated."
3058,2515,0,11,50,61,1.180327868852459,0.04963361236225398,601,"Don't look now, Hon, but I think we're being followed."
3124,2515,1,9,51,61,1.180327868852459,0.05486295255961152,601,"Faster!, I think it's arms are moving toward a hug"
3215,2515,2,7,52,61,1.180327868852459,0.05963548986123849,601,"There was a cowboy, a construction worker...but I don't remember a cactus as part of the Village People."
3287,2515,1,9,51,61,1.180327868852459,0.05486295255961152,601,Climate change must be real. He followed us to Oregon!
3875,2515,2,7,52,61,1.180327868852459,0.05963548986123849,601,Your smart assistant has sent a ton of water alright...
4761,2515,1,9,51,61,1.180327868852459,0.05486295255961152,601,"See? I told you if we try to blend in and stay still, the wonders of nature will come to us."
4023,2515,0,11,50,61,1.180327868852459,0.04963361236225398,601,"Look, he's trying to follow in our footsteps..."
4229,2515,1,9,51,61,1.180327868852459,0.05486295255961152,601,"Huh. Apparently, they don't run out of steam either."
4337,2515,3,5,53,61,1.180327868852459,0.06405341316761795,601,It's a bit spineless for a half marathon.
4353,2515,2,7,52,61,1.180327868852459,0.05963548986123849,601,I suppose we are getting our just deserts.
4394,2515,1,9,51,61,1.180327868852459,0.05486295255961152,601,I think it knows we're made of water.
4534,2515,2,7,52,61,1.180327868852459,0.05963548986123849,601,We know it’s you Wile E.
4537,2515,2,7,52,61,1.180327868852459,0.05963548986123849,601,"Watch out, it’s a succulent!"
4753,2515,0,11,50,61,1.180327868852459,0.04963361236225398,601,Coyote on our six.
2346,2515,2,7,52,61,1.180327868852459,0.05963548986123849,601,All I said was 'aloe' and now it appears to be following us.
3961,2515,3,5,53,61,1.180327868852459,0.06405341316761795,601,"What are you running from?. It is I, your border security."
2110,2515,2,7,52,61,1.180327868852459,0.05963548986123849,601,And I thought I had a thorn in my side...
