,Unnamed: 0,target_id,mean,precision,count,score,caption,contest,funny,somewhat_funny,unfunny,counts,rank
3685,3685,245,1.1136363636363635,0.05830506897872832,44,1.1136363636363635,You're lagging. A thorn in your side is no excuse.,601,1,3,40,44,3686
3686,3686,1541,1.1136363636363635,0.04839833278309262,44,1.1136363636363635,"I think we're being stalked, honey.",601,0,5,39,44,3686
3687,3687,21,1.1111111111111112,0.04737793696791343,45,1.1111111111111112,"Honey, I'd suguaro it's following us.",601,0,5,40,45,3688
3688,3688,111,1.1111111111111112,0.057050590894718936,45,1.1111111111111112,I think we are being targeted by a North Korean missile!,601,1,3,41,45,3688
3689,3689,156,1.1111111111111112,0.057050590894718936,45,1.1111111111111112,I told you if you ordered the cactus salad it would eventually catch up with you.,601,1,3,41,45,3688
3690,3690,229,1.1111111111111112,0.057050590894718936,45,1.1111111111111112,You shouldn't have mentioned our hotel pool a minute ago.,601,1,3,41,45,3688
3691,3691,250,1.1111111111111112,0.057050590894718936,45,1.1111111111111112,"Oh no, it's that needling cactus again!",601,1,3,41,45,3688
3692,3692,329,1.1111111111111112,0.057050590894718936,45,1.1111111111111112,"This is a MeToo moment, big man. All I have to do is out-run you.",601,1,3,41,45,3688
3693,3693,348,1.1111111111111112,0.04737793696791343,45,1.1111111111111112,"Let's get out of here, Dave. Sasquatch's cousin is in a prickly mood.",601,0,5,40,45,3688
3694,3694,368,1.1111111111111112,0.04737793696791343,45,1.1111111111111112,Natural running! Cool!,601,0,5,40,45,3688
3695,3695,417,1.1111111111111112,0.057050590894718936,45,1.1111111111111112,"Honey, I think you over-watered the cactus again",601,1,3,41,45,3688
3696,3696,423,1.1111111111111112,0.04737793696791343,45,1.1111111111111112,And who's going to die of thirst?,601,0,5,40,45,3688
3697,3697,465,1.1111111111111112,0.057050590894718936,45,1.1111111111111112,I just want to get a selfie!,601,1,3,41,45,3688
3698,3698,486,1.1111111111111112,0.057050590894718936,45,1.1111111111111112,When cactus man dances we u turn back to camp.,601,1,3,41,45,3688
3699,3699,501,1.1111111111111112,0.057050590894718936,45,1.1111111111111112,I told you that’s impossible.,601,1,3,41,45,3688
3700,3700,533,1.1111111111111112,0.04737793696791343,45,1.1111111111111112,That Taco Time mascot's gaining on us!,601,0,5,40,45,3688
3701,3701,548,1.1111111111111112,0.057050590894718936,45,1.1111111111111112,"I told you,we left our IDs at the house.",601,1,3,41,45,3688
3702,3702,578,1.1111111111111112,0.057050590894718936,45,1.1111111111111112,Submission 672: Border Patrol Cacti. All those in Favor?,601,1,3,41,45,3688
3703,3703,617,1.1111111111111112,0.057050590894718936,45,1.1111111111111112,He gets so prickly whenever we pass him.,601,1,3,41,45,3688
3704,3704,618,1.1111111111111112,0.057050590894718936,45,1.1111111111111112,The natives will do anything to avoid an entry fee for the marathon!,601,1,3,41,45,3688
3705,3705,765,1.1111111111111112,0.04737793696791343,45,1.1111111111111112,You won’t believe the last friend request I got.,601,0,5,40,45,3688
3706,3706,837,1.1111111111111112,0.057050590894718936,45,1.1111111111111112,Men are such pricks.,601,1,3,41,45,3688
3707,3707,933,1.1111111111111112,0.057050590894718936,45,1.1111111111111112,"Honey, I think we're being followed.",601,1,3,41,45,3688
3708,3708,1005,1.1111111111111112,0.04737793696791343,45,1.1111111111111112,"Listen! I said No, you big prick!",601,0,5,40,45,3688
3709,3709,1155,1.1111111111111112,0.057050590894718936,45,1.1111111111111112,"Ah, are we running anywhere near a colder climate?",601,1,3,41,45,3688
3710,3710,1162,1.1111111111111112,0.057050590894718936,45,1.1111111111111112,I'm afraid Nature final decided it wants to be one with us.,601,1,3,41,45,3688
3711,3711,1173,1.1111111111111112,0.057050590894718936,45,1.1111111111111112,That fucking cactus is moving,601,1,3,41,45,3688
3712,3712,1176,1.1111111111111112,0.04737793696791343,45,1.1111111111111112,No it ‘s not doing saguaro Zumba.,601,0,5,40,45,3688
3713,3713,1193,1.1111111111111112,0.06530597929391763,45,1.1111111111111112,Looks like Gumby has developed a bad case of acne.,601,2,1,42,45,3688
3714,3714,1254,1.1111111111111112,0.057050590894718936,45,1.1111111111111112,"I think we're doing this wrong, honey.",601,1,3,41,45,3688
3715,3715,1272,1.1111111111111112,0.057050590894718936,45,1.1111111111111112,"And for God's sake, try to keep up!",601,1,3,41,45,3688
3716,3716,1347,1.1111111111111112,0.04737793696791343,45,1.1111111111111112,2018 Sodom and Gomorrah Marathon,601,0,5,40,45,3688
3717,3717,1372,1.1111111111111112,0.057050590894718936,45,1.1111111111111112,"Yes, Captain Picarf.",601,1,3,41,45,3688
3718,3718,1411,1.1111111111111112,0.057050590894718936,45,1.1111111111111112,I think it wants to tell us something,601,1,3,41,45,3688
3719,3719,1444,1.1111111111111112,0.04737793696791343,45,1.1111111111111112,Cact-us r us,601,0,5,40,45,3688
3720,3720,1457,1.1111111111111112,0.04737793696791343,45,1.1111111111111112,"Following their scent inconspicuously for hours, Carl was finally closing in on the humans. He could almost taste their sweet sweat.",601,0,5,40,45,3688
3721,3721,1477,1.1111111111111112,0.04737793696791343,45,1.1111111111111112,Honey...don't look back!,601,0,5,40,45,3688
3722,3722,1481,1.1111111111111112,0.04737793696791343,45,1.1111111111111112,"""I shall avenge Spike!"" (Apologies to Charles Schulz)",601,0,5,40,45,3688
3723,3723,1483,1.1111111111111112,0.057050590894718936,45,1.1111111111111112,"Self, you are not going to be jealous of a plant.",601,1,3,41,45,3688
3724,3724,1527,1.1111111111111112,0.04737793696791343,45,1.1111111111111112,"To help assist Amanda with rent and utilities, Linda and Michael decided to forgo their gym membership and push their retirement date out another two years.",601,0,5,40,45,3688
3725,3725,1578,1.1111111111111112,0.057050590894718936,45,1.1111111111111112,I’m coming with you. I can’t stand how warm it’s getting out here!,601,1,3,41,45,3688
3726,3726,1601,1.1111111111111112,0.04737793696791343,45,1.1111111111111112,"Come on, Honey. Prickly Foot is only a desert hallucination.",601,0,5,40,45,3688
3727,3727,1642,1.1111111111111112,0.04737793696791343,45,1.1111111111111112,"Hey, don't leave me alone out here with no water.",601,0,5,40,45,3688
3728,3728,1762,1.1111111111111112,0.04737793696791343,45,1.1111111111111112,Metaphor for that one person at the office,601,0,5,40,45,3688
3729,3729,1813,1.1111111111111112,0.057050590894718936,45,1.1111111111111112,Saguaro! Saguaro! I love ya Saguaro! You're always a day away!,601,1,3,41,45,3688
3730,3730,2054,1.1111111111111112,0.04737793696791343,45,1.1111111111111112,I think he wants to sell us more peyote buttons.,601,0,5,40,45,3688
3731,3731,2174,1.1111111111111112,0.04737793696791343,45,1.1111111111111112,All I said was how sad it was pearless.,601,0,5,40,45,3688
3732,3732,2300,1.1111111111111112,0.04737793696791343,45,1.1111111111111112,Don't forget to hydrate!,601,0,5,40,45,3688
3733,3733,2341,1.1111111111111112,0.057050590894718936,45,1.1111111111111112,Are we chasing him? Or is he chasing us?,601,1,3,41,45,3688
3734,3734,2389,1.1111111111111112,0.057050590894718936,45,1.1111111111111112,A bellwether walk-run race is to be held for them in the next Olympics.,601,1,3,41,45,3688
3735,3735,2418,1.1111111111111112,0.04737793696791343,45,1.1111111111111112,I think it’s about to give up.,601,0,5,40,45,3688
3736,3736,2432,1.1111111111111112,0.057050590894718936,45,1.1111111111111112,Why cacti jog with you?,601,1,3,41,45,3688
3737,3737,2485,1.1111111111111112,0.04737793696791343,45,1.1111111111111112,High-spine chase,601,0,5,40,45,3688
3738,3738,2551,1.1111111111111112,0.057050590894718936,45,1.1111111111111112,can we be your best friend?,601,1,3,41,45,3688
3739,3739,2563,1.1111111111111112,0.057050590894718936,45,1.1111111111111112,Was it something we said?,601,1,3,41,45,3688
3740,3740,2648,1.1111111111111112,0.04737793696791343,45,1.1111111111111112,"Just ignore him, Heidi. He's only trying to get your attention.",601,0,5,40,45,3688
3741,3741,2663,1.1111111111111112,0.057050590894718936,45,1.1111111111111112,"I'm not being inappropriate, I'm always shaped like this.",601,1,3,41,45,3688
3742,3742,2665,1.1111111111111112,0.057050590894718936,45,1.1111111111111112,No thank you. I am not interested in a prickly running partner.,601,1,3,41,45,3688
3743,3743,2693,1.1111111111111112,0.04737793696791343,45,1.1111111111111112,"I am still on fence about the new ""Ouch to 5K"" app.",601,0,5,40,45,3688
3744,3744,2728,1.1111111111111112,0.04737793696791343,45,1.1111111111111112,Are you sure we have our passports?,601,0,5,40,45,3688
3745,3745,2734,1.1111111111111112,0.057050590894718936,45,1.1111111111111112,I hope we get out of here before it gets dark.,601,1,3,41,45,3688
3746,3746,2837,1.1111111111111112,0.04737793696791343,45,1.1111111111111112,The only thing that really hurts is that we?be been running for 8 miles!,601,0,5,40,45,3688
3747,3747,2909,1.1111111111111112,0.057050590894718936,45,1.1111111111111112,"Wait, I just need to get back inside Bears Ears.",601,1,3,41,45,3688
3748,3748,2993,1.1111111111111112,0.057050590894718936,45,1.1111111111111112,Why would she want to leave a town like Tucson?,601,1,3,41,45,3688
3749,3749,3060,1.1111111111111112,0.04737793696791343,45,1.1111111111111112,... that's what it's all about.,601,0,5,40,45,3688
3750,3750,3107,1.1111111111111112,0.057050590894718936,45,1.1111111111111112,Stop following me or I'll report you've got loose again.,601,1,3,41,45,3688
3751,3751,3127,1.1111111111111112,0.04737793696791343,45,1.1111111111111112,Prickly Pete sighted still on the run!,601,0,5,40,45,3688
3752,3752,3228,1.1111111111111112,0.06530597929391763,45,1.1111111111111112,'tas saguaro?,601,2,1,42,45,3688
3753,3753,3268,1.1111111111111112,0.04737793696791343,45,1.1111111111111112,How many times have I told you? I was angry at Nathan when I called him the biggest prick this side of The Alamo!,601,0,5,40,45,3688
3754,3754,3325,1.1111111111111112,0.04737793696791343,45,1.1111111111111112,Don't leave me,601,0,5,40,45,3688
3755,3755,3329,1.1111111111111112,0.057050590894718936,45,1.1111111111111112,"If there's a bounty for illegal cacti aliens, let's get a tequila one next time.",601,1,3,41,45,3688
3756,3756,3411,1.1111111111111112,0.057050590894718936,45,1.1111111111111112,Do you think he was lying when he said he was a vegan?,601,1,3,41,45,3688
3757,3757,3558,1.1111111111111112,0.04737793696791343,45,1.1111111111111112,Is it cactus or cacti? I can never remember.,601,0,5,40,45,3688
3758,3758,3700,1.1111111111111112,0.06530597929391763,45,1.1111111111111112,It looks like your prickly friend forgot to hydrate.,601,2,1,42,45,3688
3759,3759,3889,1.1111111111111112,0.04737793696791343,45,1.1111111111111112,Henry! He says he just wants to look at your prickly pear.,601,0,5,40,45,3688
3760,3760,3930,1.1111111111111112,0.04737793696791343,45,1.1111111111111112,She found the total protection jogger suit on the sale rack.,601,0,5,40,45,3688
3761,3761,3959,1.1111111111111112,0.057050590894718936,45,1.1111111111111112,Why are there mountains in the desert?,601,1,3,41,45,3688
3762,3762,3969,1.1111111111111112,0.057050590894718936,45,1.1111111111111112,for a runner he's got a prickly attitude,601,1,3,41,45,3688
3763,3763,3983,1.1111111111111112,0.057050590894718936,45,1.1111111111111112,"Come on Dan, he just wants a hug...",601,1,3,41,45,3688
3764,3764,4006,1.1111111111111112,0.057050590894718936,45,1.1111111111111112,"Run faster, Margaret—he thinks we’re here for the dessert.",601,1,3,41,45,3688
3765,3765,4011,1.1111111111111112,0.04737793696791343,45,1.1111111111111112,It's a Succulent Suckubus!,601,0,5,40,45,3688
3766,3766,4020,1.1111111111111112,0.057050590894718936,45,1.1111111111111112,You told me there was no such thing as a saguaro Zombie!!!!,601,1,3,41,45,3688
3767,3767,4089,1.1111111111111112,0.04737793696791343,45,1.1111111111111112,"I know this sounds crazy, but…",601,0,5,40,45,3688
3768,3768,4107,1.1111111111111112,0.04737793696791343,45,1.1111111111111112,The heat is catching up with us.,601,0,5,40,45,3688
3769,3769,4142,1.1111111111111112,0.057050590894718936,45,1.1111111111111112,Oh no! An escapee from the Moving Goalpost tryouts.,601,1,3,41,45,3688
3770,3770,4359,1.1111111111111112,0.057050590894718936,45,1.1111111111111112,Don't get prickly with me. You're the one who insisted on running barefoot.,601,1,3,41,45,3688
3771,3771,4373,1.1111111111111112,0.04737793696791343,45,1.1111111111111112,"Hey, you guys. Wait for me!",601,0,5,40,45,3688
3772,3772,4384,1.1111111111111112,0.04737793696791343,45,1.1111111111111112,"Helen, it's not blurry enough to be BigFoot",601,0,5,40,45,3688
3773,3773,4488,1.1111111111111112,0.057050590894718936,45,1.1111111111111112,"What, never seen a walking cactus before?",601,1,3,41,45,3688
3774,3774,4521,1.1111111111111112,0.06530597929391763,45,1.1111111111111112,What is this hydration you speak of?,601,2,1,42,45,3688
3775,3775,4543,1.1111111111111112,0.04737793696791343,45,1.1111111111111112,Surely you can make room for dessert?,601,0,5,40,45,3688
3776,3776,4711,1.1111111111111112,0.057050590894718936,45,1.1111111111111112,I'm guessing he just found out Saguaro is a non native species and he thinks he's getting deported.,601,1,3,41,45,3688
3777,3777,4712,1.1111111111111112,0.057050590894718936,45,1.1111111111111112,Guess there isn't much water left from where it comes from,601,1,3,41,45,3688
3778,3778,4769,1.1111111111111112,0.04737793696791343,45,1.1111111111111112,"Honey, his running form is way off—maybe we should tell him?",601,0,5,40,45,3688
3779,3779,4923,1.1111111111111112,0.04737793696791343,45,1.1111111111111112,Wait! We are all migrants now!,601,0,5,40,45,3688
3780,3780,4935,1.1111111111111112,0.04737793696791343,45,1.1111111111111112,Are you staying dehydrated?,601,0,5,40,45,3688
3781,3781,4939,1.1111111111111112,0.06530597929391763,45,1.1111111111111112,"Hey wait up, I think the cactus wants something!",601,2,1,42,45,3688
3782,3782,72,1.108695652173913,0.046399450995890185,46,1.108695652173913,Wait up! Don’t leave me in this god forsaken place!,601,0,5,41,46,3783
3783,3783,328,1.108695652173913,0.046399450995890185,46,1.108695652173913,Ahhh! Run! Pokey from Mario Bros is alive!,601,0,5,41,46,3783
3784,3784,371,1.108695652173913,0.046399450995890185,46,1.108695652173913,He’ll never last the full 10K.,601,0,5,41,46,3783
3785,3785,382,1.108695652173913,0.05584883729854402,46,1.108695652173913,I think the president is following us.,601,1,3,42,46,3783
3786,3786,396,1.108695652173913,0.046399450995890185,46,1.108695652173913,He won't last long barefooted.,601,0,5,41,46,3783
3787,3787,570,1.108695652173913,0.06391616542376795,46,1.108695652173913,I hear they're combing the art schools for Border Patrol candidates.,601,2,1,43,46,3783
3788,3788,1551,1.108695652173913,0.05584883729854402,46,1.108695652173913,What time's your mother's flight?,601,1,3,42,46,3783
3789,3789,1700,1.108695652173913,0.05584883729854402,46,1.108695652173913,you know john that thing kinda looks like your massive fucking cock,601,1,3,42,46,3783
3790,3790,1768,1.108695652173913,0.046399450995890185,46,1.108695652173913,"Succulents have a distinct advantage in the Badwater Ultramarathon, because they don't require much water......good or bad.",601,0,5,41,46,3783
3791,3791,2066,1.108695652173913,0.05584883729854402,46,1.108695652173913,"Bob, look! I think hydrating is over-rated.",601,1,3,42,46,3783
3792,3792,2271,1.108695652173913,0.05584883729854402,46,1.108695652173913,Faster! I hear our new personal trainer can get awful prickly.,601,1,3,42,46,3783
3793,3793,2566,1.108695652173913,0.05584883729854402,46,1.108695652173913,It's okay! Everyone's always bummed I'm not Jesus too!,601,1,3,42,46,3783
3794,3794,2595,1.108695652173913,0.046399450995890185,46,1.108695652173913,"""Jogging"" not ""jagging""...now go away!",601,0,5,41,46,3783
3795,3795,2759,1.108695652173913,0.05584883729854402,46,1.108695652173913,I tawt I taw a saguaro following us.,601,1,3,42,46,3783
3796,3796,2793,1.108695652173913,0.046399450995890185,46,1.108695652173913,But Mom used to let me keep everything which followed me home.,601,0,5,41,46,3783
3797,3797,3183,1.108695652173913,0.046399450995890185,46,1.108695652173913,It's The Thing from another desert.,601,0,5,41,46,3783
3798,3798,3193,1.108695652173913,0.05584883729854402,46,1.108695652173913,I told you protection orders don't apply to cactus's.,601,1,3,42,46,3783
3799,3799,3311,1.108695652173913,0.05584883729854402,46,1.108695652173913,Do you think he gets more traction with those shoes?,601,1,3,42,46,3783
3800,3800,3436,1.108695652173913,0.05584883729854402,46,1.108695652173913,Eating that cactus earlier is disagreeing with me.,601,1,3,42,46,3783
3801,3801,3501,1.108695652173913,0.046399450995890185,46,1.108695652173913,"""I guess some people are just born to be victims.",601,0,5,41,46,3783
3802,3802,3562,1.108695652173913,0.05584883729854402,46,1.108695652173913,We've never had a drought this bad.,601,1,3,42,46,3783
3803,3803,3716,1.108695652173913,0.05584883729854402,46,1.108695652173913,"C'mon, just one hug, one little hug!",601,1,3,42,46,3783
3804,3804,3768,1.108695652173913,0.046399450995890185,46,1.108695652173913,Spike Jones and his City Slickers,601,0,5,41,46,3783
3805,3805,3817,1.108695652173913,0.05584883729854402,46,1.108695652173913,"That must be a ""So how are you"" sujaro following us. Jessica Dean Batavia. Ill.",601,1,3,42,46,3783
3806,3806,3861,1.108695652173913,0.05584883729854402,46,1.108695652173913,He's not staying hydrated.,601,1,3,42,46,3783
3807,3807,4001,1.108695652173913,0.05584883729854402,46,1.108695652173913,You can't cacti us!,601,1,3,42,46,3783
3808,3808,4222,1.108695652173913,0.05584883729854402,46,1.108695652173913,"No I swear, it wasn't me.",601,1,3,42,46,3783
3809,3809,4431,1.108695652173913,0.046399450995890185,46,1.108695652173913,No panic! It is only that running gag again.,601,0,5,41,46,3783
3810,3810,4524,1.108695652173913,0.046399450995890185,46,1.108695652173913,"When I suggested that you spike your hair, that's not what I had in mind.",601,0,5,41,46,3783
3811,3811,4571,1.108695652173913,0.046399450995890185,46,1.108695652173913,Let's hope a case of pins and needles slows it down!,601,0,5,41,46,3783
3812,3812,418,1.1063829787234043,0.05469656058869374,47,1.1063829787234043,Look Bob....A Southwestern Chris Christie......,601,1,3,43,47,3813
3813,3813,740,1.1063829787234043,0.04546036031565445,47,1.1063829787234043,"Honey, I think there is a grey inside that cactus and I don't think he is surrendering.",601,0,5,42,47,3813
3814,3814,1340,1.1063829787234043,0.05469656058869374,47,1.1063829787234043,I think we finally found a Center.,601,1,3,43,47,3813
3815,3815,3078,1.1063829787234043,0.04546036031565445,47,1.1063829787234043,Guess what? I can prove there's global warming!,601,0,5,42,47,3813
3816,3816,3400,1.1063829787234043,0.04546036031565445,47,1.1063829787234043,Run Faster...It's still sticking with us.,601,0,5,42,47,3813
3817,3817,4261,1.1063829787234043,0.04546036031565445,47,1.1063829787234043,The sap's running.,601,0,5,42,47,3813
3818,3818,4414,1.1063829787234043,0.05469656058869374,47,1.1063829787234043,We should write a song about the jogging Saguaro.,601,1,3,43,47,3813
3819,3819,4158,1.1,0.0480384461415261,40,1.1,The heat can sure sneak up on you here.,601,0,4,36,40,3820
3820,3820,1760,1.0975609756097562,0.04691557088212523,41,1.0975609756097562,"Ted did you say , curiously this race is called the prickly 10k ?",601,0,4,37,41,3821
3821,3821,4,1.0952380952380951,0.04584379641345068,42,1.0952380952380951,"Slow down, honey! Spiny can't keep up.",601,0,4,38,42,3822
3822,3822,62,1.0952380952380951,0.05712349652663379,42,1.0952380952380951,"Unfollow, please!",601,1,2,39,42,3822
3823,3823,71,1.0952380952380951,0.05712349652663379,42,1.0952380952380951,Last one there buys the drinks!,601,1,2,39,42,3822
3824,3824,80,1.0952380952380951,0.05712349652663379,42,1.0952380952380951,I think someone wants to give us hydration tips.,601,1,2,39,42,3822
3825,3825,92,1.0952380952380951,0.04584379641345068,42,1.0952380952380951,I told you it wasn’t surrendering ...,601,0,4,38,42,3822
3826,3826,136,1.0952380952380951,0.04584379641345068,42,1.0952380952380951,# Me Tuber,601,0,4,38,42,3822
3827,3827,138,1.0952380952380951,0.04584379641345068,42,1.0952380952380951,What a prick!,601,0,4,38,42,3822
3828,3828,147,1.0952380952380951,0.04584379641345068,42,1.0952380952380951,Remember when we raced that tumbleweed?,601,0,4,38,42,3822
3829,3829,154,1.0952380952380951,0.05712349652663379,42,1.0952380952380951,"Hate to be a thorn in our side, but I think we should have turned right.",601,1,2,39,42,3822
3830,3830,191,1.0952380952380951,0.04584379641345068,42,1.0952380952380951,We're not a hugging family.,601,0,4,38,42,3822
3831,3831,204,1.0952380952380951,0.05712349652663379,42,1.0952380952380951,I'm getting a prickly feeling about this.,601,1,2,39,42,3822
3832,3832,205,1.0952380952380951,0.05712349652663379,42,1.0952380952380951,"Honey, he's catching up.",601,1,2,39,42,3822
3833,3833,218,1.0952380952380951,0.04584379641345068,42,1.0952380952380951,Our new running regimen is more prickly than I'd imagined.,601,0,4,38,42,3822
3834,3834,224,1.0952380952380951,0.04584379641345068,42,1.0952380952380951,"Run, we're in heat.",601,0,4,38,42,3822
3835,3835,258,1.0952380952380951,0.04584379641345068,42,1.0952380952380951,"...and Carson says, 'It was so hot that trees were following dogs...'",601,0,4,38,42,3822
3836,3836,263,1.0952380952380951,0.04584379641345068,42,1.0952380952380951,"If you two keep running, you'll never work in cartoons again!",601,0,4,38,42,3822
3837,3837,277,1.0952380952380951,0.04584379641345068,42,1.0952380952380951,It appears we're not keeping pace and will need some more cactus practice.,601,0,4,38,42,3822
3838,3838,278,1.0952380952380951,0.04584379641345068,42,1.0952380952380951,"I said running practice, not running cactus!",601,0,4,38,42,3822
3839,3839,303,1.0952380952380951,0.04584379641345068,42,1.0952380952380951,"When ""no pain no gain"" is drawn literally.",601,0,4,38,42,3822
3840,3840,316,1.0952380952380951,0.04584379641345068,42,1.0952380952380951,"Thanks, but we don't hydrate with running water.",601,0,4,38,42,3822
3841,3841,318,1.0952380952380951,0.04584379641345068,42,1.0952380952380951,What are the odds of minerals turning out to be territorial too?,601,0,4,38,42,3822
3842,3842,324,1.0952380952380951,0.05712349652663379,42,1.0952380952380951,I’ve always dreamed of being a cute Disney side-kick character named prickly. Love me!,601,1,2,39,42,3822
3843,3843,379,1.0952380952380951,0.04584379641345068,42,1.0952380952380951,"Hey guys, my Uber is lost -- can I hitch a ride with you?",601,0,4,38,42,3822
3844,3844,386,1.0952380952380951,0.04584379641345068,42,1.0952380952380951,"My ""spiney"" sense is telling me, we're being followed.",601,0,4,38,42,3822
3845,3845,394,1.0952380952380951,0.04584379641345068,42,1.0952380952380951,"Oh, that boy makes my ass itch.",601,0,4,38,42,3822
3846,3846,400,1.0952380952380951,0.04584379641345068,42,1.0952380952380951,"If I say something, he will say, ""Do you always have to be right?""",601,0,4,38,42,3822
3847,3847,426,1.0952380952380951,0.04584379641345068,42,1.0952380952380951,I think we're being stalked...,601,0,4,38,42,3822
3848,3848,434,1.0952380952380951,0.04584379641345068,42,1.0952380952380951,My husband thought you might be thirsty!,601,0,4,38,42,3822
3849,3849,494,1.0952380952380951,0.04584379641345068,42,1.0952380952380951,Oh c’mon! I was just trying to help... there really is water in there!,601,0,4,38,42,3822
3850,3850,499,1.0952380952380951,0.05712349652663379,42,1.0952380952380951,Are you sure those mushrooms were OK?,601,1,2,39,42,3822
3851,3851,525,1.0952380952380951,0.06651717102567406,42,1.0952380952380951,"Hey Bert, something tells me that insurance claim you have in for your 'bad back' is gonna be harder to win than we thought",601,2,0,40,42,3822
3852,3852,535,1.0952380952380951,0.04584379641345068,42,1.0952380952380951,"Except for the prickly spines, I would be interested!",601,0,4,38,42,3822
3853,3853,542,1.0952380952380951,0.04584379641345068,42,1.0952380952380951,I told you we should have gotten a dog!,601,0,4,38,42,3822
3854,3854,543,1.0952380952380951,0.04584379641345068,42,1.0952380952380951,I think I'm starting to feel something.,601,0,4,38,42,3822
3855,3855,560,1.0952380952380951,0.04584379641345068,42,1.0952380952380951,This creeper is a real thorn in my side.,601,0,4,38,42,3822
3856,3856,561,1.0952380952380951,0.04584379641345068,42,1.0952380952380951,Tell Mr. Gump he has another follower.,601,0,4,38,42,3822
3857,3857,577,1.0952380952380951,0.04584379641345068,42,1.0952380952380951,We're testing the new Dry Air Jordans.,601,0,4,38,42,3822
3858,3858,592,1.0952380952380951,0.04584379641345068,42,1.0952380952380951,"Really Dear, my mother just wants to give you a hug!",601,0,4,38,42,3822
3859,3859,595,1.0952380952380951,0.05712349652663379,42,1.0952380952380951,Do you think he is after our bottles of water?,601,1,2,39,42,3822
3860,3860,606,1.0952380952380951,0.04584379641345068,42,1.0952380952380951,"Sorry, I don’t have a water bottle.",601,0,4,38,42,3822
3861,3861,608,1.0952380952380951,0.04584379641345068,42,1.0952380952380951,The humans worship you and pick up your waste?,601,0,4,38,42,3822
3862,3862,611,1.0952380952380951,0.05712349652663379,42,1.0952380952380951,"You may have a stitch, but Steve's cactus.",601,1,2,39,42,3822
3863,3863,635,1.0952380952380951,0.04584379641345068,42,1.0952380952380951,"We're not going too fast, and I just think you're being a little prickly about it.",601,0,4,38,42,3822
3864,3864,648,1.0952380952380951,0.04584379641345068,42,1.0952380952380951,I think he just quit and said the hell with this!,601,0,4,38,42,3822
