target_id,rank,funny,somewhat_funny,unfunny,count,score,precision,contest,caption
837,3688,1,3,41,45,1.1111111111111112,0.057050590894718936,601,Men are such pricks.
765,3688,0,5,40,45,1.1111111111111112,0.047377936967913425,601,You won’t believe the last friend request I got.
618,3688,1,3,41,45,1.1111111111111112,0.057050590894718936,601,The natives will do anything to avoid an entry fee for the marathon!
617,3688,1,3,41,45,1.1111111111111112,0.057050590894718936,601,He gets so prickly whenever we pass him.
548,3688,1,3,41,45,1.1111111111111112,0.057050590894718936,601,"I told you,we left our IDs at the house."
533,3688,0,5,40,45,1.1111111111111112,0.047377936967913425,601,That Taco Time mascot's gaining on us!
501,3688,1,3,41,45,1.1111111111111112,0.057050590894718936,601,I told you that’s impossible.
486,3688,1,3,41,45,1.1111111111111112,0.057050590894718936,601,When cactus man dances we u turn back to camp.
465,3688,1,3,41,45,1.1111111111111112,0.057050590894718936,601,I just want to get a selfie!
933,3688,1,3,41,45,1.1111111111111112,0.057050590894718936,601,"Honey, I think we're being followed."
423,3688,0,5,40,45,1.1111111111111112,0.047377936967913425,601,And who's going to die of thirst?
368,3688,0,5,40,45,1.1111111111111112,0.047377936967913425,601,Natural running! Cool!
348,3688,0,5,40,45,1.1111111111111112,0.047377936967913425,601,"Let's get out of here, Dave. Sasquatch's cousin is in a prickly mood."
329,3688,1,3,41,45,1.1111111111111112,0.057050590894718936,601,"This is a MeToo moment, big man. All I have to do is out-run you."
250,3688,1,3,41,45,1.1111111111111112,0.057050590894718936,601,"Oh no, it's that needling cactus again!"
229,3688,1,3,41,45,1.1111111111111112,0.057050590894718936,601,You shouldn't have mentioned our hotel pool a minute ago.
156,3688,1,3,41,45,1.1111111111111112,0.057050590894718936,601,I told you if you ordered the cactus salad it would eventually catch up with you.
111,3688,1,3,41,45,1.1111111111111112,0.057050590894718936,601,I think we are being targeted by a North Korean missile!
21,3688,0,5,40,45,1.1111111111111112,0.047377936967913425,601,"Honey, I'd suguaro it's following us."
2341,3688,1,3,41,45,1.1111111111111112,0.057050590894718936,601,Are we chasing him? Or is he chasing us?
417,3688,1,3,41,45,1.1111111111111112,0.057050590894718936,601,"Honey, I think you over-watered the cactus again"
1005,3688,0,5,40,45,1.1111111111111112,0.047377936967913425,601,"Listen! I said No, you big prick!"
578,3688,1,3,41,45,1.1111111111111112,0.057050590894718936,601,Submission 672: Border Patrol Cacti. All those in Favor?
1162,3688,1,3,41,45,1.1111111111111112,0.057050590894718936,601,I'm afraid Nature final decided it wants to be one with us.
2174,3688,0,5,40,45,1.1111111111111112,0.047377936967913425,601,All I said was how sad it was pearless.
2054,3688,0,5,40,45,1.1111111111111112,0.047377936967913425,601,I think he wants to sell us more peyote buttons.
1813,3688,1,3,41,45,1.1111111111111112,0.057050590894718936,601,Saguaro! Saguaro! I love ya Saguaro! You're always a day away!
1762,3688,0,5,40,45,1.1111111111111112,0.047377936967913425,601,Metaphor for that one person at the office
1155,3688,1,3,41,45,1.1111111111111112,0.057050590894718936,601,"Ah, are we running anywhere near a colder climate?"
1601,3688,0,5,40,45,1.1111111111111112,0.047377936967913425,601,"Come on, Honey. Prickly Foot is only a desert hallucination."
1578,3688,1,3,41,45,1.1111111111111112,0.057050590894718936,601,I’m coming with you. I can’t stand how warm it’s getting out here!
1527,3688,0,5,40,45,1.1111111111111112,0.047377936967913425,601,"To help assist Amanda with rent and utilities, Linda and Michael decided to forgo their gym membership and push their retirement date out another two years."
1483,3688,1,3,41,45,1.1111111111111112,0.057050590894718936,601,"Self, you are not going to be jealous of a plant."
1481,3688,0,5,40,45,1.1111111111111112,0.047377936967913425,601,"""I shall avenge Spike!"" (Apologies to Charles Schulz)"
1477,3688,0,5,40,45,1.1111111111111112,0.047377936967913425,601,Honey...don't look back!
1642,3688,0,5,40,45,1.1111111111111112,0.047377936967913425,601,"Hey, don't leave me alone out here with no water."
1444,3688,0,5,40,45,1.1111111111111112,0.047377936967913425,601,Cact-us r us
1411,3688,1,3,41,45,1.1111111111111112,0.057050590894718936,601,I think it wants to tell us something
1372,3688,1,3,41,45,1.1111111111111112,0.057050590894718936,601,"Yes, Captain Picarf."
1347,3688,0,5,40,45,1.1111111111111112,0.047377936967913425,601,2018 Sodom and Gomorrah Marathon
1272,3688,1,3,41,45,1.1111111111111112,0.057050590894718936,601,"And for God's sake, try to keep up!"
1254,3688,1,3,41,45,1.1111111111111112,0.057050590894718936,601,"I think we're doing this wrong, honey."
1193,3688,2,1,42,45,1.1111111111111112,0.06530597929391763,601,Looks like Gumby has developed a bad case of acne.
1176,3688,0,5,40,45,1.1111111111111112,0.047377936967913425,601,No it ‘s not doing saguaro Zumba.
1173,3688,1,3,41,45,1.1111111111111112,0.057050590894718936,601,That fucking cactus is moving
1457,3688,0,5,40,45,1.1111111111111112,0.047377936967913425,601,"Following their scent inconspicuously for hours, Carl was finally closing in on the humans. He could almost taste their sweet sweat."
3311,3783,1,3,42,46,1.108695652173913,0.05584883729854405,601,Do you think he gets more traction with those shoes?
3436,3783,1,3,42,46,1.108695652173913,0.05584883729854405,601,Eating that cactus earlier is disagreeing with me.
3501,3783,0,5,41,46,1.108695652173913,0.04639945099589022,601,"""I guess some people are just born to be victims."
3562,3783,1,3,42,46,1.108695652173913,0.05584883729854405,601,We've never had a drought this bad.
3716,3783,1,3,42,46,1.108695652173913,0.05584883729854405,601,"C'mon, just one hug, one little hug!"
3768,3783,0,5,41,46,1.108695652173913,0.04639945099589022,601,Spike Jones and his City Slickers
4524,3783,0,5,41,46,1.108695652173913,0.04639945099589022,601,"When I suggested that you spike your hair, that's not what I had in mind."
3861,3783,1,3,42,46,1.108695652173913,0.05584883729854405,601,He's not staying hydrated.
4001,3783,1,3,42,46,1.108695652173913,0.05584883729854405,601,You can't cacti us!
4431,3783,0,5,41,46,1.108695652173913,0.04639945099589022,601,No panic! It is only that running gag again.
4571,3783,0,5,41,46,1.108695652173913,0.04639945099589022,601,Let's hope a case of pins and needles slows it down!
3193,3783,1,3,42,46,1.108695652173913,0.05584883729854405,601,I told you protection orders don't apply to cactus's.
3817,3783,1,3,42,46,1.108695652173913,0.05584883729854405,601,"That must be a ""So how are you"" sujaro following us. Jessica Dean Batavia. Ill."
3183,3783,0,5,41,46,1.108695652173913,0.04639945099589022,601,It's The Thing from another desert.
4222,3783,1,3,42,46,1.108695652173913,0.05584883729854405,601,"No I swear, it wasn't me."
2759,3783,1,3,42,46,1.108695652173913,0.05584883729854405,601,I tawt I taw a saguaro following us.
72,3783,0,5,41,46,1.108695652173913,0.04639945099589022,601,Wait up! Don’t leave me in this god forsaken place!
328,3783,0,5,41,46,1.108695652173913,0.04639945099589022,601,Ahhh! Run! Pokey from Mario Bros is alive!
371,3783,0,5,41,46,1.108695652173913,0.04639945099589022,601,He’ll never last the full 10K.
2793,3783,0,5,41,46,1.108695652173913,0.04639945099589022,601,But Mom used to let me keep everything which followed me home.
382,3783,1,3,42,46,1.108695652173913,0.05584883729854405,601,I think the president is following us.
396,3783,0,5,41,46,1.108695652173913,0.04639945099589022,601,He won't last long barefooted.
570,3783,2,1,43,46,1.108695652173913,0.06391616542376796,601,I hear they're combing the art schools for Border Patrol candidates.
1700,3783,1,3,42,46,1.108695652173913,0.05584883729854405,601,you know john that thing kinda looks like your massive fucking cock
1768,3783,0,5,41,46,1.108695652173913,0.04639945099589022,601,"Succulents have a distinct advantage in the Badwater Ultramarathon, because they don't require much water......good or bad."
2066,3783,1,3,42,46,1.108695652173913,0.05584883729854405,601,"Bob, look! I think hydrating is over-rated."
2271,3783,1,3,42,46,1.108695652173913,0.05584883729854405,601,Faster! I hear our new personal trainer can get awful prickly.
2566,3783,1,3,42,46,1.108695652173913,0.05584883729854405,601,It's okay! Everyone's always bummed I'm not Jesus too!
2595,3783,0,5,41,46,1.108695652173913,0.04639945099589022,601,"""Jogging"" not ""jagging""...now go away!"
1551,3783,1,3,42,46,1.108695652173913,0.05584883729854405,601,What time's your mother's flight?
4261,3813,0,5,42,47,1.1063829787234043,0.04546036031565445,601,The sap's running.
4414,3813,1,3,43,47,1.1063829787234043,0.05469656058869374,601,We should write a song about the jogging Saguaro.
3400,3813,0,5,42,47,1.1063829787234043,0.04546036031565445,601,Run Faster...It's still sticking with us.
3078,3813,0,5,42,47,1.1063829787234043,0.04546036031565445,601,Guess what? I can prove there's global warming!
1340,3813,1,3,43,47,1.1063829787234043,0.05469656058869374,601,I think we finally found a Center.
740,3813,0,5,42,47,1.1063829787234043,0.04546036031565445,601,"Honey, I think there is a grey inside that cactus and I don't think he is surrendering."
418,3813,1,3,43,47,1.1063829787234043,0.05469656058869374,601,Look Bob....A Southwestern Chris Christie......
4158,3820,0,4,36,40,1.1,0.04803844614152615,601,The heat can sure sneak up on you here.
1760,3821,0,4,37,41,1.0975609756097562,0.046915570882125224,601,"Ted did you say , curiously this race is called the prickly 10k ?"
3460,3822,1,2,39,42,1.0952380952380953,0.057123496526633864,601,Who dat big bitch
3458,3822,0,4,38,42,1.0952380952380953,0.045843796413450766,601,He says he wants our peyote!
3457,3822,1,2,39,42,1.0952380952380953,0.057123496526633864,601,He wants directions to a desert
3341,3822,1,2,39,42,1.0952380952380953,0.057123496526633864,601,Don't worry; his spines slow him down!
3418,3822,0,4,38,42,1.0952380952380953,0.045843796413450766,601,That thing’s a real thorn in the backside!
3405,3822,0,4,38,42,1.0952380952380953,0.045843796413450766,601,Stop being so prickly!
3406,3822,1,2,39,42,1.0952380952380953,0.057123496526633864,601,"Sweetie, I promise we'll give you a hug after our morning run."
3463,3822,0,4,38,42,1.0952380952380953,0.045843796413450766,601,I think it’s following us home.
3401,3822,1,2,39,42,1.0952380952380953,0.057123496526633864,601,And away we saguaro!
3389,3822,0,4,38,42,1.0952380952380953,0.045843796413450766,601,Impressive for being dehydrated.
3365,3822,0,4,38,42,1.0952380952380953,0.045843796413450766,601,"Honey, that cactus I squatted behind is now following us!"
3417,3822,0,4,38,42,1.0952380952380953,0.045843796413450766,601,Jogging is no reason to give us the finger.
3489,3822,0,4,38,42,1.0952380952380953,0.045843796413450766,601,Now I know how the Minutemen feel
3671,3822,0,4,38,42,1.0952380952380953,0.045843796413450766,601,"If you trying to find my facial expressions don't bother, I got a mean pokerface."
3511,3822,0,4,38,42,1.0952380952380953,0.045843796413450766,601,"Don't look now, but I think he's gaining on us."
3550,3822,0,4,38,42,1.0952380952380953,0.045843796413450766,601,"It’s the not so stable genus, Prickus Omnitweetum.”"
3557,3822,0,4,38,42,1.0952380952380953,0.045843796413450766,601,ET... is that you?!? You came back from HOME?
3559,3822,0,4,38,42,1.0952380952380953,0.045843796413450766,601,I told you not to take him for a walk with us.
3569,3822,0,4,38,42,1.0952380952380953,0.045843796413450766,601,"Being followed is spooky enough, but his hugs are really prickly."
3594,3822,1,2,39,42,1.0952380952380953,0.057123496526633864,601,“Run!” It’s a desert predator!
3643,3822,0,4,38,42,1.0952380952380953,0.045843796413450766,601,"Hey, Bob. Weren't natural floral included in the immigration ban?"
3660,3822,1,2,39,42,1.0952380952380953,0.057123496526633864,601,"Hon, I think Spikey needs a break."
3662,3822,1,2,39,42,1.0952380952380953,0.057123496526633864,601,I do believe that that anthropomorph is following us.
3305,3822,1,2,39,42,1.0952380952380953,0.057123496526633864,601,Is that rocket man?
3679,3822,0,4,38,42,1.0952380952380953,0.045843796413450766,601,Be sure to stay hydrated.
3684,3822,0,4,38,42,1.0952380952380953,0.045843796413450766,601,"Okay already, we get your point"
3717,3822,0,4,38,42,1.0952380952380953,0.045843796413450766,601,"I swear, it’s not contagious!"
3493,3822,0,4,38,42,1.0952380952380953,0.045843796413450766,601,"Pasito a pasito, suave suavecito....."
3295,3822,0,4,38,42,1.0952380952380953,0.045843796413450766,601,Don't look back. Somebody might be following you (Satchel Paige)
3096,3822,0,4,38,42,1.0952380952380953,0.045843796413450766,601,"I've told you, even here they would know that we didn't pay our taxes."
3253,3822,1,2,39,42,1.0952380952380953,0.057123496526633864,601,"John, we've got a prickly situation."
3719,3822,0,4,38,42,1.0952380952380953,0.045843796413450766,601,'It followed us home doesn't work.' It's no longer protected.
2666,3822,0,4,38,42,1.0952380952380953,0.045843796413450766,601,No worries!! Just need directions to Times Square.
2667,3822,0,4,38,42,1.0952380952380953,0.045843796413450766,601,Saguaro you going?
2674,3822,0,4,38,42,1.0952380952380953,0.045843796413450766,601,I need to get rid of some water weight.
2760,3822,0,4,38,42,1.0952380952380953,0.045843796413450766,601,Maxwell Smart is still tailing us.
2835,3822,0,4,38,42,1.0952380952380953,0.045843796413450766,601,"I think its rapping, ‘Keep the beat, beat the heat, say adios Saguaro in Sonora’"
2868,3822,0,4,38,42,1.0952380952380953,0.045843796413450766,601,You prick!
2893,3822,0,4,38,42,1.0952380952380953,0.045843796413450766,601,I told you not to mention nopales.
2931,3822,0,4,38,42,1.0952380952380953,0.045843796413450766,601,Texas Saguaro Massacre
2941,3822,0,4,38,42,1.0952380952380953,0.045843796413450766,601,sorry were leaving we dont hug anything with thorns
2965,3822,1,2,39,42,1.0952380952380953,0.057123496526633864,601,His thorns are like cleats...he's gaining on us.
2982,3822,1,2,39,42,1.0952380952380953,0.057123496526633864,601,Run faster the cactus is gaining on us. Stop a minute honey. More then one is cactUS. One is a cactI. Now runnnn. Ouch
2987,3822,0,4,38,42,1.0952380952380953,0.045843796413450766,601,The word 'spineless' means something different to him.
3269,3822,1,2,39,42,1.0952380952380953,0.057123496526633864,601,Too hot to walk? You have a point.
3027,3822,0,4,38,42,1.0952380952380953,0.045843796413450766,601,Please don't leave. I promise not to hug you again.
3064,3822,1,2,39,42,1.0952380952380953,0.057123496526633864,601,Pick up the pace!! Won the Saguaro 10K and said he really wanted to stick it to us.
3074,3822,0,4,38,42,1.0952380952380953,0.045843796413450766,601,"Speed up, Abe... it's that stalker again..."
3076,3822,0,4,38,42,1.0952380952380953,0.045843796413450766,601,I’m trying to reduce my urban footprint.
3080,3822,1,2,39,42,1.0952380952380953,0.057123496526633864,601,Hurry before it cactus up to us!
3100,3822,0,4,38,42,1.0952380952380953,0.045843796413450766,601,Not what I imagined when you suggested a dry run.
3117,3822,1,2,39,42,1.0952380952380953,0.057123496526633864,601,And so began Sarah’s vision jog.
3137,3822,0,4,38,42,1.0952380952380953,0.045843796413450766,601,You'll never cact- us!
3142,3822,0,4,38,42,1.0952380952380953,0.045843796413450766,601,"My recurring ""chase"" nightmare..."
3200,3822,2,0,40,42,1.0952380952380953,0.06651717102567413,601,did you save me any of the mexican?!
3211,3822,0,4,38,42,1.0952380952380953,0.045843796413450766,601,I thought you promised to make our borders safe.
3232,3822,0,4,38,42,1.0952380952380953,0.045843796413450766,601,He's really sticking to us
3242,3822,0,4,38,42,1.0952380952380953,0.045843796413450766,601,But he looks friendly.
3245,3822,2,0,40,42,1.0952380952380953,0.06651717102567413,601,Someone needs to tell Bob to chill he's acting thirsty af
3053,3822,0,4,38,42,1.0952380952380953,0.045843796413450766,601,"Don't run, I am only a carbon footprint."
3726,3822,0,4,38,42,1.0952380952380953,0.045843796413450766,601,Why did you have to say that cactus looks like your ex wife!
4533,3822,1,2,39,42,1.0952380952380953,0.057123496526633864,601,"Run, it’s alive and he’s horny"
3745,3822,1,2,39,42,1.0952380952380953,0.057123496526633864,601,"The only one he knows is ""Tumbling Tumbleweeds'"""
4332,3822,0,4,38,42,1.0952380952380953,0.045843796413450766,601,"Honey, feel like making some tequila after our run?"
4404,3822,0,4,38,42,1.0952380952380953,0.045843796413450766,601,"He seems friendly enough, but his hugs could be troubling."
4411,3822,0,4,38,42,1.0952380952380953,0.045843796413450766,601,Shadowed by a saguaro.
4415,3822,0,4,38,42,1.0952380952380953,0.045843796413450766,601,We should have stopped for water!!
4457,3822,0,4,38,42,1.0952380952380953,0.045843796413450766,601,Remind me to skip the peyote entree next time.
4471,3822,0,4,38,42,1.0952380952380953,0.045843796413450766,601,When is the next water station?
4506,3822,0,4,38,42,1.0952380952380953,0.045843796413450766,601,Which watering can did you use?
4519,3822,1,2,39,42,1.0952380952380953,0.057123496526633864,601,Just relax honey; he's not trying to prick me.
2633,3822,0,4,38,42,1.0952380952380953,0.045843796413450766,601,Don't pay attention to that my dear. Just run faster to get home and read Trump's tweeter about that.
4538,3822,1,2,39,42,1.0952380952380953,0.057123496526633864,601,I didn't know running had side effects!
4590,3822,0,4,38,42,1.0952380952380953,0.045843796413450766,601,Surrender is not in his vocabulary.
4608,3822,0,4,38,42,1.0952380952380953,0.045843796413450766,601,"If you think this is tough, wait till you compete in the pole vault!"
4617,3822,0,4,38,42,1.0952380952380953,0.045843796413450766,601,Run for it! The peyote around here really kicks butt!
4649,3822,1,2,39,42,1.0952380952380953,0.057123496526633864,601,"Not yet, Rocky. Not yet."
4678,3822,1,2,39,42,1.0952380952380953,0.057123496526633864,601,"Hey, slow down. I am about five times your age!"
4680,3822,0,4,38,42,1.0952380952380953,0.045843796413450766,601,How do you think it stays hydrated?
4705,3822,0,4,38,42,1.0952380952380953,0.045843796413450766,601,Sorry to bring up a thorny topic.....
4716,3822,0,4,38,42,1.0952380952380953,0.045843796413450766,601,There's nothing big and beautiful about this
4771,3822,0,4,38,42,1.0952380952380953,0.045843796413450766,601,"Please keep me, have you never heard of Imprinting ?"
4774,3822,0,4,38,42,1.0952380952380953,0.045843796413450766,601,"Honey, I think we should head for the Natural History Museum."
4786,3822,0,4,38,42,1.0952380952380953,0.045843796413450766,601,"Hey guys, don’t desert me. I can’t stand the heat!"
4840,3822,1,2,39,42,1.0952380952380953,0.057123496526633864,601,"We have to move faster, big foot is gaining on us."
4894,3822,0,4,38,42,1.0952380952380953,0.045843796413450766,601,"Come back, come back ... I'm not that prickly ... !"
4909,3822,1,2,39,42,1.0952380952380953,0.057123496526633864,601,Are you an ICE robot?
4956,3822,0,4,38,42,1.0952380952380953,0.045843796413450766,601,Hurry! Yond cactus has a lean and hungry look!
4957,3822,0,4,38,42,1.0952380952380953,0.045843796413450766,601,I think he's giving up. He can't keep up with us.
4970,3822,0,4,38,42,1.0952380952380953,0.045843796413450766,601,What a slowpoke.
4311,3822,0,4,38,42,1.0952380952380953,0.045843796413450766,601,"Hurry, the big thorny dildo is getting closer!"
4307,3822,1,2,39,42,1.0952380952380953,0.057123496526633864,601,I told you someone was following us...
4302,3822,0,4,38,42,1.0952380952380953,0.045843796413450766,601,"You had one job Saguaro, count to one hundred..."
4286,3822,1,2,39,42,1.0952380952380953,0.057123496526633864,601,"Honey, we have a succulant on our tail."
3804,3822,1,2,39,42,1.0952380952380953,0.057123496526633864,601,"It's not a proper cactus dance, but who are we to criticize?"
3822,3822,0,4,38,42,1.0952380952380953,0.045843796413450766,601,A smuggler!
3824,3822,1,2,39,42,1.0952380952380953,0.057123496526633864,601,When I said 'grow a spine' I didn't mean that literally!
3828,3822,0,4,38,42,1.0952380952380953,0.045843796413450766,601,I TOLD you that jogging in the desert with no water was a bad idea!
3842,3822,1,2,39,42,1.0952380952380953,0.057123496526633864,601,"When Sheila said that the new trainer was a little bit prickly, this isn’t what I thought she meant."
3882,3822,1,2,39,42,1.0952380952380953,0.057123496526633864,601,She got prickly when I told her you were already married
3883,3822,0,4,38,42,1.0952380952380953,0.045843796413450766,601,The rumors were true. He thought the wall idea had gotten old. They’re all along the border.
3901,3822,0,4,38,42,1.0952380952380953,0.045843796413450766,601,"Say, where-o we running?"
3914,3822,1,2,39,42,1.0952380952380953,0.057123496526633864,601,I think Ken has been juicing greens a little too much.
3921,3822,0,4,38,42,1.0952380952380953,0.045843796413450766,601,Our prickly friend never gives up!
3936,3822,0,4,38,42,1.0952380952380953,0.045843796413450766,601,Has it gotten too much rain?
3940,3822,1,2,39,42,1.0952380952380953,0.057123496526633864,601,I think your wife is still suspicious.
3943,3822,0,4,38,42,1.0952380952380953,0.045843796413450766,601,"Well, I guess Arizona made it to the Super Bowl."
3740,3822,1,2,39,42,1.0952380952380953,0.057123496526633864,601,That saguaro is creeping me out.
3945,3822,1,2,39,42,1.0952380952380953,0.057123496526633864,601,I knew about the jumping cactus... I guess there are jogging cacti too!
3972,3822,0,4,38,42,1.0952380952380953,0.045843796413450766,601,"Beware: When you least expect it, Joe Arpaio will catch up with you!"
4022,3822,1,2,39,42,1.0952380952380953,0.057123496526633864,601,It thinks you're Tom Hanks.
4026,3822,1,2,39,42,1.0952380952380953,0.057123496526633864,601,"Just tell him that this is not the traveling company for ""Lost Horizon""."
4057,3822,1,2,39,42,1.0952380952380953,0.057123496526633864,601,Remember throwing away the giant cactus your mother gave us?
4075,3822,1,2,39,42,1.0952380952380953,0.057123496526633864,601,"Let it pass, but don't touch."
4093,3822,0,4,38,42,1.0952380952380953,0.045843796413450766,601,"No, no! You put your right foot in before you take it out!"
4109,3822,1,2,39,42,1.0952380952380953,0.057123496526633864,601,(Whispering) “We’re being followed.”
4111,3822,1,2,39,42,1.0952380952380953,0.057123496526633864,601,I think he wants his peyote back...
4122,3822,1,2,39,42,1.0952380952380953,0.057123496526633864,601,Told you that running was addictive.
4168,3822,0,4,38,42,1.0952380952380953,0.045843796413450766,601,Keep going! Needles isn't too far away.
4195,3822,0,4,38,42,1.0952380952380953,0.045843796413450766,601,Your ex-wife’s camouflage technique is really getting better.
4201,3822,0,4,38,42,1.0952380952380953,0.045843796413450766,601,This guy is starting to stick too close to me.
4268,3822,1,2,39,42,1.0952380952380953,0.057123496526633864,601,I'd never walk a mile in its shoes!
3968,3822,1,2,39,42,1.0952380952380953,0.057123496526633864,601,"Wow, Ben, even the cacti in this state move with more spine and speed then Congress!"
2627,3822,0,4,38,42,1.0952380952380953,0.045843796413450766,601,"Honey, can you tell how your crazy ex looked like?"
2078,3822,1,2,39,42,1.0952380952380953,0.057123496526633864,601,"Oh c’mon, let’s stick around here for awhile."
2602,3822,1,2,39,42,1.0952380952380953,0.057123496526633864,601,Special permits must be obtained to move.
542,3822,0,4,38,42,1.0952380952380953,0.045843796413450766,601,I told you we should have gotten a dog!
543,3822,0,4,38,42,1.0952380952380953,0.045843796413450766,601,I think I'm starting to feel something.
560,3822,0,4,38,42,1.0952380952380953,0.045843796413450766,601,This creeper is a real thorn in my side.
561,3822,0,4,38,42,1.0952380952380953,0.045843796413450766,601,Tell Mr. Gump he has another follower.
577,3822,0,4,38,42,1.0952380952380953,0.045843796413450766,601,We're testing the new Dry Air Jordans.
592,3822,0,4,38,42,1.0952380952380953,0.045843796413450766,601,"Really Dear, my mother just wants to give you a hug!"
595,3822,1,2,39,42,1.0952380952380953,0.057123496526633864,601,Do you think he is after our bottles of water?
606,3822,0,4,38,42,1.0952380952380953,0.045843796413450766,601,"Sorry, I don’t have a water bottle."
2614,3822,1,2,39,42,1.0952380952380953,0.057123496526633864,601,The situation is getting a little prickly.
611,3822,1,2,39,42,1.0952380952380953,0.057123496526633864,601,"You may have a stitch, but Steve's cactus."
635,3822,0,4,38,42,1.0952380952380953,0.045843796413450766,601,"We're not going too fast, and I just think you're being a little prickly about it."
648,3822,0,4,38,42,1.0952380952380953,0.045843796413450766,601,I think he just quit and said the hell with this!
673,3822,2,0,40,42,1.0952380952380953,0.06651717102567413,601,It still wants to do the macarena.
684,3822,1,2,39,42,1.0952380952380953,0.057123496526633864,601,This is not a drill!!!
750,3822,0,4,38,42,1.0952380952380953,0.045843796413450766,601,"Don't leave me out here, all alone!"
774,3822,0,4,38,42,1.0952380952380953,0.045843796413450766,601,I don't think this is the way to water.
799,3822,1,2,39,42,1.0952380952380953,0.057123496526633864,601,"Yeah, he's getting a little out of shape."
811,3822,0,4,38,42,1.0952380952380953,0.045843796413450766,601,Global Warm-Up on Global Warning
816,3822,0,4,38,42,1.0952380952380953,0.045843796413450766,601,Ever since Peyote Jack replaced Hochuli you've become one hell of a field goal kicker.
881,3822,0,4,38,42,1.0952380952380953,0.045843796413450766,601,"We're almost there, don't turn back now!"
905,3822,0,4,38,42,1.0952380952380953,0.045843796413450766,601,I bet it will pass us at the next water stop.
