target_id,rank,funny,somewhat_funny,unfunny,count,score,precision,contest,caption
1084,1110,5,14,71,90,1.2666666666666666,0.058700024564689327,601,Honey! You’re gonna need a bigger pot.
1993,1110,5,14,71,90,1.2666666666666666,0.058700024564689327,601,That Prick is Closing In On Us!
27,1110,8,8,74,90,1.2666666666666666,0.06476694028829148,601,Why is your friend such a prick?
43,1110,5,14,71,90,1.2666666666666666,0.058700024564689327,601,I think he said something about free hugs.
157,1110,4,16,70,90,1.2666666666666666,0.05653322026700586,601,I hate it when he hugs me.
217,1110,4,16,70,90,1.2666666666666666,0.05653322026700586,601,You could say that I'm wary of pricks.
288,1110,5,14,71,90,1.2666666666666666,0.058700024564689327,601,Your brother has a dry sense of humor!
388,1110,3,18,69,90,1.2666666666666666,0.054279988058403936,601,Is that all the border security they had money for?
492,1110,5,14,71,90,1.2666666666666666,0.058700024564689327,601,And I thought I was dehydrated
531,1110,4,16,70,90,1.2666666666666666,0.05653322026700586,601,"Look, how cute! He thinks we’re his parents."
639,1110,4,16,70,90,1.2666666666666666,0.05653322026700586,601,He's trying to get rid of the water weight.
764,1110,4,16,70,90,1.2666666666666666,0.05653322026700586,601,I still say water bottles would have been less creepy.
2198,1110,5,14,71,90,1.2666666666666666,0.058700024564689327,601,That prick won't take 'no' for an answer.
870,1110,5,14,71,90,1.2666666666666666,0.058700024564689327,601,He'll be happier in the wild.
4869,1110,4,16,70,90,1.2666666666666666,0.05653322026700586,601,"It's ok hunny! He's not a stalker, just a prick."
970,1110,5,14,71,90,1.2666666666666666,0.058700024564689327,601,"I think ""succulent"" is his trigger word."
1021,1110,3,18,69,90,1.2666666666666666,0.054279988058403936,601,Arizona makes me uncomfortable.
1065,1110,4,16,70,90,1.2666666666666666,0.05653322026700586,601,Covering our footprints isn’t working.
1190,1110,4,16,70,90,1.2666666666666666,0.05653322026700586,601,At least I'm getting all my steps in today.
1191,1110,2,20,68,90,1.2666666666666666,0.05192907868894985,601,Sorry! Sorry! We thought you were an Aloe Vera plant!
1277,1110,6,12,72,90,1.2666666666666666,0.060789643641268855,601,"Remember saying ""oh some stupid cactus"" back there?"
1794,1110,4,16,70,90,1.2666666666666666,0.05653322026700586,601,Poor thing. 60 million years to optimize hydration and it can barely keep up.
1823,1110,5,14,71,90,1.2666666666666666,0.058700024564689327,601,"Uh, I doubt you'll ever call him a 'Prick' again."
1827,1110,7,10,73,90,1.2666666666666666,0.06280978159625925,601,Hurry up! We don't have an agricultural permit to move you.
1978,1110,4,16,70,90,1.2666666666666666,0.05653322026700586,601,"We can make it, I’m pretty sure he isn’t sufficiently hydrated."
888,1110,3,18,69,90,1.2666666666666666,0.054279988058403936,601,"I swear, I haven't seen that other contestant take a drink of water yet."
961,1110,4,16,70,90,1.2666666666666666,0.05653322026700586,601,You just had to give it water.
3938,1163,2,19,66,87,1.264367816091954,0.05287704973221805,601,Please! I just need a hug.
1817,1163,5,13,69,87,1.264367816091954,0.059982555859760325,601,Wait. I just want a hug!
1901,1163,2,19,66,87,1.264367816091954,0.05287704973221805,601,I guess his New Years resolution was also to start moving more.
1339,1166,2,15,55,72,1.2638888888888888,0.05931618532716555,601,I'm trying to remember how you know when you're dehydrated.
4835,1167,1,22,68,91,1.2637362637362637,0.04900764893868004,601,Better pick up the pace Hon....that cactus wants a hug!
4327,1167,4,16,71,91,1.2637362637362637,0.055985269375949595,601,The one time I wish it was a mirage!
4281,1167,3,18,70,91,1.2637362637362637,0.05376011665628522,601,The doctor says he’s retaining too much water.
4594,1167,5,14,72,91,1.2637362637362637,0.05812530112866413,601,How do you manage to stay hydrated?
2060,1167,5,14,72,91,1.2637362637362637,0.05812530112866413,601,"This gives ""green footprint"" a whole other meaning!"
1213,1167,4,16,71,91,1.2637362637362637,0.055985269375949595,601,"Strange, I thought walking cacti were extinct."
1053,1167,7,10,74,91,1.2637362637362637,0.062184814220984624,601,"Honey, this prick is still following us."
3517,1167,4,16,71,91,1.2637362637362637,0.055985269375949595,601,Saguaro you following us?
1654,1175,1,19,60,80,1.2625,0.05260237155937825,601,I told you not to give it a drink; now it's following us.
1844,1175,2,17,61,80,1.2625,0.05552895811982625,601,Hurry! I'm afraid we'll need water before he does.
4153,1177,6,11,71,88,1.2613636363636365,0.06153368597245653,601,He is still trying to surrender to us!
3235,1177,2,19,67,88,1.2613636363636365,0.05235897659372321,601,He insists the etymology isn't Latin.
4045,1177,5,13,70,88,1.2613636363636365,0.05937307040656718,601,I think he wants to give us a hug.
4049,1177,3,17,68,88,1.2613636363636365,0.05479685620357946,601,"If he catches up with us, we will be dealing with a sticky situation."
4277,1177,4,15,69,88,1.2613636363636365,0.057130801409130204,601,The desert is gaining on us!
4659,1177,6,11,71,88,1.2613636363636365,0.06153368597245653,601,"We're Polish and Irish, where are your roots?"
4554,1177,5,13,70,88,1.2613636363636365,0.05937307040656718,601,This mght turn into a sticky situation.
4559,1177,3,17,68,88,1.2613636363636365,0.05479685620357946,601,We are running from a sticky situation.
4633,1177,3,17,68,88,1.2613636363636365,0.05479685620357946,601,"Next time we play, honey, please just volunteer to be ""it."""
4644,1177,4,15,69,88,1.2613636363636365,0.057130801409130204,601,"Honey, did you water the plants before we left?"
3039,1177,4,15,69,88,1.2613636363636365,0.057130801409130204,601,I don't understand why he is signaling a touchdown.
4513,1177,5,13,70,88,1.2613636363636365,0.05937307040656718,601,The quickening pace of desertification is no joke.
2891,1177,5,13,70,88,1.2613636363636365,0.05937307040656718,601,Did you really have to call him “Rocket Man”? I told you he was prickly!
4495,1177,2,19,67,88,1.2613636363636365,0.05235897659372321,601,I get the feeling the border's crossing us.
2392,1177,2,19,67,88,1.2613636363636365,0.05235897659372321,601,Sometimes a saguaro is just a saguaro.
331,1177,4,15,69,88,1.2613636363636365,0.057130801409130204,601,Your costume is succulent.
336,1177,5,13,70,88,1.2613636363636365,0.05937307040656718,601,Now you're just being a prick.
1016,1177,4,15,69,88,1.2613636363636365,0.057130801409130204,601,"And when there were only one set of footprints in the sand know that it was I, the Cact-lord, who carried you."
2694,1177,5,13,70,88,1.2613636363636365,0.05937307040656718,601,"""I'm not the fastest, but I never need to stop for water."
1626,1177,3,17,68,88,1.2613636363636365,0.05479685620357946,601,Hold your water! We're almost there...
1651,1177,5,13,70,88,1.2613636363636365,0.05937307040656718,601,Maybe we shouldn't have eaten his peyote buds.
1039,1177,3,17,68,88,1.2613636363636365,0.05479685620357946,601,That prick is actually following us!
1660,1177,3,17,68,88,1.2613636363636365,0.05479685620357946,601,You pissed on the wrong prick.
1747,1177,4,15,69,88,1.2613636363636365,0.057130801409130204,601,They didn’t mention this feature in the brochure.
1769,1177,5,13,70,88,1.2613636363636365,0.05937307040656718,601,It doesn't look Norwegian.
1877,1177,2,19,67,88,1.2613636363636365,0.05235897659372321,601,"Mirage, smirage, I still think it's following us."
2013,1177,6,11,71,88,1.2613636363636365,0.06153368597245653,601,"When Steve goes local, he really commits."
2315,1177,4,15,69,88,1.2613636363636365,0.057130801409130204,601,The point of this exercise is to not get the point.
2736,1205,4,16,72,92,1.2608695652173914,0.055447545442538,601,"Well, so much for the scenic route..."
192,1206,2,16,59,77,1.2597402597402598,0.056687428890267476,601,"Don’t complain. He promised us running water, and he delivered."
1878,1207,4,13,64,81,1.2592592592592593,0.0602919281337026,601,"Bob, I think I've figured out what that sign meant that said, ""Please don't disturb the cacti""."
2022,1207,4,13,64,81,1.2592592592592593,0.0602919281337026,601,wow! These border patrol agents are getting really creative.
4605,1207,0,21,60,81,1.2592592592592593,0.04899539464934425,601,"No, you're wrong... the green movement truly is extraordinary here in the desert!"
4485,1210,3,16,66,85,1.2588235294117647,0.055893408901902156,601,"Honey, are you sure this witness protection program was such a good idea?"
4583,1210,3,16,66,85,1.2588235294117647,0.055893408901902156,601,"Hurry up honey, unless you want an acupuncture treatment with your workout!"
3229,1210,4,14,67,85,1.2588235294117647,0.05834539573516631,601,Show me your papers!
644,1210,3,16,66,85,1.2588235294117647,0.055893408901902156,601,"Yeah, those mushrooms were perfectly safe."
2254,1210,4,14,67,85,1.2588235294117647,0.05834539573516631,601,I told you not to feed it.
381,1210,3,16,66,85,1.2588235294117647,0.055893408901902156,601,We may need to upgrade our Witness Protection Program coverage.
2307,1210,1,20,64,85,1.2588235294117647,0.05063446522912414,601,Couldn't we have simply carried several canteens?
2394,1217,5,13,71,89,1.2584269662921348,0.058775576632546685,601,Did you tell your Mom where we were going on our honeymoon?
1027,1218,3,15,64,82,1.2560975609756098,0.0570555644212122,601,"""Next time try to remember, it's cacti not cactuses""."
1849,1218,5,11,66,82,1.2560975609756098,0.062109304262145476,601,"Yes, you're right .... it's peyote!"
4772,1218,3,15,64,82,1.2560975609756098,0.0570555644212122,601,Maybe it's just thirsty
4113,1221,4,14,68,86,1.255813953488372,0.05774145523777671,601,It says its not armed
4076,1221,2,18,66,86,1.255813953488372,0.052790908597419986,601,Tell me if you need water
4050,1221,3,16,67,86,1.255813953488372,0.05532158567646684,601,We’re not the only ones who resolved to get more exercise this year.
3905,1221,7,8,71,86,1.255813953488372,0.06445827399666161,601,ARE YOU CRAZY !!!! A THREE-WAY IS OUT OF THE QUESTION !!!
3297,1221,4,14,68,86,1.255813953488372,0.05774145523777671,601,"Remind me, what percent water are we?"
3459,1221,7,8,71,86,1.255813953488372,0.06445827399666161,601,Not even a hug?
3345,1221,4,14,68,86,1.255813953488372,0.05774145523777671,601,"'Keep running! We're faster than he is, but he won't have to stop for water."""
3274,1221,5,12,69,86,1.255813953488372,0.060063911495953054,601,"OMG, the Global Warming YETI!"
4119,1221,5,12,69,86,1.255813953488372,0.060063911495953054,601,I thought you said what happens in Oaxaca stays in Oaxaca.
3753,1221,2,18,66,86,1.255813953488372,0.052790908597419986,601,"Jeez, who knew he would be so protective of that little peyote?"
4262,1221,3,16,67,86,1.255813953488372,0.05532158567646684,601,"But sweetie, when you said stick’em up, he did!"
3201,1221,6,10,70,86,1.255813953488372,0.062299849722219976,601,'I said you'd regret eating the worm...'
4355,1221,5,12,69,86,1.255813953488372,0.060063911495953054,601,"Hurry up, it’s cactusing up with us."
4397,1221,2,18,66,86,1.255813953488372,0.052790908597419986,601,What did you say to it?
4455,1221,2,18,66,86,1.255813953488372,0.052790908597419986,601,It wants your water bottle !!
4641,1221,5,12,69,86,1.255813953488372,0.060063911495953054,601,"I am never running another ""adventure"" marathon again."
4728,1221,1,20,65,86,1.255813953488372,0.05013264624297865,601,Let's name him Spike
4823,1221,5,12,69,86,1.255813953488372,0.060063911495953054,601,You're the one who said I needed to find us a cheaper personal trainer.
4833,1221,4,14,68,86,1.255813953488372,0.05774145523777671,601,You shouldn't have needled him. He's prickly about his weight.
4875,1221,2,18,66,86,1.255813953488372,0.052790908597419986,601,"He’s built for speed, not for comfort."
4893,1221,1,20,65,86,1.255813953488372,0.05013264624297865,601,Wait! I think he just wants a hug.
4931,1221,3,16,67,86,1.255813953488372,0.05532158567646684,601,Pump your arms — it’ll look more natural.
4288,1221,4,14,68,86,1.255813953488372,0.05774145523777671,601,"Honey, don't look now, but your prickly past is catching up with us."
3179,1221,3,16,67,86,1.255813953488372,0.05532158567646684,601,That guy has a short stride but he is a natural.
1405,1221,6,10,70,86,1.255813953488372,0.062299849722219976,601,Just ignore the prick.
2922,1221,6,10,70,86,1.255813953488372,0.062299849722219976,601,Run faster!! I'm pretty Saguero that he's gonna cactus!
232,1221,3,16,67,86,1.255813953488372,0.05532158567646684,601,"Aren't mirages supposed to be enticing, and in front of you?"
283,1221,4,14,68,86,1.255813953488372,0.05774145523777671,601,BALLISTIC MISSILE THREAT INBOUND TO ARIZONA. SEEK IMMEDIATE SHELTER. THIS IS NOT A DRILL.
415,1221,6,10,70,86,1.255813953488372,0.062299849722219976,601,"Don't worry, it's just a dry run."
528,1221,1,20,65,86,1.255813953488372,0.05013264624297865,601,"Yikes! When they named it ""The Living Desert"", they sure weren't kidding!"
586,1221,3,16,67,86,1.255813953488372,0.05532158567646684,601,I hate CrossFit.
1075,1221,3,16,67,86,1.255813953488372,0.05532158567646684,601,It's not personal. He's trying to get his steps in.
1149,1221,5,12,69,86,1.255813953488372,0.060063911495953054,601,It's either following us or we had way too much peyote.
1252,1221,6,10,70,86,1.255813953488372,0.062299849722219976,601,I told you not to needle him about his dry humour.
1320,1221,3,16,67,86,1.255813953488372,0.05532158567646684,601,It's just Border Patrol stepping up its efforts.
2959,1221,2,18,66,86,1.255813953488372,0.052790908597419986,601,Ever get that prickly feeling that someone is following you?
58,1221,4,14,68,86,1.255813953488372,0.05774145523777671,601,Who knew it would enjoy this so much?
1412,1221,3,16,67,86,1.255813953488372,0.05532158567646684,601,"For a moment, I thought it was a cactus."
1707,1221,2,18,66,86,1.255813953488372,0.052790908597419986,601,I think it’s trying to surrender.
1734,1221,5,12,69,86,1.255813953488372,0.060063911495953054,601,You are right; the resemblance to Trump is uncanny...both are big Pricks!!
1764,1221,6,10,70,86,1.255813953488372,0.062299849722219976,601,"If there's one thing I can't stand, it's a prick that doesn't know when to quit."
1821,1221,6,10,70,86,1.255813953488372,0.062299849722219976,601,"Honey, remember when I said ""Get outta here you big prick"" and you thought I was talking to you..."
1925,1221,5,12,69,86,1.255813953488372,0.060063911495953054,601,"Oh great, some prick is following us!"
2051,1221,3,16,67,86,1.255813953488372,0.05532158567646684,601,Let's stop focusing on our form and just go fast.
2088,1221,6,10,70,86,1.255813953488372,0.062299849722219976,601,"Yes, dear, I know it is not keeping up with us, but that's not really the main point, is it?"""
2158,1221,4,14,68,86,1.255813953488372,0.05774145523777671,601,"Honey, I'm just saying that it's only weird because it is leavin footprint and we are not."
2500,1221,4,14,68,86,1.255813953488372,0.05774145523777671,601,We have a cereus problem
2755,1221,4,14,68,86,1.255813953488372,0.05774145523777671,601,Maybe we should have waited longer before eating more of those edibles...
1535,1221,4,14,68,86,1.255813953488372,0.05774145523777671,601,"Pretty good border-crossing costume you got there, but you have do something about the footprints!"
895,1270,5,13,72,90,1.2555555555555555,0.058189734672459324,601,I think we should stop doing our jog in Area 51.
3996,1271,4,11,60,75,1.2533333333333334,0.06322655769214071,601,I think you gave it too much water.
4945,1272,3,15,65,83,1.2530120481927711,0.056448347670580504,601,Where did you pour out your energy drink?
2556,1272,5,11,67,83,1.2530120481927711,0.061433970043286566,601,"When the wall gets built, we can stop worrying about all this undercover surveillance."
2601,1272,3,15,65,83,1.2530120481927711,0.056448347670580504,601,I told you we should stay away from the old nuclear test site.
2652,1272,2,17,64,83,1.2530120481927711,0.05378250267948101,601,The border control vigilantes are not fooling around.
2710,1272,5,11,67,83,1.2530120481927711,0.061433970043286566,601,I warned you not to water it Bill.
2799,1272,2,17,64,83,1.2530120481927711,0.05378250267948101,601,Mother Nature's definitely on the run.
3000,1272,2,17,64,83,1.2530120481927711,0.05378250267948101,601,I think someone else is thirsty.
3030,1272,4,13,66,83,1.2530120481927711,0.058993849806645786,601,Looks like Jerry's coming down with a bad case of prickly heat again...
3089,1272,3,15,65,83,1.2530120481927711,0.056448347670580504,601,"Hey, he didn't get funding for the fence but this moving cactus is impressive."
3168,1272,3,15,65,83,1.2530120481927711,0.056448347670580504,601,Hurry. I only wanted a selfie. I didn't want to adopt him. Hurry.
3347,1272,3,15,65,83,1.2530120481927711,0.056448347670580504,601,Wait!! I'll bloom in a few months!
2406,1272,3,15,65,83,1.2530120481927711,0.056448347670580504,601,Do you think he's just trying to needle us?
3419,1272,4,13,66,83,1.2530120481927711,0.058993849806645786,601,"Hmm, maybe I should reconsider my position on climate change"
3635,1272,2,17,64,83,1.2530120481927711,0.05378250267948101,601,"His base may be soft, but he’s spiking in the polls!"
3884,1272,3,15,65,83,1.2530120481927711,0.056448347670580504,601,But all it wants is a hug!
4000,1272,2,17,64,83,1.2530120481927711,0.05378250267948101,601,"He'd go faster if he used his ""arms"" like we do."
4030,1272,4,13,66,83,1.2530120481927711,0.058993849806645786,601,"If that big cactus catches up with us, we'll be stuck with him!"
4176,1272,2,17,64,83,1.2530120481927711,0.05378250267948101,601,Wait--I think he's in pain! Hand me your tweezers.
4460,1272,4,13,66,83,1.2530120481927711,0.058993849806645786,601,Is this just a dry run?
4765,1272,7,7,69,83,1.2530120481927711,0.0660442987381964,601,But we're so green! We're not leaving even actual footprints!
4768,1272,2,17,64,83,1.2530120481927711,0.05378250267948101,601,"Well, honey, now we know ""who cares"" if you step on the cryptobiotic soil."
4797,1272,5,11,67,83,1.2530120481927711,0.061433970043286566,601,Huh. I always thought it was the fern that would be clingy.
4863,1272,3,15,65,83,1.2530120481927711,0.056448347670580504,601,I'm not sure I like these new fitness trackers...
3534,1272,2,17,64,83,1.2530120481927711,0.05378250267948101,601,"All right, we're leaving. No need to get all prickly about it."
2102,1272,4,13,66,83,1.2530120481927711,0.058993849806645786,601,"If only I had known this is what the climatologists meant when they said, ""some plants will expand their ranges in a warmer world."""
4310,1272,6,9,68,83,1.2530120481927711,0.06378080460099089,601,Last one in is a rotten monotypic genus Carnegiea!
2043,1272,4,13,66,83,1.2530120481927711,0.058993849806645786,601,This brings new meaning to the word ‘Stalker’...
46,1272,4,13,66,83,1.2530120481927711,0.058993849806645786,601,I don’t trust him. He looks a bit rootless.
564,1272,5,11,67,83,1.2530120481927711,0.061433970043286566,601,Prick up the pace.
620,1272,3,15,65,83,1.2530120481927711,0.056448347670580504,601,"Yep, he's still trying to stick to us."
676,1272,2,17,64,83,1.2530120481927711,0.05378250267948101,601,But his gesture suggests he means us no harm!
680,1272,3,15,65,83,1.2530120481927711,0.056448347670580504,601,I wish we had just bought Fitbits.
710,1272,5,11,67,83,1.2530120481927711,0.061433970043286566,601,Do you believe in global warming NOW?
2096,1272,4,13,66,83,1.2530120481927711,0.058993849806645786,601,"Honey, we're being followed by some prick."
763,1272,5,11,67,83,1.2530120481927711,0.061433970043286566,601,Is it really necessary for your bodyguard to wear a disguise?
802,1272,3,15,65,83,1.2530120481927711,0.056448347670580504,601,Run faster & he won't cact-us!
892,1272,2,17,64,83,1.2530120481927711,0.05378250267948101,601,Uh Oh! Sticker shock.
950,1272,4,13,66,83,1.2530120481927711,0.058993849806645786,601,"You're wearing sweatpants in the desert! Stop! Cut me open and drink some water! Touchdown! God, it's hot out here. What kind of shithole country is this?"
717,1272,3,15,65,83,1.2530120481927711,0.056448347670580504,601,Don't you want to see the rest of my routine?
988,1272,4,13,66,83,1.2530120481927711,0.058993849806645786,601,This new trainer is a real prick
1829,1272,3,15,65,83,1.2530120481927711,0.056448347670580504,601,He's less of a slasher and more of a prick.
964,1272,4,13,66,83,1.2530120481927711,0.058993849806645786,601,Are saguaros carnivorous?
1629,1272,3,15,65,83,1.2530120481927711,0.056448347670580504,601,What does this prick want from us?
1326,1272,6,9,68,83,1.2530120481927711,0.06378080460099089,601,At least its not running for congress
1293,1272,6,9,68,83,1.2530120481927711,0.06378080460099089,601,There's been a spike in crime in this neighborhood. I found a dirty needle last week and I'm pretty sure this prick is following us.
1662,1272,3,15,65,83,1.2530120481927711,0.056448347670580504,601,No fair-you have to count to ten first.
1125,1272,5,11,67,83,1.2530120481927711,0.061433970043286566,601,Don't move! This is a stick up.
1087,1272,5,11,67,83,1.2530120481927711,0.061433970043286566,601,Just my imagination running away with me..
1009,1272,4,13,66,83,1.2530120481927711,0.058993849806645786,601,You don’t suck. I said you were a succulent.
998,1272,4,13,66,83,1.2530120481927711,0.058993849806645786,601,It's almost as if it has been storing water for exactly this purpose.
1241,1272,8,5,70,83,1.2530120481927711,0.06823274694815151,601,"If this is a new border wall patrol tactic, it's working!"
1428,1323,5,12,70,87,1.2528735632183907,0.05944227735348059,601,It's scary - even in this heat he never sweats!
2487,1324,2,17,65,84,1.25,0.05322367527583983,601,"Honey, did you leave a tip at that last rest stop?"
4739,1324,3,15,66,84,1.25,0.05585357054399395,601,I told you the wall wouldn't keep out those catixicans.
4722,1324,2,17,65,84,1.25,0.05322367527583983,601,"First it was the polar bears, now these guys are heading to more hospitable climes."
4253,1324,3,15,66,84,1.25,0.05585357054399395,601,You can have the first hug.
4090,1324,3,15,66,84,1.25,0.05585357054399395,601,Remind me to shave my underarms when we're done jogging!
3545,1324,6,9,69,84,1.25,0.06308887810420712,601,"Saguaro, smaguaro; who cares. Just hurry, he's catching up."
3316,1324,5,11,68,84,1.25,0.060772895338321996,601,"If you raise your arms, it's easier to breathe."
3266,1324,2,17,65,84,1.25,0.05322367527583983,601,"Oh, I see what you mean about getting stuck out here."
2452,1324,5,11,68,84,1.25,0.060772895338321996,601,The acupuncture did wonders for his spine condition.
4811,1324,6,9,69,84,1.25,0.06308887810420712,601,"It’s not you, it’s all the pricks around you."
2269,1324,6,9,69,84,1.25,0.06308887810420712,601,It doesn't want to be deserted.
2136,1324,4,13,67,84,1.25,0.05836508438405425,601,"...AND, he just called us a prickly pair!"
1900,1324,3,15,66,84,1.25,0.05585357054399395,601,"Leave him in the desert, you said He’d be better of wild, you said."
1422,1324,2,17,65,84,1.25,0.05322367527583983,601,I think it wants to give up.
1164,1324,5,11,68,84,1.25,0.060772895338321996,601,Who made that mushroom pizza?
1035,1324,4,11,61,76,1.25,0.06247806632675042,601,Remember that energy drink you poured out?
947,1324,7,7,70,84,1.25,0.06532280056069527,601,I was hoping the whole 'women being chased by little pricks thing' would end in 2017.
880,1324,6,9,69,84,1.25,0.06308887810420712,601,"I know he's a prick, but we can't desert him."
2440,1324,2,17,65,84,1.25,0.05322367527583983,601,Did that cactus just say... Don't shoot.?
4565,1343,3,15,67,85,1.2470588235294118,0.05527086941984991,601,Remind me why peyote Gatorade was a good idea?
2209,1343,5,11,69,85,1.2470588235294118,0.060125644246543875,601,This acid trip is getting more succulent by the minute!
2590,1343,6,9,70,85,1.2470588235294118,0.0624115785802593,601,This won't happen once Trump gets his wall.
3312,1346,3,14,64,81,1.2469135802469136,0.0570111105630559,601,You dumped me for a jogger?
3852,1346,1,18,62,81,1.2469135802469136,0.051312598618815826,601,What test site was it again we were jogging past?
3870,1346,3,14,64,81,1.2469135802469136,0.0570111105630559,601,"Don't panic, but we're in a bit of a prickly situation..."
3847,1346,2,16,63,81,1.2469135802469136,0.05423674725058963,601,"Wait up guys, I got a thorn in my shoe."
3814,1346,3,14,64,81,1.2469135802469136,0.0570111105630559,601,Apparently the wall wasn't approved.
3390,1346,4,12,65,81,1.2469135802469136,0.05965658976962751,601,Looking sharp man
3353,1346,5,10,66,81,1.2469135802469136,0.06218963481361076,601,This wouldn’t have happened … if he built that wall!
3160,1346,5,10,66,81,1.2469135802469136,0.06218963481361076,601,Can we keep him?
2908,1346,2,16,63,81,1.2469135802469136,0.05423674725058963,601,You can stop running. It just signaled a touchdown.
3133,1346,5,10,66,81,1.2469135802469136,0.06218963481361076,601,"Just ignore it, Martha. It's nothing but another attention-seeking prick."
3098,1346,4,12,65,81,1.2469135802469136,0.05965658976962751,601,I was told that this personal trainer may seem rough on the outside but soft on the inside.
3084,1346,5,10,66,81,1.2469135802469136,0.06218963481361076,601,"Pace yourself, our friend behind us can go a long way without hydrating."
4008,1346,3,14,64,81,1.2469135802469136,0.0570111105630559,601,These new border guards are real pricks.
2780,1346,5,10,66,81,1.2469135802469136,0.06218963481361076,601,Anything can be a dildo if you're brave enough
2703,1346,3,14,64,81,1.2469135802469136,0.0570111105630559,601,"Honey, I'm getting a prickly sensation that someone is following us."
2697,1346,4,12,65,81,1.2469135802469136,0.05965658976962751,601,"Darn it, I told you not to pee on that cactus."
2639,1346,3,14,64,81,1.2469135802469136,0.0570111105630559,601,You're it!
3157,1346,4,12,65,81,1.2469135802469136,0.05965658976962751,601,"oh come on, just one hug"
