target_id,mean,precision,count,score,caption,contest,funny,somewhat_funny,unfunny,counts,rank
1067,1.1914893617021276,0.05299666907573581,94,1.1914893617021276,The Mexican angels complained about cultural appropriation.,620,5,8,81,94,2390
1145,1.1914893617021276,0.05299666907573581,94,1.1914893617021276,Maybe it's filled with kinky stuff?,620,5,8,81,94,2390
1175,1.1914893617021276,0.05299666907573581,94,1.1914893617021276,This is why they're so damned fired up to get to Mars?,620,5,8,81,94,2390
1213,1.1914893617021276,0.04351464736732185,94,1.1914893617021276,And to think some believe climate change is the biggest threat to the earth's future.,620,1,16,77,94,2390
1263,1.1914893617021276,0.04848799577537426,94,1.1914893617021276,The game got a lot better when we started filling it with infinite gratification.,620,3,12,79,94,2390
1322,1.1914893617021276,0.050792384603578926,94,1.1914893617021276,Last time we got dinosaurs...,620,4,10,80,94,2390
1476,1.1914893617021276,0.05299666907573581,94,1.1914893617021276,Is this racist?,620,5,8,81,94,2390
1527,1.1914893617021276,0.04848799577537426,94,1.1914893617021276,No one swings like Sinatra.,620,3,12,79,94,2390
1582,1.1914893617021276,0.04848799577537426,94,1.1914893617021276,"I thought you said he played for the Yankees.""",620,3,12,79,94,2390
1615,1.1914893617021276,0.050792384603578926,94,1.1914893617021276,Just wait till Trump gets here.,620,4,10,80,94,2390
1648,1.1914893617021276,0.05299666907573581,94,1.1914893617021276,"Wow, has he really hit D.C. each time?",620,5,8,81,94,2390
1651,1.1914893617021276,0.04848799577537426,94,1.1914893617021276,Piñatarmageddearth Day,620,3,12,79,94,2390
1710,1.1914893617021276,0.05299666907573581,94,1.1914893617021276,"Okay, so he hits it, so who is the lucky one to gets tell God?",620,5,8,81,94,2390
1794,1.1914893617021276,0.04606848309753145,94,1.1914893617021276,Lucifer's gonna fall if he keeps swinging like that,620,2,14,78,94,2390
1814,1.1914893617021276,0.050792384603578926,94,1.1914893617021276,I wish Napolean Dynamite were here.,620,4,10,80,94,2390
2135,1.1914893617021276,0.050792384603578926,94,1.1914893617021276,"It's a perk of being a Horseman of the Apocalypse, but it's a bit too on-the-nose for me.",620,4,10,80,94,2390
2208,1.1914893617021276,0.04848799577537426,94,1.1914893617021276,"Sing faster, its been his turn since last January!",620,3,12,79,94,2390
2268,1.1914893617021276,0.05299666907573581,94,1.1914893617021276,"Oh God, he's going to be pissed when he finds out we forgot the Jujubes.",620,5,8,81,94,2390
2396,1.1914893617021276,0.04351464736732185,94,1.1914893617021276,The seam in North Korea is the trick.,620,1,16,77,94,2390
2499,1.1914893617021276,0.050792384603578926,94,1.1914893617021276,We don't play dice with the world. That was before Trump.,620,4,10,80,94,2390
2569,1.1914893617021276,0.050792384603578926,94,1.1914893617021276,None of the good hitters can get up here.,620,4,10,80,94,2390
2611,1.1914893617021276,0.04848799577537426,94,1.1914893617021276,He's still trying to make the Yankees.,620,3,12,79,94,2390
2750,1.1914893617021276,0.04848799577537426,94,1.1914893617021276,Next we'll choose their president by pin-the-tail-on-the-donkey,620,3,12,79,94,2390
2801,1.1914893617021276,0.05299666907573581,94,1.1914893617021276,And for all those years I thought the world revolved around me.,620,5,8,81,94,2390
3244,1.1914893617021276,0.04848799577537426,94,1.1914893617021276,"Silly humans, they think chaos is caused by a Trump tweet.",620,3,12,79,94,2390
3277,1.1914893617021276,0.04848799577537426,94,1.1914893617021276,No worry. He's only trying to destroy it out of love.,620,3,12,79,94,2390
3458,1.1914893617021276,0.04606848309753145,94,1.1914893617021276,And they thought climate change would be their demise.,620,2,14,78,94,2390
3611,1.1914893617021276,0.050792384603578926,94,1.1914893617021276,That’s strike #665.,620,4,10,80,94,2390
3635,1.1914893617021276,0.05299666907573581,94,1.1914893617021276,This is the Day of Judgement.,620,5,8,81,94,2390
3691,1.1914893617021276,0.03937453030062218,94,1.1914893617021276,And.........this is how He keeps the world spinning?,620,0,19,76,95,2390
3752,1.1914893617021276,0.04351464736732185,94,1.1914893617021276,I can't stand spiritual appropriation!,620,1,16,77,94,2390
3782,1.1914893617021276,0.050792384603578926,94,1.1914893617021276,"If it's candy in there, I call dibs on the Milky Ways and Mars Bars.",620,4,10,80,94,2390
3835,1.1914893617021276,0.04848799577537426,94,1.1914893617021276,Try to hit it on North Korea so all the minerals will fall out...,620,3,12,79,94,2390
3873,1.1914893617021276,0.04606848309753145,94,1.1914893617021276,It's full of starving children.,620,2,14,78,94,2390
3875,1.1914893617021276,0.04606848309753145,94,1.1914893617021276,It can't be Ted Williams. He's still on ice.,620,2,14,78,94,2390
3906,1.1914893617021276,0.04606848309753145,94,1.1914893617021276,Last year we used Pluto. Took him three hours.,620,2,14,78,94,2390
4069,1.1914893617021276,0.050792384603578926,94,1.1914893617021276,"The President wants to make sure Mexico knows he is very
serious about cancelling NAFTA.",620,4,10,80,94,2390
4101,1.1914893617021276,0.04848799577537426,94,1.1914893617021276,"Batta, batta, batta, batta, batta. Sa-WING, batta !!!",620,3,12,79,94,2390
4146,1.1914893617021276,0.050792384603578926,94,1.1914893617021276,This got a lot less fun after 2016,620,4,10,80,94,2390
4192,1.1914893617021276,0.04606848309753145,94,1.1914893617021276,Iiiit's a Wing and a Miss!,620,2,14,78,94,2390
4245,1.1914893617021276,0.05511286177044542,94,1.1914893617021276,"It is part of our new diversity sensitivity program 
in response to the Trump immigration doctrine""",620,6,6,82,94,2390
4295,1.1914893617021276,0.050792384603578926,94,1.1914893617021276,A blind angel can beat a sighted devil any day.,620,4,10,80,94,2390
4351,1.1914893617021276,0.05299666907573581,94,1.1914893617021276,"After doing this for eternity, you'd think he'd be better at it.",620,5,8,81,94,2390
4360,1.1914893617021276,0.05511286177044542,94,1.1914893617021276,"It's only a papier-mâché world, hanging over a cardboard sea.",620,6,6,82,94,2390
4369,1.1914893617021276,0.04606848309753145,94,1.1914893617021276,He does this every time he sees a new Star Wars movie.,620,2,14,78,94,2390
4374,1.1914893617021276,0.04848799577537426,94,1.1914893617021276,"Well, he did hit Kilauea last time.",620,3,12,79,94,2390
4406,1.1914893617021276,0.050792384603578926,94,1.1914893617021276,"Well, so much for my geology degree.",620,4,10,80,94,2390
4530,1.1914893617021276,0.04848799577537426,94,1.1914893617021276,Do you suppose he has no idea there are no bleachers up here?,620,3,12,79,94,2390
4603,1.1914893617021276,0.050792384603578926,94,1.1914893617021276,‘Cause we couldn’t get enough candy in the flat one.,620,4,10,80,94,2390
4623,1.1914893617021276,0.03937453030062218,94,1.1914893617021276,She just thinks she's got the world on a string,620,0,19,76,95,2390
4681,1.1914893617021276,0.050792384603578926,94,1.1914893617021276,Angels at play JUST BEFORE the dinosaurs went away.,620,4,10,80,94,2390
4742,1.1914893617021276,0.04606848309753145,94,1.1914893617021276,It's a flat-earther birthday party.,620,2,14,78,94,2390
163,1.1894736842105262,0.05247456983868302,95,1.1894736842105262,"Next year, let's play pin the tail on Jupiter",620,5,8,82,95,2458
804,1.1894736842105262,0.045625518983945526,95,1.1894736842105262,Michael always was a bully.,620,2,14,79,95,2458
1238,1.1894736842105262,0.045625518983945526,95,1.1894736842105262,Looks like the editors of the New Yorker Cartoon Caption Contest are trying to find a funny caption.,620,2,14,79,95,2458
1340,1.1894736842105262,0.04801720679389688,95,1.1894736842105262,I'm so relieved. They're starting to go bad.,620,3,12,80,95,2458
2394,1.1894736842105262,0.04801720679389688,95,1.1894736842105262,"If he hits, we're gonna be mobbed.",620,3,12,80,95,2458
2908,1.1894736842105262,0.04801720679389688,95,1.1894736842105262,Looks like he’s still holding a grudge!,620,3,12,80,95,2458
14,1.184782608695652,0.04618599010841946,92,1.184782608695652,"This could get interesting. He calls the stick his ""Trump.""",620,2,13,77,92,2464
42,1.184782608695652,0.0487035648134137,92,1.184782608695652,"November 8, 2016",620,3,11,78,92,2464
66,1.184782608695652,0.04352302998477532,92,1.184782608695652,It may be sinful - but i wanted him to miss.,620,1,15,76,92,2464
87,1.184782608695652,0.05557618064650086,92,1.184782608695652,"He was a California Angel and
couldn't hit the side of a barn",620,6,5,81,92,2464
91,1.184782608695652,0.04352302998477532,92,1.184782608695652,Surely he can't miss 2019 times in a row.,620,1,15,76,92,2464
109,1.184782608695652,0.04618599010841946,92,1.184782608695652,"Look away, the magma's about to go everywhere.",620,2,13,77,92,2464
129,1.184782608695652,0.05109724815265259,92,1.184782608695652,This is the Cinco de Mayo from Hell.,620,4,9,79,92,2464
199,1.184782608695652,0.04352302998477532,92,1.184782608695652,"Just wait, this is going to be even better than when we flooded it!",620,1,15,76,92,2464
207,1.184782608695652,0.0487035648134137,92,1.184782608695652,"Relax Peter, it's just a prank.",620,3,11,78,92,2464
228,1.184782608695652,0.04618599010841946,92,1.184782608695652,"The last time he hit it, a bunch of dinosaurs cane tumbling out.",620,2,13,77,92,2464
280,1.184782608695652,0.04618599010841946,92,1.184782608695652,He used to be in politics.,620,2,13,77,92,2464
311,1.184782608695652,0.04618599010841946,92,1.184782608695652,I'll bet we can trade him to the Mets,620,2,13,77,92,2464
327,1.184782608695652,0.04618599010841946,92,1.184782608695652,"Yippee, blazing-hot magma for everybody.",620,2,13,77,92,2464
351,1.184782608695652,0.04618599010841946,92,1.184782608695652,How did we wind up in heaven anyway?,620,2,13,77,92,2464
357,1.184782608695652,0.04618599010841946,92,1.184782608695652,Sometimes Jesus is a tad vindictive.,620,2,13,77,92,2464
387,1.184782608695652,0.0487035648134137,92,1.184782608695652,He played for the Angels during their down years,620,3,11,78,92,2464
397,1.184782608695652,0.05109724815265259,92,1.184782608695652,He realizes we were told not to do this again after what happened in the last election.,620,4,9,79,92,2464
427,1.184782608695652,0.04618599010841946,92,1.184782608695652,There goes the Middle East again,620,2,13,77,92,2464
439,1.184782608695652,0.0487035648134137,92,1.184782608695652,He's no longer the world beater he was as a cherub.,620,3,11,78,92,2464
458,1.184782608695652,0.05109724815265259,92,1.184782608695652,"After it cracks open, candy will fall out, and we’ll race to get as much candy as we can. But, I’ll collect more candy than you.",620,4,9,79,92,2464
484,1.184782608695652,0.04352302998477532,92,1.184782608695652,"I wonder how the ""Flat Earth"" folks will compensate.",620,1,15,76,92,2464
511,1.184782608695652,0.05109724815265259,92,1.184782608695652,He only has until it blows itself up.,620,4,9,79,92,2464
519,1.184782608695652,0.0487035648134137,92,1.184782608695652,I always thought money made the world go 'round.,620,3,11,78,92,2464
545,1.184782608695652,0.05109724815265259,92,1.184782608695652,He can't hit Trump's curve balls.,620,4,9,79,92,2464
608,1.184782608695652,0.04618599010841946,92,1.184782608695652,Justice is blind.,620,2,13,77,92,2464
621,1.184782608695652,0.0487035648134137,92,1.184782608695652,No wonder they can't predict the rapture,620,3,11,78,92,2464
709,1.184782608695652,0.0487035648134137,92,1.184782608695652,"Yeah, there could be some unseen consequences, but it's a downer to bring that up about at a birthday party.",620,3,11,78,92,2464
734,1.184782608695652,0.04618599010841946,92,1.184782608695652,It’s called an earthquake.,620,2,13,77,92,2464
755,1.184782608695652,0.05109724815265259,92,1.184782608695652,The idea that Earth spins around the Sun was batted around well before Copernicus.,620,4,9,79,92,2464
778,1.184782608695652,0.0487035648134137,92,1.184782608695652,It puts a whole new 'spin' on guardian angel!,620,3,11,78,92,2464
782,1.184782608695652,0.05109724815265259,92,1.184782608695652,I hear they call this a Piñata down there and it's full of candy.,620,4,9,79,92,2464
824,1.184782608695652,0.05109724815265259,92,1.184782608695652,"Your turn, Donald",620,4,9,79,92,2464
826,1.184782608695652,0.05109724815265259,92,1.184782608695652,It's a compromise between the Electoral College and direct elections.,620,4,9,79,92,2464
840,1.184782608695652,0.0487035648134137,92,1.184782608695652,.... this is whirled peace?  on earth!,620,3,11,78,92,2464
995,1.184782608695652,0.05109724815265259,92,1.184782608695652,I think God's finally given up on Earth....,620,4,9,79,92,2464
1006,1.184782608695652,0.0487035648134137,92,1.184782608695652,God only knows what’s going to happen once it breaks open,620,3,11,78,92,2464
1023,1.184782608695652,0.0487035648134137,92,1.184782608695652,He thinks he can shatter the blind faith of the world!,620,3,11,78,92,2464
1133,1.184782608695652,0.05109724815265259,92,1.184782608695652,I’d wager he was a former Met!,620,4,9,79,92,2464
1146,1.184782608695652,0.0487035648134137,92,1.184782608695652,Apparently justice is not the only thing that is blind.,620,3,11,78,92,2464
1168,1.184782608695652,0.04352302998477532,92,1.184782608695652,Science is right about everything except why the dinosaurs went extinct.,620,1,15,76,92,2464
1199,1.184782608695652,0.04618599010841946,92,1.184782608695652,I just hope he leaves the ozone layer intact this time.,620,2,13,77,92,2464
1274,1.184782608695652,0.0487035648134137,92,1.184782608695652,Is the end of this game near?,620,3,11,78,92,2464
1291,1.184782608695652,0.05109724815265259,92,1.184782608695652,"Wow!  If he makes contact, he's going to send that thing into orbit!",620,4,9,79,92,2464
1306,1.184782608695652,0.0487035648134137,92,1.184782608695652,He’ll never bust it in 4.5 billion years....,620,3,11,78,92,2464
1336,1.184782608695652,0.05109724815265259,92,1.184782608695652,They never took good care of it anyway,620,4,9,79,92,2464
1415,1.184782608695652,0.04618599010841946,92,1.184782608695652,Three strikes and you lose your wings !,620,2,13,77,92,2464
1524,1.184782608695652,0.05338370830143902,92,1.184782608695652,"You see, there is no order to the universe. It's all random. How else could Trump get elected.",620,5,7,80,92,2464
1555,1.184782608695652,0.05109724815265259,92,1.184782608695652,"I understand Sinatra's version is the best, but this is a little ridiculous.",620,4,9,79,92,2464
1641,1.184782608695652,0.05109724815265259,92,1.184782608695652,He has been practicing for over a year. It’s called “The Donald Thump.”,620,4,9,79,92,2464
1653,1.184782608695652,0.04618599010841946,92,1.184782608695652,It feels like he's been at it for an eternity.,620,2,13,77,92,2464
1663,1.184782608695652,0.04618599010841946,92,1.184782608695652,Our ruler is tired of rolling the dice.,620,2,13,77,92,2464
1673,1.184782608695652,0.0487035648134137,92,1.184782608695652,"To say, some earthlings think disturbances are due to global warming...",620,3,11,78,92,2464
1696,1.184782608695652,0.05109724815265259,92,1.184782608695652,Blindfolded AND a poor sense of smell.,620,4,9,79,92,2464
1798,1.184782608695652,0.04618599010841946,92,1.184782608695652,"You know, Satan got it on his first swing.",620,2,13,77,92,2464
1852,1.184782608695652,0.0487035648134137,92,1.184782608695652,Since missing the dinosaur asteroid he's really upped his game.,620,3,11,78,92,2464
1855,1.184782608695652,0.05109724815265259,92,1.184782608695652,Let’s see how hard he can hit it this time.,620,4,9,79,92,2464
1915,1.184782608695652,0.05109724815265259,92,1.184782608695652,"If he is predestined to hit it, then I'm complaining to the Boss.",620,4,9,79,92,2464
1922,1.184782608695652,0.04618599010841946,92,1.184782608695652,Played for the Cubs before he got here.,620,2,13,77,92,2464
1931,1.184782608695652,0.04618599010841946,92,1.184782608695652,We’ve been trying to smash it for millennia without success.,620,2,13,77,92,2464
1935,1.184782608695652,0.04618599010841946,92,1.184782608695652,It's just hot magma and the radio-active core in the center. It's just as well we miss.,620,2,13,77,92,2464
1943,1.184782608695652,0.04618599010841946,92,1.184782608695652,"Forgive me Sid but, this one time, I'm rooting against Gehrig.",620,2,13,77,92,2464
1956,1.184782608695652,0.0487035648134137,92,1.184782608695652,He's been at it since the summit.,620,3,11,78,92,2464
1984,1.184782608695652,0.0487035648134137,92,1.184782608695652,Hasn't been close in millennia.,620,3,11,78,92,2464
1986,1.184782608695652,0.04352302998477532,92,1.184782608695652,They've got ice cream at the party downstairs... Wanna come with?,620,1,15,76,92,2464
2006,1.184782608695652,0.0487035648134137,92,1.184782608695652,"His batting average is 237, he's not getting in.",620,3,11,78,92,2464
2026,1.184782608695652,0.04618599010841946,92,1.184782608695652,I kind of miss earth too.,620,2,13,77,92,2464
2049,1.184782608695652,0.0487035648134137,92,1.184782608695652,Is this what happened to Pluto?,620,3,11,78,92,2464
2185,1.184782608695652,0.04618599010841946,92,1.184782608695652,I doubt this is what Sinatra had in mind.,620,2,13,77,92,2464
2197,1.184782608695652,0.04618599010841946,92,1.184782608695652,We're going to be here for eternity...,620,2,13,77,92,2464
2246,1.184782608695652,0.0487035648134137,92,1.184782608695652,How long until tug of warring nations?,620,3,11,78,92,2464
2257,1.184782608695652,0.0487035648134137,92,1.184782608695652,"Every time he swings, Trump sends out another Tweet.",620,3,11,78,92,2464
2290,1.184782608695652,0.04618599010841946,92,1.184782608695652,I've always liked pin the tail on the devil better.,620,2,13,77,92,2464
2390,1.184782608695652,0.04618599010841946,92,1.184782608695652,This party isn't going to end happily.,620,2,13,77,92,2464
2433,1.184782608695652,0.05109724815265259,92,1.184782608695652,He's nothing but solar wind.,620,4,9,79,92,2464
2434,1.184782608695652,0.04352302998477532,92,1.184782608695652,"I told him, fine, if you can hit it, we'll ditch the whole dinosaur idea.",620,1,15,76,92,2464
2455,1.184782608695652,0.04618599010841946,92,1.184782608695652,The Mercator projection is sooooo 16th Century.,620,2,13,77,92,2464
2491,1.184782608695652,0.04618599010841946,92,1.184782608695652,"There's no candy in it, but it's completely covered with nuts.",620,2,13,77,92,2464
2512,1.184782608695652,0.0487035648134137,92,1.184782608695652,So much for his perfect game!!!,620,3,11,78,92,2464
2524,1.184782608695652,0.04618599010841946,92,1.184782608695652,We'll break it eventually.,620,2,13,77,92,2464
2586,1.184782608695652,0.0487035648134137,92,1.184782608695652,"If he's always that bad, Adam and Eve probably could have stayed in the Garden without fear.",620,3,11,78,92,2464
2607,1.184782608695652,0.04618599010841946,92,1.184782608695652,It's no worse than what humans have done to it.,620,2,13,77,92,2464
2608,1.184782608695652,0.05109724815265259,92,1.184782608695652,It's a good thing we do this only once an eon.,620,4,9,79,92,2464
2635,1.184782608695652,0.0487035648134137,92,1.184782608695652,"Oh, shit! That's strike three!",620,3,11,78,92,2464
2685,1.184782608695652,0.04618599010841946,92,1.184782608695652,Tsunamis don't count.,620,2,13,77,92,2464
2712,1.184782608695652,0.0487035648134137,92,1.184782608695652,And here we have the Mexican-themed recreation room.,620,3,11,78,92,2464
2719,1.184782608695652,0.04618599010841946,92,1.184782608695652,"And yet he looks down on us, as if he's a ""better"" angel.",620,2,13,77,92,2464
2720,1.184782608695652,0.0487035648134137,92,1.184782608695652,We only play this when they predict the end of the world. He missed in 2012.,620,3,11,78,92,2464
2765,1.184782608695652,0.04618599010841946,92,1.184782608695652,He mastered pin the tail on the donkey so now he thinks he can conquer the world.,620,2,13,77,92,2464
2789,1.184782608695652,0.0487035648134137,92,1.184782608695652,"It's about time, isn't it?",620,3,11,78,92,2464
2806,1.184782608695652,0.0487035648134137,92,1.184782608695652,He thinks that piñata contains a heavenly solution to their troubles.,620,3,11,78,92,2464
2931,1.184782608695652,0.0487035648134137,92,1.184782608695652,You said there'd be nachos.,620,3,11,78,92,2464
2969,1.184782608695652,0.04618599010841946,92,1.184782608695652,Nice shot Gabriel! You got Africa again!,620,2,13,77,92,2464
3012,1.184782608695652,0.0487035648134137,92,1.184782608695652,I hope we get dinosaurs like last time.,620,3,11,78,92,2464
3016,1.184782608695652,0.0487035648134137,92,1.184782608695652,Fake Swing!,620,3,11,78,92,2464
3026,1.184782608695652,0.05338370830143902,92,1.184782608695652,I believe that's what they call Percussive Maintenance.,620,5,7,80,92,2464
3072,1.184782608695652,0.0487035648134137,92,1.184782608695652,You-know-who doesn't find this amusing.,620,3,11,78,92,2464
3074,1.184782608695652,0.0487035648134137,92,1.184782608695652,It was either this or cornhole.,620,3,11,78,92,2464
3080,1.184782608695652,0.04618599010841946,92,1.184782608695652,Remember that time he nicked it and all the dinosaurs died?,620,2,13,77,92,2464
3085,1.184782608695652,0.05109724815265259,92,1.184782608695652,"And on the 8th day,” am I right? Want more punch",620,4,9,79,92,2464
3104,1.184782608695652,0.04618599010841946,92,1.184782608695652,I love that chewy iron-nickel center.,620,2,13,77,92,2464
3151,1.184782608695652,0.04618599010841946,92,1.184782608695652,"If we're the better angels, what does it say about their nature.",620,2,13,77,92,2464
3169,1.184782608695652,0.0487035648134137,92,1.184782608695652,"He thinks he can stand in the middle of Heaven, do this, and not lose his wings.",620,3,11,78,92,2464
3202,1.184782608695652,0.05109724815265259,92,1.184782608695652,I think he learned it from his trip south of the border.,620,4,9,79,92,2464
3208,1.184782608695652,0.0487035648134137,92,1.184782608695652,The Rapture just isn’t bringing us the talent we thought it would .,620,3,11,78,92,2464
3217,1.184782608695652,0.0487035648134137,92,1.184782608695652,"The last time we had a piñata, it was full of dinosaurs.",620,3,11,78,92,2464
3220,1.184782608695652,0.0487035648134137,92,1.184782608695652,God throws the worst birthday parties.,620,3,11,78,92,2464
3252,1.184782608695652,0.05338370830143902,92,1.184782608695652,"No, there's nothing inside",620,5,7,80,92,2464
3255,1.184782608695652,0.0487035648134137,92,1.184782608695652,You think we've had too many birthdays recently?,620,3,11,78,92,2464
3283,1.184782608695652,0.04352302998477532,92,1.184782608695652,michael-avenatti-anthony-saramucci-donald-trump-michael-cohen-stephen-colbert-late-show-video-,620,1,15,76,92,2464
3348,1.184782608695652,0.04618599010841946,92,1.184782608695652,He misses maybe once in five billion years. Watch what happens next.,620,2,13,77,92,2464
3392,1.184782608695652,0.0487035648134137,92,1.184782608695652,Hard to say which is the bigger miracle that he keeps missing or that humans haven't completely destroyed it yet either.,620,3,11,78,92,2464
3414,1.184782608695652,0.05338370830143902,92,1.184782608695652,"Ok, but I’m taking it down in 2020",620,5,7,80,92,2464
3446,1.184782608695652,0.0487035648134137,92,1.184782608695652,"The new guy is Donald, and he took to the world piñata game instinctively.",620,3,11,78,92,2464
3542,1.184782608695652,0.04618599010841946,92,1.184782608695652,This isn’t how I pictured global denuclearization would happen,620,2,13,77,92,2464
3543,1.184782608695652,0.0487035648134137,92,1.184782608695652,"He struggled in Little Angel League, too",620,3,11,78,92,2464
3564,1.184782608695652,0.0487035648134137,92,1.184782608695652,Apostle Paul's idea?,620,3,11,78,92,2464
3593,1.184782608695652,0.0487035648134137,92,1.184782608695652,Don't call it a comeback.,620,3,11,78,92,2464
3606,1.184782608695652,0.05109724815265259,92,1.184782608695652,"In human time, each swing is the length of a presidential term.",620,4,9,79,92,2464
3623,1.184782608695652,0.0487035648134137,92,1.184782608695652,It’s just filled with used plastic bags.,620,3,11,78,92,2464
3626,1.184782608695652,0.0487035648134137,92,1.184782608695652,NASA tracks our stick as a Near Earth Object.,620,3,11,78,92,2464
3639,1.184782608695652,0.0487035648134137,92,1.184782608695652,"After all that, I'm curious to see what's inside.",620,3,11,78,92,2464
3656,1.184782608695652,0.0487035648134137,92,1.184782608695652,All of us will get a turn. These plastic coated ones are tough.,620,3,11,78,92,2464
3677,1.184782608695652,0.0487035648134137,92,1.184782608695652,It's been 4 billion years...you think he would have hit it by now!,620,3,11,78,92,2464
3712,1.184782608695652,0.04618599010841946,92,1.184782608695652,Reminds Me of an Angels vs Dodgers Game I Saw Once.,620,2,13,77,92,2464
3769,1.184782608695652,0.0487035648134137,92,1.184782608695652,"I heard that if he hits it open, hopelessness and mass destruction come out.",620,3,11,78,92,2464
3793,1.184782608695652,0.04618599010841946,92,1.184782608695652,Aren't we a little old for this?,620,2,13,77,92,2464
3851,1.184782608695652,0.04618599010841946,92,1.184782608695652,"Since we all know how this is going to end, why do we keep doing it?",620,2,13,77,92,2464
3864,1.184782608695652,0.04618599010841946,92,1.184782608695652,We could remove the blindfold and he would still miss the point.,620,2,13,77,92,2464
3909,1.184782608695652,0.04352302998477532,92,1.184782608695652,"They say his name is Lucifer, and he brought the bat from a place called ""Hell.""",620,1,15,76,92,2464
3938,1.184782608695652,0.0487035648134137,92,1.184782608695652,Atlas shrugged off the catcher,620,3,11,78,92,2464
3946,1.184782608695652,0.0487035648134137,92,1.184782608695652,So heaven is just a metaphor after all.,620,3,11,78,92,2464
3966,1.184782608695652,0.04618599010841946,92,1.184782608695652,Take it from me - don’t eat the candy that falls out.,620,2,13,77,92,2464
