target_id,mean,precision,count,score,caption,contest,funny,somewhat_funny,unfunny,counts,rank
1810,1.1369863013698631,0.04497195343285888,73,1.1369863013698631,Make a wish.,620,1,8,64,73,3665
1811,1.1369863013698631,0.04902034372964355,73,1.1369863013698631,"I bought it from some red-tied
person who insisted it was a bargain.",620,2,6,65,73,3665
1846,1.1369863013698631,0.04902034372964355,73,1.1369863013698631,He’s been swinging since 1999.,620,2,6,65,73,3665
1910,1.1369863013698631,0.04902034372964355,73,1.1369863013698631,All the prizes are plastic.,620,2,6,65,73,3665
1926,1.1369863013698631,0.04902034372964355,73,1.1369863013698631,If he ever connects there'll be shit to pay!,620,2,6,65,73,3665
2194,1.1369863013698631,0.04497195343285888,73,1.1369863013698631,Annnnnd the earthquale goes to...,620,1,8,64,73,3665
2266,1.1369863013698631,0.04497195343285888,73,1.1369863013698631,I fear contamination.,620,1,8,64,73,3665
2330,1.1369863013698631,0.04497195343285888,73,1.1369863013698631,Don't worry. Trump will fix this mess too.,620,1,8,64,73,3665
2367,1.1369863013698631,0.04497195343285888,73,1.1369863013698631,"He's been standing there since the election. He's gonna swing any minute now, just wait.",620,1,8,64,73,3665
2382,1.1369863013698631,0.04497195343285888,73,1.1369863013698631,"Take another swing, Mr. President.",620,1,8,64,73,3665
2425,1.1369863013698631,0.04902034372964355,73,1.1369863013698631,God must not be proud of this creation.,620,2,6,65,73,3665
2437,1.1369863013698631,0.04902034372964355,73,1.1369863013698631,"Bless you for asking, first the pinata, then the margaritas.",620,2,6,65,73,3665
2545,1.1369863013698631,0.04497195343285888,73,1.1369863013698631,"Hawai'i, Guatemala, what's next?",620,1,8,64,73,3665
2594,1.1369863013698631,0.04497195343285888,73,1.1369863013698631,"Didn't you just have an ""End of the World"" party, too?",620,1,8,64,73,3665
2748,1.1369863013698631,0.05275899547164993,73,1.1369863013698631,"Some like it, some don’t.  But that’s what makes the world go round.",620,3,4,66,73,3665
2862,1.1369863013698631,0.04497195343285888,73,1.1369863013698631,Maybe he should try winging it?,620,1,8,64,73,3665
2897,1.1369863013698631,0.05275899547164993,73,1.1369863013698631,"The Fundamentalist Weather Channel.
""Bunty with a 80% chance of a swing and a miss!""",620,3,4,66,73,3665
2915,1.1369863013698631,0.04902034372964355,73,1.1369863013698631,He's aiming for Anaheim.,620,2,6,65,73,3665
2971,1.1369863013698631,0.04497195343285888,73,1.1369863013698631,Well that's gonna make the Mayan's look bad...,620,1,8,64,73,3665
2988,1.1369863013698631,0.04902034372964355,73,1.1369863013698631,The trick is to hit it right on the fault line,620,2,6,65,73,3665
3001,1.1369863013698631,0.04902034372964355,73,1.1369863013698631,Why do the Lefties always swing for the fences?,620,2,6,65,73,3665
3006,1.1369863013698631,0.04902034372964355,73,1.1369863013698631,Ifs this supposed to be a metaphor?,620,2,6,65,73,3665
3035,1.1369863013698631,0.04902034372964355,73,1.1369863013698631,It just keeps orbiting,620,2,6,65,73,3665
3111,1.1369863013698631,0.04902034372964355,73,1.1369863013698631,The apocalypse is scheduled for cinco de mayo.,620,2,6,65,73,3665
3119,1.1369863013698631,0.04902034372964355,73,1.1369863013698631,"If he misses the sixth, he has to rest",620,2,6,65,73,3665
3259,1.1369863013698631,0.04902034372964355,73,1.1369863013698631,We filled it with Republicans—should break any minute now.,620,2,6,65,73,3665
3267,1.1369863013698631,0.04497195343285888,73,1.1369863013698631,He needs to level out that swing.,620,1,8,64,73,3665
3272,1.1369863013698631,0.04902034372964355,73,1.1369863013698631,Is this appropriation?,620,2,6,65,73,3665
3305,1.1369863013698631,0.04902034372964355,73,1.1369863013698631,I pray we don’t have to play pin the tail on Satan after this.,620,2,6,65,73,3665
3312,1.1369863013698631,0.04902034372964355,73,1.1369863013698631,...and the devil take the hindmost...,620,2,6,65,73,3665
3378,1.1369863013698631,0.04052109440479185,73,1.1369863013698631,Don't worry. They are mostly in denial.,620,0,10,63,73,3665
3422,1.1369863013698631,0.04497195343285888,73,1.1369863013698631,You think this is in poor taste? You should see what they do in the other place.,620,1,8,64,73,3665
3435,1.1369863013698631,0.04902034372964355,73,1.1369863013698631,He thinks he's president of the United States.,620,2,6,65,73,3665
3463,1.1369863013698631,0.04497195343285888,73,1.1369863013698631,The last time he hit it Twitter was invented.,620,1,8,64,73,3665
3568,1.1369863013698631,0.04497195343285888,73,1.1369863013698631,It was flat until we filled it with candy.,620,1,8,64,73,3665
3609,1.1369863013698631,0.04497195343285888,73,1.1369863013698631,I'm not cleaning up the glitter this time.,620,1,8,64,73,3665
3659,1.1369863013698631,0.04902034372964355,73,1.1369863013698631,Well...it would be easier to hit in a geocentric model.,620,2,6,65,73,3665
3681,1.1369863013698631,0.05275899547164993,73,1.1369863013698631,Even the president occasionally gets an answered prayer.,620,3,4,66,73,3665
3705,1.1369863013698631,0.04902034372964355,73,1.1369863013698631,"If he hits it, don't eat the candy, it's toxic.",620,2,6,65,73,3665
3707,1.1369863013698631,0.04497195343285888,73,1.1369863013698631,Full of poop emoji cookies. Why?,620,1,8,64,73,3665
3710,1.1369863013698631,0.04497195343285888,73,1.1369863013698631,We're down to the final four.,620,1,8,64,73,3665
3716,1.1369863013698631,0.04902034372964355,73,1.1369863013698631,"I dunno, it did take us six days to put it together.",620,2,6,65,73,3665
3721,1.1369863013698631,0.04902034372964355,73,1.1369863013698631,Why bother? It's full of disappointment.,620,2,6,65,73,3665
3732,1.1369863013698631,0.04497195343285888,73,1.1369863013698631,We'd be out of here by now if he hadn't taken time to rest.,620,1,8,64,73,3665
3759,1.1369863013698631,0.04497195343285888,73,1.1369863013698631,Christopher Nolan with wings: If the piñata is round earth then is the stick flat earth ?!,620,1,8,64,73,3665
3924,1.1369863013698631,0.04497195343285888,73,1.1369863013698631,"When the humans find out this is how things happen, they will be pissed!",620,1,8,64,73,3665
3936,1.1369863013698631,0.04497195343285888,73,1.1369863013698631,"Last time, He just sent plagues.",620,1,8,64,73,3665
3948,1.1369863013698631,0.04902034372964355,73,1.1369863013698631,The Force is not with him!,620,2,6,65,73,3665
3983,1.1369863013698631,0.04902034372964355,73,1.1369863013698631,It's his way of showing how much he misses the earth,620,2,6,65,73,3665
3999,1.1369863013698631,0.04497195343285888,73,1.1369863013698631,I don't know guys.. was the world suppose to end this way?,620,1,8,64,73,3665
4075,1.1369863013698631,0.04497195343285888,73,1.1369863013698631,Let’s pray their better angels show up soon.,620,1,8,64,73,3665
4114,1.1369863013698631,0.04497195343285888,73,1.1369863013698631,Kill him! Kill the umpire!,620,1,8,64,73,3665
4118,1.1369863013698631,0.04902034372964355,73,1.1369863013698631,There are no angels in America today only imprisoned children!!!!!,620,2,6,65,73,3665
4226,1.1369863013698631,0.04497195343285888,73,1.1369863013698631,"Apparently he doesn't have divine guidance, after all",620,1,8,64,73,3665
4239,1.1369863013698631,0.04497195343285888,73,1.1369863013698631,It's our way of getting back at the world!!!,620,1,8,64,73,3665
4277,1.1369863013698631,0.04497195343285888,73,1.1369863013698631,"Gees Bob, you still swing like a girl,",620,1,8,64,73,3665
4314,1.1369863013698631,0.04902034372964355,73,1.1369863013698631,He’s been trying for over 4 eons – can we give him some help?,620,2,6,65,73,3665
4372,1.1369863013698631,0.04497195343285888,73,1.1369863013698631,That one is a tough nut to crack,620,1,8,64,73,3665
4400,1.1369863013698631,0.04497195343285888,73,1.1369863013698631,Is it me or is it getting warmer in here?,620,1,8,64,73,3665
4666,1.1369863013698631,0.04497195343285888,73,1.1369863013698631,"That's DiMaggio. When he got here he said he could've done it all 
blindfolded.
He hasn't had a hit yet.",620,1,8,64,73,3665
4880,1.1369863013698631,0.04497195343285888,73,1.1369863013698631,It should crack soon.,620,1,8,64,73,3665
4883,1.1369863013698631,0.04497195343285888,73,1.1369863013698631,Things are so bad down there right now maybe we ought to let him take the blindfold off.,620,1,8,64,73,3665
4890,1.1369863013698631,0.04902034372964355,73,1.1369863013698631,"Some say there's candy inside, some say molten lava.",620,2,6,65,73,3665
4932,1.1369863013698631,0.04902034372964355,73,1.1369863013698631,One more swing and we try the asteroid.,620,2,6,65,73,3665
4960,1.1369863013698631,0.04902034372964355,73,1.1369863013698631,He knocked Pluto out of the park.,620,2,6,65,73,3665
168,1.135135135135135,0.04439866982676285,74,1.135135135135135,Who knows if there's anything sweet inside.,620,1,8,65,74,3772
290,1.135135135135135,0.04439866982676285,74,1.135135135135135,Her aim is getting better,620,1,8,65,74,3772
735,1.135135135135135,0.04838879136051528,74,1.135135135135135,"After all, he's here because he never used steroids.",620,2,6,66,74,3772
919,1.135135135135135,0.04439866982676285,74,1.135135135135135,I hope pin the halo on the archangel is next!,620,1,8,65,74,3772
1377,1.135135135135135,0.04838879136051528,74,1.135135135135135,Hmmmm....the pendulum has started to swing the other way....hopefully back to common sense....,620,2,6,66,74,3772
1609,1.135135135135135,0.04439866982676285,74,1.135135135135135,"It's the president's new idea regarding sex, politics, and religion.",620,1,8,65,74,3772
2376,1.135135135135135,0.04439866982676285,74,1.135135135135135,The earth needs shaking up.,620,1,8,65,74,3772
23,1.1285714285714286,0.04514264748228169,70,1.1285714285714286,At what point do we send him down?,620,1,7,62,70,3779
49,1.1285714285714286,0.04951704046747739,70,1.1285714285714286,Kill them! KILL THEM ALL!!!,620,2,5,63,70,3779
82,1.1285714285714286,0.05353518442674905,70,1.1285714285714286,Another wild swing and a miss.  I thought God was all knowing and seeing?,620,3,3,64,70,3779
119,1.1285714285714286,0.05353518442674905,70,1.1285714285714286,"That reminds me, you owe me $Infinity for the Trump candy inside.",620,3,3,64,70,3779
128,1.1285714285714286,0.04951704046747739,70,1.1285714285714286,The candy core is a real jawbreaker.,620,2,5,63,70,3779
141,1.1285714285714286,0.04951704046747739,70,1.1285714285714286,I've heard he worked in the White House...,620,2,5,63,70,3779
142,1.1285714285714286,0.04514264748228169,70,1.1285714285714286,They're calling it plate tectonics...,620,1,7,62,70,3779
152,1.1285714285714286,0.04951704046747739,70,1.1285714285714286,"As a former world leader, who dissed everyone, he has no opportunity to make it here",620,2,5,63,70,3779
200,1.1285714285714286,0.04514264748228169,70,1.1285714285714286,Lucifer losing musical chairs set the bar for high stakes party games!,620,1,7,62,70,3779
208,1.1285714285714286,0.04514264748228169,70,1.1285714285714286,The prophecies say he succeeds in the next swing.,620,1,7,62,70,3779
218,1.1285714285714286,0.04951704046747739,70,1.1285714285714286,Yells stop your whining then swings.,620,2,5,63,70,3779
219,1.1285714285714286,0.04514264748228169,70,1.1285714285714286,And wait till the humans find out that the earth was flat after all.,620,1,7,62,70,3779
220,1.1285714285714286,0.04514264748228169,70,1.1285714285714286,Looks like he won't be getting that trip to Los Angeles anytime soon.,620,1,7,62,70,3779
225,1.1285714285714286,0.04514264748228169,70,1.1285714285714286,The people down there still think the core is just fire.,620,1,7,62,70,3779
243,1.1285714285714286,0.04951704046747739,70,1.1285714285714286,It just isn't as exciting when you're playing with house money.,620,2,5,63,70,3779
246,1.1285714285714286,0.04514264748228169,70,1.1285714285714286,Last year we played pin the tail on the Devil.,620,1,7,62,70,3779
254,1.1285714285714286,0.04514264748228169,70,1.1285714285714286,Gabriel has a real flair for retribution.,620,1,7,62,70,3779
256,1.1285714285714286,0.04951704046747739,70,1.1285714285714286,Do you think scientists will ever put the correct mechanism into their models?,620,2,5,63,70,3779
265,1.1285714285714286,0.04951704046747739,70,1.1285714285714286,"I prefer 'Pin the Ring on Saturn.'""",620,2,5,63,70,3779
268,1.1285714285714286,0.04514264748228169,70,1.1285714285714286,It seems to be devilishly fun.,620,1,7,62,70,3779
284,1.1285714285714286,0.04951704046747739,70,1.1285714285714286,"We're playing ""Pin the Tail on the Comet"" next.",620,2,5,63,70,3779
359,1.1285714285714286,0.04514264748228169,70,1.1285714285714286,It's a new game called 'Trumping.',620,1,7,62,70,3779
410,1.1285714285714286,0.05353518442674905,70,1.1285714285714286,They were so worried about Global Warming that they never stopped to consider Global Whacking.,620,3,3,64,70,3779
420,1.1285714285714286,0.04514264748228169,70,1.1285714285714286,"He was sitting on a rainbow, started singing, and now this!",620,1,7,62,70,3779
421,1.1285714285714286,0.05353518442674905,70,1.1285714285714286,Now I understand why humans like destroying their planet so much. I want to try it next!,620,3,3,64,70,3779
469,1.1285714285714286,0.04514264748228169,70,1.1285714285714286,I’m predicting there’ll be a Big Bang.,620,1,7,62,70,3779
486,1.1285714285714286,0.04951704046747739,70,1.1285714285714286,Not even close since he nicked Hawaii.,620,2,5,63,70,3779
492,1.1285714285714286,0.04951704046747739,70,1.1285714285714286,They let us each take a couple swings before He comes over and breaks it open.,620,2,5,63,70,3779
498,1.1285714285714286,0.05353518442674905,70,1.1285714285714286,For my birthday we did pin the tail on the comet.,620,3,3,64,70,3779
563,1.1285714285714286,0.04514264748228169,70,1.1285714285714286,"Apparently, Justice is of Hispanic decent.",620,1,7,62,70,3779
597,1.1285714285714286,0.04514264748228169,70,1.1285714285714286,These rapture parties are so boring!,620,1,7,62,70,3779
619,1.1285714285714286,0.04951704046747739,70,1.1285714285714286,Doesn't he realize the candy will taste like dirt?,620,2,5,63,70,3779
622,1.1285714285714286,0.04514264748228169,70,1.1285714285714286,"When he hits, the souls scatter everywhere.",620,1,7,62,70,3779
625,1.1285714285714286,0.05353518442674905,70,1.1285714285714286,It better be full of candy.,620,3,3,64,70,3779
639,1.1285714285714286,0.04951704046747739,70,1.1285714285714286,"Now it is your turn, please don’t miss...",620,2,5,63,70,3779
679,1.1285714285714286,0.04514264748228169,70,1.1285714285714286,He was Robbie Williams.,620,1,7,62,70,3779
681,1.1285714285714286,0.04951704046747739,70,1.1285714285714286,Angel trumps  birthday!,620,2,5,63,70,3779
685,1.1285714285714286,0.04514264748228169,70,1.1285714285714286,Funny thing: he batted right-handed before we brought him up.,620,1,7,62,70,3779
687,1.1285714285714286,0.04514264748228169,70,1.1285714285714286,The current EPA's not gonna know what hit 'em.,620,1,7,62,70,3779
693,1.1285714285714286,0.04029615300200892,70,1.1285714285714286,"Swing and a miss, strike one.",620,0,9,61,70,3779
705,1.1285714285714286,0.04951704046747739,70,1.1285714285714286,"If he hits, we’ll just blame it on the nukes.",620,2,5,63,70,3779
712,1.1285714285714286,0.04514264748228169,70,1.1285714285714286,He and the Babe think they're quite funny.,620,1,7,62,70,3779
718,1.1285714285714286,0.04951704046747739,70,1.1285714285714286,Has anyone checked his credentials?,620,2,5,63,70,3779
719,1.1285714285714286,0.04514264748228169,70,1.1285714285714286,World piece is looking doubtful.,620,1,7,62,70,3779
721,1.1285714285714286,0.04029615300200892,70,1.1285714285714286,Shouldn't that thing be flat?,620,0,9,61,70,3779
727,1.1285714285714286,0.04951704046747739,70,1.1285714285714286,I hope the strikingly angelic eve on the mound/cloud 9 remains a hit that does not miss .,620,2,5,63,70,3779
760,1.1285714285714286,0.04951704046747739,70,1.1285714285714286,The Permianth time's the charm.,620,2,5,63,70,3779
766,1.1285714285714286,0.04514264748228169,70,1.1285714285714286,We filled it with Trump steaks...,620,1,7,62,70,3779
803,1.1285714285714286,0.04951704046747739,70,1.1285714285714286,‘’This is where we take our BREAK!’,620,2,5,63,70,3779
818,1.1285714285714286,0.04951704046747739,70,1.1285714285714286,Which country will he smash next?,620,2,5,63,70,3779
819,1.1285714285714286,0.04951704046747739,70,1.1285714285714286,"Last time we used Uranus, it didn’t end well.",620,2,5,63,70,3779
821,1.1285714285714286,0.04951704046747739,70,1.1285714285714286,He picked it up on his recent trip to Cancun,620,2,5,63,70,3779
828,1.1285714285714286,0.04029615300200892,70,1.1285714285714286,I'm afraid what's going to come out of it.,620,0,9,61,70,3779
834,1.1285714285714286,0.04514264748228169,70,1.1285714285714286,He'd better hope it's not red hot magma inside.,620,1,7,62,70,3779
836,1.1285714285714286,0.04951704046747739,70,1.1285714285714286,"About fucking time, dude.",620,2,5,63,70,3779
839,1.1285714285714286,0.04514264748228169,70,1.1285714285714286,I'm just excited that he's a switch hitter.,620,1,7,62,70,3779
870,1.1285714285714286,0.05353518442674905,70,1.1285714285714286,"No, it’s not like that - it’s packed with all kinds of souls.",620,3,3,64,70,3779
881,1.1285714285714286,0.04514264748228169,70,1.1285714285714286,"Not even the greats here can bat 100, but it's still fun to watch.",620,1,7,62,70,3779
893,1.1285714285714286,0.04514264748228169,70,1.1285714285714286,"This one's for the Pennant, Gabriel.",620,1,7,62,70,3779
914,1.1285714285714286,0.04514264748228169,70,1.1285714285714286,"If he is peeking, you certainly wouldn’t know it.",620,1,7,62,70,3779
924,1.1285714285714286,0.05353518442674905,70,1.1285714285714286,He’s the best Thoughts and Prayers player we’ve got.,620,3,3,64,70,3779
946,1.1285714285714286,0.04514264748228169,70,1.1285714285714286,Bill is starting to remind me of Trump,620,1,7,62,70,3779
948,1.1285714285714286,0.04514264748228169,70,1.1285714285714286,There was a time She had the whole world in Her hand.,620,1,7,62,70,3779
949,1.1285714285714286,0.04514264748228169,70,1.1285714285714286,"Too bad Ty Cobb never made it up here. With his batting average, he wouldn't have missed.",620,1,7,62,70,3779
956,1.1285714285714286,0.04514264748228169,70,1.1285714285714286,"Hang on, they're on Auto",620,1,7,62,70,3779
967,1.1285714285714286,0.04951704046747739,70,1.1285714285714286,"Why are we smiting it this time? 
Jeees, Who care anymore.",620,2,5,63,70,3779
997,1.1285714285714286,0.04951704046747739,70,1.1285714285714286,"Every once in a while he actually hits it, and boy, do we get a rush then.",620,2,5,63,70,3779
1010,1.1285714285714286,0.04951704046747739,70,1.1285714285714286,Maybe this game is getting too real.,620,2,5,63,70,3779
1028,1.1285714285714286,0.04514264748228169,70,1.1285714285714286,"It's 'Justice"", not 'Justify'.  And it's T-ball, so Major League Rules don't apply.  She's allowed to be the DH.",620,1,7,62,70,3779
1029,1.1285714285714286,0.04951704046747739,70,1.1285714285714286,"I hear Washington has a guy could shatter that with one swing.""  ""You mean Harper?""   ""Nah, a guy named Trump.",620,2,5,63,70,3779
1071,1.1285714285714286,0.04514264748228169,70,1.1285714285714286,Let's pray he  keeps missing this modern Pandora's box!,620,1,7,62,70,3779
1099,1.1285714285714286,0.04951704046747739,70,1.1285714285714286,Whadda you think’s inside it?,620,2,5,63,70,3779
1111,1.1285714285714286,0.04951704046747739,70,1.1285714285714286,I hope he doesn’t hit you in the groin this time.,620,2,5,63,70,3779
1122,1.1285714285714286,0.04951704046747739,70,1.1285714285714286,Thank God it's not Pluto.,620,2,5,63,70,3779
1123,1.1285714285714286,0.04514264748228169,70,1.1285714285714286,Think there's 29% candy in there?,620,1,7,62,70,3779
1132,1.1285714285714286,0.04951704046747739,70,1.1285714285714286,God thought the earth could use a little R & R.,620,2,5,63,70,3779
1138,1.1285714285714286,0.04951704046747739,70,1.1285714285714286,Hope this one isn't just full of garbage,620,2,5,63,70,3779
1162,1.1285714285714286,0.04951704046747739,70,1.1285714285714286,One of those swings is bound to connect. But I’m not sure we want to know what’s inside?,620,2,5,63,70,3779
1196,1.1285714285714286,0.04951704046747739,70,1.1285714285714286,"With all they’ve done to that planet, he’s not gonna want to win.",620,2,5,63,70,3779
1200,1.1285714285714286,0.04951704046747739,70,1.1285714285714286,"I may stand before you in six months and say, hey, I was wrong. I don't know that I'll ever admit that but I'll find some kind of excuse""",620,2,5,63,70,3779
1205,1.1285714285714286,0.04951704046747739,70,1.1285714285714286,And to think that he was drafted by the Yankees!,620,2,5,63,70,3779
1228,1.1285714285714286,0.04514264748228169,70,1.1285714285714286,"Blessed are the weak, for they will inherit the earth.",620,1,7,62,70,3779
1262,1.1285714285714286,0.04514264748228169,70,1.1285714285714286,"It's a good gesture, but the Seraphim got a taco bar...",620,1,7,62,70,3779
1266,1.1285714285714286,0.04951704046747739,70,1.1285714285714286,It's how we deal with the enigma of eterity.,620,2,5,63,70,3779
1280,1.1285714285714286,0.04951704046747739,70,1.1285714285714286,Sooner or later...,620,2,5,63,70,3779
1288,1.1285714285714286,0.04514264748228169,70,1.1285714285714286,It's now legal to bet on whack-a-mole sports. I'll give you 100 to 1 that he'll never hit it!,620,1,7,62,70,3779
1321,1.1285714285714286,0.04514264748228169,70,1.1285714285714286,Tootsie-rools and Sweet-tarts.  What are you hoping for?,620,1,7,62,70,3779
1330,1.1285714285714286,0.04514264748228169,70,1.1285714285714286,Looks like a Los Angeles Angel,620,1,7,62,70,3779
1346,1.1285714285714286,0.04514264748228169,70,1.1285714285714286,"Well, he WAS a chess player on Earth.",620,1,7,62,70,3779
1353,1.1285714285714286,0.04514264748228169,70,1.1285714285714286,I love Indian food,620,1,7,62,70,3779
1357,1.1285714285714286,0.04514264748228169,70,1.1285714285714286,The magma and liquid iron inside this thing is a lot better than the humans that live on it.,620,1,7,62,70,3779
1366,1.1285714285714286,0.04951704046747739,70,1.1285714285714286,Too bad the candy will fall straight through the cloud.,620,2,5,63,70,3779
1386,1.1285714285714286,0.04951704046747739,70,1.1285714285714286,Someone get a video for Heaven's Funniest Home Videos.,620,2,5,63,70,3779
1399,1.1285714285714286,0.04514264748228169,70,1.1285714285714286,"Assistant: ""about 7 and a half billion, so maybe a half a billion god-fearing Christians, perhaps of those, 70 percent could conceivably be accepted.""
Supervisor: ""OK, quickly go through the numbers, and figure if the fire code will allow it?",620,1,7,62,70,3779
1418,1.1285714285714286,0.05353518442674905,70,1.1285714285714286,I hear that hell's party has beer.  Want to fall after Gabriel serves the sponge cake?,620,3,3,64,70,3779
1431,1.1285714285714286,0.04514264748228169,70,1.1285714285714286,"Yeah, I don't know what he thinks is left in there.",620,1,7,62,70,3779
1444,1.1285714285714286,0.04951704046747739,70,1.1285714285714286,We've seen better.,620,2,5,63,70,3779
1473,1.1285714285714286,0.04514264748228169,70,1.1285714285714286,I think he might be causing climate change.,620,1,7,62,70,3779
1514,1.1285714285714286,0.04514264748228169,70,1.1285714285714286,What happened to pin the tail on the demon?,620,1,7,62,70,3779
1525,1.1285714285714286,0.04514264748228169,70,1.1285714285714286,Hell of a pinyata.,620,1,7,62,70,3779
1550,1.1285714285714286,0.04029615300200892,70,1.1285714285714286,It's RIGHT there. Now I know how his wife felt!,620,0,9,61,70,3779
1577,1.1285714285714286,0.04514264748228169,70,1.1285714285714286,Looks like God went cheap on the party decor this year. I heard last year there was a bouncy house.,620,1,7,62,70,3779
1583,1.1285714285714286,0.04514264748228169,70,1.1285714285714286,It's bound to happen sooner or later.,620,1,7,62,70,3779
1593,1.1285714285714286,0.04951704046747739,70,1.1285714285714286,Don’t know why he does this. He knows only crap is inside.,620,2,5,63,70,3779
1602,1.1285714285714286,0.04514264748228169,70,1.1285714285714286,Think he'll notice if it goes out of the park?,620,1,7,62,70,3779
1606,1.1285714285714286,0.04514264748228169,70,1.1285714285714286,"The way he's hacking, this could take forever.",620,1,7,62,70,3779
1608,1.1285714285714286,0.04514264748228169,70,1.1285714285714286,I think Derek Jeter released him...,620,1,7,62,70,3779
1650,1.1285714285714286,0.04951704046747739,70,1.1285714285714286,The Angels are swinging blindly at the Earth ball. Seems only the Devils have been able to hit it lately.,620,2,5,63,70,3779
1657,1.1285714285714286,0.04951704046747739,70,1.1285714285714286,Too bad Ted Williams was cryogenically frozen.,620,2,5,63,70,3779
1688,1.1285714285714286,0.04514264748228169,70,1.1285714285714286,It was his turn last eternity.,620,1,7,62,70,3779
1700,1.1285714285714286,0.04514264748228169,70,1.1285714285714286,Three strikes and you're out!,620,1,7,62,70,3779
1756,1.1285714285714286,0.05353518442674905,70,1.1285714285714286,What can I say: the Big Guy likes magma.,620,3,3,64,70,3779
1768,1.1285714285714286,0.04514264748228169,70,1.1285714285714286,Is it okay to tell him that this isn't his birthday?,620,1,7,62,70,3779
1784,1.1285714285714286,0.04951704046747739,70,1.1285714285714286,Shall we tell him that it is not going to be candy in this piñata?,620,2,5,63,70,3779
1785,1.1285714285714286,0.04514264748228169,70,1.1285714285714286,the Doomsday Clock got knocked back an hour,620,1,7,62,70,3779
1786,1.1285714285714286,0.04514264748228169,70,1.1285714285714286,10 dollars says he breaks the world,620,1,7,62,70,3779
1840,1.1285714285714286,0.04951704046747739,70,1.1285714285714286,He was Trump's global affairs advisor!,620,2,5,63,70,3779
