target_id,mean,precision,count,score,caption,contest,funny,somewhat_funny,unfunny,counts,rank
4757,1.2624113475177303,0.04404265923987968,141,1.2624113475177303,Not to worry.....he has trouble with a curve.,620,6,26,110,142,1053
6,1.2608695652173914,0.04519004128550317,138,1.2608695652173914,Wait for the look on his face when all the garbage spills out.,620,6,24,108,138,1105
69,1.2608695652173914,0.046345726385314936,138,1.2608695652173914,He's been reading Revelations again,620,7,22,109,138,1105
471,1.2608695652173914,0.04747328592987294,138,1.2608695652173914,"I thought an Earth Day cake would be easier, but I couldn't find a baker.",620,8,20,110,138,1105
541,1.2608695652173914,0.048574678586445305,138,1.2608695652173914,Make it fast.  He's coming.,620,9,18,111,138,1105
1273,1.2608695652173914,0.046345726385314936,138,1.2608695652173914,"It's the only piñata we've got, let's not waste it.",620,7,22,109,138,1105
1491,1.2608695652173914,0.04519004128550317,138,1.2608695652173914,"After this, they will be serving cake, angel food, of course.",620,6,24,108,138,1105
1529,1.2608695652173914,0.046345726385314936,138,1.2608695652173914,Five more minutes and I'm going Old Testament on that thing.,620,7,22,109,138,1105
1659,1.2608695652173914,0.04519004128550317,138,1.2608695652173914,We're going to need a bigger bat,620,6,24,108,138,1105
1689,1.2608695652173914,0.046345726385314936,138,1.2608695652173914,All I got for my birthday was this lousy robe.,620,7,22,109,138,1105
2317,1.2608695652173914,0.04747328592987294,138,1.2608695652173914,"Its been 4.5 billion years, you'd think he'd give someone else a try.",620,8,20,110,138,1105
2740,1.2608695652173914,0.046345726385314936,138,1.2608695652173914,We could be here forever.,620,7,22,109,138,1105
3170,1.2608695652173914,0.044004014687167865,138,1.2608695652173914,"The last time somebody actually hit it, there were dinosaurs all over the place.",620,5,26,107,138,1105
4161,1.2608695652173914,0.04965164571868151,138,1.2608695652173914,"So, this is how it ends?",620,10,16,112,138,1105
4407,1.2608695652173914,0.04278512341680797,138,1.2608695652173914,"The last time, all we got were dinosaurs.",620,4,28,106,138,1105
4903,1.2608695652173914,0.04747328592987294,138,1.2608695652173914,They don’t really need any help.,620,8,20,110,138,1105
43,1.2573529411764706,0.04895011413906878,136,1.2573529411764706,Okay. We’ll give you Big Bang.,620,9,17,110,136,1120
185,1.2573529411764706,0.04782448339871768,136,1.2573529411764706,Funny to think they're just one swing away from Armageddon.,620,8,19,109,136,1120
354,1.2573529411764706,0.04365681614360453,136,1.2573529411764706,"We call it ""Rapture Ball"".",620,5,26,106,137,1120
539,1.2573529411764706,0.04782448339871768,136,1.2573529411764706,One thing I know--the people of that planet don't need help destroying it.,620,8,19,109,136,1120
548,1.2573529411764706,0.04667171252997456,136,1.2573529411764706,They don't realize that climate change is not the worst thing that can happen.,620,7,21,108,136,1120
624,1.2573529411764706,0.04548973827806604,136,1.2573529411764706,"I think he gets three strikes, Father, son and, well, you know.",620,6,23,107,136,1120
843,1.2573529411764706,0.04427622191123931,136,1.2573529411764706,What are we going to do when we run out of planets?,620,5,25,106,136,1120
1034,1.2573529411764706,0.04667171252997456,136,1.2573529411764706,The last time he connected was about 65 million years ago. And we managed to convince the current inhabitants it was an asteroid.,620,7,21,108,136,1120
1052,1.2573529411764706,0.04667171252997456,136,1.2573529411764706,"Little does he know, there’s nothing inside but 40 lbs of plastic bags.",620,7,21,108,136,1120
1208,1.2573529411764706,0.04548973827806604,136,1.2573529411764706,The lefties always have a problem with this. They are too caring.,620,6,23,107,136,1120
1294,1.2573529411764706,0.04667171252997456,136,1.2573529411764706,so much for omniscience.,620,7,21,108,136,1120
1422,1.2573529411764706,0.04427622191123931,136,1.2573529411764706,And THAT is what makes the world go 'round!,620,5,25,106,136,1120
1654,1.2573529411764706,0.04895011413906878,136,1.2573529411764706,"You were an Existentialist before, right?",620,9,17,110,136,1120
1712,1.2573529411764706,0.04548973827806604,136,1.2573529411764706,He used to work for the EPA.,620,6,23,107,136,1120
1749,1.2573529411764706,0.04782448339871768,136,1.2573529411764706,"Nah, this guy's been at it for years. I say global warming gets 'em first.",620,8,19,109,136,1120
1843,1.2573529411764706,0.04548973827806604,136,1.2573529411764706,Shoulda made it flat.,620,6,23,107,136,1120
1850,1.2573529411764706,0.04427622191123931,136,1.2573529411764706,We let them get it out of their system the first few days.,620,5,25,106,136,1120
2161,1.2573529411764706,0.04548973827806604,136,1.2573529411764706,I can't wait to see what's in it.,620,6,23,107,136,1120
2287,1.2573529411764706,0.04548973827806604,136,1.2573529411764706,I  have a bad feeling about this!,620,6,23,107,136,1120
2555,1.2573529411764706,0.04548973827806604,136,1.2573529411764706,The Rapture isn't what they think it is.,620,6,23,107,136,1120
2603,1.2573529411764706,0.04427622191123931,136,1.2573529411764706,"It's been long enough, I think it's time we tell him to swing a bit to the left.",620,5,25,106,136,1120
2649,1.2573529411764706,0.04895011413906878,136,1.2573529411764706,I think he'll be disappointed that it's filled with smog and outstanding debt.,620,9,17,110,136,1120
2764,1.2573529411764706,0.04782448339871768,136,1.2573529411764706,Does he realise that it's just filled with people?,620,8,19,109,136,1120
3033,1.2573529411764706,0.04548973827806604,136,1.2573529411764706,He looks more like a Met than an Angel.,620,6,23,107,136,1120
3367,1.2573529411764706,0.04782448339871768,136,1.2573529411764706,Didn’t anyone tell him it’s love that makes the world go round?,620,8,19,109,136,1120
3413,1.2573529411764706,0.04667171252997456,136,1.2573529411764706,"Apparently, on the 8th day he filled it with candy.",620,7,21,108,136,1120
3427,1.2573529411764706,0.04782448339871768,136,1.2573529411764706,It worked with the dinosaurs.,620,8,19,109,136,1120
3469,1.2573529411764706,0.04427622191123931,136,1.2573529411764706,Swings like a cherub.,620,5,25,106,136,1120
3545,1.2573529411764706,0.05005043592319152,136,1.2573529411764706,Gabriel is better with the horn.,620,10,15,111,136,1120
3586,1.2573529411764706,0.04548973827806604,136,1.2573529411764706,It works better than meditation.,620,6,23,107,136,1120
4113,1.2573529411764706,0.04548973827806604,136,1.2573529411764706,And they’re so worried about climate change.,620,6,23,107,136,1120
4159,1.2573529411764706,0.04548973827806604,136,1.2573529411764706,Were you praying for him to hit or miss?,620,6,23,107,136,1120
4193,1.2573529411764706,0.04782448339871768,136,1.2573529411764706,Only In New York,620,8,19,109,136,1120
4246,1.2573529411764706,0.04548973827806604,136,1.2573529411764706,"Think he'll hit it before it falls apart on it's own?""",620,6,23,107,136,1120
4285,1.2573529411764706,0.04895011413906878,136,1.2573529411764706,Get ready to scramble when all hell breaks loose.,620,9,17,110,136,1120
4335,1.2573529411764706,0.04667171252997456,136,1.2573529411764706,Wait. Why does Comey get another swing?,620,7,21,108,136,1120
4350,1.2573529411764706,0.04667171252997456,136,1.2573529411764706,I think he needs a bigger target.  How about Jupiter?,620,7,21,108,136,1120
4445,1.2573529411764706,0.04895011413906878,136,1.2573529411764706,Ten bucks if he hits Tel Aviv.,620,9,17,110,136,1120
4475,1.2573529411764706,0.04667171252997456,136,1.2573529411764706,He needs to be more patient... that was high and inside.,620,7,21,108,136,1120
4562,1.2573529411764706,0.04427622191123931,136,1.2573529411764706,I hope we didn’t get another empty one.,620,5,25,106,136,1120
4743,1.2573529411764706,0.04548973827806604,136,1.2573529411764706,"We used to have water balloon fights, but that caused a flood of complaints.",620,6,23,107,136,1120
47,1.2537313432835822,0.04933239315598411,134,1.2537313432835822,He's getting warmer.,620,9,16,109,134,1161
76,1.2537313432835822,0.04455111235379424,134,1.2537313432835822,I'm guessing some earthly delights are inside.,620,5,24,105,134,1161
161,1.2537313432835822,0.045793257829012834,134,1.2537313432835822,He's been at it for over four-and-a-half billion years--let's just take off the blindfold and get it over with.,620,6,22,106,134,1161
247,1.2537313432835822,0.045793257829012834,134,1.2537313432835822,Are they still down there singing He's got the whole world in His hands?,620,6,22,106,134,1161
278,1.2537313432835822,0.05045697043155322,134,1.2537313432835822,It used to be a lot easier to hit the icecaps.,620,10,14,110,134,1161
356,1.2537313432835822,0.04818157494169883,134,1.2537313432835822,That was some hit on Hawaii!,620,8,18,108,134,1161
373,1.2537313432835822,0.040597278973574735,134,1.2537313432835822,Is this.....is this cultural appropriation?,620,2,30,102,134,1161
418,1.2537313432835822,0.04933239315598411,134,1.2537313432835822,"Fortunately for the Earth, he's a Baltimore Oriole.",620,9,16,109,134,1161
455,1.2537313432835822,0.04455111235379424,134,1.2537313432835822,He wants to change the world.,620,5,24,105,134,1161
542,1.2537313432835822,0.045793257829012834,134,1.2537313432835822,I love these apocalypse parties.,620,6,22,106,134,1161
808,1.2537313432835822,0.047002588367328166,134,1.2537313432835822,We can't hurt it anymore then they are.,620,7,20,107,134,1161
923,1.2537313432835822,0.04455111235379424,134,1.2537313432835822,"Wait, where did you hang that thing from?",620,5,24,105,134,1161
1094,1.2537313432835822,0.045793257829012834,134,1.2537313432835822,"Not to worry. Other than Mike Trout, the Angels can’t hit.",620,6,22,106,134,1161
1150,1.2537313432835822,0.04455111235379424,134,1.2537313432835822,The blindfold became mandatory after we lost the dinosaurs.,620,5,24,105,134,1161
1171,1.2537313432835822,0.045793257829012834,134,1.2537313432835822,It's  absolutely stuffed with garbage and ideologues,620,6,22,106,134,1161
1268,1.2537313432835822,0.045793257829012834,134,1.2537313432835822,Are you sure God said it was OK to do this?,620,6,22,106,134,1161
1413,1.2537313432835822,0.04455111235379424,134,1.2537313432835822,"Prayer works, but it's all pretty random, actually.",620,5,24,105,134,1161
1478,1.2537313432835822,0.04818157494169883,134,1.2537313432835822,If he hits it we get stuck with Republicans.,620,8,18,108,134,1161
1623,1.2537313432835822,0.045793257829012834,134,1.2537313432835822,"We could be here for eternity.""",620,6,22,106,134,1161
1820,1.2537313432835822,0.047002588367328166,134,1.2537313432835822,I just think we're better than this.,620,7,20,107,134,1161
1847,1.2537313432835822,0.045793257829012834,134,1.2537313432835822,Yeesh. One of us really ought to go summon our better angels.,620,6,22,106,134,1161
1892,1.2537313432835822,0.04455111235379424,134,1.2537313432835822,The end is near.,620,5,24,105,134,1161
1923,1.2537313432835822,0.04455111235379424,134,1.2537313432835822,"No one here is allergic to nuts, right?",620,5,24,105,134,1161
1934,1.2537313432835822,0.045793257829012834,134,1.2537313432835822,"If God finds out, tell him it was Lucifer’s idea.",620,6,22,106,134,1161
1963,1.2537313432835822,0.047002588367328166,134,1.2537313432835822,He’s got the world on a string and he still can’t see it!,620,7,20,107,134,1161
1982,1.2537313432835822,0.045793257829012834,134,1.2537313432835822,Ignore the screams,620,6,22,106,134,1161
2211,1.2537313432835822,0.045793257829012834,134,1.2537313432835822,Ever wondered why bad things happen to good people?,620,6,22,106,134,1161
2218,1.2537313432835822,0.045793257829012834,134,1.2537313432835822,"No, Gary. The real Earth is much bigger.",620,6,22,106,134,1161
2288,1.2537313432835822,0.04818157494169883,134,1.2537313432835822,I hope that a hundred little dictators don't come falling out.,620,8,18,108,134,1161
2407,1.2537313432835822,0.04818157494169883,134,1.2537313432835822,Three strikes and Earth is out,620,8,18,108,134,1161
2418,1.2537313432835822,0.047002588367328166,134,1.2537313432835822,"Personally, I prefer the nuclear option.",620,7,20,107,134,1161
2486,1.2537313432835822,0.045793257829012834,134,1.2537313432835822,It's a metaphor.,620,6,22,106,134,1161
2593,1.2537313432835822,0.04818157494169883,134,1.2537313432835822,Lord knows you put a righty batter against a left spinning earth.,620,8,18,108,134,1161
2604,1.2537313432835822,0.04455111235379424,134,1.2537313432835822,Tryouts to head the heavenly EPA,620,5,24,105,134,1161
2656,1.2537313432835822,0.04818157494169883,134,1.2537313432835822,Trump makes it look so easy....,620,8,18,108,134,1161
2671,1.2537313432835822,0.045793257829012834,134,1.2537313432835822,The Real 'Angels in the Outfield.',620,6,22,106,134,1161
2679,1.2537313432835822,0.04327332621056936,134,1.2537313432835822,I would guess it's 70% plastic & 30% styrofoam.,620,4,26,104,134,1161
2681,1.2537313432835822,0.05045697043155322,134,1.2537313432835822,It's Trump's new reality show.,620,10,14,110,134,1161
2763,1.2537313432835822,0.04933239315598411,134,1.2537313432835822,"If only they knew what a ""hole in the ozone layer"" actually meant.",620,9,16,109,134,1161
2786,1.2537313432835822,0.04818157494169883,134,1.2537313432835822,What's inside? Mostly suckers.,620,8,18,108,134,1161
2810,1.2537313432835822,0.045793257829012834,134,1.2537313432835822,He told us to stop. They're doing it themselves down there.,620,6,22,106,134,1161
2827,1.2537313432835822,0.04327332621056936,134,1.2537313432835822,Last time he did this Trump got elected.,620,4,26,104,134,1161
2898,1.2537313432835822,0.047002588367328166,134,1.2537313432835822,This oughta shake things up.,620,7,20,107,134,1161
2987,1.2537313432835822,0.045793257829012834,134,1.2537313432835822,It would be apocalyptic if he were ever to hit it.,620,6,22,106,134,1161
3222,1.2537313432835822,0.04818157494169883,134,1.2537313432835822,"I said it might be time to take a swing ""by"" Earth",620,8,18,108,134,1161
3243,1.2537313432835822,0.04455111235379424,134,1.2537313432835822,It was just a trial balloon anyway,620,5,24,105,134,1161
3426,1.2537313432835822,0.045793257829012834,134,1.2537313432835822,One of these days he's not gonna miss,620,6,22,106,134,1161
3521,1.2537313432835822,0.047002588367328166,134,1.2537313432835822,He always did think he had the world on a string,620,7,20,107,134,1161
3562,1.2537313432835822,0.04818157494169883,134,1.2537313432835822,This is going to drive all the Meteorologists crazy.,620,8,18,108,134,1161
3575,1.2537313432835822,0.045793257829012834,134,1.2537313432835822,...and they worry about meteors!,620,6,22,106,134,1161
3612,1.2537313432835822,0.045793257829012834,134,1.2537313432835822,"We used to take better care of it, but if THEY won't why should WE?",620,6,22,106,134,1161
3718,1.2537313432835822,0.047002588367328166,134,1.2537313432835822,The store was out of piñatas so we had to improvise,620,7,20,107,134,1161
3724,1.2537313432835822,0.04818157494169883,134,1.2537313432835822,Watch out a bunch of stupid people are about to fall out.,620,8,18,108,134,1161
3743,1.2537313432835822,0.047002588367328166,134,1.2537313432835822,God told him to beat the hell out of it.,620,7,20,107,134,1161
4008,1.2537313432835822,0.04455111235379424,134,1.2537313432835822,Good news for them is he hits like the Mets’ offense.,620,5,24,105,134,1161
4044,1.2537313432835822,0.047002588367328166,134,1.2537313432835822,I just hope the prize isn't humans again.,620,7,20,107,134,1161
4236,1.2537313432835822,0.047002588367328166,134,1.2537313432835822,He actually only hits it once every billion years or so.,620,7,20,107,134,1161
4305,1.2537313432835822,0.045793257829012834,134,1.2537313432835822,Do you think this is what He meant by The Piñacolypse?,620,6,22,106,134,1161
4343,1.2537313432835822,0.047002588367328166,134,1.2537313432835822,This beats seeing how many can fit on the head of a pin.,620,7,20,107,134,1161
4547,1.2537313432835822,0.047002588367328166,134,1.2537313432835822,You should have used Jupiter.,620,7,20,107,134,1161
4748,1.2537313432835822,0.047002588367328166,134,1.2537313432835822,Knock the hell out of it.  It's full of sinners!,620,7,20,107,134,1161
4752,1.2537313432835822,0.045793257829012834,134,1.2537313432835822,"Wings, yes; Jedi powers, no.",620,6,22,106,134,1161
401,1.251908396946565,0.04766233680817026,131,1.251908396946565,Your getting warm.,620,7,19,105,131,1223
817,1.251908396946565,0.05006573652916798,131,1.251908396946565,No real need to expedite the process.  Let them do it themselves.,620,9,15,107,131,1223
835,1.251908396946565,0.043810716882134684,131,1.251908396946565,It beats watching climate change.,620,4,25,102,131,1223
1600,1.251908396946565,0.043810716882134684,131,1.251908396946565,"His first hit was Hawaii, but it was only a crack.",620,4,25,102,131,1223
2881,1.251908396946565,0.04887881097276983,131,1.251908396946565,"End of life on Earth, sure, but somebody needs to get that candy.",620,8,17,106,131,1223
2922,1.251908396946565,0.0464139907562274,131,1.251908396946565,I bet two-thirds of the candy is salt water taffy.,620,6,21,104,131,1223
3282,1.251908396946565,0.04175187655162472,131,1.251908396946565,Some how I didn't picture the apocalypse playing out this way.,620,3,28,101,132,1223
3491,1.251908396946565,0.04887881097276983,131,1.251908396946565,It's a dramatization of human influence on earth...,620,8,17,106,131,1223
3581,1.251908396946565,0.04766233680817026,131,1.251908396946565,Remember when Gary nailed it with a solid whack and the dinosaurs went extinct?,620,7,19,105,131,1223
3811,1.251908396946565,0.0464139907562274,131,1.251908396946565,That’s trumps new Secretary of State !,620,6,21,104,131,1223
4395,1.251908396946565,0.0464139907562274,131,1.251908396946565,and they still think it's global warming,620,6,21,104,131,1223
4860,1.251908396946565,0.04513112812486369,131,1.251908396946565,There ought to be a better way to earn your wings.,620,5,23,103,131,1223
1378,1.2518518518518518,0.04299268905480864,135,1.2518518518518518,"It's his birthday, The old man said give him what he wants.",620,4,26,105,135,1235
2062,1.25,0.044828560259541315,132,1.25,Our decent and honest pitches do not seem to be able to overcome the bat out of hell,620,5,23,104,132,1236
3582,1.248062015503876,0.04801158582107557,129,1.248062015503876,Now you know why his batting average sucked when he played for the real Angels.,620,7,18,104,129,1237
106,1.2461538461538462,0.0464115247720679,130,1.2461538461538462,Trump would call this diplomacy.,620,6,20,104,130,1238
257,1.2461538461538462,0.04767903329604257,130,1.2461538461538462,"When you break it open nowadays, fracking sand goes all over the place.",620,7,18,105,130,1238
457,1.2461538461538462,0.05011797466776628,130,1.2461538461538462,My favorite is pin the tail on the comet.,620,9,14,107,130,1238
523,1.2461538461538462,0.04376652217065625,130,1.2461538461538462,65 million years! He's had his turn!,620,4,24,102,130,1238
806,1.2461538461538462,0.04767903329604257,130,1.2461538461538462,"If you think this is bad, you should see what we're doing with the real Earth.",620,7,18,105,130,1238
829,1.2461538461538462,0.04376652217065625,130,1.2461538461538462,So that's how they came up with the Big Bang Theory.,620,4,24,102,130,1238
1598,1.2461538461538462,0.05011797466776628,130,1.2461538461538462,What the hell is Donald doing now?,620,9,14,107,130,1238
1927,1.2461538461538462,0.0451084143735003,130,1.2461538461538462,Nothing good will come out of this.,620,5,22,103,130,1238
2077,1.2461538461538462,0.04891370769448988,130,1.2461538461538462,The Master thought that one blind-folded angel couldn't mess up the world more than one egocentric world leader.,620,8,16,106,130,1238
2352,1.2461538461538462,0.05011797466776628,130,1.2461538461538462,World peace - take a whack at it!,620,9,14,107,130,1238
2506,1.2461538461538462,0.0451084143735003,130,1.2461538461538462,He missed again. Trump stays.,620,5,22,103,130,1238
2627,1.2461538461538462,0.0464115247720679,130,1.2461538461538462,"Yes, He did say He'd never destroy the earth again -- with a flood.  But the agreement did not cover using it as a pinata!",620,6,20,104,130,1238
2633,1.2461538461538462,0.04891370769448988,130,1.2461538461538462,All I got for my birthday was Saturn Ring Toss.,620,8,16,106,130,1238
3231,1.2461538461538462,0.04767903329604257,130,1.2461538461538462,"So, an 'act of GOD' is not really an ACT-OF-GOD?",620,7,18,105,130,1238
3295,1.2461538461538462,0.0464115247720679,130,1.2461538461538462,They're expecting it.,620,6,20,104,130,1238
3487,1.2461538461538462,0.04891370769448988,130,1.2461538461538462,"And yet another Secretary of State.""",620,8,16,106,130,1238
3540,1.2461538461538462,0.04376652217065625,130,1.2461538461538462,"This game is called ""Divine Intervention""",620,4,24,102,130,1238
3644,1.2461538461538462,0.04376652217065625,130,1.2461538461538462,Gabriel's batting average tanked after the Big Man got soft post-Old Testament and made him start wearing that blindfold.,620,4,24,102,130,1238
4012,1.2461538461538462,0.04767903329604257,130,1.2461538461538462,It’s only a good metaphor if he lands one.,620,7,18,105,130,1238
4015,1.2461538461538462,0.0464115247720679,130,1.2461538461538462,"So if he connects, we’re only supposed to gather up the raptured ones, right? And we let the others fall below?",620,6,20,104,130,1238
4189,1.2461538461538462,0.04891370769448988,130,1.2461538461538462,We figured the world was going to end anyway.,620,8,16,106,130,1238
4256,1.2461538461538462,0.04376652217065625,130,1.2461538461538462,"Of course it's funny, but what if he actually hits it?",620,4,24,102,130,1238
4269,1.2461538461538462,0.0451084143735003,130,1.2461538461538462,"Fire and ice, earthquakes and floods—Piñata Stick of the Angels was totally off their radar.",620,5,22,103,130,1238
4744,1.2461538461538462,0.0464115247720679,130,1.2461538461538462,Let's hope something good comes out of it.,620,6,20,104,130,1238
4762,1.2461538461538462,0.04767903329604257,130,1.2461538461538462,"The core is so hot that the candy will be gooey, I just know it.",620,7,18,105,130,1238
4882,1.2461538461538462,0.0464115247720679,130,1.2461538461538462,A bad party's not the end of the world.,620,6,20,104,130,1238
62,1.2440944881889764,0.04570892435742848,127,1.2440944881889764,"After the Republicans took over, they privatized the place.",620,5,21,101,127,1264
65,1.2440944881889764,0.04570892435742848,127,1.2440944881889764,St. Peter really went with a dark theme for his party.,620,5,21,101,127,1264
145,1.2440944881889764,0.04964130232751515,127,1.2440944881889764,"The mortals are trashing it anyway, so why not?",620,8,15,104,127,1264
174,1.2440944881889764,0.04570892435742848,127,1.2440944881889764,"They're used to it - call it ""God's Will.""",620,5,21,101,127,1264
348,1.2440944881889764,0.047056244461984,127,1.2440944881889764,Tsunami or earthquake?,620,6,19,102,127,1264
392,1.2440944881889764,0.04570892435742848,127,1.2440944881889764,Copernicus wasn’t even close.,620,5,21,101,127,1264
447,1.2440944881889764,0.047056244461984,127,1.2440944881889764,"WHEN PEOPLE ASK WHAT TOOK THE RAPTURE SO LONG, IT'S BECAUSE WE HAVE TERRIBLE AIM.",620,6,19,102,127,1264
448,1.2440944881889764,0.04836604718000924,127,1.2440944881889764,"Ever since November 8, 2016 he’s been getting closer and closer.",620,7,17,103,127,1264
466,1.2440944881889764,0.047056244461984,127,1.2440944881889764,We're just hastening the inevitable.,620,6,19,102,127,1264
538,1.2440944881889764,0.047056244461984,127,1.2440944881889764,Bet Trump destroys it before Gabe!,620,6,19,102,127,1264
592,1.2440944881889764,0.04570892435742848,127,1.2440944881889764,And they think that anything they do matters.,620,5,21,101,127,1264
605,1.2440944881889764,0.04964130232751515,127,1.2440944881889764,It was this or Whack-A-Mole.,620,8,15,104,127,1264
710,1.2440944881889764,0.047056244461984,127,1.2440944881889764,No one has the heart to tell him what’s really inside.,620,6,19,102,127,1264
752,1.2440944881889764,0.04570892435742848,127,1.2440944881889764,"When he taps it, and a little lava comes out like that, it makes me wonder if we should really be playing this.",620,5,21,101,127,1264
844,1.2440944881889764,0.047056244461984,127,1.2440944881889764,He'll never get it. We're waiting for the Big Guy.,620,6,19,102,127,1264
847,1.2440944881889764,0.04836604718000924,127,1.2440944881889764,Extra bonus points for hitting the San Andreas fault,620,7,17,103,127,1264
883,1.2440944881889764,0.04964130232751515,127,1.2440944881889764,"When I heard ""God doesn't play dice,"" this isn't exactly what I imagined.",620,8,15,104,127,1264
896,1.2440944881889764,0.04964130232751515,127,1.2440944881889764,"He hits it, all “Hell” breaks loose.",620,8,15,104,127,1264
913,1.2440944881889764,0.04836604718000924,127,1.2440944881889764,Of course there's no candy inside. But they're so much nicer to each other for a few weeks after one of us gets a hit.,620,7,17,103,127,1264
938,1.2440944881889764,0.04570892435742848,127,1.2440944881889764,Now there's only one moon.,620,5,21,101,127,1264
973,1.2440944881889764,0.04836604718000924,127,1.2440944881889764,They were out of regular piñatas.,620,7,17,103,127,1264
983,1.2440944881889764,0.04570892435742848,127,1.2440944881889764,He was getting bored and this definitely beats the dreidel.,620,5,21,101,127,1264
1009,1.2440944881889764,0.04836604718000924,127,1.2440944881889764,Planet Pinata is actually the real cause of climate change. We need to leak this somehow to the White House.,620,7,17,103,127,1264
1235,1.2440944881889764,0.05209824997711077,127,1.2440944881889764,They say his son is now president.,620,10,11,106,127,1264
1254,1.2440944881889764,0.04964130232751515,127,1.2440944881889764,The candy's probably all melted anyhow.,620,8,15,104,127,1264
