target_id,mean,precision,count,score,caption,contest,funny,somewhat_funny,unfunny,counts,rank
423,2.030834278642879,0.007361907514386581,9697,2.030834278642879,It's not the end of the world if he misses.,620,2702,4592,2403,9697,1
1563,2.0270381836945304,0.008170066099180265,9690,2.0270381836945304,"Most of them have candy, this ones filled with nuts.",620,3268,3416,3006,9690,2
3317,2.0231940082145448,0.008559197804286382,8278,2.0231940082145448,Are you sure the boss is cool with this? It took him six days to make.,620,2608,3254,2416,8278,3
991,1.977484204480184,0.0087534496154644,8705,1.977484204480184,The best part? Not a single religion predicted this one.,620,2807,2895,3003,8705,4
2820,1.97283950617284,0.008945118871326516,7695,1.97283950617284,Somehow I always imagined Judgement Day would come with a little more gravitas.,620,2267,2952,2476,7695,5
263,1.9715015974440893,0.009159740624885112,7825,1.9715015974440893,But what is the string attached to?,620,2460,2682,2683,7825,6
3262,1.9649692611066,0.008611125596856914,8621,1.9649692611066,These young guys have it easy. It was much harder back when it was flat,620,2610,3100,2912,8622,7
1303,1.9600767294089438,0.00905813302690258,8341,1.9600767294089438,"Lower it a bit, Mar-a-Lago's just coming back around.",620,2694,2620,3027,8341,8
4160,1.94758446479318,0.010028970715925777,6334,1.94758446479318,It's been 4 billion years. Just hit it already!,620,1860,2282,2192,6334,9
600,1.944055944055944,0.00900553290013826,7436,1.944055944055944,And to think they're worried about global warming,620,2046,2929,2462,7437,10
2955,1.9419862340216325,0.009055665426110537,8136,1.9419862340216325,"It was a biblical typo.  It's really called the ""Rupture.""",620,2492,2681,2964,8137,11
2422,1.915748541801685,0.009004332466402946,7715,1.915748541801685,Blind Fate gets two more chances.  Then it's Dumb Luck's turn.,620,2115,2835,2765,7715,12
4930,1.9020750426378623,0.009147142061304238,7036,1.9020750426378623,"The last time he connected, it killed off the dinosaurs.",620,1760,2827,2449,7036,13
4504,1.9007074896316167,0.013181397479999758,4099,1.9007074896316167,"Every time Trump tweets, an angel gets its swings.",620,1276,1140,1683,4099,14
2509,1.8882241354151463,0.009946300251521585,6853,1.8882241354151463,"After this, let's pin the tail on Uranus.",620,1982,2122,2749,6853,15
95,1.8866583019657048,0.009035381602117332,7173,1.8866583019657048,If he hits it he's in for a big surprise.  I understand it's two-thirds water.,620,1740,2881,2553,7174,16
292,1.8656716417910448,0.009826746423803276,6231,1.8656716417910448,This is taking an eternity.,620,1512,2370,2349,6231,17
1616,1.8478054341630248,0.010886374705161031,5263,1.8478054341630248,"It's the Big Bang, minus the theory.""",620,1301,1859,2102,5262,18
1581,1.805788271134806,0.021052245058548785,1313,1.805788271134806,It's ok. Most of the damage has already been done.,620,279,500,534,1313,19
1304,1.7785821268097852,0.013193129233916764,4006,1.7785821268097852,America First.,620,1051,1017,1938,4006,20
4747,1.7560534057479067,0.011300261926677524,4419,1.7560534057479067,I don't want to wait in line. Let's do the Saturn ring toss.,620,839,1663,1917,4419,21
417,1.7548999381060448,0.011039995388231524,4847,1.7548999381060448,"At this rate, mankind will beat us to it.",620,983,1693,2171,4847,22
3546,1.750664757619145,0.010849604487089558,4889,1.750664757619145,"Jesus, Haley's comet gets closer than that.",620,949,1772,2168,4889,23
2369,1.7431757016532103,0.01045060720256844,5202,1.7431757016532103,He should be pretty good at this.  He used to play for the Angels.,620,981,1904,2317,5202,24
1049,1.7248797056326068,0.0134057804883519,3533,1.7248797056326068,Do you think Trump will blame this on Obama too?,620,769,1023,1741,3533,25
2374,1.7198433420365535,0.012486285671347332,3830,1.7198433420365535,Hark! The Hearld Angel Swings!,620,757,1243,1830,3830,26
4776,1.7142420537897312,0.013089739303129056,3272,1.7142420537897312,"If we all miss, then the Meek get it, as is.",620,583,1171,1518,3272,27
3862,1.6991117690599555,0.01401931594817962,2702,1.6991117690599555,And to think they’re worried about climate change.,620,433,1023,1246,2702,28
1743,1.695436507936508,0.012009136335907623,4032,1.695436507936508,"God doesn’t play dice.  But man, he loves the piñata.",620,745,1314,1973,4032,29
4507,1.6876495931067497,0.011834996856551558,4178,1.6876495931067497,I always get a laugh when I hear their Teutonic plate movements explanation.,620,774,1326,2079,4179,30
450,1.6726263871763256,0.01288395394384998,3244,1.6726263871763256,"Well, it was already hanging by a string.",620,516,1150,1578,3244,31
375,1.6718783930510317,0.011239311220952656,4605,1.6718783930510317,"Hark, the herald angels swing.",620,832,1431,2342,4605,32
4782,1.6674725274725275,0.01076342758604655,4550,1.6674725274725275,"Usually it just causes a minor flood or earthquake, but one time we did wipe out the dinosaurs.",620,694,1649,2207,4550,33
2403,1.6606583072100314,0.02164290692438634,1276,1.6606583072100314,He died before he could finish the job at EPA.,620,238,367,671,1276,34
530,1.6438775510204082,0.016516443322175885,1960,1.6438775510204082,They probably think there’s a scientific reason for all this.,620,299,664,997,1960,35
4120,1.6364329268292683,0.02073594714322005,1312,1.6364329268292683,I hope it’s tied on tightly. Last time he knocked Pluto out of the solar system.,620,218,399,695,1312,36
1637,1.6045364891518739,0.02381190363133076,1014,1.6045364891518739,"I heard it's not filled with candy, it's filled with nuts.",620,170,273,571,1014,37
1498,1.5955383123181377,0.021835993131177817,1031,1.5955383123181377,Don't get your hopes up.  He hasn't connected since the dinosaurs.,620,129,356,546,1031,38
1445,1.5954545454545457,0.014150016767398028,2640,1.5954545454545457,This guy couldn't hit Jupiter,620,380,813,1447,2640,39
2036,1.5933194154488517,0.014964065562326047,2395,1.5933194154488517,I hear it's full of plastic crap made in China.,620,353,715,1327,2395,40
250,1.5891783567134268,0.01948591505296264,1497,1.5891783567134268,"Today's Tuesday, November 8, 2016.  Why do you ask?",620,244,394,859,1497,41
1296,1.5775335775335777,0.024973502107187344,819,1.5775335775335777,No one ever thinks it's going to end this way.,620,109,255,455,819,42
419,1.5737122557726466,0.02153350953687841,1126,1.5737122557726466,"And on the 8th day, we partied.",620,156,334,636,1126,43
3302,1.5663811563169163,0.01757116770675841,1868,1.5663811563169163,"Little known fact: Every time Donald Trump tweets, an angel gets its swings.""",620,309,440,1119,1868,44
1975,1.563515954244431,0.017941441179217043,1661,1.563515954244431,Admit it: This totally beats dancing on the head of a pin.,620,240,457,964,1661,45
3897,1.5532646048109966,0.02118738757562621,1164,1.5532646048109966,That's how we make wind. Wait until you see how rain happens.,620,160,324,680,1164,46
234,1.5456375838926175,0.018525289183369386,1490,1.5456375838926175,Getting warmer.,620,196,421,873,1490,47
1874,1.5450921773791728,0.015662698770085776,2007,1.5450921773791728,The last time he connected all the dinosaurs died.,620,245,604,1158,2007,48
1838,1.5427792915531335,0.016402142648081205,1835,1.5427792915531335,"If he actually hits it, we’re going to see a lot of new faces around here.",620,225,546,1064,1835,49
1694,1.5394605394605394,0.023455088307737938,1001,1.5394605394605394,Wait! Wait! He's been impeached!,620,151,238,612,1001,50
3834,1.5382700684505288,0.017489075772235,1607,1.5382700684505288,Some of them thought it would end with a whimper.,620,195,475,937,1607,51
2370,1.5347670250896055,0.01925610101737156,1395,1.5347670250896055,"I thought we were going to wait, and give the mid-terms a chance.",620,187,372,836,1395,52
2954,1.53395913859746,0.016686158160477697,1811,1.53395913859746,Here comes another Big Bang.,620,231,505,1075,1811,53
407,1.5322486926205694,0.016850155647590098,1721,1.5322486926205694,We thought we would combine Armageddon with a festive event.,620,206,504,1011,1721,54
2924,1.523117569352708,0.018139037136269662,1514,1.523117569352708,Swing and a miss. The Angels are down to their last strike.,620,188,416,910,1514,55
514,1.5220689655172417,0.0181979338187244,1450,1.5220689655172417,Don't you think they've had enough this year?,620,167,423,860,1450,56
4341,1.5174875089221984,0.01856234902926758,1401,1.5174875089221984,And to think they’re scared of climate change.,620,163,399,839,1401,57
4391,1.5164912280701754,0.018939226262324152,1425,1.5164912280701754,If I knew he batted left I would have put the White House on the other side.,620,186,364,875,1425,58
2083,1.5160550458715596,0.03443458837739998,436,1.5160550458715596,"You know, I'm not sure Pruitt should be up here.",620,58,109,269,436,59
302,1.5132605304212168,0.01943450175527259,1282,1.5132605304212168,And on the eighth day...,620,150,358,774,1282,60
2107,1.5127388535031847,0.01942528512532273,1256,1.5127388535031847,"Not so omniscient with the blindfold on, is He?",620,141,363,753,1257,61
510,1.5079239302694136,0.0201076035615383,1262,1.5079239302694136,"We're going to call it ""The Big Bang"".",620,164,313,785,1262,62
4156,1.5074775672981058,0.02168730963519461,1003,1.5074775672981058,In a minute all hell will break loose.,620,111,287,605,1003,63
947,1.5042808219178083,0.02023261047521813,1168,1.5042808219178083,"It's the end of times, we might as well have some fun.",620,133,323,712,1168,64
1841,1.5031390134529148,0.02151073796843266,1115,1.5031390134529148,It was either this or pin the tail on Uranus.,620,148,265,702,1115,65
1929,1.5029797377830751,0.024258397268185045,839,1.5029797377830751,"Had I known that this is what passed for entertainment up here, I probably would have cheated on my spouse.",620,102,218,519,839,66
3280,1.5,0.02081142908253293,1102,1.5,He won't hit it.  This is all just to scare the Baptists.,620,125,301,676,1102,67
2644,1.4972972972972969,0.03449920012376589,370,1.4972972972972969,They think earthquakes are caused by fracking.,620,35,114,221,370,68
3840,1.4965277777777777,0.04231443739095842,288,1.4965277777777777,"If he smashes that thing, all hell will break loose.",620,38,67,183,288,69
2658,1.4965243296921549,0.02212138464594295,1007,1.4965243296921549,It's okay.  It's empty now - used to be filled with hopes and dreams.,620,122,256,629,1007,70
74,1.4960707269155211,0.02280615913745265,1018,1.4960707269155211,He trained at the Environmental Protection Agency.,620,142,221,655,1018,71
988,1.496031746031746,0.024441915306819842,756,1.496031746031746,"I'm no theologian, but this just doesn't seem right.",620,76,223,457,756,72
3315,1.4959432048681542,0.02251849647003192,986,1.4959432048681542,I just didn't expect that this is what we'd do on the 8th day.,620,123,243,620,986,73
1425,1.4956437560503388,0.021400424986653614,1033,1.4956437560503388,It's not like they were taking great care of it.,620,115,282,636,1033,74
4783,1.4942418426103647,0.0212640010998046,1042,1.4942418426103647,I hope they don’t blow themselves up before it’s my turn.,620,115,285,642,1042,75
4939,1.488817891373802,0.023213710353107368,939,1.488817891373802,Einstein was right. God doen't play dice with the universe,620,120,219,600,939,76
3386,1.4880083420229406,0.022171277853414825,959,1.4880083420229406,We keep score on the Richter Scale.,620,106,256,597,959,77
1158,1.4871794871794872,0.02571407714415413,702,1.4871794871794872,"Actually, I'm not sure if the Boss knows, but we ran it through legal and they thought it was fine.",620,75,192,435,702,78
259,1.4861407249466951,0.023230813911369084,938,1.4861407249466951,"I don't believe it either, but this is what they voted for.",620,120,216,602,938,79
3570,1.4844919786096256,0.022177625589541502,935,1.4844919786096256,"When it splits open, all hell breaks loose",620,98,257,580,935,80
2889,1.4844444444444445,0.023127761797079656,900,1.4844444444444445,They were just going to blow it up anyway.,620,104,228,568,900,81
2721,1.4840484048404845,0.02448983942777935,909,1.4840484048404845,"If Trump is reelected, the blindfold goes.",620,134,172,603,909,82
1493,1.483960948396095,0.024851833786595647,717,1.483960948396095,And they're worried about global warming.,620,69,209,439,717,83
2828,1.4829106945975743,0.024130508507885826,907,1.4829106945975743,"Is that Scott? Nah, Pruit does it with his eyes open.",620,126,186,595,907,84
2141,1.480181200453001,0.02284356595280794,883,1.480181200453001,Two to one God's still pulling the strings and he misses,620,93,238,552,883,85
4456,1.4800965018094092,0.024046946035922355,829,1.4800965018094092,"Originally it was flat, but it was too hard to hit.""",620,95,208,526,829,86
4355,1.4792147806004619,0.02328430746854806,866,1.4792147806004619,I always feel sorry for their theologians after our parties.,620,95,225,546,866,87
478,1.4763271162123386,0.026312235248924,697,1.4763271162123386,He’s working in mysterious ways again.,620,81,170,446,697,88
3839,1.4753309265944643,0.02188155071624543,831,1.4753309265944643,No way am I putting anything from that in my mouth.,620,62,272,498,832,89
4963,1.4742138364779869,0.02454281950275241,795,1.4742138364779869,Bob is a klutz.  My money is on global warming.,620,91,195,509,795,90
3484,1.4742014742014742,0.025280826331355918,814,1.4742014742014742,"Yes, a lot of things have changed around here since we got a Pope from Latin America.",620,110,166,538,814,91
3539,1.4734895191122066,0.02393012288254801,811,1.4734895191122066,He's been getting closer ever since the election.,620,87,210,514,811,92
2011,1.4731369150779896,0.02796073126888469,577,1.4731369150779896,He only said we couldn't flood it again.,620,58,157,362,577,93
3075,1.4730238393977415,0.025005122724621118,797,1.4730238393977415,I love when Judgment Day falls on a Taco Tuesday.,620,99,179,519,797,94
1410,1.4727047146401986,0.02403764802565831,806,1.4727047146401986,"The last time he connected, we lost the dinosaurs",620,87,207,512,806,95
3364,1.472568578553616,0.02438200420693152,802,1.472568578553616,Two bits says that Trump busts it before he does.,620,91,197,514,802,96
424,1.4713375796178343,0.023969909682004697,785,1.4713375796178343,Hit along a fault line or they'll get suspicious.,620,79,212,494,785,97
3622,1.4645776566757494,0.026456235186157667,734,1.4645776566757494,he's Trump's foreign policy advisor,620,97,147,490,734,98
349,1.4641873278236914,0.0253246750610672,726,1.4641873278236914,"Of all the apocalyptic scenarios, I bet they didn't see this one coming.",620,79,180,468,727,99
3442,1.4631432545201668,0.02554125050128134,719,1.4631432545201668,I used to think He had a plan.,620,79,175,465,719,100
2351,1.4627285513361463,0.0259813551756553,711,1.4627285513361463,"His name?  Scott Pruitt.""",620,82,165,464,711,101
3598,1.4617563739376769,0.02517563012661151,706,1.4617563739376769,"Down there on Earth it goes by many names, the Rapture, End of Days, the Second Coming.  Up here, we just call it Fiesta!",620,70,186,450,706,102
16,1.4589235127478757,0.036069080274096,353,1.4589235127478757,He's been getting a lot closer since 2016.,620,37,88,228,353,103
3931,1.4578947368421054,0.029460323975746244,570,1.4578947368421054,Now up to bat - - R. Mageddon!,620,70,121,379,570,104
313,1.4567164179104477,0.027061287257046648,670,1.4567164179104477,You think he can get it done before Trump does it?,620,81,144,445,670,105
623,1.4563253012048192,0.027492068481263173,664,1.4563253012048192,"If Trump wins again, the blindfold comes off.",620,84,135,445,664,106
1706,1.4563253012048192,0.025698435516164696,664,1.4563253012048192,"I expected that actually ""playing God"" would be a little more imaginative",620,63,177,424,664,106
1109,1.4546925566343043,0.028752652133490205,618,1.4546925566343043,"It was this or ""Pin the tail on Uranus.""",620,81,119,418,618,108
2474,1.4545454545454546,0.026028150074757686,649,1.4545454545454546,Do you think they know it's all a game?,620,62,171,416,649,109
103,1.4535603715170278,0.025176403157302255,646,1.4535603715170278,"The whole idea of this game is to knock some sense into it.""",620,52,189,405,646,110
3830,1.4533965244865719,0.028054906928886687,633,1.4533965244865719,Seems unnecessary.,620,79,129,425,633,111
25,1.4521193092621665,0.02674503391077123,637,1.4521193092621665,They were overdue for a mass extinction event. We just wanted to make it fun.,620,66,156,415,637,112
1979,1.4516640253565771,0.026170952509358348,631,1.4516640253565771,"Well, it's getting warmer.",620,58,169,404,631,113
4134,1.4516640253565771,0.027207728506107268,631,1.4516640253565771,2016...2017...2018...,620,69,147,415,631,113
3874,1.4507936507936507,0.027237002391549414,630,1.4507936507936507,"The spin coming out of  Washington, D.C. makes it almost impossible to hit!",620,69,146,415,630,115
4194,1.4503205128205128,0.027145361338584525,624,1.4503205128205128,"We're hoping if he hits it hard enough, everything on earth will go back to normal.",620,66,149,409,624,116
241,1.4478827361563518,0.027749740710843792,614,1.4478827361563518,It's filled with nuts.,620,69,137,408,614,117
1774,1.4477611940298507,0.02712587040077503,603,1.4477611940298507,It's all fun and games until somebody loses a continent.,620,59,152,392,603,118
872,1.4471057884231535,0.03120010129680658,501,1.4471057884231535,I can't wait to hear how they report this on NPR.,620,60,104,337,501,119
4594,1.4464882943143813,0.028293322664722988,598,1.4464882943143813,"Last time we tried this, Trump got elected.",620,69,129,400,598,120
4451,1.445945945945946,0.027064157966739246,592,1.445945945945946,Are you sure that we should be doing this? He just spent seven days working on it.,620,55,154,383,592,121
2845,1.4436741767764298,0.028206390766082893,577,1.4436741767764298,It will create a terrible mess but on the upside no more tweeting.,620,61,134,382,577,122
3753,1.4423076923076923,0.02805638557140944,572,1.4423076923076923,"I just pictured something more elaborate when Stephen Hawking said, ""The end of the world is nigh.""",620,58,137,377,572,123
1534,1.4421052631578948,0.02899085204525775,570,1.4421052631578948,We might as well destroy it before Trump does.,620,66,120,384,570,124
3409,1.4416961130742052,0.02759845576698996,566,1.4416961130742052,The last time we played this game we lost the dinosaurs.,620,52,146,368,566,125
1551,1.4402852049910873,0.02822352226354896,561,1.4402852049910873,"This is the way the world ends.  Not with a bang, but a wiffle.",620,56,135,370,561,126
1160,1.4391143911439117,0.02748397504022916,542,1.4391143911439117,"I wouldn't worry too much, there are billions of these things floating around.",620,44,150,348,542,127
1173,1.439068100358423,0.02838553074716248,558,1.439068100358423,They'll never know what hit 'em.,620,57,132,370,559,128
4772,1.4388349514563106,0.029401192743739805,515,1.4388349514563106,Are we taking this string theory thing a little too literally?,620,51,124,340,515,129
4337,1.4375,0.02861515657078187,544,1.4375,Just told him that Jeff Sessions quoted Romans 13. He's swinging for the fences,620,54,130,360,544,130
2909,1.437269372693727,0.02772343496462801,542,1.437269372693727,He said a flood wasn’t enough this time.,620,46,145,351,542,131
537,1.4368932038834952,0.029393207899855923,515,1.4368932038834952,Here comes the Big Bang.,620,51,123,341,515,132
926,1.4350282485875707,0.02861925030516974,531,1.4350282485875707,I don't know why we bother with this game. They're doing a good enough job on their own.,620,50,131,350,531,133
1668,1.4340344168260035,0.02943105124708498,523,1.4340344168260035,Now this is fun. Remember when it was flat?,620,54,119,350,523,134
1137,1.431640625,0.028304657076710107,512,1.431640625,Has it really been 66 million years already?,620,42,137,333,512,135
1144,1.4285714285714286,0.02971833205096046,497,1.4285714285714286,"We've tried floods, pestilence, wars, nothing seems to work. So why not this?",620,48,117,332,497,136
1599,1.4282828282828284,0.029940441732462717,495,1.4282828282828284,"If He asks, Satan did it.",620,49,114,332,495,137
3445,1.4278846153846154,0.033507892163525614,416,1.4278846153846154,It's allowed under the loosened EPA rules.,620,46,86,284,416,138
1003,1.4262295081967211,0.03024124719943119,488,1.4262295081967211,They really have no idea how insignificant they are.,620,49,110,329,488,139
4287,1.4262295081967211,0.028151517192695368,488,1.4262295081967211,I wish the anti-science folks could see this!,620,35,139,315,489,139
1472,1.4259259259259258,0.03102161713108141,486,1.4259259259259258,We put Scott Pruitt inside.,620,54,99,333,486,141
2283,1.4259259259259258,0.03142921789832324,486,1.4259259259259258,The last time we did this Trump was elected.,620,57,93,336,486,141
4949,1.4252136752136753,0.029668896332995468,468,1.4252136752136753,Eternity sounds like fun at first. Then boredom sets in.,620,39,121,308,468,143
2670,1.425,0.031024324306546964,480,1.425,God help cartoonists: left hand over right is not right.,620,52,100,328,480,144
3812,1.425,0.030883814869229264,480,1.425,Who gave Justice a bat?,620,51,102,327,480,144
436,1.4246861924686192,0.03139887608282682,478,1.4246861924686192,He's training for a job at the EPA.,620,54,95,329,478,146
3979,1.4234042553191488,0.030773021853245975,470,1.4234042553191488,I always thought it would be global warming.,620,47,105,318,470,147
1647,1.4231578947368422,0.030536345768132626,475,1.4231578947368422,"There are no bad angels. There are only bored angels.""",620,47,107,321,475,148
2696,1.4221748400852878,0.029453358492629155,469,1.4221748400852878,Seems to me they’re doing a pretty good job themselves.,620,38,122,309,469,149
618,1.4218415417558887,0.030458868566228942,467,1.4218415417558887,God said we should have fun before putting it out of its misery.,620,44,109,314,467,150
4814,1.4218415417558887,0.028591252274430868,467,1.4218415417558887,Earth was always a hit or miss proposition.,620,32,133,302,467,150
969,1.421505376344086,0.03039909930239882,465,1.421505376344086,"You know, it's not the real one. That's already ruined.",620,43,110,312,465,152
787,1.420824295010846,0.030584245158403783,461,1.420824295010846,"You were bored with earth quakes, hurricanes, floods,  fires and Trump?",620,43,108,310,461,153
2240,1.420824295010846,0.03134569375625172,461,1.420824295010846,When this guy was done with Pluto it wasn't even a planet.,620,48,98,315,461,153
1977,1.420479302832244,0.032338634551392235,459,1.420479302832244,"Don't worry--Yankees can't get in here, and Cubs can't hit it.",620,54,85,320,459,155
287,1.4201312910284465,0.030772395808376263,457,1.4201312910284465,"The last time he won, the dinosaurs went extinct.",620,43,106,308,457,156
601,1.4201312910284465,0.03014218230624925,457,1.4201312910284465,We got tired of waiting for an asteroid to do it.,620,39,114,304,457,156
2623,1.4197802197802198,0.030867621855502105,455,1.4197802197802198,It's been 4.543 billion years - maybe it's time someone else got a turn.,620,43,105,307,455,158
333,1.4194260485651211,0.030805495355290074,453,1.4194260485651211,"If you ask me, it's not an extinction event without cake and ice cream.",620,42,106,305,453,159
402,1.4194260485651211,0.030805495355290074,453,1.4194260485651211,I told him it would break itself if he just left it alone.,620,42,106,305,453,159
1708,1.4194260485651211,0.03032614999438173,453,1.4194260485651211,No fair hitting below the equator.,620,39,112,302,453,159
1219,1.419068736141907,0.03074151418046625,451,1.419068736141907,Taking a blind swing at the world is popular on Earth right now.,620,41,107,303,451,162
2239,1.4166666666666667,0.030578571656142764,444,1.4166666666666667,So this is how the world ends? I would have never guessed.,620,38,109,297,444,163
3066,1.4166666666666667,0.03090930940641257,444,1.4166666666666667,I don't like this. The big guy spent 6 days making it.,620,40,105,299,444,163
3432,1.415909090909091,0.03288507290710787,440,1.415909090909091,WOW !! And he's one of our batter angels. !!,620,51,81,308,440,165
3128,1.415137614678899,0.030623257266351955,436,1.415137614678899,"Wow!  He said he was mad at the world, but I figured he'd just post something snarky on Facebook.",620,36,109,291,436,166
3388,1.415137614678899,0.03213550311888695,436,1.415137614678899,"What can they expect, putting everything in the Cloud!",620,45,91,300,436,166
3482,1.415137614678899,0.0316394532559649,436,1.415137614678899,You should've been here when he knocked Pluto out of the park.,620,42,97,297,436,166
4448,1.4149659863945578,0.030036501576794324,441,1.4149659863945578,"Honestly, the way its going, the humans might get the job done quicker...",620,34,115,292,441,169
3481,1.414519906323185,0.03177262173520782,427,1.414519906323185,"Metaphorically speaking, it's God's way of saying that his button is bigger than Trump's.",620,40,97,290,427,170
2532,1.4139534883720932,0.03245575519478097,430,1.4139534883720932,"And on the 8th day, they had a party.",620,45,88,297,430,171
2906,1.4139534883720932,0.03160959804756483,430,1.4139534883720932,It's called Trump Ball but no one knows the rules.,620,40,98,292,430,171
1368,1.4135514018691588,0.03154008009355351,428,1.4135514018691588,"I don't even like the molten center, it's just the sport of it for me",620,39,99,290,428,173
345,1.4134615384615383,0.04683456113780826,208,1.4134615384615383,That planet has always been hit or miss.,620,22,42,144,208,174
4150,1.412790697674419,0.04867755437344355,172,1.412790697674419,65 million years from now they'll think it was an asteroid,620,14,43,115,172,175
3101,1.4121779859484778,0.0317576253762953,427,1.4121779859484778,I hope it's filled with Skittles.  The last time it was filled with these big lizards with sharp teeth.,620,40,96,291,427,176
2505,1.4117647058823528,0.0306189549489777,425,1.4117647058823528,"If this thing explodes on it's own, I don't think that should count.",620,33,109,283,425,177
4116,1.4113475177304964,0.030898750667602944,423,1.4113475177304964,"It's a small world, isn't it?",620,34,106,283,423,178
