target_id,mean,precision,count,score,caption,contest,funny,somewhat_funny,unfunny,rank
5378,1.232,0.047022300817734855,125,1.232,"Sir, there have been compaints. You need to have waste pickup bags or written proof that he is indeed a pigeon.",623,6,17,102,1486
5497,1.232,0.04419312455647955,125,1.232,"Don't be concerned, officer. He thinks he's Snoopy.",623,4,21,100,1486
5512,1.232,0.04562964514577153,125,1.232,"If that thing shits, you’re outta here!",623,5,19,101,1486
5680,1.232,0.047022300817734855,125,1.232,The dog kite park is down the block.,623,6,17,102,1486
5811,1.232,0.04419312455647955,125,1.232,Best darn birder you'll ever find!,623,4,21,100,1486
5813,1.232,0.04037885105972217,126,1.232,It's not about the kite.,623,2,26,98,1486
5907,1.232,0.047022300817734855,125,1.232,We’ve had complaints about your dog letting his chips fall where they may.,623,6,17,102,1486
5926,1.232,0.047022300817734855,125,1.232,"On behalf of all postal workers, sir. I thank you...",623,6,17,102,1486
6349,1.232,0.042708313008125234,125,1.232,"'Sorry, pal. Kites only. You'll have to find another place to walk your Airedale",623,3,23,99,1486
6413,1.2301587301587302,0.043879631045168496,126,1.2301587301587302,He's so fly.,623,4,21,101,1533
4244,1.23,0.04893822120745192,100,1.23,"Fetching isn't the problem, it's when he drops the ball.",623,3,17,80,1534
80,1.2295081967213115,0.044759038502775586,122,1.2295081967213115,We just ask that you clean up after your pet.,623,4,20,98,1535
138,1.2295081967213115,0.047690014903129664,122,1.2295081967213115,It's the two other things they do that I'm worried about.,623,6,16,100,1535
164,1.2295081967213115,0.04624775156239316,122,1.2295081967213115,Didn't you see the 'No Helium-Filled Dogs Allowed' sign?,623,5,18,99,1535
384,1.2295081967213115,0.04162217598738882,122,1.2295081967213115,"Sorry, the rules say 'no dogs,' even if they're on the leash.",623,2,24,96,1535
392,1.2295081967213115,0.047690014903129664,122,1.2295081967213115,Most people just bury ‘em.,623,6,16,100,1535
399,1.2295081967213115,0.044759038502775586,122,1.2295081967213115,Dry kibble will help with the gas.,623,4,20,98,1535
440,1.2295081967213115,0.04624775156239316,122,1.2295081967213115,Very impressive. But I'm afraid you still need to take him to the dog park.,623,5,18,99,1535
551,1.2295081967213115,0.04624775156239316,122,1.2295081967213115,"An airdale, I presume.",623,5,18,99,1535
807,1.2295081967213115,0.04321907600596126,122,1.2295081967213115,"I know it’s legal now, but you really should keep your dog away from your stash.",623,3,22,97,1535
849,1.2295081967213115,0.049089922777945175,122,1.2295081967213115,We've had complaints about your kite marking its territory.,623,7,14,101,1535
947,1.2295081967213115,0.04624775156239316,122,1.2295081967213115,If he does not go after this ball then he can be considered a kite under the law.,623,5,18,99,1535
1013,1.2295081967213115,0.044759038502775586,122,1.2295081967213115,"He's had his shots, I don't see what the problem is.",623,4,20,98,1535
1038,1.2295081967213115,0.04624775156239316,122,1.2295081967213115,Rescue dog.  Fear of heights.,623,5,18,99,1535
1091,1.2295081967213115,0.04321907600596126,122,1.2295081967213115,I don't know whether I should call Animal Control or the FAA.,623,3,22,97,1535
1148,1.2295081967213115,0.04162217598738882,122,1.2295081967213115,We're looking for a man who sneaked in a dog.,623,2,24,96,1535
1286,1.2295081967213115,0.043995795586067116,123,1.2295081967213115,"This is why they're called ""Leash laws"" and not ""Kite string laws.""",623,4,21,98,1535
1297,1.2295081967213115,0.044759038502775586,122,1.2295081967213115,"Excuse me sir, but no dogs are allowed in the air space between 9a and 5p.",623,4,20,98,1535
1325,1.2295081967213115,0.04624775156239316,122,1.2295081967213115,"It started when he swallowed my granddaughter's, helium balloon""",623,5,18,99,1535
1416,1.2295081967213115,0.044759038502775586,122,1.2295081967213115,I don’t care if his breed can do that! You still need to pick up after him.,623,4,20,98,1535
1560,1.2295081967213115,0.0408002945514272,123,1.2295081967213115,His name is Kite.,623,2,25,96,1535
1562,1.2295081967213115,0.04321907600596126,122,1.2295081967213115,Remove your dog or be ticketed.,623,3,22,97,1535
1607,1.2295081967213115,0.0504510011320738,122,1.2295081967213115,Please make sure to curb your kite,623,8,12,102,1535
1657,1.2295081967213115,0.044759038502775586,122,1.2295081967213115,"Where's the pooper scooper, pal . .  or are you gonna use your hat?",623,4,20,98,1535
1795,1.2295081967213115,0.0408002945514272,123,1.2295081967213115,I  don't care if it is an Airdale it is still a dog!,623,2,25,96,1535
1893,1.2295081967213115,0.047690014903129664,122,1.2295081967213115,I don't care if his name is Roosevelt.,623,6,16,100,1535
1939,1.2295081967213115,0.047690014903129664,122,1.2295081967213115,"Well if you see him, call animal control.",623,6,16,100,1535
2116,1.2295081967213115,0.04697441881512515,123,1.2295081967213115,We ran out of pigs for Trump's inauguration. This will do for now.,623,6,17,100,1535
2175,1.2295081967213115,0.044759038502775586,122,1.2295081967213115,Does your dog there have a medical marijuana card sir?,623,4,20,98,1535
2308,1.2295081967213115,0.04321907600596126,122,1.2295081967213115,I hope that kite don't leak.,623,3,22,97,1535
2353,1.2295081967213115,0.049089922777945175,122,1.2295081967213115,Because you can't scoop on the fly.,623,7,14,101,1535
2517,1.2295081967213115,0.03547132708021433,122,1.2295081967213115,You're gonna have to fly your 'doodle somewhere else.,623,0,0,122,1535
2540,1.2295081967213115,0.049089922777945175,122,1.2295081967213115,I’m sure he is having fun but the lady whose head he crapped on isn’t.,623,7,14,101,1535
2568,1.2295081967213115,0.049089922777945175,122,1.2295081967213115,Tell me that's not an Airedale,623,7,14,101,1535
2800,1.2295081967213115,0.04321907600596126,122,1.2295081967213115,This is a leash!,623,3,22,97,1535
2869,1.2295081967213115,0.04162217598738882,122,1.2295081967213115,"This is a kite park, sir. The fact that he's an Airedale is irrelevant.",623,2,24,96,1535
2887,1.2295081967213115,0.04624775156239316,122,1.2295081967213115,I don't care that she's an Airedale. No dogs allowed.,623,5,18,99,1535
2890,1.2295081967213115,0.044759038502775586,122,1.2295081967213115,Pardon me sir... is that an Airedale?,623,4,20,98,1535
2915,1.2295081967213115,0.044759038502775586,122,1.2295081967213115,"I take it, that's Roosevelt?",623,4,20,98,1535
2959,1.2295081967213115,0.04624775156239316,122,1.2295081967213115,That better be an Airedale or you’re in big trouble.,623,5,18,99,1535
2992,1.2295081967213115,0.04624775156239316,122,1.2295081967213115,Great. Now there's poo everywhere.,623,5,18,99,1535
3083,1.2295081967213115,0.049089922777945175,122,1.2295081967213115,As long as he remains a kite he can stay.,623,7,14,101,1535
3129,1.2295081967213115,0.03996151319759143,122,1.2295081967213115,"Sir: Once again, I do not care that you are in a Kite park, The NYC health Code does not permit leashes longer than 6 feet long period.",623,1,26,95,1535
3164,1.2295081967213115,0.044759038502775586,122,1.2295081967213115,"Sir, you're going to need to move downwind.",623,4,20,98,1535
3167,1.2295081967213115,0.04162217598738882,122,1.2295081967213115,"They're worried a doggie bag will be too little, too late.",623,2,24,96,1535
3388,1.2295081967213115,0.047690014903129664,122,1.2295081967213115,"Oh, his name is Flydo? Carry on.",623,6,16,100,1535
3399,1.2295081967213115,0.049089922777945175,122,1.2295081967213115,I'm afraid I'm going to have to ask if you are an American citizen.,623,7,14,101,1535
3449,1.2295081967213115,0.04624775156239316,122,1.2295081967213115,Can you maybe not feed her beforehand?,623,5,18,99,1535
3527,1.2295081967213115,0.047690014903129664,122,1.2295081967213115,Emotional support animals can't fly here.,623,6,16,100,1535
3528,1.2295081967213115,0.04624775156239316,122,1.2295081967213115,So explain how Fido got high as a kite.,623,5,18,99,1535
3771,1.2295081967213115,0.04242813962887261,123,1.2295081967213115,the dog park is one block south.,623,3,23,97,1535
3836,1.2295081967213115,0.04624775156239316,122,1.2295081967213115,"I don't care how gassy he is, just pull him in now!!",623,5,18,99,1535
3858,1.2295081967213115,0.04321907600596126,122,1.2295081967213115,It's what happens before picking up after your dog that I'm worried about.,623,3,22,97,1535
3902,1.2295081967213115,0.04321907600596126,122,1.2295081967213115,It's an Airedale?,623,3,22,97,1535
3931,1.2295081967213115,0.04624775156239316,122,1.2295081967213115,Sorry sir but the dog days are over.,623,5,18,99,1535
4245,1.2295081967213115,0.044759038502775586,122,1.2295081967213115,I've gotten several complaints of a light drizzle coming from your direction.,623,4,20,98,1535
4323,1.2295081967213115,0.04162217598738882,122,1.2295081967213115,"Yes, your kite has reached the minimum height and it does indeed have a tail. Problem is, it also has bowels.",623,2,24,96,1535
4467,1.2295081967213115,0.04624775156239316,122,1.2295081967213115,"He's an airedale, officer.",623,5,18,99,1535
4554,1.2295081967213115,0.0408002945514272,123,1.2295081967213115,"Sorry, you can’t fly a dog without a license.",623,2,25,96,1535
4653,1.2295081967213115,0.044759038502775586,122,1.2295081967213115,"So, you’re saying it’s JUST for kites?",623,4,20,98,1535
4944,1.2295081967213115,0.044759038502775586,122,1.2295081967213115,You're not fooling anyone...,623,4,20,98,1535
4997,1.2295081967213115,0.044759038502775586,122,1.2295081967213115,Remember to pick up after your kite.,623,4,20,98,1535
5022,1.2295081967213115,0.044759038502775586,122,1.2295081967213115,"Nice try, bud. Leash laws still apply.",623,4,20,98,1535
5083,1.2295081967213115,0.047690014903129664,122,1.2295081967213115,"Listen, buddy, ""Keep off the grass"" doesn't exempt you from ""No dogs.""",623,6,16,100,1535
5176,1.2295081967213115,0.047690014903129664,122,1.2295081967213115,I've always liked the songs of free dog kite.,623,6,16,100,1535
5181,1.2295081967213115,0.04321907600596126,122,1.2295081967213115,"I don't care if his poop 'floats away', you still gotta pick it up.",623,3,22,97,1535
5265,1.2295081967213115,0.04624775156239316,122,1.2295081967213115,Airedale terrier?,623,5,18,99,1535
5288,1.2295081967213115,0.047690014903129664,122,1.2295081967213115,We had a report of a dog without a license tag.,623,6,16,100,1535
5338,1.2295081967213115,0.049089922777945175,122,1.2295081967213115,"Sir, the length of your dog leash exceeds the legal limit.  Please lower your dog accordingly.",623,7,14,101,1535
5571,1.2295081967213115,0.044759038502775586,122,1.2295081967213115,Kudos getting around the ‘no dogs on the grass’ rule.,623,4,20,98,1535
5766,1.2295081967213115,0.04624775156239316,122,1.2295081967213115,"It's okay for now, but you can't use him for the kite fighting later.",623,5,18,99,1535
5853,1.2295081967213115,0.044759038502775586,122,1.2295081967213115,I saw you with that helium balloon guy. Take the dog down.,623,4,20,98,1535
5945,1.2295081967213115,0.038228778951954284,122,1.2295081967213115,Your kite's fine as long as it remains air borne.,623,0,28,94,1535
6031,1.2295081967213115,0.0408002945514272,123,1.2295081967213115,Technically you're in violation of the kite tail to body ratio.,623,2,25,96,1535
6132,1.2295081967213115,0.04162217598738882,122,1.2295081967213115,"No, it is NOT the same as being on a leash.",623,2,24,96,1535
6137,1.2295081967213115,0.04321907600596126,122,1.2295081967213115,"No problem, sir, as long as he's wearing his leash.",623,3,22,97,1535
6248,1.2295081967213115,0.04162217598738882,122,1.2295081967213115,"Thank you for leashing your dog, sir.",623,2,24,96,1535
6295,1.2295081967213115,0.047690014903129664,122,1.2295081967213115,I don't care if he's an Airedale Terrier. You can't fly him here.,623,6,16,100,1535
6346,1.2295081967213115,0.044759038502775586,122,1.2295081967213115,"Sir, perhaps an alternative to 'Bombs Away!'",623,4,20,98,1535
336,1.2276422764227641,0.04290685281090796,123,1.2276422764227641,"Sorry Sir, but there have been reports that your kite has been threatening the other kites.",623,3,22,98,1613
511,1.2272727272727273,0.04595223779440722,110,1.2272727272727273,"The rest of them are leashed, too, but that’s not my point.",623,3,19,88,1614
736,1.2268907563025209,0.04374730103773937,119,1.2268907563025209,"Wise guy, huh?",623,3,21,95,1615
6,1.225,0.04177856123984774,120,1.225,"Yes, it rhymes with ""Bite Bark"" and no that's not close enough.",623,2,23,95,1616
51,1.225,0.04177856123984774,120,1.225,Is he airbroken?,623,2,23,95,1616
84,1.225,0.04006734526846948,120,1.225,"Sir, please clean up after your kite.",623,1,25,94,1616
132,1.225,0.04342239285991355,120,1.225,"I don't care if he is an Airedale, you're in the wrong park.",623,3,21,96,1616
171,1.225,0.046536182122071404,120,1.225,"...if he comes back, he’s yours; if he doesn’t he never was.",623,5,17,98,1616
278,1.225,0.04342239285991355,120,1.225,Very clever. You still have to scoop.,623,3,21,96,1616
300,1.225,0.04945430508374903,120,1.225,"Sir, that’s our drug sniffing dog and he’s high on something.",623,7,13,100,1616
301,1.225,0.046536182122071404,120,1.225,"If pigs can fly, so can he!",623,5,17,98,1616
339,1.225,0.04500622428164392,120,1.225,"Sir, I'm from the FAA.  You'll have to reel him in - support animals were banned from this airspace last week",623,4,19,97,1616
422,1.225,0.03339455162794331,120,1.225,No dogs allowed from the ground up to 25 feet. You're short.,623,0,0,120,1616
494,1.225,0.04801741630812264,120,1.225,You still have to clean up after it!,623,6,15,99,1616
557,1.225,0.04342239285991355,120,1.225,Nice Airdale.,623,3,21,96,1616
629,1.225,0.04177856123984774,120,1.225,Airdales are illegal in this park.,623,2,23,95,1616
649,1.225,0.05085060780094462,120,1.225,Marjorie wants you and Felicia to come for lunch next Thursday. She’s making cornbread.,623,8,11,101,1616
660,1.225,0.04342239285991355,120,1.225,"Sorry officer, my dog's very light on his feet.",623,3,21,96,1616
731,1.225,0.04500622428164392,120,1.225,That’s a beautiful German shepbird.,623,4,19,97,1616
771,1.225,0.046536182122071404,120,1.225,You wouldn’t happen to work at the CRISPR lab?,623,5,17,98,1616
774,1.225,0.04500622428164392,120,1.225,"Didn't you learn your lesson the first time, Mr. Romney?",623,4,19,97,1616
808,1.225,0.04177856123984774,120,1.225,We both needed some air.,623,2,23,95,1616
850,1.225,0.04342239285991355,120,1.225,It’s the rule; you catch the stool.,623,3,21,96,1616
914,1.225,0.04177856123984774,120,1.225,We have received complaints about you kite fighting with the other kites. You will need to muzzle your kite.,623,2,23,95,1616
957,1.225,0.046536182122071404,120,1.225,"I'm afraid I must ask you to leave the park. If we allow dogs to fly here, can pigs be far behind?",623,5,17,98,1616
1196,1.225,0.04801741630812264,120,1.225,"So, let me get this straight; your dog's name is Kite?",623,6,15,99,1616
1338,1.225,0.04500622428164392,120,1.225,"And, inflating your dog with helium is a separate offense, sir.",623,4,19,97,1616
1360,1.225,0.04500622428164392,120,1.225,I don't care if your dog can fly. Get him down.,623,4,19,97,1616
1460,1.225,0.04801741630812264,120,1.225,Are you aware your service dog is high on the job?,623,6,15,99,1616
1568,1.225,0.046536182122071404,120,1.225,ThePiñata Park is to right,623,5,17,98,1616
1760,1.225,0.04342239285991355,120,1.225,but he is so happy...,623,3,21,96,1616
1791,1.225,0.04177856123984774,120,1.225,"You think you're really clever,don't you?",623,2,23,95,1616
1799,1.225,0.04500622428164392,120,1.225,"No, sir. I haven't seen ""All dogs go to heaven 2""",623,4,19,97,1616
1972,1.225,0.04177856123984774,120,1.225,We're investigating a report of some stolen helium.,623,2,23,95,1616
1980,1.225,0.04500622428164392,120,1.225,"It's fine to fly your dog, but you've still got to pick up the poop.",623,4,19,97,1616
2020,1.225,0.05085060780094462,120,1.225,So will he stay floating in the yard or do you have to tie him to a post?,623,8,11,101,1616
2087,1.225,0.04801741630812264,120,1.225,"Yeah, his name is Roosevelt.",623,6,15,99,1616
2093,1.225,0.04177856123984774,120,1.225,Just make sure he doesn't mark his territory!,623,2,23,95,1616
2108,1.225,0.04500622428164392,120,1.225,"Correct Sir, the code may not fully reflect our commitment to diversity, equity and inclusion but he’ll have to relocate to the dog Park nonetheless",623,4,19,97,1616
2152,1.225,0.04500622428164392,120,1.225,"You fly him, fine. He flies you, an issue.",623,4,19,97,1616
2338,1.225,0.046536182122071404,120,1.225,New York City leashes must not exceed six feet.,623,5,17,98,1616
2456,1.225,0.04500622428164392,120,1.225,Mr. Romney?,623,4,19,97,1616
2598,1.225,0.04500622428164392,120,1.225,What do you feed her? Mine can't even jump onto the couch.,623,4,19,97,1616
2679,1.225,0.04177856123984774,120,1.225,"I don't care how much gas he has, you can't fly him here.",623,2,23,95,1616
2738,1.225,0.03827970917410137,120,1.225,Don't tell me your dog got into your medical marijuana again.,623,0,27,93,1616
2882,1.225,0.04177856123984774,120,1.225,May I also assume that you brought bags with you?,623,2,23,95,1616
2933,1.225,0.04342239285991355,120,1.225,"Sir, I'm sorry, but the dog-flying contest is over at TEDDY  Roosevelt Park.",623,3,21,96,1616
2975,1.225,0.04342239285991355,120,1.225,OK it's an Airedale but it's still the wrong park.,623,3,21,96,1616
3023,1.225,0.04177856123984774,120,1.225,There's been a report of illegal kite fighting.,623,2,23,95,1616
3088,1.225,0.04500622428164392,120,1.225,In your case a poop bag is not enough. Do you have your baseball glove?,623,4,19,97,1616
3121,1.225,0.04500622428164392,120,1.225,Next thing ya know it'll be raining kites and dogs.,623,4,19,97,1616
3238,1.225,0.046536182122071404,120,1.225,Everyone’s wondering how you got the helium in.,623,5,17,98,1616
3278,1.225,0.04500622428164392,120,1.225,Recreational helium is still a federal offense.,623,4,19,97,1616
3317,1.225,0.04500622428164392,120,1.225,He is a trained service dog and loves to fly.,623,4,19,97,1616
3335,1.225,0.046536182122071404,120,1.225,I understand dogs are allowed on-leash.,623,5,17,98,1616
3423,1.225,0.037353823408712766,121,1.225,Do you ever take him to the off-leash park?,623,0,28,93,1616
3555,1.225,0.04500622428164392,120,1.225,I guess must have I grabbed the wrong leash.,623,4,19,97,1616
3600,1.225,0.04500622428164392,120,1.225,There have been complaints about sporadic splash downs.,623,4,19,97,1616
3622,1.225,0.04801741630812264,120,1.225,"Excuse me sir, this is the ‘If pigs could fly’ park",623,6,15,99,1616
3656,1.225,0.046536182122071404,120,1.225,The Dog Fly is on the other end of the park.,623,5,17,98,1616
3722,1.225,0.03640439687791595,120,1.225,Your kite needs to stop humping other kites.,623,0,0,120,1616
3759,1.225,0.04500622428164392,120,1.225,The dog's fine -- someone complained you're the wrong ethnicity for this park.,623,4,19,97,1616
3839,1.225,0.04177856123984774,120,1.225,You could just take him for a drive on the expressway and let him hang his head out the window.,623,2,23,95,1616
3967,1.225,0.04945430508374903,120,1.225,The Roosevelt park for dogs on meth is across the street.,623,7,13,100,1616
3977,1.225,0.04500622428164392,120,1.225,"Sir, you'll need to clean up after your kite.",623,4,19,97,1616
4167,1.225,0.04177856123984774,120,1.225,"Sorry, sir, no boxer kites.",623,2,23,95,1616
4174,1.225,0.046536182122071404,120,1.225,"Yes, that is amazing, but you are still going to have to scoop.",623,5,17,98,1616
4185,1.225,0.046536182122071404,120,1.225,"Uh, sir, the phrase is ""when PIGS fly"".",623,5,17,98,1616
4252,1.225,0.04500622428164392,120,1.225,"Sir, it seems that your kite has not been properly neutered",623,4,19,97,1616
4370,1.225,0.04342239285991355,120,1.225,"No, you can't go off-leash here.",623,3,21,96,1616
4386,1.225,0.03827970917410137,120,1.225,Would you consider donating your dog to the police department's drone protection division?,623,0,27,93,1616
4503,1.225,0.04342239285991355,120,1.225,You are barking up the wrong kite!,623,3,21,96,1616
4663,1.225,0.04945430508374903,120,1.225,Would you like your kite fixed?,623,7,13,100,1616
4722,1.225,0.04342239285991355,120,1.225,"No, this isn't the Macy's Parade.",623,3,21,96,1616
4742,1.225,0.04500622428164392,120,1.225,"It's when pigs fly, sir",623,4,19,97,1616
4748,1.225,0.046536182122071404,120,1.225,"Nice try sir, but there are no dogs allowed in the park.",623,5,17,98,1616
4934,1.225,0.04801741630812264,120,1.225,"Just be sure to pick up after your kite, Mac.",623,6,15,99,1616
4999,1.225,0.04500622428164392,120,1.225,"Sir, I understand your dog identifies as a flying squirrel but he needs to be on the ground when he goes to the bathroom.",623,4,19,97,1616
5020,1.225,0.04500622428164392,120,1.225,"But Officer, it’s an emotional support dog!",623,4,19,97,1616
5040,1.225,0.046536182122071404,120,1.225,Two words: kite droppings,623,5,17,98,1616
5151,1.225,0.04342239285991355,120,1.225,You say he's a companion kite and so where is his yellow vest?,623,3,21,96,1616
5182,1.225,0.046536182122071404,120,1.225,"Sir, is that your empty Canister of helium in the parking lot.",623,5,17,98,1616
5184,1.225,0.04945430508374903,120,1.225,"I told him to 'roll over', and you won't believe what happened next.",623,7,13,100,1616
5225,1.225,0.04342239285991355,120,1.225,Do you know why I pulled you over?,623,3,21,96,1616
5279,1.225,0.04006734526846948,120,1.225,"I'm sorry, but your kite does not meet the minimum tail-length requirements.""",623,1,25,94,1616
5348,1.225,0.04801741630812264,120,1.225,What happens when fluffy over there finally passes gas?,623,6,15,99,1616
5399,1.225,0.04801741630812264,120,1.225,How did you manage to get him up so high with such a short tail?,623,6,15,99,1616
5488,1.225,0.046536182122071404,120,1.225,Sir! the barking is disturbing the other flyers.,623,5,17,98,1616
5518,1.225,0.046536182122071404,120,1.225,"Please bring him down, I'd like to check his tags.",623,5,17,98,1616
5531,1.225,0.04500622428164392,120,1.225,Your kite better be house broken!,623,4,19,97,1616
5578,1.225,0.04342239285991355,120,1.225,"Wow, Rex will do just about anything to fit in, eh?",623,3,21,96,1616
5609,1.225,0.04945430508374903,120,1.225,"Sorry, sir, you need a leash to fly your dog.",623,7,13,100,1616
6050,1.225,0.04177856123984774,120,1.225,"I am sorry sir, but your airedale is not licensed  for this park.",623,2,23,95,1616
6105,1.225,0.04177856123984774,120,1.225,That's not what we meant by pet friendly event,623,2,23,95,1616
6141,1.225,0.04342239285991355,120,1.225,I don’t care if he’s on a leash — we keep getting calls about yellow rain.,623,3,21,96,1616
6157,1.225,0.04801741630812264,120,1.225,"Sir, do you have time to talk about our Lord and savior?",623,6,15,99,1616
6181,1.225,0.046536182122071404,120,1.225,My dog had the same problem when we put him on a raw diet.,623,5,17,98,1616
6194,1.225,0.04500622428164392,120,1.225,"Sir, your 10 minutes is now finished,
please allow the next person
to use the flying fox.",623,4,19,97,1616
6253,1.225,0.046536182122071404,120,1.225,"I want you to know, sir, that I voted for you in 2012.",623,5,17,98,1616
6341,1.225,0.04500622428164392,120,1.225,"But officer!  If it flies like a kite, and has a tail like a kite, it’s a kite.",623,4,19,97,1616
3,1.2222222222222223,0.04395545918145441,117,1.2222222222222223,"I don't care if he is a skye terrier, bring him down!",623,3,20,94,1713
19,1.2222222222222223,0.0456009277118376,117,1.2222222222222223,I don't care if your dog's name is Roosevelt.,623,4,18,95,1713
32,1.2222222222222223,0.04872544551705716,117,1.2222222222222223,Is that an Airedale terrier?,623,6,14,97,1713
42,1.2222222222222223,0.04718905407515574,117,1.2222222222222223,Don't you think this is a strange hobby for a taxidermist?,623,5,16,96,1713
89,1.2222222222222223,0.04224594862853445,117,1.2222222222222223,A lot of people would reject a dog that identified as a kite.,623,2,22,93,1713
94,1.2222222222222223,0.04718905407515574,117,1.2222222222222223,Is that one of those new Labrokites?,623,5,16,96,1713
95,1.2222222222222223,0.0456009277118376,117,1.2222222222222223,"It's okay, sir. I did that to my ex-wife's cat. There is nothing in the books, specifically, about repurposing an animal. Carry on.",623,4,18,95,1713
103,1.2222222222222223,0.04224594862853445,117,1.2222222222222223,No hot doggin.,623,2,22,93,1713
158,1.2222222222222223,0.04718905407515574,117,1.2222222222222223,I'm afraid we no longer allow emotional-support animals.,623,5,16,96,1713
179,1.2222222222222223,0.04395545918145441,117,1.2222222222222223,"Yes, officer, this is his leash.",623,3,20,94,1713
186,1.2222222222222223,0.04395545918145441,117,1.2222222222222223,"Sorry sir, border collies have recently been added to our no-fly policy",623,3,20,94,1713
193,1.2222222222222223,0.04310917864780815,118,1.2222222222222223,"There have been some questions, sir - is she flightbroken?",623,3,21,94,1713
196,1.2222222222222223,0.04718905407515574,117,1.2222222222222223,Curb your enthusiasm.,623,5,16,96,1713
342,1.2222222222222223,0.050214850962274495,117,1.2222222222222223,Your kite just violated the Airborne Particulate Matter Ordinance.,623,7,12,98,1713
445,1.2222222222222223,0.04395545918145441,117,1.2222222222222223,"So, you're telling me you know nothing about the dog poop on my hat?",623,3,20,94,1713
468,1.2222222222222223,0.04718905407515574,117,1.2222222222222223,"Yes, we're all very impressed you have a trained rat that flies.  But this is  a kite-flying contest.",623,5,16,96,1713
500,1.2222222222222223,0.04224594862853445,117,1.2222222222222223,"Again, sir, it's not a 'kite' if you have to force-feed it helium for it to fly.",623,2,22,93,1713
