target_id,mean,precision,count,score,caption,contest,funny,somewhat_funny,unfunny,rank
1746,1.1076923076923078,0.038748926306942086,65,1.1076923076923078,I'm looking for terrier with a short tail.,623,0,7,58,4788
1861,1.1076923076923078,0.027934305858334514,65,1.1076923076923078,"Sir,  we’ve been getting complaints about beagle waste again.",623,0,0,65,4788
1878,1.1076923076923078,0.038748926306942086,65,1.1076923076923078,The kids say this is normal behavior for Molly.,623,0,7,58,4788
1922,1.1076923076923078,0.038748926306942086,65,1.1076923076923078,Has Ben been by lately?,623,0,7,58,4788
2004,1.1076923076923078,0.04452244962611625,65,1.1076923076923078,The Four Freedoms don't include dog flying.,623,1,5,59,4788
2018,1.1076923076923078,0.04452244962611625,65,1.1076923076923078,"Sorry, no airedales allowed.",623,1,5,59,4788
2026,1.1076923076923078,0.04452244962611625,65,1.1076923076923078,I wasn't in the mood for barbeque.,623,1,5,59,4788
2070,1.1076923076923078,0.038748926306942086,65,1.1076923076923078,Interesting. I always thought cats were the ones who preferred weed.,623,0,7,58,4788
2193,1.1076923076923078,0.038748926306942086,65,1.1076923076923078,I assume that's a border collie?,623,0,7,58,4788
2222,1.1076923076923078,0.038748926306942086,65,1.1076923076923078,My dog Paco is a bit flighty,623,0,7,58,4788
2242,1.1076923076923078,0.04452244962611625,65,1.1076923076923078,Be glad it's not his dick.,623,1,5,59,4788
2254,1.1076923076923078,0.04962879961755362,65,1.1076923076923078,"But he's a therapy dog, officer.",623,2,3,60,4788
2279,1.1076923076923078,0.038748926306942086,65,1.1076923076923078,"Sorry sir, flying pets or children is not allowed in this section of the park.",623,0,7,58,4788
2290,1.1076923076923078,0.038748926306942086,65,1.1076923076923078,You probably don't even know after which Roosevelt this park is named!,623,0,7,58,4788
2321,1.1076923076923078,0.04452244962611625,65,1.1076923076923078,"Yes, Officer, I've brought a poop bag.",623,1,5,59,4788
2335,1.1076923076923078,0.038748926306942086,65,1.1076923076923078,"Wagging your dog in the park?  Whaddaya tryin' to hide, bub?",623,0,7,58,4788
2389,1.1076923076923078,0.038748926306942086,65,1.1076923076923078,"I'm sorry, sir, there's an eight foot leash limit.",623,0,7,58,4788
2416,1.1076923076923078,0.038748926306942086,65,1.1076923076923078,"No, this isn't the open casting call for Cirque du Soleil Les Folies Canines.",623,0,7,58,4788
2423,1.1076923076923078,0.038748926306942086,65,1.1076923076923078,"Have you seen a man walking a dog? This is a kite park. No dogs are allowed, so if you see him, let me know, OK?",623,0,7,58,4788
2437,1.1076923076923078,0.038748926306942086,65,1.1076923076923078,"Maybe your dog likes helium, maybe he doesn't. I want to talk to him.",623,0,7,58,4788
2465,1.1076923076923078,0.04962879961755362,65,1.1076923076923078,"I don't know how you are doing that, but the fact remains that the lyric is 'crying all the time', not 'flying all the time'.",623,2,3,60,4788
2585,1.1076923076923078,0.038748926306942086,65,1.1076923076923078,He’s got gas,623,0,7,58,4788
2610,1.1076923076923078,0.038748926306942086,65,1.1076923076923078,Just be careful when your pooch expels all that methane.,623,0,7,58,4788
2617,1.1076923076923078,0.035511894831960364,66,1.1076923076923078,I'm sorry but that doesn't count as a leash.,623,0,8,58,4788
2663,1.1076923076923078,0.04452244962611625,65,1.1076923076923078,Why can't you fly balloon kites like all of the rest of these people?,623,1,5,59,4788
2665,1.1076923076923078,0.04452244962611625,65,1.1076923076923078,Excuse me. You misunderstood.  “It’s when pigs fly.”,623,1,5,59,4788
2707,1.1076923076923078,0.038748926306942086,65,1.1076923076923078,Be sure to pick up your poop.,623,0,7,58,4788
2728,1.1076923076923078,0.04452244962611625,65,1.1076923076923078,The dog park is one block over.,623,1,5,59,4788
2767,1.1076923076923078,0.04452244962611625,65,1.1076923076923078,"Sir, do you know it's a capital offense now to denigrate a government official?",623,1,5,59,4788
2790,1.1076923076923078,0.027934305858334514,65,1.1076923076923078,Does your dog bite?,623,0,0,65,4788
2870,1.1076923076923078,0.04452244962611625,65,1.1076923076923078,"Sir, please stop wildly swinging your dead dog through the air. This is a kite park.",623,1,5,59,4788
2878,1.1076923076923078,0.038748926306942086,65,1.1076923076923078,"Sir, please curb your kite.",623,0,7,58,4788
2899,1.1076923076923078,0.038748926306942086,65,1.1076923076923078,"Yes, Mr. Brown, I HEARD what you said when the tree ate all your other ones!",623,0,7,58,4788
2920,1.1076923076923078,0.04452244962611625,65,1.1076923076923078,It's fine as long as it's a breed that has a tail.,623,1,5,59,4788
2924,1.1076923076923078,0.04452244962611625,65,1.1076923076923078,"Sir, we've had some complaints. Did you bring any umbrellas to share?",623,1,5,59,4788
2934,1.1076923076923078,0.038748926306942086,65,1.1076923076923078,Kitty is spelled K-I-T-T-Y,623,0,7,58,4788
2937,1.1076923076923078,0.04962879961755362,65,1.1076923076923078,Apparently you were right here when it hit the fan.,623,2,3,60,4788
2956,1.1076923076923078,0.038748926306942086,65,1.1076923076923078,I'm afraid you need a leash with that kite.,623,0,7,58,4788
2982,1.1076923076923078,0.02323662687229725,65,1.1076923076923078,Couldn't make it to the dog park?......you'll still have to clean up after him!,623,0,0,65,4788
3038,1.1076923076923078,0.04452244962611625,65,1.1076923076923078,Where's your scooper or baseball glove?,623,1,5,59,4788
3081,1.1076923076923078,0.038748926306942086,65,1.1076923076923078,'No Dogs Allowed' means ALL DOGS - you'll have to leave.,623,0,7,58,4788
3100,1.1076923076923078,0.038748926306942086,65,1.1076923076923078,It would fly better with a longer tail.,623,0,7,58,4788
3115,1.1076923076923078,0.038748926306942086,65,1.1076923076923078,"I'm sorry, sir. Dogs must be on a maximum 6' kite string.",623,0,7,58,4788
3186,1.1076923076923078,0.038748926306942086,65,1.1076923076923078,"Kite Park, Mr Macy, This a kite park.",623,0,7,58,4788
3201,1.1076923076923078,0.04452244962611625,65,1.1076923076923078,I will dog you until your kite enters a kennel.,623,1,5,59,4788
3240,1.1076923076923078,0.038748926306942086,65,1.1076923076923078,My parents said dogs don't go towards heaven.,623,0,7,58,4788
3253,1.1076923076923078,0.04452244962611625,65,1.1076923076923078,Not kool.,623,1,5,59,4788
3296,1.1076923076923078,0.038748926306942086,65,1.1076923076923078,"I'll allow this in my park when pig fly, sir.",623,0,7,58,4788
3347,1.1076923076923078,0.038748926306942086,65,1.1076923076923078,Could you let my dad down?,623,0,7,58,4788
3355,1.1076923076923078,0.038748926306942086,65,1.1076923076923078,His mother was half ballon doggy,623,0,7,58,4788
3382,1.1076923076923078,0.038748926306942086,65,1.1076923076923078,"Officer, he is just taking assimilation to a higher level!",623,0,7,58,4788
3412,1.1076923076923078,0.038748926306942086,65,1.1076923076923078,Roosevelt loved dogs. He took 'Fala' everywhere.,623,0,7,58,4788
3415,1.1076923076923078,0.038748926306942086,65,1.1076923076923078,"Sir, I'm afraid you need a permit to fly your dog.",623,0,7,58,4788
3421,1.1076923076923078,0.038748926306942086,65,1.1076923076923078,Your Airdale just pooped  on a police car!,623,0,7,58,4788
3424,1.1076923076923078,0.038748926306942086,65,1.1076923076923078,He just resigned.  You don't have to walk his dog for him anymore.,623,0,7,58,4788
3448,1.1076923076923078,0.038748926306942086,65,1.1076923076923078,Is that kite friendly ?,623,0,7,58,4788
3478,1.1076923076923078,0.04452244962611625,65,1.1076923076923078,"Sir, you need to have your kite on a leash.",623,1,5,59,4788
3546,1.1076923076923078,0.038748926306942086,65,1.1076923076923078,Nice try but you’ve still got to take him over to the dog park.,623,0,7,58,4788
3550,1.1076923076923078,0.038748926306942086,65,1.1076923076923078,"Sir, your under arrest! No I'm under a golden retriever.",623,0,7,58,4788
3576,1.1076923076923078,0.038748926306942086,65,1.1076923076923078,"But, that's the only thing I had with a tail!",623,0,7,58,4788
3610,1.1076923076923078,0.04962879961755362,65,1.1076923076923078,Not a problem. I brought airbags.,623,2,3,60,4788
3615,1.1076923076923078,0.038748926306942086,65,1.1076923076923078,"I said, ""No Airedales!""",623,0,7,58,4788
3663,1.1076923076923078,0.038748926306942086,65,1.1076923076923078,"Why yes sir, I did bring poop bags.",623,0,7,58,4788
3807,1.1076923076923078,0.038748926306942086,65,1.1076923076923078,You knew the rules,623,0,7,58,4788
3846,1.1076923076923078,0.038748926306942086,65,1.1076923076923078,I think I have a contact high.,623,0,7,58,4788
3847,1.1076923076923078,0.04452244962611625,65,1.1076923076923078,"Holy Cow, that pig can fly!",623,1,5,59,4788
3865,1.1076923076923078,0.038748926306942086,65,1.1076923076923078,"How about the kitchen sink next time?""",623,0,7,58,4788
3919,1.1076923076923078,0.04452244962611625,65,1.1076923076923078,Nice bridle and beam reach.,623,1,5,59,4788
3946,1.1076923076923078,0.038748926306942086,65,1.1076923076923078,"This is a Kite Park, sir.",623,0,7,58,4788
3987,1.1076923076923078,0.04452244962611625,65,1.1076923076923078,"The sign says, 'No Pushcarts, Perambulators or Pooping Kites'.",623,1,5,59,4788
4021,1.1076923076923078,0.038748926306942086,65,1.1076923076923078,"Oh, I thought it said ""KIT"" park",623,0,7,58,4788
4085,1.1076923076923078,0.038748926306942086,65,1.1076923076923078,I hope you will pick up after it?,623,0,7,58,4788
4090,1.1076923076923078,0.038748926306942086,65,1.1076923076923078,There's a -- doggone it!,623,0,7,58,4788
4098,1.1076923076923078,0.04452244962611625,65,1.1076923076923078,His flatulence isn't going to keep him up  forever. So bring him down gently.,623,1,5,59,4788
4123,1.1076923076923078,0.038748926306942086,65,1.1076923076923078,"Sir, please go to the zoo.",623,0,7,58,4788
4189,1.1076923076923078,0.04962879961755362,65,1.1076923076923078,"Excuse me, where can I find one of these exquisite kites?",623,2,3,60,4788
4209,1.1076923076923078,0.04452244962611625,65,1.1076923076923078,"Sir..when flying your dog, the ordinance dictates you must provide umbrellas within an obvious spatial proximity as well as a county approved aerial pooper scooper.",623,1,5,59,4788
4267,1.1076923076923078,0.038748926306942086,65,1.1076923076923078,"Never mind  the letter from your ""doctor"", you got the training certificate for your service kite?",623,0,7,58,4788
4304,1.1076923076923078,0.04452244962611625,65,1.1076923076923078,You may understand me.  I'm looking for a guy flying a goat.,623,1,5,59,4788
4325,1.1076923076923078,0.04452244962611625,65,1.1076923076923078,"...well that sign doesn't say ""dite"" or ""kog"", so you'll have to leave.",623,1,5,59,4788
4354,1.1076923076923078,0.04452244962611625,65,1.1076923076923078,Helium ? Yes sir,623,1,5,59,4788
4389,1.1076923076923078,0.038748926306942086,65,1.1076923076923078,"Well it's not a kite now, is it sir?",623,0,7,58,4788
4435,1.1076923076923078,0.04452244962611625,65,1.1076923076923078,PETA has lodged a complaint against your object.,623,1,5,59,4788
4455,1.1076923076923078,0.038748926306942086,65,1.1076923076923078,Leash or not. No dogs.,623,0,7,58,4788
4472,1.1076923076923078,0.038748926306942086,65,1.1076923076923078,"Excuse me sir.  Are you sure you're in the right pa
rk?",623,0,7,58,4788
4539,1.1076923076923078,0.04452244962611625,65,1.1076923076923078,Bad gas,623,1,5,59,4788
4548,1.1076923076923078,0.04452244962611625,65,1.1076923076923078,"Sir, your dog has to be on a leash.",623,1,5,59,4788
4557,1.1076923076923078,0.04452244962611625,65,1.1076923076923078,"Yeah, he’s on a leash but it’s still not OK!",623,1,5,59,4788
4727,1.1076923076923078,0.038748926306942086,65,1.1076923076923078,"Sir, we’ve  been getting noise complaints....",623,0,7,58,4788
4732,1.1076923076923078,0.04452244962611625,65,1.1076923076923078,"I'm sorry sir, but pet kites are only allowed on Mondays and Wednesdays.",623,1,5,59,4788
4735,1.1076923076923078,0.04452244962611625,65,1.1076923076923078,How long ago did your dog die?,623,1,5,59,4788
4781,1.1076923076923078,0.04452244962611625,65,1.1076923076923078,I called the police  because you're flying makes me mad.,623,1,5,59,4788
4782,1.1076923076923078,0.04452244962611625,65,1.1076923076923078,Did you just come from the vet? Your dog is as high as a kite!,623,1,5,59,4788
4836,1.1076923076923078,0.038748926306942086,65,1.1076923076923078,Is that Fala?,623,0,7,58,4788
4844,1.1076923076923078,0.038748926306942086,65,1.1076923076923078,"Oh boy, the animal rights folks are going to have a problem with this one.",623,0,7,58,4788
4905,1.1076923076923078,0.04452244962611625,65,1.1076923076923078,Stay in the Dog Park and tell the Guiness people to stop bugging me about world records.,623,1,5,59,4788
4940,1.1076923076923078,0.04452244962611625,65,1.1076923076923078,You'll have to leash your kite.,623,1,5,59,4788
4957,1.1076923076923078,0.038748926306942086,65,1.1076923076923078,I told you: No Dogs allowed!,623,0,7,58,4788
5006,1.1076923076923078,0.038748926306942086,65,1.1076923076923078,"Why me, why me?",623,0,7,58,4788
5056,1.1076923076923078,0.038748926306942086,65,1.1076923076923078,I haven't trained him to go off leash.,623,0,7,58,4788
5066,1.1076923076923078,0.038748926306942086,65,1.1076923076923078,"He was always jealous of kites, and rightfully so.",623,0,7,58,4788
5072,1.1076923076923078,0.038748926306942086,65,1.1076923076923078,"Yep, he’s a purebred drone dog!",623,0,7,58,4788
5140,1.1076923076923078,0.038748926306942086,65,1.1076923076923078,Got into the fairy dust again I see.,623,0,7,58,4788
5160,1.1076923076923078,0.04452244962611625,65,1.1076923076923078,"There's nothing wrong with flying 'em here, as long as he's under your control at all times, and you pick up all of his poops.",623,1,5,59,4788
5203,1.1076923076923078,0.038748926306942086,65,1.1076923076923078,"I don't care if he thinks he's a Macy's Day parade float.
this is a kite park, not a dog park.",623,0,7,58,4788
5220,1.1076923076923078,0.038748926306942086,65,1.1076923076923078,"Sir, your party is at the wrong park.  You need to go to the Edison Park down the street.",623,0,7,58,4788
5221,1.1076923076923078,0.038748926306942086,65,1.1076923076923078,"I'm sure he is a good boy, Allen, but he is clearly shedding.",623,0,7,58,4788
5250,1.1076923076923078,0.038748926306942086,65,1.1076923076923078,Sorry sir but you can only fly donkeys here,623,0,7,58,4788
5252,1.1076923076923078,0.04452244962611625,65,1.1076923076923078,My dog has always loved to fly so I keep him on a short leash.,623,1,5,59,4788
5264,1.1076923076923078,0.038748926306942086,65,1.1076923076923078,At what height can they breed?,623,0,7,58,4788
5276,1.1076923076923078,0.038748926306942086,65,1.1076923076923078,"I’m sorry officer, I thought it was only an issue when pigs fly.",623,0,7,58,4788
5403,1.1076923076923078,0.035511894831960364,66,1.1076923076923078,"I’m sorry sir, we don’t accept flying marsupials.",623,0,8,58,4788
5407,1.1076923076923078,0.04962879961755362,65,1.1076923076923078,Sir we have a strict policy against bringing pets to this park.,623,2,3,60,4788
5486,1.1076923076923078,0.038748926306942086,65,1.1076923076923078,"Sir, the dog park is two blocks north of here.",623,0,7,58,4788
5503,1.1076923076923078,0.038748926306942086,65,1.1076923076923078,You still have to scoop up after her.,623,0,7,58,4788
5515,1.1076923076923078,0.038748926306942086,65,1.1076923076923078,Be sure to pick up the poop!,623,0,7,58,4788
5561,1.1076923076923078,0.038748926306942086,65,1.1076923076923078,"Sir, Your dog must be leashed at all times.",623,0,7,58,4788
5563,1.1076923076923078,0.04452244962611625,65,1.1076923076923078,"No, this isn't the Roosevelt Kite Bait Park. That's in New Jersey.",623,1,5,59,4788
5588,1.1076923076923078,0.04452244962611625,65,1.1076923076923078,"I've been asked to remind you sir, you still need to curb your dog.",623,1,5,59,4788
5591,1.1076923076923078,0.04452244962611625,65,1.1076923076923078,You've got to be more careful about the amount of beans you feed your puppy.,623,1,5,59,4788
5602,1.1076923076923078,0.04452244962611625,65,1.1076923076923078,She better be house trained !,623,1,5,59,4788
5605,1.1076923076923078,0.04452244962611625,65,1.1076923076923078,"The cop said softly, “No dogs allowed.” The man replied, “What? Are you going to hit me with your big stick?”",623,1,5,59,4788
5718,1.1076923076923078,0.04452244962611625,65,1.1076923076923078,Just as long as you keep him on a leash.,623,1,5,59,4788
5753,1.1076923076923078,0.038748926306942086,65,1.1076923076923078,"Sir, you can only fly your kite with the dorsal side showing.",623,0,7,58,4788
5771,1.1076923076923078,0.038748926306942086,65,1.1076923076923078,"Sir, you do realize that you are aiding and abetting a highly sophisticated dog pound escape attempt, don't you?",623,0,7,58,4788
5772,1.1076923076923078,0.04452244962611625,65,1.1076923076923078,"Sorry, no hounds. Toys only.",623,1,5,59,4788
5870,1.1076923076923078,0.038748926306942086,65,1.1076923076923078,"They told me I could use the park, no strings attached?",623,0,7,58,4788
5882,1.1076923076923078,0.038748926306942086,65,1.1076923076923078,"I told City Hall Starbucks shouldn't sponsor the dog park water fountain, but do they listen? Noooo.""",623,0,7,58,4788
5894,1.1076923076923078,0.038748926306942086,65,1.1076923076923078,We have leash laws here that prohibit you flying your pooch.,623,0,7,58,4788
5906,1.1076923076923078,0.038748926306942086,65,1.1076923076923078,You still have to scoop the poop.,623,0,7,58,4788
5940,1.1076923076923078,0.038748926306942086,65,1.1076923076923078,"Ok Dr. Pavlov, you're training has gone far enough.",623,0,7,58,4788
6009,1.1076923076923078,0.027934305858334514,65,1.1076923076923078,"Excuses me Sir, when flying a dog you must display evidence of a dog excrement kit system at all times.",623,0,0,65,4788
6010,1.1076923076923078,0.038748926306942086,65,1.1076923076923078,I understand the humor in hearing that high-pitched bark.  But pumping helium into your dog IS animal abuse!,623,0,7,58,4788
6028,1.1076923076923078,0.04962879961755362,65,1.1076923076923078,"This is your last warning, sir! The baloon guy is pressing charges next time",623,2,3,60,4788
6060,1.1076923076923078,0.038748926306942086,65,1.1076923076923078,"I don't care if he's high as a kite, but no dogs allowed.",623,0,7,58,4788
6074,1.1076923076923078,0.04962879961755362,65,1.1076923076923078,We've been getting complaints that his bark is worse than his kite.,623,2,3,60,4788
6077,1.1076923076923078,0.038748926306942086,65,1.1076923076923078,"All dogs go to heaven, wanted to make sure he can see those pearly gates.",623,0,7,58,4788
6081,1.1076923076923078,0.04452244962611625,65,1.1076923076923078,Is that your Airedale?,623,1,5,59,4788
6122,1.1076923076923078,0.038748926306942086,65,1.1076923076923078,The dog-flying area is on the other side of the hill.,623,0,7,58,4788
6151,1.1076923076923078,0.04452244962611625,65,1.1076923076923078,Do you call this a therapy dog?,623,1,5,59,4788
6353,1.1076923076923078,0.038748926306942086,65,1.1076923076923078,"Excuse me Sir, we don't provide poop bags in this park. Did you bring your own or some umbrellas?",623,0,7,58,4788
2230,1.1071428571428572,0.04887415212385377,56,1.1071428571428572,"Sir, have you seen the ""clean up after your kite"" signs.",623,1,4,51,4972
2919,1.1071428571428572,0.04887415212385377,56,1.1071428571428572,We had a complaint about some uhh...  droppings,623,1,4,51,4972
3025,1.1071428571428572,0.05511835805950907,56,1.1071428571428572,You'd better catch him when all the gas leaks out.,623,2,2,52,4972
3273,1.1071428571428572,0.05511835805950907,56,1.1071428571428572,I couldn't find an off-leash park.,623,2,2,52,4972
4853,1.1071428571428572,0.04887415212385377,56,1.1071428571428572,He'd rather fly than go for a walk.,623,1,4,51,4972
5326,1.1071428571428572,0.04887415212385377,56,1.1071428571428572,"Fine -- then you come straight to the security booth when it's time to feed your kite, sir.",623,1,4,51,4972
6177,1.1071428571428572,0.04887415212385377,56,1.1071428571428572,It’s better than him chasing after cyclists.,623,1,4,51,4972
6268,1.1071428571428572,0.04887415212385377,56,1.1071428571428572,"But officer, the sign said ""No dog walking allowed"" -- he's not walking, he's flying!",623,1,4,51,4972
44,1.106060606060606,0.03819217678704997,66,1.106060606060606,This is a kite park...not a dog park!,623,0,7,59,4980
59,1.106060606060606,0.03500774392378128,67,1.106060606060606,"Sir, you can't fly that in this park.",623,0,8,59,4980
112,1.106060606060606,0.03819217678704997,66,1.106060606060606,"Mr. Booth, I presume?",623,0,7,59,4980
129,1.106060606060606,0.03819217678704997,66,1.106060606060606,What's your problem? He's on a leash,623,0,7,59,4980
372,1.106060606060606,0.03819217678704997,66,1.106060606060606,Your kite discriminates against flying cows.,623,0,7,59,4980
509,1.106060606060606,0.04387303082685017,66,1.106060606060606,I don't care if it helps his balance- dog kites must be neutered.,623,1,5,60,4980
593,1.106060606060606,0.03819217678704997,66,1.106060606060606,"I'm sorry, but the leash law maximum is six feet.",623,0,7,59,4980
607,1.106060606060606,0.03819217678704997,66,1.106060606060606,He's Over it not On it,623,0,7,59,4980
645,1.106060606060606,0.04387303082685017,66,1.106060606060606,"Excuse me sir, do you have a catch it and bag it license?",623,1,5,60,4980
710,1.106060606060606,0.04387303082685017,66,1.106060606060606,This IS a kite.  Don’t you see the tail?,623,1,5,60,4980
715,1.106060606060606,0.03819217678704997,66,1.106060606060606,"We didn’t have the gonads to choose, “Latest in men’s fashion from the folks at #MeToo.” What makes you think we’re interested in your thoughts about flying pigs?",623,0,7,59,4980
871,1.106060606060606,0.04387303082685017,66,1.106060606060606,"Sir, this is my last warning to you that poop bags are required for pets in this park.",623,1,5,60,4980
891,1.106060606060606,0.03819217678704997,66,1.106060606060606,How do you handle the poop?,623,0,7,59,4980
1060,1.106060606060606,0.04387303082685017,66,1.106060606060606,"Excuse me, sir. Forgive me for appearing dogmatic or discriminatory but the Dog Flying Park is next door.",623,1,5,60,4980
1203,1.106060606060606,0.03819217678704997,66,1.106060606060606,We ran out of seaweed.,623,0,7,59,4980
1218,1.106060606060606,0.03819217678704997,66,1.106060606060606,The sign clearly says no dogs!,623,0,7,59,4980
1235,1.106060606060606,0.04387303082685017,66,1.106060606060606,Is your dog named roosevelt?,623,1,5,60,4980
1265,1.106060606060606,0.03819217678704997,66,1.106060606060606,"I don't care what his name is, dogs are not allowed in the park!",623,0,7,59,4980
1333,1.106060606060606,0.03819217678704997,66,1.106060606060606,"But Officer, He's an airedale!",623,0,7,59,4980
1422,1.106060606060606,0.04387303082685017,66,1.106060606060606,We use a leash,623,1,5,60,4980
1495,1.106060606060606,0.03819217678704997,66,1.106060606060606,I'm afraid you'll need a license in order to fly a Fake Kite.,623,0,7,59,4980
1507,1.106060606060606,0.04387303082685017,66,1.106060606060606,Dog is spelled D-O-G,623,1,5,60,4980
1508,1.106060606060606,0.03819217678704997,66,1.106060606060606,I don't care if your dog's name is Roosevelt or not!,623,0,7,59,4980
1538,1.106060606060606,0.04387303082685017,66,1.106060606060606,That's how high a dog with a dream can fly.,623,1,5,60,4980
1556,1.106060606060606,0.04387303082685017,66,1.106060606060606,"Well, Ill be dog gone!!",623,1,5,60,4980
1622,1.106060606060606,0.03819217678704997,66,1.106060606060606,You'll get better stability with a longer tail!,623,0,7,59,4980
1741,1.106060606060606,0.03819217678704997,66,1.106060606060606,No dogs in the park.,623,0,7,59,4980
1748,1.106060606060606,0.02755615481943334,66,1.106060606060606,Be sure you pick up after him,623,0,0,66,4980
1825,1.106060606060606,0.03819217678704997,66,1.106060606060606,"It's OK officer, it's an Airedale!",623,0,7,59,4980
1831,1.106060606060606,0.03819217678704997,66,1.106060606060606,Can you prove he's an airedale?,623,0,7,59,4980
1862,1.106060606060606,0.03819217678704997,66,1.106060606060606,Hey Buddy! The dog park is two blocks  north of here!,623,0,7,59,4980
1890,1.106060606060606,0.04387303082685017,66,1.106060606060606,Did you walk him before sending him up?,623,1,5,60,4980
1925,1.106060606060606,0.04387303082685017,66,1.106060606060606,"Tailwind is a real bitch today, Officer.",623,1,5,60,4980
1932,1.106060606060606,0.03819217678704997,66,1.106060606060606,It just looks like it's moving.,623,0,7,59,4980
1949,1.106060606060606,0.03819217678704997,66,1.106060606060606,"No dogs allowed above the park, sir.",623,0,7,59,4980
1955,1.106060606060606,0.04387303082685017,66,1.106060606060606,The sign clearly stated: NO DOGS ALLOWED.,623,1,5,60,4980
2027,1.106060606060606,0.03819217678704997,66,1.106060606060606,"Officer, It's a Dog Day Afternoon.",623,0,7,59,4980
2077,1.106060606060606,0.03819217678704997,66,1.106060606060606,So you have no idea who overturned all the trash cans in the park?,623,0,7,59,4980
2157,1.106060606060606,0.04387303082685017,66,1.106060606060606,"I'm sorry sir you'll have to leave.   
You just don't fit in.",623,1,5,60,4980
2261,1.106060606060606,0.03819217678704997,66,1.106060606060606,That leash is way over ten feet.,623,0,7,59,4980
2268,1.106060606060606,0.03819217678704997,66,1.106060606060606,"Sir, Your cat was hit by a car.",623,0,7,59,4980
2292,1.106060606060606,0.04387303082685017,66,1.106060606060606,"Yes, but have you seen my pig fly?",623,1,5,60,4980
2305,1.106060606060606,0.04387303082685017,66,1.106060606060606,"No, the Akita Park is over the next hill.",623,1,5,60,4980
2363,1.106060606060606,0.03819217678704997,66,1.106060606060606,"Sir, have you seen any large seagulls.. there have been some complaints",623,0,7,59,4980
