target_id,mean,precision,count,score,caption,contest,funny,somewhat_funny,unfunny,counts,rank
5510,1.2028985507246377,0.038702400924038254,138,1.2028985507246377,Have you tried support hose?,625,3,22,113,138,2432
5538,1.2028985507246377,0.04004575333393034,138,1.2028985507246377,Watch out for his knuckles on the ground ball -just a tip.,625,4,20,114,138,2432
5539,1.2028985507246377,0.03731071313293277,138,1.2028985507246377,"Baseball bat,not baseball club",625,2,24,112,138,2432
5571,1.2028985507246377,0.038702400924038254,138,1.2028985507246377,"Hold on, he's almost done warming up.",625,3,22,113,138,2432
5573,1.2028985507246377,0.04004575333393034,138,1.2028985507246377,You might keep an eye on my follow through.,625,4,20,114,138,2432
5619,1.2028985507246377,0.038702400924038254,138,1.2028985507246377,"I love these no-cut contracts.""",625,3,22,113,138,2432
5631,1.2028985507246377,0.03937980572175916,138,1.2028985507246377,"Today, maul ball. Tomorrow, woolly mammoth.",625,4,21,114,139,2432
3813,1.2014925373134329,0.043394113935632216,134,1.2014925373134329,Are you sure you're playing with the right club?,625,6,15,113,134,2654
312,1.2014388489208634,0.03978339868432062,139,1.2014388489208634,"I'm telling you Bro... you'll get more traction and power if you wear cleats""",625,4,20,115,139,2655
2664,1.2014388489208634,0.03563601502987766,139,1.2014388489208634,What was a good clubbing average in the big-inning?,625,1,26,112,139,2655
412,1.1985294117647058,0.038799878912362536,136,1.1985294117647058,"Hey Ump, I don’t think that’s a corked bat, but can you check it?",625,3,21,112,136,2657
552,1.1985294117647058,0.040179137191926284,136,1.1985294117647058,Stand back. I’m the next Babeous Ruthus.,625,4,19,113,136,2657
614,1.1985294117647058,0.04151259480400222,136,1.1985294117647058,"Oh ya, the place has Brontosaurus ribs that are to die for! It’s on 7th and Main.",625,5,17,114,136,2657
659,1.1985294117647058,0.03736974901896395,136,1.1985294117647058,Are you here for the game or just looking for a meal?,625,2,23,111,136,2657
1763,1.1985294117647058,0.03736974901896395,136,1.1985294117647058,"Dude, you're the team mascot of the Cavemen, not the designated hitter.",625,2,23,111,136,2657
2591,1.1985294117647058,0.038799878912362536,136,1.1985294117647058,And you speak softly.,625,3,21,112,136,2657
3801,1.1985294117647058,0.040179137191926284,136,1.1985294117647058,"I don't know about you, but I think this ""throwback uniform"" thing has gone too far.",625,4,19,113,136,2657
4305,1.1985294117647058,0.040179137191926284,136,1.1985294117647058,Do you only bam bam fastballs?,625,4,19,113,136,2657
778,1.1954887218045114,0.03767364538009038,133,1.1954887218045114,"Wooden bat, I presume.",625,2,22,109,133,2665
818,1.1954887218045114,0.04196506947311111,133,1.1954887218045114,me yogi!  you fred!,625,5,16,112,133,2665
1570,1.1954887218045114,0.03915641355866943,133,1.1954887218045114,Your toenail length is against the Yankees' appearance policy.,625,3,20,110,133,2665
2188,1.1954887218045114,0.04196506947311111,133,1.1954887218045114,I'm a batavism.,625,5,16,112,133,2665
3716,1.1954887218045114,0.04058504514387407,133,1.1954887218045114,I hope you've got big balls.,625,4,18,111,133,2665
4124,1.1954887218045114,0.04196506947311111,133,1.1954887218045114,This time swing at the ball and not my head.,625,5,16,112,133,2665
4498,1.1954887218045114,0.03915641355866943,133,1.1954887218045114,You've taken throw-back uniforms to a new level.,625,3,20,110,133,2665
5301,1.1954887218045114,0.03915641355866943,133,1.1954887218045114,You were given 'time'  How many times!?,625,3,20,110,133,2665
5381,1.1954887218045114,0.043301134193411,133,1.1954887218045114,"My pitcher's a real fireballer.  Oh, do you know what that means?",625,6,14,113,133,2665
205,1.1923076923076923,0.039520310737412176,130,1.1923076923076923,I love your throwback jersey.,625,3,19,108,130,2674
308,1.1923076923076923,0.04381365898794812,130,1.1923076923076923,Still beating your wife?,625,6,13,111,130,2674
578,1.1923076923076923,0.039520310737412176,130,1.1923076923076923,And your mother is a Brontosaurus,625,3,19,108,130,2674
589,1.1923076923076923,0.039520310737412176,130,1.1923076923076923,"Sorry, this is the thinking man's game.",625,3,19,108,130,2674
673,1.1923076923076923,0.042430839368734416,130,1.1923076923076923,"It's Clubs are for Golf, and Bats are for Baseball!",625,5,15,110,130,2674
815,1.1923076923076923,0.041001409063085616,130,1.1923076923076923,He can't throw a woolly mammoth and you know it.,625,4,17,109,130,2674
832,1.1923076923076923,0.041001409063085616,130,1.1923076923076923,Is that a regulation bat?,625,4,17,109,130,2674
1109,1.1923076923076923,0.036377655119975635,130,1.1923076923076923,Of course my bat's bigger than yours they call this the Big Leagues for a reason!,625,1,23,106,130,2674
1152,1.1923076923076923,0.036377655119975635,130,1.1923076923076923,"After the game, do you want to go clubbing?",625,1,23,106,130,2674
1357,1.1923076923076923,0.041001409063085616,130,1.1923076923076923,I just came from the clubhouse. What's the score?,625,4,17,109,130,2674
1740,1.1923076923076923,0.037981500449623534,130,1.1923076923076923,"Yes, people call them the ‘Tools of Ignorance.’ And, yes, I’m sure you DID use it first.",625,2,21,107,130,2674
1802,1.1923076923076923,0.039520310737412176,130,1.1923076923076923,This expansion team business has gone far enough!,625,3,19,108,130,2674
2083,1.1923076923076923,0.037981500449623534,130,1.1923076923076923,"Hey Grok, have you ever met Fred Flintstone?",625,2,21,107,130,2674
2230,1.1923076923076923,0.039520310737412176,130,1.1923076923076923,I get four strikes.,625,3,19,108,130,2674
2423,1.1923076923076923,0.037981500449623534,130,1.1923076923076923,Three strikes and I'm out--cold.,625,2,21,107,130,2674
2430,1.1923076923076923,0.042430839368734416,130,1.1923076923076923,"So I hit the ball, but don’t run after it?",625,5,15,110,130,2674
2921,1.1923076923076923,0.036377655119975635,130,1.1923076923076923,You guys sure take Old -Timers' Day seriously.,625,1,23,106,130,2674
3389,1.1923076923076923,0.037981500449623534,130,1.1923076923076923,Sure baseball has a long season ... but eons!,625,2,21,107,130,2674
3571,1.1923076923076923,0.041001409063085616,130,1.1923076923076923,I hear you needed a slugger.,625,4,17,109,130,2674
3575,1.1923076923076923,0.037981500449623534,130,1.1923076923076923,I'll be honest. I am a one-tool player.,625,2,21,107,130,2674
4228,1.1923076923076923,0.039520310737412176,130,1.1923076923076923,Paleo diet,625,3,19,108,130,2674
4802,1.1923076923076923,0.037981500449623534,130,1.1923076923076923,"Hey, Alley Oop, the rules say you gotta wear a helmet.",625,2,21,107,130,2674
5051,1.1923076923076923,0.039520310737412176,130,1.1923076923076923,I do not understand finger puppets. Can we communicate in Hieroglyphics instead?,625,3,19,108,130,2674
5612,1.1923076923076923,0.037981500449623534,130,1.1923076923076923,Allow me to explain the intent behind Throwback Night.,625,2,21,107,130,2674
4391,1.1916666666666669,0.04149825910650005,120,1.1916666666666669,"If Bloog no hit homerun, Bloog lose scholarship.",625,3,17,100,120,2698
1688,1.1908396946564883,0.04071369150638141,131,1.1908396946564883,They told me to put some good wood on it,625,4,17,110,131,2699
3496,1.1908396946564883,0.03924493424609722,131,1.1908396946564883,Bill Veeck is at it again.,625,3,19,109,131,2699
325,1.1889763779527558,0.03829297767285124,127,1.1889763779527558,"With all de respect, you were called up from the minors 1,600 years ago.",625,2,20,105,127,2701
438,1.1889763779527558,0.041428503387875903,127,1.1889763779527558,"After the GEICO contract ran out, Frank decided to see what else was so easy.",625,4,16,107,127,2701
641,1.1889763779527558,0.03829297767285124,127,1.1889763779527558,Wow! Talk about a 'throwback' uniform.,625,2,20,105,127,2701
739,1.1889763779527558,0.03829297767285124,127,1.1889763779527558,I say the retro look has gone to far back but it is comfortable.,625,2,20,105,127,2701
746,1.1889763779527558,0.03829297767285124,127,1.1889763779527558,No curve balls—understand?,625,2,20,105,127,2701
1143,1.1889763779527558,0.0398915594581907,127,1.1889763779527558,Was that a cave ball?,625,3,18,106,127,2701
1789,1.1889763779527558,0.03829297767285124,127,1.1889763779527558,Did they at least give you a cup to wear under that?,625,2,20,105,127,2701
1929,1.1889763779527558,0.04291043311261407,127,1.1889763779527558,Did they emphasize it's the ball your supposed to hit and not me?,625,5,14,108,127,2701
1937,1.1889763779527558,0.04291043311261407,127,1.1889763779527558,"You're hugging the plate, sir.",625,5,14,108,127,2701
1954,1.1889763779527558,0.03829297767285124,127,1.1889763779527558,"When you say you're up here to hit, you're talking about the ball, right.",625,2,20,105,127,2701
2489,1.1889763779527558,0.03829297767285124,127,1.1889763779527558,"There was a time when beards weren't allowed, you know.",625,2,20,105,127,2701
2548,1.1889763779527558,0.0398915594581907,127,1.1889763779527558,"Quit grunting, and get in the batter's box.",625,3,18,106,127,2701
2553,1.1889763779527558,0.041428503387875903,127,1.1889763779527558,Intentional Walk,625,4,16,107,127,2701
2609,1.1889763779527558,0.0398915594581907,127,1.1889763779527558,You think season is over?,625,3,18,106,127,2701
2809,1.1889763779527558,0.0398915594581907,127,1.1889763779527558,"I'll be honest, I'm not crazy about these throwback uniforms.",625,3,18,106,127,2701
2899,1.1889763779527558,0.041428503387875903,127,1.1889763779527558,"Wait till you see the Green Monster here in Jurassic Park.""",625,4,16,107,127,2701
3169,1.1889763779527558,0.0398915594581907,127,1.1889763779527558,He could not adapt to the modern strike zone,625,3,18,106,127,2701
3829,1.1889763779527558,0.04434286466687743,127,1.1889763779527558,Cleats? What are those?,625,6,12,109,127,2701
3837,1.1889763779527558,0.041428503387875903,127,1.1889763779527558,Just up from the Neanderthal League?,625,4,16,107,127,2701
3852,1.1889763779527558,0.0398915594581907,127,1.1889763779527558,"Did you say DH,or was that Duh?",625,3,18,106,127,2701
4054,1.1889763779527558,0.036624687877176536,127,1.1889763779527558,Dry cleaners lose the uniforms again?,625,1,22,104,127,2701
4112,1.1889763779527558,0.04291043311261407,127,1.1889763779527558,"...And up to the plate is Moog McGregor, 
who was grandfathered in before bat size regulation rules",625,5,14,108,127,2701
4195,1.1889763779527558,0.0398915594581907,127,1.1889763779527558,"No, you may not hit everyone at Home when you hit a Run.",625,3,18,106,127,2701
4258,1.1889763779527558,0.041428503387875903,127,1.1889763779527558,That Paleo Diet is really working.,625,4,16,107,127,2701
4907,1.1889763779527558,0.0398915594581907,127,1.1889763779527558,Attitude is not always everything.,625,3,18,106,127,2701
5158,1.1889763779527558,0.0398915594581907,127,1.1889763779527558,"They wanted an exceptional E.R.A., not era.",625,3,18,106,127,2701
5210,1.1889763779527558,0.03829297767285124,127,1.1889763779527558,"Word to the wise:  If you argue his calls, you best speak softly.",625,2,20,105,127,2701
5312,1.1889763779527558,0.04291043311261407,127,1.1889763779527558,I'm guessing you've never seen the forkball.,625,5,14,108,127,2701
5417,1.1889763779527558,0.041428503387875903,127,1.1889763779527558,"Sorry, we don't have club sports any more.",625,4,16,107,127,2701
5550,1.1889763779527558,0.036624687877176536,127,1.1889763779527558,"Look, the game has changed a lot!!",625,1,22,104,127,2701
3398,1.1885245901639343,0.04250005732220327,122,1.1885245901639343,"Wait till you see our cleanup hitter, he's a mammoth.""",625,4,15,103,122,2731
95,1.1875,0.03960620626622991,128,1.1875,Ya Muthas a Tyrannosaurus,625,3,18,107,128,2732
631,1.1875,0.03802131084983997,128,1.1875,Ringer?,625,2,20,106,128,2732
947,1.1864406779661016,0.04331135159774357,118,1.1864406779661016,Paleo I can understand. It's those Crossfit types that take it too far.,625,4,14,100,118,2734
5106,1.1864406779661016,0.03982642431771825,118,1.1864406779661016,It's not that kind of clubhouse.,625,2,18,98,118,2734
3075,1.186046511627907,0.039324852495548485,129,1.186046511627907,"In the major league, underwear is not optional.",625,3,18,108,129,2736
109,1.1840000000000002,0.0399741852183502,125,1.1840000000000002,Don't you think you went a little overboard with founders day?,625,3,17,105,125,2737
321,1.1840000000000002,0.0399741852183502,125,1.1840000000000002,"Nice bat, man.",625,3,17,105,125,2737
354,1.1840000000000002,0.04155680139201625,125,1.1840000000000002,I never was too happy about the designated hitter rule.,625,4,15,106,125,2737
355,1.1840000000000002,0.03832627330965602,125,1.1840000000000002,What no batting gloves??,625,2,19,104,125,2737
421,1.1840000000000002,0.03660424794667875,125,1.1840000000000002,You know you're just supposed to hit the ball -- right?,625,1,21,103,125,2737
546,1.1840000000000002,0.0399741852183502,125,1.1840000000000002,"Alright, alright. So you never used steroids, 
but you're over the top with the Flintstones Vitamins.",625,3,17,105,125,2737
592,1.1840000000000002,0.0399741852183502,125,1.1840000000000002,Babe's Roots???,625,3,17,105,125,2737
601,1.1840000000000002,0.04155680139201625,125,1.1840000000000002,Now that's a tool of ignorance,625,4,15,106,125,2737
628,1.1840000000000002,0.032890826253119634,125,1.1840000000000002,You gotta play by the rules!,625,0,0,125,125,2737
695,1.1840000000000002,0.0399741852183502,125,1.1840000000000002,They weren't kidding when they said that your manager was 'old-school'.,625,3,17,105,125,2737
706,1.1840000000000002,0.0399741852183502,125,1.1840000000000002,You must be the designated Neanderthal.,625,3,17,105,125,2737
728,1.1840000000000002,0.03832627330965602,125,1.1840000000000002,Didn’t realize this is a club team.,625,2,19,104,125,2737
994,1.1840000000000002,0.0399741852183502,125,1.1840000000000002,"You can be confident that the neanderthal on first won't tag you out, he extincts",625,3,17,105,125,2737
1071,1.1840000000000002,0.0399741852183502,125,1.1840000000000002,That was an inside stoneball,625,3,17,105,125,2737
1085,1.1840000000000002,0.04308131845707603,125,1.1840000000000002,"Hey, Joe! So how’s the Paleo Diet working for you?",625,5,13,107,125,2737
1125,1.1840000000000002,0.04155680139201625,125,1.1840000000000002,Nice bat,625,4,15,106,125,2737
1204,1.1840000000000002,0.03660424794667875,125,1.1840000000000002,"Welcome to the show kid, you finally made it",625,1,21,103,125,2737
1326,1.1840000000000002,0.0399741852183502,125,1.1840000000000002,"No, I said, ""You look like a pro minion.""",625,3,17,105,125,2737
1327,1.1840000000000002,0.0399741852183502,125,1.1840000000000002,It's called a ball; and it was invented sometime after the wheel.,625,3,17,105,125,2737
1439,1.1840000000000002,0.04155680139201625,125,1.1840000000000002,Good luck getting around on the fastball.,625,4,15,106,125,2737
1461,1.1840000000000002,0.03832627330965602,125,1.1840000000000002,Try not to slide...it's going to hurt.,625,2,19,104,125,2737
1502,1.1840000000000002,0.03832627330965602,125,1.1840000000000002,Tell the pitcher to let me get a hit or I hit you instead!,625,2,19,104,125,2737
1506,1.1840000000000002,0.04308131845707603,125,1.1840000000000002,'Cubs' not 'clubs',625,5,13,107,125,2737
1507,1.1840000000000002,0.0399741852183502,125,1.1840000000000002,"League crack down on steroids, so coach make whole team go paleo.",625,3,17,105,125,2737
1530,1.1840000000000002,0.03660424794667875,125,1.1840000000000002,the umpire checking the rule for tar on your bat.,625,1,21,103,125,2737
1532,1.1840000000000002,0.0399741852183502,125,1.1840000000000002,You have worthwhile opportunity to defy baseball analytics.,625,3,17,105,125,2737
1549,1.1840000000000002,0.0399741852183502,125,1.1840000000000002,"... You're a mascot, you can hit, and you're marginally less offensive than your predecessor.",625,3,17,105,125,2737
1566,1.1840000000000002,0.04155680139201625,125,1.1840000000000002,I used to play for the  Mets!,625,4,15,106,125,2737
1670,1.1840000000000002,0.0399741852183502,125,1.1840000000000002,Do you have any idea how ridiculous you look?,625,3,17,105,125,2737
1674,1.1840000000000002,0.03660424794667875,125,1.1840000000000002,I agree.  Throwback uniform night has gotten out of hand.,625,1,21,103,125,2737
1730,1.1840000000000002,0.03660424794667875,125,1.1840000000000002,"So what, if a fan called you a Neanderthal",625,1,21,103,125,2737
1739,1.1840000000000002,0.04155680139201625,125,1.1840000000000002,"With the new beard trend, I thought I would go completely old school.",625,4,15,106,125,2737
1775,1.1840000000000002,0.03832627330965602,125,1.1840000000000002,It must not be easy to drag your wife to the playoffs.,625,2,19,104,125,2737
1805,1.1840000000000002,0.03832627330965602,125,1.1840000000000002,No helmet or cup?  What a Neanderthal.,625,2,19,104,125,2737
1816,1.1840000000000002,0.0399741852183502,125,1.1840000000000002,No women - just a ball.,625,3,17,105,125,2737
1918,1.1840000000000002,0.03832627330965602,125,1.1840000000000002,I hope you're wearing a cup.  He likes to pitch inside.,625,2,19,104,125,2737
1953,1.1840000000000002,0.04308131845707603,125,1.1840000000000002,"Look, if you can’t grasp the infield fly rule, you really shouldn’t be playing catcher. Only a neanderthal wouldn’t understand.",625,5,13,107,125,2737
2101,1.1840000000000002,0.04455370083466149,125,1.1840000000000002,I tried going paleo too but just couldn't give up dairy,625,6,11,108,125,2737
2120,1.1840000000000002,0.04155680139201625,125,1.1840000000000002,"Fine, you've got me. I can't explain the semantic distinction between a bat and a club. But there's no way that thing's regulation.",625,4,15,106,125,2737
2234,1.1840000000000002,0.0399741852183502,125,1.1840000000000002,Are you sure that's a regulation bat?,625,3,17,105,125,2737
2315,1.1840000000000002,0.04155680139201625,125,1.1840000000000002,Have you been talking the roids' or have I?,625,4,15,106,125,2737
2351,1.1840000000000002,0.03660424794667875,125,1.1840000000000002,It's a new concept called sports.,625,1,21,103,125,2737
2490,1.1840000000000002,0.0399741852183502,125,1.1840000000000002,Where have you been all these years?,625,3,17,105,125,2737
2525,1.1840000000000002,0.03660424794667875,125,1.1840000000000002,I'm the DH... Designated Hunter,625,1,21,103,125,2737
2538,1.1840000000000002,0.03832627330965602,125,1.1840000000000002,Your batting stance has really evolved.,625,2,19,104,125,2737
2562,1.1840000000000002,0.04155680139201625,125,1.1840000000000002,well now i've seen EVERYTHING!,625,4,15,106,125,2737
2631,1.1840000000000002,0.03832627330965602,125,1.1840000000000002,These retro uniforms are getting ridiculous.,625,2,19,104,125,2737
2638,1.1840000000000002,0.03479710777747798,125,1.1840000000000002,The wife says algae is the new paleo.,625,0,23,102,125,2737
2765,1.1840000000000002,0.04308131845707603,125,1.1840000000000002,"Yes, you've got quite a Ball Club!",625,5,13,107,125,2737
2814,1.1840000000000002,0.04455370083466149,125,1.1840000000000002,I can hit you right out of the park!,625,6,11,108,125,2737
2835,1.1840000000000002,0.0399741852183502,125,1.1840000000000002,I got called up from the Neanderthal League.,625,3,17,105,125,2737
2837,1.1840000000000002,0.04155680139201625,125,1.1840000000000002,"Good, now the ball. It's the opposite of the umpire, so try to miss all three.",625,4,15,106,125,2737
2845,1.1840000000000002,0.03832627330965602,125,1.1840000000000002,At least you get a cup,625,2,19,104,125,2737
2893,1.1840000000000002,0.03660424794667875,125,1.1840000000000002,"Yeah, but what's your strikeout to walk ratio?",625,1,21,103,125,2737
2954,1.1840000000000002,0.0399741852183502,125,1.1840000000000002,Pangaea? I hardly knew 'er.,625,3,17,105,125,2737
2961,1.1840000000000002,0.03832627330965602,125,1.1840000000000002,"As far as I know, you're the first from the Pleistocene Epoch.",625,2,19,104,125,2737
3028,1.1840000000000002,0.03832627330965602,125,1.1840000000000002,"Remember you get 3 strikes at the ball, AT THE BALL.",625,2,19,104,125,2737
3035,1.1840000000000002,0.03832627330965602,125,1.1840000000000002,"Suddenly, Fred remembered he needed to renew his car insurance.",625,2,19,104,125,2737
3114,1.1840000000000002,0.03832627330965602,125,1.1840000000000002,"Has this game really been around, that long?",625,2,19,104,125,2737
3178,1.1840000000000002,0.03832627330965602,125,1.1840000000000002,"I'm the inspiration for the movie,""The Natural.""",625,2,19,104,125,2737
3197,1.1840000000000002,0.0399741852183502,125,1.1840000000000002,You wouldn’t still be playing if this were the National League.,625,3,17,105,125,2737
3243,1.1840000000000002,0.04155680139201625,125,1.1840000000000002,Nice Wheels.,625,4,15,106,125,2737
3262,1.1840000000000002,0.0399741852183502,125,1.1840000000000002,You'll wanna strike before the Iron Age gets hot,625,3,17,105,125,2737
3278,1.1840000000000002,0.03832627330965602,125,1.1840000000000002,How's that paleo diet working out for you?,625,2,19,104,125,2737
3298,1.1840000000000002,0.03479710777747798,125,1.1840000000000002,"Next up, pinch-hitting for Fred Flintstone, is Babe Rock.",625,0,23,102,125,2737
3353,1.1840000000000002,0.0399741852183502,125,1.1840000000000002,I guess we're still in the early innings.,625,3,17,105,125,2737
3368,1.1840000000000002,0.04597895731885437,125,1.1840000000000002,Bludgeonder Up!,625,7,9,109,125,2737
3434,1.1840000000000002,0.03832627330965602,125,1.1840000000000002,"That's right, this sign means just stand there...",625,2,19,104,125,2737
3470,1.1840000000000002,0.04155680139201625,125,1.1840000000000002,The last player from the Steroid Age,625,4,15,106,125,2737
3585,1.1840000000000002,0.04155680139201625,125,1.1840000000000002,So you started before the designated hitter rule?,625,4,15,106,125,2737
3605,1.1840000000000002,0.0399741852183502,125,1.1840000000000002,Is that pine tar?,625,3,17,105,125,2737
3606,1.1840000000000002,0.04155680139201625,125,1.1840000000000002,Just pretend it's a tiny mastodon.,625,4,15,106,125,2737
3662,1.1840000000000002,0.0399741852183502,125,1.1840000000000002,Ump! That's a funny name,625,3,17,105,125,2737
3695,1.1840000000000002,0.03832627330965602,125,1.1840000000000002,You don't know what a ball is?  You don't know what a strike is?  Just stand there like that and let him pitch to you three times.,625,2,19,104,125,2737
3745,1.1840000000000002,0.04155680139201625,125,1.1840000000000002,I'm the cleanup hitter.,625,4,15,106,125,2737
3774,1.1840000000000002,0.0399741852183502,125,1.1840000000000002,Not a foul ball. Just foul.,625,3,17,105,125,2737
3935,1.1840000000000002,0.03832627330965602,125,1.1840000000000002,"So, how do you like your throwback uniforms?",625,2,19,104,125,2737
3956,1.1840000000000002,0.0399741852183502,125,1.1840000000000002,Call-up from the Paleolithic?,625,3,17,105,125,2737
4205,1.1840000000000002,0.04155680139201625,125,1.1840000000000002,You might want to choke up a bit.,625,4,15,106,125,2737
4277,1.1840000000000002,0.03832627330965602,125,1.1840000000000002,They sure are taking the retro look back a few years.,625,2,19,104,125,2737
4410,1.1840000000000002,0.0399741852183502,125,1.1840000000000002,You're only supposed to hit the ball.,625,3,17,105,125,2737
4418,1.1840000000000002,0.037475153058716036,125,1.1840000000000002,Where'd the umpire go? That bat doesn't look up to regulation.,625,2,20,103,125,2737
4440,1.1840000000000002,0.0399741852183502,125,1.1840000000000002,Stop overthinking it.,625,3,17,105,125,2737
4445,1.1840000000000002,0.03660424794667875,125,1.1840000000000002,How long is Aaron Judge out?,625,1,21,103,125,2737
4480,1.1840000000000002,0.0399741852183502,125,1.1840000000000002,"Trust me, it's okay. Just hit and run.",625,3,17,105,125,2737
4508,1.1840000000000002,0.03660424794667875,125,1.1840000000000002,"So, you're an original slugger, huh?",625,1,21,103,125,2737
4527,1.1840000000000002,0.04155680139201625,125,1.1840000000000002,It was either this getup or taking a knee.,625,4,15,106,125,2737
4531,1.1840000000000002,0.04155680139201625,125,1.1840000000000002,Three strikes. It's a law.,625,4,15,106,125,2737
4572,1.1840000000000002,0.03660424794667875,125,1.1840000000000002,I'm a pinch hunter,625,1,21,103,125,2737
4573,1.1840000000000002,0.0399741852183502,125,1.1840000000000002,"Grunt at me like that again, and I'll signal for a pitch very high and very inside.",625,3,17,105,125,2737
4647,1.1840000000000002,0.0399741852183502,125,1.1840000000000002,"Oh, Hey Corg - try not to swing so low this time""",625,3,17,105,125,2737
4745,1.1840000000000002,0.04155680139201625,125,1.1840000000000002,"No, you stand here and try to hit that little white thing.",625,4,15,106,125,2737
4832,1.1840000000000002,0.04155680139201625,125,1.1840000000000002,Where's the meat of the plate?,625,4,15,106,125,2737
4882,1.1840000000000002,0.0399741852183502,125,1.1840000000000002,Party after the game at my man cave.,625,3,17,105,125,2737
4890,1.1840000000000002,0.04155680139201625,125,1.1840000000000002,"Aww...mighty Grog has struck out. Uh, jjjust kiddin'!'",625,4,15,106,125,2737
5000,1.1840000000000002,0.0399741852183502,125,1.1840000000000002,"C'mon, Blackmon, you're not fooling anyone.",625,3,17,105,125,2737
5002,1.1840000000000002,0.03832627330965602,125,1.1840000000000002,If only you’d work on your social media presence.,625,2,19,104,125,2737
5100,1.1840000000000002,0.03832627330965602,125,1.1840000000000002,"Wow! You certainly give new meaning to the term ""ball club.""",625,2,19,104,125,2737
5108,1.1840000000000002,0.03660424794667875,125,1.1840000000000002,Looks like that paleo diet is really working for you!,625,1,21,103,125,2737
5222,1.1840000000000002,0.03479710777747798,125,1.1840000000000002,"Yes, there were four balls Thal.  You can walk softly to first base.",625,0,23,102,125,2737
