target_id,mean,precision,count,score,caption,contest,funny,somewhat_funny,unfunny,counts,rank
4021,1.2526315789473683,0.04014512943964189,190,1.2526315789473683,"I don't believe they were referring  to baseball when they said , it's so easy a caveman could do it""",625,11,26,153,190,1261
4067,1.2526315789473683,0.03574160967981459,190,1.2526315789473683,Me no understand why one need mask to poop?,625,5,38,147,190,1261
4161,1.2526315789473683,0.03800719721467119,190,1.2526315789473683,"Why yes, Roger Clemens is my father. How did you know?",625,8,32,150,190,1261
4201,1.2526315789473683,0.037267308026982734,190,1.2526315789473683,I'm up from the minors.,625,7,34,149,190,1261
4203,1.2526315789473683,0.03800719721467119,190,1.2526315789473683,"If you're going to go paleo, you have to fully embrace it, you know",625,8,32,150,190,1261
4303,1.2526315789473683,0.037267308026982734,190,1.2526315789473683,Activated from the bush league?,625,7,34,149,190,1261
4325,1.2526315789473683,0.03800719721467119,190,1.2526315789473683,"Clubs are for golf, man.",625,8,32,150,190,1261
4420,1.2526315789473683,0.03873295538235892,190,1.2526315789473683,This is first base. You want the club house.,625,9,30,151,190,1261
4438,1.2526315789473683,0.03873295538235892,190,1.2526315789473683,Back from retirement?,625,9,30,151,190,1261
4752,1.2526315789473683,0.03944536253083124,190,1.2526315789473683,"Geez, Rick. Don’t you think you’re taking the paleo diet thing a bit far?",625,10,28,152,190,1261
4808,1.2526315789473683,0.03944536253083124,190,1.2526315789473683,No knuckle balls!,625,10,28,152,190,1261
4855,1.2526315789473683,0.03873295538235892,190,1.2526315789473683,This is why we shouldn't have the Designated Hitter rule.,625,9,30,151,190,1261
4860,1.2526315789473683,0.03800719721467119,190,1.2526315789473683,Never do an endorsement deal for a paleo diet.,625,8,32,150,190,1261
4945,1.2526315789473683,0.037267308026982734,190,1.2526315789473683,Was your rookie card a cave drawing?,625,7,34,149,190,1261
5004,1.2526315789473683,0.03944536253083124,190,1.2526315789473683,That was a mammoth home run you hit last time.,625,10,28,152,190,1261
5014,1.2526315789473683,0.03651242877488587,190,1.2526315789473683,It's nice to see the league is becoming more inclusive.,625,6,36,148,190,1261
5070,1.2526315789473683,0.04014512943964189,190,1.2526315789473683,Remember I invented fire.,625,11,26,153,190,1261
5262,1.2526315789473683,0.03800719721467119,190,1.2526315789473683,"How's that Paleo diet working out, Greg?",625,8,32,150,190,1261
5445,1.2526315789473683,0.037267308026982734,190,1.2526315789473683,Bruce takes old timers day way too seriously,625,7,34,149,190,1261
5500,1.2526315789473683,0.033322339126980904,190,1.2526315789473683,You're gonna need a bigger mitt.,625,2,44,144,190,1261
5505,1.2526315789473683,0.03800719721467119,190,1.2526315789473683,I’ve been taking a lot of Flintstones vitamins.,625,8,32,150,190,1261
5548,1.2526315789473683,0.04014512943964189,190,1.2526315789473683,"If you hit it, don't chase it and eat it",625,11,26,153,190,1261
5595,1.2526315789473683,0.03651242877488587,190,1.2526315789473683,You're going to set this game back a thousand years.,625,6,36,148,190,1261
2907,1.2513661202185793,0.03733976493894721,183,1.2513661202185793,Your swing has really evolved.,625,6,34,143,183,1339
3724,1.2513661202185793,0.03891473405344112,183,1.2513661202185793,"Yes, I get paid to squat down like this and catch small white balls. What do you do for a living?",625,8,30,145,183,1339
124,1.25,0.03587645835316415,188,1.25,Can you count to three? That's all you need to do is count to three.,625,5,37,146,188,1341
191,1.25,0.03964299094595663,188,1.25,"So easy to hit, a caveman could do it !",625,10,27,151,188,1341
558,1.25,0.038180991923616237,188,1.25,Sweet walk-up music... Theme from 2001 is a solid choice.,625,8,31,149,188,1341
1448,1.25,0.03742858333995922,188,1.25,Manager tell Glonk must knock ball out of park.,625,7,33,148,188,1341
5426,1.25,0.03964299094595663,188,1.25,Ya might have some trouble. He’s got a fantastic cave ball.,625,10,27,151,188,1341
256,1.2486486486486486,0.039295410968874685,185,1.2486486486486486,"Helmet, Man, Helmet!",625,9,28,148,185,1346
539,1.2486486486486486,0.03777063025753965,185,1.2486486486486486,"I hate game delays too but when an umpire calls a strike next time, don't club him.",625,7,32,146,185,1346
807,1.2486486486486486,0.04003603039504853,185,1.2486486486486486,"Yeah, my wife also went on the paleo diet; I have to wear this gear at home, too.",625,10,26,149,185,1346
844,1.2486486486486486,0.03777063025753965,185,1.2486486486486486,Paleo Diet been working for you?,625,7,32,146,185,1346
925,1.2486486486486486,0.03777063025753965,185,1.2486486486486486,"After going 0 for 26 last week, I shaved mine.",625,7,32,146,185,1346
969,1.2486486486486486,0.03777063025753965,185,1.2486486486486486,"When the season's over, I'm going to taking a painting course and spend time with the kids.",625,7,32,146,185,1346
1274,1.2486486486486486,0.036984673899755766,185,1.2486486486486486,Why the ball?,625,6,34,145,185,1346
1949,1.2486486486486486,0.036984673899755766,185,1.2486486486486486,What? You thought only the fans are Neanderthals?,625,6,34,145,185,1346
1983,1.2486486486486486,0.03618164862040952,185,1.2486486486486486,It doesn't look like a Louisville Slugger.,625,5,36,144,185,1346
2746,1.2486486486486486,0.036984673899755766,185,1.2486486486486486,I get it with the bat but you’re telling me the Rules Committee approved the off-the-shoulder uniform too?,625,6,34,145,185,1346
2749,1.2486486486486486,0.03618164862040952,185,1.2486486486486486,"Speaking softly, I see.",625,5,36,144,185,1346
2941,1.2486486486486486,0.03777063025753965,185,1.2486486486486486,I understand that you're a caveman but you still need to wear a batting helmet.,625,7,32,146,185,1346
2968,1.2486486486486486,0.03618164862040952,185,1.2486486486486486,I'm assuming we can rule out a bunt.,625,5,36,144,185,1346
3031,1.2486486486486486,0.03536039154633739,185,1.2486486486486486,Great throwback uniform.,625,4,38,143,185,1346
3214,1.2486486486486486,0.036984673899755766,185,1.2486486486486486,I'm literally gonna hit this ball into the Stone Age.,625,6,34,145,185,1346
3677,1.2486486486486486,0.036984673899755766,185,1.2486486486486486,"For the last time, the count is one ball and more than one strike, there's more than one man on base, and the score is more than one to more than one.",625,6,34,145,185,1346
3861,1.2486486486486486,0.039295410968874685,185,1.2486486486486486,Watch out for his fast rock.,625,9,28,148,185,1346
3893,1.2486486486486486,0.03777063025753965,185,1.2486486486486486,"Louisville? No, it's from Lascaux.",625,7,32,146,185,1346
4019,1.2486486486486486,0.03536039154633739,185,1.2486486486486486,"You're up next, the Neanderthal just struck out.",625,4,38,143,185,1346
4146,1.2486486486486486,0.03854056196570392,185,1.2486486486486486,Let's see if you can hit it outta the Jurassic.,625,8,30,147,185,1346
4210,1.2486486486486486,0.03777063025753965,185,1.2486486486486486,"Me hit, you sit.",625,7,32,146,185,1346
4278,1.2486486486486486,0.03854056196570392,185,1.2486486486486486,You just get called up?,625,8,30,147,185,1346
4306,1.2486486486486486,0.04003603039504853,185,1.2486486486486486,"No, you don't get to actually kill the umpire.",625,10,26,149,185,1346
4439,1.2486486486486486,0.036984673899755766,185,1.2486486486486486,I love how you bagged that T-Rex in the on deck circle.,625,6,34,145,185,1346
4520,1.2486486486486486,0.03536039154633739,185,1.2486486486486486,"Can you believe, I finally passed the drug test?",625,4,38,143,185,1346
4633,1.2486486486486486,0.036984673899755766,185,1.2486486486486486,I think you're taking this Paleo thing a bit too far.,625,6,34,145,185,1346
4682,1.2486486486486486,0.03777063025753965,185,1.2486486486486486,"Finally called you up from Triple-A.D., huh?",625,7,32,146,185,1346
4842,1.2486486486486486,0.03777063025753965,185,1.2486486486486486,Still on the paleo diet?,625,7,32,146,185,1346
4887,1.2486486486486486,0.03854056196570392,185,1.2486486486486486,You misunderstand what we mean by club.,625,8,30,147,185,1346
4950,1.2486486486486486,0.03777063025753965,185,1.2486486486486486,"When they said they were looking for a player 
with some experience ...",625,7,32,146,185,1346
5027,1.2486486486486486,0.036984673899755766,185,1.2486486486486486,"One more time Ugg. He throw, you hit. You miss, I catch.",625,6,34,145,185,1346
5288,1.2486486486486486,0.04003603039504853,185,1.2486486486486486,Just don't hurl your 'Neanderthal Slugger' when you strike out.,625,10,26,149,185,1346
5320,1.2486486486486486,0.03365781450345968,185,1.2486486486486486,"so, how's the new club working out for ya?",625,2,42,141,185,1346
5464,1.2486486486486486,0.03618164862040952,185,1.2486486486486486,Hit a grounder.  I want to watch you run to first in that thing.,625,5,36,144,185,1346
5475,1.2486486486486486,0.036984673899755766,185,1.2486486486486486,Please remember if you have to slide we have a PG audience.,625,6,34,145,185,1346
5601,1.2486486486486486,0.03777063025753965,185,1.2486486486486486,"Listen BamBam, we need you to knock one into the Stone Age!",625,7,32,146,185,1346
5040,1.247191011235955,0.036996517661824525,178,1.247191011235955,We're not going to be as easy to eliminate as the Mammoths.,625,5,34,139,178,1382
598,1.2459016393442623,0.040241280578885666,183,1.2459016393442623,I'm not doing what you think I'm doing.,625,10,25,148,183,1383
1161,1.2459016393442623,0.03793696009826397,183,1.2459016393442623,I'm with the Clubs.,625,7,31,145,183,1383
2427,1.2459016393442623,0.040241280578885666,183,1.2459016393442623,"Strike"" is not a command",625,10,25,148,183,1383
3071,1.2459016393442623,0.03872030709943275,183,1.2459016393442623,Looks like we're gonna need a bigger ball.,625,8,29,146,183,1383
4650,1.2459016393442623,0.03793696009826397,183,1.2459016393442623,I was told this was a club team.,625,7,31,145,183,1383
125,1.2444444444444445,0.03663552276658908,180,1.2444444444444445,"Just a jock strap, but  then I'm not a catcher.",625,5,34,141,180,1388
137,1.2444444444444445,0.034900072142041334,180,1.2444444444444445,You Cleveland guys really take throw-back Tuesdays seriously.,625,3,38,139,180,1388
343,1.2444444444444445,0.03829240161236748,180,1.2444444444444445,"Wow, you actually look the way that you smell.",625,7,30,143,180,1388
828,1.2444444444444445,0.03829240161236748,180,1.2444444444444445,And I'M saying you didn't invent it!,625,7,30,143,180,1388
870,1.2444444444444445,0.03909451710500632,180,1.2444444444444445,Is this your first at club?,625,8,28,144,180,1388
1123,1.2444444444444445,0.034900072142041334,180,1.2444444444444445,"Give new meaning to the term ""baseball club""",625,3,38,139,180,1388
1185,1.2444444444444445,0.03577832139648922,180,1.2444444444444445,You do know it's the ball you have to hit?,625,4,36,140,180,1388
1216,1.2444444444444445,0.03829240161236748,180,1.2444444444444445,So... you're the one they call  Yabba Dabba Doo...,625,7,30,143,180,1388
1441,1.2444444444444445,0.03829240161236748,180,1.2444444444444445,You'll need to think of the strike zone a little differently...,625,7,30,143,180,1388
1516,1.2444444444444445,0.039880502931939316,180,1.2444444444444445,"Well that's a coincidence, because he calls his best pitch his Alley Oop.",625,9,26,145,180,1388
1729,1.2444444444444445,0.03577832139648922,180,1.2444444444444445,"Oh alright, you were safe.",625,4,36,140,180,1388
1911,1.2444444444444445,0.035341924943826764,180,1.2444444444444445,What do you mean I need a helmet?,625,4,37,140,181,1388
1923,1.2444444444444445,0.03829240161236748,180,1.2444444444444445,It feels like an eon since our last out.,625,7,30,143,180,1388
1977,1.2444444444444445,0.039880502931939316,180,1.2444444444444445,Been down in the minors for awhile?,625,9,26,145,180,1388
1988,1.2444444444444445,0.034900072142041334,180,1.2444444444444445,I'll explain it one more time.  You're ON a baseball club.,625,3,38,139,180,1388
2293,1.2444444444444445,0.03577832139648922,180,1.2444444444444445,I went along with the lucky beard thing but this is getting ridiculous.,625,4,36,140,180,1388
2329,1.2444444444444445,0.03909451710500632,180,1.2444444444444445,We call him Early Man around here because he swings too soon,625,8,28,144,180,1388
2842,1.2444444444444445,0.034900072142041334,180,1.2444444444444445,You're never gonna catch up to his fastball with that.,625,3,38,139,180,1388
3030,1.2444444444444445,0.03663552276658908,180,1.2444444444444445,No collusion.,625,5,34,141,180,1388
3224,1.2444444444444445,0.034900072142041334,180,1.2444444444444445,"Yes, and yes, I am on  the Paleo diet.",625,3,38,139,180,1388
3244,1.2444444444444445,0.034900072142041334,180,1.2444444444444445,They said they’d LET you steal second this time so long as you promise not to slide.,625,3,38,139,180,1388
3246,1.2444444444444445,0.03909451710500632,180,1.2444444444444445,But what's wrong with calling it a cave run?,625,8,28,144,180,1388
3260,1.2444444444444445,0.03663552276658908,180,1.2444444444444445,Let's see if you can hit it straight back to the Stone Age.,625,5,34,141,180,1388
3281,1.2444444444444445,0.03909451710500632,180,1.2444444444444445,You lookin' for meat? We'll serve you up a slider.,625,8,28,144,180,1388
3288,1.2444444444444445,0.03747312069753538,180,1.2444444444444445,Huh. Thorg learn how stand upright eons ago.,625,6,32,142,180,1388
3303,1.2444444444444445,0.03829240161236748,180,1.2444444444444445,"I'd get farther back,if I were you.",625,7,30,143,180,1388
3409,1.2444444444444445,0.03829240161236748,180,1.2444444444444445,"I don't care if you did invent fire, step in the box.",625,7,30,143,180,1388
3459,1.2444444444444445,0.03747312069753538,180,1.2444444444444445,I was in the minor leagues for a very long tine.,625,6,32,142,180,1388
3492,1.2444444444444445,0.03829240161236748,180,1.2444444444444445,"Sorry! No shoes, no shirt . . . no service!!",625,7,30,143,180,1388
3595,1.2444444444444445,0.03829240161236748,180,1.2444444444444445,It's deja vu all over again,625,7,30,143,180,1388
3614,1.2444444444444445,0.039880502931939316,180,1.2444444444444445,"Alright, let's see you knock it out of the Jurassic Park!",625,9,26,145,180,1388
3615,1.2444444444444445,0.03747312069753538,180,1.2444444444444445,It's my first Old-timers Game - you?,625,6,32,142,180,1388
3839,1.2444444444444445,0.03747312069753538,180,1.2444444444444445,"I've heard of waiting for a pitch, but you sir are ridiculous!",625,6,32,142,180,1388
3930,1.2444444444444445,0.039880502931939316,180,1.2444444444444445,You're the designated WHAT?,625,9,26,145,180,1388
4624,1.2444444444444445,0.03909451710500632,180,1.2444444444444445,Coconut or Cantaloupe ?,625,8,28,144,180,1388
4705,1.2444444444444445,0.03663552276658908,180,1.2444444444444445,"Hey, you need a helmet... AND shoes... AND pants...",625,5,34,141,180,1388
4964,1.2444444444444445,0.039880502931939316,180,1.2444444444444445,I'm jealous of you guys that were grandfathered in.,625,9,26,145,180,1388
5024,1.2444444444444445,0.03829240161236748,180,1.2444444444444445,How do you like the paleo diet?,625,7,30,143,180,1388
5273,1.2444444444444445,0.03577832139648922,180,1.2444444444444445,You from the Pro-Magnon League?,625,4,36,140,180,1388
5497,1.2444444444444445,0.03663552276658908,180,1.2444444444444445,"Hi there!  If there's a bench clearing brawl, just want you to know, I'm an incredibly amicable person.",625,5,34,141,180,1388
5598,1.2444444444444445,0.034452553059306015,180,1.2444444444444445,"OK.  Yes, I can see it your way.",625,3,39,139,181,1388
2103,1.2427745664739884,0.03923393848818495,173,1.2427745664739884,"We don't hit and run, we continue to hit it until it is dead!",625,7,28,138,173,1429
70,1.2415730337078652,0.03928047368902725,178,1.2415730337078652,That apple you just ate was the last baseball. Head for home.,625,8,27,143,178,1430
450,1.2415730337078652,0.03846395249016343,178,1.2415730337078652,"OK Rocky, you swing at the ball, not me.",625,7,29,142,178,1430
597,1.2415730337078652,0.04086460029624647,178,1.2415730337078652,"As designated hitter you hit the ball, not me.",625,10,23,145,178,1430
2061,1.2415730337078652,0.03762971789818171,178,1.2415730337078652,I think you are taking this whole Paleo thing a little too far.,625,6,31,141,178,1430
2757,1.2415730337078652,0.03846395249016343,178,1.2415730337078652,"Mr. Teebow, it's 2050, how long have you been stuck in the minors?",625,7,29,142,178,1430
2790,1.2415730337078652,0.03590314366401795,178,1.2415730337078652,My guess is that you are not going to bunt.,625,4,35,139,178,1430
3263,1.2415730337078652,0.04008036408645976,178,1.2415730337078652,"Well, since the Geico commercials and sitcom spin-off, I've been trying to cover all my bases.",625,9,25,144,178,1430
3648,1.2415730337078652,0.034089232622948384,178,1.2415730337078652,"I heard that your team is anti-analytics, but you guys are more old school than I thought.",625,2,39,137,178,1430
3751,1.2415730337078652,0.03762971789818171,178,1.2415730337078652,"Now, this is what I call an 'Old Timers Game'",625,6,31,141,178,1430
4243,1.2415730337078652,0.036776564508228936,178,1.2415730337078652,This Paleo diet craze is ruining the game.,625,5,33,140,178,1430
4677,1.2415730337078652,0.036776564508228936,178,1.2415730337078652,"So you’re the first, first draft pick huh?",625,5,33,140,178,1430
4953,1.2415730337078652,0.03846395249016343,178,1.2415730337078652,Jeez! How long did they keep you in the dugout?,625,7,29,142,178,1430
5042,1.2415730337078652,0.03846395249016343,178,1.2415730337078652,Just up from the Asia Minors?,625,7,29,142,178,1430
5325,1.2415730337078652,0.04008036408645976,178,1.2415730337078652,But can you eat it?,625,9,25,144,178,1430
38,1.24,0.037978474587846534,175,1.24,"Catcher: ""Finally got the call to the big leagues?""
Batter: ""It's been a long time coming!""",625,6,30,139,175,1444
100,1.24,0.03620775665566876,175,1.24,Wait till you see his curve stone.,625,4,34,137,175,1444
131,1.24,0.03883356765752402,175,1.24,If you’re hunting for home plate you’ve found it.,625,7,28,140,175,1444
171,1.24,0.04048961431027807,175,1.24,You play for a baseball 'club'. You hit with a baseball bat.,625,9,24,142,175,1444
193,1.24,0.037103680235630467,175,1.24,"You're really committed to this 'beard look,' Dombrowski.",625,5,32,138,175,1444
211,1.24,0.03883356765752402,175,1.24,Watch your toes--he throws a wicked sinker.,625,7,28,140,175,1444
239,1.24,0.039670233450325006,175,1.24,This paleo diet coach put me on has really gotten out of hand.,625,8,26,141,175,1444
336,1.24,0.03620775665566876,175,1.24,"Just my opinion, but I think your team has taken the retro look a little too far.",625,4,34,137,175,1444
386,1.24,0.04285385865905711,175,1.24,"Hey clubber, clubber! Hey clubber, clubber! No clubber! No clubber!",625,12,18,145,175,1444
405,1.24,0.035289094590883675,175,1.24,"Take it easy, buddy. You're playing like a bunch of Neanderthals.",625,3,36,136,175,1444
542,1.24,0.039670233450325006,175,1.24,Your Leopard Print from last time looked better,625,8,26,141,175,1444
571,1.24,0.03620775665566876,175,1.24,"Wait a minute, isn’t that a mastodon femur?",625,4,34,137,175,1444
642,1.24,0.035289094590883675,175,1.24,You wearing a cup under that pelt?,625,3,36,136,175,1444
977,1.24,0.037978474587846534,175,1.24,Trust me. Pine tar's the last thing you should be worried about.,625,6,30,139,175,1444
1271,1.24,0.04129273921631822,175,1.24,"no, you can’t play. Clubbing your wife is only ok in football.",625,10,22,143,175,1444
1315,1.24,0.04048961431027807,175,1.24,Why you hide brow ridge behind mask?,625,9,24,142,175,1444
1362,1.24,0.039670233450325006,175,1.24,I was told to swing for the lights.  What are lights?,625,8,26,141,175,1444
1415,1.24,0.03883356765752402,175,1.24,"I’m a Pro-Magnon, if that’s what you’re asking....",625,7,28,140,175,1444
1494,1.24,0.037103680235630467,175,1.24,He takes an old-school approach to the game.,625,5,32,138,175,1444
1503,1.24,0.03883356765752402,175,1.24,You really should cut down on the steroids Gronk,625,7,28,140,175,1444
1533,1.24,0.03883356765752402,175,1.24,"I know facial hair is big in baseball now,  but this is ridiculous.",625,7,28,140,175,1444
1573,1.24,0.037103680235630467,175,1.24,"I know this is a pro club team, but you still have to wear shoes.",625,5,32,138,175,1444
1759,1.24,0.035289094590883675,175,1.24,"Now batting for Rodriguez, number 7, Cro-Magnon",625,3,36,136,175,1444
1760,1.24,0.03883356765752402,175,1.24,"So, what's your idea to speed up the game?",625,7,28,140,175,1444
1991,1.24,0.03883356765752402,175,1.24,"No, not much has changed....They throw something at you -- your days a rock, nowadays it's a hard-ball -- and then you hit the thing back at them in a way that makes it impossible for them to catch the thing.",625,7,28,140,175,1444
2115,1.24,0.03883356765752402,175,1.24,"Don't take it personally, but my wife keeps saying baseball is an old man's game and I'm starting to realize she might have a point.",625,7,28,140,175,1444
2119,1.24,0.03620775665566876,175,1.24,"Suit yourself, but you try sliding into second and you'll find yourself having quite a wardrobe malfunction.",625,4,34,137,175,1444
2278,1.24,0.03434586950497171,175,1.24,Exactly how long were you in the minors?,625,2,38,135,175,1444
2343,1.24,0.039670233450325006,175,1.24,For distance I might go with a lighter club.,625,8,26,141,175,1444
2498,1.24,0.037978474587846534,175,1.24,I've got some ideas about speeding up the game.,625,6,30,139,175,1444
2523,1.24,0.039670233450325006,175,1.24,"You realize that a strike out is not a comment on you as a person, right?",625,8,26,141,175,1444
2564,1.24,0.037978474587846534,175,1.24,"Listen wise-guy, the strike zone is not between your knuckles and your knees.",625,6,30,139,175,1444
2612,1.24,0.039670233450325006,175,1.24,I just came up from the Miocene League.,625,8,26,141,175,1444
2691,1.24,0.03620775665566876,175,1.24,"You do realize, of course, that a strike doesn't mean what you might think it means?",625,4,34,137,175,1444
2782,1.24,0.037978474587846534,175,1.24,"Yeah, he throws mean a knuckle-dragger ball.",625,6,30,139,175,1444
2962,1.24,0.037978474587846534,175,1.24,"turn back the clock"" night has gone too fa",625,6,30,139,175,1444
2988,1.24,0.039670233450325006,175,1.24,whatchu say about my momma?,625,8,26,141,175,1444
3000,1.24,0.037978474587846534,175,1.24,"Don't freeze up again, Carl.",625,6,30,139,175,1444
3252,1.24,0.039670233450325006,175,1.24,Found it in the bat cave.,625,8,26,141,175,1444
3445,1.24,0.039670233450325006,175,1.24,damn right I choke up,625,8,26,141,175,1444
3458,1.24,0.03883356765752402,175,1.24,If you promise not to hit me I will call for a walk.,625,7,28,140,175,1444
3462,1.24,0.037978474587846534,175,1.24,"Same stuff as always, nothing new",625,6,30,139,175,1444
3485,1.24,0.039670233450325006,175,1.24,"If its a close play, slide feet-first.  Baseball is a family game.",625,8,26,141,175,1444
3503,1.24,0.03883356765752402,175,1.24,Watch out. this pitcher is a real Neanderthal.,625,7,28,140,175,1444
3554,1.24,0.03883356765752402,175,1.24,Kill the ump wasn't meant literally.,625,7,28,140,175,1444
3570,1.24,0.03883356765752402,175,1.24,What are you waiting for — a knuckledragger ball?,625,7,28,140,175,1444
3627,1.24,0.033864406528930205,175,1.24,"Buy me some peanuts and crackerjack, I won't care if I never get back.",625,2,39,135,176,1444
3636,1.24,0.039670233450325006,175,1.24,"Remember, you are going for RBIs, not RIBs.",625,8,26,141,175,1444
3685,1.24,0.03883356765752402,175,1.24,It’s  not in your DNA.,625,7,28,140,175,1444
3756,1.24,0.04285385865905711,175,1.24,Who are you wearing?  Let me guess.  Wilma?,625,12,18,145,175,1444
3824,1.24,0.04048961431027807,175,1.24,"Same old shit, bro - waiting for the kill.",625,9,24,142,175,1444
3838,1.24,0.037103680235630467,175,1.24,"Get with the times,man. We use aluminum bats now.",625,5,32,138,175,1444
3846,1.24,0.039670233450325006,175,1.24,"I think you should know, I have an anger management problem.",625,8,26,141,175,1444
3960,1.24,0.04048961431027807,175,1.24,He called me off the bench.  I hope the rules haven't changed much.,625,9,24,142,175,1444
4179,1.24,0.04048961431027807,175,1.24,"Why, yes! I opted not to circumcise, too. Good eye!",625,9,24,142,175,1444
4468,1.24,0.03434586950497171,175,1.24,"No, they moved to L.A. in '58.'",625,2,38,135,175,1444
4483,1.24,0.03620775665566876,175,1.24,Haven't you heard? It's a whole new ball game.,625,4,34,137,175,1444
4522,1.24,0.037978474587846534,175,1.24,Not my favorite throwback uniform.,625,6,30,139,175,1444
4523,1.24,0.04048961431027807,175,1.24,They are going a little too far with these throwback uniforms.,625,9,24,142,175,1444
4542,1.24,0.03883356765752402,175,1.24,Pull out all the stops to break that the slump!,625,7,28,140,175,1444
4588,1.24,0.03620775665566876,175,1.24,"Listen, you gotta hang on to your bat.",625,4,34,137,175,1444
4599,1.24,0.03883356765752402,175,1.24,"I heard you guys haven’t made it to the World Series in over  4,000 years.",625,7,28,140,175,1444
4618,1.24,0.04048961431027807,175,1.24,"I promise you Thag, it's ""to the ballgame,"" not ""at the ballgame""",625,9,24,142,175,1444
4678,1.24,0.037103680235630467,175,1.24,"Wow, the shift is really changing the game.",625,5,32,138,175,1444
4679,1.24,0.04129273921631822,175,1.24,OK - four strikes and you're out - if you say so.,625,10,22,143,175,1444
4780,1.24,0.03883356765752402,175,1.24,Hi Donald. When did you get traded to the Republicans?,625,7,28,140,175,1444
4910,1.24,0.037103680235630467,175,1.24,"Uhmm unga bunga buga buga?

It’s alright dude, I speak english. I just dress like this for the gram.",625,5,32,138,175,1444
4938,1.24,0.037103680235630467,175,1.24,"No jockstrap, huh?",625,5,32,138,175,1444
5035,1.24,0.039670233450325006,175,1.24,One more curve ball and you lose a finger.,625,8,26,141,175,1444
