target_id,mean,precision,count,score,caption,contest,funny,somewhat_funny,unfunny,counts,rank
2519,1.1354166666666667,0.03810129523822529,96,1.1354166666666667,"Hey, that's not a regulation bat, buddy!",625,1,11,84,96,4068
2555,1.1354166666666667,0.03810129523822529,96,1.1354166666666667,Next at bat... BAM BAMBINO,625,1,11,84,96,4068
2643,1.1354166666666667,0.03810129523822529,96,1.1354166666666667,Don't you like these throwback games?,625,1,11,84,96,4068
2694,1.1354166666666667,0.03810129523822529,96,1.1354166666666667,Are you another one of those vintage base ball players?,625,1,11,84,96,4068
2840,1.1354166666666667,0.03810129523822529,96,1.1354166666666667,Go back to your cave and get a batting helmet,625,1,11,84,96,4068
2857,1.1354166666666667,0.03810129523822529,96,1.1354166666666667,Ok.  But please don’t slide.,625,1,11,84,96,4068
2943,1.1354166666666667,0.04087795181322621,96,1.1354166666666667,Is that one of those new Cretaceous Slugger bats?,625,2,9,85,96,4068
2959,1.1354166666666667,0.04347764011602377,96,1.1354166666666667,The first pitch better be a fastball down the middle or I'm going to knock you back to the Stone Age.,625,3,7,86,96,4068
3008,1.1354166666666667,0.04087795181322621,96,1.1354166666666667,Is this the clubbing scene?,625,2,9,85,96,4068
3032,1.1354166666666667,0.035105703998301666,96,1.1354166666666667,Great. Knocked out in Jurassic Park.,625,0,13,83,96,4068
3067,1.1354166666666667,0.04347764011602377,96,1.1354166666666667,Did that club keep the Yankees from making you shave and get a haircut?,625,3,7,86,96,4068
3144,1.1354166666666667,0.035105703998301666,96,1.1354166666666667,"'Well, you know it's not corked.""",625,0,13,83,96,4068
3173,1.1354166666666667,0.04087795181322621,96,1.1354166666666667,When are you going to learn how to walk?,625,2,9,85,96,4068
3203,1.1354166666666667,0.035105703998301666,96,1.1354166666666667,This where I go to kill ump?,625,0,13,83,96,4068
3256,1.1354166666666667,0.03810129523822529,96,1.1354166666666667,You must be kidding. Is that pine tar on your jersey?,625,1,11,84,96,4068
3286,1.1354166666666667,0.04087795181322621,96,1.1354166666666667,"I agree, uniforms hide the real you.",625,2,9,85,96,4068
3293,1.1354166666666667,0.03810129523822529,96,1.1354166666666667,I'm afraid if you want to fight dinosaurs you need to talk to the rugby coach.,625,1,11,84,96,4068
3306,1.1354166666666667,0.04087795181322621,96,1.1354166666666667,You look a little under dressed to play this game slugger.  Go to the locker room and get into uniform.,625,2,9,85,96,4068
3337,1.1354166666666667,0.03810129523822529,96,1.1354166666666667,Wow Damon. You've really let yourself go.,625,1,11,84,96,4068
3510,1.1354166666666667,0.035105703998301666,96,1.1354166666666667,I know big beards are in right now man but don't you think you're taking it too far with this caveman getup?,625,0,13,83,96,4068
3513,1.1354166666666667,0.03810129523822529,96,1.1354166666666667,You catch three pound rocks,625,1,11,84,96,4068
3631,1.1354166666666667,0.04347764011602377,96,1.1354166666666667,"Remember, you're hitting it OUT not DOWN!",625,3,7,86,96,4068
3634,1.1354166666666667,0.04347764011602377,96,1.1354166666666667,"Monkey, no catch!",625,3,7,86,96,4068
3684,1.1354166666666667,0.03810129523822529,96,1.1354166666666667,Give me some heat,625,1,11,84,96,4068
3731,1.1354166666666667,0.03810129523822529,96,1.1354166666666667,"One more way inside like that, and you'll get to join my club.",625,1,11,84,96,4068
3809,1.1354166666666667,0.04087795181322621,96,1.1354166666666667,My pitcher's ERA is 2.19. What's yours?,625,2,9,85,96,4068
3833,1.1354166666666667,0.03810129523822529,96,1.1354166666666667,"I knew doping was a thing, but didn't realize cryonomics was.",625,1,11,84,96,4068
3844,1.1354166666666667,0.03810129523822529,96,1.1354166666666667,Say that again.,625,1,11,84,96,4068
3849,1.1354166666666667,0.035105703998301666,96,1.1354166666666667,"No batter, no batter, seriously, no batter!",625,0,13,83,96,4068
3866,1.1354166666666667,0.04087795181322621,96,1.1354166666666667,"Don't even try reading my signs.""",625,2,9,85,96,4068
3978,1.1354166666666667,0.03810129523822529,96,1.1354166666666667,So you just moved up from the Paleo League?,625,1,11,84,96,4068
4050,1.1354166666666667,0.04087795181322621,96,1.1354166666666667,"I guess you figured the bare feet took care of the ""walk softly"" part.",625,2,9,85,96,4068
4057,1.1354166666666667,0.04347764011602377,96,1.1354166666666667,I think this is the beginning of a beautiful franchise for you and your sidekick Robin.,625,3,7,86,96,4068
4166,1.1354166666666667,0.03810129523822529,96,1.1354166666666667,"You're supposed to knock the BALL out of the park, not the pitcher.",625,1,11,84,96,4068
4177,1.1354166666666667,0.04347764011602377,96,1.1354166666666667,"What do you wearing, mister? Where is the cowhide I brought you?",625,3,7,86,96,4068
4231,1.1354166666666667,0.035105703998301666,96,1.1354166666666667,When do I bat you?,625,0,13,83,96,4068
4276,1.1354166666666667,0.03810129523822529,96,1.1354166666666667,Really! That's your team's new outfit?,625,1,11,84,96,4068
4283,1.1354166666666667,0.03810129523822529,96,1.1354166666666667,I won't need cleats.,625,1,11,84,96,4068
4309,1.1354166666666667,0.035105703998301666,96,1.1354166666666667,"If I told him to fire one over the plate, would you even understand?",625,0,13,83,96,4068
4314,1.1354166666666667,0.03810129523822529,96,1.1354166666666667,This is the best player they got?,625,1,11,84,96,4068
4332,1.1354166666666667,0.04087795181322621,96,1.1354166666666667,"I forgot the sign for ""Wild Batter""",625,2,9,85,96,4068
4395,1.1354166666666667,0.035105703998301666,96,1.1354166666666667,You know 2 fingers used to mean a curveball.,625,0,13,83,96,4068
4466,1.1354166666666667,0.04087795181322621,96,1.1354166666666667,If you hit a home rum make sure you don't flip that bat in my direction.,625,2,9,85,96,4068
4471,1.1354166666666667,0.03810129523822529,96,1.1354166666666667,Supper at Mama Leone's tonight after the game?,625,1,11,84,96,4068
4500,1.1354166666666667,0.04347764011602377,96,1.1354166666666667,"This time, don’t throw your club at the pitcher. We only have two left.",625,3,7,86,96,4068
4502,1.1354166666666667,0.02817470429282805,96,1.1354166666666667,Are you from the the Neanderthal league?,625,0,0,96,96,4068
4519,1.1354166666666667,0.04347764011602377,96,1.1354166666666667,Ug like fastball brontosaurus high.,625,3,7,86,96,4068
4534,1.1354166666666667,0.035105703998301666,96,1.1354166666666667,"Actually, my mother IS a Neanderthal...",625,0,13,83,96,4068
4563,1.1354166666666667,0.04087795181322621,96,1.1354166666666667,"Yeah, budget cuts - but on the plus side we picked up more international pool money.",625,2,9,85,96,4068
4616,1.1354166666666667,0.035105703998301666,96,1.1354166666666667,"You have to tell me every damn time...   ""No DH in the good old days.""",625,0,13,83,96,4068
4665,1.1354166666666667,0.035105703998301666,96,1.1354166666666667,"No, “strike three” doesn’t mean you hit me three times!  You actually have to take that up with the Ump”",625,0,13,83,96,4068
4727,1.1354166666666667,0.04347764011602377,96,1.1354166666666667,Do your knees hurt from squatting?,625,3,7,86,96,4068
4738,1.1354166666666667,0.035105703998301666,96,1.1354166666666667,You ain't got no chance...his knucklerock ia a killer.,625,0,13,83,96,4068
4743,1.1354166666666667,0.04087795181322621,96,1.1354166666666667,Catch her? You'll never catch her like that!,625,2,9,85,96,4068
4759,1.1354166666666667,0.04087795181322621,96,1.1354166666666667,One Cave Run pitch...coming Up!!!,625,2,9,85,96,4068
4838,1.1354166666666667,0.04087795181322621,96,1.1354166666666667,"Sorry, didn't mean to ice you for that long.",625,2,9,85,96,4068
4853,1.1354166666666667,0.03810129523822529,96,1.1354166666666667,These new rookies play ball like a bunch of Neanderthals.,625,1,11,84,96,4068
4889,1.1354166666666667,0.03810129523822529,96,1.1354166666666667,"Great, another ""throwback"" jersey day.",625,1,11,84,96,4068
4916,1.1354166666666667,0.03810129523822529,96,1.1354166666666667,"Yeah,I go free agent in 25,000 years.",625,1,11,84,96,4068
4931,1.1354166666666667,0.04087795181322621,96,1.1354166666666667,Nothing like the Flintstones-Yankees game.,625,2,9,85,96,4068
4942,1.1354166666666667,0.03810129523822529,96,1.1354166666666667,"Look, I'm tired explaining the rules, figure them out yourself.",625,1,11,84,96,4068
4946,1.1354166666666667,0.03810129523822529,96,1.1354166666666667,"Looks like 'roids are back in, huh?",625,1,11,84,96,4068
4954,1.1354166666666667,0.03810129523822529,96,1.1354166666666667,Can we switch positions?  I mean in all aspects.,625,1,11,84,96,4068
4973,1.1354166666666667,0.04347764011602377,96,1.1354166666666667,"Okay, but if they say you're using too much pine tar, don't bash me.",625,3,7,86,96,4068
5015,1.1354166666666667,0.04347764011602377,96,1.1354166666666667,"From Tom Potter: ""Let's see what your back-to-basics approach can do in the big leagues.""

From Stephen West:  ""Dang! I forgot it was Classic Uniform Day.""

email: markellorhighwater@gmail.com
phone: 301 725 9378",625,3,7,86,96,4068
5020,1.1354166666666667,0.03810129523822529,96,1.1354166666666667,Judge hit ball,625,1,11,84,96,4068
5078,1.1354166666666667,0.035105703998301666,96,1.1354166666666667,Really try to hit it this time because my doctor said I need to avoid any more rocks to the face.,625,0,13,83,96,4068
5112,1.1354166666666667,0.04087795181322621,96,1.1354166666666667,Any cork in that bone?,625,2,9,85,96,4068
5147,1.1354166666666667,0.03810129523822529,96,1.1354166666666667,Swing before the ball gets to me!,625,1,11,84,96,4068
5242,1.1354166666666667,0.03810129523822529,96,1.1354166666666667,Org know me not turtle?  He no think I am food because I am over plate?,625,1,11,84,96,4068
5265,1.1354166666666667,0.03810129523822529,96,1.1354166666666667,"You're going to see a great curve ball, not a cave ball.",625,1,11,84,96,4068
5330,1.1354166666666667,0.035105703998301666,96,1.1354166666666667,"Remember -if you are hit with the ball, don't hit me.__",625,0,13,83,96,4068
5348,1.1354166666666667,0.035105703998301666,96,1.1354166666666667,"Now, up at cudgel, Billy-Bob Cro-Magnon!",625,0,13,83,96,4068
5384,1.1354166666666667,0.04087795181322621,96,1.1354166666666667,He’s gonna walk you to pitch to the Missing Link,625,2,9,85,96,4068
5400,1.1354166666666667,0.03810129523822529,96,1.1354166666666667,I think you forgot your batting helmet.,625,1,11,84,96,4068
5409,1.1354166666666667,0.035105703998301666,96,1.1354166666666667,"If it's over the plate, just swing. Simple.",625,0,13,83,96,4068
5432,1.1354166666666667,0.03810129523822529,96,1.1354166666666667,I hate the early innings,625,1,11,84,96,4068
5555,1.1354166666666667,0.03810129523822529,96,1.1354166666666667,I'm making up for my vegan phase.,625,1,11,84,96,4068
5588,1.1354166666666667,0.04087795181322621,96,1.1354166666666667,"You've been moved up in the order, hub?",625,2,9,85,96,4068
5624,1.1354166666666667,0.04087795181322621,96,1.1354166666666667,I'll trade you a Babe Ruth and Ty Cobb for your card.,625,2,9,85,96,4068
5625,1.1354166666666667,0.03810129523822529,96,1.1354166666666667,So you're the new guy with the ball club.,625,1,11,84,96,4068
429,1.134020618556701,0.043049724454871305,97,1.134020618556701,"This is an agricultural pastime, pal.",625,3,7,87,97,4212
623,1.134020618556701,0.043049724454871305,97,1.134020618556701,You don't have any protective gear? We sent away the umpire to limit co-lateral damage.,625,3,7,87,97,4212
744,1.134020618556701,0.03773228738143944,97,1.134020618556701,"Sorry, buddy - cricket tryouts are next door.",625,1,11,85,97,4212
1104,1.134020618556701,0.040478415771098786,97,1.134020618556701,Watch out for the Neanderball,625,2,9,86,97,4212
2354,1.134020618556701,0.040478415771098786,97,1.134020618556701,"So, you're big on the paleo thing.",625,2,9,86,97,4212
3501,1.134020618556701,0.03773228738143944,97,1.134020618556701,Abner Doubleday!  What are you doing here?!,625,1,11,85,97,4212
4012,1.134020618556701,0.03773228738143944,97,1.134020618556701,I'm a heavy hitter.,625,1,11,85,97,4212
4333,1.134020618556701,0.040478415771098786,97,1.134020618556701,It's not true that the game is always devolving.,625,2,9,86,97,4212
5275,1.134020618556701,0.03773228738143944,97,1.134020618556701,"Hey, Paleo Man, got any hot dogs?",625,1,11,85,97,4212
5506,1.134020618556701,0.03476994217327846,97,1.134020618556701,"Yeah, yeah—next you're going to tell you just came out of the bat-cave.",625,0,13,84,97,4212
3762,1.1326530612244898,0.04263011814278531,98,1.1326530612244898,Our new uniforms are woolly mammoth. They're supposed to breathe better.,625,3,7,88,98,4222
1642,1.1304347826086956,0.04152317120425728,92,1.1304347826086956,I like the throw-back uni.,625,2,8,82,92,4223
3309,1.1304347826086956,0.03530425838874572,92,1.1304347826086956,Glad you showed up for old-timers day,625,0,12,80,92,4223
3708,1.1304347826086956,0.03530425838874572,92,1.1304347826086956,"Sorry,aluminum bats only in this league.",625,0,12,80,92,4223
4585,1.1304347826086956,0.04152317120425728,92,1.1304347826086956,"Hey, rookie. They say you're a 5 tool ball player. Too bad none of your ""tools"" involve baseball.",625,2,8,82,92,4223
4772,1.1304347826086956,0.03530425838874572,92,1.1304347826086956,Is this your first Old Timers game?,625,0,12,80,92,4223
52,1.1290322580645162,0.04109819724326487,93,1.1290322580645162,Let's just say my ERA has long since past.,625,2,8,83,93,4228
62,1.1290322580645162,0.038148495723287934,93,1.1290322580645162,Try not to be nervous. Picture rhem all naked.,625,1,10,82,93,4228
101,1.1290322580645162,0.038148495723287934,93,1.1290322580645162,Your mom still dating dinosaurs?,625,1,10,82,93,4228
157,1.1290322580645162,0.03495073154102972,93,1.1290322580645162,Homer.,625,0,12,81,93,4228
181,1.1290322580645162,0.038148495723287934,93,1.1290322580645162,Football Practice is one field over,625,1,10,82,93,4228
214,1.1290322580645162,0.038148495723287934,93,1.1290322580645162,I spit at the Green Monster.,625,1,10,82,93,4228
220,1.1290322580645162,0.04109819724326487,93,1.1290322580645162,"I heard of throwback Thursday, but this is ridiculous!",625,2,8,83,93,4228
250,1.1290322580645162,0.04109819724326487,93,1.1290322580645162,"Exhibition season's over, Pal.",625,2,8,83,93,4228
270,1.1290322580645162,0.04109819724326487,93,1.1290322580645162,You really let yourself go over the All Star Break huh,625,2,8,83,93,4228
306,1.1290322580645162,0.038148495723287934,93,1.1290322580645162,"Me Despondent Homosapien.""",625,1,10,82,93,4228
326,1.1290322580645162,0.038148495723287934,93,1.1290322580645162,"Perhaps you're thinking of a different ""old ball game.""",625,1,10,82,93,4228
340,1.1290322580645162,0.04109819724326487,93,1.1290322580645162,Did anyone check his bat for a cork?,625,2,8,83,93,4228
347,1.1290322580645162,0.038148495723287934,93,1.1290322580645162,Bring in your corners -- this club is so heavy all I can do is bunt.,625,1,10,82,93,4228
367,1.1290322580645162,0.038148495723287934,93,1.1290322580645162,"""Your kidding!   A blast from the past ain't happening.""",625,1,10,82,93,4228
398,1.1290322580645162,0.038148495723287934,93,1.1290322580645162,"Does it look like I lost a bet to you, Charlie?",625,1,10,82,93,4228
423,1.1290322580645162,0.04109819724326487,93,1.1290322580645162,you might want to reconsider that signal to the picture.,625,2,8,83,93,4228
503,1.1290322580645162,0.038148495723287934,93,1.1290322580645162,Tar pit bats are illegal.,625,1,10,82,93,4228
506,1.1290322580645162,0.043849924827106514,93,1.1290322580645162,Petrified wood?  Petrified me!,625,3,6,84,93,4228
523,1.1290322580645162,0.038148495723287934,93,1.1290322580645162,I hate classic uniform day,625,1,10,82,93,4228
524,1.1290322580645162,0.03495073154102972,93,1.1290322580645162,No rocks and stones just balls and strikes.,625,0,12,81,93,4228
562,1.1290322580645162,0.038148495723287934,93,1.1290322580645162,Let me guess. You still think RBIs are a telling stat?,625,1,10,82,93,4228
591,1.1290322580645162,0.04109819724326487,93,1.1290322580645162,"Green monsters are your thing, right?",625,2,8,83,93,4228
682,1.1290322580645162,0.043849924827106514,93,1.1290322580645162,"We've taken the ""throwback jerseys"" too far.",625,3,6,84,93,4228
683,1.1290322580645162,0.038148495723287934,93,1.1290322580645162,Are you fitting in? With that beard you're perfect.,625,1,10,82,93,4228
701,1.1290322580645162,0.04109819724326487,93,1.1290322580645162,You're out of the box.,625,2,8,83,93,4228
717,1.1290322580645162,0.038148495723287934,93,1.1290322580645162,Contestant on Let's Make a Deal?,625,1,10,82,93,4228
756,1.1290322580645162,0.04109819724326487,93,1.1290322580645162,I guess you didn't hear that big barrels are verboten in this tournament.,625,2,8,83,93,4228
771,1.1290322580645162,0.03965078525449415,93,1.1290322580645162,"For the last time, I'm from the stone age. I never played centerfield for the Colorado Rockies.",625,1,9,82,92,4228
777,1.1290322580645162,0.038148495723287934,93,1.1290322580645162,These throwback nights are getting out of hand.,625,1,10,82,93,4228
811,1.1290322580645162,0.038148495723287934,93,1.1290322580645162,Watch out this one requires a wide swing.,625,1,10,82,93,4228
845,1.1290322580645162,0.04109819724326487,93,1.1290322580645162,I woke up on the wrong side of the bed.,625,2,8,83,93,4228
877,1.1290322580645162,0.038148495723287934,93,1.1290322580645162,"I don't mind your team's weird uniforms, but has that bat been checked for pine tar?",625,1,10,82,93,4228
912,1.1290322580645162,0.038148495723287934,93,1.1290322580645162,"Splitter high and inside, eh! I plan to walk upright to first!",625,1,10,82,93,4228
913,1.1290322580645162,0.04109819724326487,93,1.1290322580645162,"I knew the Mets farm system was thin, but this is ridiculous.",625,2,8,83,93,4228
939,1.1290322580645162,0.03495073154102972,93,1.1290322580645162,Ogg take your man's ERA  to paleolithic.,625,0,12,81,93,4228
945,1.1290322580645162,0.03495073154102972,93,1.1290322580645162,Is that a retro uniform?,625,0,12,81,93,4228
989,1.1290322580645162,0.038148495723287934,93,1.1290322580645162,Welcome back Mr. Bench.,625,1,10,82,93,4228
996,1.1290322580645162,0.038148495723287934,93,1.1290322580645162,Gonna need a bigger plate.,625,1,10,82,93,4228
1098,1.1290322580645162,0.046438884547752426,93,1.1290322580645162,"Hi Mike
I haven’t seen you in ages.",625,4,4,85,93,4228
1116,1.1290322580645162,0.038148495723287934,93,1.1290322580645162,Good to see you again Damon!,625,1,10,82,93,4228
1159,1.1290322580645162,0.038148495723287934,93,1.1290322580645162,In the Old Days it was 4 strikes and you were out.,625,1,10,82,93,4228
1190,1.1290322580645162,0.04109819724326487,93,1.1290322580645162,Can you speak up?,625,2,8,83,93,4228
1193,1.1290322580645162,0.04109819724326487,93,1.1290322580645162,Will you wear that same throwback jersey when confirmed for a Supreme Court judgeship?,625,2,8,83,93,4228
1232,1.1290322580645162,0.038148495723287934,93,1.1290322580645162,"Right: How can I trump this?
Left: In a million years.",625,1,10,82,93,4228
1236,1.1290322580645162,0.04109819724326487,93,1.1290322580645162,Saber Tooth Metrics.. its killing our sport...,625,2,8,83,93,4228
1277,1.1290322580645162,0.03495073154102972,93,1.1290322580645162,You must be the new guy from the Club Team.,625,0,12,81,93,4228
1348,1.1290322580645162,0.038148495723287934,93,1.1290322580645162,The diet worked so well I'm going totally Paleo.,625,1,10,82,93,4228
1374,1.1290322580645162,0.038148495723287934,93,1.1290322580645162,Is this the new retro-style uniform?,625,1,10,82,93,4228
1382,1.1290322580645162,0.043849924827106514,93,1.1290322580645162,Our pitching staff is mostly creationists so you'll probably see a lot of forkballs.,625,3,6,84,93,4228
1383,1.1290322580645162,0.038148495723287934,93,1.1290322580645162,Tap your foot. Tap it again. Tap it again. You're out.,625,1,10,82,93,4228
1421,1.1290322580645162,0.038148495723287934,93,1.1290322580645162,"I’m telling you, this next hit will be prehistoric!",625,1,10,82,93,4228
1457,1.1290322580645162,0.038148495723287934,93,1.1290322580645162,You're not going to throw off the analytics with this old school crap!,625,1,10,82,93,4228
1483,1.1290322580645162,0.04109819724326487,93,1.1290322580645162,"Don't tell me, you're trying Paleo...",625,2,8,83,93,4228
1581,1.1290322580645162,0.038148495723287934,93,1.1290322580645162,Grasping the concept of 'home plate' may take some time.,625,1,10,82,93,4228
1637,1.1290322580645162,0.038148495723287934,93,1.1290322580645162,"Up to bat, wearing a throwback jersey...",625,1,10,82,93,4228
1661,1.1290322580645162,0.04109819724326487,93,1.1290322580645162,No cleats. No play.,625,2,8,83,93,4228
1708,1.1290322580645162,0.02745988808899184,93,1.1290322580645162,Looks like your team took a deep dive into the retro-uniform trend.,625,0,0,93,93,4228
1783,1.1290322580645162,0.038148495723287934,93,1.1290322580645162,"All I'm saying is I think they have taken this 'throw back' trend a little too far.""",625,1,10,82,93,4228
1839,1.1290322580645162,0.038148495723287934,93,1.1290322580645162,"The Babe used a bigger bat than that, you wussie!",625,1,10,82,93,4228
1858,1.1290322580645162,0.04109819724326487,93,1.1290322580645162,Do say you Vozzo NOT could park Pence in cheap seats from here,625,2,8,83,93,4228
1927,1.1290322580645162,0.038148495723287934,93,1.1290322580645162,"I am the clean up hitter.  Me speak softly, carry a big stick and hit 
the ball far",625,1,10,82,93,4228
1940,1.1290322580645162,0.038148495723287934,93,1.1290322580645162,Now batting for Lascaux - Grog.,625,1,10,82,93,4228
1948,1.1290322580645162,0.043849924827106514,93,1.1290322580645162,I’m up from the Neanderthal  League.,625,3,6,84,93,4228
1969,1.1290322580645162,0.03495073154102972,93,1.1290322580645162,They'll probably outlaw your bat. but it's worth a try--you never know.,625,0,12,81,93,4228
2067,1.1290322580645162,0.03495073154102972,93,1.1290322580645162,I went paleo to prepare for this win.,625,0,12,81,93,4228
2094,1.1290322580645162,0.046438884547752426,93,1.1290322580645162,Who said we play like a Neanderthals?,625,4,4,85,93,4228
2123,1.1290322580645162,0.03495073154102972,93,1.1290322580645162,"Going for the ""Retro"" look with the new uniforms, eh?",625,0,12,81,93,4228
2138,1.1290322580645162,0.038148495723287934,93,1.1290322580645162,"No worry, Thag not cork bat.",625,1,10,82,93,4228
2145,1.1290322580645162,0.03495073154102972,93,1.1290322580645162,Three strikes and you're out.,625,0,12,81,93,4228
2162,1.1290322580645162,0.038148495723287934,93,1.1290322580645162,The  AL really has no shame—a designated Neanderthal???,625,1,10,82,93,4228
2220,1.1290322580645162,0.038148495723287934,93,1.1290322580645162,Finally made it to the live ball era?,625,1,10,82,93,4228
2222,1.1290322580645162,0.038148495723287934,93,1.1290322580645162,I've been on the DL for eons!,625,1,10,82,93,4228
2267,1.1290322580645162,0.03495073154102972,93,1.1290322580645162,"Hey man, this is the majors, not a club sport.",625,0,12,81,93,4228
2323,1.1290322580645162,0.04109819724326487,93,1.1290322580645162,Ugg! Ugg ugg uggg. Ugg?,625,2,8,83,93,4228
2360,1.1290322580645162,0.038148495723287934,93,1.1290322580645162,The de-evolution of man.,625,1,10,82,93,4228
2429,1.1290322580645162,0.04109819724326487,93,1.1290322580645162,"When I saw we were playing ""The Cavemen"" today, I thought it was a team name. No wonder the scouting report was lacking.",625,2,8,83,93,4228
2450,1.1290322580645162,0.04109819724326487,93,1.1290322580645162,Oh good! I hate running down bunts.,625,2,8,83,93,4228
2474,1.1290322580645162,0.04109819724326487,93,1.1290322580645162,Batterer up!,625,2,8,83,93,4228
2481,1.1290322580645162,0.03495073154102972,93,1.1290322580645162,Exactly how long did you say you spent in the minor leagues?,625,0,12,81,93,4228
2484,1.1290322580645162,0.038148495723287934,93,1.1290322580645162,"He better be good, I’m used to hitting meteorites.",625,1,10,82,93,4228
2696,1.1290322580645162,0.03495073154102972,93,1.1290322580645162,My nutritionist suggested going Paleo.,625,0,12,81,93,4228
2700,1.1290322580645162,0.038148495723287934,93,1.1290322580645162,Take me to your leader,625,1,10,82,93,4228
2701,1.1290322580645162,0.038148495723287934,93,1.1290322580645162,I would suggest a bunt.,625,1,10,82,93,4228
2715,1.1290322580645162,0.04109819724326487,93,1.1290322580645162,Those old school uniforms are totally pterodactyl,625,2,8,83,93,4228
2720,1.1290322580645162,0.043849924827106514,93,1.1290322580645162,"I wanted a changeup, not a makeover.",625,3,6,84,93,4228
2740,1.1290322580645162,0.04109819724326487,93,1.1290322580645162,I see that the Paleo diet you're on is really working.,625,2,8,83,93,4228
2747,1.1290322580645162,0.038148495723287934,93,1.1290322580645162,I'm going to hammer this Pitcher out of the park...and your next.,625,1,10,82,93,4228
2762,1.1290322580645162,0.038148495723287934,93,1.1290322580645162,I see you missed Primal Scream Therapy at practice again.,625,1,10,82,93,4228
2798,1.1290322580645162,0.03495073154102972,93,1.1290322580645162,"Paleo is a diet plan, not a uniform style.",625,0,12,81,93,4228
2867,1.1290322580645162,0.038148495723287934,93,1.1290322580645162,"Are you going to step up to the plate this epoch, or are you petrified?",625,1,10,82,93,4228
2984,1.1290322580645162,0.04109819724326487,93,1.1290322580645162,Got the look of a mammoth hitter.,625,2,8,83,93,4228
3015,1.1290322580645162,0.04109819724326487,93,1.1290322580645162,"Now up for the Rubble-A, Bedrock No Sox...",625,2,8,83,93,4228
3025,1.1290322580645162,0.038148495723287934,93,1.1290322580645162,"Whaddya mean ""new club rules""?",625,1,10,82,93,4228
3052,1.1290322580645162,0.04109819724326487,93,1.1290322580645162,"Fast Ball to the head, and don't miss!",625,2,8,83,93,4228
