caption,count,funny,precision,rank,score,somewhat_funny,target_id,unfunny,contest
I wish you’d come in when it was just a chip on your shoulder.,141,41,0.07161766200570112,1,1.8368794326241136,36,4474,64,650
The good news? You’re not delusional.,139,29,0.06789799224932093,2,1.6762589928057554,36,4112,74,650
You were better off with a chip on your shoulder.,142,28,0.06595562461689165,3,1.676056338028169,40,275,74,650
"I treat depression and obsession, but not compression.",148,30,0.06530263426865965,4,1.6689189189189189,39,3920,79,650
Tell me about your first crush.,124,19,0.06611495823572587,5,1.6370967741935485,40,2871,64,650
I could begin with the obvious--but why don't you go first?,142,23,0.06279768641902439,6,1.6338028169014085,44,3670,75,650
Last week it was a monkey on your back.,147,24,0.061873367010009,7,1.6326530612244898,45,3463,77,650
"So, the last thing you remember was a roadrunner and a coyote?",132,25,0.06836149763775158,8,1.6287878787878791,33,3801,74,650
And you think this is the cause of your erectile dysfunction?,125,22,0.06889355979077551,9,1.6159999999999999,33,3279,70,650
"Well, let's start with the obvious.",155,25,0.06105947308774889,10,1.6064516129032258,42,3419,87,650
"Well, usually when someone tells me that, it's a metaphor.",137,21,0.06332498816063795,11,1.6058394160583942,41,5767,75,650
This could be the main reason for your erectile dysfunction.,139,26,0.06666044051520421,12,1.6043165467625902,31,3317,81,650
"I'm just here to give you the tools, you'll have to do the heavy lifting.",156,22,0.058006222520296975,13,1.6025641025641026,50,1838,84,650
Your time's almost up.  Are you sure there isn't anything else you want to get off your chest?,118,17,0.06716440712823232,14,1.6016949152542372,37,6081,64,650
No wonder you're unable to have an erection.,151,29,0.06454377705456774,15,1.5960264900662253,32,7213,90,650
Otherwise OK?,136,25,0.06713777697402536,16,1.5955882352941178,31,6296,80,650
"On the plus side, you’re using the word ‘literally’ correctly.",120,22,0.07149448406112974,17,1.5916666666666666,27,548,71,650
What's your gut feeling?,122,19,0.06762474697191312,18,1.5901639344262295,34,6493,69,650
Let's begin our session with some deep breathing.,136,22,0.06473558438909481,19,1.5882352941176472,35,6134,78,650
can you feel the pea now?,145,25,0.06386813439911743,20,1.5862068965517242,35,1294,85,650
You're in luck. My next patient thinks he's Superman.,127,20,0.06655497287719665,21,1.5826771653543308,34,7327,73,650
The good news is that this problem is not in your head.,141,19,0.060524579789892737,22,1.5815602836879432,44,3348,78,650
"Now, imagine it's Styrofoam.",150,23,0.06077059220509121,23,1.58,41,750,86,650
I mean besides that.,151,22,0.059754528100352575,24,1.5761589403973508,43,413,86,650
...and suddenly it hit me.,139,23,0.06456257639768552,25,1.5755395683453235,34,6529,81,650
"""You know, for the first time in my career I think the problem might not be your mother""",136,19,0.062301845303592174,26,1.5735294117647058,40,4640,77,650
You might be more comfortable if you take off your shoes.,143,21,0.061570687191841014,27,1.573426573426573,40,4528,82,650
"It's $200 for the session, plus $2,000 for the forklift.",150,25,0.06228078633102217,28,1.5733333333333333,36,3924,89,650
"Thus far, this is the only effective treatment we've found for erections lasting longer than 4-hours.",131,25,0.06941626786574802,29,1.5725190839694656,25,4571,81,650
I see you've gained weight but it's good that you've got a handle on it.,152,31,0.06574371012023789,30,1.5723684210526316,25,7293,96,650
Seems to me that you're the underlying issue.,140,18,0.06009828977603121,31,1.5714285714285714,44,819,78,650
"Ask yourself, does it spark joy?",137,29,0.07011278746932842,32,1.5693430656934306,20,251,88,650
You ripped off the ankle bracelet - what did you expect?,130,21,0.0663724529383932,33,1.5692307692307692,32,1376,77,650
The first step is acceptance.,132,19,0.06380014283337343,34,1.568181818181818,37,7112,76,650
Why do you think you can't get an erection?,125,21,0.06847274004326287,35,1.568,29,2854,75,650
Can you think of anything concrete that might be causing your anxiety?,155,27,0.0620953459865465,36,1.5677419354838709,34,2038,93,650
I think I know the cause of your erectile dysfunction.,138,21,0.06336630376036764,37,1.5652173913043481,36,917,81,650
Any other pressing matters to discuss?,140,17,0.05929589803444791,38,1.5642857142857145,45,3952,78,650
"If you upgrade to Premium Care, I can get that removed.",140,21,0.06266660366883524,39,1.5642857142857145,37,5085,81,650
I can't help you if you don't tell me what's wrong.,133,23,0.06695657810407085,40,1.56390977443609,29,5555,81,650
"So, what brings you in today?",162,24,0.058047201907697826,41,1.5617283950617284,43,4929,95,650
You seem obsessed with your weight.,141,27,0.06704713695667584,42,1.5602836879432624,25,1464,89,650
And how long since your last erection?,134,21,0.0648809533093393,43,1.5597014925373134,33,1698,80,650
"You can't change the fact that it's there, but you CAN change your reaction to it.",143,15,0.0566840160347535,44,1.5594405594405594,50,6620,78,650
First I applaud your proper use of “literally”.,126,21,0.06719368409052927,45,1.5555555555555556,27,483,78,650
Any other symptoms?,135,17,0.061009262331954923,46,1.5555555555555556,41,4630,77,650
We'll pick this up next week.,137,18,0.06122383952436593,47,1.5547445255474452,39,2957,79,650
"No, in this instance I agree - it’s not all in your head.",157,21,0.05743361665108058,48,1.5541401273885351,45,1462,91,650
Take an anvil and call me in the morning.,132,24,0.06828455005012983,49,1.5530303030303032,25,4074,83,650
I can't help you if you wont tell me what's bothering you.,132,20,0.06480847237462826,50,1.5530303030303032,33,6942,79,650
Let's pick this up again next week.,152,21,0.058882850715794015,51,1.5526315789473684,42,429,88,650
"It's a lamp shade, for goodness sake.  Just lift it off you.",143,27,0.06633629813119646,52,1.5524475524475525,25,6992,91,650
"In my opinion, you're putting too much pressure on yourself.",143,18,0.059279565986899416,53,1.5524475524475525,42,7452,82,650
You seem depressed.,142,22,0.06287605061832166,54,1.5492957746478873,34,398,86,650
Depressed in what way?,155,17,0.05506864238263467,55,1.5483870967741935,51,1120,87,650
But does it spark joy?,115,17,0.06903881690501715,56,1.5478260869565217,29,4489,69,650
Maybe it’s not all in your mind.,137,19,0.0621384371494222,57,1.5474452554744529,37,2475,81,650
"I said to take an Advil""",130,23,0.06829688816338009,58,1.5461538461538462,25,3222,82,650
Sorry about that. It was supposed to hang ominously above you.,132,16,0.0611816296533229,59,1.5454545454545454,40,270,76,650
Now don't all your other problems seem trivial?,132,17,0.062119660559602975,60,1.5454545454545454,38,2120,76,650
"So let me get this straight. You clicked ""Accept"" without reading the terms and conditions?",121,22,0.0713892059963015,61,1.5454545454545454,22,2718,77,650
"Sometimes therapy only works under pressure""",132,14,0.059261040870275776,62,1.5454545454545454,43,4284,74,650
"I can help you, but it’s you who must do the heavy lifting.",145,18,0.05870514538208847,63,1.5448275862068963,43,2933,84,650
My first question is how you got in here.,160,21,0.056667736070190385,64,1.54375,45,5282,94,650
"I sleep OK, but I have trouble some mornings getting up.",142,17,0.0588091793186457,65,1.5422535211267605,43,1534,82,650
I've had too many people leave without paying.,142,21,0.062113445046952674,66,1.5422535211267605,35,6319,85,650
It's just until we verify insurance.,135,16,0.06018486626611086,67,1.5407407407407407,40,5408,78,650
Hmmm. So roughly how long has it been since you've been unable to achieve an erection?,137,20,0.06303355215186017,68,1.54014598540146,34,4862,82,650
"Well we can talk about it, or we can just get a crane.",141,19,0.060826568023796886,69,1.5390070921985817,38,4472,84,650
Let's start with your weight problem.,140,23,0.06444538808796367,70,1.5357142857142858,29,2129,88,650
I suggest not starting your day watching the news.,146,19,0.05925404945743211,71,1.5342465753424657,40,3253,87,650
"Yes, normally it is a metaphor.",154,19,0.05579014054250913,72,1.5324675324675323,43,5587,92,650
Let's start by getting a belt with a different buckle,139,21,0.06319455758670213,73,1.5323741007194245,32,367,85,650
Define 'pressing concern'.,128,16,0.06268427558416713,74,1.53125,36,3225,76,650
"Would you describe your anxiety as heavy, paralyzing, or crushing?",128,17,0.06365807019989532,75,1.53125,33,6651,77,650
I think your delusions are becoming more concrete.,160,19,0.055316325197298975,76,1.53125,46,7510,94,650
My mistake; I assumed you were speaking figuratively,162,19,0.0548071323364033,77,1.530864197530864,48,6497,94,650
How bad is the pain…on a scale of 1 to 16 tons?,115,11,0.062152759732777924,78,1.5304347826086957,37,3617,65,650
This may take more than one session.,132,22,0.06667770606556822,79,1.5303030303030305,26,2047,84,650
"I'm Jungian but more importantly, I'm also a certified crane operator.",121,20,0.06950670356842521,80,1.5289256198347108,24,7557,76,650
"When you made the appointment, I just assumed  you were speaking metaphorically.",157,16,0.0538873541197813,81,1.5286624203821657,51,3334,90,650
"Now, try to visualize a crane.",144,20,0.0607071482778142,82,1.5277777777777777,36,3608,87,650
"We could attempt psychoanalysis, but I'd actually recommend a crane.",131,17,0.06349411435109159,83,1.5267175572519085,33,3873,80,650
"Yes, but what would you say is your most pressing issue?",135,12,0.056456668375398415,84,1.525925925925926,47,2697,76,650
"When you said ""literally"" over the phone I thought you meant figuratively.",137,18,0.06003817660759923,85,1.5255474452554745,34,299,84,650
Let's leave it there for now.,158,19,0.056575502453953035,86,1.5253164556962024,43,6689,95,650
“Your hour is up. Can I call you a crane?”,141,20,0.06170620350115235,87,1.5248226950354609,34,7227,87,650
"I noticed you shaved your head, you want to talk about that?",141,16,0.05832998422896026,88,1.5248226950354609,42,7475,83,650
My childhood was fine. Please just call 911.,162,20,0.056207777588864215,89,1.5246913580246917,43,5492,98,650
"Unfortunately we’ve run out of time. 
Let’s pick that up next week.",147,21,0.060542490020467625,90,1.5238095238095235,35,2785,91,650
"It'd be a coincidence but, yes, it's possible you're having a heart attack.",147,18,0.058187878613434274,91,1.5238095238095235,41,3268,88,650
Perhaps I wasn't clear. Our time is up.,147,19,0.05898319402717452,92,1.5238095238095235,39,7365,89,650
"When you said you've been under pressure, had put on a ton of weight and were having trouble getting out of bed in the morning, I suspected something else.",151,22,0.0600473963542676,93,1.52317880794702,35,6336,94,650
"Murray, sometimes a two-ton anvil is just a two-ton anvil.",130,20,0.06571961604166325,94,1.5230769230769232,28,6777,82,650
I've seen bigger,153,18,0.05647372553045427,95,1.5228758169934642,44,556,91,650
"But no tingling or shortness of breath, right?",132,16,0.06127822381343918,96,1.5227272727272727,37,3852,79,650
Anything pressing you’d like to discuss?,136,14,0.05808013373911209,97,1.5220588235294117,43,3454,78,650
"Well, why do YOU think it's there?",140,18,0.05641559297585904,98,1.5214285714285714,34,4745,88,650
So you say you fell victim to a pyramid scheme?,142,21,0.062189843637033976,99,1.5211267605633805,32,4335,88,650
Could you be more concrete?,144,24,0.0638452732782069,100,1.5208333333333333,27,3290,93,650
It can be so hard to get over your first crush.,146,24,0.06315524961037128,101,1.5205479452054795,28,7496,94,650
"To begin your therapy, I want you to know that your feelings are real.",135,16,0.06026645446389416,102,1.5185185185185186,38,1191,81,650
"Now, imagine it's a feather ...",137,17,0.06050292813674036,103,1.5182481751824817,37,1900,83,650
I know it took a lot for you just to come in today.,137,15,0.05870195822294193,104,1.5182481751824817,40,2294,81,650
That's the worst case of writer's block I've ever seen.,114,18,0.0707408136362509,105,1.5175438596491229,23,995,73,650
Side effects may include difficulty breathing.,143,17,0.058590041416027076,106,1.5174825174825175,40,2821,86,650
How long have you been struggling with your weight?,149,22,0.060684189944930536,107,1.516778523489933,33,326,94,650
"Good. Now you are using the word ""literally""  correctly.",155,21,0.05814824294415843,108,1.5161290322580645,38,5073,95,650
"Once again Robert, It's not guilt, it's a concrete pylon.",124,20,0.06821299136448968,109,1.5161290322580645,24,5627,80,650
"If you prefer, we can tell your parole officer you are ready for an ankle bracelet.",130,17,0.062956966670175,110,1.515384615384615,33,1132,79,650
And you're sure you saw a beeping roadrunner right before this?,130,19,0.06482361314415645,111,1.515384615384615,29,3949,82,650
"Yes, it probably is more effective than a condom.",134,19,0.06332630158234448,112,1.5149253731343284,31,2092,84,650
I just provide the tools. YOU have to do the heavy lifting.,134,14,0.058729176896392864,113,1.5149253731343284,41,4673,79,650
Visualize a crane...,142,17,0.058904794346632386,114,1.5140845070422535,39,6852,85,650
"Yes Carl, that's the proper usage of 'literally'",142,23,0.06378961923558826,115,1.5140845070422535,27,7312,92,650
"You say you have a ton of issues, but I see just one.",146,21,0.060883358261236586,116,1.5136986301369864,33,7429,92,650
"For most of my patients, this is just a metaphor.",152,20,0.05828593394903129,117,1.5131578947368418,38,861,94,650
"Frankly, I’m surprised to hear about the headaches.",123,20,0.06865538383680943,118,1.5121951219512195,23,5410,80,650
I think I’ve identified the cause of your erectile dysfunction.,131,17,0.06259828416745454,119,1.5114503816793894,33,2923,81,650
Really? Does this look like a metaphor to you?,133,18,0.0627977449674652,120,1.5112781954887218,32,7152,82,650
"First of all, your under too much pressure.",147,18,0.058215108657796874,121,1.5102040816326532,39,267,89,650
I see you've traded in the albatross.,147,17,0.05740915359002902,122,1.5102040816326532,41,5696,89,650
It seems to me that your problem is your weight.,128,17,0.0637146669009361,123,1.5078125,31,1627,80,650
I can't remove it until you've met your deductible,132,19,0.06407422912516611,124,1.5075757575757576,29,337,84,650
How's the restless leg syndrom now?,132,16,0.06130681507770965,125,1.5075757575757576,35,1840,81,650
You seem to be in the same place you were when we ended our last session.,138,18,0.061062194884324364,126,1.5072463768115942,34,3807,86,650
You wanted the other Dr. Crane.,140,17,0.059542991085456326,127,1.5071428571428571,37,1077,86,650
"When you described your problem over the phone, I assumed you were speaking metaphorically.",144,16,0.05746230122726315,128,1.5069444444444444,41,915,87,650
Looks like you put on some weight.,150,19,0.05811865258054232,129,1.5066666666666666,38,5959,93,650
I'm sorry we're out of time. We'll pick it up next week.,158,16,0.05368530548255397,130,1.5063291139240509,48,2404,93,650
Anything you’d like to get off your chest?,121,16,0.06547555107194407,131,1.5041322314049588,29,3761,76,650
Have you considered switching to similes?,127,18,0.06506706350496995,132,1.5039370078740155,28,587,81,650
I don't think it's all in your head.,133,15,0.06002207780029796,133,1.5037593984962403,37,6169,81,650
"You know I can't help you if you won't tell me what's wrong, Steve.",135,20,0.06384931999048657,134,1.5037037037037038,28,4238,87,650
"Well, I think I’ve figured out what’s been weighing on you",141,12,0.054785307671808885,135,1.50354609929078,47,911,81,650
You never forget your first crush.,143,20,0.061076496377440566,136,1.5034965034965035,32,2865,91,650
I think it's time that we begin discussing the possibility that it's not your imagination.,143,18,0.05944200785021012,137,1.5034965034965035,36,3877,89,650
"In the future, metaphors will be just fine""",151,19,0.057829903723920564,138,1.5033112582781456,38,3853,94,650
"Sorry, dear, but it's what the doctor ordered for an erection lasting more than four hours.",140,22,0.0637150645867436,139,1.5,26,445,92,650
You also mentioned a monkey on your back?,138,16,0.05930768822842537,140,1.5,37,1525,85,650
I think in your case it's not just a feeling.,156,20,0.057159102027431276,141,1.5,38,2245,98,650
"A metaphor would have sufficed, Mr. Richards.",126,14,0.06146362971528591,142,1.5,35,2309,77,650
We're making progress...last week it was the weight of the world.,122,13,0.061865941049740136,143,1.5,35,2310,74,650
When you said you had a weight problem I must say I pictured something different.,136,16,0.059956411182041786,144,1.5,36,2638,84,650
"And what made you yell, ""More cowbell!"" in the first place?",122,20,0.06910698691273669,145,1.5,21,3082,81,650
Why do YOU think you can't get off the couch?,132,17,0.062246478644432064,146,1.5,32,3398,83,650
What do you consider your most pressing problem?,148,18,0.05792578193291024,147,1.5,38,3556,92,650
"Don’t exaggerate, it’s a lamp shade for God’s sake.",140,21,0.0629033745706389,148,1.5,28,3962,91,650
The good news is that you're absolutely not hallucinating.,124,12,0.06005068232702484,149,1.5,38,5468,74,650
"Well, on the up side,  we seem to have got rid of the monkey on your back.",120,14,0.0637308767385162,150,1.5,32,5998,74,650
Did you ever consider a forklift instead of analysis?,138,20,0.06277378413149942,151,1.5,29,6582,89,650
Would you like to get anything off your chest?,138,17,0.0601929265428846,152,1.5,35,6856,86,650
Sometimes a crushing weight on your chest is just a crushing weight on your chest.,151,17,0.056282300265863484,153,1.4966887417218544,41,964,93,650
You'll feel better once you get it off your chest.,145,21,0.061217013895884936,154,1.4965517241379311,30,1987,94,650
Well you said you wanted non-pharmaceutical options.,143,13,0.05514423828530742,155,1.4965034965034965,45,57,84,650
"Well, you didn't like the inkblots at first either.",143,18,0.05944200785021012,156,1.4965034965034965,35,6194,90,650
Have you given any thought to leaving the Trump Administration?,141,16,0.05836692922425879,157,1.49645390070922,38,794,86,650
"So, what brings you here?",141,17,0.0592285028484036,158,1.49645390070922,36,2121,88,650
"Can you talk to me about your most pressing 
issues?",141,21,0.0625562470104963,159,1.49645390070922,28,5810,92,650
This could explain your ED.,135,22,0.06555800715606475,160,1.4962962962962962,23,4310,90,650
It doesn't spark joy but it's hard to throw away.,133,18,0.06280456450866652,161,1.4962406015037597,30,2052,85,650
"You and I both know that the block isn't really the problem, right?",133,13,0.05809309331030262,162,1.4962406015037597,40,5114,79,650
What was that pressing matter you wanted to discuss?,127,13,0.06007329580100785,163,1.4960629921259845,37,4708,77,650
I see you spent the weekend with your mother.....,123,15,0.06362582180659643,164,1.4959349593495934,31,4336,77,650
My diagnosis: obsessive-compressive disorder.,160,22,0.05745990877431152,165,1.49375,35,1388,103,650
"Well,  at least we've got a handle on it now.",134,18,0.062444021531415386,166,1.492537313432836,30,5709,86,650
...and at what point did you realize it was too much cowbell?,130,17,0.06296789448580452,167,1.4923076923076923,30,670,83,650
"Doc, is this is the only way to cure an erection lasting longer than four hours?",130,21,0.0666483163589514,168,1.4923076923076923,22,4886,87,650
Describe this pressure. Are you feeling it now?,126,19,0.06642435176524196,169,1.4920634920634919,24,3816,83,650
The judge ruled that an electronic bracelet was too risky...,122,10,0.058484103935465215,170,1.4918032786885247,40,7018,72,650
We'll get to that.,122,17,0.06609668215063094,171,1.4918032786885247,26,7434,79,650
It makes that chip on your shoulder seem insignificant.,159,17,0.05417666123365957,172,1.490566037735849,44,4811,98,650
I think you are regressing. Last visit it was just a can of worms.,147,17,0.057409153590028975,173,1.4897959183673468,38,5668,92,650
You seem to be getting enough iron.,145,16,0.0579975899381281,174,1.4896551724137932,37,1546,91,650
I preferred the monkey on my back.,143,18,0.05943621399982836,175,1.4895104895104896,34,1318,90,650
"If it doesn't bring you joy, just get rid of it.",143,14,0.05602402439735345,176,1.4895104895104896,41,6132,87,650
Are your hiccups gone?,139,16,0.05898288708701008,177,1.4892086330935252,36,4715,87,650
I believe the pressure you are feeling is very real.,139,19,0.06157738393911288,178,1.4892086330935252,30,5032,90,650
Why is it always me who has to get up when the phone rings?,137,17,0.0605158768641517,179,1.4890510948905111,33,4905,87,650
"Sorry, that was a lot to lay on you all at once.",137,18,0.06139636438416321,180,1.4890510948905111,31,6927,88,650
So you say you have trouble getting up in the morning...,135,13,0.0574631053471515,181,1.4888888888888892,40,4839,82,650
"And nice use of the word 'literally,' by the way.",133,13,0.05905820947834279,182,1.4887218045112782,37,4773,82,650
It was a gift from my mother,133,19,0.0636983354535387,183,1.4887218045112782,27,5464,87,650
"Sorry, I'm afraid that your insurance has denied the metaphor.",131,15,0.060693208487579475,184,1.4885496183206106,34,6990,82,650
"To be clear, I was asking what was weighing on your mind",129,13,0.059385866069940174,185,1.4883720930232558,37,603,79,650
What did you THINK Panini Therapy would be like?,164,24,0.05769255333760725,186,1.4878048780487805,32,975,108,650
"In the dream, I was Wile E. Coyote...",121,16,0.06546685751138373,187,1.487603305785124,27,5210,78,650
Interesting - usually when clients first come to see me they have a lot on their minds.,119,12,0.06185835276379156,188,1.487394957983193,34,7373,73,650
I said treat yourself with Advil.,154,25,0.06127761013920618,189,1.4870129870129871,24,6351,102,650
Please.  I get the symbolism.,142,14,0.0549569763825972,190,1.4859154929577465,40,2587,88,650
Where would you like to start?,142,17,0.058904794346632386,191,1.4859154929577465,35,4742,90,650
You seem to be under a lot of pressure,140,20,0.06206924678349768,192,1.4857142857142858,28,6063,92,650
"OK, Let’s move on to more pressing matters.",138,19,0.06191307061824298,193,1.4855072463768115,29,5609,90,650
Shall we start with the obvious?,136,13,0.05715218200769257,194,1.4852941176470589,40,648,83,650
Just let me know when you're comfortable and we can start,136,15,0.059027424405844575,195,1.4852941176470589,36,6933,84,650
It appears we have tons to discuss.,136,13,0.05715218200769257,196,1.4852941176470589,40,7451,83,650
"You need a crane operator, not a therapist.",134,17,0.06152868250523449,197,1.4850746268656716,30,5778,86,650
That’s all the time we have. We’ll pick this up next week.,132,10,0.05534662343795633,198,1.4848484848484849,44,2891,78,650
Anything else you want to get off your chest?,132,17,0.062232400508179526,199,1.4848484848484849,30,3766,85,650
"How long, would you say, have you had erectile dysfunction?",126,19,0.06641297156154942,200,1.4841269841269842,23,4153,84,650
"You understand that treating a metaphor can take a very long time, right?",155,25,0.0609620117756818,201,1.4838709677419355,25,5052,105,650
...the good news is it’s not a heart attack,120,12,0.06147502206589165,202,1.4833333333333334,34,3038,74,650
"Your constant need for attention is what we've been working on for months, Alan. And I know it's made out of styrofoam.",149,19,0.05839937280973824,203,1.483221476510067,34,1332,96,650
Good news - you asphyxiated that monkey on your back.,147,18,0.058204218168756115,204,1.4829931972789117,35,403,93,650
What do YOU think the problem is?,143,16,0.057743396998204334,205,1.4825174825174825,37,4584,90,650
And yet you say there is nothing you want to get off your chest.,139,18,0.06071251593226833,206,1.4820143884892083,30,905,90,650
"You're right, of course. It's not all in your head.",137,17,0.06050292813674035,207,1.4817518248175183,32,5366,88,650
Let's start with the obvious -- your socks don't match.,137,20,0.0631080892912065,208,1.4817518248175183,26,5431,91,650
I’d like to refer you to a colleague of mine. Her name is Dr. Crane.,137,24,0.066422885828681,209,1.4817518248175183,18,7226,95,650
What I'm hearing is that you're under a lot of pressure.,156,18,0.0556718153214645,210,1.4807692307692308,39,4083,99,650
"No, it’s not your imagination.",129,13,0.05937005303116431,211,1.4806201550387597,36,2889,80,650
It looked a lot smaller on Amazon Prime.,129,16,0.06235523466355105,212,1.4806201550387597,30,5702,82,650
I charge a flat fee.,127,16,0.06309359406783605,213,1.4803149606299213,28,5761,82,650
I suppose I'll be charging you a flat fee.,125,13,0.0607480253230108,214,1.48,34,4042,78,650
"In these dreams you’ve been having, are you the roadrunner or the coyote?",119,13,0.06298009114712297,215,1.4789915966386555,31,2761,74,650
"So, anything in particular you would like to discuss today?",119,14,0.0641008715556752,216,1.4789915966386555,29,5311,76,650
"Well, it's definitely not all in your head...",117,11,0.061418407963455775,217,1.4786324786324787,34,4600,72,650
But how does it make you feel?,140,19,0.06122075797367455,218,1.4785714285714286,29,577,92,650
How's that erection now?,140,17,0.05951832794218617,219,1.4785714285714286,33,912,90,650
"So, what's holding you back?",161,16,0.052931865059190425,220,1.4782608695652173,45,6345,99,650
Do you want to tell me what’s troubling you?,138,14,0.057466331681081985,221,1.4782608695652173,38,7186,86,650
"You're my only patient who uses ""literally"" correctly.",136,15,0.059010460064524026,222,1.4779411764705883,35,2872,86,650
So...what seems to be the problem today?,113,12,0.06421920564515901,223,1.4778761061946903,30,300,71,650
Well I can see you're under a lot of pressure.,134,16,0.0605926088529735,224,1.4776119402985075,32,2466,86,650
