caption,count,funny,precision,rank,score,somewhat_funny,target_id,unfunny,contest
Let’s begin with you telling me about what’s weighing on you,126,8,0.052649623618986716,1918,1.3253968253968254,25,6470,92,650
Would you feel different sitting up?,123,7,0.053525495511753104,1919,1.3252032520325203,24,173,91,650
At least we got the weight off your shoulders,123,8,0.053525495511753104,1920,1.3252032520325203,24,766,91,650
"Sam, I'm happy I got that off my chest.",123,10,0.05596015289854298,1921,1.3252032520325203,20,6382,93,650
I see you've put on some weight.,120,9,0.05695654149478899,1922,1.325,19,493,91,650
Sisyphus could at least roll his burden around...,120,8,0.05444203866709707,1923,1.325,23,1949,89,650
I think we all feel the Trump Presidency is like that....,120,10,0.05695654149478899,1924,1.325,19,4340,91,650
I'm still finding it really hard to move on.,160,9,0.045686586116095364,1925,1.325,34,7261,117,650
"Well, Neal, that's better than the elephant of last time.",157,8,0.045378046636816535,1926,1.32484076433121,35,1247,114,650
You just take on too much.,154,5,0.0430986346444763,1927,1.324675324675325,40,1343,109,650
At least it is off your shoulders. Were making good progress.,154,9,0.04687240189613191,1928,1.324675324675325,32,3254,113,650
I'm sorry to have kept you weighting.,154,8,0.04595802021071944,1929,1.324675324675325,34,5780,112,650
"Doc, the truth hurts more than I expected",151,9,0.04749780417759232,1930,1.3245033112582782,31,59,111,650
We may need to increase your dosage.,151,13,0.05108074279701808,1931,1.3245033112582782,23,1496,115,650
I can see how that might weigh on you.,151,9,0.04749780417759232,1932,1.3245033112582782,31,2443,111,650
Let me explain how displacement works.,151,12,0.0502089838967546,1933,1.3245033112582782,25,6231,114,650
At least this weight is now off your shoulders.,148,8,0.047182246537511865,1934,1.3243243243243243,32,339,108,650
"So, what I hear you saying is that you are relieved to have that weight off your shoulders, but now for some reason you can't get an erection?",148,7,0.046197789178372126,1935,1.3243243243243243,34,805,106,650
You'll appreciate it more once you get it off your chest.,111,8,0.05746795163156267,1936,1.3243243243243243,20,3757,83,650
"Errr, something you want to get off your chest?",148,10,0.04909197200195792,1937,1.3243243243243243,28,4003,110,650
"It's always the same, Hank.  You never tell me anything.",148,8,0.047182246537511865,1938,1.3243243243243243,32,4434,108,650
Yes.. but tell me more about your childhood,148,6,0.04519189154718003,1939,1.3243243243243243,35,4650,106,650
It's time for you to move on.,148,9,0.04814657881598428,1940,1.3243243243243243,30,5582,109,650
Weighting for Godot,148,11,0.050019499981489766,1941,1.3243243243243243,26,6849,111,650
"Now that you've got that weight off your shoulders, we need to work on your core.",145,9,0.048820139268035176,1942,1.3241379310344827,29,678,107,650
I'll bet you were glad to find out you didn't have angina.,145,11,0.05074423001067613,1943,1.3241379310344827,25,4279,108,650
"It may or may not improve your posture, but it should at least keep you from wandering off.",145,9,0.048820139268035176,1944,1.3241379310344827,29,6584,107,650
"Now, tell me what's weighing on you today...",142,6,0.04639570841715111,1945,1.323943661971831,34,1238,102,650
"So sorry, but I only deal with crushing emotional weight.",142,7,0.04746000295402807,1946,1.323943661971831,31,2127,103,650
I'm going to refer you to a colleague that specializes in weighty issues.,142,8,0.048500948457359055,1947,1.323943661971831,30,3067,104,650
"I had to take a call, sorry for the wait.",142,8,0.048500948457359055,1948,1.323943661971831,30,6066,104,650
It’s time to stop reading The Unbearable Lightness of Being.,142,7,0.04746000295402807,1949,1.323943661971831,32,6778,102,650
"After many sessions together, there still seems to be something weighing you down.",142,8,0.048500948457359055,1950,1.323943661971831,30,6997,104,650
"So, you were saying last week you no longer feel the weight of the world is on your shoulders?",142,13,0.05340217791063048,1951,1.323943661971831,20,7387,109,650
"You know, I have a real visual sense of the crushing weight you describe.",139,12,0.05423934659086379,1952,1.3237410071942446,19,2814,107,650
"You only seem a little depressed, maybe a centimeter or two.",139,8,0.04919943745437834,1953,1.3237410071942446,29,3637,101,650
What do you fear will happen when you stop breathing?,139,10,0.05127488152046683,1954,1.3237410071942446,25,5639,104,650
"Usually I start my clients with deep breathing techniques, but in your case maybe visualization would be best?",139,6,0.04703249745353378,1955,1.3237410071942446,33,6005,100,650
I see that you are not speaking metaphorically.,139,7,0.04812816463643688,1956,1.3237410071942446,31,6375,101,650
"I think ""Ball and Chain"" might be the wrong way to characterize your feelings about your marriage.",136,10,0.052062423715104916,1957,1.3235294117647058,24,1125,101,650
"This ""Mueller"" who calls you, does he give his first name?",136,10,0.052062423715104916,1958,1.3235294117647058,24,1866,102,650
"Get something off my chest"" is so cliche. I need you to strive for originality",136,6,0.047694508233092896,1959,1.3235294117647058,32,3239,98,650
"Overall, how would you describe your mood?",136,9,0.0510055242225534,1960,1.3235294117647058,26,3303,100,650
"Yes, I think it would help to get it off your chest.",136,9,0.0510055242225534,1961,1.3235294117647058,26,3696,101,650
You really should get it off your chest,136,8,0.0499262560116803,1962,1.3235294117647058,28,4355,100,650
You say this has been going on since 2016?,136,9,0.0510055242225534,1963,1.3235294117647058,26,4410,101,650
"I see what you mean, but how do you feel about it?",136,6,0.047694508233092896,1964,1.3235294117647058,32,5425,98,650
The good news is you don’t have E.D.,136,10,0.052062423715104916,1965,1.3235294117647058,24,6506,102,650
I don't think so; COPD is when an elephant is sitting on you.,133,10,0.04954667149963756,1966,1.3233082706766917,21,1302,101,650
Our smoking cessation program has a near one hundred percent success rate.,133,7,0.04954667149963756,1967,1.3233082706766917,29,3439,97,650
"I promise, after this session you'll feel like a huge weight was lifted.",133,7,0.04954667149963756,1968,1.3233082706766917,28,3453,97,650
Weight loss? That's down the hall.,133,8,0.05068326965819927,1969,1.3233082706766917,27,4071,98,650
"Don't worry Mr Smith, 2020 is almost here. He'll be gone soon.",133,10,0.051242115554708666,1970,1.3233082706766917,21,6742,100,650
"Oh great, now even my couch is depressed.",133,9,0.05179493208604958,1971,1.3233082706766917,25,7254,98,650
"With some clients it can takes years to find the root cause of their problems. With you, it’s not that difficult",130,9,0.05261825097591534,1972,1.3230769230769228,24,1660,97,650
On a positive note the fact you feel anchored in your life is a good thing,130,10,0.05373956568619883,1973,1.3230769230769228,22,2833,98,650
Better?,130,7,0.05030068754013894,1974,1.3230769230769228,28,4248,95,650
Have you tried the deep breathing exercises we discussed?,130,10,0.05373956568619883,1975,1.3230769230769228,22,5706,98,650
You’ll feel so much better once you get it off your chest.,127,11,0.0557660065769125,1976,1.3228346456692914,19,4378,97,650
". . . so, what's new?",127,4,0.04727533025655223,1977,1.3228346456692914,32,4381,90,650
'Then it hit me like a ton of bricks.',127,8,0.05229621744139442,1978,1.3228346456692914,25,5919,93,650
"So let me get this straight, you pulled into Nazareth just feelin' 'bout half past dead?",158,10,0.04688901756160624,1979,1.3227848101265822,31,2354,117,650
. . . and how is that working for you?,158,12,0.04857809463183497,1980,1.3227848101265822,27,2846,119,650
You have 45minutes to get it off your chest unless want a double session.,158,8,0.045136777219089576,1981,1.3227848101265822,35,5911,115,650
"So, can you describe these feelings of oppression?",124,5,0.045153796538355384,1982,1.3225806451612905,28,4933,91,650
"Yes, of course I'm paying attention! 
Tell me again about this crushing weight you feel.",155,8,0.04570857566673902,1983,1.3225806451612905,34,4999,113,650
I liked the ball and chain metaphor better.,152,13,0.05078846232718948,1984,1.3223684210526316,23,542,115,650
What is the problem from your viewpoint?,152,9,0.0472325565960349,1985,1.3223684210526316,31,1828,112,650
So you feel there’s something you need to get off your chest?,152,11,0.0490427482313032,1986,1.3223684210526316,27,1930,114,650
"I don't think dieting alone will help your weight problem, Mr. Jones.",121,9,0.05531636539068268,1987,1.3223140495867771,21,3375,91,650
"Yes, but as a metaphor for being depressed, it still borders on cliché.",149,6,0.044940309864732325,1988,1.3221476510067114,36,1711,107,650
This looks a little heavy for our first session. Let's save it for next week.,149,9,0.047871866638347964,1989,1.3221476510067114,30,3566,109,650
Try and use your words.,149,16,0.05409786193936138,1990,1.3221476510067114,16,4668,117,650
"It's common to feel weighed down by external pressures, but how are you feeling inside?",149,5,0.043919662216038866,1991,1.3221476510067114,38,5236,106,650
The TV commercial did mention it as one of the possible side effects of the medication.,149,12,0.05063397851385358,1992,1.3221476510067114,24,6124,113,650
You thought you could outsmart the ankle bracelet...well let's see you figure this  one out.,118,10,0.057573408515826915,1993,1.3220338983050848,18,2372,89,650
There is something I would like to get off my chest........,146,11,0.05044434724336883,1994,1.321917808219178,25,980,110,650
"Sorry, we're out of time. See you next week.",146,7,0.04654824297061415,1995,1.321917808219178,33,3123,105,650
Well at least the load is off of your shoulders.,146,8,0.04755220536358845,1996,1.321917808219178,31,3887,107,650
Any idea what's weighing on you?,146,7,0.04654824297061415,1997,1.321917808219178,33,4233,106,650
"Accepting your guilt is a good first step, but you won't be fully free without an industrial grade engine hoist.",146,12,0.05137222479218837,1998,1.321917808219178,23,4691,110,650
What about you? What do you think is causing your flat affect?,146,13,0.05228363789359625,1999,1.321917808219178,21,4984,112,650
"I must say, that’s really heavy stuff. Is there anything else you'd like to get off your chest?",146,10,0.049499079360327616,2000,1.321917808219178,27,5525,109,650
Good. You're starting to understand 'privilege'.,146,6,0.04654824297061415,2001,1.321917808219178,33,6448,106,650
Let's talk about the pressure you've been under.,146,10,0.049499079360327616,2002,1.321917808219178,27,6912,109,650
Medication alone won't fix your issue.,146,10,0.049499079360327616,2003,1.321917808219178,27,7058,109,650
I thought we agreed you were going to stop putting yourself down.,115,8,0.05598821125637305,2004,1.3217391304347823,21,7389,86,650
And so you feel she is pressuring you to stay?,143,8,0.048213834941635135,2005,1.3216783216783217,30,1596,105,650
"All right, what is it that you want to get off your chest?",143,8,0.048213834941635135,2006,1.3216783216783217,30,1614,104,650
"What's on your mind, Harry?",143,9,0.04922465780499416,2007,1.3216783216783217,28,2268,106,650
"Now, how about reframing with a positive perspective?",143,13,0.05307578695579476,2008,1.3216783216783217,20,3602,110,650
"Obviously, I could simply lift the weight of your chest but that wouldn't be getting to the core of your problems.",143,7,0.04718136097591614,2009,1.3216783216783217,32,4097,104,650
I'd say it probably isn't a heart attack.,143,8,0.048213834941635135,2010,1.3216783216783217,30,5426,105,650
"I was pondering a rather weighty problem, then ...it hit me.....",143,10,0.050215137082938524,2011,1.3216783216783217,26,6048,107,650
I am getting the feeling something is weighing on you.,112,6,0.05413156329270253,2012,1.3214285714285714,24,1909,82,650
Great progress! You're no longer carrying the weight on your shoulders.,140,6,0.04675256547511975,2013,1.3214285714285714,33,6773,100,650
"I know it sounds difficult, but you’ll feel much better once you lose the weight",165,11,0.0462870305105758,2014,1.3212121212121213,31,6030,123,650
Just relax and tell me all about it.,137,10,0.05173493496724591,2015,1.3211678832116789,24,1144,103,650
"No complaints, Rocco. If you'd remembered the AA batteries, you could've done the ankle monitoring.",137,10,0.05173493496724591,2016,1.3211678832116789,24,1646,103,650
Try to relax.,137,9,0.05068689464851234,2017,1.3211678832116789,26,2805,102,650
You've been my patient for 10 years and you still never learned to unburden yourself?,137,5,0.046257890800233084,2018,1.3211678832116789,34,3269,98,650
It ain't heavy...it's my mother,137,9,0.05068689464851234,2019,1.3211678832116789,26,3883,102,650
Never mind. I can guess.,137,8,0.049616721799748256,2020,1.3211678832116789,28,4531,101,650
How long have you been feeling this weight?,137,9,0.05068689464851234,2021,1.3211678832116789,26,5101,102,650
You’ve got a ton of problems.,137,6,0.047403952031893536,2022,1.3211678832116789,32,5747,99,650
It’s only a metaphor.  Breathe easy.,137,7,0.04852295204537579,2023,1.3211678832116789,30,6757,100,650
"Therapists use the phrase ""to get something off your chest"" metaphorically. I'll refer you to a crane operator.",134,9,0.048081527325625206,2024,1.3208955223880596,23,521,102,650
Are you staying hydrated?,134,9,0.051463538761602735,2025,1.3208955223880596,25,1818,100,650
At least the weight is off your shoulders.,134,9,0.051463538761602735,2026,1.3208955223880596,25,3851,99,650
"Now that you have called me away from a very nice dinner, what exactly is so pressing?",134,11,0.053599790327342536,2027,1.3208955223880596,21,4536,102,650
"So, when did this panini fetish start becoming a problem?",106,11,0.06365220217092007,2028,1.320754716981132,12,201,83,650
"Interesting, last week it was your mother weighing you down.",106,8,0.05926651063843898,2029,1.320754716981132,18,4724,79,650
I prefer the metaphor,159,9,0.045775917863392517,2030,1.320754716981132,33,6377,117,650
"I still say, ""If you want a flat stomach, do sit ups!""",159,10,0.04663739006565512,2031,1.320754716981132,31,7187,118,650
Let's weigh the pros and cons,131,8,0.051137588085008234,2032,1.3206106870229009,26,27,97,650
I’m prescribing an editor to reduce your cliche levels.,131,10,0.053384759429490516,2033,1.3206106870229009,22,6753,99,650
...research indicates this is the best approach to impulse control.,128,4,0.04697229895213162,2034,1.3203125,33,2178,91,650
"If that gets much larger, you really should see someone about it.",128,8,0.051947308429796384,2035,1.3203125,25,2509,95,650
Mmm ... probably psychosomatic.,128,8,0.051947308429796384,2036,1.3203125,25,3259,95,650
"It is just your imagination, Mr Zeppelin. You will not lift off",128,11,0.05538607533748325,2037,1.3203125,19,6190,98,650
Do you want sympathy or help?,128,8,0.051947308429796384,2038,1.3203125,25,7159,95,650
Have you thought of losing weight?,153,9,0.04697011284630677,2039,1.3202614379084967,31,2832,113,650
Sometimes one feels better getting things off one's chest.,153,9,0.04697011284630677,2040,1.3202614379084967,31,6451,112,650
"So which is in your imagination, the comfy couch or the oppressive weight",150,10,0.04853099288798357,2041,1.32,28,260,112,650
"To be fair, it’s not the weight of the world....",125,7,0.05155642070711495,2042,1.32,25,348,92,650
Stop being so literal!,100,8,0.061758735529003614,2043,1.32,16,1405,76,650
Even Freud would say you overdid it with the symbolism..,125,5,0.048989794855663564,2044,1.32,30,2844,89,650
I see that your past weighs heavily upon you.,150,7,0.045681515899262636,2045,1.32,34,2861,109,650
I have a crush on you.,125,8,0.052792961407687175,2046,1.32,24,3095,93,650
How long have you been a panini?,125,7,0.05155642070711495,2047,1.32,26,3796,91,650
"I gotta tell ya', it's better than a monkey on your back.",150,8,0.04665068438369968,2048,1.32,32,4281,110,650
On a positive note-the weight seems to be off your shoulders,125,6,0.05028948456749697,2049,1.32,28,4420,91,650
Have you considered that it's not your problems that are weighing you down?,125,9,0.054001194729913736,2050,1.32,22,5724,94,650
I believe your self-esteem would improve if you lost weight.,147,8,0.047278358467382736,2051,1.3197278911564625,31,680,108,650
That should keep you here for about 9 or 10 sessions.,147,11,0.050147851995045616,2052,1.3197278911564625,25,2907,110,650
"Honey, it's been over four hours.  Time to call the doctor.",147,10,0.04920994919324189,2053,1.3197278911564625,27,3488,110,650
"Well, at least you're not behind the eight ball.",147,10,0.050147851995045616,2054,1.3197278911564625,25,5508,111,650
So what’s weighing you down that you had to see me immediately?,122,6,0.05239992098882017,2055,1.319672131147541,25,557,89,650
I think it replaced the elephant in the room.,144,10,0.04991521344435182,2056,1.3194444444444444,26,1412,108,650
Maybe it's not heavy.  Maybe it's your brother.,144,7,0.04690579113307769,2057,1.3194444444444444,32,1467,105,650
"My advice,  don't exhale.""",144,6,0.04690579113307769,2058,1.3194444444444444,32,2427,105,650
So what is your personal crisis this week?,144,10,0.04991521344435182,2059,1.3194444444444444,26,5915,108,650
I hate how you never help with housework and act as if there's something more pressing.,144,11,0.050878813177198785,2060,1.3194444444444444,24,6214,108,650
Do you do think you do well under pressure?,144,7,0.04690579113307769,2061,1.3194444444444444,32,7570,105,650
I am certain that with twelve more sessions we can find your problem.,119,10,0.057151653603799826,2062,1.319327731092437,18,1860,91,650
"""In a 45 minute session I can't make any promises...",141,12,0.052610812215000136,2063,1.319148936170213,21,93,108,650
"No, no, there IS something I have to get off of my chest.",141,6,0.046475744494948096,2064,1.319148936170213,33,862,102,650
I'm here to get something off my chest,141,9,0.0496381526060434,2065,1.319148936170213,27,1266,105,650
Another 10 minutes and you won't even notice it's there.,141,9,0.0496381526060434,2066,1.319148936170213,27,1505,105,650
"We all carry heavy burdens, Mr. Jones.""",141,8,0.048606882964731805,2067,1.319148936170213,29,2091,104,650
Why do I always have to get the door?,141,10,0.050648428571225895,2068,1.319148936170213,25,2899,105,650
Take a deep breath and imagine going to your happy place.,141,8,0.048606882964731805,2069,1.319148936170213,29,4374,104,650
"First, tell me about your childhood.",163,12,0.04743318406847935,2070,1.3190184049079754,28,1054,123,650
I need to get this off my chest.,116,7,0.054207024350269584,2071,1.3189655172413792,23,770,86,650
At least today it's not the weight of the world,116,5,0.05136683184651551,2072,1.3189655172413792,27,4577,84,650
"To be honest Doc, I preferred when the weight of the world was on my shoulders.",116,9,0.056905637364616485,2073,1.3189655172413792,19,4878,88,650
Let’s talk about your weight.,138,9,0.050372049880031126,2074,1.318840579710145,26,249,103,650
"Okay, so you had pulled into Nazareth, just a feelin' 'bout half past dead.  Then what happened ?",138,11,0.052430110191666913,2075,1.318840579710145,22,2570,105,650
Be glad that I don't charge by the pound.,138,12,0.05342942052378381,2076,1.318840579710145,20,6166,105,650
"I know it's unprofessional, but I've developed a crush on you.",138,5,0.0459804014546237,2077,1.318840579710145,34,7343,99,650
Do you want soup or baked chicken for dinner?,138,10,0.05141137940099779,2078,1.318840579710145,24,7577,104,650
The cardiologist said it wasn't my heart.,160,9,0.04553307164257147,2079,1.31875,33,4802,118,650
Have you tried lifting weights?,135,10,0.05220600840552335,2080,1.3185185185185184,23,384,102,650
How does that make you feel?,135,9,0.0511361808715124,2081,1.3185185185185184,25,1019,100,650
So it's not your classic pyramid scheme. Sue me.,135,8,0.05004348783418765,2082,1.3185185185185184,27,4308,99,650
So you would say that it's really weighing on you...,135,9,0.0511361808715124,2083,1.3185185185185184,25,6054,101,650
"Oh, come on.  That's just a figure of speech.",157,9,0.0461114192882048,2084,1.3184713375796178,32,972,115,650
I could have imagined the weight of your burden without the visual aid.,157,7,0.044305127853516126,2085,1.3184713375796178,36,6304,114,650
"Are you sure, you have nothing to get off your chest?",132,12,0.055172203047811584,2086,1.318181818181818,18,1760,101,650
"You took the weight off my shoulders, but I still need to get something off my chest.",132,7,0.049655512122314165,2087,1.318181818181818,28,2284,97,650
I need a favor.,132,5,0.04726890142706326,2088,1.318181818181818,32,3595,94,650
"But, what’s on your mind?",132,9,0.051932559402913636,2089,1.318181818181818,24,4331,99,650
"So, you went deep-sea fishing with Mr. Soprano...how did it make you feel?",132,10,0.05303443359875813,2090,1.318181818181818,22,5269,98,650
You think you had a bad day.,132,9,0.051932559402913636,2091,1.318181818181818,23,6106,99,650
"""I hear you denying it. But from where I'm sitting, this--quote unquote-- 'weight' you're carrying is very real.""",132,9,0.051932559402913636,2092,1.318181818181818,24,6362,99,650
How do you think I feel?  I’m crushed!,154,7,0.044856433269738406,2093,1.318181818181818,35,7448,112,650
We've succeeded in taking it off your mind.,129,8,0.05160281765773003,2094,1.3178294573643408,25,1020,96,650
Would you describe it as a metric tonne or an imperial ton?,129,8,0.05160281765773003,2095,1.3178294573643408,25,1720,96,650
Let’s not waste time here. You’re gonna need medication for that.,129,7,0.05041554085011072,2096,1.3178294573643408,27,1763,95,650
"I think the best way to get this weight off your chest is going to be a pulley system. Failing that, we'll get you some Xanax.",129,7,0.05041554085011072,2097,1.3178294573643408,27,3456,95,650
...and our time is up.  How do you feel?,148,13,0.051665728536959984,2098,1.3175675675675675,21,722,114,650
You're improving. It's smaller than last week's load.,148,9,0.04797533586986028,2099,1.3175675675675675,29,1040,109,650
I'll give you the number of a crane operator that takes your insurance.,148,10,0.04892403821418605,2100,1.3175675675675675,26,3948,111,650
We're all under pressure,148,8,0.047007490769755696,2101,1.3175675675675675,31,5398,109,650
I think you're ready to explore the idea that this weight you feel may have an external source.,126,5,0.0486657451325584,2102,1.3174603174603174,30,801,91,650
Hand me the remote.,126,10,0.0548021476242288,2103,1.3174603174603174,19,1628,96,650
I feel like there's something you need to get off your chest.,126,11,0.055948722158883066,2104,1.3174603174603174,18,2976,97,650
Do you think it’s climate change or the 2020 elections?,126,10,0.0548021476242288,2105,1.3174603174603174,19,3979,96,650
I don't think of it as pressure. I see it more as an opportunity.,126,10,0.0548021476242288,2106,1.3174603174603174,20,5763,96,650
Weight of the world?  I've heard worse.,145,11,0.05057471264367817,2107,1.3172413793103448,24,900,110,650
...and that must have hit you like a ten ton weight.,145,8,0.04764918926017042,2108,1.3172413793103448,30,2538,107,650
Now that’s gravitas,123,6,0.050740318526078534,2109,1.3170731707317074,27,2332,88,650
"Really, Phil?  A pyramid scheme?",123,7,0.05203710162425183,2110,1.3170731707317074,25,2731,90,650
There’s something I’d like to get off my chest.,123,7,0.05203710162425183,2111,1.3170731707317074,25,4783,90,650
"I wouldn't say it's the weight of the world, but I get the point you're making.",123,6,0.050740318526078534,2112,1.3170731707317074,27,5134,90,650
Think of it as an apt metaphor.,142,8,0.04831567019715917,2113,1.3169014084507042,29,1308,104,650
Something is clearly weighing on you.,142,9,0.0493385661269934,2114,1.3169014084507042,27,1683,106,650
"Shall we start at the beginning, Mr. Vader?",142,11,0.051323234009576925,2115,1.3169014084507042,23,3867,108,650
"Unburden yourself quickly, Mr. Johnson, our time is almost up.",142,10,0.05034068164352512,2116,1.3169014084507042,25,5131,106,650
You are definitely not imagining this crushing feeling,142,9,0.0493385661269934,2117,1.3169014084507042,27,5441,106,650
That’s a lot of cowbell!,142,10,0.05034068164352512,2118,1.3169014084507042,25,5849,106,650
Now have you always had a weight problem?,142,10,0.05034068164352512,2119,1.3169014084507042,25,6131,107,650
Your insurance doesn’t cover this....,142,9,0.0493385661269934,2120,1.3169014084507042,27,6427,106,650
You'll feel much better once you get that weight off your chest.,120,7,0.052903555467842825,2121,1.3166666666666669,24,5811,89,650
You have to let go. It's just you holding yourself down.,120,9,0.05356131245912113,2122,1.3166666666666669,19,6590,92,650
I'm pretty sure I know where the pressure is coming from.,139,10,0.05109169093298821,2123,1.3165467625899279,24,26,105,650
Let's explore the possibility that it is not just the unresolved emotional trauma that is weighing you down.,139,9,0.05006092755669513,2124,1.3165467625899279,26,377,103,650
"Would you call yourself overdramatic? Moan in anguish once for yes, twice for no.",139,6,0.046832715319216116,2125,1.3165467625899279,30,671,101,650
Is your depression related to your weight?,139,12,0.053093217189228735,2126,1.3165467625899279,20,863,107,650
"When you signed on with Trump, you knew this would happen.",139,12,0.053093217189228735,2127,1.3165467625899279,20,3393,107,650
Can you see it from her side now?,139,5,0.04570600408715937,2128,1.3165467625899279,33,4677,100,650
This is my new relativity therapy.  Now just visualize your other problems getting smaller and smaller.,139,5,0.04570600408715937,2129,1.3165467625899279,34,5247,100,650
"Now, that's a concrete statement.",139,7,0.04793294940566513,2130,1.3165467625899279,30,5339,101,650
