caption,count,funny,precision,rank,score,somewhat_funny,target_id,unfunny,contest
Maybe now that you know what it actually feels like to have a 1000lb weight on your chest you won't be so quick to complain.,139,0,0.03367724450095659,5787,1.1942446043165469,27,674,112,650
"Our couples therapy is going well, don't you think?",139,6,0.041949294207520166,5788,1.1942446043165469,15,1488,118,650
On a scale of 1-5000 how much weight would you put on your mother’s inadequate nurturing?,139,3,0.038038796522013515,5789,1.1942446043165469,21,1668,115,650
"If you want a huge weight lifted off your shoulders, you've come to the wrong place.",139,3,0.038038796522013515,5790,1.1942446043165469,21,2257,115,650
"Mr Smith, think creatively, you’re too concrete.",139,4,0.03938545994905303,5791,1.1942446043165469,19,2461,116,650
Will you please just get the liposuction,139,3,0.038038796522013515,5792,1.1942446043165469,21,3787,115,650
Tell me more about this heavy weight you are feeling?,139,3,0.038038796522013515,5793,1.1942446043165469,21,4734,115,650
"Now, isn't that a weight off your mind?",139,5,0.04068757635880727,5794,1.1942446043165469,17,5496,117,650
They told you the treatment would last twenty minutes.  You'll just have to weight it out.,139,2,0.03664267493357759,5795,1.1942446043165469,23,6644,114,650
"To improve your self-image , you might try losing a few pounds.",139,2,0.03664267493357759,5796,1.1942446043165469,23,6863,114,650
"It's finally time, Frank, to share in this household's financial burden.",139,3,0.038038796522013515,5797,1.1942446043165469,21,6898,114,650
"Well, that's a weight off my mind.",134,5,0.04167626156127724,5798,1.1940298507462686,16,1028,113,650
"Remember to ""Breathe"" ever so slowly...",134,3,0.038890475395087415,5799,1.1940298507462686,20,1325,111,650
"I know I suggested getting a weighted blanket, but this isn’t what I had in mind.",134,2,0.03741989077779158,5800,1.1940298507462686,22,1826,109,650
I agree we're making progress.  This is much less than the weight of the world.,134,5,0.04167626156127724,5801,1.1940298507462686,16,5491,113,650
Well that takes a load off me,134,4,0.040307442576898216,5802,1.1940298507462686,18,5509,111,650
"So, other than Trump. Derangment Symdrone, anything else weighing you down?",129,3,0.039799520887428025,5803,1.193798449612403,19,1280,107,650
"My trainer said I shouldn't go any higher than a 12lb kettlebell.
Just saying........",129,4,0.04129317006329947,5804,1.193798449612403,17,2242,108,650
"You're not obligated to be analyzed, but the judge said it might lighten your sentence.",129,3,0.039799520887428025,5805,1.193798449612403,19,2634,107,650
"Next week we'll work on your overusage of the verb ""slay.""",129,1,0.03662995769658102,5806,1.193798449612403,23,3702,105,650
"Trust me. If you take yor meds as I have prescribed them, you will feel as though a heavy weight has been lifted  from you.",129,2,0.03824758596122202,5807,1.193798449612403,21,4049,106,650
"You say you feel like the weight of the whole world is on you. Oh, you always exaggerate.",129,4,0.04129317006329947,5808,1.193798449612403,17,7506,108,650
Imagine you are a mummy under Cheops pyramide,124,4,0.04235002596262145,5809,1.1935483870967742,16,2926,103,650
"Now, with two hands.",155,2,0.03436755686236305,5810,1.1935483870967742,26,3688,127,650
"Can we up the dosage, I'm getting that painful feeling?",155,5,0.036149823450880345,5811,1.1935483870967742,19,4462,131,650
So you say you’re feeling a lot of pressure?,124,2,0.0391313686434772,5812,1.1935483870967742,20,6027,101,650
Now how often are you a victim of this kind of... oppression?,155,4,0.036724696401883375,5813,1.1935483870967742,21,7138,129,650
Let’s focus on the weight off your shoulders,150,4,0.03747830592971979,5814,1.1933333333333334,21,4010,124,650
"Sorry honey, but I've been flat out all day.",150,4,0.03747830592971979,5815,1.1933333333333334,21,4356,125,650
Next time use a dumbbell,150,4,0.03747830592971979,5816,1.1933333333333334,21,5120,125,650
I said the session is over. Please get up and leave my office. I have another client waiting.,150,3,0.03626483085233812,5817,1.1933333333333334,23,5245,124,650
So you feel theses things weigh you down,119,3,0.04181692951237239,5818,1.1932773109243695,17,116,99,650
"I TOLD YOU, HENRY, YOU ARE SUPPOSED TO CARRY THE WEIGHT OF THE WORLD'S TROUBLES ON YOUR SHOULDERS!",119,7,0.04814950682023363,5819,1.1932773109243695,9,2552,103,650
It feels like a huge weight has been lifted off my shoulders.,119,3,0.04181692951237239,5820,1.1932773109243695,17,3031,99,650
$150 an hour feels better after a weighty discussion.,119,5,0.045094515192395886,5821,1.1932773109243695,13,5475,101,650
And when did this obsession with Miley Cyrus begin?,145,4,0.03827776047206143,5822,1.193103448275862,20,3180,121,650
"please explain again, how does this weigh you down?",145,5,0.03950914308574073,5823,1.193103448275862,18,5411,121,650
"Just feel the weigh, experience the weight, become one with the weigh",145,2,0.03568775792243685,5824,1.193103448275862,23,7191,119,650
Weight it out.,140,4,0.03912773055256461,5825,1.1928571428571428,19,47,117,650
Any issues beside weight loss?,140,5,0.04041972564371146,5826,1.1928571428571428,17,1043,118,650
So how does it make you not feel?,140,5,0.04041972564371146,5827,1.1928571428571428,17,2417,118,650
I told my psychiatrist I needed a weight off my shoulders.,140,5,0.04041972564371146,5828,1.1928571428571428,17,3310,117,650
"Well, Larry, you don’t seem to be succeeding in losing the extra weight.",140,1,0.03496647722373065,5829,1.1928571428571428,25,3335,114,650
"Tut tut Mister Jones, it's all in your head!",140,4,0.03912773055256461,5830,1.1928571428571428,19,3742,117,650
Now tell me about these weighty decisions on your chest?,140,3,0.037791591330285236,5831,1.1928571428571428,20,4993,116,650
Are you ready to weigh in on your relationship?.,140,2,0.03640644795028049,5832,1.1928571428571428,23,5316,115,650
I think you’ve been putting on some weight.,140,5,0.04041972564371146,5833,1.1928571428571428,17,6146,118,650
I din’t Know why but I feel like I’ve got the weight of the world on my shoulders.,109,1,0.0401260844561969,5834,1.1926605504587156,19,1173,89,650
Well this is an interesting way to honor your new year's resolution to get underweight.,109,3,0.044157581278879685,5835,1.1926605504587156,15,3836,90,650
Would you mind pulling down the shade?,135,3,0.03641826957592937,5836,1.1925925925925926,19,1011,113,650
"I really can't say.""",135,6,0.0427060042232472,5837,1.1925925925925926,14,1625,115,650
"It's called ""prop drama."" And it doesn't work with me.",135,2,0.037169470249948884,5838,1.1925925925925926,22,7325,111,650
Is there something weighing on you honey?,161,4,0.0358086789315852,5839,1.1925465838509317,23,6654,134,650
And you find this less heavy then the divorce,130,5,0.037981500449623534,5840,1.1923076923076923,13,2011,112,650
Do you feel better with that weight off your shoulders?,130,5,0.042430839368734416,5841,1.1923076923076923,15,4977,110,650
I think you’re being a bit two- dimensional about things.,130,4,0.041001409063085616,5842,1.1923076923076923,17,5855,109,650
"In my experience, levitation can be successfully managed.",130,3,0.039520310737412176,5843,1.1923076923076923,19,6715,108,650
Now I suppose you are going to say you are too tired  to get up.,130,4,0.041001409063085616,5844,1.1923076923076923,17,7483,108,650
"I dunno about you, but I feel our work is done here.",151,3,0.0360466117032233,5845,1.1920529801324504,23,5453,125,650
Put the weight right on me.,125,5,0.04354604533727637,5846,1.192,14,1976,106,650
Wait?  For what?,125,2,0.03884792517397268,5847,1.192,20,7484,103,650
I thought this was a safe zone.,172,5,0.035308958981522816,5848,1.1918604651162792,23,2502,144,650
I don't think you can blame your parents for your failure to accomplish anything.,146,4,0.03803768175341875,5849,1.1917808219178083,20,2167,122,650
"Yeah, I see the problem now, what you have is a literal weight...",146,3,0.03677488167057516,5850,1.1917808219178083,22,2564,121,650
"It's your own dam fault for being a repeat sex offender, Deter.",146,5,0.03925988467206605,5851,1.1917808219178083,18,5984,123,650
"It's like there's something weighing down on me, but I can't figure out what.",120,4,0.04315276968259602,5852,1.1916666666666669,15,1182,101,650
Why you start by taking a load off,120,3,0.04149825910650005,5853,1.1916666666666669,17,4147,99,650
"No, the weight of the world is NOT on your shoulders. That looks like your stomach from here.",167,4,0.034952978128845215,5854,1.1916167664670658,24,3720,139,650
How does that make you feel when your mother says that?,141,3,0.03754752964542799,5855,1.1914893617021276,21,537,115,650
"That's not what I meant when I said, ""lie in wait "".",141,4,0.03887330838850756,5856,1.1914893617021276,19,2304,118,650
You need to literally this get weight off your chest before we can proceed further.,141,6,0.04139768532485178,5857,1.1914893617021276,15,2661,120,650
"I suggested 
That 
You stop reading the news!",141,2,0.03617319255858647,5858,1.1914893617021276,23,3260,114,650
Welcome to Klegon/Smythson Intervention  RealityTherapy...Within six sessions you will feel the weight of the world lifted. I guarantee it.,141,5,0.0401553387193002,5859,1.1914893617021276,17,3632,119,650
I think I'm ready to go back to the Senate now.,141,7,0.0426038199325972,5860,1.1914893617021276,13,4055,120,650
My wife says I’ve been moody lately...I don’t see it.,115,5,0.04604188749503791,5861,1.191304347826087,12,3372,98,650
Doctor I really appreciate you got “the” weight off my shoulders... but could you get it off my chest quicker.,115,4,0.0443542568735968,5862,1.191304347826087,14,3675,96,650
If this keeps you here you're paying for the second session.,136,2,0.03692232009759421,5863,1.1911764705882353,21,2416,112,650
"Actually, our mailer guaranteed that when you LEAVE here you'll feel as if a great weight has been lifted off of your chest.",136,4,0.039763332922888715,5864,1.1911764705882353,18,3457,114,650
"You're in great shape,
some people have the weight of the world on their chest",136,3,0.03836913060342712,5865,1.1911764705882353,20,3625,113,650
Learn to code.,136,2,0.03692232009759421,5866,1.1911764705882353,22,4603,112,650
Does the pressure you feel come from your work or your personal life?,136,2,0.03692232009759421,5867,1.1911764705882353,21,5479,110,650
Spending today complaining about yesterday won't make tomorrow any better.,136,3,0.03836913060342712,5868,1.1911764705882353,20,6312,113,650
"I am so fed up, day in and day out, having to listen to everyone whine about having the weight of the world on them!",157,6,0.0384810381324668,5869,1.1910828025477709,18,2204,133,650
dunno if I’m oppressed or impressed,157,4,0.03629699245249046,5870,1.1910828025477709,22,6277,131,650
It provides a psychological uplift,157,4,0.03629699245249046,5871,1.1910828025477709,22,6875,130,650
"I'm suppose to believe that?""",131,4,0.04071369150638141,5872,1.1908396946564883,17,1070,110,650
"It's going to stay there until you tell me what you did with my credit card !""",131,2,0.037719027716580825,5873,1.1908396946564883,21,2449,108,650
I thought we agreed to compartmentalize.,131,3,0.039244934246097214,5874,1.1908396946564883,19,4513,109,650
At least I got it off my shoulders.,131,4,0.04071369150638141,5875,1.1908396946564883,17,6866,110,650
I still think this pressure in my chest is more than just my imagination.,131,2,0.037719027716580825,5876,1.1908396946564883,21,7108,108,650
The lite box has been found to be the most effective treatment for depression.,131,2,0.035306732130568834,5877,1.1908396946564883,20,7502,109,650
I just think it's an old-fashioned way to get rid of a cyst.,152,7,0.04040311062490436,5878,1.1907894736842106,15,5937,130,650
tell me more about your carrying the weight of the world fixation,126,2,0.03856848901203158,5879,1.1904761904761905,19,375,103,650
Something’s weighing heavily on me.,147,1,0.03390159546036864,5880,1.1904761904761905,26,1101,119,650
The good news is you no longer have the weight of the world on your shoulders,147,4,0.03780055628036639,5881,1.1904761904761905,20,1424,122,650
"The counter-part of this must be, ‘Heavy is the head that wears the crown.’",147,1,0.03390159546036864,5882,1.1904761904761905,26,2561,120,650
Don't look at me...I told you to go with the Keto diet.,126,3,0.04018099639948377,5883,1.1904761904761905,18,3584,105,650
This will keep you from chasing other women!!,147,6,0.040190272148074,5884,1.1904761904761905,16,4728,125,650
"First of all, do not pay attention to the number on the scale.  Iron weighs more than fat.",147,4,0.03780055628036639,5885,1.1904761904761905,20,5883,123,650
"My holistic practice treats acute depression as a ""brain sprain"" --with this Compression Therapy",147,2,0.035249200485600235,5886,1.1904761904761905,24,7231,121,650
"I'm gonna need you to pay me, Frank.",142,5,0.039894349776583946,5887,1.1901408450704225,17,599,120,650
"So I hate to interrupt you sir, but I'm having a difficult time listening without addressing this first.",142,3,0.033047065524206415,5888,1.1901408450704225,19,2246,120,650
"As you weigh your options, think about what kind of impression you’re making.",142,5,0.039894349776583946,5889,1.1901408450704225,17,3122,120,650
"Yes, you were adopted, but we never wanted you to feel like a burden.",142,3,0.03730655307532888,5890,1.1901408450704225,21,3749,118,650
Any chance your emotional baggage could come in the form of dumbbells? It's my New Year's Resolution to work out more.,142,3,0.03730655307532888,5891,1.1901408450704225,21,4270,118,650
"So, that's what's been on your mind.",142,6,0.03730655307532888,5892,1.1901408450704225,13,6812,123,650
This is a great way to get some weight of your chest,121,0,0.03581796951709283,5893,1.1900826446280992,23,3241,98,650
I feel so pressed to marry her.....,158,3,0.034951849181425285,5894,1.1898734177215189,24,2770,130,650
"This is what I call ""literal"" therapy.",158,6,0.03825583258081625,5895,1.1898734177215189,18,4736,133,650
I see you have a giant weight on your chest.,137,4,0.03949668137670992,5896,1.1897810218978102,18,1279,115,650
I’m afraid literal weight won’t just replace the figurative weight.,137,4,0.03949668137670992,5897,1.1897810218978102,18,2565,114,650
I just want to rule out the witch diagnosis now.,137,3,0.03811358855864362,5898,1.1897810218978102,20,4390,114,650
I guess my marriage is not that oppressive.,137,4,0.03949668137670992,5899,1.1897810218978102,18,4800,115,650
Dr.  I feel like I have a large weight on me.,137,7,0.043382190592922684,5900,1.1897810218978102,12,5738,117,650
"Mr Smith,  You must find another approach to removing your belly fat.",137,5,0.040832952951373964,5901,1.1897810218978102,16,6963,116,650
Have you ever felt like you’re bearing the weight of the world?,132,3,0.038973314472690784,5902,1.1893939393939394,19,269,110,650
Allow this weight to help your mind come up with a funny caption.,132,3,0.038973314472690784,5903,1.1893939393939394,18,331,110,650
"When I asked you to try to take the weight of the world off your shoulders, I didn't mean for you to place it elsewhere....",132,3,0.038973314472690784,5904,1.1893939393939394,19,779,110,650
I feel like it really weighs me down,132,3,0.038973314472690784,5905,1.1893939393939394,19,1658,110,650
"Once you resolve your childhood issues, you’ll feel a whole weight lift off you.",132,4,0.040429935221209315,5906,1.1893939393939394,17,1920,110,650
This isn't exactly the kind of weighted blanket I had in mind.,132,2,0.03746009636911411,5907,1.1893939393939394,21,2279,108,650
I  see that the weight of the world is all over you now.,132,0,0.03423357968392221,5908,1.1893939393939394,25,2411,107,650
"Don't complain.  It only cost $10.00 from Amazon.  Shipping was free!""",132,4,0.040429935221209315,5909,1.1893939393939394,17,4607,110,650
Your weekly whining about the weight of the world wreaking havoc on your psyche is getting old. Let's try something new.,132,6,0.04319607046941939,5910,1.1893939393939394,13,4692,113,650
"Jesus Christ Garry, when i said we were going to talk about the burden of your past I wasn't being that litteral...",132,3,0.038973314472690784,5911,1.1893939393939394,19,5618,110,650
I am glad you are seeing the positive that  at least it's not on my shoulders.,132,5,0.041835870768936,5912,1.1893939393939394,15,7141,112,650
You were telling me about how your father was in construction...,148,4,0.037566330809077016,5913,1.1891891891891893,20,2893,124,650
I assure you we're all under a lot of pressure. Now let's get down to what's REALLY bothering you.,148,3,0.03632217706993585,5914,1.1891891891891893,22,3389,123,650
"It's called an open MRI.
Done at home.
For claustrophobics.
Stop complaining.",148,6,0.03993853448953126,5915,1.1891891891891893,16,5722,126,650
We need to explore what you feel is weighing on you.,127,2,0.03829297767285124,5916,1.1889763779527558,20,2381,105,650
Tell me what you really think of my haircut and get it off your chest.,127,5,0.04291043311261407,5917,1.1889763779527558,14,3490,107,650
Learning to handle stress without swearing is key to so much in life.,127,3,0.0398915594581907,5918,1.1889763779527558,18,4007,106,650
And what aspect of getting the weight off your mind is it that you find unsatisfactory?,127,3,0.0398915594581907,5919,1.1889763779527558,18,7126,106,650
At least it's a load off my feet,127,3,0.0398915594581907,5920,1.1889763779527558,18,7437,106,650
Only 10 more direct-to-consume memory foam mattresses to go.,143,7,0.04204823033011393,5921,1.1888111888111887,13,2276,123,650
Increasing your sleep number will improve your attitude.,143,4,0.03837413849424776,5922,1.1888111888111887,19,3090,120,650
"I know I""m only a psychiatrist, but I'm sure there are easier ways to treat an enlarged prostate.",106,5,0.04854247137193207,5923,1.1886792452830188,10,6641,91,650
"I encourage my clients to breathe deeply into the body, 
using the breath to become present with their feelings.",122,3,0.04087507645872571,5924,1.1885245901639343,17,3112,102,650
Now you can see why your appointment was marker urgent,122,3,0.04087507645872571,5925,1.1885245901639343,17,4545,102,650
You're crazy if you think you're leaving that here.,138,2,0.036437583866152166,5926,1.1884057971014492,22,371,114,650
"Sorry, that's one weight I can't help you get off your chest.",138,4,0.03923353875954684,5927,1.1884057971014492,18,1576,116,650
"Original, but I’m not impressed.",138,3,0.03786137927756817,5928,1.1884057971014492,20,2271,115,650
You'd previously mentioned a weight lifted off your shoulders--so what's changed?,138,3,0.03786137927756817,5929,1.1884057971014492,20,5691,115,650
Let's talk about your weight gain.,138,4,0.03923353875954684,5930,1.1884057971014492,18,6254,116,650
I can guarantee you'll feel less depressed when our session is over.,138,5,0.0405593033272745,5931,1.1884057971014492,16,6925,117,650
Don't worry I will help you to take that load off your chest,138,3,0.03786137927756817,5932,1.1884057971014492,20,6985,115,650
You’re not the only one of my patients to describe a weight on their chest,138,3,0.03786137927756817,5933,1.1884057971014492,20,7222,115,650
"Much better today, Doc, like a great weight has been lifted off my shoulders.",154,5,0.03772842943363955,5934,1.1883116883116882,19,2742,130,650
"So, when did you first notice you had the weight of the world on your shoulders?",154,5,0.03772842943363955,5935,1.1883116883116882,18,3144,130,650
"When you *actually* have the world pressing on you, the anxiety is barely noticeable!  You can pay my receptionist on the way out.",154,4,0.03658622622935447,5936,1.1883116883116882,21,3842,128,650
In our last session I did say a great weight would be off you shoulders.,154,1,0.03292270700040721,5937,1.1883116883116882,27,7255,126,650
Your hour isn't up for another 30 seconds,117,3,0.04193173675097573,5938,1.188034188034188,16,2794,98,650
I can understand why you might find this to be a weighty subject......,117,2,0.040136122516075165,5939,1.188034188034188,18,6465,97,650
Maybe it’s time to prescribe steroids with the Prozac.,133,4,0.04015006020204168,5940,1.18796992481203,17,1051,111,650
"Harold, you’ve got to stop being penny wise pound foolish.",133,6,0.04289370195416879,5941,1.18796992481203,13,1437,114,650
"Good morning Marvin, is there anything we can do today to lighten your load?",133,3,0.038705376469875936,5942,1.18796992481203,19,2125,111,650
"I've got a major crush on you, valentine.",133,6,0.04289370195416879,5943,1.18796992481203,13,2448,114,650
Where exactly did you see that ad for a weight loss program?,133,3,0.038705376469875936,5944,1.18796992481203,19,2695,110,650
"Well, take a deep breath an try to describe the physical ailments, you imagine you are being plagued of.",133,3,0.03643109136226512,5945,1.18796992481203,17,4348,112,650
I apologize for the interruption Mr. Smith but please continue...You were saying that you had eaten a large bowl of baked beans for lunch?,133,4,0.04015006020204168,5946,1.18796992481203,17,4510,112,650
"Thats a huge weight off my chest, doc.",133,3,0.038705376469875936,5947,1.18796992481203,19,5097,111,650
"Trust me, you’re not carrying the weight of the world.",133,4,0.04015006020204168,5948,1.18796992481203,17,6049,112,650
"But the world is round, Robert.",149,6,0.03968990027701637,5949,1.1879194630872485,16,89,127,650
I'll take it off when the Knicks win a championship.,149,6,0.03793739713855837,5950,1.1879194630872485,15,699,128,650
It’s really sad when a weightlifter can no longer lift weight.,144,4,0.038129270876733234,5951,1.1875,19,368,121,650
All you have to do is keep your fly shut.,128,4,0.0411300750165392,5952,1.1875,16,3417,108,650
"Well, maybe we should switch to speaking about your relationship with your mother, instead?",144,4,0.038129270876733234,5953,1.1875,19,5524,121,650
I'm sensing you have a weighty issue to get off your chest.,128,5,0.042599466744656964,5954,1.1875,14,5695,109,650
It seems the weight of the world is crashing down on you,128,5,0.042599466744656964,5955,1.1875,14,5743,109,650
'We need to start downsizing.,128,2,0.038021310849839965,5956,1.1875,20,6083,106,650
I'm sorry a ton. Believe me.,144,5,0.039382310682797614,5957,1.1875,17,6126,122,650
I don’t know what you’re weighting for.,128,5,0.042599466744656964,5958,1.1875,14,6971,108,650
To reveal the problem is the first step to recovery,155,2,0.03398796797157038,5959,1.1870967741935483,25,7369,128,650
Talk about a ball and chain.,139,4,0.038973837329925286,5960,1.1870503597122302,18,3075,117,650
My wife tells me I take things too literally.,139,2,0.03619987799853549,5961,1.1870503597122302,22,4321,115,650
In 1963 the weight of the world was merely confined to my shoulders,139,4,0.038973837329925286,5962,1.1870503597122302,18,5188,117,650
"You feel the crushing psychological weight of being alive, correct?",139,2,0.03619987799853549,5963,1.1870503597122302,22,5909,115,650
Sorry. I was just remembering -- my grandmother's pierogi.,139,2,0.03619987799853549,5964,1.1870503597122302,22,7530,115,650
Tell me more about feeling you have a weight that needs lifting.,123,2,0.03889311074169898,5965,1.1869918699186992,19,1116,102,650
"Sorry Sir, this sort of weight gain cannot be attributed to your mental health",123,3,0.04057035967909163,5966,1.1869918699186992,17,1200,103,650
"Sir - if you're not going to buy that, I'm going to have to ask you to leave.",123,5,0.043732300730015015,5967,1.1869918699186992,12,2074,104,650
"No, not the weight of the world, just two tons.",123,4,0.04218096852628763,5968,1.1869918699186992,15,2238,104,650
"When you said you needed help with having weight lifted, I thought you were speaking metaphorically.",123,4,0.04218096852628763,5969,1.1869918699186992,15,5076,104,650
"You look like you've gained weight, how is everything?",150,3,0.033958346200296745,5970,1.1866666666666668,21,458,126,650
So you feel your gravity blanket started this coping cycle of dealing with increasing anxiety?,150,5,0.038293189757509394,5971,1.1866666666666668,18,1034,127,650
"I'm really sorry about your depression, George. I just don't know what to do about it.",150,3,0.03588032141130667,5972,1.1866666666666668,22,6078,125,650
You’re Problem is paying too much attention to the side effects.,150,5,0.038293189757509394,5973,1.1866666666666668,18,6567,127,650
Finally telling you the truth feels like a huge weight has been lifted off my shoulders.,150,1,0.03329304052430058,5974,1.1866666666666668,26,7444,123,650
"I’m sorry, but lifting things is not in my job description.",134,2,0.034600028684028686,5975,1.1865671641791045,20,358,112,650
"Yes, but does it make you feel wrinkle free ?",134,4,0.03987398854083669,5976,1.1865671641791045,17,2048,113,650
Hoe does it make you feel?,134,4,0.03987398854083669,5977,1.1865671641791045,17,3793,113,650
"Jerry, the weightiness of your discussions is directly proportional to the load you always carry.",134,1,0.03540158767982916,5978,1.1865671641791045,23,4064,108,650
"Yes, I do see you are bearing a heavy weight today.",134,2,0.036952581247954516,5979,1.1865671641791045,21,4672,111,650
The weight of the world is actually 2000 kilos more.,134,3,0.038441047221956993,5980,1.1865671641791045,19,5056,112,650
You have a very vivid imagination.,134,3,0.038441047221956993,5981,1.1865671641791045,19,5345,112,650
"Well, that's a huge weight off your shoulders.",134,4,0.03987398854083669,5982,1.1865671641791045,17,6914,113,650
Huh. So this is what physical therapy is.,134,2,0.036952581247954516,5983,1.1865671641791045,21,7303,111,650
Dave Osborne you're not.,102,1,0.04116907422639316,5984,1.1862745098039216,17,279,84,650
"You said your anxieties weigh you down like a ton of bricks, but that's only a half-ton at most.",145,2,0.03526881837371555,5985,1.186206896551724,23,2775,119,650
