,rank,caption,score,precision,count,unfunny,somewhat_funny,funny
3088,3089,Mind if I use your bathroom?,1.09375,0.0689695906576505,32.0,30.0,1.0,1.0
3089,3090,Then you probably also won't appreciate the Cajun in the kitchen or Brazilian in the bathroom.,1.09375,0.0523514603733822,32.0,29.0,3.0,0.0
3090,3091,Forget it. He ran out of ketchup.,1.09375,0.0689695906576505,32.0,30.0,1.0,1.0
3091,3092,Hot Dog?,1.09375,0.0689695906576505,32.0,30.0,1.0,1.0
3092,3093,Are you going to listen to me or watch your flat screen all day?,1.09375,0.0523514603733822,32.0,29.0,3.0,0.0
3093,3094,It was an Amazon delivery.,1.09375,0.0523514603733822,32.0,29.0,3.0,0.0
3094,3095,I knew we should have tipped him.,1.09375,0.0689695906576505,32.0,30.0,1.0,1.0
3095,3096,The trouble with retirement is you never get a day off!,1.09375,0.0523514603733822,32.0,29.0,3.0,0.0
3096,3097,"Sorry, your lease isn't gluten-free.",1.09375,0.0689695906576505,32.0,30.0,1.0,1.0
3097,3098,All he wants to watch is 'Competitive Chef.',1.09375,0.0689695906576505,32.0,30.0,1.0,1.0
3098,3099,I told you not to put our address on yelp...,1.09375,0.0523514603733822,32.0,29.0,3.0,0.0
3099,3100,I told you to pay for the premium UberEATS subscription...this is embarrassing.,1.09375,0.0689695906576505,32.0,30.0,1.0,1.0
3100,3101,I think I could justify getting some nachos if we did the wave a couple of times.,1.09375,0.0689695906576505,32.0,30.0,1.0,1.0
3101,3102,"I asked for a truckload of fast food, not a truck of fast food!",1.09375,0.0523514603733822,32.0,29.0,3.0,0.0
3102,3103,at-Whay o-day ou-yay ant-way or-fay inner-day?,1.09375,0.0523514603733822,32.0,29.0,3.0,0.0
3103,3104,This way we can get take-out whenever we want.,1.09375,0.0523514603733822,32.0,29.0,3.0,0.0
3104,3105,Maybe we should have ordered hamburgers!,1.09375,0.0523514603733822,32.0,29.0,3.0,0.0
3105,3106,It seemed easier then going to Food Trucks in the park!,1.09375,0.0523514603733822,32.0,29.0,3.0,0.0
3106,3107,"Now we can eat out inside, inside out, outside in, and in outside, all while sitting side by side with a side of fries.",1.09375,0.0689695906576505,32.0,30.0,1.0,1.0
3107,3108,This is what you meant by a quick visit? - and you have yet to turn a page.,1.09375,0.0523514603733822,32.0,29.0,3.0,0.0
3108,3109,"Not sure if ""Squatter's Rights"" applies to a food cart.",1.09375,0.0523514603733822,32.0,29.0,3.0,0.0
3109,3110,Your Instacart order has arrived,1.09375,0.0523514603733822,32.0,29.0,3.0,0.0
3110,3111,"It's the latest thing. They call it a ""food pantry.""",1.09375,0.0523514603733822,32.0,29.0,3.0,0.0
3111,3112,I'm the Uber of food trucks.,1.09375,0.0523514603733822,32.0,29.0,3.0,0.0
3112,3113,It was the only parking space left.,1.09375,0.0523514603733822,32.0,29.0,3.0,0.0
3113,3114,Tell him we're watching 'I Love Lucy' reruns and to get lost.,1.09375,0.0689695906576505,32.0,30.0,1.0,1.0
3114,3115,So this is what you meant when you said we should cut down on ordering in.,1.09375,0.0523514603733822,32.0,29.0,3.0,0.0
3115,3116,Well he did say that despite the fact it was so late he'd make a concession for us.,1.09375,0.0689695906576505,32.0,30.0,1.0,1.0
3116,3117,$11 for a hotdog? They charge way too much in this area.,1.09375,0.0689695906576505,32.0,30.0,1.0,1.0
3117,3118,Really? THIS is your settlement package?,1.09375,0.0523514603733822,32.0,29.0,3.0,0.0
3118,3119,We have our own food truck and we still don't know what to have for dinner!,1.09375,0.0689695906576505,32.0,30.0,1.0,1.0
3119,3120,"Honey,I've got hives.",1.09375,0.0523514603733822,32.0,29.0,3.0,0.0
3120,3121,Eating In For A Change,1.09375,0.0523514603733822,32.0,29.0,3.0,0.0
3121,3122,When he stares at us like that I'm sorry we canceled our Blue Apron.,1.0909090909090908,0.050819726761358916,33.0,30.0,3.0,0.0
3122,3123,Not that happy with the Food Network's app.,1.0909090909090908,0.050819726761358916,33.0,30.0,3.0,0.0
3123,3124,"I love NYC street art: not only visually arresting, but artery-stopping as well!",1.0909090909090908,0.050819726761358916,33.0,30.0,3.0,0.0
3124,3125,Baseball Night on Super Platinum Sports Cable TV,1.0909090909090908,0.050819726761358916,33.0,30.0,3.0,0.0
3125,3126,The Met gift store has everything.....,1.0909090909090908,0.043840256560946575,44.0,40.0,4.0,0.0
3126,3127,"Do you read while he's watching TV? If so, you get a free hot dog.",1.0909090909090908,0.050819726761358916,33.0,30.0,3.0,0.0
3127,3128,I think after Transformers he started doing obscure performance art.,1.0888888888888888,0.04290254662948555,45.0,41.0,4.0,0.0
3128,3129,"It is called ""Time Out""in our food truck business.",1.0857142857142856,0.048009602880960366,35.0,32.0,3.0,0.0
3129,3130,These cooking shows are so inspiring!,1.0857142857142856,0.048009602880960366,35.0,32.0,3.0,0.0
3130,3131,Movie night musings: Love the private concession stand. Dislike the lack of privacy. Puzzled that he doesn't sell popcorn.,1.0857142857142856,0.048009602880960366,35.0,32.0,3.0,0.0
3131,3132,Order whatever keeps that dog from barking.,1.0851063829787233,0.04114219418674768,47.0,43.0,4.0,0.0
3132,3133,I don't know... what would YOU like for dinner?,1.0833333333333333,0.046717659215115684,36.0,33.0,3.0,0.0
3133,3134,These short term rental sites aren't missing a beat...,1.0833333333333333,0.046717659215115684,36.0,33.0,3.0,0.0
3134,3135,"What are you thinking tonight hon, food or food channel?",1.0833333333333333,0.046717659215115684,36.0,33.0,3.0,0.0
3135,3136,"Honey , I promise you - next time we get a dog we'll keep it outside",1.0810810810810811,0.04549326548811748,37.0,34.0,3.0,0.0
3136,3137,Well at least it's better than going to Chipotle and ordering a Burrito Toilet Bowl.,1.0731707317073171,0.04117547077105887,41.0,38.0,3.0,0.0
3137,3138,Please step out and show us your license.,1.0731707317073171,0.04117547077105887,41.0,38.0,3.0,0.0
3138,3139,"No, I will not put it on the Food Channel",1.0714285714285714,0.07142857142857148,28.0,27.0,0.0,1.0
3139,3140,I'd say AirBNB is thinking out of the box.,1.0714285714285714,0.04956347617776512,28.0,26.0,2.0,0.0
3140,3141,Its Uber's new vendor sharing service.,1.0714285714285714,0.07142857142857148,28.0,27.0,0.0,1.0
3141,3142,"Honey, I could go for a mustard dog. Call Ubereats, willya?",1.0714285714285714,0.04956347617776512,28.0,26.0,2.0,0.0
3142,3143,For the last time....your husband has eaten all of the Vegan Burgers.,1.0714285714285714,0.04956347617776512,28.0,26.0,2.0,0.0
3143,3144,Lunch time habits are hard to break.,1.0714285714285714,0.07142857142857148,28.0,27.0,0.0,1.0
3144,3145,"All you need is love, love, love!",1.0714285714285714,0.04956347617776512,28.0,26.0,2.0,0.0
3145,3146,That comes with potato chips or fries.,1.0714285714285714,0.04956347617776512,28.0,26.0,2.0,0.0
3146,3147,"Believe me, I just love the convenience, but I'm afraid those little wheels in the front are digging into the carpet.",1.0714285714285714,0.04956347617776512,28.0,26.0,2.0,0.0
3147,3148,So I can serve it hot or cold.,1.0714285714285714,0.04956347617776512,28.0,26.0,2.0,0.0
3148,3149,He always shows up when we are watching the Food Channel.,1.0714285714285714,0.04956347617776512,28.0,26.0,2.0,0.0
3149,3150,"Honestly, I'm just sick of the judgmental looks",1.0714285714285714,0.04956347617776512,28.0,26.0,2.0,0.0
3150,3151,Avert your eyes from his. I want to order out.,1.0714285714285714,0.04956347617776512,28.0,26.0,2.0,0.0
3151,3152,This hologram's odor is the real treat.,1.0714285714285714,0.07142857142857148,28.0,27.0,0.0,1.0
3152,3153,Do you think we've overstayed our welcome?,1.0714285714285714,0.04956347617776512,28.0,26.0,2.0,0.0
3153,3154,"Honey, why are there five mirrors on our wall?",1.0714285714285714,0.07142857142857148,28.0,27.0,0.0,1.0
3154,3155,My gluten free roll request annoyed him,1.0714285714285714,0.07142857142857148,28.0,27.0,0.0,1.0
3155,3156,"Your brother isn't afraid to take a stand, is he?",1.0714285714285714,0.04956347617776512,28.0,26.0,2.0,0.0
3156,3157,A crepe food truck for date night would have been more romantic.,1.0714285714285714,0.04956347617776512,28.0,26.0,2.0,0.0
3157,3158,"One permit, please, for here.",1.0714285714285714,0.04956347617776512,28.0,26.0,2.0,0.0
3158,3159,'I'm not too happy with our Wayne's business model - he needs to extend his customer Base.',1.0714285714285714,0.07142857142857148,28.0,27.0,0.0,1.0
3159,3160,Now that he's finished his tiny house maybe he could go sell his tiny hot dogs someplace else.,1.0714285714285714,0.07142857142857148,28.0,27.0,0.0,1.0
3160,3161,"The latest in ""home food service.""",1.0714285714285714,0.07142857142857148,28.0,27.0,0.0,1.0
3161,3162,Let's find another housemate; I can't eat any more chili dogs.,1.0714285714285714,0.04956347617776512,28.0,26.0,2.0,0.0
3162,3163,"""Do you think you could get in some sushi?""@",1.0714285714285714,0.07142857142857148,28.0,27.0,0.0,1.0
3163,3164,Food trucks have become too important to us.,1.0714285714285714,0.04956347617776512,28.0,26.0,2.0,0.0
3164,3165,I'm buying your brother a truck tomorrow!,1.0714285714285714,0.07142857142857148,28.0,27.0,0.0,1.0
3165,3166,Should we tip extra for the 5 story walk-up?,1.0714285714285714,0.04956347617776512,28.0,26.0,2.0,0.0
3166,3167,Can we get that to go?,1.0714285714285714,0.04956347617776512,28.0,26.0,2.0,0.0
3167,3168,"Oh, for Pete's sake!",1.0714285714285714,0.04956347617776512,28.0,26.0,2.0,0.0
3168,3169,I thought my license said okay to double date!,1.0714285714285714,0.04956347617776512,28.0,26.0,2.0,0.0
3169,3170,I like this corner apartment.,1.0714285714285714,0.04956347617776512,28.0,26.0,2.0,0.0
3170,3171,Holy schnikes. It's Mr. Pib!,1.0714285714285714,0.04956347617776512,28.0,26.0,2.0,0.0
3171,3172,I didn't think his summer internship with the food truck with a work-from-home opportunity.,1.0714285714285714,0.04956347617776512,28.0,26.0,2.0,0.0
3172,3173,I told the Kushners I wasn't moving.,1.0714285714285714,0.04956347617776512,28.0,26.0,2.0,0.0
3173,3174,He'll pay his share of the rent in hot dogs.,1.0714285714285714,0.07142857142857148,28.0,27.0,0.0,1.0
3174,3175,"Come on honey! This is a perk, our new insurance company isnt trying to kill us off.",1.0714285714285714,0.04956347617776512,28.0,26.0,2.0,0.0
3175,3176,No more . . . I felafel.,1.0714285714285714,0.07142857142857148,28.0,27.0,0.0,1.0
3176,3177,Commercial breaks solved.,1.0714285714285714,0.04956347617776512,28.0,26.0,2.0,0.0
3177,3178,"""It's just my dad watching me incognito"".",1.0714285714285714,0.04956347617776512,28.0,26.0,2.0,0.0
3178,3179,Next time I'l read the HOA agreement before demanding a dog.,1.0714285714285714,0.04956347617776512,28.0,26.0,2.0,0.0
3179,3180,Does this Airbnb have room service?,1.0714285714285714,0.04956347617776512,28.0,26.0,2.0,0.0
3180,3181,"Ok, all set. I will have a burger, coke, and fries..Everyday.. Forever.",1.0714285714285714,0.04956347617776512,28.0,26.0,2.0,0.0
3181,3182,"""It was prescribed for diet control"".",1.0714285714285714,0.04956347617776512,28.0,26.0,2.0,0.0
3182,3183,Can't you buy a hot dog or something? You got the best sits in the house.,1.0714285714285714,0.07142857142857148,28.0,27.0,0.0,1.0
3183,3184,uughh...I am DONE keeping your loser brother in business.,1.0714285714285714,0.04956347617776512,28.0,26.0,2.0,0.0
3184,3185,I feel like ordering inside.,1.0714285714285714,0.04956347617776512,28.0,26.0,2.0,0.0
3185,3186,"Dad got me this for my birthday- He thought it was cool, like a millennial private chef or something",1.0714285714285714,0.07142857142857148,28.0,27.0,0.0,1.0
3186,3187,"Yes, it’s convenient, but I’m not eating a hot dog with ketchup on it.",1.0714285714285714,0.07142857142857148,28.0,27.0,0.0,1.0
3187,3188,How exactly did you estimate foot traffic to the corner?,1.0714285714285714,0.04956347617776512,28.0,26.0,2.0,0.0
3188,3189,No mor,1.0714285714285714,0.04956347617776512,28.0,26.0,2.0,0.0
3189,3190,"No thanks,I was craving pizza",1.0714285714285714,0.04956347617776512,28.0,26.0,2.0,0.0
3190,3191,"The league's work from home policy is very progressive, if a little misguided.",1.0714285714285714,0.04956347617776512,28.0,26.0,2.0,0.0
3191,3192,"Your right, this is a rerun of the surreal food channel.",1.0714285714285714,0.04956347617776512,28.0,26.0,2.0,0.0
3192,3193,Even the heartburn feels authentic.,1.0714285714285714,0.07142857142857148,28.0,27.0,0.0,1.0
3193,3194,My dad lost his job last September.,1.0714285714285714,0.04956347617776512,28.0,26.0,2.0,0.0
3194,3195,He said he's all out of nothing burgers.,1.0714285714285714,0.04956347617776512,28.0,26.0,2.0,0.0
3195,3196,Airbnb listed hot dog stand nearby - not parked in the living room!,1.0714285714285714,0.04956347617776512,28.0,26.0,2.0,0.0
3196,3197,So what can I get ya?,1.0714285714285714,0.07142857142857148,28.0,27.0,0.0,1.0
3197,3198,Feel like convenience food?,1.0714285714285714,0.04956347617776512,28.0,26.0,2.0,0.0
3198,3199,Wish we had central air.,1.0714285714285714,0.04956347617776512,28.0,26.0,2.0,0.0
3199,3200,"How about a chilli dog, a shake and an episode of House of Cards?",1.0714285714285714,0.04956347617776512,28.0,26.0,2.0,0.0
3200,3201,"Naturally, the nearest food truck sells hot dogs and tacos when I'm in the mood for an ice-cream cone.",1.0714285714285714,0.07142857142857148,28.0,27.0,0.0,1.0
3201,3202,"Sure I said 'no minimum', but this is ridiculous!",1.0714285714285714,0.04956347617776512,28.0,26.0,2.0,0.0
3202,3203,"Wow, IKEA really does keep our living room modern-looking!",1.0714285714285714,0.04956347617776512,28.0,26.0,2.0,0.0
3203,3204,"""Uber Eats"" wanted to upgrade.",1.0714285714285714,0.04956347617776512,28.0,26.0,2.0,0.0
3204,3205,He wants to know if we want fries with that?,1.0714285714285714,0.07142857142857148,28.0,27.0,0.0,1.0
3205,3206,Isn't it time your brother expanded his horizons?,1.0714285714285714,0.07142857142857148,28.0,27.0,0.0,1.0
3206,3207,The competition among the cable companies is getting ridiculous!,1.0714285714285714,0.07142857142857148,28.0,27.0,0.0,1.0
3207,3208,Ice cream truck? Must've been a commercial while I was in the bathroom.,1.0714285714285714,0.04956347617776512,28.0,26.0,2.0,0.0
3208,3209,"""...and that's how street I am"".",1.0714285714285714,0.04956347617776512,28.0,26.0,2.0,0.0
3209,3210,Are you my mother?,1.0714285714285714,0.07142857142857148,28.0,27.0,0.0,1.0
3210,3211,It's not our problem if he picked a bad sub-let.,1.0714285714285714,0.04956347617776512,28.0,26.0,2.0,0.0
3211,3212,"He's staring at us again, and my stomach already hurts.",1.0714285714285714,0.04956347617776512,28.0,26.0,2.0,0.0
3212,3213,Looks like we'll be having thirds tonight.,1.0714285714285714,0.07142857142857148,28.0,27.0,0.0,1.0
3213,3214,"Well, you did say you wanted to eat out more.",1.0714285714285714,0.04956347617776512,28.0,26.0,2.0,0.0
3214,3215,Turn the page...Please turn the page!!,1.0714285714285714,0.04956347617776512,28.0,26.0,2.0,0.0
3215,3216,"No, popcorn will be in the third truck.",1.0714285714285714,0.07142857142857148,28.0,27.0,0.0,1.0
3216,3217,Do you have a permit for that couch?,1.0714285714285714,0.04956347617776512,28.0,26.0,2.0,0.0
3217,3218,Hold the potatoes,1.0714285714285714,0.04956347617776512,28.0,26.0,2.0,0.0
3218,3219,I specifically told that Genie I Wish for a tummy tuck not a food truck .,1.0714285714285714,0.04956347617776512,28.0,26.0,2.0,0.0
3219,3220,"Thanks to our new subletter, we have our own home AND all the avocado toast we can eat!",1.0714285714285714,0.07142857142857148,28.0,27.0,0.0,1.0
3220,3221,This is taking on demand delivery to a whole other level.,1.0714285714285714,0.07142857142857148,28.0,27.0,0.0,1.0
3221,3222,"Hungry or not, I call it greed.",1.0714285714285714,0.04956347617776512,28.0,26.0,2.0,0.0
3222,3223,"Honey, I thought we agreed it's just less awkward if we tip him.",1.0714285714285714,0.04956347617776512,28.0,26.0,2.0,0.0
3223,3224,Couldn't get a residency after med school so I'm trying it out...,1.0714285714285714,0.04956347617776512,28.0,26.0,2.0,0.0
3224,3225,You want mustard on that hot dog?,1.0714285714285714,0.07142857142857148,28.0,27.0,0.0,1.0
3225,3226,"So does this count as ""take home"" or ""delivery""?",1.0714285714285714,0.07142857142857148,28.0,27.0,0.0,1.0
3226,3227,Franchise opportunities are apparently limited.,1.0714285714285714,0.04956347617776512,28.0,26.0,2.0,0.0
3227,3228,You wanna eat in/out?; or do you wanna eat out/out?; or you wanna go out and bring it back in? You never cook for me anymore!,1.0714285714285714,0.04956347617776512,28.0,26.0,2.0,0.0
3228,3229,I told you the doorman drinks.,1.0714285714285714,0.07142857142857148,28.0,27.0,0.0,1.0
3229,3230,This Red Grooms looks so real.,1.0714285714285714,0.04956347617776512,28.0,26.0,2.0,0.0
3230,3231,"What do you feel like, take-out or delivery?",1.0714285714285714,0.04956347617776512,28.0,26.0,2.0,0.0
3231,3232,"Having been cited once again by the Board of Health, fortunately for Mel and Myrna the food truck was parked just down the hall from the bathroom.",1.0714285714285714,0.04956347617776512,28.0,26.0,2.0,0.0
3232,3233,I don't know... should we order out or eat in?,1.0714285714285714,0.04956347617776512,28.0,26.0,2.0,0.0
3233,3234,I'll just have a tossed salad,1.0714285714285714,0.07142857142857148,28.0,27.0,0.0,1.0
3234,3235,Your dad doesn't like me.,1.0714285714285714,0.07142857142857148,28.0,27.0,0.0,1.0
3235,3236,"This is the ""Moneyball"" trailer?",1.0714285714285714,0.07142857142857148,28.0,27.0,0.0,1.0
3236,3237,Maybe you just don't have the stomach for investing.,1.0714285714285714,0.04956347617776512,28.0,26.0,2.0,0.0
3237,3238,It's sanctuary.....his vendor license was discovered to be fake!,1.0714285714285714,0.04956347617776512,28.0,26.0,2.0,0.0
3238,3239,Two with everything hold the onions,1.0714285714285714,0.04956347617776512,28.0,26.0,2.0,0.0
3239,3240,It's time to trade up for a taco truck.,1.0714285714285714,0.04956347617776512,28.0,26.0,2.0,0.0
3240,3241,It's part of my work at home deal,1.0714285714285714,0.07142857142857148,28.0,27.0,0.0,1.0
3241,3242,Delivery IN your home,1.0714285714285714,0.04956347617776512,28.0,26.0,2.0,0.0
3242,3243,What do you mean you don't have chicken and rice?,1.0714285714285714,0.04956347617776512,28.0,26.0,2.0,0.0
3243,3244,"Well son, we did ask you not to bring your work home.",1.0714285714285714,0.04956347617776512,28.0,26.0,2.0,0.0
3244,3245,"When we said get a job, this is not what we meant!",1.0714285714285714,0.04956347617776512,28.0,26.0,2.0,0.0
3245,3246,He claims he's out of corn dogs.,1.0714285714285714,0.04956347617776512,28.0,26.0,2.0,0.0
3246,3247,Let's just eat in tonight.,1.0714285714285714,0.04956347617776512,28.0,26.0,2.0,0.0
3247,3248,"Dinner?...our stomachs are still full from that gluten-full, hydrogenated fat, sugar loaded and cholesterol laden double chili cheese dog at lunch.",1.0714285714285714,0.04956347617776512,28.0,26.0,2.0,0.0
3248,3249,Mom? Dad? Why don't you support my career choice?,1.0714285714285714,0.04956347617776512,28.0,26.0,2.0,0.0
3249,3250,"Well, Trump promised a taco stand in every corner.",1.0714285714285714,0.04956347617776512,28.0,26.0,2.0,0.0
3250,3251,Can we talk about the elephant ear in the room?,1.0714285714285714,0.07142857142857148,28.0,27.0,0.0,1.0
3251,3252,He'll take his hot dog with a side of couch potato.,1.0714285714285714,0.04956347617776512,28.0,26.0,2.0,0.0
3252,3253,"Maybe they meant corner ""of 25th and Spruce"", not ""in 25th and Spruce"".",1.0714285714285714,0.04956347617776512,28.0,26.0,2.0,0.0
3253,3254,"When we're alone like this, do you ever feel strong urges?",1.0714285714285714,0.04956347617776512,28.0,26.0,2.0,0.0
3254,3255,Ever tried a fake hot dog?,1.0714285714285714,0.04956347617776512,28.0,26.0,2.0,0.0
3255,3256,"'Grande,' 'MoltoGrande,' 'ExtremmoGrande' and 'Belligerande.' Same as yesterday.",1.0714285714285714,0.04956347617776512,28.0,26.0,2.0,0.0
3256,3257,It is a reminder to beat the junk food habit.,1.0714285714285714,0.04956347617776512,28.0,26.0,2.0,0.0
3257,3258,"This is like, what? 7-D?",1.0714285714285714,0.07142857142857148,28.0,27.0,0.0,1.0
3258,3259,When does he use the bathroom?,1.0714285714285714,0.04956347617776512,28.0,26.0,2.0,0.0
3259,3260,Try the veal on weck. It's the best in the city.,1.0714285714285714,0.04956347617776512,28.0,26.0,2.0,0.0
3260,3261,We better order or your mother loses her parking space.,1.0714285714285714,0.04956347617776512,28.0,26.0,2.0,0.0
3261,3262,I've served Trump a lot of hot dogs and he always wants Russian dressing on them.,1.0714285714285714,0.04956347617776512,28.0,26.0,2.0,0.0
3262,3263,Takeout again?,1.0714285714285714,0.07142857142857148,28.0,27.0,0.0,1.0
3263,3264,"I mean, I'd still rather have a Poke-Man truck.",1.0714285714285714,0.07142857142857148,28.0,27.0,0.0,1.0
3264,3265,"Sure the boardwalk is cheaper, but this is more convenient.",1.0714285714285714,0.04956347617776512,28.0,26.0,2.0,0.0
3265,3266,"When they said we'd get a '3D Movie Experience with Your New TV,' I had no idea this is what they meant.",1.0714285714285714,0.04956347617776512,28.0,26.0,2.0,0.0
3266,3267,"Great! Not only the way, but when you like it.",1.0714285714285714,0.07142857142857148,28.0,27.0,0.0,1.0
3267,3268,"No, I'm not lazy -- just innovative. Having a vendor here means we don't have to leave our home for food.",1.0714285714285714,0.04956347617776512,28.0,26.0,2.0,0.0
3268,3269,"Yeah, but the wiener water soup is free.",1.0714285714285714,0.07142857142857148,28.0,27.0,0.0,1.0
3269,3270,""" Take your daughter to work day"" is sure a bummer when it rains.",1.0714285714285714,0.07142857142857148,28.0,27.0,0.0,1.0
3270,3271,I'd like to see how Amazon would handle this.,1.0714285714285714,0.07142857142857148,28.0,27.0,0.0,1.0
3271,3272,Buy me some peanuts and crackerjacks. I don't care if I never get back.,1.0714285714285714,0.04956347617776512,28.0,26.0,2.0,0.0
3272,3273,"I tipped him two bucks, and he followed me home.",1.0714285714285714,0.07142857142857148,28.0,27.0,0.0,1.0
3273,3274,"Next time, we don't order the whole Kit 'n Kaboodle.",1.0714285714285714,0.07142857142857148,28.0,27.0,0.0,1.0
3274,3275,Take out? No this is take in.,1.0714285714285714,0.04956347617776512,28.0,26.0,2.0,0.0
3275,3276,Can you turn put on the Food Network?,1.0714285714285714,0.04956347617776512,28.0,26.0,2.0,0.0
3276,3277,There is a remote chance that Vendorella Story was true.,1.0714285714285714,0.04956347617776512,28.0,26.0,2.0,0.0
3277,3278,At least my brother's trying to help. Your brother wouldn't even clean the dishes.,1.0714285714285714,0.07142857142857148,28.0,27.0,0.0,1.0
3278,3279,Fast food wasn't fast enough.,1.0714285714285714,0.04956347617776512,28.0,26.0,2.0,0.0
3279,3280,"So this is the general idea, except outside.",1.0714285714285714,0.07142857142857148,28.0,27.0,0.0,1.0
3280,3281,It's like insurance sales all over again.,1.0714285714285714,0.04956347617776512,28.0,26.0,2.0,0.0
3281,3282,He wanted me to angle the flat screen more his way.,1.0714285714285714,0.04956347617776512,28.0,26.0,2.0,0.0
3282,3283,So how long will the kitchen re-model take?,1.0714285714285714,0.07142857142857148,28.0,27.0,0.0,1.0
3283,3284,Mellinial generation reality commercial.,1.0714285714285714,0.07142857142857148,28.0,27.0,0.0,1.0
3284,3285,The competition for food truck spaces is brutal.,1.0714285714285714,0.04956347617776512,28.0,26.0,2.0,0.0
3285,3286,"Okay so far, but what about the Ferris Wheel?",1.0714285714285714,0.07142857142857148,28.0,27.0,0.0,1.0
3286,3287,Who's going to tell Frank that we are going vegan?,1.0714285714285714,0.04956347617776512,28.0,26.0,2.0,0.0
3287,3288,That Friday you stayed home together because you both started a diet.,1.0714285714285714,0.04956347617776512,28.0,26.0,2.0,0.0
3288,3289,It's Taco Tuesday again!,1.0714285714285714,0.04956347617776512,28.0,26.0,2.0,0.0
3289,3290,Think they have an app we could use to make our order?,1.0714285714285714,0.07142857142857148,28.0,27.0,0.0,1.0
3290,3291,I'm going to the bathroom for a pretzel.,1.0714285714285714,0.07142857142857148,28.0,27.0,0.0,1.0
3291,3292,I would order up some privacy but that's pretty expensive these days.,1.0714285714285714,0.04956347617776512,28.0,26.0,2.0,0.0
3292,3293,I thought we rest on sundaes.,1.0714285714285714,0.04956347617776512,28.0,26.0,2.0,0.0
3293,3294,Its another helpful 'suggestion' from the Progressive Thought Police --Home Food Monitoring.,1.0714285714285714,0.04956347617776512,28.0,26.0,2.0,0.0
3294,3295,I am not sure if we did the right decision when we rented the fast food equipped apartment.,1.0714285714285714,0.07142857142857148,28.0,27.0,0.0,1.0
3295,3296,I believe that my penchant for wanderlust has now officially disappeared.,1.0714285714285714,0.04956347617776512,28.0,26.0,2.0,0.0
3296,3297,"Uh, let's try no mustard this time.",1.0714285714285714,0.04956347617776512,28.0,26.0,2.0,0.0
3297,3298,At Home with The Chestnuts.,1.0714285714285714,0.04956347617776512,28.0,26.0,2.0,0.0
3298,3299,I thought the Republicans were afraid of taco stands on every corner is this McConnell's replacement plan,1.0714285714285714,0.04956347617776512,28.0,26.0,2.0,0.0
3299,3300,"If I make enough money, I'll be in a position to buy a car and move out.",1.0714285714285714,0.04956347617776512,28.0,26.0,2.0,0.0
3300,3301,It really is a vast waistland.,1.0714285714285714,0.04956347617776512,28.0,26.0,2.0,0.0
3301,3302,This is how Joey Chestnut trains.,1.0714285714285714,0.04956347617776512,28.0,26.0,2.0,0.0
3302,3303,You were supposed to order Netflix!,1.0714285714285714,0.07142857142857148,28.0,27.0,0.0,1.0
3303,3304,5D tv is great until your order never gets made.,1.0714285714285714,0.04956347617776512,28.0,26.0,2.0,0.0
3304,3305,I thought we'd order in from foodcart.com.,1.0714285714285714,0.04956347617776512,28.0,26.0,2.0,0.0
3305,3306,I really prefer to support our local brick-and-mortar merchants,1.0714285714285714,0.07142857142857148,28.0,27.0,0.0,1.0
3306,3307,"Okay, one more ""spoiler alert!"" and you lose your license",1.0714285714285714,0.07142857142857148,28.0,27.0,0.0,1.0
