,rank,caption,score,precision,count,unfunny,somewhat_funny,funny
2224,2225,"I wish he delivered, too.",1.135135135135135,0.05697797585888971,37.0,32.0,5.0,0.0
2225,2226,Maybe we shouldn't have requested free shipping for those tv trays.,1.135135135135135,0.06890566910260519,37.0,33.0,3.0,1.0
2226,2227,Do you think Amazon's gone a little too far with their customer service?,1.135135135135135,0.05697797585888971,37.0,32.0,5.0,0.0
2227,2228,"I bought some peanuts and Cracker Jack, but I can't convince him that I did care to get back.",1.135135135135135,0.06890566910260519,37.0,33.0,3.0,1.0
2228,2229,"I don't care what they say, I like having a taco truck in every corner.",1.135135135135135,0.05697797585888971,37.0,32.0,5.0,0.0
2229,2230,I only have him in for dinner hours.,1.135135135135135,0.07905373321974883,37.0,34.0,1.0,2.0
2230,2231,"Honey, I think I know why you got it for 100% off at Amazon.",1.135135135135135,0.06890566910260519,37.0,33.0,3.0,1.0
2231,2232,Keeping him? Depends on the results of my blood test.,1.135135135135135,0.06890566910260519,37.0,33.0,3.0,1.0
2232,2233,He's doing a fund-raiser. He's hoping to raise enough money to move to Portland.,1.135135135135135,0.05697797585888971,37.0,32.0,5.0,0.0
2233,2234,I feel we're holding back Manolito from reaching his full potential.,1.135135135135135,0.07905373321974883,37.0,34.0,1.0,2.0
2234,2235,I didn't understand the meaning of takeout!,1.135135135135135,0.05697797585888971,37.0,32.0,5.0,0.0
2235,2236,"Just act cool honey, he's more afraid of us than we are of him",1.135135135135135,0.05697797585888971,37.0,32.0,5.0,0.0
2236,2237,How long have you been agoraphobic?,1.135135135135135,0.06890566910260519,37.0,33.0,3.0,1.0
2237,2238,When he said 'On the house' this is not what I had in mind.,1.135135135135135,0.06890566910260519,37.0,33.0,3.0,1.0
2238,2239,Let me introduce you to our new in-home personal chef.,1.135135135135135,0.05697797585888971,37.0,32.0,5.0,0.0
2239,2240,TV dinners really have gotten better.,1.135135135135135,0.06890566910260519,37.0,33.0,3.0,1.0
2240,2241,I only subscribed for The Hot Dog's Tale,1.135135135135135,0.06890566910260519,37.0,33.0,3.0,1.0
2241,2242,"He says that it may be our living room, but it's still his stand: no ketchup.",1.135135135135135,0.06890566910260519,37.0,33.0,3.0,1.0
2242,2243,"Experts told me to be a success in this business, I just needed to find a good corner.",1.135135135135135,0.06890566910260519,37.0,33.0,3.0,1.0
2243,2244,I was craving Asian.,1.135135135135135,0.06890566910260519,37.0,33.0,3.0,1.0
2244,2245,He's here so I can binge eat tacos while I binge watch Netflix.,1.135135135135135,0.06890566910260519,37.0,33.0,3.0,1.0
2245,2246,"I'm sorry, son, I misunderstood what you meant by a ""home office.""",1.135135135135135,0.06890566910260519,37.0,33.0,3.0,1.0
2246,2247,"Ehh, I'd really prefer Chinese.",1.135135135135135,0.05697797585888971,37.0,32.0,5.0,0.0
2247,2248,Whaddaya mean no more hot dogs?,1.135135135135135,0.05697797585888971,37.0,32.0,5.0,0.0
2248,2249,"A Taco Truck on every corner, and a Taco Cart in every living room.",1.135135135135135,0.05697797585888971,37.0,32.0,5.0,0.0
2249,2250,Don't pay any attention to my Dad. He was forced out by his corporate partners.,1.135135135135135,0.06890566910260519,37.0,33.0,3.0,1.0
2250,2251,You have to hand it to him...this IS more convenient than Postmates.,1.135135135135135,0.05697797585888971,37.0,32.0,5.0,0.0
2251,2252,I think you were a little bit hasty in selling your car to finance the food truck.,1.135135135135135,0.06890566910260519,37.0,33.0,3.0,1.0
2252,2253,"If the food was better, I wouldn't mind as much.",1.135135135135135,0.05697797585888971,37.0,32.0,5.0,0.0
2253,2254,They did say that the flat was fully furnished.,1.135135135135135,0.05697797585888971,37.0,32.0,5.0,0.0
2254,2255,"I said, let's order a dinner not a diner!",1.135135135135135,0.06890566910260519,37.0,33.0,3.0,1.0
2255,2256,This isn't what I had in mind when we talked about spicing things up at home.,1.135135135135135,0.06890566910260519,37.0,33.0,3.0,1.0
2256,2257,Not only did we not order hot-dogs...but how did he get in here?,1.135135135135135,0.05697797585888971,37.0,32.0,5.0,0.0
2257,2258,He decided to work from home.,1.135135135135135,0.05697797585888971,37.0,32.0,5.0,0.0
2258,2259,I'm not sure how I feel about the Halal Roommates.,1.135135135135135,0.05697797585888971,37.0,32.0,5.0,0.0
2259,2260,Junior's internship is running pretty smoothly.,1.135135135135135,0.05697797585888971,37.0,32.0,5.0,0.0
2260,2261,Third week in a row he opened up 5 minutes before Game of Thrones. This guy really knows his customer base.,1.135135135135135,0.06890566910260519,37.0,33.0,3.0,1.0
2261,2262,He said it was more profitable to just follow me around.,1.135135135135135,0.05697797585888971,37.0,32.0,5.0,0.0
2262,2263,Would you like some couch potato fries with that?,1.135135135135135,0.06890566910260519,37.0,33.0,3.0,1.0
2263,2264,"When you said you subscribed to a 'meal in a box' service, I was thinking more of Blue Apron",1.135135135135135,0.05697797585888971,37.0,32.0,5.0,0.0
2264,2265,Next time we get the cable package with the draft beer.,1.135135135135135,0.06890566910260519,37.0,33.0,3.0,1.0
2265,2266,"But, will be deliver?",1.135135135135135,0.05697797585888971,37.0,32.0,5.0,0.0
2266,2267,"Hey, can you tilt it this way a little? I can't see.",1.135135135135135,0.05697797585888971,37.0,32.0,5.0,0.0
2267,2268,"They had a concierge option, so I thought we'd try it out.",1.135135135135135,0.06890566910260519,37.0,33.0,3.0,1.0
2268,2269,Couldn't you have just brought me an I <3 NY shirt instead?,1.135135135135135,0.07905373321974883,37.0,34.0,1.0,2.0
2269,2270,"Ryan, this isn't helping your weightloss."" ""I know, but my friends love it on the Super Bowl.",1.135135135135135,0.05697797585888971,37.0,32.0,5.0,0.0
2270,2271,How was I supposed to know that not all personal chefs are not the same?,1.135135135135135,0.06890566910260519,37.0,33.0,3.0,1.0
2271,2272,For success in the Falafel business it's location location location,1.135135135135135,0.06890566910260519,37.0,33.0,3.0,1.0
2272,2273,How long is his Airbnb contract?,1.135135135135135,0.07905373321974883,37.0,34.0,1.0,2.0
2273,2274,Figured we should grab one before they defund Meals on Wheels.,1.135135135135135,0.05697797585888971,37.0,32.0,5.0,0.0
2274,2275,I thought pop-up meant they'd just show up occasionally.,1.135135135135135,0.06890566910260519,37.0,33.0,3.0,1.0
2275,2276,'I ordered it by accident on Amazon and I'm too lazy to return it.',1.135135135135135,0.06890566910260519,37.0,33.0,3.0,1.0
2276,2277,Everyone's switching to the falafel cart these days.,1.135135135135135,0.07905373321974883,37.0,34.0,1.0,2.0
2277,2278,I regret agreeing to partner with your brother in his pop-up hot dog stand.,1.135135135135135,0.07905373321974883,37.0,34.0,1.0,2.0
2278,2279,Couldn't have just gone with the Olde Popcorn Cart. You needed THAT Amazon experience.,1.135135135135135,0.05697797585888971,37.0,32.0,5.0,0.0
2279,2280,Let's eat in tonight.,1.135135135135135,0.05697797585888971,37.0,32.0,5.0,0.0
2280,2281,"I think Tony is beginning to appreciate the concept of location, location, location.",1.135135135135135,0.05697797585888971,37.0,32.0,5.0,0.0
2281,2282,This is not what I envisioned when your brother said he would bring dinner.,1.135135135135135,0.06890566910260519,37.0,33.0,3.0,1.0
2282,2283,Now if they'd just lower their prices...,1.135135135135135,0.06890566910260519,37.0,33.0,3.0,1.0
2283,2284,"Thanks for being here, but we're binge-watching; we'll binge-eat later.",1.135135135135135,0.06890566910260519,37.0,33.0,3.0,1.0
2284,2285,Maybe an unpaid summer internship would have been a better plan.,1.135135135135135,0.06890566910260519,37.0,33.0,3.0,1.0
2285,2286,"Sorry, I thought you'd drum up some business with my kids and their friends if you set up shop here.",1.135135135135135,0.06890566910260519,37.0,33.0,3.0,1.0
2286,2287,"I know you're proud of your dad's new business, but I can't keep eating hotdogs for dinner.",1.135135135135135,0.06890566910260519,37.0,33.0,3.0,1.0
2287,2288,It's the next best thing to being there.,1.135135135135135,0.05697797585888971,37.0,32.0,5.0,0.0
2288,2289,I hate it when Dad brings his work home with him.,1.135135135135135,0.05697797585888971,37.0,32.0,5.0,0.0
2289,2290,ARE YOU AS COMMITTED TO THE URBAN EXPERIENCE AS I AM?,1.135135135135135,0.05697797585888971,37.0,32.0,5.0,0.0
2290,2291,Could your dad pass me another frankfurter?,1.135135135135135,0.06890566910260519,37.0,33.0,3.0,1.0
2291,2292,I don't know... let's eat in tonight.,1.135135135135135,0.05697797585888971,37.0,32.0,5.0,0.0
2292,2293,They first began to appear in Colorado and Washington a few years ago.,1.135135135135135,0.06890566910260519,37.0,33.0,3.0,1.0
2293,2294,I dunno -- where do /you/ want to eat?,1.135135135135135,0.06890566910260519,37.0,33.0,3.0,1.0
2294,2295,You might've mentioned the vegan thing up front.,1.135135135135135,0.06890566910260519,37.0,33.0,3.0,1.0
2295,2296,"Do I have to order ""a la cart?",1.135135135135135,0.07905373321974883,37.0,34.0,1.0,2.0
2296,2297,You said he'd move out if he got a job,1.135135135135135,0.06890566910260519,37.0,33.0,3.0,1.0
2297,2298,I think you forgot to give him a tip.,1.135135135135135,0.06890566910260519,37.0,33.0,3.0,1.0
2298,2299,"Next time you want to order in, let me make the call.",1.135135135135135,0.05697797585888971,37.0,32.0,5.0,0.0
2299,2300,"Dear, I'm sure this is not how Portillos got started.",1.135135135135135,0.06890566910260519,37.0,33.0,3.0,1.0
2300,2301,Nothing about this was seamless.,1.135135135135135,0.06890566910260519,37.0,33.0,3.0,1.0
2301,2302,"Well, one thing's for sure - it's not the ""work from home"" scenario I envisioned when I signed up.",1.135135135135135,0.07905373321974883,37.0,34.0,1.0,2.0
2302,2303,No. Tell him to come here.,1.135135135135135,0.07905373321974883,37.0,34.0,1.0,2.0
2303,2304,Should we raise his allowance?,1.135135135135135,0.06890566910260519,37.0,33.0,3.0,1.0
2304,2305,Do you think he'd get offended if I asked for some Grey Poupon?,1.135135135135135,0.07905373321974883,37.0,34.0,1.0,2.0
2305,2306,"No, it is not very lucrative but I like to build relationships with my customers.",1.135135135135135,0.06890566910260519,37.0,33.0,3.0,1.0
2306,2307,We don't deliver.,1.135135135135135,0.06890566910260519,37.0,33.0,3.0,1.0
2307,2308,It's better than health insurance.,1.135135135135135,0.05697797585888971,37.0,32.0,5.0,0.0
2308,2309,Four years of college and he is back home!,1.135135135135135,0.06890566910260519,37.0,33.0,3.0,1.0
2309,2310,Can you do Asian Fusion tonight?,1.135135135135135,0.07905373321974883,37.0,34.0,1.0,2.0
2310,2311,Let's go out for dinner tonight.,1.135135135135135,0.07905373321974883,37.0,34.0,1.0,2.0
2311,2312,Gary decided to work from home today.,1.135135135135135,0.05697797585888971,37.0,32.0,5.0,0.0
2312,2313,Isn't it great that Junior can work from home?,1.135135135135135,0.07905373321974883,37.0,34.0,1.0,2.0
2313,2314,"Ok, maybe I have been eating a lot of hot dogs.",1.135135135135135,0.06890566910260519,37.0,33.0,3.0,1.0
2314,2315,"Finally, our son got a job.",1.135135135135135,0.05697797585888971,37.0,32.0,5.0,0.0
2315,2316,Air B 'n' Eats seemed like such a solid idea at the time,1.135135135135135,0.05697797585888971,37.0,32.0,5.0,0.0
2316,2317,'I guess HD meant hot dog',1.135135135135135,0.07905373321974883,37.0,34.0,1.0,2.0
2317,2318,I just don't feel his prices are competitive.,1.135135135135135,0.06890566910260519,37.0,33.0,3.0,1.0
2318,2319,It's my lunch revisiting!,1.135135135135135,0.06890566910260519,37.0,33.0,3.0,1.0
2319,2320,I don't care what your cousin said. That corner doesn't get a lot of traffic.,1.135135135135135,0.06890566910260519,37.0,33.0,3.0,1.0
2320,2321,"I know you feel he rescued you, but you're gonna have to release him back into the wild",1.135135135135135,0.07905373321974883,37.0,34.0,1.0,2.0
2321,2322,"Well, you wanted my brother to get a job.",1.135135135135135,0.06890566910260519,37.0,33.0,3.0,1.0
2322,2323,Your father so did specify bringing home the bacon.,1.135135135135135,0.05697797585888971,37.0,32.0,5.0,0.0
2323,2324,"Today there is no privacy anywhere, not in cyberspace, nor in real space.",1.135135135135135,0.05697797585888971,37.0,32.0,5.0,0.0
2324,2325,"Just ignore him, he's semi-retired.",1.135135135135135,0.06890566910260519,37.0,33.0,3.0,1.0
2325,2326,Baseball and a hotdog... its just not the same without the smell of the crowd.,1.135135135135135,0.06890566910260519,37.0,33.0,3.0,1.0
2326,2327,For a more interactive baseball experience,1.135135135135135,0.06890566910260519,37.0,33.0,3.0,1.0
2327,2328,Exactly what Trump promised us for our son's financial future: MAGA by going 'Back to Basics and the Good Old Days'.,1.135135135135135,0.06890566910260519,37.0,33.0,3.0,1.0
2328,2329,Looks like Amazon is going after the food truck industry.,1.135135135135135,0.05697797585888971,37.0,32.0,5.0,0.0
2329,2330,You wanna eat out tonight?,1.135135135135135,0.06890566910260519,37.0,33.0,3.0,1.0
2330,2331,"Here, let me buzz you in.",1.135135135135135,0.06890566910260519,37.0,33.0,3.0,1.0
2331,2332,Our new neighbor's no great shakes.,1.135135135135135,0.05697797585888971,37.0,32.0,5.0,0.0
2332,2333,"It's very convenient, we just have to cover his health insurance.",1.135135135135135,0.05697797585888971,37.0,32.0,5.0,0.0
2333,2334,I felt we needed to live with more relish.,1.135135135135135,0.06890566910260519,37.0,33.0,3.0,1.0
2334,2335,The bell tolls for you.,1.135135135135135,0.05697797585888971,37.0,32.0,5.0,0.0
2335,2336,It was in the latest delivery from Hello Hot Dogs.,1.135135135135135,0.05697797585888971,37.0,32.0,5.0,0.0
2336,2337,"It was this or a brewery, you wanted to move to Portland.",1.135135135135135,0.05697797585888971,37.0,32.0,5.0,0.0
2337,2338,I thought it was taco trucks that were everywhere.,1.135135135135135,0.05697797585888971,37.0,32.0,5.0,0.0
2338,2339,"When I said ""Why don't you order a meal kit,"" I didn't mean this.",1.135135135135135,0.06890566910260519,37.0,33.0,3.0,1.0
2339,2340,"He is going to pay rent, right?",1.135135135135135,0.05697797585888971,37.0,32.0,5.0,0.0
2340,2341,But are they organic?,1.135135135135135,0.07905373321974883,37.0,34.0,1.0,2.0
2341,2342,It's the Uber of hot dogs.,1.135135135135135,0.06890566910260519,37.0,33.0,3.0,1.0
2342,2343,How about we order carryout tonight?,1.135135135135135,0.05697797585888971,37.0,32.0,5.0,0.0
2343,2344,This way I can always be first in line.,1.135135135135135,0.05697797585888971,37.0,32.0,5.0,0.0
2344,2345,"When I said "" To take away"" , I did'nt mean the whole truck!",1.135135135135135,0.06890566910260519,37.0,33.0,3.0,1.0
2345,2346,"Why don't we go out to a French restaurant for a change.""",1.135135135135135,0.05697797585888971,37.0,32.0,5.0,0.0
2346,2347,Making concessions,1.135135135135135,0.05697797585888971,37.0,32.0,5.0,0.0
2347,2348,"Well you did say you wanted your food to-go, right?",1.135135135135135,0.06890566910260519,37.0,33.0,3.0,1.0
2348,2349,Good corners are hard to find,1.135135135135135,0.07905373321974883,37.0,34.0,1.0,2.0
2349,2350,It actually gets a lot busier around here when you guys are at work.,1.135135135135135,0.06890566910260519,37.0,33.0,3.0,1.0
2350,2351,I'm not leaving until you pay for the peanuts!,1.135135135135135,0.06890566910260519,37.0,33.0,3.0,1.0
2351,2352,Too bad it gives me the runs.,1.135135135135135,0.06890566910260519,37.0,33.0,3.0,1.0
2352,2353,"Honey, this isn’t what I meant when I told you I wanted to spice up our home life",1.135135135135135,0.05697797585888971,37.0,32.0,5.0,0.0
2353,2354,"Listen, if you guys don't order more food soon, I'm taking my business elsewhere.",1.135135135135135,0.05697797585888971,37.0,32.0,5.0,0.0
2354,2355,"The works, please. Who says you can't have it all?",1.135135135135135,0.06890566910260519,37.0,33.0,3.0,1.0
2355,2356,"Well, it does answer the question ""what's for dinner""?",1.135135135135135,0.06890566910260519,37.0,33.0,3.0,1.0
2356,2357,I still think it's strange that they don't deliver..,1.135135135135135,0.05697797585888971,37.0,32.0,5.0,0.0
2357,2358,Why do I get the feeling we're never going out again?,1.135135135135135,0.05697797585888971,37.0,32.0,5.0,0.0
2358,2359,I think your father still wishes you would marry Joey Chestnut.,1.135135135135135,0.05697797585888971,37.0,32.0,5.0,0.0
2359,2360,You said you wanted to redo the kitchen.,1.135135135135135,0.06890566910260519,37.0,33.0,3.0,1.0
2360,2361,I got tired of having to buzz-in the delivery guy.,1.135135135135135,0.07905373321974883,37.0,34.0,1.0,2.0
2361,2362,On demand service is getting a bit ridiculous.,1.135135135135135,0.06890566910260519,37.0,33.0,3.0,1.0
2362,2363,Open the windows or we'll never get the smell out of the furniture!,1.135135135135135,0.06890566910260519,37.0,33.0,3.0,1.0
2363,2364,"Apparently the meat is locally sourced. By the way, have you seen Fido?",1.135135135135135,0.05697797585888971,37.0,32.0,5.0,0.0
2364,2365,This gives a whole new meaning to the local food movement.,1.135135135135135,0.05697797585888971,37.0,32.0,5.0,0.0
2365,2366,This is too much. They shoulda stopped with the 3D after Avatar.,1.135135135135135,0.05697797585888971,37.0,32.0,5.0,0.0
2366,2367,I have pressed on the pause button and you can order hot dogs now.,1.135135135135135,0.06890566910260519,37.0,33.0,3.0,1.0
2367,2368,"I'm going to give only 2 stars. The Air B&B description didn't say ""cash breakfast"".",1.135135135135135,0.07905373321974883,37.0,34.0,1.0,2.0
2368,2369,So that's why our house smells like hot dogs,1.135135135135135,0.06890566910260519,37.0,33.0,3.0,1.0
2369,2370,"Next time, check the fine print.",1.135135135135135,0.06890566910260519,37.0,33.0,3.0,1.0
2370,2371,I call it Netflix and Chili dog.,1.135135135135135,0.06890566910260519,37.0,33.0,3.0,1.0
2371,2372,"Whatever you do, don’t get in a debate with that food shamer about putting ketchup on a hotdog.",1.1346153846153846,0.04779328093727965,52.0,45.0,7.0,0.0
2372,2373,How is your book coming along?,1.1333333333333333,0.06030226891555274,45.0,40.0,4.0,1.0
2373,2374,I heard your brother is thinking of starting a food-truck business.,1.1333333333333333,0.06816498108607269,45.0,41.0,2.0,2.0
2374,2375,"Mom, Dad....this is not exactly what I meant by branching out on my own!!",1.131578947368421,0.05557219020090345,38.0,33.0,5.0,0.0
2375,2376,Shall we order take-out?,1.131578947368421,0.06716206838991055,38.0,34.0,3.0,1.0
2376,2377,"Its all locally sourced honey, I swear.",1.131578947368421,0.05557219020090345,38.0,33.0,5.0,0.0
2377,2378,"Ok, I get it. Every now and then you want me to cook hotdogs.",1.131578947368421,0.05557219020090345,38.0,33.0,5.0,0.0
2378,2379,Can you teach her the basics?,1.131578947368421,0.06716206838991055,38.0,34.0,3.0,1.0
2379,2380,let's just do 'take out' next time..,1.131578947368421,0.05557219020090345,38.0,33.0,5.0,0.0
2380,2381,Did you order stake out?,1.131578947368421,0.06716206838991055,38.0,34.0,3.0,1.0
2381,2382,I'm tossing up between the heart disease and the diabetes.,1.131578947368421,0.05557219020090345,38.0,33.0,5.0,0.0
2382,2383,"I know I didn't want him to be discovered, but this might be a little much",1.131578947368421,0.05557219020090345,38.0,33.0,5.0,0.0
2383,2384,"I dont know, he just insists he'll make more money here when it's raining outside",1.1304347826086956,0.059047967499893876,46.0,41.0,4.0,1.0
2384,2385,I still can't figure out how he got the car through the door,1.1282051282051282,0.05423355275954148,39.0,34.0,5.0,0.0
2385,2386,I see you have Amazon Prime beef,1.1282051282051282,0.06550424345215436,39.0,35.0,3.0,1.0
2386,2387,You two are my last dieter hallucination of the day.,1.1282051282051282,0.05423355275954148,39.0,34.0,5.0,0.0
2387,2388,They taste better at the ball game..,1.1282051282051282,0.05423355275954148,39.0,34.0,5.0,0.0
2388,2389,Seamless is really outdoing itself.,1.1282051282051282,0.05423355275954148,39.0,34.0,5.0,0.0
2389,2390,"I don't know, I was thinking sushi.",1.1282051282051282,0.05423355275954148,39.0,34.0,5.0,0.0
2390,2391,Your father needs a new hobby,1.1282051282051282,0.05423355275954148,39.0,34.0,5.0,0.0
2391,2392,I don't know why look so surprised? I told you this DVD came with a tasty trailer.,1.127659574468085,0.06535338561028703,47.0,43.0,2.0,2.0
2392,2393,"'I dunno, love. We still think you should have bought the car first.'",1.125,0.07327066086497203,40.0,37.0,1.0,2.0
2393,2394,There's never anything good on the grill.,1.1219512195121952,0.05173952057462535,41.0,36.0,5.0,0.0
2394,2395,This is a weird waiting room for an addiction specialist.,1.1219512195121952,0.05173952057462535,41.0,36.0,5.0,0.0
2395,2396,I'm starting to doubt working from home is the answer,1.1219512195121952,0.05173952057462535,41.0,36.0,5.0,0.0
2396,2397,"With this HD TV, you'd swear they were right in the room.",1.1176470588235294,0.07020095781645354,34.0,31.0,2.0,1.0
2397,2398,If only it was within arm's reach.,1.1176470588235294,0.07020095781645354,34.0,31.0,2.0,1.0
2398,2399,"I can't take your order, I'm hot dog stand monitor.",1.1176470588235294,0.05608603466150544,34.0,30.0,4.0,0.0
2399,2400,"Well, he's wearing a blue apron...doesn't that count for something?",1.1176470588235294,0.05608603466150544,34.0,30.0,4.0,0.0
2400,2401,I call it farm to table.2--it's for people that need their food right now.,1.1176470588235294,0.07020095781645354,34.0,31.0,2.0,1.0
2401,2402,Did somebody here order take-in?,1.1176470588235294,0.07020095781645354,34.0,31.0,2.0,1.0
2402,2403,"No, I said 'Netflix and chili dogs.'",1.1176470588235294,0.05608603466150544,34.0,30.0,4.0,0.0
2403,2404,"This is the ""Best Baseball Date, Ever""?",1.1176470588235294,0.05608603466150544,34.0,30.0,4.0,0.0
2404,2405,Do we have to go all the way down there?,1.1176470588235294,0.05608603466150544,34.0,30.0,4.0,0.0
2405,2406,"The time has come for you to face your latent agoraphobia, Frank.",1.1176470588235294,0.07020095781645354,34.0,31.0,2.0,1.0
2406,2407,Are we having take in tonight?,1.1176470588235294,0.07020095781645354,34.0,31.0,2.0,1.0
2407,2408,Our very own personal chef.,1.1176470588235294,0.07020095781645354,34.0,31.0,2.0,1.0
2408,2409,It's getting harder to wait for the commercials.,1.1176470588235294,0.07020095781645354,34.0,31.0,2.0,1.0
2409,2410,"Joe, he's watching us.",1.1176470588235294,0.05608603466150544,34.0,30.0,4.0,0.0
2410,2411,"No seriously, I'm exhausted, see if he'll deliver.",1.1176470588235294,0.07020095781645354,34.0,31.0,2.0,1.0
2411,2412,It's worth every penny not having to wait in line.,1.1176470588235294,0.05608603466150544,34.0,30.0,4.0,0.0
2412,2413,You know he's behind on rent.,1.1176470588235294,0.05608603466150544,34.0,30.0,4.0,0.0
2413,2414,I thought we'did eat in tonight.,1.1176470588235294,0.07020095781645354,34.0,31.0,2.0,1.0
2414,2415,"So glad we're sharing all the housework. I'm in charge of supper on Monday, Wednesday, Friday. Now we'll always know it'll be hot and delicious.",1.1176470588235294,0.05608603466150544,34.0,30.0,4.0,0.0
2415,2416,"If they're silly enough to caption this, they may be silly enough to come over and buy a hot dog.",1.1176470588235294,0.07020095781645354,34.0,31.0,2.0,1.0
2416,2417,Let's just kick him to the curb.,1.1176470588235294,0.07020095781645354,34.0,31.0,2.0,1.0
2417,2418,What makes you think he's homeless?,1.1176470588235294,0.05608603466150544,34.0,30.0,4.0,0.0
2418,2419,"I don't mind your brother staying with us for a while, but does he have to telecommute?",1.1176470588235294,0.07020095781645354,34.0,31.0,2.0,1.0
2419,2420,Next time don't tell your brother dinner is pot luck.,1.1176470588235294,0.07020095781645354,34.0,31.0,2.0,1.0
2420,2421,"Add fish tacos to your menu, and we'll let you go.",1.1176470588235294,0.05608603466150544,34.0,30.0,4.0,0.0
2421,2422,Mom? Dad? Nothing?,1.1176470588235294,0.07020095781645354,34.0,31.0,2.0,1.0
2422,2423,I say we go back to using a microwave.,1.1176470588235294,0.05608603466150544,34.0,30.0,4.0,0.0
2423,2424,Why do they never have the popcorn that I like?,1.1176470588235294,0.05608603466150544,34.0,30.0,4.0,0.0
2424,2425,"What I said was, 'I think we could use a nightLIGHT in here.'",1.1176470588235294,0.05608603466150544,34.0,30.0,4.0,0.0
2425,2426,"Do you serve Netflix, chilled?",1.1176470588235294,0.07020095781645354,34.0,31.0,2.0,1.0
2426,2427,"Yes, he does have a permission for that.",1.1176470588235294,0.07020095781645354,34.0,31.0,2.0,1.0
2427,2428,We should have gone with the mime motif.,1.1176470588235294,0.05608603466150544,34.0,30.0,4.0,0.0
2428,2429,This guy just doesn't cut the mustard.,1.1176470588235294,0.05608603466150544,34.0,30.0,4.0,0.0
2429,2430,Are you going to tell him that we are going vegan and gluten free or should I?,1.1176470588235294,0.07020095781645354,34.0,31.0,2.0,1.0
2430,2431,"Either this is your hallucination or mine. Either I am your worst nightmare, or you are mine.",1.1176470588235294,0.05608603466150544,34.0,30.0,4.0,0.0
2431,2432,Who needs takeout anymore?,1.1176470588235294,0.07020095781645354,34.0,31.0,2.0,1.0
2432,2433,SON. WHAT CORNER WOULD YOU LIKE TO SELL YOUR HOTDOGS ON?,1.1176470588235294,0.07020095781645354,34.0,31.0,2.0,1.0
2433,2434,Boy Amazon's latest offer to sign up for Fire TV and you get to try their al a carte service for free was this literal?,1.1176470588235294,0.07020095781645354,34.0,31.0,2.0,1.0
2434,2435,Gluten free hot dogs will set you free,1.1176470588235294,0.07020095781645354,34.0,31.0,2.0,1.0
2435,2436,Not exactly what I had in mind when suggesting we get our own Food Cart,1.1176470588235294,0.07020095781645354,34.0,31.0,2.0,1.0
2436,2437,The realtor did say we'd have a view of the park.,1.1176470588235294,0.07020095781645354,34.0,31.0,2.0,1.0
2437,2438,What time do your Book Club members come over?,1.1176470588235294,0.07020095781645354,34.0,31.0,2.0,1.0
