,target_id,mean,precision,count,score,caption,contest
2903,1299,1.234375,0.061970725215460876,64,1.234375,Since McDonalds has supersized their menu we have decided to do the same.,589
2904,1316,1.234375,0.061970725215460876,64,1.234375,I'll be right back with the wine list.,589
2905,1381,1.234375,0.05783026057090191,64,1.234375,Many of our customers asked for a larger menu.,589
2906,1495,1.234375,0.061970725215460876,64,1.234375,May I interest you in today's specials?,589
2907,1514,1.234375,0.061970725215460876,64,1.234375,Would you like to hear about our specials?,589
2908,1552,1.234375,0.06951571243822256,64,1.234375,Keeping up with Texas.,589
2909,1559,1.234375,0.061970725215460876,64,1.234375,Would you like me to recite all the options?,589
2910,1583,1.234375,0.061970725215460876,64,1.234375,Take your time. I'll be back in a few hours.,589
2911,1586,1.234375,0.06585136695439135,64,1.234375,Wait til you see our list of specials.,589
2912,1587,1.234375,0.061970725215460876,64,1.234375,May I tell you about the specials?,589
2913,1750,1.234375,0.06585136695439135,64,1.234375,I’ll bring you our wine list as soon as the forklift is available.,589
2914,1756,1.234375,0.061970725215460876,64,1.234375,You really used some big words here,589
2915,1773,1.234375,0.061970725215460876,64,1.234375,Ah. Yes. We've added a new craft beer selection.,589
2916,1787,1.234375,0.05783026057090191,64,1.234375,Now that’s a tall order.,589
2917,1811,1.234375,0.04850026335634602,64,1.234375,"Would you like to,hear the daily specials?",589
2918,1826,1.234375,0.07299634252361824,64,1.234375,"The menu just reflects our prices, sir.",589
2919,1848,1.234375,0.0430841478922721,64,1.234375,We have a rather large menu.,589
2920,1858,1.234375,0.061970725215460876,64,1.234375,I recommend that you allow me to just surprise you.,589
2921,1888,1.234375,0.053369535239372906,64,1.234375,Welcome to Trump's Trattoria! We are putting the men back in menu.,589
2922,1890,1.234375,0.05783026057090191,64,1.234375,I'm gonna need a few minutes.,589
2923,1903,1.234375,0.05783026057090191,64,1.234375,Soy clams? Three rows from the bottom on the right.,589
2924,1970,1.234375,0.061970725215460876,64,1.234375,We're overcompensating for very small portions.,589
2925,2132,1.234375,0.05783026057090191,64,1.234375,Perhaps sir would like to order from something a little more his size?,589
2926,2181,1.234375,0.05783026057090191,64,1.234375,"No Monsieur, I haven’t had the opportunity to try that yet. I’ve only been here forty-two years.",589
2927,2217,1.234375,0.061970725215460876,64,1.234375,Our guest chef today is from Brobdingnag.,589
2928,2262,1.234375,0.06585136695439135,64,1.234375,... and NONE of them are organic-gluten-free-range-localvore?,589
2929,2272,1.234375,0.061970725215460876,64,1.234375,Can I keep the menu?,589
2930,2429,1.234375,0.061970725215460876,64,1.234375,"Yes, sir! We're not kidding when we say we have the largest menu in midtown Manhattan!",589
2931,2456,1.234375,0.05783026057090191,64,1.234375,"Monseigneur, we offer fine dining NOT fine print.",589
2932,2532,1.234375,0.061970725215460876,64,1.234375,I'd recommend the jumbo sized shrimp.,589
2933,2550,1.234375,0.05783026057090191,64,1.234375,And would you like that to be lunch or dinner portion?,589
2934,2576,1.234375,0.06951571243822256,64,1.234375,We DO have interesting ways to hide your mistress. Wait til you see our 14 foot high shrimp cocktail.,589
2935,2592,1.234375,0.06585136695439135,64,1.234375,Need more time?,589
2936,2611,1.234375,0.06585136695439135,64,1.234375,"""We needed a large size menu to fit all the zeros"".",589
2937,2618,1.234375,0.05783026057090191,64,1.234375,You may supersize anything on the menu.,589
2938,2698,1.234375,0.05783026057090191,64,1.234375,Well we do save a fortune on menus not being stolen,589
2939,2769,1.234375,0.061970725215460876,64,1.234375,"Yes, the 'small plate' trend is so over.",589
2940,2813,1.234375,0.061970725215460876,64,1.234375,We used to be a diner before the snotty son-in-law took over.,589
2941,2855,1.234375,0.05783026057090191,64,1.234375,We've determined that it is the most inconspicuous way to prevent your acquaintances from seeing you eat alone.,589
2942,3049,1.234375,0.061970725215460876,64,1.234375,You should see our dinner menu!,589
2943,3084,1.234375,0.061970725215460876,64,1.234375,We now include nutrition information.,589
2944,3100,1.234375,0.061970725215460876,64,1.234375,"You think this is bad, just wait until I bring your bill",589
2945,3134,1.234375,0.061970725215460876,64,1.234375,Would you like to hear about every special we've offered since your suit was in style?,589
2946,3194,1.234375,0.061970725215460876,64,1.234375,"Well that’s a tall order, but I’ll speak to our chef.",589
2947,3220,1.234375,0.061970725215460876,64,1.234375,Would you like to see the ala carte menu?,589
2948,3231,1.234375,0.036881052772005145,64,1.234375,"Ah, but we like our menu large sir. It helps offset the portion size of our food.",589
2949,3243,1.234375,0.06585136695439135,64,1.234375,I'll take one of each.,589
2950,3263,1.234375,0.053369535239372906,64,1.234375,Would Sir like a ladder with that?,589
2951,3329,1.234375,0.06951571243822256,64,1.234375,Wait until you see our portions.,589
2952,3366,1.234375,0.05783026057090191,64,1.234375,"As you can see, we've expanded our menu.",589
2953,3423,1.234375,0.05783026057090191,64,1.234375,Wait'll you hear the specials.,589
2954,3566,1.234375,0.061970725215460876,64,1.234375,MAY I TAKE YOUR ORDER?!!,589
2955,3583,1.234375,0.061970725215460876,64,1.234375,We also have a small plate menu.,589
2956,3585,1.234375,0.06585136695439135,64,1.234375,"That's right, the staff choices are in Helvetica 72.",589
2957,3609,1.234375,0.061970725215460876,64,1.234375,Tall orders are our specialty.,589
2958,3613,1.234375,0.061970725215460876,64,1.234375,Don't you have any lighter fare?,589
2959,3679,1.234375,0.06951571243822256,64,1.234375,"Remember what ""big"" means around here when it comes time to leave the tip.",589
2960,3685,1.234375,0.05783026057090191,64,1.234375,I normally order the wine second from the top.,589
2961,3754,1.234375,0.05783026057090191,64,1.234375,"The menu is bit cumbersome to some, but our owner insists it's the appropriate size for his hands...",589
2962,3860,1.234375,0.061970725215460876,64,1.234375,We're proud to offer the largest menu in the city...and you should see our small plates.,589
2963,3891,1.234375,0.053369535239372906,64,1.234375,Would you like to see our tapas menu?,589
2964,3910,1.234375,0.061970725215460876,64,1.234375,I hope you enjoy our big menu change,589
2965,3926,1.234375,0.06585136695439135,64,1.234375,But do you have Vanilla ice cream?,589
2966,3932,1.234375,0.05783026057090191,64,1.234375,Most of our guests are older,589
2967,3968,1.234375,0.05783026057090191,64,1.234375,"Sorry, we are out of that as well",589
2968,3971,1.234375,0.061970725215460876,64,1.234375,It's to make the prices look smaller.,589
2969,3992,1.234375,0.06585136695439135,64,1.234375,Full disclosure. Big menu. Small portions. High Prices.,589
2970,4064,1.234375,0.06951571243822256,64,1.234375,"Isn't it the most terrific, great, fantastic, BEST menu you've ever seen!! I'm right. Amn't I right? Go on tell me I'm right!! You're gonna LOVE it!",589
2971,4191,1.234375,0.06585136695439135,64,1.234375,Would you like to hear the specials first?,589
2972,4338,1.234375,0.061970725215460876,64,1.234375,We also have some specials tonight.,589
2973,4392,1.234375,0.061970725215460876,64,1.234375,Take your time reviewing the menu and I will be back in two days to take your order.,589
2974,4464,1.234375,0.061970725215460876,64,1.234375,Let's just start you off with the medium large salad.,589
2975,4640,1.234375,0.05783026057090191,64,1.234375,And those are just the breakfast cereals,589
2976,4717,1.234375,0.061970725215460876,64,1.234375,The chef used to work at The Cheesecake Factory.,589
2977,4749,1.234375,0.06585136695439135,64,1.234375,"I'm sorry, we're out of cheesecake.",589
2978,4755,1.234375,0.061970725215460876,64,1.234375,I'm sorry sir but we only serve tapas.,589
2979,4792,1.234375,0.05783026057090191,64,1.234375,"Perhaps, Sir would like to use our Nook version.",589
2980,5006,1.234375,0.05783026057090191,64,1.234375,And there are a few specials du jour not in the menu.,589
2981,5026,1.234375,0.06585136695439135,64,1.234375,You still need to pick one from Column Y and one from column Z.,589
2982,5269,1.234375,0.06585136695439135,64,1.234375,Chef takes his inspiration from life in the Big Apple.,589
2983,5382,1.234375,0.053369535239372906,64,1.234375,"Or, you could order from the children's menu.",589
2984,5421,1.234375,0.061970725215460876,64,1.234375,"Yes, I know. We got them in a bankruptcy auction at Bob's Big Boy.",589
2985,5478,1.234375,0.05783026057090191,64,1.234375,"Yes, our prices have gone up slightly.",589
2986,5499,1.234375,0.04850026335634602,64,1.234375,"May I recommend the chef's special, roast brontosarus loin with braized carrots and potatoes au gratin?",589
2987,5513,1.234375,0.06585136695439135,64,1.234375,"If you have any questions about the menu, let me know.",589
2988,5514,1.234375,0.05783026057090191,64,1.234375,Any specials tonight?,589
2989,5529,1.234375,0.061970725215460876,64,1.234375,"Pardon, do you need any help with the menu?",589
2990,5539,1.234375,0.061970725215460876,64,1.234375,We are out of a few things,589
2991,5582,1.234375,0.061970725215460876,64,1.234375,"Sorry, we don't have any beef dishes, sir.",589
2992,5623,1.234375,0.061970725215460876,64,1.234375,Our chef will be delighted. Everyone else orders a la carte.,589
2993,5644,1.234375,0.06951571243822256,64,1.234375,The owner is from Texas,589
2994,5646,1.234375,0.05783026057090191,64,1.234375,"If you don't feel like reading all that, we have smorgasbord on Wednesday night.",589
2995,5663,1.234375,0.06585136695439135,64,1.234375,Shall I roll out our list of specials?,589
2996,5678,1.234375,0.061970725215460876,64,1.234375,Would it be correct to assume that small plates are not offered?,589
2997,5680,1.234375,0.061970725215460876,64,1.234375,"As signore is perhaps aware, for more than 75 years Luigi's has prided itself in offering the largest menu in town.",589
2998,5712,1.234375,0.06585136695439135,64,1.234375,May I suggest something large to start with?,589
2999,5736,1.234375,0.061970725215460876,64,1.234375,"Would you like to see our extra large print menu, sir?",589
3000,5764,1.234375,0.061970725215460876,64,1.234375,I recommend the jumbo shrimp.,589
3001,5793,1.234375,0.06951571243822256,64,1.234375,Want to hear the specials?,589
3002,5836,1.234375,0.06951571243822256,64,1.234375,"Don't worry, the servings are small.",589
3003,5839,1.234375,0.06951571243822256,64,1.234375,King Kong just loved the Grilled Bananas,589
3004,5996,1.234375,0.061970725215460876,64,1.234375,It's the condensed version.,589
3005,6031,1.234375,0.061970725215460876,64,1.234375,I know a good copy editor if you're looking.,589
3006,6041,1.234375,0.05783026057090191,64,1.234375,We're just highlighting our special of the day....... jumbo shrimp.,589
3007,6068,1.234375,0.061970725215460876,64,1.234375,This section is reserved for parties larger than you.,589
3008,6076,1.234375,0.05783026057090191,64,1.234375,How do you like our expanded menu?,589
3009,94,1.2307692307692308,0.05266563052934288,65,1.2307692307692308,We have taken super-sized to the next level!,589
3010,344,1.2307692307692308,0.05704768066996663,65,1.2307692307692308,Can I interest you in our 65 specials today?,589
3011,473,1.2307692307692308,0.06111634070027192,65,1.2307692307692308,I suggest number 2004 with our special sauce.,589
3012,523,1.2307692307692308,0.06853280646617484,65,1.2307692307692308,That includes a soupçon of oxycodone to relieve knuckle pain.,589
3013,643,1.2307692307692308,0.06493055006205434,65,1.2307692307692308,"Frankly sir, the large print menu is part of the AARP discount.",589
3014,715,1.2307692307692308,0.06853280646617484,65,1.2307692307692308,I thought you might appreciate our large print menu.,589
3015,855,1.2307692307692308,0.06853280646617484,65,1.2307692307692308,Would you like your order super-sized too?,589
3016,1239,1.2307692307692308,0.06493055006205434,65,1.2307692307692308,It seems the new format confirms that size really does matter.,589
3017,1644,1.2307692307692308,0.06493055006205434,65,1.2307692307692308,Would you like to see our specials?,589
3018,1696,1.2307692307692308,0.06493055006205434,65,1.2307692307692308,"Don’t worry, the portions are really small.",589
3019,1876,1.2307692307692308,0.06493055006205434,65,1.2307692307692308,We are now featuring our newly expanded menu with extra large portions.,589
3020,1895,1.2307692307692308,0.06853280646617484,65,1.2307692307692308,Perhaps you'd prefer to have a look at our children's menu.,589
3021,2104,1.2307692307692308,0.06493055006205434,65,1.2307692307692308,"And later, it's your privacy screen.",589
3022,2120,1.2307692307692308,0.06853280646617484,65,1.2307692307692308,"Now that's a tall order, my friend!",589
3023,2225,1.2307692307692308,0.06111634070027192,65,1.2307692307692308,For big appetites,589
3024,2321,1.2307692307692308,0.05704768066996663,65,1.2307692307692308,We only make big salads,589
3025,2372,1.2307692307692308,0.06853280646617484,65,1.2307692307692308,I recommend the quail eggs.,589
3026,2528,1.2307692307692308,0.06111634070027192,65,1.2307692307692308,It's for people with big appetites.,589
3027,2759,1.2307692307692308,0.05704768066996663,65,1.2307692307692308,May I start you off with some eye drops?,589
3028,2772,1.2307692307692308,0.06111634070027192,65,1.2307692307692308,"The steaks come 6 oz, 12oz - or the whole cow!",589
3029,2793,1.2307692307692308,0.05704768066996663,65,1.2307692307692308,May I have the lite menu?,589
3030,3232,1.2307692307692308,0.06111634070027192,65,1.2307692307692308,We have a large type version so you won't have to squint. Save room for desert; we have an extensive selection that that will bring a smile to your lips and a shock to your hips.,589
3031,3400,1.2307692307692308,0.05266563052934288,65,1.2307692307692308,Customers really seem to like the actual-size photos of our entrees,589
3032,3617,1.2307692307692308,0.06853280646617484,65,1.2307692307692308,Gimme a few minutes.... maybe hours... maybe days.,589
3033,3757,1.2307692307692308,0.07195494974565271,65,1.2307692307692308,Every thing is absolutely fresh and prepared from scratch.,589
3034,4162,1.2307692307692308,0.05704768066996663,65,1.2307692307692308,Can I interest you in Chef Jack's braised bean stalk?,589
3035,4242,1.2307692307692308,0.06493055006205434,65,1.2307692307692308,""" The less expensive choices are at the top of the page"".",589
3036,4243,1.2307692307692308,0.07195494974565271,65,1.2307692307692308,"What did you think ""big menu"" meant?",589
3037,4255,1.2307692307692308,0.05266563052934288,65,1.2307692307692308,Would you like to hear this evening's specials?,589
3038,4482,1.2307692307692308,0.06111634070027192,65,1.2307692307692308,"I'm sorry, we don't carry Coke products. Will a Pepsi do?",589
3039,4486,1.2307692307692308,0.04788422922303357,65,1.2307692307692308,Do you have enough time to hear our specials?,589
3040,4553,1.2307692307692308,0.06111634070027192,65,1.2307692307692308,"Yes, but the portions are teeny tiny.",589
3041,4574,1.2307692307692308,0.06853280646617484,65,1.2307692307692308,Would you prefer the petit dejeuner menu?,589
3042,4645,1.2307692307692308,0.06493055006205434,65,1.2307692307692308,And don't even begin to ask me about the specials.,589
3043,4776,1.2307692307692308,0.06111634070027192,65,1.2307692307692308,Is Brevity a special tonight?,589
3044,4879,1.2307692307692308,0.05704768066996663,65,1.2307692307692308,"Rest assured, sir, it all contains plenty of gluten.",589
3045,5241,1.2307692307692308,0.06493055006205434,65,1.2307692307692308,"I'll have the appendix, please.",589
3046,5259,1.2307692307692308,0.06493055006205434,65,1.2307692307692308,"While the full menu is at your disposal, our special tonight is avocado toast.",589
3047,5358,1.2307692307692308,0.06111634070027192,65,1.2307692307692308,Reader's Digest is coming out with a condensed version soon.,589
3048,5470,1.2307692307692308,0.07195494974565271,65,1.2307692307692308,Wait for the bill.,589
3049,5501,1.2307692307692308,0.019230769230769197,65,1.2307692307692308,Notice the HUGE specials !,589
3050,5568,1.2307692307692308,0.06493055006205434,65,1.2307692307692308,"And we have some nice specials, too.",589
3051,5656,1.2307692307692308,0.06493055006205434,65,1.2307692307692308,"Of course the prices aren't listed, there's not enough space.",589
3052,5670,1.2307692307692308,0.06493055006205434,65,1.2307692307692308,"""Do you have any specials today""?",589
3053,5819,1.2307692307692308,0.06111634070027192,65,1.2307692307692308,"It’s our new all-you-can-order menu, sir.",589
3054,695,1.2272727272727273,0.060284695763812665,66,1.2272727272727273,"You did ask for the large-print menu, sir.",589
3055,2078,1.2272727272727273,0.06403471722070707,66,1.2272727272727273,"are you done with the appetizer menu, sir?",589
3056,2361,1.2272727272727273,0.056285380669717305,66,1.2272727272727273,Just wait until you see the dessert cart.,589
3057,2992,1.2272727272727273,0.060284695763812665,66,1.2272727272727273,"Sir, do you need another minute?",589
3058,3584,1.2272727272727273,0.056285380669717305,66,1.2272727272727273,I would bring you the wine list but the forklift is in the shop.,589
3059,5409,1.2272727272727273,0.06403471722070707,66,1.2272727272727273,It offsets the portion sizes.,589
3060,6020,1.2272727272727273,0.06403471722070707,66,1.2272727272727273,I didn't realize this was a Cheesecake Factory.,589
3061,38,1.2258064516129032,0.06672577740289717,62,1.2258064516129032,All the best stuff is at the top.,589
3062,43,1.2258064516129032,0.058263950350759514,62,1.2258064516129032,"Will that be tap, sparkling, or bottled from the Rio Grande?",589
3063,92,1.2258064516129032,0.06672577740289717,62,1.2258064516129032,"....but then we had all this ""fake news"" about us NOT having the biggest menu the world has ever seen!",589
3064,123,1.2258064516129032,0.06672577740289717,62,1.2258064516129032,Can I tell you about our specials?,589
3065,151,1.2258064516129032,0.058263950350759514,62,1.2258064516129032,More economical than passing out magnifying glasses with the little flashlights,589
3066,153,1.2258064516129032,0.06672577740289717,62,1.2258064516129032,"You want it, we got it",589
3067,248,1.2258064516129032,0.06672577740289717,62,1.2258064516129032,It distracts from the small portions.,589
3068,250,1.2258064516129032,0.06672577740289717,62,1.2258064516129032,We're baby boomer friendly.,589
3069,298,1.2258064516129032,0.06263791695329896,62,1.2258064516129032,I think you'll find our Southwestern offerings in the lower left-hand corner.,589
3070,309,1.2258064516129032,0.058263950350759514,62,1.2258064516129032,"And for today's specials, we have a few items not on the regular menu.",589
3071,369,1.2258064516129032,0.06263791695329896,62,1.2258064516129032,We are renowned for our small portions.,589
3072,496,1.2258064516129032,0.06263791695329896,62,1.2258064516129032,Would you prefer our a la carte?,589
3073,536,1.2258064516129032,0.06672577740289717,62,1.2258064516129032,Are you sure you just want 'a little something''>,589
3074,555,1.2258064516129032,0.06263791695329896,62,1.2258064516129032,Everything's bigger in Texas.,589
3075,574,1.2258064516129032,0.058263950350759514,62,1.2258064516129032,I'm sorry sir. The kitchen is now closed for breakfast orders.,589
3076,603,1.2258064516129032,0.07057726333454416,62,1.2258064516129032,Welcome to Chez Claes Oldenburg...,589
3077,613,1.2258064516129032,0.045526213174875985,62,1.2258064516129032,The sautéed flounder is big today.,589
3078,651,1.2258064516129032,0.058263950350759514,62,1.2258064516129032,"To be fair, we reprinted the menu in 20 languages.",589
3079,670,1.2258064516129032,0.07057726333454416,62,1.2258064516129032,Ever since someone remarked that the chef had small hands.,589
3080,728,1.2258064516129032,0.06672577740289717,62,1.2258064516129032,Do you have a dollar menu?,589
3081,752,1.2258064516129032,0.06263791695329896,62,1.2258064516129032,We found our customers preferred the larger print vs the iPhone flashlight!,589
3082,782,1.2258064516129032,0.058263950350759514,62,1.2258064516129032,It's customary to tip proportionally.,589
3083,797,1.2258064516129032,0.058263950350759514,62,1.2258064516129032,You should see our dinner menu!,589
3084,843,1.2258064516129032,0.05594888332745763,62,1.2258064516129032,"I'm afraid to ask, but what are your specials?",589
3085,851,1.2258064516129032,0.06672577740289717,62,1.2258064516129032,Might I suggest the jumbo shrimp?,589
3086,864,1.2258064516129032,0.058263950350759514,62,1.2258064516129032,"I'm sorry sir, no substitutions.",589
3087,874,1.2258064516129032,0.053533794753437405,62,1.2258064516129032,"Honestly, everything on the menu is great.",589
3088,990,1.2258064516129032,0.058263950350759514,62,1.2258064516129032,I hope you brought your appetite.,589
3089,991,1.2258064516129032,0.06672577740289717,62,1.2258064516129032,We are no longer offering the petits fours. Would you like to try the huge gazillion?,589
3090,1023,1.2258064516129032,0.06672577740289717,62,1.2258064516129032,"Sir, that is one tall order!",589
3091,1026,1.2258064516129032,0.06672577740289717,62,1.2258064516129032,"Why, yes. It is a very big salad!",589
3092,1114,1.2258064516129032,0.058263950350759514,62,1.2258064516129032,Chef trained at the Golden Coral.,589
3093,1150,1.2258064516129032,0.06672577740289717,62,1.2258064516129032,Did you see our specials on the billboard?,589
3094,1157,1.2258064516129032,0.053533794753437405,62,1.2258064516129032,Would you like to hear what the specials are?,589
3095,1195,1.2258064516129032,0.058263950350759514,62,1.2258064516129032,"Hey, big spender!",589
3096,1205,1.2258064516129032,0.03576877117522128,62,1.2258064516129032,Wait till you see the size of our dessert menu!,589
3097,1278,1.2258064516129032,0.06672577740289717,62,1.2258064516129032,"You'll have to go outside to see the wine list.""",589
3098,1279,1.2258064516129032,0.06263791695329896,62,1.2258064516129032,Do you have a bigger menu?,589
3099,1289,1.2258064516129032,0.058263950350759514,62,1.2258064516129032,"Printed every day, you bet!",589
3100,1308,1.2258064516129032,0.058263950350759514,62,1.2258064516129032,I hope you have a BIG appetite Monsieur.,589
3101,1313,1.2258064516129032,0.053533794753437405,62,1.2258064516129032,You should have seen it when we were open for lunch.,589
3102,1346,1.2258064516129032,0.06263791695329896,62,1.2258064516129032,"If you have an hour or so, I can tell you about tonight's specials.",589
3103,1371,1.2258064516129032,0.058263950350759514,62,1.2258064516129032,Now that's a tall order sir,589
3104,1376,1.2258064516129032,0.06263791695329896,62,1.2258064516129032,Do you guys have a kids menu?,589
3105,1395,1.2258064516129032,0.07057726333454416,62,1.2258064516129032,"I can read you the specials, but it’ll take an hour.",589
3106,1427,1.2258064516129032,0.06263791695329896,62,1.2258064516129032,And a tall latte to drink?,589
3107,1477,1.2258064516129032,0.06263791695329896,62,1.2258064516129032,Would you like to hear about tonight's specials?,589
3108,1516,1.2258064516129032,0.053533794753437405,62,1.2258064516129032,Wait'll you see the desert tray.,589
3109,1517,1.2258064516129032,0.058263950350759514,62,1.2258064516129032,And I suppose you are going to expect a big tip as well.......,589
3110,1588,1.2258064516129032,0.053533794753437405,62,1.2258064516129032,Do you have a chilldren's menu?,589
3111,1614,1.2258064516129032,0.06263791695329896,62,1.2258064516129032,Perhaps Monsieur would like to see our small plates menu.,589
3112,1627,1.2258064516129032,0.07422917775084267,62,1.2258064516129032,"May I suggest, first pick your protein",589
3113,1683,1.2258064516129032,0.07057726333454416,62,1.2258064516129032,And if the menu makes you feel inferior just wait until you try the soufflé!,589
3114,1710,1.2258064516129032,0.06263791695329896,62,1.2258064516129032,"Yes, our menu ees big. Would you like to see our wine list? it""s huuge.",589
3115,1733,1.2258064516129032,0.058263950350759514,62,1.2258064516129032,The chef? He prefers to hide behind the menu.,589
3116,1755,1.2258064516129032,0.06672577740289717,62,1.2258064516129032,Sir I assure you our ridiculously small portion sizes will easily compensate for the menu.,589
3117,1769,1.2258064516129032,0.058263950350759514,62,1.2258064516129032,Would you like the wine list?,589
3118,1879,1.2258064516129032,0.06672577740289717,62,1.2258064516129032,We also have a number of specials for today,589
3119,1901,1.2258064516129032,0.06263791695329896,62,1.2258064516129032,"55 plus Menu, Monsieur? I thought you wanted the 55 inch Menu!",589
3120,1919,1.2258064516129032,0.06672577740289717,62,1.2258064516129032,"Yes, sir, but a ladder is extra.",589
3121,1936,1.2258064516129032,0.06263791695329896,62,1.2258064516129032,"Yes, the rumor is true. Donald Trump exited our establishment in a fit of rage. However, his departure had nothing to do with our exceptional cuisine. It was most unfortunate Mr. Trump was unable to grasp our menu....",589
3122,2038,1.2258064516129032,0.053533794753437405,62,1.2258064516129032,May I suggest #555.,589
3123,2059,1.2258064516129032,0.058263950350759514,62,1.2258064516129032,Might I recommend a stepladder?,589
3124,2094,1.2258064516129032,0.06263791695329896,62,1.2258064516129032,I'll need another hour.,589
3125,2141,1.2258064516129032,0.06672577740289717,62,1.2258064516129032,Can you please remind me what the specials are?,589
3126,2159,1.2258064516129032,0.06263791695329896,62,1.2258064516129032,"The selection is the same, sir. We've just added more descriptors.",589
