,target_id,mean,precision,count,score,caption,contest
4608,3762,1.163265306122449,0.06742934558367009,49,1.163265306122449,"Sir, yes this is just the menu for our wines by the glass, would you like to see our large wine list?",589
4609,3839,1.163265306122449,0.05334825558285075,49,1.163265306122449,We like to keep our macrophiliac customers happy.,589
4610,3851,1.163265306122449,0.06742934558367009,49,1.163265306122449,"Yes, we’re comphensating.",589
4611,3904,1.163265306122449,0.06742934558367009,49,1.163265306122449,After yesterday's incident we felt obligated to spotlight food allergies,589
4612,3933,1.163265306122449,0.06742934558367009,49,1.163265306122449,The management consultants recommended a bigger menu.,589
4613,3962,1.163265306122449,0.05334825558285075,49,1.163265306122449,"We received so many suggestions for a larger menu, Sir.",589
4614,4038,1.163265306122449,0.060797833101086655,49,1.163265306122449,We want to be a leading indicator of inflation.,589
4615,4065,1.163265306122449,0.05334825558285075,49,1.163265306122449,Is this your first time dining with us here at Napoleans?,589
4616,4070,1.163265306122449,0.060797833101086655,49,1.163265306122449,"Actually, we're small.",589
4617,4071,1.163265306122449,0.05334825558285075,49,1.163265306122449,"Yes, we had been getting criticisms on our small print but, as you can clearly see, that is no longer a problem.",589
4618,4143,1.163265306122449,0.060797833101086655,49,1.163265306122449,If you'd like I can narrate our specials.,589
4619,4161,1.163265306122449,0.06742934558367009,49,1.163265306122449,We're trying to discourage off menu orders.,589
4620,4179,1.163265306122449,0.060797833101086655,49,1.163265306122449,Our chef has OCD.,589
4621,4273,1.163265306122449,0.060797833101086655,49,1.163265306122449,"Sir, May I suggest our small plates?",589
4622,4385,1.163265306122449,0.060797833101086655,49,1.163265306122449,We ARE big. It's the patrons that got small.,589
4623,4393,1.163265306122449,0.060797833101086655,49,1.163265306122449,"You did ask for the Large-Type menu, Sir.",589
4624,4450,1.163265306122449,0.060797833101086655,49,1.163265306122449,Elephant is on special this week.,589
4625,4451,1.163265306122449,0.060797833101086655,49,1.163265306122449,"That's our a la carte menu. If you wish, I can show you the early bird special which includes salad, a choice of entrée, dessert and one beverage.",589
4626,4565,1.163265306122449,0.05334825558285075,49,1.163265306122449,Yes! We’re back to our pre-recession prices.,589
4627,4768,1.163265306122449,0.060797833101086655,49,1.163265306122449,I’m sorry sir. We’re out of the sole. Will you need more time?,589
4628,4850,1.163265306122449,0.06742934558367009,49,1.163265306122449,Our chef has been to ALL of the finest culinary schools.,589
4629,4910,1.163265306122449,0.05334825558285075,49,1.163265306122449,May I suggest the kiddie menu. It has smaller proportions.,589
4630,4953,1.163265306122449,0.060797833101086655,49,1.163265306122449,May I recommend the mini shrimp?,589
4631,4957,1.163265306122449,0.060797833101086655,49,1.163265306122449,Yes the menu is HUGE but rest assured the portions are TINY !,589
4632,4959,1.163265306122449,0.05334825558285075,49,1.163265306122449,"I'll have the #9,039 - rare.",589
4633,5122,1.163265306122449,0.06742934558367009,49,1.163265306122449,I'd rather have the large size drink.,589
4634,5247,1.163265306122449,0.05334825558285075,49,1.163265306122449,Are your portions as large as your menu?,589
4635,5249,1.163265306122449,0.060797833101086655,49,1.163265306122449,May I suggest our speed reading tutorial to go with your aperitif?,589
4636,5291,1.163265306122449,0.05334825558285075,49,1.163265306122449,"Unable to get library cards, homeless readers hid books around the library to ensure they could return to them later",589
4637,5300,1.163265306122449,0.020619652471058063,49,1.163265306122449,"... and if you supersize, we include a loaner forklift for taking home leftovers.",589
4638,5339,1.163265306122449,0.05334825558285075,49,1.163265306122449,For when your stomach is bigger than your eyes!,589
4639,5444,1.163265306122449,0.05334825558285075,49,1.163265306122449,It's time to order as the hour is now up.,589
4640,5602,1.163265306122449,0.05334825558285075,49,1.163265306122449,"If you've got the time, I'd like to tell you about our specials.",589
4641,5628,1.163265306122449,0.05334825558285075,49,1.163265306122449,"Certain of our customers, who shall remain nameless, seem to run off with the regular sized ones.",589
4642,5743,1.163265306122449,0.04467321611076087,49,1.163265306122449,"This is our executive order menu, featuring the chef's signature dish.",589
4643,5775,1.163265306122449,0.060797833101086655,49,1.163265306122449,I meant differently when I said I have a big appetite.,589
4644,5785,1.163265306122449,0.060797833101086655,49,1.163265306122449,The portions are smaller than you'd think.,589
4645,5892,1.163265306122449,0.06742934558367009,49,1.163265306122449,We decided to elevate the Greek family restaurant concept to another level. I recommend item trois cent vingt-quatre.,589
4646,5942,1.163265306122449,0.05334825558285075,49,1.163265306122449,"Quite a grand opening, isn't it?",589
4647,5974,1.163265306122449,0.060797833101086655,49,1.163265306122449,"To make room for your cheeseburger, I'll need your help to carry the menu back to the kitchen.",589
4648,6045,1.163265306122449,0.06742934558367009,49,1.163265306122449,Would you like to try the kids menu?,589
4649,6089,1.163265306122449,0.06742934558367009,49,1.163265306122449,You are what you eat. You're a pig.,589
4650,166,1.16,0.05965889433663176,50,1.16,"As a reminder, our portions are small.",589
4651,951,1.16,0.06614763944451561,50,1.16,Shall I have our helicopter deliver the wine list?,589
4652,1606,1.16,0.05965889433663176,50,1.16,"""I am so glad you are eating alone tonight Monsieur.",589
4653,1894,1.16,0.05237229365663822,50,1.16,I'll come back in a day.,589
4654,2041,1.16,0.05965889433663176,50,1.16,"Item 935 is tasty, sir. Or, would you prefer one of the other selections?",589
4655,3170,1.16,0.05965889433663176,50,1.16,The small print it's just a disclaimer,589
4656,3431,1.16,0.06614763944451561,50,1.16,Prices have gone higher since you were last here.,589
4657,3893,1.16,0.05237229365663822,50,1.16,I didn't realize this is what you meant when you asked me if I wanted to supersize.,589
4658,4240,1.16,0.06614763944451561,50,1.16,"Sorry sir, we don’t have that on the menu !",589
4659,4440,1.16,0.06614763944451561,50,1.16,Wait until you see how big the check is.,589
4660,4510,1.16,0.05965889433663176,50,1.16,It's a very large farm,589
4661,4825,1.16,0.05965889433663176,50,1.16,"Sir, the Sparks Notes menu is only available on the terrace",589
4662,4916,1.16,0.05965889433663176,50,1.16,Isn't it nice not to have to deal with all of those annoying pages.,589
4663,4944,1.16,0.05237229365663822,50,1.16,"Yes, Claes Oldenburg is a friend of the owners.",589
4664,5171,1.16,0.05965889433663176,50,1.16,"Sir, that is the child's menu",589
4665,5415,1.16,0.06614763944451561,50,1.16,What will it be Mr Gulliver?,589
4666,1001,1.1568627450980393,0.05856150793360027,51,1.1568627450980393,We had to substitute the menu because we didn't have a cake large enough for the stripper to jump out of.,589
4667,1677,1.1568627450980393,0.05856150793360027,51,1.1568627450980393,"Is Monsieur FINALLY done? (Nicholas Rohatyn, age 9)",589
4668,4449,1.1568627450980393,0.05856150793360027,51,1.1568627450980393,May I recommend the giant squid special?,589
4669,4992,1.1568627450980393,0.05143089038668232,51,1.1568627450980393,"To complement the chef's ego, we feature wine in Imperials, Methuselahs, and Jeroboams only.",589
4670,5875,1.1568627450980393,0.05143089038668232,51,1.1568627450980393,Don’t panic. The menu’s big but the portions are small.,589
4671,51,1.1555555555555554,0.03106779090753486,45,1.1555555555555554,I was told you have bad eye sight.,589
4672,65,1.1555555555555554,0.05463890236888298,45,1.1555555555555554,Ah # 82 chef special he's off today.,589
4673,193,1.1555555555555554,0.05463890236888298,45,1.1555555555555554,This is the new menu in honor of receiving our fifth Michelin galaxy.,589
4674,282,1.1555555555555554,0.06321005190772537,45,1.1555555555555554,The digital revolution has not affected our business yet.,589
4675,312,1.1555555555555554,0.05463890236888298,45,1.1555555555555554,We enlarged our menu when we noticed most of our over 50 customers had short arms.,589
4676,337,1.1555555555555554,0.06321005190772537,45,1.1555555555555554,Mais oui -- supersize you.,589
4677,364,1.1555555555555554,0.06321005190772537,45,1.1555555555555554,"I have the gluten free menu right here, sir.",589
4678,428,1.1555555555555554,0.05463890236888298,45,1.1555555555555554,"A Triple Whopper? Excellent choice, sir! Would you care to over-size that order for an additional $2.99?",589
4679,488,1.1555555555555554,0.05463890236888298,45,1.1555555555555554,Would it help if I just gave you tonight's specials?,589
4680,780,1.1555555555555554,0.05463890236888298,45,1.1555555555555554,Customers end up ordering substantially more than they normally would.,589
4681,790,1.1555555555555554,0.06321005190772537,45,1.1555555555555554,"Yes, we now Supper Size",589
4682,883,1.1555555555555554,0.05463890236888298,45,1.1555555555555554,Our portions are quite generous sir.,589
4683,897,1.1555555555555554,0.05463890236888298,45,1.1555555555555554,It’s a counterpoint to the small playes,589
4684,948,1.1555555555555554,0.05463890236888298,45,1.1555555555555554,Just wait until you see the size of your bill.,589
4685,1022,1.1555555555555554,0.06321005190772537,45,1.1555555555555554,I've changed my mind again-I want it *with* the jumbo shrimp.,589
4686,1125,1.1555555555555554,0.05463890236888298,45,1.1555555555555554,It's an homasge to Julia Child.,589
4687,1193,1.1555555555555554,0.05463890236888298,45,1.1555555555555554,"For starters, we recommend the 'Côté de Boeuf', which is a side of beef.",589
4688,1208,1.1555555555555554,0.07075034750641404,45,1.1555555555555554,Might I suggest the goat balls?,589
4689,1210,1.1555555555555554,0.05463890236888298,45,1.1555555555555554,Do you have a ladder? Or would you prefer to just tell me about the appetizers?,589
4690,1216,1.1555555555555554,0.05463890236888298,45,1.1555555555555554,Monsieur did say he has a giant appetite.,589
4691,1306,1.1555555555555554,0.06321005190772537,45,1.1555555555555554,"That is the regular menu, sir. You should see our large print version; comes in on a crane.",589
4692,1399,1.1555555555555554,0.06321005190772537,45,1.1555555555555554,I recommend the short stack.,589
4693,1403,1.1555555555555554,0.07075034750641404,45,1.1555555555555554,We're compensating as all our plate sizes are really small.,589
4694,1437,1.1555555555555554,0.05463890236888298,45,1.1555555555555554,Would you like to hear about our specials as well?,589
4695,1584,1.1555555555555554,0.05463890236888298,45,1.1555555555555554,Please tip accordingly.,589
4696,1695,1.1555555555555554,0.07075034750641404,45,1.1555555555555554,"Pardon, Monsieur. May I suggest our Grease Burger.",589
4697,1729,1.1555555555555554,0.06321005190772537,45,1.1555555555555554,The chef is a masochist.,589
4698,1797,1.1555555555555554,0.06321005190772537,45,1.1555555555555554,Small plates aren't popular anymore.,589
4699,1823,1.1555555555555554,0.06321005190772537,45,1.1555555555555554,“How would you like that overcooked?,589
4700,1863,1.1555555555555554,0.06321005190772537,45,1.1555555555555554,"Look through the menu. I will be back in three hours to take your order, sir.",589
4701,1881,1.1555555555555554,0.05463890236888298,45,1.1555555555555554,You'll enjoy our portion sizes.,589
4702,1886,1.1555555555555554,0.07075034750641404,45,1.1555555555555554,I'll have the whale platter,589
4703,1929,1.1555555555555554,0.06321005190772537,45,1.1555555555555554,I'll have a small chef's special.,589
4704,1963,1.1555555555555554,0.05463890236888298,45,1.1555555555555554,We also have an exceptionally large wine list.,589
4705,2011,1.1555555555555554,0.05463890236888298,45,1.1555555555555554,And for you sir?,589
4706,2014,1.1555555555555554,0.06321005190772537,45,1.1555555555555554,"Wow, this menu is very large.",589
4707,2024,1.1555555555555554,0.06321005190772537,45,1.1555555555555554,We also offer lunch size portions...,589
4708,2025,1.1555555555555554,0.06321005190772537,45,1.1555555555555554,Do you have a big salad?,589
4709,2087,1.1555555555555554,0.06321005190772537,45,1.1555555555555554,... and would the gentleman care to hear about today's specials?,589
4710,2099,1.1555555555555554,0.05463890236888298,45,1.1555555555555554,"I'm not ready yet, I can't find my glasses.",589
4711,2114,1.1555555555555554,0.06321005190772537,45,1.1555555555555554,The large print edition brings in more boomers.,589
4712,2117,1.1555555555555554,0.05463890236888298,45,1.1555555555555554,would you like to visit our wine archives before dinner? ?,589
4713,2119,1.1555555555555554,0.05463890236888298,45,1.1555555555555554,Those are the starters. Just let me know when you are ready and I'll use the two-wheeler to bring in the first volume of the main menu.,589
4714,2194,1.1555555555555554,0.06321005190772537,45,1.1555555555555554,"No, monsieur. It is not representative of the portion sizes.",589
4715,2242,1.1555555555555554,0.05463890236888298,45,1.1555555555555554,this menu seems too large to be local,589
4716,2319,1.1555555555555554,0.05463890236888298,45,1.1555555555555554,I thought choice meats referred to the quality,589
4717,2329,1.1555555555555554,0.06321005190772537,45,1.1555555555555554,We needed a menu commensurate with the prices.,589
4718,2341,1.1555555555555554,0.03106779090753486,45,1.1555555555555554,We pride ourselves in the fact that our tall menu never translates into high prices.,589
4719,2422,1.1555555555555554,0.05463890236888298,45,1.1555555555555554,"As you can see, here at Chez Jacques, jumbo shrimp is not an oxymoron.",589
4720,2488,1.1555555555555554,0.05463890236888298,45,1.1555555555555554,I'll give you some time.,589
4721,2691,1.1555555555555554,0.06321005190772537,45,1.1555555555555554,"Introvert Dining Patron: ""Are you sure no one can see me?""",589
4722,2844,1.1555555555555554,0.05463890236888298,45,1.1555555555555554,We get our food from Costco.,589
4723,2905,1.1555555555555554,0.022473328748774737,45,1.1555555555555554,A better selection?,589
4724,2963,1.1555555555555554,0.06321005190772537,45,1.1555555555555554,We call it out TRUMP MENU...the biggest and best!!!,589
4725,3038,1.1555555555555554,0.06321005190772537,45,1.1555555555555554,Does all that come with a bag of chips?,589
4726,3051,1.1555555555555554,0.07075034750641404,45,1.1555555555555554,We felt with the smaller portions a larger menu made sense,589
4727,3109,1.1555555555555554,0.06321005190772537,45,1.1555555555555554,We super-sized our menu.,589
4728,3146,1.1555555555555554,0.06321005190772537,45,1.1555555555555554,"We're merging with Cracker Barrel, and Texas Roadhouse, and Olive Garden, and ....",589
4729,3149,1.1555555555555554,0.07075034750641404,45,1.1555555555555554,"Sir, In this restaurant SIZE really does matter!",589
4730,3173,1.1555555555555554,0.05463890236888298,45,1.1555555555555554,"I understand, so how would you like your burger cook?",589
4731,3217,1.1555555555555554,0.06321005190772537,45,1.1555555555555554,"If you think our menu is big, wait till you see our portions.",589
4732,3221,1.1555555555555554,0.05463890236888298,45,1.1555555555555554,I’ll have the steak.,589
4733,3277,1.1555555555555554,0.06321005190772537,45,1.1555555555555554,The menu is indicative of the size of the check sir,589
4734,3367,1.1555555555555554,0.06321005190772537,45,1.1555555555555554,"It's all proportional, the bill is just as large.",589
4735,3371,1.1555555555555554,0.06321005190772537,45,1.1555555555555554,You should see the specials board.,589
4736,3372,1.1555555555555554,0.05463890236888298,45,1.1555555555555554,Our menus are why we can place our tables so far apart.,589
4737,3396,1.1555555555555554,0.06321005190772537,45,1.1555555555555554,Overwhelming? We have staff members to help.,589
4738,3471,1.1555555555555554,0.06321005190772537,45,1.1555555555555554,Could I offer you a complimentary ladder?,589
4739,3665,1.1555555555555554,0.05463890236888298,45,1.1555555555555554,May I suggest dinner number 637 with our jelly bean gravy...,589
4740,3729,1.1555555555555554,0.06321005190772537,45,1.1555555555555554,"The better for you to see with, Sir.",589
4741,3830,1.1555555555555554,0.06321005190772537,45,1.1555555555555554,Will you be ordering from the Senior's menu this evening?,589
4742,3837,1.1555555555555554,0.05463890236888298,45,1.1555555555555554,"This gives a complete explanation of your order, Sir.",589
4743,3847,1.1555555555555554,0.06321005190772537,45,1.1555555555555554,"It's Trump Tower, it has to be the biggest ever menu!!",589
4744,3865,1.1555555555555554,0.06321005190772537,45,1.1555555555555554,Today's specials? The wine list?,589
4745,3868,1.1555555555555554,0.05463890236888298,45,1.1555555555555554,"Size, oh yes sir but we find it takes the sting out of the bill.",589
4746,3919,1.1555555555555554,0.06321005190772537,45,1.1555555555555554,Would you like to supersize the drinks menu as well?,589
4747,3960,1.1555555555555554,0.05463890236888298,45,1.1555555555555554,So that will be the Texas steak special for both you and the lady?,589
4748,3975,1.1555555555555554,0.05463890236888298,45,1.1555555555555554,Why don’t you super surprise me?,589
4749,3981,1.1555555555555554,0.05463890236888298,45,1.1555555555555554,It's makes up for our small servings size.,589
4750,4107,1.1555555555555554,0.06321005190772537,45,1.1555555555555554,why did I bother with makeup?,589
4751,4185,1.1555555555555554,0.05463890236888298,45,1.1555555555555554,"As you see, here at Chez Trump we have a HUGE menu to choose from.",589
4752,4265,1.1555555555555554,0.05463890236888298,45,1.1555555555555554,"David had thought the portion sizes had been getting smaller, but he concluded that he must have been mistaken.",589
4753,4389,1.1555555555555554,0.05463890236888298,45,1.1555555555555554,"GUARANTEE: IF YOU CAN'T FIND IT ON THIS MENU, YOU DON'T WANT IT11",589
4754,4396,1.1555555555555554,0.06321005190772537,45,1.1555555555555554,1. You should see the dinner menu. 2. We just added vegetarian options 3. Would you like to see the wine list?,589
4755,4425,1.1555555555555554,0.06321005190772537,45,1.1555555555555554,I CAN COME BACK IN AN HOUR!,589
4756,4457,1.1555555555555554,0.07075034750641404,45,1.1555555555555554,Wait 'til you see the portions.,589
4757,4526,1.1555555555555554,0.05463890236888298,45,1.1555555555555554,"Of course, please feel free to order off of the menu if there is nothing you see that catches your fancy.",589
4758,4624,1.1555555555555554,0.022473328748774737,45,1.1555555555555554,...ist die Kochspezialität. Sehr lecker.,589
4759,4693,1.1555555555555554,0.05463890236888298,45,1.1555555555555554,"The prices? You are joking, right?",589
4760,4721,1.1555555555555554,0.06321005190772537,45,1.1555555555555554,"Did you think it was fake news that at the Trump Hotel we have the ""Yoougest"" menu in the world?",589
4761,4778,1.1555555555555554,0.06321005190772537,45,1.1555555555555554,Peanut butter without jelly?,589
4762,4872,1.1555555555555554,0.06321005190772537,45,1.1555555555555554,Our new mega-menu offers a vast array of delectable dishes--everything from aardvark to zebra.,589
4763,4888,1.1555555555555554,0.022473328748774737,45,1.1555555555555554,Yeah can I fucking get...uuuuuuuuuuuuuuuuuuuuhhhhhhhhh,589
4764,5040,1.1555555555555554,0.06321005190772537,45,1.1555555555555554,I didn't think you could handle the adult menu.,589
4765,5073,1.1555555555555554,0.05463890236888298,45,1.1555555555555554,What are today's specials?,589
4766,5076,1.1555555555555554,0.07075034750641404,45,1.1555555555555554,So will it be the burger with fries or without fries with your choice of wine?,589
4767,5086,1.1555555555555554,0.07075034750641404,45,1.1555555555555554,"Hello, my name is Bertrand and I will be your server tonight. Would you like freshly ground pepper on whatever you order? Any questions you have about the menu I have less than zero interest in answering. I'll be back in an hour for your order.",589
4768,5104,1.1555555555555554,0.07075034750641404,45,1.1555555555555554,"Yes Sir, ""Jumbo"" is officially a thing now.""",589
4769,5108,1.1555555555555554,0.06321005190772537,45,1.1555555555555554,"Sorry sir, but I thought you were looking for the seniors' special.",589
4770,5137,1.1555555555555554,0.06321005190772537,45,1.1555555555555554,All our dishes are locally sourced from delivery restaurants within a ten block radius,589
4771,5163,1.1555555555555554,0.06321005190772537,45,1.1555555555555554,"Yes sir, everything is a la carte at this restaurant.",589
4772,5381,1.1555555555555554,0.022473328748774737,45,1.1555555555555554,"Sir, I said wine. Not blind.",589
4773,5445,1.1555555555555554,0.05463890236888298,45,1.1555555555555554,Just a burger and fries today? We just recently expanded our menu.,589
4774,5475,1.1555555555555554,0.06321005190772537,45,1.1555555555555554,How big are the martinis?,589
4775,5541,1.1555555555555554,0.05463890236888298,45,1.1555555555555554,The portions are huge!,589
4776,5601,1.1555555555555554,0.05463890236888298,45,1.1555555555555554,"The chef changed our motto from, ""Eat Petite, Be Petite"" to ""Eat Grand, Be Grand.""",589
4777,5734,1.1555555555555554,0.05463890236888298,45,1.1555555555555554,I agree. But the chef says small plates are so last century.,589
4778,5758,1.1555555555555554,0.05463890236888298,45,1.1555555555555554,"This is our large-font menu, courtesy of the chef.",589
4779,5805,1.1555555555555554,0.05463890236888298,45,1.1555555555555554,"No sir, our chicken does not have any growth hormones in it.",589
4780,5917,1.1555555555555554,0.05463890236888298,45,1.1555555555555554,"Sorry, we’re all out of champagne magnums, jumbo shrimp and porterhouse steak.",589
4781,5963,1.1555555555555554,0.05463890236888298,45,1.1555555555555554,May I suggest the cheeseburger and fries?,589
4782,6071,1.1555555555555554,0.05463890236888298,45,1.1555555555555554,What's good today? The ambience!,589
4783,6073,1.1555555555555554,0.05463890236888298,45,1.1555555555555554,I'm exhausted from all these options.,589
4784,212,1.1521739130434783,0.061913070618242964,46,1.1521739130434783,I’d recommend a small plate.,589
4785,228,1.1521739130434783,0.053544791889597564,46,1.1521739130434783,"Why, yes, the portions are large.",589
4786,384,1.1521739130434783,0.053544791889597564,46,1.1521739130434783,I just needed more light to read the regular menu.,589
4787,641,1.1521739130434783,0.061913070618242964,46,1.1521739130434783,"Sir, the large print menu entitles you to the senior discount.",589
4788,810,1.1521739130434783,0.061913070618242964,46,1.1521739130434783,"Sir, may I supersize your burger and fries?",589
4789,813,1.1521739130434783,0.053544791889597564,46,1.1521739130434783,I read the small print only as a last resort.,589
4790,822,1.1521739130434783,0.053544791889597564,46,1.1521739130434783,The name change to 'Tout pour tous' meant a bigger menu,589
4791,928,1.1521739130434783,0.061913070618242964,46,1.1521739130434783,Hold it between my KNEES? What kind of talk is that?,589
4792,1191,1.1521739130434783,0.061913070618242964,46,1.1521739130434783,Adaptation. A customer on yelp complained he could not read the menu.,589
4793,1354,1.1521739130434783,0.053544791889597564,46,1.1521739130434783,I'm sorry sir but they only come in large portions,589
4794,1410,1.1521739130434783,0.053544791889597564,46,1.1521739130434783,"Of course we have Hamburgers here-- Page 12, Columns 3 thru 8",589
4795,1508,1.1521739130434783,0.053544791889597564,46,1.1521739130434783,And just how big are the slab of ribs?,589
4796,1564,1.1521739130434783,0.061913070618242964,46,1.1521739130434783,Condensed milk is on another menu.,589
4797,1661,1.1521739130434783,0.053544791889597564,46,1.1521739130434783,How big are your entrees?,589
4798,1725,1.1521739130434783,0.061913070618242964,46,1.1521739130434783,The new owners made their money designing billboards.,589
4799,1732,1.1521739130434783,0.0219793491131929,46,1.1521739130434783,Man-u spread.,589
4800,2121,1.1521739130434783,0.061913070618242964,46,1.1521739130434783,Tonight's special is one golden egg over easy topped with the blood of an Englishman.,589
4801,2241,1.1521739130434783,0.053544791889597564,46,1.1521739130434783,You're gonna need a bigger pad,589
4802,2295,1.1521739130434783,0.061913070618242964,46,1.1521739130434783,"Yes, I realize it says ""Today's Specials"". But ""Today's Specials"" are now, technically speaking, ""Yesterday's Specials"".",589
4803,2849,1.1521739130434783,0.053544791889597564,46,1.1521739130434783,Trump wanted the most choices on a menu that the world has ever seen.,589
4804,2856,1.1521739130434783,0.06927778784183837,46,1.1521739130434783,No shrimp cocktail?,589
4805,2936,1.1521739130434783,0.053544791889597564,46,1.1521739130434783,"Yes, we're overcompensating for our new small plate menu.",589
4806,3015,1.1521739130434783,0.053544791889597564,46,1.1521739130434783,Would you like to hear about tonight's specials?,589
4807,3065,1.1521739130434783,0.053544791889597564,46,1.1521739130434783,"To enhance your dining experience, we include side effects disclaimers for each item.",589
4808,3163,1.1521739130434783,0.053544791889597564,46,1.1521739130434783,"Our wine list is even bigger, sir.",589
4809,3256,1.1521739130434783,0.053544791889597564,46,1.1521739130434783,We also have a little kids menu.,589
4810,3289,1.1521739130434783,0.053544791889597564,46,1.1521739130434783,Ahh chef usta own a dina.,589
