,target_id,mean,precision,count,score,caption,contest
1436,3485,1.3229166666666667,0.061940109136835064,96,1.3229166666666667,...so just the cup of tea?,589
1437,3643,1.3229166666666667,0.04054127111651395,96,1.3229166666666667,We also have a buffet option.,589
1438,3676,1.3229166666666667,0.05234582974614944,96,1.3229166666666667,"Just a plain cheese pizza, please.",589
1439,4370,1.3229166666666667,0.056379804744615195,96,1.3229166666666667,No I haven’t made up my mind yet!,589
1440,4573,1.3229166666666667,0.058292200410131785,96,1.3229166666666667,Would you like to try the 3D experience for two dollars more?,589
1441,4866,1.3229166666666667,0.056379804744615195,96,1.3229166666666667,"Are you ready to order, or shall I come back next week?",589
1442,5908,1.3229166666666667,0.046817093863008793,96,1.3229166666666667,Each dish is named after a Cleveland Browns starting quaterback,589
1443,5943,1.3229166666666667,0.04054127111651395,96,1.3229166666666667,We are a tapas restaurant.,589
1444,5652,1.3225806451612903,0.06146354792751876,93,1.3225806451612903,What are your specials?,589
1445,3409,1.3203883495145632,0.060478440562679266,103,1.3203883495145632,Welcome to Mar a Large-o! May I fake your order?,589
1446,3959,1.3203883495145632,0.05888356616063574,103,1.3203883495145632,Just a test to make sure you'll be able to handle the bill.,589
1447,856,1.32,0.060100925218512326,100,1.32,"I’m sorry, we are out of that item as well.",589
1448,1685,1.32,0.061758735529003614,100,1.32,We're out of everything.,589
1449,2278,1.32,0.05663992238766581,100,1.32,Would sir care to see this year's specials?,589
1450,3136,1.32,0.05295319068800674,100,1.32,But the portions are small.,589
1451,3317,1.32,0.06494753127087909,100,1.32,"Sorry, sir, we only have one entree left this evening.",589
1452,3586,1.32,0.05295319068800674,100,1.32,It's for our customers whose eyes are bigger than their stomachs...,589
1453,5544,1.32,0.0386122919665369,100,1.32,"'Yes, we change the menu every week'",589
1454,5687,1.32,0.05839607015973771,100,1.32,My eyesight isn't very good. Do you have a large print menu by any chance?,589
1455,421,1.3195876288659794,0.06479280974214709,97,1.3195876288659794,We believe it compensates for our small portions.,589
1456,674,1.3195876288659794,0.056847280928125715,97,1.3195876288659794,"These days, we have to compete with Amazon.",589
1457,1146,1.3195876288659794,0.059613574774331844,97,1.3195876288659794,"I'd like the children's menu, please.",589
1458,1230,1.3195876288659794,0.057784095260481914,97,1.3195876288659794,Would you like to hear the specials too?,589
1459,1426,1.3195876288659794,0.0613885569929548,97,1.3195876288659794,"Sir, you're the one who mentioned that your eyes were bigger than your stomach.",589
1460,2045,1.3195876288659794,0.0613885569929548,97,1.3195876288659794,Wait until you see the size of your check!,589
1461,2249,1.3195876288659794,0.057784095260481914,97,1.3195876288659794,"Yes, the chef did add a few new items to the menu. Why do you ask?",589
1462,2324,1.3195876288659794,0.059613574774331844,97,1.3195876288659794,"No worries, the portions are more in keeping with the table top.",589
1463,2328,1.3195876288659794,0.057784095260481914,97,1.3195876288659794,We also have a second volume of our daily specials.,589
1464,2486,1.3195876288659794,0.059613574774331844,97,1.3195876288659794,Do you care to hear about this evening's specials? We have quite a few that aren't listed on the menu.,589
1465,2702,1.3195876288659794,0.06642954784269178,97,1.3195876288659794,Would you like the large-print version?,589
1466,3207,1.3195876288659794,0.057784095260481914,97,1.3195876288659794,"Sorry sir, happy hour just ended, can we wheel in the dinner menu.",589
1467,3840,1.3195876288659794,0.0613885569929548,97,1.3195876288659794,"We have American portions, too.",589
1468,4115,1.3195876288659794,0.0613885569929548,97,1.3195876288659794,I see you've expanded the menu,589
1469,4186,1.3195876288659794,0.055894767490079454,97,1.3195876288659794,Room for dessert?,589
1470,4507,1.3195876288659794,0.05393930292901122,97,1.3195876288659794,"In addition to tonight's menu, we have 458 special items that may interest you.",589
1471,4538,1.3195876288659794,0.06479280974214709,97,1.3195876288659794,"If you have an hour to spare, I'll tell you about to tonight's specials.",589
1472,4577,1.3195876288659794,0.05492573819821487,97,1.3195876288659794,"Sir, love is not on the menu",589
1473,4889,1.3195876288659794,0.059613574774331844,97,1.3195876288659794,"Ah, yes, the single chickpea, excellent choice.",589
1474,4941,1.3195876288659794,0.055894767490079454,97,1.3195876288659794,May I tell you our specials?,589
1475,5254,1.3195876288659794,0.059613574774331844,97,1.3195876288659794,Our specials this evening include a much smaller menu and a more competent server.,589
1476,533,1.3191489361702127,0.057022847306584794,94,1.3191489361702127,And for the sixteenth course may I recommend...,589
1477,1613,1.3191489361702127,0.058994793959766104,94,1.3191489361702127,The forklift with the wine list is on its way,589
1478,3476,1.3191489361702127,0.057022847306584794,94,1.3191489361702127,Can I start you with an amusing little step ladder?,589
1479,4985,1.3191489361702127,0.06090292533007282,94,1.3191489361702127,"I'm sorry, we're out of that. And just about everything else.",589
1480,567,1.3176470588235294,0.058486429046404435,85,1.3176470588235294,How does the prime rib's portion size compare to its font size?,589
1481,1121,1.3176470588235294,0.06738776270118936,85,1.3176470588235294,Would you like the big cheque now?,589
1482,5748,1.3176470588235294,0.06309426655597127,85,1.3176470588235294,Sure the plates are small but we are big on presentation.,589
1483,1138,1.3173076923076923,0.05677481802775082,104,1.3173076923076923,Do you want to hear our specials?,589
1484,295,1.316831683168317,0.05437437709998408,101,1.316831683168317,"The giant salad and a gallon of iced tea? Very good, monsieur.",589
1485,563,1.316831683168317,0.061226236965308135,101,1.316831683168317,I highly recommend the jumbo shrimp.,589
1486,1139,1.316831683168317,0.05958718227061813,101,1.316831683168317,Just how jumbo is the jumbo shrimp?,589
1487,3315,1.316831683168317,0.05616576080666468,101,1.316831683168317,"So, would you like to hear our specials of the day in addition to the menu",589
1488,3664,1.316831683168317,0.0628225428879814,101,1.316831683168317,Do you have any specials that aren’t listed?,589
1489,170,1.3157894736842106,0.06035200568404197,95,1.3157894736842106,Do you have 10 minutes to hear Today's Specials?,589
1490,406,1.3157894736842106,0.05240713622354024,95,1.3157894736842106,"I'm sorry, there's no ordering off the menu.",589
1491,599,1.3157894736842106,0.05651934410995645,95,1.3157894736842106,"Very good, sir, but I must say, that is one tall order.",589
1492,606,1.3157894736842106,0.058467088386143805,95,1.3157894736842106,Wait until you see the portion sizes,589
1493,672,1.3157894736842106,0.05450203751132783,95,1.3157894736842106,The portions are actually quite small.,589
1494,686,1.3157894736842106,0.04794350420740789,95,1.3157894736842106,I see you added the prices.,589
1495,740,1.3157894736842106,0.05450203751132783,95,1.3157894736842106,We're hoping your eyes are bigger than your stomach.,589
1496,1159,1.3157894736842106,0.06035200568404197,95,1.3157894736842106,How did you print this?,589
1497,1168,1.3157894736842106,0.06035200568404197,95,1.3157894736842106,"Yes Sir, they're all Gluten free.",589
1498,1287,1.3157894736842106,0.05651934410995645,95,1.3157894736842106,I recommend the small plates,589
1499,1324,1.3157894736842106,0.05941702203257828,95,1.3157894736842106,And have you heard about our 'Shelters for the Homeless' initiative?,589
1500,1415,1.3157894736842106,0.06736632135585678,95,1.3157894736842106,"Would messieur like to hear about our 42,000 specials this evening....?",589
1501,1540,1.3157894736842106,0.058467088386143805,95,1.3157894736842106,"'Is the mammoth fresh or frozen?""",589
1502,1623,1.3157894736842106,0.04301919646179799,95,1.3157894736842106,The prices on our menu reflect the printing costs,589
1503,1887,1.3157894736842106,0.06035200568404197,95,1.3157894736842106,"Finally, we have menus large enough to accommodate our prices.",589
1504,1937,1.3157894736842106,0.063955397907867,95,1.3157894736842106,What our menu lacks in subtlety it makes up for in price.,589
1505,2047,1.3157894736842106,0.06035200568404197,95,1.3157894736842106,"Patrons kept insisting on raw and minimalist, so Chef decided to swap the old menu for a wholesalers’ produce catalogue and stop cooking all together; the individual kale leaves are highly recommend- page 42, middle column, 8th row from the top.",589
1506,2072,1.3157894736842106,0.058467088386143805,95,1.3157894736842106,Save room for dessert,589
1507,2134,1.3157894736842106,0.05651934410995645,95,1.3157894736842106,Do you want fries with that burger?,589
1508,2734,1.3157894736842106,0.05651934410995645,95,1.3157894736842106,"So sorry, I'm afraid we're fresh out of special number 1,312.",589
1509,3215,1.3157894736842106,0.06217980987282059,95,1.3157894736842106,"Yes, I can get you the large print menu, sir....",589
1510,3407,1.3157894736842106,0.05450203751132783,95,1.3157894736842106,"It is big, it's the portions that got small",589
1511,3479,1.3157894736842106,0.058467088386143805,95,1.3157894736842106,You did ask for a large print menu.,589
1512,3700,1.3157894736842106,0.06217980987282059,95,1.3157894736842106,Would you like to know our specials?,589
1513,3702,1.3157894736842106,0.058467088386143805,95,1.3157894736842106,"I must warn you, the portions are quite small.",589
1514,3882,1.3157894736842106,0.06217980987282059,95,1.3157894736842106,Why is the wine glass so small?,589
1515,4163,1.3157894736842106,0.05651934410995645,95,1.3157894736842106,"Why yes, I do agree it's a bit unwieldy, but how else can we fit in the calorie counts?",589
1516,4201,1.3157894736842106,0.05651934410995645,95,1.3157894736842106,You should see our extensive wine list.,589
1517,4283,1.3157894736842106,0.05651934410995645,95,1.3157894736842106,"Here at Trump Grille, we believe in quantity, not quality. I'll give you another hour to decide.",589
1518,4285,1.3157894736842106,0.06035200568404197,95,1.3157894736842106,We enlarged the type for some of our older patrons.,589
1519,4325,1.3157894736842106,0.058467088386143805,95,1.3157894736842106,"I assure you, no request is too large here, sir.",589
1520,4367,1.3157894736842106,0.05450203751132783,95,1.3157894736842106,We are the only Brobdingnagian restaurant in town.,589
1521,4547,1.3157894736842106,0.04033220919420718,95,1.3157894736842106,"If you don't find something to your liking, I can bring you our BIG menu...",589
1522,4556,1.3157894736842106,0.05450203751132783,95,1.3157894736842106,"Good evening, sir. Do you need a few more hours?",589
1523,4738,1.3157894736842106,0.06217980987282059,95,1.3157894736842106,May I suggest the grilled whale with plankton?,589
1524,4880,1.3157894736842106,0.05450203751132783,95,1.3157894736842106,"Yes, I can have the a la carte menu rolled out if you wish.",589
1525,4928,1.3157894736842106,0.03089975082884719,95,1.3157894736842106,Yes indeed! The portions are quite generous.,589
1526,5035,1.3157894736842106,0.063955397907867,95,1.3157894736842106,"It's a new strategy. Larger menus, smaller portions.",589
1527,5267,1.3157894736842106,0.05651934410995645,95,1.3157894736842106,Perhaps you would prefer our tapas menu.,589
1528,5460,1.3157894736842106,0.058467088386143805,95,1.3157894736842106,For dessert our menu writer Proust recommends a madeleine.,589
1529,5471,1.3157894736842106,0.058467088386143805,95,1.3157894736842106,These are our gluten free options. Would you like to see our vegan menu next?,589
1530,5561,1.3157894736842106,0.06217980987282059,95,1.3157894736842106,The chef had a really productive morning foraging today.,589
1531,5725,1.3157894736842106,0.05651934410995645,95,1.3157894736842106,You’ll be most impressed with our dessert menu.,589
1532,5874,1.3157894736842106,0.058467088386143805,95,1.3157894736842106,"If it's not on the menu, it doesn't exist.",589
1533,6024,1.3157894736842106,0.06035200568404197,95,1.3157894736842106,That's our Factory Farm-to-Table menu.,589
1534,2419,1.315217391304348,0.06359463836055658,92,1.315217391304348,I'll have the cheese sandwhich,589
1535,1430,1.3146067415730338,0.0631071239678998,89,1.3146067415730338,And may I also wish you a great big Texas welcome sir.,589
1536,4028,1.3146067415730338,0.06105036020030265,89,1.3146067415730338,I'll have the elephant brisket and a barrel of your house red.,589
1537,596,1.313953488372093,0.06246559196667716,86,1.313953488372093,We believe in large fonts here at Mr. Magoo's.,589
1538,946,1.3125,0.0598105561885103,96,1.3125,"Wait until you see the bill ""Actually this is nothing, wait until you see the bill.",589
1539,1882,1.3125,0.05794829062159566,96,1.3125,Shall we begin with an incredibly generous appetizer?,589
1540,2540,1.3125,0.06507839402152647,96,1.3125,Welcome to Mar-a-Lago.,589
1541,2925,1.3125,0.04980774441298032,96,1.3125,In addition we also have nine chef's specials this evening.,589
1542,5437,1.3125,0.061616563334812684,96,1.3125,"I'm sorry, sir, we're out of everything.",589
1543,5658,1.3125,0.05794829062159566,96,1.3125,All of the items are to scale.,589
1544,478,1.3118279569892473,0.04581222376808275,93,1.3118279569892473,And the specials are...,589
1545,557,1.3118279569892473,0.059171651918434806,93,1.3118279569892473,"In the new nouvelle cuisine, we compensate for the tiny portions with a really huge menu!",589
1546,823,1.3118279569892473,0.06111496119161818,93,1.3118279569892473,"If it's not on there, we probably don't have it.",589
1547,939,1.3118279569892473,0.06482705193702835,93,1.3118279569892473,"Take your time, sir.",589
1548,960,1.3118279569892473,0.05065834608403694,93,1.3118279569892473,"Yes we have one, but the print is tiny.",589
1549,2421,1.3118279569892473,0.05716231538399947,93,1.3118279569892473,Would you like a bit more time with the menu?,589
1550,2474,1.3118279569892473,0.06482705193702835,93,1.3118279569892473,"Yes, thank you for noticing. We have enlarged our menu.",589
1551,2548,1.3118279569892473,0.05716231538399947,93,1.3118279569892473,"Why don't you look it up, sir? That's why a culinary dictionary is included in the menu.",589
1552,2619,1.3118279569892473,0.05716231538399947,93,1.3118279569892473,"Tell the chef I am gluten free , a vegan , no nuts, hold the beets , avoid stone fruits , no salt , no red wine , no capers , no truffles, no vinegar, no onions. avoid garlic and dressing on the side ,Theatre at eight.",589
1553,2668,1.3118279569892473,0.03578575874756369,93,1.3118279569892473,Are you enjoying our new expanded menu?,589
1554,2853,1.3118279569892473,0.06299835372570925,93,1.3118279569892473,The chef has been working really hard to expand our menu.,589
1555,2924,1.3118279569892473,0.059171651918434806,93,1.3118279569892473,"Welcome to Amazon Bistro. Tonight's special is Prime rib. Sorry, no substitutions allowed. If you can't find it on the menu, it doesn't exist.",589
1556,2926,1.3118279569892473,0.055079725937619145,93,1.3118279569892473,...but I still can't see the prices.,589
1557,3018,1.3118279569892473,0.043185712404455005,93,1.3118279569892473,Would you like to speak to our in-house navigateur?,589
1558,3024,1.3118279569892473,0.05716231538399947,93,1.3118279569892473,"Would you like a few hours to peruse the menu, Sir?",589
1559,3113,1.3118279569892473,0.06482705193702835,93,1.3118279569892473,Tonight's menu is also available in a large print format,589
1560,3250,1.3118279569892473,0.05716231538399947,93,1.3118279569892473,We also have the movie version if you'd like to see that instead.,589
1561,3272,1.3118279569892473,0.06482705193702835,93,1.3118279569892473,I would recommend any of our small plates,589
1562,3512,1.3118279569892473,0.05716231538399947,93,1.3118279569892473,Nothing is off OUR menu,589
1563,3513,1.3118279569892473,0.06111496119161818,93,1.3118279569892473,And our specials...,589
1564,3817,1.3118279569892473,0.06111496119161818,93,1.3118279569892473,We call it our “Grand Prix Fixe”.,589
1565,3961,1.3118279569892473,0.06111496119161818,93,1.3118279569892473,Are the binoculars extra?,589
1566,4086,1.3118279569892473,0.043185712404455005,93,1.3118279569892473,"Instead of reading glasses, we offer a larger menu.",589
1567,4176,1.3118279569892473,0.06111496119161818,93,1.3118279569892473,"For anything you don't finish, we offer an elephant bag.",589
1568,4673,1.3118279569892473,0.04581222376808275,93,1.3118279569892473,...and would monsieur prefer a full or a half magnum with his entree?,589
1569,4694,1.3118279569892473,0.06299835372570925,93,1.3118279569892473,"Would you care to hear the specials, Monsieur?",589
1570,5029,1.3118279569892473,0.06299835372570925,93,1.3118279569892473,May I suggest the 396-course tasting menu?,589
1571,5087,1.3118279569892473,0.05400832495101974,93,1.3118279569892473,I will need another minute.,589
1572,5185,1.3118279569892473,0.06111496119161818,93,1.3118279569892473,You want gluten free? Then you want our larger menu.,589
1573,5227,1.3118279569892473,0.05291523522263364,93,1.3118279569892473,How big are your portions?,589
1574,5237,1.3118279569892473,0.06111496119161818,93,1.3118279569892473,"Yes, there is a small fee for time spent reading the menu.",589
1575,5246,1.3118279569892473,0.055079725937619145,93,1.3118279569892473,"would you like to see our specials for tonight as well, sir?",589
1576,5287,1.3118279569892473,0.06482705193702835,93,1.3118279569892473,All our menus are genetically modified.,589
1577,5524,1.3118279569892473,0.059171651918434806,93,1.3118279569892473,Take your time. It's a big menu.,589
1578,5728,1.3118279569892473,0.06111496119161818,93,1.3118279569892473,Would you like to hear our specials this evening?,589
1579,5901,1.3118279569892473,0.059171651918434806,93,1.3118279569892473,I’ll have to ask the chef... That’s an extremely tall order.,589
1580,5915,1.3118279569892473,0.055079725937619145,93,1.3118279569892473,The desserts start on column H row 137.,589
1581,6056,1.3118279569892473,0.05716231538399947,93,1.3118279569892473,Will you need another hour?,589
1582,5834,1.3103448275862069,0.06602945570733366,87,1.3103448275862069,I'd recommend the chicken.,589
1583,351,1.308641975308642,0.0648882593877427,81,1.308641975308642,May I suggest a nice Chateauneuf-de-pape with your franks and beans?,589
1584,77,1.3085106382978724,0.06421943148068798,94,1.3085106382978724,It makes the portions look bigger.,589
1585,2666,1.3085106382978724,0.054591504674966845,94,1.3085106382978724,Where did you hide my wife?,589
1586,53,1.3076923076923077,0.06573025071401598,91,1.3076923076923077,"This is a TRUMP restaurant, sir!",589
1587,110,1.3076923076923077,0.05109857287171226,91,1.3076923076923077,Are you ready to order or do you need another hour?,589
1588,133,1.3076923076923077,0.05989879069168813,91,1.3076923076923077,And we have a very extensive wine list.,589
1589,210,1.3076923076923077,0.057824431533102176,91,1.3076923076923077,Take your time. I'll be back in an hour.,589
1590,300,1.3076923076923077,0.05567283572736507,91,1.3076923076923077,...and the dessert table arrives on flatbed trailer.,589
1591,340,1.3076923076923077,0.05989879069168813,91,1.3076923076923077,"Yes, a concordance is available towards the back, sir.",589
1592,460,1.3076923076923077,0.05567283572736507,91,1.3076923076923077,Shrimp? Really?,589
1593,541,1.3076923076923077,0.061903678166381274,91,1.3076923076923077,"Yes, sir. I assure you that's our full menu.",589
1594,595,1.3076923076923077,0.05989879069168813,91,1.3076923076923077,I will include your complaint in the whine list,589
1595,620,1.3076923076923077,0.061903678166381274,91,1.3076923076923077,If you don't see it on the menu it doesn't exist.,589
1596,650,1.3076923076923077,0.061903678166381274,91,1.3076923076923077,"If you cannot decide, sir, would you like to see our supplemental menu?",589
1597,705,1.3076923076923077,0.06573025071401598,91,1.3076923076923077,"When you're ready, I'll have a fork lift bring the dessert menu.",589
1598,769,1.3076923076923077,0.05567283572736507,91,1.3076923076923077,It makes the prices look smaller.,589
1599,793,1.3076923076923077,0.06573025071401598,91,1.3076923076923077,"Welcome to Costco Restaurant, would you like to know the specials?",589
1600,826,1.3076923076923077,0.061903678166381274,91,1.3076923076923077,Our web page clearly states we are famous for our large menu,589
1601,882,1.3076923076923077,0.05675882979789399,91,1.3076923076923077,"Oddly, I don't see Jumbo Shrimp.",589
1602,931,1.3076923076923077,0.061903678166381274,91,1.3076923076923077,I think I will just have the big salad.,589
1603,1025,1.3076923076923077,0.05567283572736507,91,1.3076923076923077,Would you like to see the complete menu?,589
1604,1048,1.3076923076923077,0.05567283572736507,91,1.3076923076923077,I'll be back in a couple of hours to take your order.,589
1605,1187,1.3076923076923077,0.061903678166381274,91,1.3076923076923077,"I told you "" No matter how big the menu is, I can't read French """,589
1606,1222,1.3076923076923077,0.05567283572736507,91,1.3076923076923077,This is our new Chris Christie selection.,589
1607,1393,1.3076923076923077,0.05567283572736507,91,1.3076923076923077,Anything with your small salad?,589
1608,1439,1.3076923076923077,0.057824431533102176,91,1.3076923076923077,We're having a clearance sale.,589
1609,1444,1.3076923076923077,0.04865042554105199,91,1.3076923076923077,"We also have off-menu specials, if you have the time to hear them.",589
1610,1513,1.3076923076923077,0.05343467407710028,91,1.3076923076923077,"Yes sir, ONE BIG SALAD and......",589
1611,1549,1.3076923076923077,0.061903678166381274,91,1.3076923076923077,"Monsieur, from our extensive menu by far our best meal is cheeseburger and fries.",589
1612,1607,1.3076923076923077,0.057824431533102176,91,1.3076923076923077,"Would you rather see the children's menu, sir?",589
1613,1620,1.3076923076923077,0.03560846537586737,91,1.3076923076923077,"Welcome to New Orleans, sir!",589
1614,1703,1.3076923076923077,0.06384563896404478,91,1.3076923076923077,"Shall I bring you the large print version, sir?",589
1615,2090,1.3076923076923077,0.05343467407710028,91,1.3076923076923077,Would you prefer to order from the drop down menu?,589
1616,2454,1.3076923076923077,0.05227967359907491,91,1.3076923076923077,You should see the chef,589
1617,2627,1.3076923076923077,0.061903678166381274,91,1.3076923076923077,"That's a tall order, sir. But then all the orders we get are tall orders.",589
1618,3498,1.3076923076923077,0.03728354769230615,91,1.3076923076923077,We don’t get many guests with normal eyesight,589
1619,3601,1.3076923076923077,0.06384563896404478,91,1.3076923076923077,It helps us justify the prices.,589
1620,3746,1.3076923076923077,0.05989879069168813,91,1.3076923076923077,Our motto is 'more is less.',589
1621,3853,1.3076923076923077,0.05989879069168813,91,1.3076923076923077,"Yes, sir; the All-You-Can-Read special, then?",589
1622,3911,1.3076923076923077,0.05567283572736507,91,1.3076923076923077,"""I recommend the Big Salad"".",589
1623,3998,1.3076923076923077,0.057824431533102176,91,1.3076923076923077,"You think that's big, wait until you see the bill.",589
1624,4043,1.3076923076923077,0.05989879069168813,91,1.3076923076923077,"If you read the small print, I think you'll find that gratuity is not included.",589
1625,4094,1.3076923076923077,0.061903678166381274,91,1.3076923076923077,It's for those patrons whose eyes are bigger than the stomachs.,589
1626,4169,1.3076923076923077,0.05989879069168813,91,1.3076923076923077,"Sir, I assure you the portions are modest",589
1627,4311,1.3076923076923077,0.06384563896404478,91,1.3076923076923077,"Sir, are you ready to order?...or do you need another hour.",589
1628,4433,1.3076923076923077,0.061903678166381274,91,1.3076923076923077,The wine list will become available as soon as the skywriter has refueled.,589
1629,4489,1.3076923076923077,0.061903678166381274,91,1.3076923076923077,"Indeed, a very different perspective since Chef Gulliver landed on our shores.",589
1630,4590,1.3076923076923077,0.05109857287171226,91,1.3076923076923077,And what would you like from the adult menu?,589
1631,4807,1.3076923076923077,0.061903678166381274,91,1.3076923076923077,"May I start you off with a beverage and a ladder, or a pair of field glasses?",589
1632,4890,1.3076923076923077,0.05989879069168813,91,1.3076923076923077,"Pardon me, but does the chef accommodate requests?",589
1633,4905,1.3076923076923077,0.06384563896404478,91,1.3076923076923077,"Sorry, we don't have that tonight.",589
1634,4926,1.3076923076923077,0.05227967359907491,91,1.3076923076923077,How big is your smallest serving?,589
1635,4949,1.3076923076923077,0.06756231274259077,91,1.3076923076923077,"Mostly, to keep away short-fingered vulgarians.",589
1636,4976,1.3076923076923077,0.05989879069168813,91,1.3076923076923077,All of our specials today come with a side of beef.,589
1637,5003,1.3076923076923077,0.05989879069168813,91,1.3076923076923077,"Yes, sir. Mr. Trump designed the menu, too.",589
1638,5049,1.3076923076923077,0.05109857287171226,91,1.3076923076923077,"I can assure you sir, I think you'll be more than satisfied with the portion size",589
1639,5063,1.3076923076923077,0.057824431533102176,91,1.3076923076923077,"May I suggest the jumbo shrimp, sir?",589
1640,5097,1.3076923076923077,0.06573025071401598,91,1.3076923076923077,"Sorry, but we're out of everything except chicken noodle soup.",589
1641,5145,1.3076923076923077,0.04865042554105199,91,1.3076923076923077,May I suggest the footnote rare.,589
1642,5211,1.3076923076923077,0.06384563896404478,91,1.3076923076923077,"Nope. Sorry, we do not serve that either.",589
