,caption,count,funny,precision,rank,score,somewhat_funny,target_id,unfunny,contest
4025,"Talk about lift and comfort!  AND with optional tasers, no practical joker has braved snapping them yet!",158,5,0.03649457734712867,4026,1.1772151898734178,18,972,135,638
4026,I got the idea when my spouse told me I was always droning on.,158,2,0.03301480289953606,4027,1.1772151898734178,24,1974,132,638
4027,"It’s safer than the new Boeing, I can tell you that much!",158,4,0.035372708698403484,4028,1.1772151898734178,20,2711,134,638
4028,It is the belt of the future! Holds up your pants – air-conditions!,158,6,0.037582972618314864,4029,1.1772151898734178,16,2994,136,638
4029,"Give me an exchange I said, and I'll let the delivery boys go.",158,6,0.037582972618314864,4030,1.1772151898734178,16,3275,136,638
4030,Are you jealous? Don't worry. It might not work!,158,5,0.03649457734712867,4031,1.1772151898734178,18,3389,135,638
4031,I see you when you're bad or good.  So be good for goodness sake.,158,5,0.03649457734712867,4032,1.1772151898734178,18,4629,135,638
4032,Suspenders are old school...,175,7,0.03602068892310305,4033,1.177142857142857,17,1319,151,638
4033,Let me know when I’m out of range!,175,2,0.031130094852666435,4034,1.177142857142857,27,2234,146,638
4034,Suspenders so passé,175,4,0.03317296633585229,4035,1.177142857142857,23,3134,148,638
4035,"They're cheaper than suspenders, plus I've lost ten pounds.",175,3,0.03216775171701932,4036,1.177142857142857,25,4410,147,638
4036,"Its really only a problem when going down in an elevator and the GPS lags on the altitude""",147,2,0.034402768589717754,4037,1.1768707482993197,22,573,123,638
4037,"And if the blades cut you anywhere, we'll give you your money back!",147,7,0.040613917407896466,4038,1.1768707482993197,12,5267,128,638
4038,One more and I can teleport.,164,4,0.034529365645152806,4039,1.1768292682926829,21,926,139,638
4039,Meet the parents.,164,4,0.034529365645152806,4040,1.1768292682926829,21,1002,139,638
4040,You should see the shoulder pads on my sport jacket.,164,4,0.034529365645152806,4041,1.1768292682926829,21,2825,139,638
4041,Our stretch goal is customer support.,164,5,0.03559626091240336,4042,1.1768292682926829,19,3854,140,638
4042,I'm glad you asked.  My drone man costume is at the dry cleaners.,164,3,0.033428436887916586,4043,1.1768292682926829,23,4064,138,638
4043,I could never find my size.,164,5,0.03559626091240336,4044,1.1768292682926829,19,4087,140,638
4044,"In the future , everyone will keep they’re pants up this way",164,2,0.03228999370830205,4045,1.1768292682926829,25,5171,137,638
4045,I've discovered the solution to belt slippage,181,6,0.0343055911790003,4046,1.1767955801104972,20,796,155,638
4046,It was the only way I could get the government to help pull me up by the bootstraps.,181,5,0.03339889566940304,4047,1.1767955801104972,22,2606,154,638
4047,Dude. The blades literally keep me cooler than you.,181,5,0.03246688894444054,4048,1.1767955801104972,20,3684,156,638
4048,They are great! Works like suspenders!,198,3,0.029874857051746057,4049,1.1767676767676767,29,5066,166,638
4049,Just act normal...,153,4,0.03605699996118442,4050,1.1764705882352942,19,91,130,638
4050,Everyone has 2 choices: be on a kill list or make one.,153,4,0.03605699996118442,4051,1.1764705882352942,19,499,130,638
4051,"Sure, all you need to worry about is holding up your pants. Me? I need 360-degree capture of every stop-and-frisk.",170,3,0.03269211197862161,4052,1.1764705882352942,24,1303,143,638
4052,"Retrofuturism.
 You should check it out!",153,4,0.03605699996118442,4053,1.1764705882352942,19,1868,130,638
4053,"Alexa, get me Gordon Gekko on the phone. Oh, never mind, he's right here.",170,6,0.035743742367658815,4054,1.1764705882352942,18,1963,146,638
4054,"Hi, I’m the slim Jim you ordered.",153,6,0.038368031878268934,4055,1.1764705882352942,15,2372,132,638
4055,Who needs belts? This is how you keep your pants up with style.,170,3,0.03269211197862161,4056,1.1764705882352942,24,2468,143,638
4056,Shoulders-free suspenders. Amazing for your posture and really helps with getting my steps in.,153,4,0.03605699996118442,4057,1.1764705882352942,19,2671,130,638
4057,Hey I’m gonna need you to sign a waiver if you enter my Drone Zone.,153,3,0.03484405163288778,4058,1.1764705882352942,21,2691,129,638
4058,Amazon’s throwing these in if you’re a Prime member. I read every review before committing.,170,4,0.03374000340689094,4059,1.1764705882352942,22,2989,144,638
4059,You should see my streaming numbers during bathroom breaks.,170,6,0.035743742367658815,4060,1.1764705882352942,18,3226,146,638
4060,Watch out!  All drone operations are suspended.,170,6,0.035743742367658815,4061,1.1764705882352942,18,3673,146,638
4061,My suitcases have their own drones.,153,3,0.03484405163288778,4062,1.1764705882352942,21,4157,129,638
4062,At least they come with Wi-Fi,153,5,0.0372304520279617,4063,1.1764705882352942,17,4609,131,638
4063,It's great for getting pizza.,176,1,0.02990231538144152,4064,1.1761363636363635,29,1141,146,638
4064,Too lazy to pull up his own pants.,176,5,0.03396893764767238,4065,1.1761363636363635,21,1175,150,638
4065,Trust me. These are so much better than an iPod.,176,3,0.03200029054620167,4066,1.1761363636363635,25,1373,148,638
4066,"No not high tech suspenders.  f









No not high tech suspenders.  They're here to blow away flatulence",176,4,0.03299929787096066,4067,1.1761363636363635,23,2241,149,638
4067,New from Apple: the Corporate Drone,176,3,0.03200029054620167,4068,1.1761363636363635,25,2488,148,638
4068,Personal delivery option.,176,1,0.02990231538144152,4069,1.1761363636363635,29,3434,146,638
4069,I'm a TMZ paparazzi -- Did you see which way Megyn Kelly went?,176,4,0.03299929787096066,4070,1.1761363636363635,23,4038,149,638
4070,"But these suspenders work just fine,",159,4,0.035167201242443775,4071,1.1761006289308176,20,481,135,638
4071,I can walk and chew gum at the same time with these gizmos!,159,3,0.034016474645773204,4072,1.1761006289308176,22,1341,134,638
4072,These suspenders are from Amazon.com.,159,3,0.034016474645773204,4073,1.1761006289308176,22,2676,134,638
4073,I come to you with a message from the near future - suspenders are in.,159,5,0.036281448966745344,4074,1.1761006289308176,18,2870,136,638
4074,"Of course, I’m just a prototype—but who wouldn’t want a Johnny-on-the-spot?",159,3,0.034016474645773204,4075,1.1761006289308176,22,5279,134,638
4075,The suspenders just didn't work for me.,142,2,0.03505107903487607,4076,1.176056338028169,21,1792,119,638
4076,Now that's what I call a lift!,165,5,0.0353960958753391,4077,1.1757575757575758,19,1683,141,638
4077,"Ultimately, I want to free solo the Burj Khalifa.",165,4,0.034336187517090576,4078,1.1757575757575758,21,2255,140,638
4078,"I am your UBER incarnate, take my hand.",165,1,0.029092602808541337,4079,1.1757575757575758,26,3700,138,638
4079,It just seems like we don't have anything in common anymore.,165,4,0.033242502059884355,4080,1.1757575757575758,20,4343,141,638
4080,No I haven't heard of Skynet. Sounds cutting edge!,165,7,0.03742597043806586,4081,1.1757575757575758,15,5348,143,638
4081,The newer models will be able to lift me up with them.,171,7,0.03650392729731125,4082,1.1754385964912282,16,2534,148,638
4082,I think it'll work. They're both flexible flyers.,171,2,0.031441047376087355,4083,1.1754385964912282,26,2540,143,638
4083,What? You haven't heard of UberDrone?,171,3,0.03251674814168497,4084,1.1754385964912282,24,4441,144,638
4084,And don't get me started on how awkward the selfies are.,154,3,0.0346360132677686,4085,1.1753246753246753,21,2335,130,638
4085,Better than suspenders,154,3,0.0346360132677686,4086,1.1753246753246753,21,3472,130,638
4086,Can you hear me now? No? I must be droning you out.,154,4,0.03584042205260224,4087,1.1753246753246753,19,4325,131,638
4087,"Come on, Jimmy -- 'Man of Steel' is only an expression.",154,6,0.03813529505006989,4088,1.1753246753246753,15,4929,133,638
4088,"I was pretty low too, but decided to make a change.",177,5,0.033791133444131316,4089,1.1751412429378532,21,2611,151,638
4089,"Yes, this is a remote belt.",177,3,0.031834541439504635,4090,1.1751412429378532,25,5411,149,638
4090,"Hey dude, can I borrow those suspenders?",160,5,0.03607077250255139,4091,1.175,18,1235,137,638
4091,Suspenders that transport.,160,4,0.034964042625668434,4092,1.175,20,1246,136,638
4092,You like em? It’s the newest thing in suspenders,160,5,0.03607077250255139,4093,1.175,18,1962,137,638
4093,I left my suspenders at the hotel.,160,3,0.03382111654762896,4094,1.175,22,3655,135,638
4094,"You imagine yourself whizzing around some war zone but in the total safety of Jersey.  Dude, it's hot!",160,4,0.034964042625668434,4095,1.175,20,3803,136,638
4095,Seriously. You need to stop droning on and on about this.,143,2,0.03482687171239298,4096,1.1748251748251748,21,5126,120,638
4096,Swap a drone for those suspenders.,166,3,0.033058598519889966,4097,1.1746987951807228,23,2321,140,638
4097,This way your wife will never know about our divorce investigation.,166,5,0.03519814819496672,4098,1.1746987951807228,19,3768,142,638
4098,Back to the Future completely failed to grasp the potential of drones to deliver high quality wedgies - it’s a transformative technology for Biffs everywhere!,166,5,0.03519814819496672,4099,1.1746987951807228,19,5307,142,638
4099,"Cost less than that new GoPro. Better angles, too!",149,4,0.03655233572903953,4100,1.174496644295302,18,1975,127,638
4100,Belts are so low tech,149,4,0.03655233572903953,4101,1.174496644295302,18,4111,127,638
4101,The FAA is constantly giving me shit about airspace.,172,4,0.033377898534553176,4102,1.1744186046511629,22,485,146,638
4102,Bizarre is when they start claiming that I am attached to them.,172,2,0.03127435368755401,4103,1.1744186046511629,26,1934,144,638
4103,They want me to take them to Putin.,172,5,0.03438144218306264,4104,1.1744186046511629,20,2491,147,638
4104,These babies also make sure my zipper is zipped .,172,7,0.03630540563877483,4105,1.1744186046511629,16,2590,149,638
4105,"Yeah, they're a real timesaver for my Insta feed.",172,5,0.03438144218306264,4106,1.1744186046511629,20,3837,147,638
4106,OK. So it's overkill to keep my pants up.,155,3,0.03443041481495158,4107,1.1741935483870967,21,703,131,638
4107,"Smile, you're on flying camera.",155,4,0.03562640376028727,4108,1.1741935483870967,19,855,132,638
4108,"Yes, 6 D, 360 degree selfie.",155,3,0.03443041481495158,4109,1.1741935483870967,21,961,131,638
4109,And I dont need braces!,155,2,0.0331913585706922,4110,1.1741935483870967,23,1228,130,638
4110,"I know they say earth is round, but I just have to see for myself.",155,3,0.03443041481495158,4111,1.1741935483870967,21,1826,131,638
4111,So . . . how far into the 21st century do you think those will stay up?,155,3,0.03443041481495158,4112,1.1741935483870967,21,3001,131,638
4112,Need a lift? Give me a bear hug!,178,4,0.0326572992401653,4113,1.1741573033707866,23,1186,151,638
4113,It’s a belt and suspenders operation.,161,5,0.035862506363595205,4114,1.173913043478261,18,1748,138,638
4114,"I said, ""We can both hover--not have her.""",184,7,0.03465318043487592,4115,1.173913043478261,18,1783,159,638
4115,Hey dude! I can take you to places you never thought existed.,161,4,0.034763193339020386,4116,1.173913043478261,20,3057,137,638
4116,Now you see why I drone on and on.....,161,6,0.03692910930731611,4117,1.173913043478261,16,3835,139,638
4117,I’m hoping it’s picked for Oprah’s Favorites.,167,3,0.03287669368744196,4118,1.1736526946107784,23,1035,141,638
4118,"Superficially, this approach may have some logic to it.",167,3,0.03287669368744196,4119,1.1736526946107784,23,1517,141,638
4119,I named them Rover and Hubert Hover,167,2,0.03176054346079685,4120,1.1736526946107784,25,1643,140,638
4120,"Hey, one can't be too careful.",167,3,0.03287669368744196,4121,1.1736526946107784,23,1832,141,638
4121,It's a visual message for young men to keep their pants pulled up.,167,5,0.035002381656157724,4122,1.1736526946107784,19,2029,143,638
4122,I call the suspenders disbelief.,167,6,0.036018211900315754,4123,1.1736526946107784,17,2398,144,638
4123,because suspenders are so 1990,167,5,0.035002381656157724,4124,1.1736526946107784,19,2740,143,638
4124,"My kid's in Harvard now, so I've had to step up my game.",167,5,0.035002381656157724,4125,1.1736526946107784,19,3236,143,638
4125,It’s the quickest way crosstown.,167,4,0.03395617550182303,4126,1.1736526946107784,21,4496,142,638
4126,I've lost 10 lbs. overnight.,167,3,0.03287669368744196,4127,1.1736526946107784,23,4602,141,638
4127,"The service works like Uber, only it’s quicker.",167,2,0.03176054346079685,4128,1.1736526946107784,25,4724,140,638
4128,"No belt, no suspenders, and oh so cool.
Mind you, batteries and hair gel costs ain’t cheap.",167,4,0.03395617550182303,4129,1.1736526946107784,21,4937,142,638
4129,They are called 'supspenders.,144,6,0.039825109497100095,4130,1.1736111111111112,13,4753,125,638
4130,I'm viral Vince- go ahead & do something stupid.,173,5,0.03419699296589373,4131,1.1734104046242775,20,336,148,638
4131,... and the suspenders are adjustable.,173,2,0.031109392834517333,4132,1.1734104046242775,26,400,145,638
4132,When they lose power I just wait in the bathroom while they charge.,173,3,0.03217153489745256,4133,1.1734104046242775,24,1162,146,638
4133,"When I'm on the campaign trail, I set them in opposite directions.",173,4,0.033199713745508355,4134,1.1734104046242775,22,3869,147,638
4134,I'm the latest in pop-up ads.,150,2,0.03377338171479713,4135,1.1733333333333333,22,650,126,638
4135,Don't tell me you haven't bought a pair of fly pants yet?!?,150,2,0.03377338171479713,4136,1.1733333333333333,22,1724,126,638
4136,I've found that technological advancements really let you focus on the things that matter.,150,3,0.03507316311749439,4137,1.1733333333333333,20,2403,127,638
4137,"It's the belt of the future, transportation included.",156,3,0.034227214246493914,4138,1.1730769230769231,21,2046,132,638
4138,"This is the only way I can get above this freakin' mess.
My mother was Mexican, Trump says I'm a nobody.",156,4,0.035414900550674824,4139,1.1730769230769231,19,3901,133,638
4139,This is the best belt-and-suspenders approach.,156,5,0.036564028319551724,4140,1.1730769230769231,17,4319,134,638
4140,"Unfortunately, they only get you as far as you think they will.",156,4,0.035414900550674824,4141,1.1730769230769231,19,4677,133,638
4141,"Buddy, I've got a 5-star rating.",156,4,0.035414900550674824,4142,1.1730769230769231,19,5136,133,638
4142,...plus they're powered by blockchain. You can't pass up on this investment!,133,3,0.03775313771193071,4143,1.1729323308270676,17,577,113,638
4143,If you buy a certain bridge I will throw in two of these.,162,3,0.03343697587998637,4144,1.1728395061728396,22,442,137,638
4144,Twenty-First century suspenders.,162,7,0.03774594415834494,4145,1.1728395061728396,14,542,141,638
4145,Look what I save on belts and suspenders!,162,1,0.031059119172889282,4146,1.1728395061728396,26,684,135,638
4146,"Better than suspenders cooler than a belt, I call it , Drone won’t leave your pants alone.",162,3,0.03343697587998637,4147,1.1728395061728396,22,1345,137,638
4147,"I've already had 40 seconds of this morning go viral, and it's only Monday. Say goodbye to the 9-to-5.",162,5,0.03565660988094412,4148,1.1728395061728396,18,3979,139,638
4148,I always wanted to be light in my loafers,162,4,0.03456461473964836,4149,1.1728395061728396,20,4811,138,638
4149,"Hey, man, they work way better than suspenders.",139,6,0.040752050204457546,4150,1.1726618705035972,12,4912,121,638
4150,Beats the hell out of those suspenders!,168,5,0.03480876081667539,4151,1.1726190476190477,19,878,144,638
4151,"I'm not ready to actually fly this way yet. I'm still struggling to keep the drones from smacking into each other. And I haven't figured out how to avoid the wedgie, either.",168,6,0.03581809359837885,4152,1.1726190476190477,17,1756,145,638
4152,"All you need is a remote control, a spare battery, to give up elevators and cars, and it really takes the pressure off your shoulders.",168,4,0.03376927346216977,4153,1.1726190476190477,21,2347,143,638
4153,They’re still working out the kinks.”,168,5,0.03480876081667539,4154,1.1726190476190477,19,2596,144,638
4154,It’s a new app. Do you think it will kill me?,168,6,0.03581809359837885,4155,1.1726190476190477,17,3720,145,638
4155,I'm from beam-me-up ceiling cleaners,168,5,0.03480876081667539,4156,1.1726190476190477,19,4586,144,638
4156,"You won't be able to grow an afro anymore, but when you consider the cost savings from not having to purchase belts for the rest of your life...",168,2,0.03158784309356021,4157,1.1726190476190477,25,4713,141,638
4157,"If you're innocent, what have you got to be worried about?",145,4,0.037067851716315194,4158,1.1724137931034482,17,1734,124,638
4158,"Suspend your disbelief and sadness, the future is here...droning on without you.",174,4,0.033023401104270614,4159,1.1724137931034482,22,1775,148,638
4159,My voice is no longer my only thing that drones on.,174,7,0.035914722951171124,4160,1.1724137931034482,16,2699,151,638
4160,Safety schmafety...I’ll play whatever music you want and no surge pricing.,145,1,0.03296466758551724,4161,1.1724137931034482,23,3502,121,638
4161,talk about a salesman! he sold me on the remote control.,174,6,0.03497751501470765,4162,1.1724137931034482,18,3703,150,638
4162,"Don’t flatter yourself, Jim – it was just a downdraft.",174,5,0.03401449380115513,4163,1.1724137931034482,20,3783,149,638
4163,Would you like to join our new sexual harassment prevention program?,174,5,0.03401449380115513,4164,1.1724137931034482,20,4155,149,638
4164,They're selfie drones.,180,5,0.03326861086666922,4165,1.1722222222222223,21,4821,154,638
4165,I double-prayed for deliverance.,151,6,0.03847144453358845,4166,1.1721854304635762,14,1095,131,638
4166,Someone told me I can't see what's right in front of me.,151,5,0.037306190153249645,4167,1.1721854304635762,16,1544,130,638
4167,"""I guarantee you, these suspenders will put a spring in your step.""",151,4,0.03610334614685831,4168,1.1721854304635762,18,1706,129,638
4168,Suspenders? In this economy?,151,4,0.03610334614685831,4169,1.1721854304635762,18,5368,129,638
4169,The devil makes much more noise than the angel.,157,7,0.03852831630157887,4170,1.1719745222929936,13,1279,137,638
4170,It's my new weight loss plan.,157,4,0.035205868900656134,4171,1.1719745222929936,19,2064,134,638
4171,I am now secure in the knowledge I’ll never make an ass of myself,157,5,0.03634711160984177,4172,1.1719745222929936,17,2721,135,638
4172,He kept droning on!,157,6,0.037453595818110724,4173,1.1719745222929936,15,3881,136,638
4173,Thank god the bullies didn't have these in high school.,157,6,0.037453595818110724,4174,1.1719745222929936,15,3982,136,638
4174,Those old suspenders get in the way. You should try these.,157,4,0.035205868900656134,4175,1.1719745222929936,19,4779,134,638
4175,"It`s air suspension, but I could drone on.",157,5,0.03634711160984177,4176,1.1719745222929936,17,5040,135,638
4176,If the Wright brothers had invented this they'd be flying high now,157,3,0.03402637047529577,4177,1.1719745222929936,21,5176,133,638
4177,"It's my latest invention, The WedgieFly.",157,7,0.03852831630157887,4178,1.1719745222929936,13,5354,137,638
4178,"Hi! I'm Paul, do you have minute for technology?",163,4,0.03436826902782698,4179,1.1717791411042944,20,677,139,638
4179,...And I also wear suspenders.,163,3,0.03324812105864271,4180,1.1717791411042944,22,1888,138,638
4180,No bald spots will remain uncovered with these babies,163,4,0.03436826902782698,4181,1.1717791411042944,20,2881,139,638
4181,This is the 21st century way to suspend.,163,3,0.03324812105864271,4182,1.1717791411042944,22,3714,138,638
4182,"Pretty sweet, right?",163,4,0.03436826902782698,4183,1.1717791411042944,20,3824,139,638
4183,Steve Urkel’s got nothing on my suspenders!,163,4,0.03436826902782698,4184,1.1717791411042944,20,4036,139,638
4184,Synchro something or other.  It's real damn expensive but it keeps them from colliding.,169,3,0.03251875319921335,4185,1.1715976331360947,23,1251,143,638
4185,And the best thing? Drone pants batteries last half an hour!,169,5,0.034617250987054426,4186,1.1715976331360947,19,2342,145,638
4186,Dodger Stadium Express,169,8,0.03754572146469925,4187,1.1715976331360947,13,3806,148,638
4187,You're flying low.,175,5,0.0338339142809577,4188,1.1714285714285715,20,1425,150,638
4188,I’ve been told to watch my step.,175,4,0.03284893165050278,4189,1.1714285714285715,22,4150,149,638
4189,This will be the next big thing for inversion freaks.,181,4,0.03215724856388858,4190,1.171270718232044,23,2206,154,638
4190,How do you like my high tech suspenders?,181,4,0.03215724856388858,4191,1.171270718232044,23,4923,154,638
4191,Now all I need is underwear that is less painful when stressed.,146,4,0.03683202309770149,4192,1.1712328767123288,17,1548,125,638
4192,"You see, big brother helps all of us in different ways.",152,6,0.03823428969926598,4193,1.1710526315789473,14,199,132,638
4193,"With my suspenders, if they both work I get Lift, if one fails, I get dragged through the mud and ruptured.",152,3,0.03464744985688511,4194,1.1710526315789473,20,1350,129,638
4194,"If they don't get called into combat, I'll beat you there!",152,4,0.03588292292060451,4195,1.1710526315789473,18,1955,130,638
4195,"I’ll tell ya Airlines these days, amirite?",152,4,0.03588292292060451,4196,1.1710526315789473,18,4487,130,638
4196,This will be the biggest auto-flight thing since Daedalus,158,4,0.034999266269688516,4197,1.1708860759493671,19,273,135,638
4197,"A drone again, naturally.",158,6,0.0372317062405613,4198,1.1708860759493671,15,3651,137,638
4198,It’s my personal transport,164,3,0.033061363034350776,4199,1.170731707317073,22,413,139,638
4199,Now I know exactly where I am going and where I have been. Can you claim the same?,164,1,0.030715148176667866,4200,1.170731707317073,26,2162,137,638
4200,It also serves as both a belt and suspenders.,164,8,0.03830322729386281,4201,1.170731707317073,12,3747,144,638
4201,The FAA notified me that my drone license was to be suspended.,170,5,0.034427818211090054,4202,1.1705882352941177,19,313,146,638
4202,I'm sorry I can only take parties of eight.,176,5,0.033655224617253426,4203,1.1704545454545454,20,4607,151,638
4203,My specialist said we should keep an eye on things.,182,3,0.031030595016585887,4204,1.1703296703296704,25,4063,154,638
4204,"I started at analog, skipped digital and went straight to Popular Mechanix",141,3,0.03623273694877958,4205,1.1702127659574468,18,3000,120,638
4205,Who wouldn't want eight propellers involved in pulling their pants down?,147,5,0.0378508341429082,4206,1.1700680272108843,15,29,127,638
4206,It’s the only thing that holds my pants up!,147,2,0.033957646634701966,4207,1.1700680272108843,21,2816,124,638
4207,These US made high tech suspenders are available on sale with a free money back guarantee...,147,2,0.033957646634701966,4208,1.1700680272108843,21,2915,124,638
4208,My wife says I can drone on,147,2,0.033957646634701966,4209,1.1700680272108843,21,2919,124,638
4209,Air suspenders keep clothes smoother.,153,2,0.03316631230422294,4210,1.1699346405228759,22,1476,129,638
4210,Do I need to wear a seat belt?,153,5,0.03685108150214538,4211,1.1699346405228759,16,1597,132,638
4211,The sensation is something you've got to feel to believe.,153,3,0.03443840274848347,4212,1.1699346405228759,20,4019,130,638
4212,"Suspenders are a drag, man",159,4,0.03479505107279786,4213,1.169811320754717,19,860,136,638
4213,"So what you will, but plumber's crack is nothing but a faint memory.",159,4,0.03479505107279786,4214,1.169811320754717,19,2331,136,638
4214,Drone mention it!,159,3,0.033631593528386426,4215,1.169811320754717,21,3061,135,638
4215,The urologist gives me a discount.,159,1,0.02987054729258538,4216,1.169811320754717,23,4229,135,638
4216,I know you're excited about your new toy but do you have to drone on and on.,159,7,0.03807269450483687,4217,1.169811320754717,13,4337,139,638
4217,"I know, but this one is for men.",165,6,0.036091616222951366,4218,1.1696969696969697,16,615,143,638
4218,Braces are soooo 80s.,165,2,0.03173271878606121,4219,1.1696969696969697,24,947,139,638
4219,"It's all the rage hi-fi apparel, but when I get above ten feet, my voice gets higher and my sperm count drops.",165,2,0.03173271878606121,4220,1.1696969696969697,24,2058,139,638
4220,What is this guy droning on about!,165,4,0.033982129150040376,4221,1.1696969696969697,20,2841,141,638
4221,They take out muggers too!,165,3,0.03287666758603483,4222,1.1696969696969697,19,3512,143,638
4222,You think this is crazy? You should see how I manscape.,171,4,0.033220589179131704,4223,1.1695906432748537,21,122,146,638
4223,"Forget segways, bikes, and scooters! This new method of sightseeing won't get on anyone's nerves!",171,4,0.033220589179131704,4224,1.1695906432748537,21,1731,146,638
4224,Not in production yet. This is just the Belt a test,171,6,0.03523075992108954,4225,1.1695906432748537,17,2694,148,638
4225,"If I get nominated for the Supreme Court, I can prove I didn’t do anything wrong.",171,2,0.03108067962898875,4226,1.1695906432748537,25,5342,144,638
4226,Look at the drone-ads on him!!,177,8,0.03624095721531277,4227,1.1694915254237288,14,1777,155,638
4227,The New suspenders,177,2,0.03046635796342376,4228,1.1694915254237288,26,4154,149,638
4228,"Yeah, it is attached to my underwear.",177,6,0.034423891545067635,4229,1.1694915254237288,18,4987,153,638
4229,They monitor dissidents and keep your pants up!,183,3,0.03087459592846382,4230,1.169398907103825,25,803,155,638
4230,Wearing suspenders like it's 1917 is so 2017.,183,4,0.0318322150363908,4231,1.169398907103825,23,3300,156,638
4231,Need a watch?,142,6,0.03994281071295725,4232,1.1690140845070423,12,4581,124,638
4232,Drone suspenders,148,6,0.03881461247660831,4233,1.1689189189189189,13,4058,129,638
