,caption,count,funny,precision,rank,score,somewhat_funny,target_id,unfunny,contest
1284,Skymall.,165,12,0.04631121770484318,1285,1.290909090909091,24,4605,129,638
1285,And each one has a camera to tell me if my shoelaces are tied.,141,7,0.046714775201292066,1286,1.2907801418439717,27,3542,107,638
1286,"""Watch this. Beam me up Scotties.""",172,9,0.04263565891472868,1287,1.2906976744186047,32,4570,131,638
1287,I save a bundle on belts and I can skip the escalators at the mall.,172,8,0.04183061026435942,1288,1.2906976744186047,34,4897,130,638
1288,Indoors can be a problem.,148,8,0.046234748759610964,1289,1.2905405405405406,27,642,113,638
1289,You said you wanted a product that would suspend belief!,148,10,0.048182043538841486,1290,1.2905405405405406,23,3349,115,638
1290,"Suspenders, but with a constant feed to all my social media!",179,10,0.04225675691988008,1291,1.2905027932960893,32,3752,137,638
1291,"Filthy subways, no parking, crowded streets...what do you mean 'why?",155,8,0.043387887138632876,1292,1.2903225806451613,28,456,119,638
1292,"I'm logging 50,000 steps a day on my fitness tracker with no effort!",155,9,0.04573813181316198,1293,1.2903225806451613,27,1622,119,638
1293,Even if you don't fly it will give you a nice buzz,155,9,0.04573813181316198,1294,1.2903225806451613,27,1686,119,638
1294,Man..  Those suspenders are so last century!,155,5,0.04191453184174533,1295,1.2903225806451613,35,4288,115,638
1295,Not only does it help keep my pants up but it also provides some personal space in crowded areas.,162,6,0.04170481232076497,1296,1.2901234567901234,35,601,121,638
1296,"I put 4 million into their Kickstarter campaign, but I got to keep the prototype!",162,13,0.04770807084153488,1297,1.2901234567901234,21,898,128,638
1297,"Why, to hold my pants up, of course....",162,12,0.04689753498126938,1298,1.2901234567901234,23,1697,127,638
1298,It’s amazing! They know when I have to go to the bathroom before I do.,162,9,0.04350464162492643,1299,1.2901234567901234,28,4715,125,638
1299,I know I tend to drone on a bit.,169,12,0.045505558186626445,1300,1.2899408284023668,25,1996,132,638
1300,dronewalking is a sideline; i'm really an actor,169,13,0.046273082931777204,1301,1.2899408284023668,23,3812,133,638
1301,"I should have Googled, 'Keep Pants Up No Batteries'. Where'd you get those?""",169,10,0.043930297854750236,1302,1.2899408284023668,29,5405,130,638
1302,"So I asked 
myself, ‘self, do you want spend one more second on F train?’",138,7,0.04736011941389737,1303,1.289855072463768,26,3183,105,638
1303,I like to keep an eye on myself.,138,6,0.0462297997843558,1304,1.289855072463768,28,3948,104,638
1304,My pants fit fine. These are to hold up my underwear.,176,7,0.04038033102157586,1305,1.2897727272727273,37,1346,132,638
1305,Taking my pet Drones for a walk..,145,10,0.048853955258283704,1306,1.289655172413793,22,3241,113,638
1306,"No offense, but my thinking was...""anything but suspenders"".",183,11,0.04231993381014933,1307,1.289617486338798,31,3109,141,638
1307,Those suspenders are sooooo 2005!,152,8,0.04537860074596002,1308,1.2894736842105263,28,3050,116,638
1308,The occasional atomic wedgie is a small price to pay for the added security against pickpockets.,152,10,0.04725985777742666,1309,1.2894736842105263,24,4198,118,638
1309,"Yes, like my wife says, I am definitely a helicopter parent",152,9,0.046328779191793075,1310,1.2894736842105263,26,5048,117,638
1310,My first one seemed lonely.,159,7,0.04311151787474359,1311,1.2893081761006289,32,2389,120,638
1311,I just try to stay away from schools when the batteries get low.,159,9,0.04492021777846088,1312,1.2893081761006289,28,3873,122,638
1312,"I know, I could’ve just settled on a belt...but this is 2018!",159,7,0.04311151787474359,1313,1.2893081761006289,32,4020,120,638
1313,"Sure it’s a prototype, but the casualty rates have been very low.",159,7,0.04311151787474359,1314,1.2893081761006289,32,4978,120,638
1314,They are great! Do you have a charger I could borrow?,166,10,0.044451335294701314,1315,1.2891566265060241,28,327,128,638
1315,"Sorry, I can't hear you over the sound of how hip my pants are.",166,11,0.04526522461680426,1316,1.2891566265060241,26,3202,129,638
1316,This way I can avoid the subway.,166,10,0.044451335294701314,1317,1.2891566265060241,28,3449,128,638
1317,I call them suspendered animation!,173,12,0.0447353094841009,1318,1.2890173410404624,26,1057,135,638
1318,It keeps the pants up and you feel 20 pounds lighter on your feet.,173,6,0.03997459072816323,1319,1.2890173410404624,38,2542,129,638
1319,"I’m sorry, am I droning on again?",173,13,0.04548033915621097,1320,1.2890173410404624,24,2770,136,638
1320,And the updraft keeps my hair in place.,173,11,0.043977660004968416,1321,1.2890173410404624,28,2796,134,638
1321,The hardest part was figuring out what my upseam was.,173,9,0.042421785785857966,1322,1.2890173410404624,32,3094,132,638
1322,This would work like a charm if it wasn't for the pigeons.,173,8,0.04162204432912362,1323,1.2890173410404624,34,4848,131,638
1323,"They're the newest thing in hands-free, but I have to be near a charger when the batteries die or else.",187,13,0.043031580229225916,1324,1.2887700534759359,28,4122,146,638
1324,"But you can't literally 'suspend' from yours, can you?",142,8,0.047493340716311575,1325,1.2887323943661972,25,4953,109,638
1325,I just think suspenders are too much of a statement.”,194,12,0.041290494800982784,1326,1.288659793814433,32,5103,150,638
1326,I put tape over the camera for privacy,149,10,0.04789728983007011,1327,1.2885906040268456,23,205,116,638
1327,Keeps your pants up and gives off a nice breeze at the same time.,149,9,0.04694098051275169,1328,1.2885906040268456,25,854,115,638
1328,They’re called suspenders? What a great idea.,149,10,0.04789728983007011,1329,1.2885906040268456,23,3922,116,638
1329,With the pull of these puppies there's no chance that I'll moon anyone.,149,6,0.04394737178486239,1330,1.2885906040268456,31,4560,112,638
1330,They're called Suspendrones.,156,8,0.04456351624034515,1331,1.2884615384615385,29,1816,119,638
1331,Who needs Uber?,156,7,0.04362561167209823,1332,1.2884615384615385,31,3790,118,638
1332,"Sure, it seems like the perfect solution until you figure in the cost of batteries!",156,8,0.04456351624034515,1333,1.2884615384615385,29,4175,119,638
1333,Let's take this one to Shark Tank.,163,10,0.04498977505112478,1334,1.2883435582822085,27,140,126,638
1334,Give you a lift,163,10,0.04498977505112478,1335,1.2883435582822085,27,1069,126,638
1335,You’re not supposed to wear a belt with suspenders.,163,12,0.04664290496129793,1336,1.2883435582822085,23,1490,128,638
1336,THERE'S NO DOWN SIDE.,163,11,0.04582379535994089,1337,1.2883435582822085,25,3545,127,638
1337,So far their artificial intelligence has only learned to keep my pants up,163,11,0.04582379535994089,1338,1.2883435582822085,25,5199,127,638
1338,I spent too much time at The Sharper Image.,170,10,0.04370441111922956,1339,1.2882352941176471,29,2581,131,638
1339,seriously...it's like I'm not even wearing pants!,170,8,0.04208144796380088,1340,1.2882352941176471,33,4132,129,638
1340,"Yes,it's cool,but I feel bad about the two guys I fired.",177,10,0.042513889670317564,1341,1.2881355932203389,31,184,136,638
1341,"Yeah, but can YOUR suspenders deliver PIZZA?",177,7,0.040184907723380514,1342,1.2881355932203389,37,2687,133,638
1342,Technically they're still suspenders,177,5,0.03855417147289064,1343,1.2881355932203389,41,4259,131,638
1343,I'm just trying to create a little buzz around here!,139,7,0.04706438389614814,1344,1.2877697841726619,26,1347,106,638
1344,They’ve really taken the weight off my shoulders.,146,7,0.04554701289352375,1345,1.2876712328767124,28,2299,111,638
1345,I should probably figure out who's driving these things.,153,8,0.04512071739016899,1346,1.2875816993464053,28,86,117,638
1346,I'm taking man-spreading to whole new levels.,153,11,0.04789443677317868,1347,1.2875816993464053,22,2088,120,638
1347,Avoiding the subway is worth the oppressive wedgies.,153,6,0.04317268249474997,1348,1.2875816993464053,32,3219,115,638
1348,Their purpose? Hold my pants up - what else!,160,11,0.04640156620106641,1349,1.2875,24,1233,125,638
1349,"In this #MeToo era, you can't be too careful.",167,8,0.04255544337173069,1350,1.2874251497005988,32,3659,127,638
1350,Which way to the Met Gala?,167,10,0.044218271046593614,1351,1.2874251497005988,28,3977,129,638
1351,My belt broke.,174,9,0.042209972111649965,1352,1.2873563218390804,32,1618,133,638
1352,There are some perks working for Amazon.,174,10,0.04298979546033624,1353,1.2873563218390804,30,1648,134,638
1353,"Ehh, Uber is so 2016.",174,5,0.03807200947402007,1354,1.2873563218390804,38,5102,131,638
1354,"Yes, I am absolutely terrified.",188,12,0.04216026348611134,1355,1.2872340425531914,30,4701,146,638
1355,I still put them on one leg at a time. How they stay up is my business.,143,9,0.04823525855297529,1356,1.2867132867132867,23,2043,111,638
1356,"Hey, I see you’re into suspenders too!",143,5,0.04396211940653265,1357,1.2867132867132867,31,5112,107,638
1357,The wedgie is worth the convenience.,150,9,0.046666666666666676,1358,1.2866666666666666,25,2236,116,638
1358,Suspenders?!  And you wonder why you cannot get a date?,150,9,0.046666666666666676,1359,1.2866666666666666,25,2660,116,638
1359,I'm a drone parent.,150,11,0.04854635614547944,1360,1.2866666666666666,21,4659,118,638
1360,I use to have a seeing eye dog.,150,1,0.03704603420423028,1361,1.2866666666666666,40,4792,109,638
1361,...but listen to me droning on - how have you been?,157,9,0.04522879522522273,1362,1.286624203821656,27,1594,121,638
1362,It drowns out my tinnitus,157,5,0.041460905057809604,1363,1.286624203821656,35,4538,117,638
1363,"These drones are guards, my slacks a prison, and my dick, a convicted felon.",164,14,0.047976598414166564,1364,1.2865853658536586,19,1677,131,638
1364,It's all about the support.,164,11,0.04557744944742412,1365,1.2865853658536586,25,2831,128,638
1365,"I'm thinking of calling them ""suspendrones.""  What do you think?",164,11,0.04557744944742412,1366,1.2865853658536586,25,4587,128,638
1366,"Sure, a belt is more practical. You don't have to drone on and on about it.",171,8,0.04186857758562124,1367,1.286549707602339,33,666,130,638
1367,"If you're clumsy you can get a free hair cut out of them, too.",171,11,0.04426484087689004,1368,1.286549707602339,27,4983,133,638
1368,Do you have a flip phone to go with that outfit?,171,11,0.04426484087689004,1369,1.286549707602339,27,5077,133,638
1369,I call them wunder pants.,178,9,0.03918957810570349,1370,1.2865168539325842,31,4023,138,638
1370,This way I can focus full time on my social media without missing anything in real life.,178,11,0.04304907539596055,1371,1.2865168539325842,29,4200,138,638
1371,They provide my pants with support and me with companionship.,199,11,0.03988250052190908,1372,1.2864321608040201,35,868,153,638
1372,Keeping my pants up is a breeze,133,9,0.050708613406591115,1373,1.2857142857142858,20,323,104,638
1373,"I was skeptical too, but look at the difference in our postures!",161,4,0.03982548443261939,1374,1.2857142857142858,38,550,119,638
1374,"Other than battery life issues, they never let me down.",168,10,0.043987563001449244,1375,1.2857142857142858,28,801,130,638
1375,I bet you are still pulling them down yourself too,147,11,0.04922282969318585,1376,1.2857142857142858,20,1149,116,638
1376,So what did you think I meant when I said the NSA's been suspending my right to privacy,154,8,0.044865648136121684,1377,1.2857142857142858,28,1717,118,638
1377,"Forgot my belt? No, I lost my remotes.",168,9,0.04316966179363413,1378,1.2857142857142858,30,1728,129,638
1378,We'll see who's the idiot when you have to pee.,161,13,0.04779986374737866,1379,1.2857142857142858,20,1788,128,638
1379,"It's far more than a massage, friend.",168,10,0.043987563001449244,1380,1.2857142857142858,28,2081,130,638
1380,Where do you want to be dropped?,168,13,0.046354759163386904,1381,1.2857142857142858,22,2352,133,638
1381,"Gave up waiting for the jet-pack, man""",147,4,0.04207815635452089,1382,1.2857142857142858,31,2635,112,638
1382,I thought it meant they would deliver the belt by drone,161,8,0.0435502952516282,1383,1.2857142857142858,30,2651,123,638
1383,"Just like everyone else, I put my pants on one leg at a time.",168,7,0.04148551193510007,1384,1.2857142857142858,34,3012,127,638
1384,I’m taking my drones out for a walk.,147,9,0.04729176506299244,1385,1.2857142857142858,24,3216,114,638
1385,Belts will be obsolete,168,11,0.044790531345767465,1386,1.2857142857142858,26,3221,131,638
1386,I enjoy the sensation. Plus the flying part is nice too,154,10,0.04580184298145538,1387,1.2857142857142858,23,3284,121,638
1387,Think of them as 'the bitcoin of suspenders.',154,7,0.04390949720562358,1388,1.2857142857142858,30,3453,117,638
1388,You didn’t know that Popular Mechanics bought GQ?,154,8,0.044865648136121684,1389,1.2857142857142858,28,3577,118,638
1389,A wedgie is a small price to pay for fashion.,154,7,0.04390949720562358,1390,1.2857142857142858,30,4365,117,638
1390,Suspenders make me look old,154,11,0.04761904761904759,1391,1.2857142857142858,22,4577,121,638
1391,We ran out of Segways.,182,10,0.04164913578080867,1392,1.2857142857142858,32,4606,140,638
1392,Yeah but I tried everything else to get it up,175,10,0.04277496225831015,1393,1.2857142857142858,30,4954,135,638
1393,Got a minute to learn about bitcoin?,168,8,0.04233596225370391,1394,1.2857142857142858,32,5343,128,638
1394,"Oh man, can you lighten up?",186,6,0.03730917716899918,1395,1.2849462365591398,40,3757,140,638
1395,It makes airport security slightly more complicated I suppose,172,2,0.03643313192611111,1396,1.2848837209302326,45,264,125,638
1396,They work great on stairs and I can skip the elevator altogether.,172,7,0.04083344685386205,1397,1.2848837209302326,35,1773,130,638
1397,'My shrink told me l need to see things from a different perspective`,172,14,0.04629650714684252,1398,1.2848837209302326,21,3746,137,638
1398,I'm beta testing new suspenders for James Bond.,165,9,0.0436728926515564,1399,1.284848484848485,29,4424,127,638
1399,They’re Gucci,165,9,0.0436728926515564,1400,1.284848484848485,29,4726,127,638
1400,The drones are free once you buy a suspension data plan.,165,9,0.0436728926515564,1401,1.284848484848485,29,5108,127,638
1401,"Honestly, the only it's uncomfortable is in the men's room.""",158,10,0.04586574126769227,1402,1.2848101265822784,25,1625,123,638
1402,"By all means, drone on....",158,7,0.04314845601854772,1403,1.2848101265822784,31,3728,120,638
1403,$199 to LA - No frills Coach,158,9,0.044978223252496785,1404,1.2848101265822784,27,4547,122,638
1404,I still feel like something’s been holding me up.,158,9,0.044978223252496785,1405,1.2848101265822784,27,5259,122,638
1405,I'm thinking of selling my parking space.,151,12,0.049167446869590986,1406,1.2847682119205297,19,4092,120,638
1406,I’m sorry if I drone on.,151,10,0.0473374839865085,1407,1.2847682119205297,23,4775,118,638
1407,Want a new high?,144,10,0.0489429786162614,1408,1.2847222222222223,21,78,113,638
1408,"Belt and suspenders are so 2018, man.",144,4,0.03900370856349364,1409,1.2847222222222223,31,1221,109,638
1409,"No need for a belt, but the wedgies are awful.",144,8,0.0469165744868658,1410,1.2847222222222223,25,2114,111,638
1410,"I'm telling you, this time I really think I found the idea that's going to take off",144,7,0.045869814305886714,1411,1.2847222222222223,27,2569,110,638
1411,"Are you Kevin?  Hi, I’m your Uber driver today.",144,9,0.04794048454810113,1412,1.2847222222222223,23,3990,112,638
1412,I'm an Amazon Test Dummy.,190,10,0.04041439191385028,1413,1.2842105263157895,34,5358,146,638
1413,"No, I haven't worn them on a date, yet.  Why do you ask?",183,8,0.03997538864685785,1414,1.284153005464481,36,3207,139,638
1414,"The permits weren’t the cheapest, but you just can’t put a price on this level of back support.",183,9,0.040719540000403266,1415,1.284153005464481,34,3440,140,638
1415,"Not only do they hold my pants up, they record every move I make.",176,6,0.03939289875415385,1416,1.2840909090909092,38,3496,132,638
1416,I've gotten some really great selfies.,169,8,0.042118651881780336,1417,1.2840236686390532,32,889,129,638
1417,"Yea, so then I said, ""After college, I'll GoPro"". And here I am.",169,9,0.04294674859024004,1418,1.2840236686390532,30,963,130,638
1418,"Well, it sure beats taking the subway to work!",169,12,0.04534038320170378,1419,1.2840236686390532,24,3649,133,638
1419,Everyone at Fox was issued them............,162,13,0.04753661494234805,1420,1.2839506172839505,20,576,129,638
1420,"Oh what, these old things?",162,8,0.04331655087457262,1421,1.2839506172839505,30,1339,124,638
1421,"ah, but listen to me just droning on! 
What's new with you?",162,7,0.04242219164031854,1422,1.2839506172839505,32,1344,123,638
1422,"You're missing the point, it's not about practicality, it's about innovation, STEVEN!",162,8,0.04331655087457262,1423,1.2839506172839505,30,2268,124,638
1423,But can yours give you a wedgie?,162,9,0.04419281407390758,1424,1.2839506172839505,28,2802,125,638
1424,It’s the prototype from my start-up company UberLyft,148,8,0.04602266935891564,1425,1.2837837837837838,26,3048,114,638
1425,They hold up my pants AND definitively resolve the haunting fear that I'm being watched!,187,8,0.03939431666117855,1426,1.2834224598930482,37,2052,142,638
1426,This way I can keep me under constant surveillance,180,6,0.038817883212604286,1427,1.2833333333333334,39,721,135,638
1427,Don’t get me wrong. You look great in suspenders but I need something more cutting edge.,173,6,0.039794381481910154,1428,1.283236994219653,37,4495,130,638
1428,I guarantee there's no discomfort in that area.,166,6,0.040843949675049236,1429,1.283132530120482,35,51,125,638
1429,They usually leave once they get your lunch money.,166,12,0.04589492701622542,1430,1.283132530120482,23,1668,131,638
1430,"Yea,a cup is really necessary.",166,7,0.04172825871260073,1431,1.283132530120482,33,2972,126,638
1431,We had to transition to belts after our zipper incident.,159,12,0.04732479911287327,1432,1.2830188679245282,21,1696,126,638
1432,It's a modern-day chastity belt.,159,11,0.046476070349953234,1433,1.2830188679245282,23,3657,125,638
1433,"What, you’ve never seen Drone Drawers before.",159,11,0.046476070349953234,1434,1.2830188679245282,23,3689,125,638
1434,Statistically it's safer than a helicopter.,159,8,0.04383138860991947,1435,1.2830188679245282,29,4445,122,638
1435,Suspenders just hold up your pants- these hold up my ego!,159,9,0.0447303266629452,1436,1.2830188679245282,27,5106,123,638
1436,Those suspenders tell the world you don't care how you look.,159,10,0.045611551379818184,1437,1.2830188679245282,25,5415,124,638
1437,Do you want to carpool to work today?,152,8,0.04517284411080173,1438,1.2828947368421053,27,228,117,638
1438,This new prototype is nearly wedgie-free.,152,5,0.04218021713833116,1439,1.2828947368421053,33,382,114,638
1439,This takes a HUGE load off my shoulders!,152,4,0.041134320732158565,1440,1.2828947368421053,35,2152,113,638
1440,"Acquiring two FAA licenses to keep your pants up might seem extreme, but it’s just a cost of doing business in the plumbing trade these days.",145,7,0.04559467464436487,1441,1.282758620689655,27,3550,111,638
1441,Pendulous testicles.,145,7,0.04559467464436487,1442,1.282758620689655,27,4490,111,638
1442,"If we both do it, it'll be cool.",191,6,0.037389677636350004,1443,1.2827225130890052,42,5386,143,638
1443,"Everyone kept accusing me of droning on, so I thought I would.",177,10,0.042351475503919045,1444,1.2824858757062148,30,448,137,638
1444,"It's a ""sans-a-belt"" for geeks.",177,8,0.040807411172279755,1445,1.2824858757062148,34,844,135,638
1445,Care to try a Sky Wedgie?,170,11,0.044325418628989866,1446,1.2823529411764707,26,23,133,638
1446,Hello. I am Andrew. Brother of Alexa. Please save me.,170,10,0.04353308043730565,1447,1.2823529411764707,28,2000,132,638
1447,"That's right, Brookstone makes suspenders now.",170,9,0.04272605116420948,1448,1.2823529411764707,30,2764,131,638
1448,Pulling yourself up by your bootstraps is so 20th century,163,8,0.04308521634099655,1449,1.2822085889570551,30,240,125,638
1449,Trendy? Yes. Comfortable? Not so much.,163,7,0.04219710304169643,1450,1.2822085889570551,32,516,124,638
1450,"Pants up, nice breeze, and cutting-edge​ fashion.  What's not to like?",163,7,0.04219710304169643,1451,1.2822085889570551,32,3871,124,638
1451,"Sorry to drone on and on, but...",163,10,0.04480866647455978,1452,1.2822085889570551,26,4022,127,638
1452,Those buckles look complicated.,163,10,0.04480866647455978,1453,1.2822085889570551,26,5069,127,638
1453,"Reduces hip fractures, and prevents drowning in case of floods.",156,7,0.043421560430802156,1454,1.2820512820512822,30,1137,119,638
1454,The first step is suspending your disbelief Harold.,156,8,0.044363779101701833,1455,1.2820512820512822,28,1704,120,638
1455,I call it the selfie paparazzi.,156,8,0.044363779101701833,1456,1.2820512820512822,28,1976,120,638
1456,They see any danger around me AND they keep my pants up!,156,8,0.044363779101701833,1457,1.2820512820512822,28,3723,120,638
1457,I know my batteries are low when my navel feels a breeze.,156,9,0.04528639842296347,1458,1.2820512820512822,26,3903,121,638
1458,"Laugh if you want.
I've lost 35 pounds on the Drone Diet!",149,9,0.04575240834014757,1459,1.2818791946308725,23,1411,117,638
1459,Ride share is no longer necessary my friend,149,7,0.04475028656172383,1460,1.2818791946308725,28,1876,114,638
1460,"Ironically, the real suspense is during the brief recharging period.",149,8,0.04575240834014757,1461,1.2818791946308725,26,2492,115,638
1461,"The helicopters were getting too expensive, so Channel 4 came up with a new way to do live traffic reports.",149,6,0.043725203553433525,1462,1.2818791946308725,30,2561,113,638
1462,"Sure, people stare. But that’s the price of fashion.",149,5,0.04267550473306661,1463,1.2818791946308725,32,4464,112,638
1463,My service drones have really taken a weight off my shoulders,149,5,0.04267550473306661,1464,1.2818791946308725,32,4818,112,638
1464,"My mom was worried, so I told her I'm on a motorcycle.",149,10,0.04769352484413387,1465,1.2818791946308725,22,4863,117,638
1465,"I'm telling you, there's a fortune to be made disrupting the suspender industry.",142,7,0.04619818198900105,1466,1.2816901408450705,26,179,109,638
1466,"’”Relax, they’re not watching you - they’re watching everyone.”",142,9,0.04726692437588792,1467,1.2816901408450705,21,2950,112,638
1467,You just have to make sure you don't accidentally turn up the power and give yourself a wedgie.,142,8,0.04726692437588792,1468,1.2816901408450705,24,3770,110,638
1468,What do you mean the government is always spying on us?,142,7,0.04619818198900105,1469,1.2816901408450705,26,4275,109,638
1469,"No, YOUR suspenders are too loud.",174,12,0.04434732143868114,1470,1.2816091954022988,25,850,137,638
1470,My wife's the jealous type.,174,6,0.03959848873952181,1471,1.2816091954022988,37,1913,131,638
1471,"Don’t worry, I used to put my pants on one leg at a time, too.",174,8,0.04124223377273099,1472,1.2816091954022988,33,2030,133,638
1472,"Yeah, it does give quite the wedgie.",206,9,0.03758954985013285,1473,1.2815533980582525,40,4678,157,638
1473,"Sorry, I'm droning on. What was your question again?",167,10,0.04404206293391513,1474,1.281437125748503,27,1078,130,638
1474,I think you will find it very uplifting.,167,12,0.045650772625010216,1475,1.281437125748503,23,1390,132,638
1475,Don't let me drone on too long.,167,14,0.047204690180593534,1476,1.281437125748503,19,3836,134,638
1476,They have incredible rear suspension.,167,10,0.04404206293391513,1477,1.281437125748503,27,4021,130,638
1477,"You should buy now, before any public demand for regulation.",167,10,0.04404206293391513,1478,1.281437125748503,27,4503,130,638
1478,The legroom is fantastic and there's no airline to give away your seat,167,11,0.04485363055949498,1479,1.281437125748503,25,5336,131,638
1479,"And if I'm losing the argument, a simple hand gesture allows me a quick exit.",192,8,0.03866094873696949,1480,1.28125,38,1766,146,638
1480,"Yeah, they’re OK, but if you’re not careful with the lift setting you get a wedgy.",160,9,0.04448506480343754,1481,1.28125,27,3223,124,638
1481,"These are are the best protection system ever!  Since I started using them, nobody comes anywhere near me.",160,11,0.046218542761196545,1482,1.28125,23,4051,126,638
1482,Sorry.  I tend to drone on sometimes.,153,8,0.04345493411085066,1483,1.2810457516339868,26,307,119,638
1483,Need a lift?,153,6,0.04295732350339835,1484,1.2810457516339868,31,460,116,638
1484,Now who's nerdier. Huh?,153,11,0.04770040044489292,1485,1.2810457516339868,21,2941,121,638
1485,What? I couldn't hear you.,178,7,0.03981925144316555,1486,1.2808988764044944,36,2977,135,638
1486,"The charge lasts up to 8 hours, so you're not obligated to keep your pants on all day.",203,14,0.04101902548726302,1487,1.2807881773399015,29,2265,160,638
1487,I just have to make sure the batteries don't die near a school.,171,7,0.04085696891379272,1488,1.280701754385965,34,1582,130,638
1488,I could drone on forever about these suspenders!,171,11,0.04409636841328589,1489,1.280701754385965,26,2494,134,638
1489,This takes voyeurism to a whole new height.,171,11,0.04409636841328589,1490,1.280701754385965,26,4743,134,638
1490,"They hold my pants up to 2,500 feet.",164,12,0.04621607424980684,1491,1.2804878048780488,22,2436,130,638
1491,It's the airline's frequent flyer award.,164,10,0.04456783729203366,1492,1.2804878048780488,26,4550,128,638
1492,They also offer a mini for unzipping at urinals.,157,11,0.04681109236934048,1493,1.2802547770700636,22,1550,124,638
1493,"The pants are fly, man.",157,8,0.04411689491370177,1494,1.2802547770700636,28,1725,121,638
