,caption,count,funny,precision,rank,score,somewhat_funny,target_id,unfunny,contest
0,I wear the pants but my wife controls them.,162,42,0.06742378374368466,1,1.691358024691358,28,4419,92,638
1,"I wear the pants, but my wife has the remote.",155,31,0.06390578494391523,2,1.6451612903225807,38,5015,86,638
2,Nothing you buy on a 2 am informercial is ever a good idea.,164,27,0.05868043077169408,3,1.6341463414634145,50,2355,87,638
3,"To be honest, I’m kind of flying by the seat of my pants.",183,28,0.0547048250256659,4,1.6065573770491803,55,4828,100,638
4,Seriously? You've never tried a pair of hoveralls?,163,30,0.06131560061580757,5,1.5950920245398772,37,3197,96,638
5,"This is Otto, the other is Hannah — they’re palindrones.",164,30,0.06115304126452025,6,1.579268292682927,35,4270,99,638
6,The puppy wasn't attracting the type of women I'm interested in.,163,26,0.05895894632902172,7,1.5766871165644172,42,5093,95,638
7,It’s not so bad. I had helicopter parents.,164,26,0.05874841653000914,8,1.5670731707317074,41,482,97,638
8,And that’s when I just decided to fly by the seat of my pants!,163,24,0.057752609625017395,9,1.5644171779141105,44,5392,95,638
9,My wife forgave me for the affair.  With conditions.,187,34,0.05729022375096511,10,1.5561497326203209,36,4056,117,638
10,"I'm Adam, your Lift driver.",164,31,0.06195531956727335,11,1.548780487804878,28,2390,105,638
11,We didn't understand cargo pants at first either.,135,19,0.06284090533180428,12,1.548148148148148,36,188,80,638
12,"Hi, I’m your Uber ride.  Grab my hand.",144,23,0.06300784351958369,13,1.5416666666666667,32,1819,89,638
13,This is much better.  I used to fly by the seat of my pants.,161,23,0.057775661677634566,14,1.5403726708074534,41,4908,97,638
14,"In hind sight, I should have agreed to an ankle monitor.",165,25,0.05798856177001159,15,1.5393939393939393,39,2230,101,638
15,YOU can wait for the walk sign.,171,21,0.053915464662531505,16,1.5380116959064327,50,617,100,638
16,Always wanted to fly by the seat of my pants.,169,25,0.05694602977406531,17,1.532544378698225,40,1489,104,638
17,I like to fly by the seat of my pants.,156,24,0.05992818406420636,18,1.5320512820512822,35,130,97,638
18,The only danger is if they see a squirrel.,170,23,0.05545525321213948,19,1.5294117647058822,44,1666,103,638
19,My wife has the remote,157,23,0.058953050432759294,20,1.5286624203821657,37,2673,97,638
20,I see yours are still analog.,176,22,0.05340909090909092,21,1.5284090909090908,49,3074,105,638
21,"No - I can't fly yet, but I can hit a high C.",150,21,0.059600959908990385,22,1.5266666666666666,37,2875,92,638
22,First time in the Bay Area?,173,22,0.054113288723100006,23,1.5260115606936415,47,3276,104,638
23,I've got them set between low-rider and full wedgie.,155,25,0.06094870952179929,24,1.5225806451612902,31,1617,99,638
24,I’d wait for the next upgrade. There’s a wedgie issue.,182,26,0.05437902851091832,25,1.521978021978022,43,2615,113,638
25,My wife is at the controls . . . long story.,163,23,0.0572921646610789,26,1.521472392638037,39,1463,101,638
26,The only problem with them is if there's a strong gust of wind my voice goes up an octave.,160,24,0.05879547951968488,27,1.51875,35,3289,101,638
27,SkyMall. Why do you ask?,174,27,0.0568970047275713,28,1.5172413793103448,36,2173,111,638
28,The good news is that I get uptown in 10 minutes. The bad news is that I land with one hell of a wedgie.,153,19,0.0572448010592604,29,1.5163398692810457,41,3490,93,638
29,It was either this or an ankle monitor.,146,23,0.06242355766821597,30,1.5068493150684932,28,4553,95,638
30,Mr. Smith? I’m your Uber ride.,160,22,0.05677168981236108,31,1.50625,36,4131,102,638
31,It's called upward mobility.,172,22,0.054385463713680776,32,1.505813953488372,43,5075,107,638
32,Turns out you don't have to put on your pants one leg at a time.,182,23,0.05270144531112879,33,1.5054945054945055,46,2566,113,638
33,"Alexa, hold up my pants!",163,24,0.057973446355877624,34,1.5030674846625767,34,4922,105,638
34,You must be the fellow who ordered a friend on Amazon.,161,19,0.055114381065134846,35,1.4968944099378882,42,5115,100,638
35,It’s the convenience of suspenders without the ridiculous look.,153,21,0.05874225168773347,36,1.4967320261437909,34,1395,98,638
36,Ask me where I keep the remote.,149,16,0.056037743067406415,37,1.4966442953020134,42,3115,91,638
37,The judge said it was either this or the ankle bracelet.,174,25,0.05573073644621069,38,1.4942528735632183,36,4673,113,638
38,"Hi, I'm Steve from Amazon Cloud Services.",152,17,0.0559985264903355,39,1.486842105263158,40,4915,95,638
39,I'm flying by the seat of my pants.,169,19,0.05315259037795793,40,1.485207100591716,44,1856,106,638
40,"Well, I guess I’m going to take off.",165,22,0.05611601105458705,41,1.4848484848484849,36,5219,107,638
41,Actually my wife has the controls.,159,17,0.05416741843546321,42,1.4842767295597483,43,2897,99,638
42,Well I'm off.  My Lyft is here.,159,18,0.05489736529071835,43,1.4842767295597483,41,5188,100,638
43,Amazon sent me. Your book is backordered.,157,22,0.058287594728908695,44,1.484076433121019,32,570,103,638
44,You're experiencing what is known as 'disbelief of suspension'.,145,17,0.05798619887645719,45,1.4827586206896552,36,4238,92,638
45,"Yeah, I had helicopter parents, why",170,20,0.053569768640538425,46,1.4823529411764707,42,3536,108,638
46,They're my emotional support drones.,191,25,0.05188267703387433,47,1.4816753926701571,42,3533,124,638
47,I said I BARELY NOTICE THEM ANYMORE!,154,19,0.05695851925548873,48,1.4805194805194806,36,2301,99,638
48,"All I said was: ""Hey Alexa I need a lift,"" and this happens...",160,20,0.056042156190141815,49,1.475,36,2553,104,638
49,They keep dropping me off at Amazon.,160,25,0.05944581592884852,50,1.475,26,3560,109,638
50,"At first it was just a joke, but then I got the Department of Defense contract.",160,16,0.053162560713675366,51,1.475,44,4438,100,638
51,You act like you've never seen a pair of chastity drones before.,158,20,0.056575502453953014,52,1.4746835443037976,35,2381,103,638
52,"As you probably guessed, I'm single.",169,21,0.05443496016823787,53,1.4733727810650887,38,2502,110,638
53,I lost the car in the divorce.,186,19,0.049515405649398776,54,1.4731182795698925,50,3386,117,638
54,I hope I have been ordered by a nice family,146,18,0.057662878901077505,55,1.4726027397260273,31,752,97,638
55,It's just until the sexual assault charges are dropped.,174,23,0.0544834959119878,56,1.471264367816092,36,4706,115,638
56,They're great until your kid steals the controller.,172,21,0.05371252236913112,57,1.4709302325581395,39,3304,112,638
57,"The battery life is pretty short, and that’s led to a couple of embarrassing incidents.”",187,20,0.04989444187656737,58,1.4705882352941178,48,5095,119,638
58,"One leg at a time, that's how.",183,23,0.05243849555599227,59,1.469945355191257,40,4430,120,638
59,Guess who just put his pants on TWO legs at a time?,162,15,0.05193358075979278,60,1.4691358024691359,46,5302,101,638
60,No lines ... no tickets ... just fly by the seat of your pants.,160,18,0.054601094138598316,61,1.46875,39,257,103,638
61,Yes I'm single. Why do you ask?,165,20,0.05473400932052743,62,1.4666666666666666,37,773,108,638
62,"Plus, with the turbo option, I can go up a full octave.",180,27,0.05537525055185705,63,1.4666666666666666,30,942,123,638
63,Best part? I can use Tesla charging stations.,163,18,0.05384708291242399,64,1.4662576687116564,40,1680,105,638
64,It’s not so much about holding up my pants as it’s about attracting venture capitalists.,148,15,0.055424236370484915,65,1.4662162162162162,39,1388,94,638
65,They're controlled by a joystick in my pants.,161,22,0.057125132276659635,66,1.4658385093167703,31,1317,108,638
66,"Alexa, fix my wedgie.",159,21,0.05697847653963456,67,1.4654088050314464,32,4313,106,638
67,It's the hot new fashion...hoveralls,142,17,0.05755478585128057,68,1.4647887323943662,31,1273,94,638
68,Gotta go.  My Lift is here.”,170,20,0.05351814617362404,69,1.464705882352941,39,5186,111,638
69,It's better than flying by the seat of my pants!,153,19,0.05718585668008692,70,1.4640522875816993,33,270,101,638
70,They're just for technical support,132,12,0.05731814117039322,71,1.4621212121212122,37,3709,83,638
71,"OK, you have the remote, right?",158,18,0.05508569032142656,72,1.4620253164556962,37,1871,103,638
72,"And now, when people say, ""He puts his pants on just like you and me,"" you'll know just how wrong they are.",143,18,0.05935504071095189,73,1.4615384615384615,30,1824,95,638
73,"Ya, you get a wedgie.  But I can be in Hoboken in five minutes.",156,18,0.05332967474885326,74,1.4615384615384615,34,2815,104,638
74,I prefer to fly by the seat of my pants.,180,17,0.04943120851723304,75,1.461111111111111,49,2086,114,638
75,"You also get an owner’s manual, a pack of adult diapers and a barf bag.",148,18,0.05782919417930753,76,1.4594594594594594,32,1786,98,638
76,"Hi, I'm the drinking buddy you ordered from Amazon Prime.",181,24,0.053410173271973234,77,1.4585635359116023,35,623,122,638
77,They're my suspenders of disbelief.,155,19,0.056603124226281894,78,1.4580645161290322,33,746,103,638
78,I'm here for your Amazon return.,166,20,0.05444962410732784,79,1.4578313253012047,36,1609,110,638
79,"Sure, but once he builds that wall, these babies will sell like hot tamales.",171,21,0.0538893401150774,80,1.456140350877193,36,3321,114,638
80,I admit it can be a little embarrassing when the batteries get low.,178,18,0.05043467800987305,81,1.4550561797752808,45,4793,115,638
81,"Hi!  I'm Joe, the personal assistant you ordered from Amazon.",154,15,0.05379330321944897,82,1.4545454545454546,40,4823,99,638
82,Of course my wife has the remote control.,165,20,0.05468078801162,83,1.4545454545454546,35,5299,110,638
83,AirUber.  Where to?,163,16,0.052363985445422305,84,1.4539877300613497,42,2513,105,638
84,I place an order on Amazon and - Pow! - these babies deliver ME to my stuff!,170,23,0.05538321058165751,85,1.4529411764705882,31,1770,116,638
85,The balloons looked ridiculous.,164,18,0.05353358324032581,86,1.451219512195122,38,133,108,638
86,Are you the one who called Amazon Customer Support?,164,23,0.05692036568738006,87,1.451219512195122,28,922,113,638
87,"Why, yes, I am Mr. Fancypants.",173,23,0.0546384473193283,88,1.4508670520231215,32,643,118,638
88,My wife got the bra version.,171,20,0.0532169412944158,89,1.4502923976608186,37,1647,114,638
89,I have a mini one to do my zipper.,178,26,0.05521290768950007,90,1.449438202247191,28,3799,124,638
90,"Hi, i’m Your Lyft driver.",178,21,0.052259595436486055,91,1.449438202247191,38,3974,119,638
91,"Wow, you're still using analog suspenders?",167,15,0.05072071482394938,92,1.4491017964071857,45,238,107,638
92,I’ve been sent here to see if there is anything we can do to stop you from dropping your Amazon Prime.,172,20,0.052971368911569866,93,1.447674418604651,37,2391,115,638
93,The only thing I don't like about them is I have to call the FAA every time I want to take off  my pants.,170,18,0.05211286895525058,94,1.4470588235294117,40,4650,112,638
94,yeah...product of helicopter parents,170,19,0.0527765549749261,95,1.4470588235294117,38,5161,113,638
95,"No one thought the iPhone would catch on, either!",150,13,0.053123187778889906,96,1.4466666666666668,41,3336,96,638
96,I have a patent suspending.,159,19,0.05546899197843859,97,1.4465408805031446,33,1366,107,638
97,"Unfortunately, I left the remote in my other pants.",186,21,0.05055988924251111,98,1.446236559139785,41,1852,124,638
98,"Sir, your Lyft has arrived.",186,22,0.051131448629808944,99,1.446236559139785,39,3608,125,638
99,The hip-hop setting is eight inches lower.,148,18,0.057753958693635456,100,1.445945945945946,30,904,100,638
100,"By design, I fly by the seat of my pants!",148,16,0.0561396688454045,101,1.445945945945946,34,4514,98,638
101,"Look, they put my pants on one leg at a time just like everybody else.",166,20,0.05438495707250697,102,1.4457831325301205,34,1342,112,638
102,"When you go low, I go high.",166,15,0.05091784368116453,103,1.4457831325301205,44,3515,107,638
103,I only have to wear them until my wife trusts me again.,155,23,0.05942183064828007,104,1.4451612903225806,23,668,109,638
104,"Honestly, I feel 20 pounds lighter.",182,18,0.049571826271437074,105,1.445054945054945,45,4432,119,638
105,"With the Drone-penders 2.0, there's no chance of getting caught with your pants down.",169,16,0.05095453208155913,106,1.4437869822485208,43,453,110,638
106,"You ordered a handshake on Amazon, correct?! Here it is!",208,23,0.04753973389163887,107,1.4423076923076923,46,5288,139,638
107,"I know it looks weird, but I haven't been mugged  once since I put them on.",163,15,0.0515591631829603,108,1.4417177914110428,42,1257,106,638
108,Amazon needs a clarification on your order.,195,25,0.05091595467212933,109,1.441025641025641,36,3931,134,638
109,"Amazon Customer Support here, how can I help?",159,17,0.05397295404381149,110,1.440251572327044,36,5274,106,638
110,"To be honest, yes, I am a little worried about the battery life on these things.",150,17,0.05634664206133644,111,1.44,32,3521,101,638
111,Imagine the possibilities for brassieres.,162,16,0.05249788339067427,112,1.4382716049382716,39,373,107,638
112,I don’t  know how I managed before self-driving pants.,162,15,0.051762404546150165,113,1.4382716049382716,41,2358,106,638
113,"Hi, I’m your ride",153,15,0.05393850522600959,114,1.4379084967320261,37,2686,101,638
114,They came free with my Prime membership.,169,14,0.049510720004115875,115,1.4378698224852071,46,1900,109,638
115,"The view was great, but the wedgie was brutal.",190,23,0.05081954501993655,116,1.436842105263158,37,4197,130,638
116,They have two speeds...tenor and soprano.,174,22,0.05369992617310499,117,1.4367816091954022,32,509,120,638
117,"Now, Prime members can be delivered to their online orders.",165,18,0.053198445294365085,118,1.4363636363636363,36,4449,111,638
118,"Greetings, I'm from Amazon and I'm here to help.",163,15,0.05151408215380799,119,1.4355828220858895,41,5422,107,638
119,I see you're still wearing analog suspenders. You need to think bigger.,186,17,0.04813457306790327,120,1.435483870967742,47,3245,122,638
120,I wanted to fly by the seat of my pants.,177,18,0.05051825176623136,121,1.4350282485875707,41,4433,118,638
121,"Hi, I'm your car-less driver. Where can I drop you?""",168,21,0.05448247910865203,122,1.4345238095238095,31,2096,116,638
122,"The free app syncs with my calendar, so I never forget to wear pants to a meeting.",145,17,0.05774646752680677,123,1.4344827586206896,29,690,99,638
123,They keep me on my toes.,152,15,0.05416678720207256,124,1.4342105263157894,36,4631,101,638
124,I don't mind; I was raised by helicopter parents.,182,18,0.04949774796772316,125,1.434065934065934,43,5339,121,638
125,Go ahead build the wall. I'll make millions.,166,19,0.053627480768604574,126,1.4337349397590362,34,4972,113,638
126,A life well-documented is a life well-lived.,143,15,0.05662931052157336,127,1.4335664335664335,32,2060,96,638
127,"Hi, I'm Frank. Professional drone walker.",143,14,0.055752899062822235,128,1.4335664335664335,34,2336,95,638
128,"I thought about suspenders, but I didn't want to look ridiculous.",150,16,0.05549586651811619,129,1.4333333333333333,33,2364,101,638
129,Just a natural progression from helicopter parents.,194,22,0.04946939924820223,130,1.4329896907216495,40,2526,132,638
130,Basically they're fully autonomous... but I can still take over the zipper in case of an emergency.,164,19,0.05410785110474077,131,1.4329268292682926,33,2128,112,638
131,I am your date.  Match.com now has drone delivery.,164,17,0.052706983911037106,132,1.4329268292682926,37,2588,110,638
132,I also invented noise canceling trousers.,164,15,0.05126785303505357,133,1.4329268292682926,41,4107,108,638
133,Next year I'll just tell them what I want for father's day.,162,16,0.052450526025800186,134,1.4320987654320987,38,2174,108,638
134,I use to be one of those helicopter parents.,169,14,0.04946439515919631,135,1.4319526627218935,45,1524,110,638
135,"I still adjust my fly manually, though.",169,18,0.052235006470793766,136,1.4319526627218935,37,5181,114,638
136,"If they pull my pants any tighter it is going to be
""unmanned"" flight for sure.""",146,19,0.0590489370929472,137,1.4315068493150684,25,3342,102,638
137,I see you're still sporting the analog model.,167,17,0.051999235478116516,138,1.4311377245508983,38,554,112,638
138,Just wait until you see how I hold my socks up.,151,13,0.052747835103946705,139,1.4304635761589404,39,1325,99,638
139,Just because they suspended my driver's license doesn't mean I'm grounded,151,17,0.05599584798139376,140,1.4304635761589404,31,2326,103,638
140,You're late on your Amazon Prime payment,179,18,0.05006965676215789,141,1.4301675977653632,41,1909,120,638
141,"Marvin, this is the last time I'll get your ball off the roof.",193,19,0.047979946055575484,142,1.4300518134715026,45,555,129,638
142,Amazon can now go directly into my wallet and remove money without bothering to delivery anything.,147,15,0.055454510040331716,143,1.4285714285714286,33,964,99,638
143,I can't understand why the judge considers me a flight risk.,161,17,0.05338996180271602,144,1.4285714285714286,35,1593,109,638
144,"Well, when the batteries die, it does get a bit awkward.",161,15,0.05191539769846597,145,1.4285714285714286,39,3817,107,638
145,Alexa sent me.  I'm Greg from Prime Friendship.,159,18,0.054609308164834044,146,1.4276729559748427,32,1545,109,638
146,"I don't like waiting for the ""WALK"" sign.",152,14,0.05329993464144561,147,1.4276315789473684,37,599,101,638
147,They're working on little ones for your socks.,171,17,0.051075888455228424,148,1.4269005847953216,39,2393,115,638
148,Now I really can fly by the seat of my pants.,164,13,0.04973442533824614,149,1.4268292682926829,44,3704,107,638
149,it was either this or an ankle monitor and i'm like so let's have some fun,157,19,0.05585425673803098,150,1.4267515923566878,29,5123,109,638
150,They’re waiting to see if I want to return the pants.,150,16,0.05543940131795853,151,1.4266666666666667,32,1220,102,638
151,It’s best if I don’t tell you where the remote control is.,150,17,0.056240667466759646,152,1.4266666666666667,30,4839,103,638
152,"You did order a lyft, didn’t you?",176,21,0.05254551914344659,153,1.4261363636363635,33,5401,122,638
153,I put my pants on like everyone else. One drone at a time.,169,18,0.05218710640893494,154,1.4260355029585798,36,3137,115,638
154,"Ironically, it was only because two people gave me the same gift that I found a use for them.",162,15,0.0516617171917498,155,1.4259259259259258,39,1219,108,638
155,I put them on same as everyone else; one leg at a time.,162,17,0.05239860932602948,156,1.4259259259259258,33,4989,112,638
156,They work great except for the wedgies.,155,17,0.054881818488162266,157,1.4258064516129032,32,2765,106,638
157,The only downside is that it gives you a really bad wedgie.,141,18,0.05974790212914586,158,1.425531914893617,24,527,99,638
158,"It's a new service called ""Lift.""",181,17,0.049005798232084535,159,1.425414364640884,43,2814,121,638
159,"And if you think that’s impressive, wait until you see how the zipper works.",165,16,0.05169093091982485,160,1.4242424242424243,38,4789,111,638
160,We're still having some problems with the necktie option.,158,19,0.055565306888700254,161,1.4240506329113924,29,1287,110,638
161,I might have to take off early.,158,13,0.05102694777404146,162,1.4240506329113924,41,1825,104,638
162,I also programmed my Roomba to tie my shoes.,151,13,0.052686826073894986,163,1.423841059602649,38,3640,100,638
163,They're a must have for the committed helicopter parent.,144,16,0.057109082218714906,164,1.4236111111111112,29,4395,99,638
164,"I may have been born privileged, but I still put my pants on one drone at a time—just like everyone else does.",163,21,0.055654789030539054,165,1.4233128834355828,27,4859,115,638
165,The settings go from low rider to wedgie.,149,14,0.05402467680723152,166,1.4228187919463087,35,4794,100,638
166,Tssh. You still wearing analogs?,166,18,0.052842504946141254,167,1.4216867469879517,34,3891,114,638
167,"Actually, I don't put my pants on one leg at time!",150,16,0.05537749241945384,168,1.42,31,4993,103,638
168,Two to keep your pants up; six to get airborne.,167,14,0.049766311495389036,169,1.4191616766467066,42,4857,111,638
169,"Sure beats taking a cab, but I wish I had worn my relaxed-fit jeans.",148,16,0.05591794732803181,170,1.4189189189189189,30,3211,102,638
170,Mostly I fly to the battery store,172,21,0.05339693815275792,171,1.4186046511627908,30,4119,121,638
171,This is what I call tech support!,172,15,0.04942910345194765,172,1.4186046511627908,42,4386,115,638
172,Same as everyone. One drone at a time.,165,17,0.05234538155976742,173,1.4181818181818182,35,2600,113,638
173,"I'm Andy, from Amazon's new on-line dating service. Are you Michael?",146,17,0.05730265826981175,174,1.417808219178082,27,2295,102,638
174,It’s the latest from Lyft!,170,13,0.04841628959276017,175,1.4176470588235295,45,168,112,638
175,Hi. Bob from Amazon.,151,15,0.05427232118820632,176,1.4172185430463575,33,4281,103,638
176,Your wife ordered you a friend on Amazon.,151,18,0.056660263936973355,177,1.4172185430463575,27,4932,106,638
177,The only downside is my voice occasionally sounds a little higher.,168,14,0.04953207526817938,178,1.4166666666666667,42,1462,112,638
178,Safe? Of course it's safe. I've got 2 gps-guided drones with 4 gyro-stablized propellers on each for software and hardware fault tolerance. What could possibly go wrong?,180,18,0.049751087439649844,179,1.4166666666666667,39,2045,123,638
179,This seemed more functional than a cape and tights.,137,9,0.050906695062979915,180,1.416058394160584,38,1892,90,638
180,"Well, it was pretty embarrassing when both batteries died at the same time.",190,15,0.046050542976865574,181,1.4157894736842105,49,590,126,638
181,I call them 'willing suspenders of disbelief.',154,15,0.05348502960257234,182,1.4155844155844155,34,4005,105,638
182,...But I still put them on one leg at a time.,142,11,0.05311489869084434,183,1.4154929577464788,37,3793,94,638
183,I'm Frank.  I'll be your Uber driver.,171,19,0.05230183753664467,184,1.4152046783625731,33,3607,119,638
184,Tell me the belt industry isn't nervous.,147,14,0.05447416171511016,185,1.4149659863945578,33,3376,100,638
185,I'm supposed to deliver you to your mother's for Thanksgiving.,188,20,0.04935535562090204,186,1.4148936170212767,38,391,130,638
186,These babies get me to work in 10 minutes but for some strange reason my voice is higher for the rest of the day.,164,15,0.051100736569039955,187,1.4146341463414633,38,401,111,638
187,Gone are the days when I could lift myself by the bootstraps.,152,11,0.05065283027288724,188,1.4144736842105263,41,5198,100,638
188,"They work fine, but I'm having some intimacy issues.",145,10,0.051403861551719325,189,1.4137931034482758,40,667,95,638
189,"I put my pants on just like everyone else, one drone at a time.",167,17,0.05183697799699178,190,1.4131736526946108,35,2240,115,638
190,Helicopter parents are so last year.,167,17,0.05183697799699178,191,1.4131736526946108,35,5361,115,638
191,I’m thinking of calling it “Lyft.”,160,15,0.051994420963414466,192,1.4125,36,1907,109,638
192,I’m the BFF you just ordered on Amazon,160,20,0.05564621795169051,193,1.4125,26,2909,114,638
193,Sorry I'm late. I got held up.,160,17,0.05348506815666658,194,1.4125,32,4090,111,638
194,Hi. I’m Matt from Amazon.,170,17,0.05115324076402742,195,1.411764705882353,36,782,117,638
195,I'm a fly by the seat of your pants type of guy,170,18,0.051829216518647414,196,1.411764705882353,34,5289,118,638
196,"I'm not sure what it does, but I got it with 2-day free shipping from Amazon!",197,24,0.049783388525989555,197,1.4111675126903553,33,4801,140,638
197,"Hi, I'm your driver.  Grab my hand and hold on tight.",180,18,0.049697339015356286,198,1.4111111111111112,38,138,124,638
198,I’m Amazon’s new tech support.,168,13,0.04874410549264197,199,1.4107142857142858,43,4273,112,638
199,"I use to be a Helicopter dad,but I need to keep up with the times.",151,15,0.05420224018798339,200,1.4105960264900663,32,838,104,638
200,Mosquitoes stay clear and my pants stay hiked up. It's a win-win.,156,14,0.05214330548607016,201,1.4102564102564104,36,3195,106,638
201,I have ten minutes to charge these before my pants fall off.,156,14,0.05214330548607016,202,1.4102564102564104,36,3251,106,638
202,I’m gonna need either a belt or a charger in the next 15 seconds.,144,18,0.05864733540346582,203,1.4097222222222223,23,3130,103,638
203,"Other than raising my voice a few octaves, they work fine...",166,19,0.05341379187271508,204,1.4096385542168675,30,1601,117,638
204,Hi I am your Amazon personal shopper...,171,16,0.050229959401311274,205,1.409356725146199,38,501,117,638
205,"Yep, I really am flying by the seat of my pants”.",176,19,0.0511381673563563,206,1.4090909090909092,34,5122,123,638
206,"Hi, I'm the new assistant you ordered from Amazon.",159,18,0.054430223131922445,207,1.4088050314465408,29,525,112,638
207,I found them in SkyMall.”,159,15,0.052190178218615435,208,1.4088050314465408,35,1997,109,638
208,What? You're still using Uber,159,14,0.0514218164458514,209,1.4088050314465408,37,3622,108,638
209,This changes the game for a 5 story walk up!,169,16,0.050646845205163916,210,1.4082840236686391,37,809,116,638
210,"I'm telling you, helicopter parenting isn't enough these days.",147,11,0.0517651359710206,211,1.4081632653061225,38,4556,98,638
211,Practical? No. Suspenseful? Yes.,152,13,0.052270897280421856,212,1.4078947368421053,36,1674,103,638
212,"Talk about ""flying by the seat of your pants.""",157,16,0.05342691498862353,213,1.4076433121019107,32,2536,109,638
213,"Jetson, George Jetson”",167,16,0.051072960978420595,214,1.407185628742515,36,2877,115,638
214,Didn't you order a man from Amazon?,150,17,0.056041424968084036,215,1.4066666666666667,27,1290,106,638
