caption,count,funny,precision,rank,score,somewhat_funny,target_id,unfunny,contest
"You know you can just stop at the red lights, right?",140,7,0.047438420701218044,903,1.3071428571428572,29,3202,104,671
I got doored two times too many,140,5,0.045220060955157244,904,1.3071428571428572,33,3466,102,671
Do these make my butt look medieval?,140,13,0.05354487180056181,905,1.3071428571428572,17,3507,110,671
"Chivalry isn't dead, it's just out of shape.",140,8,0.045220060955157244,906,1.3071428571428572,25,3601,107,671
"It’s less aerodynamic than lycra, but at least it’s recycled!",140,9,0.0495575786783754,907,1.3071428571428572,25,3632,106,671
"Long sword? In a lake? Appeared to Arthur? Yes, that's mine. Can you hold it 'til 5?",138,9,0.04997481186373819,908,1.3043478260869565,24,23,105,671
"Sure it's heavy, but I totaled a truck once and didn't get a scratch.",138,7,0.04781117835006826,909,1.3043478260869565,28,164,103,671
This is much better than the drawbridge.,138,9,0.04997481186373819,910,1.3043478260869565,24,168,105,671
Remind me to pick up the mail on our way back.,138,8,0.041916299469741576,911,1.3043478260869565,22,281,108,671
It was on sale on Prime Day.,138,9,0.04997481186373819,912,1.3043478260869565,24,542,105,671
It's really great at preventing road rash.,138,7,0.04781117835006826,913,1.3043478260869565,28,549,103,671
I misunderstood when you asked if I would go on a night ride,138,10,0.051022233816376786,914,1.3043478260869565,22,604,106,671
I've been feeling a little rusty lately,138,8,0.04890496189569144,915,1.3043478260869565,26,617,104,671
I must say...I’m a little rusty.,138,4,0.044368335632870536,916,1.3043478260869565,34,892,100,671
"I heard all the Lance jokes years ago, okay?",138,6,0.04669177928099378,917,1.3043478260869565,30,931,102,671
Think about it. A soda can seals in all the liquid. Ergo I can’t dehydrate.,138,10,0.051022233816376786,918,1.3043478260869565,22,1018,106,671
You need more than just a helmet to ride safely in this city.,138,11,0.05204858179057349,919,1.3043478260869565,20,1120,107,671
Cycling is great when your middle aged.,138,9,0.04725479355391935,920,1.3043478260869565,22,1441,107,671
"Well you said we were going through Central Park, didn't you.",138,10,0.051022233816376786,921,1.3043478260869565,22,1474,106,671
"Long story short, I went through a portal.",138,6,0.04669177928099378,922,1.3043478260869565,30,1542,102,671
"I know it's heavy, but my shrink said be your own knight in shining armor.",138,9,0.04997481186373819,923,1.3043478260869565,24,1932,105,671
This is just until we get Universal Healthcare.,138,5,0.045544875997504314,924,1.3043478260869565,32,2290,101,671
"Right,but you gotta understand,things have changed. When I imagined this moment,you were wearing white and on a horse.",138,8,0.04890496189569144,925,1.3043478260869565,26,2387,104,671
Isn't just a helmet enough?,138,7,0.04781117835006826,926,1.3043478260869565,28,2576,103,671
"Actually, I said we should bike *at* night.",138,7,0.04781117835006826,927,1.3043478260869565,28,2647,103,671
"It's aluminum and lightweight, for speed and efficiency.",138,10,0.051022233816376786,928,1.3043478260869565,22,3086,106,671
Can I squeak by you?,138,10,0.051022233816376786,929,1.3043478260869565,22,3189,106,671
"OK, so we’ll be passing a driving range.  I still say you’re overreacting.",138,8,0.04890496189569144,930,1.3043478260869565,26,3262,104,671
My dragon’s in the shop.,138,9,0.04997481186373819,931,1.3043478260869565,24,3481,105,671
"Personally, I’d save the armour for off-road...",138,7,0.04781117835006826,932,1.3043478260869565,28,3555,103,671
Oy! I'm going to have the worst helmet hair!,138,6,0.04669177928099378,933,1.3043478260869565,30,3744,102,671
"First, it was the bike helmet.  Then it was the kneepads...",136,11,0.0525181293951035,934,1.3014705882352942,19,60,106,671
"No, it's pedal to the metal....not metal to the pedal!",136,6,0.047047758775446924,935,1.3014705882352942,29,180,101,671
Mail delivery.,136,9,0.050401279660476465,936,1.3014705882352942,23,217,104,671
I plan on falling.,136,5,0.04587547431819103,937,1.3014705882352942,31,396,100,671
"Well, you said you only went out for knight rides.",136,6,0.04280453234454161,938,1.3014705882352942,24,467,106,671
Somebody’s gotta tell you... UnderArmour is a clothing brand cyclists wear.,136,7,0.04819153522836019,939,1.3014705882352942,27,684,102,671
I just got hired as a courier in NYC!,136,9,0.050401279660476465,940,1.3014705882352942,23,824,104,671
My mom told me she would be at mile 10 to make sure I was wearing my armor.,136,8,0.04762308092437387,941,1.3014705882352942,24,1118,104,671
"My fair Maiden, I beg your pardon as I blow past thee.",136,6,0.047047758775446924,942,1.3014705882352942,29,1344,101,671
RAN OUT  OF SUNSCREEN,136,7,0.04467243761029128,943,1.3014705882352942,25,1574,104,671
I wear Under Armour on the inside.,136,4,0.04467243761029128,944,1.3014705882352942,33,1649,99,671
She's about to pass-is chivalry still an option?,136,7,0.04819153522836019,945,1.3014705882352942,27,1693,102,671
I'm not a big fan of bugs hitting me in the face.,136,6,0.047047758775446924,946,1.3014705882352942,29,1751,101,671
"Slings and arrows whether by mad dogs, road rage or Twitter, shall harm me not!",136,7,0.04819153522836019,947,1.3014705882352942,27,1936,102,671
I think you misunderstood what an Ironman Triathalon is!,136,7,0.04819153522836019,948,1.3014705882352942,27,2012,102,671
I'm training for the Tour de 12th Century France.,136,5,0.04587547431819103,949,1.3014705882352942,31,2133,100,671
You should try Under Armour it breathes better.,136,8,0.04930878754887327,950,1.3014705882352942,25,2203,103,671
Taking up cycling now that you’re retired from the Game of  Thrones “,136,5,0.04587547431819103,951,1.3014705882352942,31,2395,100,671
I can’t afford my health insurance.,136,9,0.050401279660476465,952,1.3014705882352942,23,2547,104,671
"Why yes, Ma'am. I'm a Connecticut Yankee.",136,8,0.04930878754887327,953,1.3014705882352942,25,2568,103,671
"No road rash for you, eh?",136,8,0.04405860246431504,954,1.3014705882352942,22,2615,106,671
"If a helmet is supposed to work, why stop there?",136,9,0.050401279660476465,955,1.3014705882352942,23,2672,104,671
Downhill grades mess with my knight vision.,136,9,0.050401279660476465,956,1.3014705882352942,23,2689,104,671
"Well, if they get rid of Obamacare, I'm protected!",136,7,0.04819153522836019,957,1.3014705882352942,27,2751,102,671
Jousting was too hard on my knees.,136,8,0.04930878754887327,958,1.3014705882352942,25,2753,103,671
"On your right, Sir Knight.",136,7,0.04819153522836019,959,1.3014705882352942,27,2872,102,671
"Honey, I guarantee you'll look just as manly at the Renaissance fair in spandex.",136,6,0.047047758775446924,960,1.3014705882352942,29,2965,101,671
Advice? Sure...careful with the brakes when you're followed by a guy with a lance,136,11,0.0525181293951035,961,1.3014705882352942,19,3183,106,671
I'm embracing my middle-agedness.,136,4,0.04467243761029128,962,1.3014705882352942,33,3363,99,671
New suit?,136,7,0.04819153522836019,963,1.3014705882352942,27,3369,102,671
I'd assumed this is what you wore over Under Armour.,136,10,0.05147058823529411,964,1.3014705882352942,21,3391,105,671
I still live with my parents.,136,11,0.0525181293951035,965,1.3014705882352942,19,3500,106,671
"Knight on a bike, how can I help you?",134,9,0.05083728396286952,966,1.2985074626865671,22,12,103,671
Remember Lance?,134,7,0.04681513071115217,967,1.2985074626865671,25,557,102,671
Your first Iron Man race? May be your last.,134,6,0.04741062000036792,968,1.2985074626865671,28,763,100,671
"I think you misunderstood when I said ""let's go for a night ride, it will be a lot cooler"".",134,8,0.04972130921533928,969,1.2985074626865671,24,803,102,671
I guess I misunderstood when you asked if I wanted to go for a knight ride.,134,2,0.03967923619495466,970,1.2985074626865671,34,959,98,671
"Look, dragon's breath is already bad for the ozone. I'm doing my part.",134,6,0.04741062000036792,971,1.2985074626865671,28,997,100,671
It's only a problem when it rains.,134,9,0.05083728396286952,972,1.2985074626865671,22,1184,103,671
One close call with an Uber and you will too....,134,6,0.046211968559943854,973,1.2985074626865671,27,1280,101,671
"Yes, it's the Ironman Triathlon, but not literally.",134,10,0.05192928163719847,974,1.2985074626865671,20,1602,104,671
I was tired of lifting weights.,134,8,0.04972130921533928,975,1.2985074626865671,24,1729,102,671
"Yeah, Over Armour is definitely worse.",134,7,0.04857970501612103,976,1.2985074626865671,26,1837,101,671
It's Lancelot. I gotta take this.,134,9,0.05083728396286952,977,1.2985074626865671,22,2137,103,671
"I promise, next week we’ll ride our steeds and you can carry the lance.",134,8,0.04972130921533928,978,1.2985074626865671,24,2933,102,671
"My other ride is getting shoed""..",134,9,0.05083728396286952,979,1.2985074626865671,22,3157,103,671
The difference is like Knight and day,134,7,0.04857970501612103,980,1.2985074626865671,26,3224,101,671
See a not-so-trusty steed gallop by milady?,134,9,0.05083728396286952,981,1.2985074626865671,22,3365,103,671
"Yes, I'm wearing it, but, Dad, other kids don't have to wear a suit of armor when they get their training wheels off.",134,8,0.04972130921533928,982,1.2985074626865671,24,3422,102,671
Last leg!  Metal to the pedal!,134,8,0.04972130921533928,983,1.2985074626865671,24,3756,102,671
Good day and good knight.,135,9,0.050507730635623,984,1.2962962962962963,22,1106,104,671
Joan?  Joan Arc?  Is that you?,135,10,0.05159059190854659,985,1.2962962962962963,20,1353,105,671
A helmet is just not enough!,135,7,0.04826918494167436,986,1.2962962962962963,26,2531,102,671
"No, I am not 'the king of bicycling.' But I am His Majesty's faithful envoy.",135,9,0.050507730635623,987,1.2962962962962963,22,2563,104,671
"Where's your lance, Armstrong?",135,11,0.0526511870045466,988,1.2962962962962963,18,2916,106,671
"Of course you don’t get it, mom! It’s social commentary on today’s  culture of dominance and deception",135,6,0.047110040282513234,989,1.2962962962962963,28,2987,101,671
Do look like I’m ok?,135,11,0.0526511870045466,990,1.2962962962962963,18,3301,106,671
It's a better glute workout than jousting.,135,7,0.04826918494167436,991,1.2962962962962963,26,3705,102,671
"I know, I know. But it was free with the helmet purchase.",132,7,0.048975906452720666,992,1.2954545454545454,25,599,100,671
My father was the Tin Man.,132,8,0.050142794436185724,993,1.2954545454545454,23,709,101,671
it's an uphill battle,132,7,0.048975906452720666,994,1.2954545454545454,25,2302,100,671
People in my neighborhood really don’t like when you bike on the sidewalk.,132,6,0.047780529422158075,995,1.2954545454545454,27,2304,99,671
Apparently ‘Italian steel’ wasn't specific enough.,132,6,0.047780529422158075,996,1.2954545454545454,27,2613,99,671
Smart Outfit!......... how do you pee in that thing?,132,7,0.048975906452720666,997,1.2954545454545454,25,2706,100,671
"To me, it's all the same: the peddle to the metal and the metal to the peddle.",132,5,0.04655446886022631,998,1.2954545454545454,29,2789,98,671
"I'm accident prone, that's why.",132,5,0.04655446886022631,999,1.2954545454545454,29,3094,98,671
Give me a break. Last week you made fun of me for wearing spandex!,132,5,0.04655446886022631,1000,1.2954545454545454,29,3625,98,671
Dressing as Jeanne d'Arc is still not going to get a woman in the Tour de France.,133,7,0.048657009197015086,1001,1.2932330827067668,25,278,101,671
Can we stop to oil my codpiece?,133,8,0.04981391081365883,1002,1.2932330827067668,23,374,102,671
I'm late for the Festival.  Supposed to fight a dragon holding flowers for a damsel.  What a cliche.,133,10,0.05205062961825387,1003,1.2932330827067668,19,510,104,671
"Pedal faster! There are still Trumps, in NYC!!!",133,7,0.048657009197015086,1004,1.2932330827067668,25,535,101,671
The taxis won't see it coming.,133,5,0.04172455066214986,1005,1.2932330827067668,26,1040,102,671
"Howdy, would you like to join me in the war against cars?",133,6,0.04747192199022139,1006,1.2932330827067668,27,1210,100,671
"Sally, I said Under Armor, not Over Armor",133,6,0.04747192199022139,1007,1.2932330827067668,27,1366,100,671
"I'm just saying... in a risk-reward comparison, it doesn't seem worth it.",133,9,0.05094454707919094,1008,1.2932330827067668,21,1624,103,671
Regular sunblock doesn’t work anymore.,133,9,0.05094454707919094,1009,1.2932330827067668,21,1628,103,671
"That’s from Over Armor, right?",133,7,0.048657009197015086,1010,1.2932330827067668,25,1815,101,671
"I think I ordered from wrong""under armor"" website...",133,6,0.04747192199022139,1011,1.2932330827067668,27,1890,100,671
Nothing huzzahs quite like a vintage power suit.,133,5,0.046256482906646926,1012,1.2932330827067668,29,2067,99,671
Hope it doesn't rain.,133,5,0.042401635714140594,1013,1.2932330827067668,27,2289,101,671
I’m just saying it may be possible to take bike safety too far.,133,9,0.05094454707919094,1014,1.2932330827067668,21,2676,103,671
"I’m moving away from spandex, too.",133,8,0.04981391081365883,1015,1.2932330827067668,23,2685,102,671
Today is night-ride; knight-ride is next week,133,8,0.04981391081365883,1016,1.2932330827067668,23,2702,102,671
At least I get to attack downhill this time.,133,8,0.04981391081365883,1017,1.2932330827067668,23,2810,102,671
"I figured, well, if UNDER Armour is good, then...",133,7,0.048657009197015086,1018,1.2932330827067668,25,2862,101,671
I don’t want to talk about what happened to the horse.,133,7,0.048657009197015086,1019,1.2932330827067668,25,3757,101,671
It's Over Armour,130,6,0.048157654340454506,1020,1.2923076923076924,26,16,98,671
We broke up but he said I was a knight to remember.,130,5,0.04690308185181261,1021,1.2923076923076924,28,112,97,671
"Apparently I took the term ""Ironman"" too literally.",130,7,0.049380363060143255,1022,1.2923076923076924,24,214,99,671
You'll wish you had one too once we fall off the end of this illustration.,130,8,0.05057351916100385,1023,1.2923076923076924,22,265,100,671
"Sorry, I thought you said ""viking""",130,8,0.05057351916100385,1024,1.2923076923076924,22,306,100,671
"When you said you were going to add something from the past, I imagined it would be something like a clothes pin with playing card.",130,6,0.04561401651708573,1025,1.2923076923076924,22,345,101,671
I hear those new carbon fiber outfits are only good for one crash.,130,7,0.049380363060143255,1026,1.2923076923076924,24,598,99,671
"If you must know, I'm escaping from that cartoon contest of two weeks ago!",130,5,0.04690308185181261,1027,1.2923076923076924,28,655,97,671
"Hey, about coming over to my place for a knightcap?",130,5,0.04690308185181261,1028,1.2923076923076924,28,678,97,671
It was either this or training wheels.,130,5,0.04690308185181261,1029,1.2923076923076924,28,712,97,671
"When you go up against an SUV, you need armor!",130,5,0.04690308185181261,1030,1.2923076923076924,28,829,97,671
"You’re talking on your phone, you are going the wrong way on a one way street, and you just went thru a red light...you do need body armor.",130,8,0.05057351916100385,1031,1.2923076923076924,22,980,100,671
"My bike company merged with Nike...its called  
""Knike """,130,8,0.05057351916100385,1032,1.2923076923076924,22,1114,100,671
It's a new line of bike wear called Outer Armour.,130,9,0.05173916722083269,1033,1.2923076923076924,20,1183,101,671
"If you could do that well in the swim, the run should be a piece of cake!",130,4,0.04561401651708573,1034,1.2923076923076924,30,1194,96,671
"I don't get road rash. I get road sparks.""",130,6,0.048157654340454506,1035,1.2923076923076924,26,1215,98,671
Thanks for not bringing the lance.,130,7,0.049380363060143255,1036,1.2923076923076924,24,1282,99,671
"Pardon me. I've got places to be, centuries to catch up on.",130,8,0.05057351916100385,1037,1.2923076923076924,22,1290,100,671
...so that's when I realized that I have to be my own knight in shining armor.,130,7,0.049380363060143255,1038,1.2923076923076924,24,1414,99,671
"The joust did not go well, but fortunately I keep a back-up ride.",130,7,0.049380363060143255,1039,1.2923076923076924,24,1476,99,671
My trusty steed went to The Crusades with my best friend.,130,9,0.05173916722083269,1040,1.2923076923076924,20,1611,101,671
"I said let’s bike at NIGHT, Greg...",130,9,0.05173916722083269,1041,1.2923076923076924,20,1621,101,671
"Yes, I'm coming to the wedding. And yes, I am wearing my suit.",130,5,0.04690308185181261,1042,1.2923076923076924,28,1911,97,671
Get out your oil can. It is going to rain.,130,5,0.04690308185181261,1043,1.2923076923076924,28,2037,97,671
...and so will my horse be ready by Friday?,130,5,0.04690308185181261,1044,1.2923076923076924,28,2050,97,671
"M'lady, please removeth thy earbuds.",130,6,0.048157654340454506,1045,1.2923076923076924,26,2063,98,671
"Bill, I said it was a night bikeride!",130,3,0.04428744651076766,1046,1.2923076923076924,32,2206,95,671
"Tell him to blanch the Kale first, then in ice water. Are we in the bus lane?",130,7,0.049380363060143255,1047,1.2923076923076924,24,2410,99,671
You know what? I want a divorce.,130,7,0.049380363060143255,1048,1.2923076923076924,24,3209,99,671
"It's loud, but surprisingly breathable.",130,6,0.048157654340454506,1049,1.2923076923076924,26,3234,98,671
"It's in case I win the race, and have to meet Trump.",130,10,0.05287912640241091,1050,1.2923076923076924,18,3352,102,671
Tonight’s the knight!,130,9,0.05173916722083269,1051,1.2923076923076924,20,3394,101,671
I burn calories just putting this on.,130,4,0.04561401651708573,1052,1.2923076923076924,30,3397,96,671
Passing on the left me lady.,130,7,0.049380363060143255,1053,1.2923076923076924,24,3453,99,671
They had it in neon yellow too.,130,9,0.05173916722083269,1054,1.2923076923076924,20,3527,101,671
"Yeah, but a bike doesn't poop.",130,8,0.05057351916100385,1055,1.2923076923076924,22,3570,100,671
I love our knight rides together.,130,6,0.048157654340454506,1056,1.2923076923076924,26,3633,98,671
If you think your chain is rusty wait till it rains!,127,9,0.052568375458033396,1057,1.2913385826771653,19,255,99,671
I can be there in 5 minutes and yes my armor is shining.,127,5,0.047576218749342036,1058,1.2913385826771653,27,260,95,671
I thought you asked to go on a knight ride.,127,7,0.05013447261506803,1059,1.2913385826771653,23,530,97,671
I'm tired of being body-shamed.,127,6,0.04887208781542001,1060,1.2913385826771653,25,1004,96,671
They told me the plume was aerodynamic...,127,5,0.047576218749342036,1061,1.2913385826771653,27,1026,95,671
"Hey, wanna see my under armour?",127,7,0.05013447261506803,1062,1.2913385826771653,23,1079,97,671
Ironman training?,127,4,0.0462440505744508,1063,1.2913385826771653,29,1172,94,671
I’m more of a Knight-Rider,127,7,0.05013447261506803,1064,1.2913385826771653,23,1178,97,671
You also laughed when I grew a handle-bar mustache but then it came back into style.,127,6,0.04887208781542001,1065,1.2913385826771653,25,1347,96,671
"I'm trying this new athletic gear called ""Over Armor""",127,5,0.047576218749342036,1066,1.2913385826771653,27,1591,95,671
I'm dreading the swimming part of this race.,127,7,0.05013447261506803,1067,1.2913385826771653,23,1756,97,671
"Get real, it's  time   to  get off your  high  horse.",127,8,0.05136584197055361,1068,1.2913385826771653,21,1764,98,671
It's hard admitting that you're a woman and voted for Trump.,127,6,0.04887208781542001,1069,1.2913385826771653,25,1920,96,671
I feel like I've put on a little weight.,127,4,0.0462440505744508,1070,1.2913385826771653,29,2197,94,671
Not what I had in mind when you asked me to go on a night ride.,127,8,0.05136584197055361,1071,1.2913385826771653,21,2396,98,671
Why do people keep asking me if I am the Knight Rider?!,127,5,0.047576218749342036,1072,1.2913385826771653,27,2628,95,671
I thought spandex was a little too showy,127,2,0.04124399221944065,1073,1.2913385826771653,32,2727,93,671
Does it sound like my chain is squeaking again?,127,6,0.04887208781542001,1074,1.2913385826771653,25,3182,96,671
It is a little tougher on the up-hills.,127,7,0.05013447261506803,1075,1.2913385826771653,23,3516,97,671
The best thing about having an exoskeleton is that you don't have to wear all that lycra,134,9,0.05061026617466471,1076,1.291044776119403,21,1571,104,671
I love taking Knight rides after work!,128,6,0.04022626664627534,1077,1.2890625,21,377,101,671
"Besides being lighter weight, spandex is more breathable.",128,4,0.033556318988310914,1078,1.2890625,22,1028,102,671
You know what—I’m just glad to finally see a white knight going the distance,128,8,0.051013767718148216,1079,1.2890625,21,1399,99,671
"I'm drop dead gorgeous and I want to stay this way.""",128,8,0.051013767718148216,1080,1.2890625,21,1823,99,671
Sir Lancelot Armstrong,128,9,0.05220570843178142,1081,1.2890625,19,2236,100,671
You’ll see. This will come in handy if we have to attack a castle.,128,6,0.048542162134326036,1082,1.2890625,25,2722,97,671
What? the casting call said to wear a suit for amour?,128,9,0.05220570843178142,1083,1.2890625,19,3021,100,671
Brakes just slow me down.”,125,10,0.05425863986500215,1084,1.288,16,10,99,671
I'm training for the Iron Man competition.,125,5,0.047946206415913864,1085,1.288,26,84,94,671
This heavy bottle of water is slowing me down.,125,8,0.0518260116531358,1086,1.288,20,190,97,671
"Yes, 9-1-1 !  I'm in pursuit of a clown on a unicycle who stole my jousting lance!",125,9,0.05305626958178915,1087,1.288,18,274,98,671
"Oh, nothing special, just girl knights out.... What are you doing?",125,2,0.043723471219516315,1088,1.288,32,291,91,671
Have you seen the price of oats?,125,4,0.04658118130332145,1089,1.288,28,309,93,671
"My new bike only weighs 22 lbs., but I'm not noticing any difference.",125,4,0.04658118130332145,1090,1.288,28,312,93,671
"They don't see me any better, but the marks I leave now are way beyond paintless dent repairs.",125,7,0.05056583061521339,1091,1.288,22,375,96,671
The law does not state the type of helmet.,125,5,0.047946206415913864,1092,1.288,26,416,94,671
"I ride for the Knights of the Round Table.  Who is thy patron?""",125,8,0.0518260116531358,1093,1.288,20,491,97,671
"Time machine a success, now bring me back.   Entire future controlled by 2”x5” shiny black card.",125,8,0.0518260116531358,1094,1.288,20,589,97,671
I've got an app for the horse and the lance.,125,4,0.04658118130332145,1095,1.288,28,770,93,671
"I gave up the horse and the sword, but the armor just makes sense these days.",125,6,0.04927343064717471,1096,1.288,24,888,95,671
"how far is this place ""Camelot"" ?",125,7,0.05056583061521339,1097,1.288,22,938,96,671
Let me guess... classics major?,125,5,0.047946206415913864,1098,1.288,26,973,94,671
"Yeh, I’m starting a new trend: Over Armor",125,8,0.0518260116531358,1099,1.288,20,1180,97,671
In my previous life this wouldn't have been so exhausting.  My horse did all the work!,125,4,0.04658118130332145,1100,1.288,28,1415,93,671
"Legend has it, there's a fish out there somewhere who needs a bicycle.",125,7,0.05056583061521339,1101,1.288,22,1431,96,671
Nobility is out of style. Today’s knights are more focused on mobility.,125,5,0.045883442793459225,1102,1.288,25,1619,95,671
I met a man named Otto who didn't know what a palindrome is.,125,5,0.04145109827721211,1103,1.288,23,1697,97,671
After the doping scandal I became Lancelot.,125,8,0.0518260116531358,1104,1.288,20,1907,97,671
"I said do you want to go for a night ride Jason,  not a knight ride.",125,8,0.0518260116531358,1105,1.288,20,1918,97,671
My horse is ready.,125,6,0.04927343064717471,1106,1.288,24,2008,95,671
I meant night ride,125,8,0.0518260116531358,1107,1.288,20,2030,97,671
You need to pee?,125,5,0.047946206415913864,1108,1.288,26,2041,94,671
That’s not what they mean by iron man competition,125,6,0.04927343064717471,1109,1.288,24,2052,95,671
"Spandex has its merits, but you can't beat this for security.",125,11,0.05543493716118488,1110,1.288,14,2174,100,671
It’s casual Friday.,125,6,0.04927343064717471,1111,1.288,24,2303,95,671
"Do you hear whistling, too?",125,5,0.036484198966039376,1112,1.288,21,2357,99,671
"Running a little late. 650, 700 years tops.",125,5,0.047946206415913864,1113,1.288,26,2465,94,671
Why?  My therapist said that knight bicycle rides are very therapeutic.,125,7,0.05056583061521339,1114,1.288,22,2499,96,671
It's so much harder now horses aren't allowed into the city.,125,9,0.05305626958178915,1115,1.288,18,2535,98,671
"how do you pee?""",125,10,0.05425863986500215,1116,1.288,16,2556,99,671
You're the one who wanted to move here to Portland.,125,8,0.0518260116531358,1117,1.288,20,2711,97,671
Did I leave my lance at your place?,125,10,0.05425863986500215,1118,1.288,16,2799,99,671
The bike and the injury avoidance uniform together was cheaper than a new car.,125,5,0.047946206415913864,1119,1.288,26,2807,94,671
I just thought you meant a night ride.,125,8,0.0518260116531358,1120,1.288,20,3042,97,671
You’ll need a strong lance arm!,125,5,0.03558905232176449,1121,1.288,18,3089,102,671
My cowboy outfit is at the cleaners.,125,7,0.05056583061521339,1122,1.288,22,3382,96,671
"Not what I meant by 'night cycling gear', but at least it's reflective.",125,8,0.0518260116531358,1123,1.288,20,3440,97,671
You said let’s take a knight ride together!,125,7,0.05056583061521339,1124,1.288,22,3511,96,671
It's knockoff Under Armour,125,10,0.05425863986500215,1125,1.288,16,3536,99,671
"Why the bike, Sire?  I’m trying to reduce my horse manure footprint.",125,7,0.05056583061521339,1126,1.288,22,3613,96,671
My mother doesn't believe in half measures.,125,5,0.047946206415913864,1127,1.288,26,3624,94,671
Got mail?,125,5,0.047946206415913864,1128,1.288,26,3702,94,671
Let me call you back after I slay this hill.,122,6,0.05003657813472293,1129,1.2868852459016393,23,1070,93,671
