caption,count,funny,precision,rank,score,somewhat_funny,target_id,unfunny,contest
"You've heard of 'Joan of Arc'.  Well, I'm 'Joan of Central Park.'",67,1,0.050313422571883724,2716,1.164179104477612,9,3252,57,671
In the 'burbs I'm known as Sir Falls-A-Lot.,67,0,0.045597768109013316,2717,1.164179104477612,11,3255,56,671
Zis stage of ze Tour has taken me longer zan I expected.,67,1,0.050313422571883724,2718,1.164179104477612,9,3294,57,671
You of all people should have let me go first!,67,3,0.05861747657178797,2719,1.164179104477612,5,3310,59,671
"To be honest, I'm only here testing new methods of virtue signaling, m'lady.",67,1,0.050313422571883724,2720,1.164179104477612,9,3354,57,671
I'm the mascot for the tour du  france,67,3,0.05861747657178797,2721,1.164179104477612,5,3361,59,671
"I'm not so sure about my new ""Over Armour"" sponsorship.",67,2,0.05462347961518495,2722,1.164179104477612,7,3389,58,671
"Wait, you're breaking up... are you sure you're not entering a building or a tunnel?",67,1,0.050313422571883724,2723,1.164179104477612,9,3392,57,671
On your knight!,67,2,0.05462347961518495,2724,1.164179104477612,7,3399,58,671
I'm a knight on the steel horse I ride.,67,3,0.05861747657178797,2725,1.164179104477612,5,3403,59,671
I Left My Horse At Home...,67,1,0.050313422571883724,2726,1.164179104477612,9,3409,57,671
"I might not win the race, but I will survive it!",67,0,0.045597768109013316,2727,1.164179104477612,11,3448,56,671
"Right, they don't do yellow jerseys anymore.",67,2,0.05462347961518495,2728,1.164179104477612,7,3454,58,671
"I've been invited to go cycling in the Swiss Alps.""",67,1,0.050313422571883724,2729,1.164179104477612,9,3455,57,671
"Pardon me, Sir, are you a knight?  Because it isn't very chivalrous of you to go in front of me.",67,3,0.05861747657178797,2730,1.164179104477612,5,3533,59,671
"I know this is anachronistic, but I refuse to ride a horse to the Renaissance Faire.",67,2,0.05462347961518495,2731,1.164179104477612,7,3546,58,671
I'm lost?,67,1,0.050313422571883724,2732,1.164179104477612,9,3557,57,671
"Nag, nag, nag - just let me ride in peace",67,1,0.050313422571883724,2733,1.164179104477612,9,3559,57,671
I thought you literally meant we were getting Medieval.,67,0,0.045597768109013316,2734,1.164179104477612,11,3621,56,671
"No, that isn't Red Landing.",67,2,0.05462347961518495,2735,1.164179104477612,7,3634,58,671
"I know! Yeah, I think I took digital detox far way back",67,3,0.05861747657178797,2736,1.164179104477612,5,3676,59,671
I refuse to battle traffic.,67,2,0.05462347961518495,2737,1.164179104477612,7,3683,58,671
I'm a 3-D rebus: knight rider. You?,67,2,0.05462347961518495,2738,1.164179104477612,7,3739,58,671
I'm suffering from an iron deficiency since the police said no lance allowed,68,1,0.049626763740833676,2739,1.161764705882353,9,70,58,671
"Hello, police ?  There's a woman who looks just like me that's stalking me.",68,2,0.05386833246131616,2740,1.161764705882353,7,93,59,671
If I fall someone will hear the clanking sound.,68,1,0.049626763740833676,2741,1.161764705882353,9,428,58,671
My entire life is a LARP.,68,0,0.04498704387503319,2742,1.161764705882353,11,852,57,671
I just had to get away from all that Lance stuff. Lancelot was a no brainer.,68,1,0.049626763740833676,2743,1.161764705882353,9,919,58,671
"Over Armour?""  Just not sure it wicks fast enough.",68,1,0.049626763740833676,2744,1.161764705882353,9,1024,58,671
"I just got rid of my car, but I still don't feel safe unless I'm encased in steel.  Do you think I should have gone for the Iron Man suit?",68,1,0.049626763740833676,2745,1.161764705882353,9,1111,58,671
They told me it was the latest style and that everybody was switching over.,68,0,0.04498704387503319,2746,1.161764705882353,11,1136,57,671
How far did you say 'til we hit clean air?,68,1,0.049626763740833676,2747,1.161764705882353,9,1359,58,671
"My trusty steed went to a damsel who, turns out, wasn't in distress.",68,1,0.049626763740833676,2748,1.161764705882353,9,1610,58,671
"Are you wearing Under Armour?""",68,0,0.04498704387503319,2749,1.161764705882353,11,1818,57,671
Where's your lance? I don't joust on the first date.,68,2,0.05386833246131616,2750,1.161764705882353,7,1921,59,671
"That's great, John - but I still think chivalry is dead.",68,0,0.04498704387503319,2751,1.161764705882353,11,1973,57,671
Let me know if you see a white knight.,68,2,0.05386833246131616,2752,1.161764705882353,7,2015,59,671
"Hey, you need protection to feel a new experience these days!",68,1,0.049626763740833676,2753,1.161764705882353,9,2070,58,671
Now I know why your Social media user name is @knightrider,68,3,0.05779947062852091,2754,1.161764705882353,5,2581,60,671
"I could not love thee err so much, loved I not armor more.",68,2,0.05386833246131616,2755,1.161764705882353,7,3088,59,671
Who said that chivalry doesn't run in cycles?,68,1,0.049626763740833676,2756,1.161764705882353,9,3207,58,671
My horse is in the shop so I’m stuck biking.,64,1,0.05087893153952011,2757,1.15625,8,13,55,671
Damn I forgot my shades.,64,2,0.055540052400361674,2758,1.15625,6,20,56,671
I don’t think exercise would get you under the weight limit for the ride,64,1,0.05087893153952011,2759,1.15625,8,22,55,671
The hard part is tilting .,64,1,0.05087893153952011,2760,1.15625,8,36,55,671
"Dorothy, this is the Yellow Brick Road.",64,3,0.05983919423477113,2761,1.15625,4,39,57,671
"This is my ""Uber-All"" bike outfit designed to protect me from all opening taxi doors.",64,1,0.05087893153952011,2762,1.15625,8,163,55,671
So tell me. How do you like your telemarketing job?,64,2,0.055540052400361674,2763,1.15625,6,166,56,671
I'd fit in perfectly at a lobster boil.,64,1,0.05087893153952011,2764,1.15625,8,194,55,671
M'lady,64,1,0.05087893153952011,2765,1.15625,8,215,55,671
"I'm ready for preventable accidents.""",64,2,0.055540052400361674,2766,1.15625,6,223,56,671
"Queens are doing the slaying now, so we got demoted to bikes.",64,2,0.055540052400361674,2767,1.15625,6,247,56,671
You aught to wear something wither higher visibility when riding at knight,64,0,0.045745315919462494,2768,1.15625,10,267,54,671
In Game of Thrones they never take them off.,64,0,0.045745315919462494,2769,1.15625,10,275,54,671
Sponsored by Armor All. Why?,64,0,0.045745315919462494,2770,1.15625,10,365,54,671
I'm afraid the yellow jersey won't stretch to fit over my breastplate.,64,0,0.045745315919462494,2771,1.15625,10,398,54,671
I think this is more suited to winter riding.,64,1,0.05087893153952011,2772,1.15625,8,452,55,671
"I'm busy all day, so I only have time for knight rides.",64,1,0.05087893153952011,2773,1.15625,8,454,55,671
"Tell Merlin his shortcut didn't quite work, sire.",64,1,0.05087893153952011,2774,1.15625,8,455,55,671
I forgot my lance!,64,0,0.036723103212062694,2775,1.15625,9,472,55,671
This route goes past Trump Tower and Bergdorfs so I'm not taking any chances.,64,2,0.055540052400361674,2776,1.15625,6,499,56,671
"Yeah, I found this suit of armor at my local Goodwill. It was a total steel!",64,1,0.05087893153952011,2777,1.15625,8,512,55,671
I never had to worry about my fertility on my last steed.,64,1,0.05087893153952011,2778,1.15625,8,556,55,671
"Is that to protect your body when you fall?

Not really, it’s to protect my identity on Amazon Prime Day.",64,2,0.055540052400361674,2779,1.15625,6,609,56,671
"I misread ""safe guard protection"" in the description.",64,2,0.055540052400361674,2780,1.15625,6,680,56,671
Ni! Ni! Night My Lady,64,1,0.05087893153952011,2781,1.15625,8,702,55,671
"Ya, bike chain lubricant is pretty versatile.",64,0,0.045745315919462494,2782,1.15625,10,705,54,671
This isn’t exactly what I had in mind when you said we’d ride off into the sunset together.,64,1,0.05087893153952011,2783,1.15625,8,744,55,671
Is it dangerous?  Do I need my mace?,64,1,0.05087893153952011,2784,1.15625,8,745,55,671
I choose to wear all this armor when cycling because of all the jerks that are looking at their iPhones instead of the roads.,64,1,0.05087893153952011,2785,1.15625,8,759,55,671
"The name’s Lancelot, but you can just call me Lance",64,1,0.05087893153952011,2786,1.15625,8,797,55,671
I Charlemagne am invincible on my fiery steed Tencendur!,64,2,0.055540052400361674,2787,1.15625,6,808,56,671
"What am I doing? Being a knight in shining armor, of course.",64,1,0.05087893153952011,2788,1.15625,8,889,55,671
Her Ladyship has gone vegan.,64,1,0.05087893153952011,2789,1.15625,8,907,55,671
I told you you had to readjust your helmet!,64,0,0.045745315919462494,2790,1.15625,10,913,54,671
I would regret it if it wasn’t 40% off retail,64,2,0.055540052400361674,2791,1.15625,6,927,56,671
"Find me on TikTok, @lancelot_armourstrong!",64,3,0.05983919423477113,2792,1.15625,4,943,57,671
"Good knight to you, sir!",64,0,0.045745315919462494,2793,1.15625,10,955,54,671
We missed the last turn?,64,1,0.05087893153952011,2794,1.15625,8,961,55,671
"No, I don't know of a good fender repair shop.",64,2,0.055540052400361674,2795,1.15625,6,968,56,671
Ride and talk don't Ride and Text.,64,1,0.05087893153952011,2796,1.15625,8,1007,55,671
Knights of the Cross??  I thought they said Knights of the Cross-Training!,64,1,0.05087893153952011,2797,1.15625,8,1014,55,671
"No, I said chain oil, not chain mail.",64,2,0.055540052400361674,2798,1.15625,6,1039,56,671
I see the Middle Ages are ahead of me.,64,1,0.05087893153952011,2799,1.15625,8,1049,55,671
"I meant as in ""night and day""....",64,0,0.045745315919462494,2800,1.15625,10,1059,54,671
"Whoops, it’s time for me to re-lube again.",64,2,0.055540052400361674,2801,1.15625,6,1082,56,671
I have taken peyote/mushrooms twice therefore I am ahead of you and the smog.,64,2,0.055540052400361674,2802,1.15625,6,1121,56,671
It's my Halloween costume. I'm a Knight Rider.,64,2,0.055540052400361674,2803,1.15625,6,1147,56,671
"Pretty sure I said to buy the Under Ar
mour cycling gear...",64,0,0.045745315919462494,2804,1.15625,10,1150,54,671
You misunderstood. It's a product that makes your tires shine.,64,1,0.05087893153952011,2805,1.15625,8,1161,55,671
I have to hold the visor up like this while riding - otherwise my vision is zero.,64,0,0.045745315919462494,2806,1.15625,10,1217,54,671
I’ll feel safer.  The knights drive very aggressively.,64,2,0.055540052400361674,2807,1.15625,6,1270,56,671
What? Knight riding’s no picnic...,64,3,0.05983919423477113,2808,1.15625,4,1274,57,671
Now you're ready to take on Manhattan.,64,0,0.045745315919462494,2809,1.15625,10,1281,54,671
"You've heard of performance enhancing drugs?  Well this is a performance degrading drug, except its not actually a drug, it is a kind of uniform to give protection.  It is made out of metal which is very heavy and makes it hard to move these pedals.",64,0,0.045745315919462494,2810,1.15625,10,1296,54,671
And that's why I gave up swimming.,64,2,0.055540052400361674,2811,1.15625,6,1309,56,671
"Today, I'm a bike messenger, but you know the advice.",64,1,0.05087893153952011,2812,1.15625,8,1311,55,671
"Why , I wear under armour,of course",64,2,0.055540052400361674,2813,1.15625,6,1321,56,671
What? You're having an acrophobia moment? We're just on a path CALLED the High Line!,64,3,0.05983919423477113,2814,1.15625,4,1337,57,671
My horse showed me a great shortcut this way.,64,1,0.05087893153952011,2815,1.15625,8,1338,55,671
Maybe some Under Armor would help..,64,1,0.05087893153952011,2816,1.15625,8,1360,55,671
i only wear this when cycling through central park...,64,2,0.055540052400361674,2817,1.15625,6,1395,56,671
"Now, this is a helmet.",64,0,0.045745315919462494,2818,1.15625,10,1488,54,671
"I never learned to drive, but loved the old series Knight Rider.",64,1,0.05087893153952011,2819,1.15625,8,1531,55,671
You should get an endorsement from Under Armour for wearing that Body Armor!,64,2,0.055540052400361674,2820,1.15625,6,1562,56,671
I made everything from recycled materials.,64,0,0.045745315919462494,2821,1.15625,10,1575,54,671
I just find Over Armour to be much more durable.,64,1,0.05087893153952011,2822,1.15625,8,1614,55,671
"Hey, don't text and drive!  I'm right here.",64,0,0.045745315919462494,2823,1.15625,10,1631,54,671
I am going downtown.,64,2,0.055540052400361674,2824,1.15625,6,1690,56,671
"The drag on my body is reduced; the less drag on, the better.",64,3,0.05983919423477113,2825,1.15625,4,1711,57,671
Want to race to the Dark Ages?,64,2,0.055540052400361674,2826,1.15625,6,1802,56,671
"Joust, schmoust. Let's just ride.",64,2,0.055540052400361674,2827,1.15625,6,1805,56,671
Yes and my bike  also comes with the latest super light  carbon fiber alloy  frame!,64,0,0.036723103212062694,2828,1.15625,9,1826,55,671
They were out of Under Armour.,64,0,0.045745315919462494,2829,1.15625,10,1831,54,671
I'm allergic to sunlight.,64,1,0.05087893153952011,2830,1.15625,8,1834,55,671
I think you misunderstood about being cool in Under Armor.,64,2,0.055540052400361674,2831,1.15625,6,1884,56,671
"Obey the traffic laws, and you can wear shorts",64,2,0.055540052400361674,2832,1.15625,6,1923,56,671
"Look, I know I'm not dreaming - most drivers are aiming at us.",64,1,0.05087893153952011,2833,1.15625,8,1943,55,671
I want everything to be carbon fibre.,64,0,0.045745315919462494,2834,1.15625,10,1958,54,671
Did they have to hoist you onto your mount with a crane?,64,2,0.055540052400361674,2835,1.15625,6,1988,56,671
This iron woman contest is ridiculous,64,2,0.055540052400361674,2836,1.15625,6,2005,56,671
In fact I wear it all the time in case the knight in shining armor pun presents itself.,64,1,0.05087893153952011,2837,1.15625,8,2014,55,671
"Chivalry isn't dead, but it could lose some weight.",64,3,0.05983919423477113,2838,1.15625,4,2045,57,671
"Cool, but how do you deal with nature in that outfit?",64,2,0.055540052400361674,2839,1.15625,6,2069,56,671
Wasn’t there suppose to be a jousting segment in this triathlon?,64,1,0.05087893153952011,2840,1.15625,8,2074,55,671
You wouldn't believe how hard it is to find parking for a horse!,64,1,0.05087893153952011,2841,1.15625,8,2108,55,671
My horse left me to work for Medieval Times,64,0,0.045745315919462494,2842,1.15625,10,2124,54,671
"Good Knight,  sir!  Pay attention to the road!",64,1,0.05087893153952011,2843,1.15625,8,2150,55,671
"Just to let you know that's a dragon not an airplane""",64,3,0.05983919423477113,2844,1.15625,4,2153,57,671
I bet it was great to live 700 years ago.,64,1,0.05087893153952011,2845,1.15625,8,2216,55,671
I need to talk to a spokes person in the chain of command.,64,0,0.045745315919462494,2846,1.15625,10,2233,54,671
I thought 'Under Armour' was more of a literal thing.,64,0,0.045745315919462494,2847,1.15625,10,2239,54,671
It’s high modulus carbon fiber,64,1,0.05087893153952011,2848,1.15625,8,2266,55,671
The invite said NIGHT ride. I feel like you’re overdressed.,64,1,0.05087893153952011,2849,1.15625,8,2280,55,671
My suggestion is breathable fabrics and a good lawyer.,64,0,0.045745315919462494,2850,1.15625,10,2405,54,671
Cycling in Manhattan is more dangerous than you think,64,1,0.05087893153952011,2851,1.15625,8,2421,55,671
Wear Under Armor - not body armor,64,1,0.05087893153952011,2852,1.15625,8,2424,55,671
"No, I'm not THAT Knight Rider.",64,2,0.055540052400361674,2853,1.15625,6,2434,56,671
"Wow I can't hear or see
'butt ' I'm safe!",64,2,0.055540052400361674,2854,1.15625,6,2460,56,671
"...and then he said, ‘sorry Carl, there’s not enough room at the table’.",64,2,0.055540052400361674,2855,1.15625,6,2482,56,671
KITT is in the shop.,64,1,0.05087893153952011,2856,1.15625,8,2496,55,671
"A little less horsepower than I'm used to, but lower emissions are important these days.",64,2,0.055540052400361674,2857,1.15625,6,2503,56,671
"I'm going to have to get a lot more information before I agree to another of your ""night rides.""",64,2,0.055540052400361674,2858,1.15625,6,2512,56,671
"This.wasn’t. a good...
idea...",64,1,0.05087893153952011,2859,1.15625,8,2554,55,671
"Listen, Janet, my lance is on my other bike. Otherwise I would be defending your honor.",64,1,0.05087893153952011,2860,1.15625,8,2583,55,671
Horse racing is the sport of kings.  This is all I could afford.,64,2,0.055540052400361674,2861,1.15625,6,2614,56,671
This is my knight outfit,64,2,0.055540052400361674,2862,1.15625,6,2624,56,671
Jousting was much safer than cycling in the City....,64,0,0.045745315919462494,2863,1.15625,10,2627,54,671
"I threw down the gauntlet, but only because it didn't work on my phone's touchscreen.",64,3,0.05983919423477113,2864,1.15625,4,2636,57,671
Someone suggested I try knight riding to beat the heat.,64,2,0.055540052400361674,2865,1.15625,6,2644,56,671
This workout gear isn't as breathable as I thought it might be.,64,1,0.05087893153952011,2866,1.15625,8,2671,55,671
Pretending to be a knight-errant makes the ride a lot more interesting.,64,0,0.045745315919462494,2867,1.15625,10,2724,54,671
I seem to have lost my lance in the crowd behind us.,64,0,0.045745315919462494,2868,1.15625,10,2734,54,671
"Your outfit won't offer any protection after sunset,either.",64,1,0.0429490169335173,2869,1.15625,7,2811,56,671
It's all downhill after this.,64,2,0.055540052400361674,2870,1.15625,6,2861,56,671
"I don't watch much television so no, I didn't know it was Night Rider with an N",64,2,0.055540052400361674,2871,1.15625,6,2890,56,671
"Pray tell, fair maiden, from whence is the Throgs Neck Bridge?",64,1,0.05087893153952011,2872,1.15625,8,2910,55,671
Another minute for hard fried.,64,0,0.036723103212062694,2873,1.15625,9,2918,55,671
I hear America's ass hurts.,64,1,0.05087893153952011,2874,1.15625,8,2920,55,671
Road rash phobia.,64,2,0.055540052400361674,2875,1.15625,6,2934,56,671
It's castleisure wear.,64,0,0.045745315919462494,2876,1.15625,10,2941,54,671
"My horse joined the AHCLU so they now get Sundays off, 3 carrots a day, an apple twice a month, and conjugal stall visits.",64,1,0.05087893153952011,2877,1.15625,8,2951,55,671
Best new safety equipment money can buy!,64,0,0.045745315919462494,2878,1.15625,10,2983,54,671
It does create a lot of wind resistance but it does keep the bugs out of my teeth,64,1,0.05087893153952011,2879,1.15625,8,3013,55,671
I guess today is casual Friday,64,1,0.05087893153952011,2880,1.15625,8,3018,55,671
"Fitbit Support, I've been cycling for an hour but the device seems to be broken. So did I even cycle at all?",64,2,0.055540052400361674,2881,1.15625,6,3043,56,671
I don't think this part of town is gentrified yet.,64,0,0.045745315919462494,2882,1.15625,10,3046,54,671
did you know your back wheel is going forward?...snap out of the past.,64,3,0.05983919423477113,2883,1.15625,4,3064,57,671
GPS schmeeps.I think we took the wrong exit and lost the other racers,64,2,0.055540052400361674,2884,1.15625,6,3066,56,671
Looking for my missing varlet.,64,1,0.05087893153952011,2885,1.15625,8,3079,55,671
You must be a steel man...,64,2,0.055540052400361674,2886,1.15625,6,3105,56,671
"I am not sure what just happened.  I started riding as as a competent and successful CEO and ""poof"" . . .I am in the middle ages.",64,1,0.05087893153952011,2887,1.15625,8,3184,55,671
"The name's Arc, Joan of Arc",64,2,0.055540052400361674,2888,1.15625,6,3186,56,671
"I don't usually do this, but I'm training for an Ironman.",64,0,0.045745315919462494,2889,1.15625,10,3195,54,671
This is easier and more exercise than jousting.,64,2,0.055540052400361674,2890,1.15625,6,3230,56,671
I thought you said you liked fast paced city knights.,64,1,0.05087893153952011,2891,1.15625,8,3251,55,671
I think my odds are better than yours.,64,0,0.045745315919462494,2892,1.15625,10,3341,54,671
"Listen Karen, I don't think we can see each other anymore. How am I going to explain the excess leg muscles and rust on my suit to Deborah?",64,0,0.045745315919462494,2893,1.15625,10,3374,54,671
It chaffs.,64,3,0.05983919423477113,2894,1.15625,4,3386,57,671
Apparently chivalry IS dead.,64,2,0.055540052400361674,2895,1.15625,6,3396,56,671
It is better than coconuts,64,1,0.05087893153952011,2896,1.15625,8,3432,55,671
The drivers here are worse than dragons.,64,1,0.05087893153952011,2897,1.15625,8,3434,55,671
No sorry this is the other Knight Rider.,64,0,0.045745315919462494,2898,1.15625,10,3456,54,671
"It’s my effort against global warming, bicycling recycling.",64,1,0.05087893153952011,2899,1.15625,8,3594,55,671
Can you direct me to the nearest damsel in distress?,64,1,0.05087893153952011,2900,1.15625,8,3609,55,671
"Oh, the body armor? It's a girl thing that gives me the power to seek the ideal hookup without being poked along the way.",64,0,0.045745315919462494,2901,1.15625,10,3669,54,671
My mother said knight biking was dangerous but I feel totally safe.,64,2,0.055540052400361674,2902,1.15625,6,3671,56,671
"No, a dragon isn’t the problem. I’m running late on a quest to save a damsel from an unfunny caption contest!",64,3,0.05983919423477113,2903,1.15625,4,3677,57,671
...and good day to you!,65,3,0.058960421987522674,2904,1.1538461538461537,4,68,58,671
"And I told him if I wanted a Knight to fight for me,
I'd be that Knight.",65,2,0.0547317287336835,2905,1.1538461538461537,6,147,57,671
"They say, amour conquers all!",65,2,0.0547317287336835,2906,1.1538461538461537,6,172,57,671
I couldn't find a steed with e-assist.,65,2,0.0547317287336835,2907,1.1538461538461537,6,240,57,671
"I hoped you'd see it as a ""Suit of amour"".",65,0,0.045100151536763756,2908,1.1538461538461537,10,285,55,671
Doctor's orders!,65,1,0.05014771080925116,2909,1.1538461538461537,8,516,56,671
New tactic: slow gentrification by requiring gentry attire,65,1,0.05014771080925116,2910,1.1538461538461537,8,607,56,671
"Fine, but then let's drop by the farmer's market to buy a $6 tomato.",65,3,0.058960421987522674,2911,1.1538461538461537,4,677,58,671
"Bono, is that you?",65,1,0.05014771080925116,2912,1.1538461538461537,8,746,56,671
"If this is what I use to charge, I'd fall before the jousting begins.",65,1,0.05014771080925116,2913,1.1538461538461537,8,773,56,671
It’s a wedding gift.  I should have never married a guy named Arthur King.,65,3,0.058960421987522674,2914,1.1538461538461537,4,793,58,671
"Grass prices in the city, am I right?",65,1,0.05014771080925116,2915,1.1538461538461537,8,893,56,671
I’m a knight in shining Armor All,65,1,0.05014771080925116,2916,1.1538461538461537,8,1177,56,671
'You have to be prepared for life's uphill battles.',65,2,0.0547317287336835,2917,1.1538461538461537,6,1388,57,671
"When they said knight ride I figured
I’d be chivalrous and give you a head start.",65,1,0.05014771080925116,2918,1.1538461538461537,8,1401,56,671
"So, how long have you been riding your bike in New York?",65,0,0.045100151536763756,2919,1.1538461538461537,10,1402,55,671
Bike apparel: Day and Knight,65,2,0.0547317287336835,2920,1.1538461538461537,6,1672,57,671
"It’s supposed to rain, but you never listen.",65,0,0.045100151536763756,2921,1.1538461538461537,10,1758,55,671
I'm a knight in shining bike,65,2,0.0547317287336835,2922,1.1538461538461537,6,1836,57,671
"I just intended to get a helmet, but this suit was on sale!",65,0,0.045100151536763756,2923,1.1538461538461537,10,1908,55,671
I thought recycling would be much easier.,65,2,0.0547317287336835,2924,1.1538461538461537,6,2009,57,671
"Do you know where the “Off Broadway “ area is ?, I’m running late for an audition, this suit was supposed to be done yesterday at the dry cleaners",65,1,0.05014771080925116,2925,1.1538461538461537,8,2058,56,671
hey are you holding?,65,1,0.05014771080925116,2926,1.1538461538461537,8,2093,56,671
"No you are mistaken, David Hasselhoff drove a car on the television series Knight Rider.”",65,2,0.0547317287336835,2927,1.1538461538461537,6,2094,57,671
"the left cyclist: Et tu, Brute
the right cyclist: May the Force be with you",65,2,0.0547317287336835,2928,1.1538461538461537,6,2134,57,671
"You’ve heard of the Knight Errant? Well, I’m the Knight Errand!",65,0,0.045100151536763756,2929,1.1538461538461537,10,2211,55,671
Oh. Night ride.,65,0,0.045100151536763756,2930,1.1538461538461537,10,2376,55,671
"Fear not, fair lady. If the mayor shan’t, I shall protect thy bike lane.",65,0,0.045100151536763756,2931,1.1538461538461537,10,2558,55,671
"It's a new brand, Over Armour.",65,1,0.05014771080925116,2932,1.1538461538461537,8,2561,56,671
Just protecting the moneymaker.,65,1,0.05014771080925116,2933,1.1538461538461537,8,2574,56,671
I'm a big fan of knight rider,65,2,0.0547317287336835,2934,1.1538461538461537,6,2880,57,671
I'm on my way to The Renaissance Fair.,65,0,0.045100151536763756,2935,1.1538461538461537,10,2961,55,671
It’s just like riding a horse,65,2,0.0547317287336835,2936,1.1538461538461537,6,3112,57,671
Maintenance on my cycling gear is as much as a bus pass.,65,3,0.058960421987522674,2937,1.1538461538461537,4,3126,58,671
You got a can opener on you by any chance?,65,1,0.05014771080925116,2938,1.1538461538461537,8,3235,56,671
"Yeah, my horse is still on maternity leave.",65,1,0.05014771080925116,2939,1.1538461538461537,8,3250,56,671
"Let's face it, chivalry is dead.",65,1,0.05014771080925116,2940,1.1538461538461537,8,3390,56,671
Damsel in distress. Lame charger. Gotta fly. Get a better helmet.,65,3,0.058960421987522674,2941,1.1538461538461537,4,3647,58,671
"It's convenient, but the horsepower's a little low.",65,0,0.045100151536763756,2942,1.1538461538461537,10,3728,55,671
"I meant, ""Let's go night riding"".",65,1,0.05014771080925116,2943,1.1538461538461537,8,3752,56,671
Better safe than sorry!,61,1,0.05140679705526445,2944,1.1475409836065573,7,47,53,671
When was the last time they closed the FDR Drive?,61,1,0.05140679705526445,2945,1.1475409836065573,7,67,53,671
My joints feel a little stiff too.,61,1,0.05140679705526445,2946,1.1475409836065573,7,183,53,671
Do you also bike at night?,61,2,0.05647217784814785,2947,1.1475409836065573,5,314,54,671
That yellow chain mail is as good as mine.,61,1,0.05140679705526445,2948,1.1475409836065573,7,389,53,671
There must be a mote in my eye.,61,2,0.05647217784814785,2949,1.1475409836065573,5,437,54,671
