caption,count,funny,precision,rank,score,somewhat_funny,target_id,unfunny,contest
"Armstrong? No, though I do get mistaken for Lance a lot.",9080,3082,0.008387053422117855,1,2.0365638766519822,3241,800,2757,671
It’s the swimming portion that I am most concerned with.,9649,3010,0.007839391203762333,2,2.028500362731889,3896,351,2742,671
I think you misunderstood 'ironman competition'.,8886,2601,0.008054016044829665,3,2.0082151699302275,3752,3641,2532,671
"Whew, I'm a lot rustier than I thought.",8527,2311,0.008095152784173311,4,1.9819397208865954,3748,2754,2468,671
"It started as a crusade, now it's just a commute.",7977,2198,0.00856412184716132,5,1.962015795411809,3271,2131,2508,671
I always said I'd take up cycling when I hit the middle ages.,7255,2028,0.00900993997831355,6,1.9615437629221226,2902,2692,2325,671
"I said, '""Wear your Under Armour.""",3655,963,0.012950946539155333,7,1.905061559507524,1382,3659,1310,671
You won't believe how many people want to shoot the messenger.,6991,1749,0.009272802042871255,8,1.8797024746102131,2640,1666,2602,671
"Costume party?  No, substitute teacher, seventh grade.",7220,1887,0.009311336484477711,9,1.878808864265928,2563,2686,2770,671
It’s just until I can afford health insurance.,4800,1153,0.011106240503344343,10,1.8695833333333334,1865,289,1782,671
Anyone wearing spandex shouldn’t judge anyone’s else’s fashion choices.,6457,1449,0.009619514998012767,11,1.817717206132879,2381,3423,2627,671
It’s honestly more comfortable than the seat.”,5725,1236,0.01008288371873952,12,1.8033187772925765,2112,688,2377,671
"It's your first Ironman, right?",4209,817,0.01139489306823773,13,1.8030411023996198,1746,1008,1646,671
Well the helmet would look stupid without the rest of it.,3240,661,0.01326420687701505,14,1.7969135802469136,1260,1616,1319,671
"It started with wearing a helmet like everyone else. Then I scraped my knee, so I started wearing knee pads, then it sort of snowballed",5504,1193,0.010390656855885794,15,1.793422965116279,1975,1289,2336,671
First time biking in New York City?,5097,1010,0.01046159301916056,16,1.786541102609378,1978,3284,2109,671
It even comes with knight vision.,3030,609,0.013858532189639505,17,1.765016501650165,1100,3717,1321,671
Water bottle? No that's WD-40.,1906,354,0.01702809551910222,18,1.762854144805876,746,1116,806,671
Stay clear of magnet schools.,2520,554,0.015733490130052784,19,1.7571428571428571,800,3109,1166,671
You said we were doing a century.  I picked the 13th.,3328,678,0.013384323692900886,20,1.7478966346153846,1133,3691,1517,671
"No, no! The coach suggested UNDER armor.",6179,1182,0.009594120252843633,21,1.742029454604305,2210,3117,2787,671
Surely you joust.,3503,702,0.013047860150211874,22,1.7336568655438196,1166,157,1635,671
"Normally, I wouldn't send a knight out on a bike like this.",4302,901,0.011999107082972173,23,1.7164109716410971,1276,1830,2125,671
I’m putting metal to the pedal.,2303,416,0.015689246514401727,24,1.7112462006079028,806,2923,1081,671
All attempts to pass me are feudal.”,3271,587,0.013123247879154976,25,1.7095689391623357,1145,1224,1539,671
Don’t ask. It was Amazon prime day.,3719,680,0.012475818863504075,26,1.6902393116429149,1206,1393,1833,671
This part isn't nearly as bad as the swim.,3524,545,0.012092351245867591,27,1.6872871736662882,1316,3460,1663,671
"The bike?  It’s a $15,000 carbon fibre kit that weighs 3.4 pounds. Why?",3595,662,0.01270344970331084,28,1.686230876216968,1136,3627,1795,671
I'm Medieval Knievel,3042,551,0.013792439882574462,29,1.6837606837606838,978,2661,1513,671
Laundry day.,1923,319,0.016917057921055818,30,1.6781071242849714,666,887,938,671
I just thought I was too old for Lycra and too young to die.,2142,359,0.01615775440954207,31,1.661998132586368,700,2860,1083,671
I'm in the middle age division.,1964,274,0.016012260085614228,32,1.660386965376782,749,2125,941,671
"It's New York, Mom.  Every day's a battle.",3836,596,0.011762951201358262,33,1.6569343065693432,1321,593,1919,671
"Laugh all you like, but I’ll get into the Met for free today!",1739,263,0.017440241707658753,34,1.6543990799309949,612,3339,864,671
"On thy left, fair maiden.",2392,388,0.015084085830454093,35,1.6525919732441472,778,1960,1225,671
"Dress for the job you want, not the job you have.",2284,350,0.015305881221061218,36,1.6471103327495622,778,1813,1156,671
It’s cheaper than health insurance,507,75,0.03220615311953492,37,1.6449704142011834,177,3220,255,671
Do you know where there's a White Castle around here?,2148,314,0.015542792004691927,38,1.6396648044692737,743,2998,1091,671
"Honey, I said NIGHT ride.",1450,198,0.018672338197586253,39,1.6337931034482758,523,3562,729,671
Do you know how expensive it is to keep a steed in Manhattan?,718,109,0.027390176326060247,40,1.6253481894150419,231,2484,378,671
Out for your knightly ride?,2579,369,0.014230091465015578,41,1.618844513377278,858,1017,1352,671
I'm between insurance plans.,1961,281,0.016327820526090466,42,1.6185619581845998,651,395,1029,671
I really want to be like Lance. A lot.,1413,210,0.019432232857968572,43,1.6185421089879688,454,764,749,671
Did you see a lion and scarecrow back there?,1579,231,0.018310877486339555,44,1.616212792906903,511,2575,837,671
This is not what I meant when I told you to bring protection,1479,215,0.01889367016795108,45,1.614604462474645,479,2148,785,671
"It burns calories, protects me against falls, and I get terrific reception on my cell phone.",1582,219,0.018041838740516507,46,1.6106194690265487,528,3245,835,671
Let me guess: You’re a Knight in riding armor?,1951,279,0.016181493057759004,47,1.6002050230650948,603,2085,1069,671
Right now?  I'm putting my metal to the pedal.,2331,312,0.01470042449150689,48,1.595023595023595,759,1598,1260,671
"Not sure why, but my sponsor said all my clothes had to be under armor.",2116,325,0.016057294312337198,49,1.5949905482041589,607,1895,1184,671
It’s SPF 150.,1682,231,0.017515812975132782,50,1.5945303210463733,538,2538,913,671
I used to race with Lance a lot.,1898,288,0.016964098828498086,51,1.5869336143308745,538,1853,1072,671
I work at the White House.,1334,206,0.020338728502982073,52,1.5862068965517242,370,1182,758,671
Lycra makes me chafe.,1626,210,0.017556751491345588,53,1.58610086100861,533,1126,883,671
"Honestly the armor is not so bad, it's the chastity belt that's the killer.",1137,166,0.02169720290854176,54,1.584872471416007,333,2466,638,671
It's my first Ironman.,1827,226,0.01620440433372937,55,1.5801860974274768,601,3442,999,671
"At least when they door me, I have the satisfaction of scratching their paint.",1274,173,0.020133590126267312,56,1.5745682888540031,386,199,715,671
"Oh, you meant a night ride.",1716,245,0.017583479574540133,57,1.5728438228438228,493,284,978,671
Obviously you have never ridden in this part of the city.,1641,213,0.01753864830302713,58,1.5716026812918953,512,1422,916,671
Are you sure your therapist wasn't using a metaphor?,991,120,0.022181953708439346,59,1.5711402623612514,326,1048,545,671
My therapist said I need to get off my high horse.,1262,167,0.02012531379605994,60,1.5625990491283677,376,1880,719,671
Everyone just assumes I have a good reason.,1015,129,0.0222145612253869,61,1.561576354679803,312,721,574,671
And my pants leg STILL gets caught in the gear!,1242,169,0.02043833302189116,62,1.5611916264090178,359,827,714,671
The horse is on backorder.,1235,138,0.01951477528877133,63,1.5595141700404858,415,2595,682,671
"Well, you said you wanted a knight out on the town.",358,44,0.0371494466388219,64,1.5558659217877095,111,2836,203,671
My mom is kind of overprotective.,1182,129,0.019850038439490354,65,1.5541455160744502,397,2032,656,671
My worst stage of a triathlon?  Probably swimming.,1251,139,0.019378266283193696,66,1.5531574740207834,414,2638,698,671
"If you see a dragon on a scooter,
let me know.",1011,134,0.022544058436370612,67,1.5420375865479723,280,1273,597,671
"Shirley, you joust?",1038,152,0.022845624585648455,68,1.5404624277456647,257,2392,629,671
Do you have any WD-40?,1068,128,0.021387646584958127,69,1.5402621722846441,321,1622,619,671
My wife took the horse today,1019,129,0.02219946177457287,70,1.5387634936211974,291,0,599,671
You said to wear protection.,1014,115,0.02166206321834277,71,1.5384615384615385,316,628,583,671
I wanted to be like Lance... a lot.,965,116,0.022525604441389825,72,1.5357512953367876,285,2420,564,671
"You have no idea what the Iron Man competition actually is, do you?",743,78,0.02486572399687744,73,1.5343203230148048,241,2349,424,671
"I'll admit, when I pre-ordered Tesla's ""eco-friendly armored vehicle"" for $70,000, I was sort of expecting a car...",622,86,0.02909504306896072,74,1.5289389067524115,157,933,379,671
It’s protection against the slings and arrows of outrageous fortune.,799,98,0.02490006412211182,75,1.5231539424280351,222,3505,479,671
"What, you’ve never lost a bet?",660,76,0.02698244529576056,76,1.5227272727272727,193,1206,391,671
The worst part is going to the rest room at Starbucks.,766,90,0.025172386780003452,77,1.5156657963446476,215,298,461,671
My wife says I’m having a middle age crisis.,740,83,0.02533073264676745,78,1.5121621621621621,213,3592,444,671
"You said on your profile ⁠— ""looking for a knight in shining armor.""",742,83,0.02528041265660477,79,1.5121293800539084,214,3338,445,671
Do you switch to chain mail in hotter weather?,715,77,0.025527339810625615,80,1.5104895104895104,211,713,427,671
Make fun all you want; you have no idea how high my deductible is.,725,96,0.026663458418720455,81,1.5103448275862068,178,2939,451,671
"Can't talk now, I'm on a crusade!",693,74,0.02588153050601414,82,1.505050505050505,202,2219,417,671
You wanna know what looks weird?  Those stretchy black pants.,678,68,0.025798056555866023,83,1.5044247787610618,206,3168,404,671
Navigating traffic and jaywalkers was a lot more fun before the police took away my lance.,520,58,0.030190855018348683,84,1.5038461538461538,146,3041,316,671
"It's laundry day, okay?",667,71,0.025976289789814373,85,1.502248875562219,190,3759,406,671
"I think I'm lost, is this not the cartoon with the dragon from last week?",668,89,0.02782642776608044,86,1.501497005988024,157,1877,422,671
Going out for bagels doesn’t qualify as a quest.,657,71,0.026656502975726266,87,1.5007610350076104,187,536,399,671
Spandex makes my butt look big.,630,74,0.027765716281538233,88,1.4984126984126984,166,2551,390,671
It's an easier way to get buns of steel.,608,63,0.027445742099346263,89,1.4983552631578947,177,3515,368,671
History is cyclical.,640,70,0.027084179744809322,90,1.496875,178,2182,392,671
The dragon was in last week's cartoon.,632,76,0.0278806692711382,91,1.4968354430379747,162,3081,394,671
My kingdom for a horse!,625,74,0.027930316219165228,92,1.496,162,785,389,671
I hate delivering for Round Table Pizza.,623,70,0.026916147978401337,93,1.4959871589085072,164,346,389,671
Aren’t you taking this Iron Man thing a little too seriously?,598,69,0.028375896329873855,94,1.491638795986622,156,3447,373,671
"Joan of Arc, what’s yours?",559,63,0.029181525874355133,95,1.4847942754919499,145,1367,351,671
I thought you said that this was an Iron Man competition,549,45,0.027473776191253834,96,1.482695810564663,175,2977,329,671
"You invited me out for a ""night ride""?",547,44,0.02742208025480978,97,1.482632541133455,176,2425,327,671
This is a cakewalk; the swim and the run are the hardest.,541,41,0.02725948045459794,98,1.4824399260628467,179,3100,321,671
I thought you said “dress for a knight ride.”,535,54,0.029077063189807788,99,1.480373831775701,149,863,332,671
It just got too expensive to keep a horse in the city.,535,62,0.030024662598415814,100,1.480373831775701,133,1637,340,671
You have to decide if the safety is worth the chafing.,535,53,0.0289564329414639,101,1.480373831775701,151,2004,331,671
I'm a bike messenger for Brinks.,535,56,0.02931683464914372,102,1.480373831775701,145,3577,334,671
I lost my healthcare coverage.,523,55,0.029680338850346002,103,1.4780114722753346,140,441,328,671
My lawyer told me to wear something court-appropriate.,513,49,0.029332769165067944,104,1.4775828460038987,147,1191,317,671
You said we were going to see Queens.,373,44,0.036122760776139934,105,1.477211796246649,90,2391,239,671
No...I said dress appropriately for a NIGHT ride.,520,57,0.030051280027882377,106,1.476923076923077,134,1897,329,671
"Sure, you're protected from concussions, cuts and scrapes but keep an eye out for lightning.",497,48,0.029872833574095634,107,1.476861167002012,141,651,308,671
"Its heavy, it hurts and its ruining my hair. But at least its not plastic.",492,58,0.03143471797790172,108,1.475609756097561,118,3438,316,671
Think we'll have enough momentum to clear the moat?,507,52,0.029971011830410663,109,1.47534516765286,137,1192,318,671
The best biking accessory for me has been WD-40.,504,41,0.0286208192195386,110,1.4742063492063493,157,1703,306,671
When you drink and joust they take away your horse.,502,60,0.031221736134243203,111,1.4741035856573705,118,2024,324,671
“How do I get to Queens?,494,52,0.030536884743166424,112,1.4716599190283401,129,1221,313,671
"Yeah, she took the castle *and* the horse in the divorce.",476,49,0.030946109649710077,113,1.468487394957983,125,2728,302,671
I’m heading home now; my knight shift is over!,310,36,0.03946312365702424,114,1.467741935483871,73,1205,201,671
Not bad for a Middle-Aged man huh?,368,31,0.033724922415442254,115,1.4673913043478262,110,3332,227,671
"I feel safer, but the chaffing is ridiculous.",473,42,0.030060532440505577,116,1.46723044397463,137,2382,294,671
"I'm a little rusty, but I think I can make it.",467,40,0.030028762870120077,117,1.4668094218415417,138,2639,289,671
"Titanium, lighter than it looks and matches my bike.",465,46,0.030272931423336865,118,1.4666666666666666,120,2909,299,671
"Well, all I can say is the genius who invented Bike to Work Day never worked at Medieval Times.",434,45,0.032458135245748095,119,1.4654377880184333,112,479,277,671
Because it has a lower carbon footprint than my horse.,460,41,0.030502367481869394,120,1.4652173913043478,132,2090,287,671
"Well, I would look stupid in just the helmet.",458,55,0.03256326752580148,121,1.465065502183406,101,2626,302,671
I thought I was ordering gear for ‘Night’ cycling.,459,45,0.031163261924342156,122,1.4640522875816993,123,1115,291,671
Do you think your second week in congress will go better?,455,45,0.03136003585032873,123,1.4637362637362636,121,2794,289,671
When I set up my on-line dating profile I didn't literally mean I wanted a knight in shining armor.,270,26,0.0404997062947774,124,1.462962962962963,73,2981,171,671
You’re right—I can see better with the visor up!,446,45,0.03181197737100979,125,1.4618834080717489,116,1850,285,671
"Metal to the pedal, baby.",439,42,0.03168606275061222,126,1.460136674259681,118,299,279,671
"Of course I'm wearing a helmet, Mom.",439,46,0.03233592632256499,127,1.460136674259681,110,3306,283,671
These helmet laws are getting out of hand.,439,37,0.030344611640792232,128,1.460136674259681,126,3618,276,671
I am a knight in riding armor.,437,48,0.03276535883450415,129,1.459954233409611,105,644,284,671
It's a tin speed.,390,52,0.03638495845343732,130,1.458974358974359,75,1304,263,671
"The clanging is annoying, but worse is the chafing.",429,40,0.03186641753647584,131,1.456876456876457,116,207,273,671
It won't help. He's still president.,429,53,0.03377473479636439,132,1.456876456876457,89,438,287,671
My horse is still finishing the swim.,319,36,0.038593153393315996,133,1.4545454545454546,73,1214,210,671
My mother is a little overprotective.,414,43,0.03321451428268525,134,1.4541062801932367,102,176,269,671
First time in New York?,414,37,0.031311084508133524,135,1.4541062801932367,111,1515,266,671
To the Cloisters.  Why do you ask?,388,39,0.034057207273284214,136,1.4536082474226804,98,796,251,671
My other bike is a horse.,294,31,0.03956317711066614,137,1.4523809523809523,71,94,192,671
Nobody likes a knight in shining spandex.,401,44,0.03417186882038711,138,1.4513715710723192,93,1827,264,671
"You said let’s ride any time, so I chose the Middle Ages.",401,32,0.03131587775753901,139,1.4513715710723192,115,2064,254,671
"Because I consider the rest of my body just as important as my head, that's why!",393,40,0.033913206222291825,140,1.4478371501272265,96,1590,257,671
"Yes, the visor does mess with my peripheral vision, but that’s where the rest of the armor comes in.",393,37,0.03333404685625772,141,1.4478371501272265,102,1913,254,671
I say “night ride” and your first thought is “knight ride”?,393,41,0.034104073780549964,142,1.4478371501272265,94,2126,258,671
Lance-less Armstrong,393,43,0.03448263958481428,143,1.4478371501272265,90,3151,260,671
This is nothing. The swim was a bitch!!,391,39,0.033845032245872625,144,1.4475703324808185,97,1331,255,671
Mind if I set the pace? I'm a bit rusty.,384,31,0.03265723605944008,145,1.4453125,109,2110,244,671
So you change at work then?,379,40,0.03480344285514056,146,1.4432717678100264,88,2363,251,671
"Really lowers the insurance.""",377,34,0.03370392937797586,147,1.442970822281167,99,1063,244,671
Turns out he wasn't a faithful steed.,377,35,0.03391259358833217,148,1.442970822281167,97,1330,245,671
"OK, I’ll admit it. Under Armour would have been a better choice.",375,32,0.033406408314254676,149,1.4426666666666668,102,2524,241,671
"No, I said I wanted to go for a night ride.",368,35,0.03449295750108076,150,1.440217391304348,92,3443,241,671
I just got dropped from my parents health care coverage.,368,26,0.030505939715097036,151,1.440217391304348,104,3664,238,671
"Yes,  it is really hot in here,  and stop calling me 'Rusty'.",366,38,0.0352694965620678,152,1.4398907103825136,85,2510,243,671
I always imagined you’d be riding a white horse.,366,41,0.03590057003968676,153,1.4398907103825136,79,3637,246,671
"""You save time with the aerodynamics but any bathroom break takes all day.""",366,32,0.033972198999714875,154,1.4398907103825136,97,3747,237,671
"On your left, m'lady.",361,40,0.03550710390530459,155,1.4376731301939059,76,225,245,671
Just the helmet? You must be new here.,357,34,0.03501620866137574,156,1.4369747899159664,88,720,235,671
I haven’t been on the road in ages.,357,27,0.03340626358780035,157,1.4369747899159664,102,2718,228,671
I'll take it off when this street gets a bike lane.,357,40,0.035794036934616774,158,1.4369747899159664,73,2767,244,671
You think Lycra chafes...,352,35,0.03559002877270815,159,1.4346590909090908,83,2748,234,671
"So, do you lance a lot  ?",352,39,0.034434177311279165,160,1.4346590909090908,69,3067,244,671
I figured it was the logical thing to wear over my Under Armour.,352,44,0.037581082923857305,161,1.4346590909090908,65,3174,243,671
I'm training for an Ironman.,350,35,0.03433343656527965,162,1.4342857142857144,78,372,237,671
It's cumbersome but cars feel threatened.,350,35,0.03573548286221399,163,1.4342857142857144,82,3211,233,671
What makes you say I'm having a middle age crisis?,348,29,0.0344699894650091,164,1.4339080459770115,93,988,226,671
"He who rests, rusts.",344,33,0.03570980148667623,165,1.433139534883721,83,930,228,671
I voted for Trump.,324,34,0.03754320382463455,166,1.4320987654320987,72,1966,218,671
"Gosh, I thought my parents were overprotective.  Yours are, like, from the Middle Ages.",341,31,0.035441289922086935,167,1.4310850439882699,85,1843,225,671
I think you dropped a gauntlet.,341,28,0.03470351748311073,168,1.4310850439882699,91,2858,222,671
This is why you are single,339,35,0.035465439793921215,169,1.4306784660766962,73,453,231,671
Is this the way to White Castle?,339,26,0.03434022497358877,170,1.4306784660766962,94,3650,219,671
Fair maiden...will this road lead me to Queens?,337,23,0.03370194258046728,171,1.4302670623145401,99,71,215,671
Passing on ye left!,333,33,0.03653756907785606,172,1.4294294294294294,77,286,223,671
My horse is in the shop.,332,27,0.03442951727015975,173,1.427710843373494,82,138,223,671
It's cheaper than having health insurance.,330,23,0.034168573840364994,174,1.4272727272727272,95,357,212,671
"I love the knight thing but I just can't ride a horse.""",330,29,0.0357493945177637,175,1.4272727272727272,83,2500,218,671
"'It's hot and heavy, but I saved 20% on medical insurance.""",330,27,0.03523033661991656,176,1.4272727272727272,87,3537,216,671
My friends told me to buy under armor but that stuff is WAY too expensive.,328,27,0.035378261365653786,177,1.4268292682926829,86,3721,215,671
It's been a while - I feel rusty.,289,20,0.03646125075345624,178,1.42560553633218,83,1728,186,671
Paleo is over. I'm going medieval on my body.,322,35,0.03793074370648185,179,1.4254658385093169,67,1745,220,671
"Not everyone can afford private health insurance, Jane.",322,25,0.03528805194689945,180,1.4254658385093169,87,3360,210,671
"With all the drive-by shootings, it was either this or a stretch limo.",319,24,0.03522486588775508,181,1.4231974921630095,87,1272,208,671
"In the long run, it’s cheaper than sunscreen.",319,31,0.035503617793429615,182,1.4231974921630095,69,2254,219,671
Pardon me.  Do you happen to have any grey poupon?,319,33,0.037659427416182764,183,1.4231974921630095,69,2821,217,671
I look ridiculous in bike shorts.,317,32,0.037565110305290576,184,1.4227129337539433,70,192,215,671
"Listen Merlin, I want my horse back.",317,34,0.038092897374464176,185,1.4227129337539433,66,3519,217,671
I'm a middle age biker.,315,32,0.0377354696572094,186,1.4222222222222223,69,738,214,671
But you said it was an Ironman triathalon,315,33,0.03800244824529308,187,1.4222222222222223,67,1394,215,671
Overprotective mother.,315,32,0.0377354696572094,188,1.4222222222222223,66,1914,217,671
I'm done swerving for jaywalkers,308,27,0.03693185449960072,189,1.4188311688311688,75,1153,206,671
I think you're training too literally for the Ironman.,306,25,0.027475969910660963,190,1.4183006535947713,60,1547,221,671
You know that only the helmet is required...,304,29,0.03784746942919621,191,1.417763157894737,69,2691,206,671
There’s not much work available since ‘Game of Thrones’ ended.,300,17,0.034524427341238124,192,1.4166666666666667,91,3614,192,671
I have an overprotective mother.,298,28,0.038089098620906925,193,1.4161073825503356,68,1525,202,671
Over Armour.  It’s a thing.,297,25,0.0372617871603091,194,1.4141414141414141,73,3034,199,671
"I'll tell you what, it's more effective than ankle weights.",293,17,0.03503748530698135,195,1.4129692832764504,87,950,189,671
I save 15 minutes cutting through the dog park.,293,23,0.03698492109331088,196,1.4129692832764504,75,2323,195,671
Time to put some metal to the pedal.,293,21,0.03634737107959712,197,1.4129692832764504,79,2550,193,671
I have a very high deductible.,293,24,0.037299609786413064,198,1.4129692832764504,73,2629,196,671
Then tell me why do they call it an Iron Man?,293,23,0.03698492109331088,199,1.4129692832764504,75,3436,195,671
I get stiff when it rains.,289,24,0.03765267523465004,200,1.411764705882353,71,413,194,671
"Now that I've tried both, I think I prefer the Under Armour.""",287,23,0.0375091779997658,201,1.411149825783972,72,518,192,671
'Tis a courtesy loaner from my farrier,285,29,0.039606481177710685,202,1.4105263157894736,59,3686,197,671
It’s a 10-steed,281,32,0.040949573913748705,203,1.4092526690391458,51,2426,198,671
I misread night ride.,284,25,0.038417230770060116,204,1.408450704225352,66,1400,193,671
Trust me. You’ll get practically the same noise by putting a baseball card in the spokes and it is sooo much easier.,284,26,0.03709914376098159,205,1.408450704225352,59,1466,199,671
"Don't look now, I just saw the Four Horsemen of the Apocalypse on two tandems behind us.",284,24,0.038091985140965484,206,1.408450704225352,68,3031,192,671
I said I was in the mood for amour,284,26,0.03873974584455314,207,1.408450704225352,64,3222,194,671
"Pardon me, but do you have any W40?",282,25,0.03860579060143499,208,1.4078014184397163,65,735,192,671
"'Thought I was getting a noble steed, not 6-speed.""",282,25,0.03860579060143499,209,1.4078014184397163,65,1244,192,671
"Chivalry is dead, but not from a head injury.",282,28,0.039574290777483076,210,1.4078014184397163,59,1765,195,671
"It's not breathable, but it is stainless.",282,18,0.03238397910878242,211,1.4078014184397163,71,3615,192,671
It's a Schwinn 10 steed,270,27,0.04050914862005702,212,1.4074074074074074,56,3658,187,671
Sunscreen would probably suffice.,280,16,0.03570404359026829,213,1.4071428571428573,82,2480,182,671
I cross-train with Shakespeare in the Park.,280,24,0.03846546290810358,214,1.4071428571428573,66,2946,190,671
You're not fooling anyone Lance!,278,26,0.039322025154571075,215,1.4064748201438848,61,349,191,671
This helmet just doesn't work without the suit.,278,23,0.03831847668829981,216,1.4064748201438848,67,1408,188,671
My insurance doesn't kick in until the end of the month.,278,19,0.03693802440555238,217,1.4064748201438848,75,2300,184,671
It seemed easier than getting my brakes fixed.,278,25,0.03899037907067681,218,1.4064748201438848,63,2345,190,671
It’s cheaper than healthcare.,278,21,0.035686350883067534,219,1.4064748201438848,64,2887,193,671
This is not what I meant when I said you should use protection.,274,29,0.040720373308406506,220,1.405109489051095,53,1061,192,671
This kit received the highest rating on crash tests.,274,25,0.03887279139443869,221,1.405109489051095,60,3695,189,671
I haven't been riding in ages.,272,25,0.039586721966256025,222,1.4044117647058822,60,142,187,671
"A neon green helmet? Sharon, you look like a nerd.",272,27,0.04026628620283345,223,1.4044117647058822,56,837,189,671
Your other bike is a horse?,272,21,0.0381913348675322,224,1.4044117647058822,68,1413,183,671
Have you seen the way New Yorkers drive? A helmet isn’t enough,272,20,0.03729271374270626,225,1.4044117647058822,69,1747,183,671
"I know it's a bit clunky.  But when I fall down, I skin the asphalt!",272,21,0.0381913348675322,226,1.4044117647058822,68,2277,183,671
