caption,count,funny,precision,rank,score,somewhat_funny,target_id,unfunny,contest
I'm on my way... I'm about 900 years out.,91,4,0.0543064228666571,1809,1.2307692307692308,13,990,74,671
Sir Cumnavigate on your left.,91,6,0.05863094791125815,1810,1.2307692307692308,9,991,76,671
"I can't afford a broken bone, okay?!",91,3,0.05200949259867792,1811,1.2307692307692308,15,1012,73,671
I’m training for my first Ironman Triathlon.,91,3,0.05200949259867792,1812,1.2307692307692308,15,1054,73,671
"Well, I’m ready for those famous New York City potholes!",91,3,0.05200949259867792,1813,1.2307692307692308,15,1078,73,671
Very nice to meet you Guinevere...people call me Lance...a lot.,91,6,0.05863094791125815,1814,1.2307692307692308,9,1103,76,671
I think it's your chain.,91,2,0.04960632092961228,1815,1.2307692307692308,17,1105,72,671
We have to swim after this?,91,2,0.04960632092961228,1816,1.2307692307692308,17,1112,72,671
"Actually, I'm training for Ironman.",91,4,0.0543064228666571,1817,1.2307692307692308,13,1125,74,671
"My kingdom for a bike, really?",91,1,0.0470806417965117,1818,1.2307692307692308,19,1144,71,671
My trusty steed hath taken a self-care day.,91,3,0.05200949259867792,1819,1.2307692307692308,15,1145,73,671
I'll dismount when the yellow beast is gone,91,4,0.0543064228666571,1820,1.2307692307692308,13,1278,74,671
Would you like some water?,91,5,0.05651006820711174,1821,1.2307692307692308,11,1292,75,671
Cosplay triathlon training is a bitch.,91,5,0.05651006820711174,1822,1.2307692307692308,11,1306,75,671
"It's the latest chastity suit by GrabMeNot, Inc.",91,4,0.0543064228666571,1823,1.2307692307692308,13,1333,74,671
"This is great and all, but I think my last ride had more horsepower",91,4,0.0543064228666571,1824,1.2307692307692308,13,1356,74,671
"Actually I said a ""night ride""",91,4,0.0543064228666571,1825,1.2307692307692308,13,1357,74,671
And what are these 'bike lanes' you speak of?,91,4,0.0543064228666571,1826,1.2307692307692308,13,1434,74,671
Do you mind if I go on ahead? I'm late for a joust.,91,2,0.04960632092961228,1827,1.2307692307692308,17,1444,72,671
You're the one who wanted to ride with a visor.,91,2,0.04960632092961228,1828,1.2307692307692308,17,1484,72,671
OMG! You're David Hasselhoff!,91,6,0.05863094791125815,1829,1.2307692307692308,9,1497,76,671
Who needs a bike lane when you got this on?,91,5,0.05651006820711174,1830,1.2307692307692308,11,1527,75,671
I really need to recharge after working the night shift all week.,91,5,0.05651006820711174,1831,1.2307692307692308,11,1530,75,671
Now you’re in a Medieval cycle?,91,2,0.04960632092961228,1832,1.2307692307692308,17,1609,72,671
I'll never sign another contract without reading it!,91,2,0.04960632092961228,1833,1.2307692307692308,17,1683,72,671
Jousting was never a big deal until we got married.,91,2,0.04960632092961228,1834,1.2307692307692308,17,1783,72,671
"Hang on princess, I'm coming to your rescue.",91,4,0.050822113280262274,1835,1.2307692307692308,12,1807,75,671
. . . and I have almost always have 4 bars.,91,1,0.0470806417965117,1836,1.2307692307692308,19,1812,71,671
Why are we riding boy's bikes?,91,4,0.0543064228666571,1837,1.2307692307692308,13,1864,74,671
"Sorry, there were no white horses",91,3,0.05200949259867792,1838,1.2307692307692308,15,1891,73,671
How many grams is your Carbon fiber armor?,91,4,0.0543064228666571,1839,1.2307692307692308,13,1894,74,671
They’re big in Europe.,91,3,0.05200949259867792,1840,1.2307692307692308,15,1919,73,671
They weren't kidding - this gives you a body of steel,91,5,0.05651006820711174,1841,1.2307692307692308,11,1964,75,671
Yes honey; I'll stop by the cleaners and pick up your suit.,91,2,0.04960632092961228,1842,1.2307692307692308,17,1981,72,671
"I was shopping for a new helmet online and I used the keywords ‘Arm,’ ‘Strong,’ and ‘Lance.’ I have no idea what went wrong.",91,3,0.05200949259867792,1843,1.2307692307692308,15,1984,73,671
My trusty steed only had two gears.,91,4,0.0543064228666571,1844,1.2307692307692308,13,2055,74,671
But what if it rains,91,2,0.04960632092961228,1845,1.2307692307692308,17,2104,72,671
Do You Know Where the Joust path is?,91,1,0.0470806417965117,1846,1.2307692307692308,19,2222,71,671
"BTW, did you pack the WD-40?",91,4,0.0543064228666571,1847,1.2307692307692308,13,2235,74,671
"Once more unto the bike path, dear friends, once more!",91,1,0.0470806417965117,1848,1.2307692307692308,19,2292,71,671
I think it would be more appropriate if you were on a horse.,91,1,0.0470806417965117,1849,1.2307692307692308,19,2326,71,671
Wrong place at the wrong time,91,3,0.05200949259867792,1850,1.2307692307692308,15,2333,73,671
"Sure, sure, but on the downhill...!",91,4,0.0543064228666571,1851,1.2307692307692308,13,2377,74,671
Wait until you scrape YOUR knee,91,4,0.0543064228666571,1852,1.2307692307692308,13,2389,74,671
It hasn't been the same without Lance.,91,5,0.05651006820711174,1853,1.2307692307692308,11,2454,75,671
I don't advise a visor.,91,2,0.04960632092961228,1854,1.2307692307692308,17,2458,72,671
My white horse doesn't do cities.,91,1,0.0470806417965117,1855,1.2307692307692308,19,2548,71,671
I thought we were going for a knight ride?,91,4,0.0543064228666571,1856,1.2307692307692308,13,2584,74,671
What mosquitoes?,91,2,0.04960632092961228,1857,1.2307692307692308,17,2590,72,671
"Uh-Oh!  My GPS says, ‘Up Escalator 100 Feet’!",91,4,0.0543064228666571,1858,1.2307692307692308,13,2637,74,671
My white horse moved to the burbs.,91,2,0.038522540146915446,1859,1.2307692307692308,13,2651,76,671
"‘Safety over style, noob.’",91,2,0.04960632092961228,1860,1.2307692307692308,17,2653,72,671
It's competition not war.,91,1,0.0470806417965117,1861,1.2307692307692308,19,2656,71,671
You think you're helmet will protect you,91,2,0.04960632092961228,1862,1.2307692307692308,17,2695,72,671
"No, just late for my gig at Medieval Times.",91,1,0.0470806417965117,1863,1.2307692307692308,19,2701,71,671
It's the original sportswear.,91,3,0.04960632092961228,1864,1.2307692307692308,14,2714,74,671
"Onst thou left, fair damsel.",91,3,0.05200949259867792,1865,1.2307692307692308,15,2737,73,671
"And, it's a lot less upkeep than your horse!",91,3,0.05200949259867792,1866,1.2307692307692308,15,2803,73,671
I said I wanted something suitable for NIGHT riding.,91,4,0.0543064228666571,1867,1.2307692307692308,13,2830,74,671
"Yeah, sometimes the ""Ironic Outfit"" angle takes a lot of commitment. I might switch to a Steampunk Tuba shtick.",91,6,0.05863094791125815,1868,1.2307692307692308,9,2834,76,671
You wouldn't believe how much I've saved on my insurance since I bought this suit.,91,3,0.05200949259867792,1869,1.2307692307692308,15,2835,73,671
I thought you said you wanted to try poly-armory,91,3,0.05200949259867792,1870,1.2307692307692308,15,2919,73,671
Listen when I lay it down.,91,3,0.048359972643412096,1871,1.2307692307692308,14,2953,74,671
Don't bother calling me.  I don't have my phone.,91,3,0.05200949259867792,1872,1.2307692307692308,15,3003,73,671
Nice outfit.  But wouldn't brakes make you even safer?,91,4,0.0543064228666571,1873,1.2307692307692308,13,3011,74,671
My horse is already on the festival grounds.,91,4,0.0543064228666571,1874,1.2307692307692308,13,3015,74,671
What? It's no dumber than your fanny pack.,91,5,0.05651006820711174,1875,1.2307692307692308,11,3084,75,671
The suit came with the bike.,91,5,0.05651006820711174,1876,1.2307692307692308,11,3115,75,671
I miss Rudy Giuliani too.,91,3,0.05200949259867792,1877,1.2307692307692308,15,3215,73,671
You're saying they want to take the character in another direction?,91,2,0.04960632092961228,1878,1.2307692307692308,17,3249,72,671
My landlord doesn’t allow horses,91,2,0.04960632092961228,1879,1.2307692307692308,17,3311,72,671
Trustier than that steed of mine.,91,2,0.04960632092961228,1880,1.2307692307692308,17,3350,72,671
This heat wave sucks!,91,3,0.05200949259867792,1881,1.2307692307692308,15,3375,73,671
Am I the only one that heard “Ironman?”,91,4,0.0543064228666571,1882,1.2307692307692308,13,3387,74,671
'Dress for Success' they said,91,6,0.05863094791125815,1883,1.2307692307692308,9,3415,76,671
The King’s training for the Tour de France and I’m his security.,91,2,0.04960632092961228,1884,1.2307692307692308,17,3457,72,671
"No, health insurance.",91,3,0.05200949259867792,1885,1.2307692307692308,15,3547,73,671
It was a suggestion from my therapist.,91,3,0.05200949259867792,1886,1.2307692307692308,15,3672,73,671
The cycling experience in this city has become purely medieval.,91,2,0.04960632092961228,1887,1.2307692307692308,17,3731,72,671
You’re so brave Celeste. I’ve never been comfortable night riding.,96,3,0.05017331074496788,1888,1.2291666666666667,16,2378,77,671
"On thy behalf, m'lady, I shall slay the four-wheeled monsters.",92,4,0.05377142984298548,1889,1.2282608695652173,13,103,75,671
UberStallion was experiencing surge pricing....,92,5,0.05594871053561895,1890,1.2282608695652173,11,233,76,671
It's not that far to the Armoury.,92,2,0.04912823608557884,1891,1.2282608695652173,17,328,73,671
Medal to the pedal...I'll race you!,92,4,0.05377142984298548,1892,1.2282608695652173,13,611,75,671
I'm raising money for the Medieval Bikers' Foundation.,92,3,0.05150218562468723,1893,1.2282608695652173,15,622,74,671
"There are other types of visors, you know..?",92,3,0.046633593445508804,1894,1.2282608695652173,13,660,76,671
"Ohh, I thought you wanted to go knight riding.",92,5,0.05594871053561895,1895,1.2282608695652173,11,718,76,671
I need this in Manhattan.,92,3,0.04912823608557884,1896,1.2282608695652173,14,757,75,671
I'm training for iron man,92,0,0.043997732832518,1897,1.2282608695652173,21,908,71,671
"This way, if they cut me up, I put a dent in their chassis.",92,5,0.05594871053561895,1898,1.2282608695652173,11,914,76,671
"So that's why they call it a ""knight ride""",92,5,0.05594871053561895,1899,1.2282608695652173,11,923,76,671
I wanted my outfit to match my helmet.,92,2,0.045334823987982095,1900,1.2282608695652173,16,1002,74,671
"I thought it was ridiculous, too, but the guy at the shop kept saying ""Steel is Real"", so... here we are.",92,3,0.05150218562468723,1901,1.2282608695652173,15,1066,74,671
Is the President back in town?,92,5,0.05594871053561895,1902,1.2282608695652173,11,1361,76,671
I can’t hear you because of the clanking!,92,3,0.043997732832518,1903,1.2282608695652173,13,1428,76,671
"Of course she is a better negotiator than I am. She trots from home 3 days a week, and here I am wearing last year's armor.",92,4,0.05377142984298548,1904,1.2282608695652173,13,1620,75,671
The Tour de France is crazy dangerous.,92,5,0.05594871053561895,1905,1.2282608695652173,11,1680,76,671
"Don't sweat now, we haven't got the oil can with us and you've been squeaking enough as it is!",92,3,0.05150218562468723,1906,1.2282608695652173,15,1725,74,671
Think of me as the armored car of bicycle delivery.,92,2,0.04912823608557884,1907,1.2282608695652173,17,1821,73,671
The GPS states the city is to the right.,92,3,0.05150218562468723,1908,1.2282608695652173,15,1962,74,671
I have the passcode to lower the drawbridge.,92,2,0.04912823608557884,1909,1.2282608695652173,17,2166,73,671
Just out for a Knight time bike ride,92,4,0.05377142984298548,1910,1.2282608695652173,13,2238,75,671
The last thing I remember was being served a drink while visiting the New Yorker Magazine offices,92,5,0.05594871053561895,1911,1.2282608695652173,11,2260,76,671
"Yes, I’m putting the metal to the pedal.",92,4,0.05377142984298548,1912,1.2282608695652173,13,2324,75,671
"It's not a Schwinn, it's a Lochinvar.",92,5,0.05594871053561895,1913,1.2282608695652173,11,2455,76,671
Can't talk. I'm at Knight cycle.,92,4,0.05377142984298548,1914,1.2282608695652173,13,2571,75,671
Will you be my girlfriend now?,92,5,0.05594871053561895,1915,1.2282608695652173,11,2731,76,671
Is your suit titanium or carbon fiber?,92,4,0.05377142984298548,1916,1.2282608695652173,13,2792,75,671
I really need to do a wash.,92,3,0.05150218562468723,1917,1.2282608695652173,15,2943,74,671
You must be from the Nanny State.,92,4,0.05377142984298548,1918,1.2282608695652173,13,2959,75,671
Did your blacksmith also make your bicycle?,92,2,0.04912823608557884,1919,1.2282608695652173,17,3119,73,671
I have never felt that a helmet is enough protection,92,5,0.05594871053561895,1920,1.2282608695652173,11,3213,76,671
Because parking at the joust is just too expensive.,92,2,0.04912823608557884,1921,1.2282608695652173,17,3307,73,671
It's a new clothing line from Steph Curry ...it's called Outer Armour.,92,5,0.05594871053561895,1922,1.2282608695652173,11,3402,76,671
It’s my first triathlon. But everyone kept saying I should do the Ironman.,92,0,0.043997732832518,1923,1.2282608695652173,21,3543,71,671
It’s my Knight Rider kit.,92,4,0.05032920973450761,1924,1.2282608695652173,12,3617,76,671
"It worked for Mick Jagger, didn't it?",92,4,0.05377142984298548,1925,1.2282608695652173,13,3679,75,671
We're almost there.  Then I can take off this insect repellent outfit.,93,1,0.04619468188464644,1926,1.2258064516129032,19,3558,73,671
It somewhat levels the playing field.,89,1,0.04727726928669147,1927,1.2247191011235956,18,31,70,671
I'm just a knight on a bike asking a girl to love him.,89,1,0.04727726928669147,1928,1.2247191011235956,18,54,70,671
I hope it rains.,89,0,0.04449469155183755,1929,1.2247191011235956,20,108,69,671
"Believe it or not, it was my lack of confidence that was really slowing me down",89,4,0.05478346498667158,1930,1.2247191011235956,12,282,73,671
I love how romantic the city looks when I'm knight riding.,89,2,0.04990493769277262,1931,1.2247191011235956,16,466,71,671
"...oh yes, I love it. But the rust stains can be a handful.",89,2,0.04990493769277262,1932,1.2247191011235956,16,597,71,671
"My Mom made me wear it
or
I fall a lot
or
It's a great conversation starter",89,1,0.04727726928669147,1933,1.2247191011235956,18,671,70,671
"No, it's carbon fibre.",89,3,0.05240100591622927,1934,1.2247191011235956,14,868,72,671
Is that a Trusty Steed road bike?,89,4,0.05478346498667158,1935,1.2247191011235956,12,1284,73,671
"My insurance at Monty Python Pizza is a joke.""",89,1,0.04727726928669147,1936,1.2247191011235956,18,1318,70,671
This outfit keeps the seat from giving me a wedgie.,89,3,0.05240100591622927,1937,1.2247191011235956,14,1324,72,671
And to think I thought chivalry was dead.,89,1,0.04727726928669147,1938,1.2247191011235956,18,1532,70,671
"It's not the same, but my cholesterol was out of control.",89,2,0.04990493769277262,1939,1.2247191011235956,16,1643,71,671
"Sure, he's trusty, but he wouldn't fit on the subway.",89,3,0.05240100591622927,1940,1.2247191011235956,14,1955,72,671
You must be roasting.,89,4,0.05478346498667158,1941,1.2247191011235956,12,2117,73,671
"Breathable Gore-Tex? No, I'm pretty sure you said, ""Medieval war techs"".",89,2,0.04990493769277262,1942,1.2247191011235956,16,2118,71,671
"Can't hear you, got New York in my other ear.",89,3,0.05240100591622927,1943,1.2247191011235956,14,2319,72,671
I said I needed full protection.,89,1,0.04727726928669147,1944,1.2247191011235956,18,3216,70,671
"Yes, there are sparks.",89,2,0.04990493769277262,1945,1.2247191011235956,16,3242,71,671
But you wanted me to show my masculine side.,89,2,0.04990493769277262,1946,1.2247191011235956,16,3576,71,671
It is air-conditioned!,90,0,0.041137926942822464,1947,1.2222222222222223,19,1451,71,671
"So, how did you lose your horse?",90,2,0.04941045135965652,1948,1.2222222222222223,16,1714,72,671
That’s what happens when you reach middle-age,90,1,0.04681564710038359,1949,1.2222222222222223,18,2969,71,671
I'm unable to peddle to let's stick to the downhills.,87,2,0.050194189481096475,1950,1.2183908045977012,15,50,70,671
I’m training for a Spartan race.,87,3,0.052789817806336015,1951,1.2183908045977012,13,128,71,671
I didn't know they had a stricter helmet law here.,87,1,0.04745680616415606,1952,1.2183908045977012,17,211,69,671
Safety first...,87,1,0.04745680616415606,1953,1.2183908045977012,17,350,69,671
This bike wasn't built for a Lance.,87,3,0.052789817806336015,1954,1.2183908045977012,13,367,71,671
I'm guessing you've never crashed on your bike?,87,4,0.05526366862947198,1955,1.2183908045977012,11,596,72,671
"Forsooth, I have only one job in
 Le Tour: to protect my king of the mountain.",87,5,0.05763142612108451,1956,1.2183908045977012,9,654,73,671
"Sorry , when I'm on the phone chivalry is dead.",87,1,0.04745680616415606,1957,1.2183908045977012,17,841,69,671
Need an oil can break?,87,0,0.04455154593210369,1958,1.2183908045977012,19,1003,68,671
"This is my last madcap gesture, Jennifer!",87,2,0.050194189481096475,1959,1.2183908045977012,15,1027,70,671
I am ready to battle traffic.,87,2,0.050194189481096475,1960,1.2183908045977012,15,1073,70,671
Yes. Almost there and dressed as Knight Rider; just like you asked.,87,4,0.05526366862947198,1961,1.2183908045977012,11,1113,72,671
My codpiece? Had to leave it. Way too heavy.,87,5,0.05763142612108451,1962,1.2183908045977012,9,1203,73,671
This outfit?  Have you seen the bike lanes in Manhattan?,87,2,0.050194189481096475,1963,1.2183908045977012,15,1218,70,671
"Go get your own draft, my lady.",87,3,0.052789817806336015,1964,1.2183908045977012,13,1220,71,671
Well the under armor makes it quite comfortable.,87,1,0.04745680616415606,1965,1.2183908045977012,17,1487,69,671
My toga is at the cleaners.,87,4,0.05526366862947198,1966,1.2183908045977012,11,1501,72,671
I still prefer my aulde metal frame.,87,5,0.05763142612108451,1967,1.2183908045977012,9,1516,73,671
I'm late for stage rehearsal.,87,2,0.050194189481096475,1968,1.2183908045977012,15,1667,70,671
No road leads away from Rome.,87,5,0.05763142612108451,1969,1.2183908045977012,9,1671,73,671
"You know, those things aren't foolproof.",87,4,0.05526366862947198,1970,1.2183908045977012,11,1705,72,671
"Sir, this is the Tour de France.",87,1,0.04745680616415606,1971,1.2183908045977012,17,1824,69,671
"Well, once I realized I was the only round thing at that table I knew something had to change.",87,2,0.050194189481096475,1972,1.2183908045977012,15,1829,70,671
"Please Don Quixote, don’t try attack Trump tower again.",87,3,0.052789817806336015,1973,1.2183908045977012,13,1889,71,671
I guess you could say I’m Spandex non-conforming.,87,2,0.050194189481096475,1974,1.2183908045977012,15,1990,70,671
I was canned today so Cheryl took off work to join me in a spin.,87,3,0.052789817806336015,1975,1.2183908045977012,13,2200,71,671
"Good Sire, methinks it would behoove you to buy shares in metals.""",87,6,0.05990567154378588,1976,1.2183908045977012,7,2284,74,671
It's made of Titanium alloys and weighs only 36 pounds,87,2,0.04745680616415606,1977,1.2183908045977012,14,2388,71,671
"Lance? My arm IS strong, but I'm a sword fighter.",87,3,0.052789817806336015,1978,1.2183908045977012,13,2609,71,671
"It doesn't look like it, but I'm telling you it's a one-piece Spandex jumpsuit.",87,3,0.052789817806336015,1979,1.2183908045977012,13,2879,71,671
Japanese beetle season.,87,2,0.050194189481096475,1980,1.2183908045977012,15,2889,70,671
Thanks for breaking wind.,87,4,0.05526366862947198,1981,1.2183908045977012,11,2912,72,671
All I can be today is your knight in sweaty armor.,87,2,0.050194189481096475,1982,1.2183908045977012,15,3077,70,671
We're approaching Manhattan. Get ready.,87,1,0.04745680616415606,1983,1.2183908045977012,17,3106,69,671
The party's theme is Hasselhoff TV shows.,87,0,0.027963428193117458,1984,1.2183908045977012,16,3137,71,671
what do you mean --I'm in the wrong century,87,3,0.052789817806336015,1985,1.2183908045977012,13,3474,71,671
He threw down a gauntlet,87,4,0.05526366862947198,1986,1.2183908045977012,11,3763,72,671
It's just a little added protective gear.,88,0,0.044112233475599005,1987,1.2159090909090908,19,122,69,671
So Amazon put Under Amour on sale with a 3 hour delivery window. I like it.,88,3,0.05224546106377937,1988,1.2159090909090908,13,136,72,671
It's not what I meant by a night ride.,88,1,0.04698001875328986,1989,1.2159090909090908,17,303,70,671
You should always be careful riding at night,88,2,0.04968254403624252,1990,1.2159090909090908,15,414,71,671
Not my regular gig...I'm just a freelancer,88,4,0.054688401161677745,1991,1.2159090909090908,11,566,73,671
I'm gonna cut through Hunts Point.,88,5,0.05702678529843941,1992,1.2159090909090908,9,590,74,671
"If it was good enough for Sir Lancelot, it's good enough for me.",88,2,0.04104456264052583,1993,1.2159090909090908,13,591,73,671
"I promise, in the fall, I’ll move out of my mother’s place.",88,5,0.05702678529843941,1994,1.2159090909090908,9,663,74,671
It's a new millenial thing called Joustcycling,88,4,0.054688401161677745,1995,1.2159090909090908,11,675,73,671
I guess I misunderstood when you said you wanted to go on a night ride.,88,4,0.054688401161677745,1996,1.2159090909090908,11,719,73,671
I only have two hands. If you keep calling of course I'm going to lose my lance a lot.,88,4,0.054688401161677745,1997,1.2159090909090908,11,762,73,671
"Yes, I am the night rider.",88,3,0.05224546106377937,1998,1.2159090909090908,13,788,72,671
I still have SPF 60 all over.  Can't be too careful.,88,1,0.04698001875328986,1999,1.2159090909090908,17,1096,70,671
Crumble zone,88,2,0.04968254403624252,2000,1.2159090909090908,15,1109,71,671
"Without your bike, this would be a one knight stand.",88,4,0.054688401161677745,2001,1.2159090909090908,11,1230,73,671
"I know it looks silly, but my healthcare deductible went through the roof this year. 

Steve Manderscheid, Minneapolis, MN",88,5,0.05702678529843941,2002,1.2159090909090908,9,1238,74,671
I go down Hills much faster now!,88,3,0.05224546106377937,2003,1.2159090909090908,13,1329,72,671
"Geeze Stan, way to put the pedal to the metal!",88,2,0.04968254403624252,2004,1.2159090909090908,15,1652,71,671
I've cycled 'round to wearing both armour *and* Under Armour.,88,3,0.05224546106377937,2005,1.2159090909090908,13,1660,72,671
"Yes, it's awesome that Herman Melville lived on this island, but be damned sure to watch your tushy on this next turn.",88,2,0.04968254403624252,2006,1.2159090909090908,15,1701,71,671
"Didn’t  Merlin teach not to text and ride, Lance.",88,5,0.05702678529843941,2007,1.2159090909090908,9,1986,74,671
The bike path is perfect for jousting practice--a conveyor belt of oncoming targets.,88,4,0.054688401161677745,2008,1.2159090909090908,11,2042,73,671
You really should wear glasses for knight riding.,88,2,0.04968254403624252,2009,1.2159090909090908,15,2229,71,671
Had to give up the horse - too big of a methane footprint.,88,2,0.04968254403624252,2010,1.2159090909090908,15,2241,71,671
What? Your voicemail said you wanted to go for a knight ride.,88,3,0.05224546106377937,2011,1.2159090909090908,13,2407,72,671
"They say that biking is 80% ""hardwear""!",88,3,0.05224546106377937,2012,1.2159090909090908,13,2417,72,671
My wife always tells me I'm too literal.,88,1,0.04698001875328986,2013,1.2159090909090908,17,2418,70,671
"Yeah, I thought it was an Under Armor endorsement....",88,3,0.05224546106377937,2014,1.2159090909090908,13,2473,72,671
I told you we were not going to bike in the night!,88,2,0.04968254403624252,2015,1.2159090909090908,15,2501,71,671
What do you think? Does it make me look fat?,88,4,0.054688401161677745,2016,1.2159090909090908,11,2798,73,671
arrowdynamic,88,1,0.04698001875328986,2017,1.2159090909090908,17,2897,70,671
Don’t Stress Irma.  The FlexPak will release your frozen arm soon.,88,2,0.04968254403624252,2018,1.2159090909090908,15,2931,71,671
ever since dad took the training wheels off..........,88,3,0.05224546106377937,2019,1.2159090909090908,13,2974,72,671
You will be safer with all that armor on,88,3,0.05224546106377937,2020,1.2159090909090908,13,3022,72,671
I often bike in a rough neighborhood.,88,3,0.05224546106377937,2021,1.2159090909090908,13,3124,72,671
Your not David Hasselhoff!,88,0,0.044112233475599005,2022,1.2159090909090908,19,3135,69,671
"Without your lance, how can you make your armstrong?",88,4,0.054688401161677745,2023,1.2159090909090908,11,3192,73,671
"Well, you said  ""get Under Armour workout clothes.""",88,3,0.05224546106377937,2024,1.2159090909090908,13,3236,72,671
I am going to the White House after for a meeting with the President.,88,2,0.04968254403624252,2025,1.2159090909090908,15,3272,71,671
You got metal to the pedal?,88,0,0.044112233475599005,2026,1.2159090909090908,19,3331,69,671
I won’t be the one with a sore ass tomorrow.,88,1,0.04698001875328986,2027,1.2159090909090908,17,3495,70,671
Excuse me. Where did you get your helmet ?,88,1,0.04698001875328986,2028,1.2159090909090908,17,3522,70,671
"I get that all the time. But no, I'm not the Knight Rider.",88,4,0.054688401161677745,2029,1.2159090909090908,11,3574,73,671
"I think what he actually said was , “Wanna spend the night in Armonk”?!",88,3,0.05224546106377937,2030,1.2159090909090908,13,3636,72,671
The only thing that kill me in this outfit is riding uphill.,88,4,0.054688401161677745,2031,1.2159090909090908,11,3668,73,671
The white steed is in the shop.,84,2,0.05101221145533819,2032,1.2142857142857142,14,64,68,671
"But they said, ""No refunds.""",84,1,0.04503911913297603,2033,1.2142857142857142,15,317,68,671
But you said it was a knight ride,84,4,0.05375041813985267,2034,1.2142857142857142,9,432,71,671
"It's renaissance faire day at work, and I didn't have chainmail.",84,4,0.056355737798860085,2035,1.2142857142857142,10,494,70,671
I always enjoy going for a ride at knight time!,84,3,0.05375041813985267,2036,1.2142857142857142,12,515,69,671
"So you are the Knight rider? 
Cool helmet.",84,4,0.056355737798860085,2037,1.2142857142857142,10,538,70,671
"I was looking for some bike kit that was a bit more durable, but this was all the Met had in stock.",84,3,0.05375041813985267,2038,1.2142857142857142,12,600,69,671
"You think it's awkward now, but at night, it's SHINING!",84,3,0.05375041813985267,2039,1.2142857142857142,12,634,69,671
