target_id,score,precision,count,rank,caption,funny,unfunny,somewhat_funny,contest
1245,1.3012820512820513,0.04448015309581283,156,825,Yes master... open tuna can now.,9,119,28,677
1357,1.3012820512820513,0.04306291374859299,156,826,IIII Wiilll FFeeeedddd the cat.,6,115,35,677
1383,1.3012820512820513,0.047623308056168476,156,827,I've been a bad little doggie and I crave your discipline...,11,120,25,677
1731,1.3012820512820513,0.04306291374859299,156,828,"You are in a deep catnap, open the fridge and pass the smoked salmon ..",6,115,35,677
1872,1.3012820512820513,0.044942635797161956,156,829,Now show me where you hide the cat food!,8,117,31,677
2202,1.3012820512820513,0.044942635797161956,156,830,"Following his death, Freud's experiments with hypnotism continued despite his reincarnation as a cat",8,117,31,677
2312,1.3012820512820513,0.04401281093565317,156,831,"Finally, the chicken leg is on the top shelf.
I’ll wait here.",7,116,33,677
2614,1.3012820512820513,0.041097306099562955,156,832,Must...build...tuna...castle...,4,113,39,677
2700,1.3012820512820513,0.044942635797161956,156,833,"I must put the left over tuna in the cat's dish, I must put the left over tuna in the cat's dish.",8,117,31,677
2707,1.3012820512820513,0.040078368014458646,156,834,"...slowly, slowly, ... one small step,  ...now reach to the left...",3,112,41,677
3105,1.3012820512820513,0.044942635797161956,156,835,...now the cat would have TEN lives.,8,117,31,677
2448,1.2993630573248407,0.04087976673740338,157,836,"I'm playing along, but know that it is fully my idea to feed you at this absurd hour.",4,114,39,677
22,1.2960526315789473,0.04461095506414591,152,837,That Darn Cat! He only does this when there's leftover salmon.,7,114,31,677
107,1.2960526315789473,0.04461095506414591,152,838,"Feed the cat, then make a lasagna for the cat, and then take over the world with the cat",7,114,31,677
263,1.2960526315789473,0.04461095506414591,152,839,"That’s right, Dave, this all a dream.",7,114,31,677
342,1.2960526315789473,0.04652326367761186,152,840,Telekinetic Fluffy's naughty night at the sink,9,116,27,677
639,1.2960526315789473,0.04745052622423986,152,841,"You will tell all your friends we’re excellent, hassle-free pets, who are way smarter and cleaner than dogs and not at all cold and shunning of all affection,  or secretly planning your demise while you lie asleep in bed at night.",10,117,25,677
660,1.2960526315789473,0.04557713996595138,152,842,You had me at Meow.,8,115,29,677
868,1.2960526315789473,0.04557713996595138,152,843,The Catocalypse has begun.,8,115,29,677
949,1.2960526315789473,0.04461095506414591,152,844,You are NOT a dog person. You are a cat person.,7,114,31,677
971,1.2960526315789473,0.04557713996595138,152,845,"Now, retrieve the salmon from the fridge and return to bed until further instruction from me.",8,115,29,677
1434,1.2960526315789473,0.04652326367761186,152,846,Another innocent seized from sleep by the dreaded catpurr beam.,9,116,27,677
1489,1.2960526315789473,0.041577905003898616,152,847,Sphinx says what?,4,111,37,677
1621,1.2960526315789473,0.04557713996595138,152,848,I liked it better when you just sat on my face and tried to suffocate me.,8,115,29,677
1681,1.2960526315789473,0.04745052622423986,152,849,You WILL tell everyone you're a cat person until it's annoying.,10,117,25,677
1786,1.2960526315789473,0.041577905003898616,152,850,"You know, as a cartoonist, I sometimes regret I gave you a superpower.",4,111,37,677
2169,1.2960526315789473,0.04745052622423986,152,851,You WILL keep filling my bowl with catnip.,10,117,25,677
2307,1.2960526315789473,0.04461095506414591,152,852,Tweety Bird should be free.  Tweety Bird should be free.  Tweety Bird should be ...,7,114,31,677
2608,1.2960526315789473,0.04745052622423986,152,853,"No, Mel...you're sleepwalking. I know a catnap when I see one !",10,117,25,677
2646,1.2960526315789473,0.04261291541603195,152,854,Tomcatatonia,5,112,35,677
3056,1.2960526315789473,0.04461095506414591,152,855,OPEN THE FRIDGE.  TAKE OUT BROILED CHICKEN &FISH. PLACE IN KITTY'S BOWL.....,7,114,31,677
6,1.2933333333333332,0.04491768924221898,150,856,You really are the cat's pajamas.,7,113,30,677
103,1.2933333333333332,0.04287922445234526,150,857,Now continue to the open window and let’s see if you also have nine lives.,5,111,34,677
196,1.2933333333333332,0.04590298754409706,150,858,The origin of Paul's catatonia.,8,114,28,677
226,1.2933333333333332,0.04491768924221898,150,859,That's why I just take little cat naps during the day.,7,113,30,677
286,1.2933333333333332,0.04182275016090678,150,860,It’s the 3rd night of slipping my captor Ambien...my plan is finally ready to be implemented!!,4,110,36,677
303,1.2933333333333332,0.04073888771688119,150,861,Fish. Get fish. Fish...,3,109,38,677
717,1.2933333333333332,0.04391028749903124,150,862,"Forget Meow Mix. You have a sudden desire for liver, chicken liver, and give most of it to your feline friend.",6,112,32,677
742,1.2933333333333332,0.04182275016090678,150,863,I must...clean...the litter box.,4,110,36,677
838,1.2933333333333332,0.04182275016090678,150,864,Must put dog outside.,4,110,36,677
853,1.2933333333333332,0.04491768924221898,150,865,What’s the matter?  Cat got your tongue?,7,113,30,677
1040,1.2933333333333332,0.04491768924221898,150,866,When you adopt a cat named Ambien,7,113,30,677
1064,1.2933333333333332,0.04491768924221898,150,867,"Feed me, Seymour, feed me.",7,113,30,677
1071,1.2933333333333332,0.04182275016090678,150,868,Catwalk innovation for NYFW 2019.,4,110,36,677
1107,1.2933333333333332,0.04391028749903124,150,869,Must ... open ... all the ... tuna.,6,112,32,677
1163,1.2933333333333332,0.04491768924221898,150,870,I see you got into my catnip.,7,113,30,677
1192,1.2933333333333332,0.04182275016090678,150,871,"Ok, this is the last time I give the cat catnip.",4,110,36,677
1205,1.2933333333333332,0.0468675764690954,150,872,Must-take-you-off-senior-cat-food.,9,115,26,677
1286,1.2933333333333332,0.04287922445234526,150,873,"Now veeery slowly, open a can of tuna...",5,111,34,677
1366,1.2933333333333332,0.04590298754409706,150,874,Take out the fish..take out the fish.. Take out the fish..,8,114,28,677
1548,1.2933333333333332,0.04491768924221898,150,875,Tuuunaaa.,7,113,30,677
1588,1.2933333333333332,0.04491768924221898,150,876,Oh goody! He's taking  Ambien again.,7,113,30,677
1688,1.2933333333333332,0.03962538976206641,150,877,"Now turn left at the refrigerator,get out the milk and pour it in a bowl and put it on the counter ,then turnaround and walk  back to the bedroom and when you hear a meow you will fall into a deep sleep.",2,108,40,677
1752,1.2933333333333332,0.0468675764690954,150,878,She was right ... her pussy is ... very powerful.,9,115,26,677
1763,1.2933333333333332,0.04391028749903124,150,879,You WILL give me TWO cans of wet food this morning,6,112,32,677
1829,1.2933333333333332,0.04182275016090678,150,880,Open the cabinet and place my catnip on the counter. Return to bed with no memory of this.,4,110,36,677
1843,1.2933333333333332,0.04391028749903124,150,881,You WILL find the can opener.,6,112,32,677
1910,1.2933333333333332,0.04182275016090678,150,882,... and when you awaken you will  have no memory of feeding me your leftover salmon.,4,110,36,677
1931,1.2933333333333332,0.04287922445234526,150,883,You missed my 4:30 AM feeding!,5,111,34,677
1932,1.2933333333333332,0.04491768924221898,150,884,Guess I was only allowed a cat-nap,7,113,30,677
1943,1.2933333333333332,0.04073888771688119,150,885,"For the kingdom the power and the tuna are yours, forever and ever, amen.",3,109,38,677
1953,1.2933333333333332,0.04491768924221898,150,886,Feline control mechanism #37: sleep feeding.,7,113,30,677
1977,1.2933333333333332,0.04590298754409706,150,887,"Nightly, the voice calls...I must give...grain free tuna treats...",8,114,28,677
2011,1.2933333333333332,0.03905673801649582,150,888,"Now that I've got him, what do I do with him?",6,115,29,677
2092,1.2933333333333332,0.0468675764690954,150,889,Hypno-cat,9,115,26,677
2130,1.2933333333333332,0.04491768924221898,150,890,"Fixta-puss frigatorium mangio!
Fixta-puss frigatorium mangio!!",7,113,30,677
2139,1.2933333333333332,0.04781270942646401,150,891,He's not sleepwalking; he's catnotised.,10,116,24,677
2188,1.2933333333333332,0.04287922445234526,150,892,This will be a cat-astrophic event for you my purrrsonal servant.,5,111,34,677
2449,1.2933333333333332,0.03962538976206641,150,893,That's it...sleep walk right over to the treats. Such a good person!,2,108,40,677
2520,1.2933333333333332,0.04590298754409706,150,894,Now THAT was a weird tuna dream!,8,114,28,677
2545,1.2933333333333332,0.04391028749903124,150,895,"The lox is in the crisper, under the arugula, put it on the counter, don’t bother slicing it, then turn around and go back to bed.",6,112,32,677
2560,1.2933333333333332,0.04391028749903124,150,896,Will you stop this if I apologize for that laser toy?,6,112,32,677
2698,1.2933333333333332,0.04287922445234526,150,897,"A new metaphysical state somewhere between hunger, dreaming, and cat videos was discovered.",5,111,34,677
2757,1.2933333333333332,0.04287922445234526,150,898,"Must. Serve. Le Bernardin's yellowfin tuna carpaccio, with Iberico ham ""chutney"" and sea beans, drizzled with lemon-EVOO.",5,111,34,677
2787,1.2933333333333332,0.04590298754409706,150,899,"Tuna, tuna, tuna; don't care if it's dolphin-free.",8,114,28,677
2856,1.2933333333333332,0.04073888771688119,150,900,Now who’s the cat’s meow?,3,109,38,677
2859,1.2933333333333332,0.04491768924221898,150,901,Why do I have this sudden urge to open a can of tuna?,7,113,30,677
2865,1.2933333333333332,0.03962538976206641,150,902,I wonder what Freud would say about this.,2,108,40,677
2926,1.2933333333333332,0.04491768924221898,150,903,No wonder the Pharaohs worshipped cats.,7,113,30,677
2949,1.2933333333333332,0.04182275016090678,150,904,I will open the fridge.  I will get out the tuna.,4,110,36,677
53,1.2905405405405406,0.042070623235642805,148,905,Jim appeared catatonic as he made his way to the kitchen.,4,109,35,677
171,1.2905405405405406,0.04522967310855908,148,906,Must .... kill ... dog.,7,112,29,677
188,1.2905405405405406,0.04096350419676244,148,907,Thank goodness they will never really understand  our power.,3,108,37,677
202,1.2905405405405406,0.046234748759610964,148,908,Are those my pajamas?,8,113,27,677
208,1.2905405405405406,0.04522967310855908,148,909,"Yes, that's a good human. Now relinquish all of your prized possessions, so that I may tear them apart while I make you watch.",7,112,29,677
223,1.2905405405405406,0.04420174958245293,148,910,You will cook me a chicken...and remember to buy more of the catnip you bought from the fortune teller.,6,111,31,677
267,1.2905405405405406,0.04420174958245293,148,911,"Ha ha Pavlov, who's salivating now? I learned a few things while you were obsessing over that dog.",6,111,31,677
333,1.2905405405405406,0.04314934533446183,148,912,Snacks outside tonight Jon-boy. Open the screen door.,5,110,33,677
844,1.2905405405405406,0.04522967310855908,148,913,The good stuff is in the fridge,7,112,29,677
861,1.2905405405405406,0.042070623235642805,148,914,Must...open...three...cans...of...tuna...,4,109,35,677
901,1.2905405405405406,0.04314934533446183,148,915,"Yes, John. Come into the kitchen...and fix me a snack. You know the kind...the albacore tuna.",5,110,33,677
917,1.2905405405405406,0.03982562005444409,148,916,"Yes Master, catnaps are for cats.",2,107,39,677
1398,1.2905405405405406,0.04314934533446183,148,917,"More tuna...yes, master...",5,110,33,677
1461,1.2905405405405406,0.042070623235642805,148,918,Tuna...you want tuna...a plate of tuna...on the counter...,4,109,35,677
1576,1.2905405405405406,0.046234748759610964,148,919,Why we prefer dogs.,8,113,27,677
1657,1.2905405405405406,0.04522967310855908,148,920,The cat is the king. Long live the cat.,7,112,29,677
2090,1.2905405405405406,0.04420174958245293,148,921,"Excellent, now go get some milk.",6,111,31,677
2237,1.2905405405405406,0.049126754247925356,148,922,You keep waking me up like this and I'll make you into an outdoor cat.,11,116,21,677
2248,1.2905405405405406,0.04096350419676244,148,923,"You will find the dog, and you will dispose of the dog.",3,108,37,677
2508,1.2905405405405406,0.03982562005444409,148,924,The difference between men and  cats is that cats never sleep........... walk.,2,107,39,677
2540,1.2905405405405406,0.04096350419676244,148,925,Tuna salad...tuna salad...tuna salad...,3,108,37,677
2554,1.2905405405405406,0.04314934533446183,148,926,Catatonia is a beautiful thing.,5,110,33,677
2914,1.2905405405405406,0.04420174958245293,148,927,I will get you your milk and then get rid of the dog.,6,111,31,677
2924,1.2905405405405406,0.04522967310855908,148,928,You will open the draw.  The one where you hide the catnip.  You will then place the catnip on the counter on front of the cat.  Return to your bed. You will do this every night from now on.,7,112,29,677
3022,1.2905405405405406,0.04096350419676244,148,929,I have this thing for cats!,3,108,37,677
3067,1.2905405405405406,0.04314934533446183,148,930,I...will...take...you...to...the...Cats...movie.,5,110,33,677
462,1.289655172413793,0.04581869293791897,145,931,"I will feed the cat.
I will feed the cat.
I will feed the cat.",7,110,28,677
1237,1.289655172413793,0.041427175381471504,145,932,"You are in my power.
The can opener is on the right",3,106,36,677
2403,1.289655172413793,0.04581869293791897,145,933,"Lord Fluffyboots the Second commands breakfast. If it's not salmon, I send it back. If it's in the dog's dish again, I send it back. Katpish?",7,110,28,677
3021,1.289655172413793,0.04367816091954024,145,934,...and then when I tap your nose three times you'll wake up and won't remember any of this.,5,108,32,677
56,1.2876712328767124,0.04657256375606114,146,935,The tuna's in the fridge. The tuna's in the fridge.,8,112,26,677
57,1.2876712328767124,0.042321512846945075,146,936,You will feed me the left over ahi tuna...,4,108,34,677
238,1.2876712328767124,0.04554701289352375,146,937,Must. Open. Door. Close. Door. Open. Door....,7,111,28,677
255,1.2876712328767124,0.04554701289352375,146,938,"Catatonic man, catatonic.",7,111,28,677
469,1.2876712328767124,0.04119025538115267,146,939,"When I scratch you, you will awake and get me cream.",3,107,36,677
676,1.2876712328767124,0.044497832219482995,146,940,Zap!  I command you to get a buncha 50-something liberal mofos to compete at captioning this shit.,6,110,30,677
812,1.2876712328767124,0.044497832219482995,146,941,Now hop on one foot and bark like a dog.,6,110,30,677
835,1.2876712328767124,0.04757601292775531,146,942,Must.  Feed.  Cat.,9,113,24,677
984,1.2876712328767124,0.0434233089589416,146,943,Listen carefully.  You will open the refrigerator and return to bed.,5,109,32,677
1103,1.2876712328767124,0.0434233089589416,146,944,"You're feeling very, very sleepy. And hungry. For...tuna.",5,109,32,677
1111,1.2876712328767124,0.04757601292775531,146,945,FRESH king salmon. FRESH king salmon...,9,113,24,677
1421,1.2876712328767124,0.04657256375606114,146,946,Men have only one thing on their mind.,8,112,26,677
1471,1.2876712328767124,0.04002703869979662,146,947,"Where, kitty, kitty? Where, kitty, kitty",2,106,38,677
1568,1.2876712328767124,0.044497832219482995,146,948,Why didn't I dog-sit for Pavlov instead of cat-sitting for Schrödinger?,6,110,30,677
1647,1.2876712328767124,0.04554701289352375,146,949,You are under my power. Give me that fresh salmon that  I saw you put in the refrigerator now.,7,111,28,677
1694,1.2876712328767124,0.04002703869979662,146,950,Repeat after me:  Cats are man's best friend.,2,106,38,677
1813,1.2876712328767124,0.042321512846945075,146,951,Not the soy milk this time!,4,108,34,677
2097,1.2876712328767124,0.0434233089589416,146,952,Yes. Bring me the thumbs.,5,109,32,677
2127,1.2876712328767124,0.0434233089589416,146,953,Now...puuuut the dog out....,5,109,32,677
2257,1.2876712328767124,0.0434233089589416,146,954,"That's it Harry, now open the fridge and pull out cat food.",5,109,32,677
2262,1.2876712328767124,0.04657256375606114,146,955,"When I scratch my claws three times, you shall turn from a can opener back into Marvin!",8,112,26,677
2309,1.2876712328767124,0.04119025538115267,146,956,"When I snap my tail, you’ll leave the steak on the floor and go back to bed...and bark like a dog.",3,107,36,677
2322,1.2876712328767124,0.0434233089589416,146,957,"Okay, but this Super Kitty gig is only gonna last until I find the catnip",5,109,32,677
2346,1.2876712328767124,0.04757601292775531,146,958,Hypnosis works,9,113,24,677
2451,1.2876712328767124,0.0434233089589416,146,959,"Yes, master. A bowl of warm milk with brandy, coming up.",5,109,32,677
2466,1.2876712328767124,0.04554701289352375,146,960,I've got this guy so whipped.,7,111,28,677
2611,1.2876712328767124,0.03943256485990019,146,961,Now---Open The Refrigerator.,6,113,27,677
2619,1.2876712328767124,0.04119025538115267,146,962,Get the cat treats from the second drawer. When you wake up you’ll remember nothing of this episode.,3,107,36,677
2743,1.2876712328767124,0.0434233089589416,146,963,Must unlatch the doggie door.,5,109,32,677
2767,1.2876712328767124,0.04757601292775531,146,964,Open fridge. Get out leftover tuna.,9,113,24,677
2788,1.2876712328767124,0.0434233089589416,146,965,This is one rude awakening he’ll never forget.,5,109,32,677
3111,1.2876712328767124,0.0434233089589416,146,966,Now left 90 degrees,5,109,32,677
3122,1.2876712328767124,0.042321512846945075,146,967,"When you awaken, you'll believe you are a guy who doesn't mind cat butt on his kitchen counter.",4,108,34,677
1757,1.2867132867132867,0.04282726802487756,143,968,"Hey, how's that Ambien working for you? My cat's getting fat...",4,106,33,677
2392,1.2867132867132867,0.046148174993094856,143,969,"For the last time Mittens, you were not in The Last Supper.",7,109,27,677
2846,1.2867132867132867,0.04823525855297529,143,970,Since he’s been taking Ambien I get my sleep walking snack.,9,111,23,677
1791,1.2857142857142858,0.04390949720562358,154,971,"Think tuna, tuna, tuna.",7,117,30,677
110,1.2836879432624113,0.04538057144769253,141,972,Garfield could never do this.,6,107,28,677
194,1.2836879432624113,0.04538057144769253,141,973,"Since trying cat hypnosis, Lucas hasn't been sleeping as well.",6,107,28,677
332,1.2836879432624113,0.04538057144769253,141,974,You will now feed me canned food ON the counter.,6,107,28,677
420,1.2836879432624113,0.0430901615189789,141,975,"Sleep walking tonight. Next, he will feed me again!",4,105,32,677
520,1.2836879432624113,0.0430901615189789,141,976,Stop. Turn left. Open refrigerator.......,4,105,32,677
907,1.2836879432624113,0.04538057144769253,141,977,"I will prepare your Chicken Liver Sundae, Master.",6,107,28,677
1031,1.2836879432624113,0.0442501880484751,141,978,"So, you like laser beams?",5,106,30,677
1433,1.2836879432624113,0.0442501880484751,141,979,Now open the door and pour the cream....,5,106,30,677
1678,1.2836879432624113,0.047560808551858784,141,980,You will now put hot sauce in the dog food,8,109,24,677
1956,1.2836879432624113,0.046483474348555806,141,981,The power of the pussy,7,108,26,677
2196,1.2836879432624113,0.0442501880484751,141,982,My handler at the CIA is going to love this trick.,5,106,30,677
2275,1.2836879432624113,0.04538057144769253,141,983,Clean my kitty litter,6,107,28,677
2483,1.2836879432624113,0.04538057144769253,141,984,"I am a cat person, I am a cat person, I am a cat person...",6,107,28,677
2493,1.2836879432624113,0.046483474348555806,141,985,"There is no dog, there is no dog....",7,108,26,677
2509,1.2836879432624113,0.046483474348555806,141,986,You are feline generous...,7,108,26,677
2510,1.2836879432624113,0.04067096967794416,141,987,"Who’s obsessed with laser pointers now, human?!",2,103,36,677
2686,1.2836879432624113,0.0430901615189789,141,988,"And now, the liver pâté, leave it on the counter...""_Anne Shellabarger, Goleta, C",4,105,32,677
3085,1.2836879432624113,0.04189802975245938,141,989,What's in it for YOU,3,104,34,677
43,1.2805755395683454,0.04454238758035183,139,990,One Ambien too many.,5,105,29,677
44,1.2805755395683454,0.04335619767464587,139,991,Now open the fridge and get me some shrimp.,4,104,31,677
51,1.2805755395683454,0.04792512425674259,139,992,Opposoble thumbs would be so much easier.,8,108,23,677
120,1.2805755395683454,0.046824706304139325,139,993,"(Catnosis at work) OK, Dave now open the fridge and grab the milk",7,107,25,677
199,1.2805755395683454,0.04335619767464587,139,994,"Open sardine tin, open sardine tin, open sardine tin.",4,104,31,677
283,1.2805755395683454,0.04569779760462853,139,995,"Sorry, your x-ray vision doesn’t impress me at 3:30 a.m.",6,106,27,677
288,1.2805755395683454,0.04792512425674259,139,996,I'll believe it' s for real when he eats the Purina.,8,108,23,677
298,1.2805755395683454,0.04213662851068718,139,997,Tuna. Must … have … tuna.,3,103,33,677
309,1.2805755395683454,0.046824706304139325,139,998,The power of toxoplasmosis compels you...,7,107,25,677
314,1.2805755395683454,0.046824706304139325,139,999,The true cause of catatonic schizophrenia.,7,107,25,677
340,1.2805755395683454,0.04569779760462853,139,1000,Catatonic mind-control,6,106,27,677
361,1.2805755395683454,0.04213662851068718,139,1001,You are herewith ordered to immediately provide cat treats.,3,103,33,677
369,1.2805755395683454,0.04569779760462853,139,1002,New Study Shows Sleepwalking May Actually Be Caused by Hypnotization from Your Cat Wanting a Midnight Snack,6,106,27,677
417,1.2805755395683454,0.04569779760462853,139,1003,The motion sensor hidden in the stuffed cat registers 'intruder'. Automated reporting is passed to headquarters. Armed response is initiated. Things go rapidly downhill from there.,6,106,27,677
456,1.2805755395683454,0.04569779760462853,139,1004,Who knew my Cat Scan would give us such a connection,6,106,27,677
539,1.2805755395683454,0.04454238758035183,139,1005,Thaaat's right!  Toooppp draaawer!,5,105,29,677
544,1.2805755395683454,0.04335619767464587,139,1006,"You WILL make a Catnip &
Cheese sandwhich - 
for ME, for ME!!",4,104,31,677
675,1.2805755395683454,0.046824706304139325,139,1007,FEED ME!,7,107,25,677
972,1.2805755395683454,0.04569779760462853,139,1008,"Yes, take the milk. Now spill it.",6,106,27,677
1034,1.2805755395683454,0.04569779760462853,139,1009,My human on Ambien is such fun to mess with,6,106,27,677
1153,1.2805755395683454,0.04454238758035183,139,1010,"Good human, now open the fridge and get me some tuna.",5,105,29,677
1199,1.2805755395683454,0.04569779760462853,139,1011,"All those failed experiments with mice but, ha, I should have known all along it would work with Albert.",6,106,27,677
1320,1.2805755395683454,0.04213662851068718,139,1012,...feed steak...feed steak...feed ...,3,103,33,677
1384,1.2805755395683454,0.04454238758035183,139,1013,It might be a sleep-walking cat burglar.,5,105,29,677
1385,1.2805755395683454,0.04335619767464587,139,1014,"I could have had a tabby, but no, I pick the hell cat.",4,104,31,677
1466,1.2805755395683454,0.04569779760462853,139,1015,My cats will always be the boss of me.”,6,106,27,677
1474,1.2805755395683454,0.04569779760462853,139,1016,I'm already catatonic.,6,106,27,677
1484,1.2805755395683454,0.040880692847508636,139,1017,I won't let you sleep until you give me catnip,2,102,35,677
1519,1.2805755395683454,0.04569779760462853,139,1018,"Good, very good. Now human, open five different cans of food for me to choose from.",6,106,27,677
1537,1.2805755395683454,0.04213662851068718,139,1019,"Just a little further, then a sharp left ...",3,103,33,677
1581,1.2805755395683454,0.046824706304139325,139,1020,"You'll post about me on social media, you'll post about me...",7,107,25,677
1586,1.2805755395683454,0.04569779760462853,139,1021,"Now, where did you hide the catnip?",6,106,27,677
1637,1.2805755395683454,0.04335619767464587,139,1022,"Fluffy, using her mental powers to extract another midnight snack from her sleeping master, put a new spin on catatonia . . .",4,104,31,677
1707,1.2805755395683454,0.04569779760462853,139,1023,Tonight I want extra catnip with that Tuna Sandwich.,6,106,27,677
1771,1.2805755395683454,0.04454238758035183,139,1024,Suggestion: you will put your pet cat in your next cartoon.,5,105,29,677
1825,1.2805755395683454,0.04335619767464587,139,1025,"Hocus Pocus! Bring me Tuna or Meat, whatever is closest!",4,104,31,677
1867,1.2805755395683454,0.04900083621306406,139,1026,"I was happier when he hissed, scratched, and peed on everything.",9,109,21,677
1870,1.2805755395683454,0.04335619767464587,139,1027,"Phil, trust me. I know catatonic behavior when I see it. You really should see a doctor.",4,104,31,677
2056,1.2805755395683454,0.04213662851068718,139,1028,Hypno-kitty strikes again!,3,103,33,677
2058,1.2805755395683454,0.04213662851068718,139,1029,"Yes, master. The Tuna Delight or the Chicken and Carrots.",3,103,33,677
2103,1.2805755395683454,0.046824706304139325,139,1030,It’s about time...after 7 lives of practice!,7,107,25,677
2239,1.2805755395683454,0.04454238758035183,139,1031,I feel certain that I will regret not filming this.,5,105,29,677
2366,1.2805755395683454,0.04454238758035183,139,1032,I miss when I was the master.,5,105,29,677
2516,1.2805755395683454,0.04454238758035183,139,1033,And all these years I thought it was the Ambien.,5,105,29,677
2584,1.2805755395683454,0.04335619767464587,139,1034,"You are totally in my power”, get me the lobster salad”",4,104,31,677
2607,1.2805755395683454,0.04454238758035183,139,1035,Must get tuna. Must get tuna.,5,105,29,677
2621,1.2805755395683454,0.046824706304139325,139,1036,So that is where my Smart Phone went.,7,107,25,677
2631,1.2805755395683454,0.04569779760462853,139,1037,"You will feed the cat, pet the cat, love the cat....",6,106,27,677
2643,1.2805755395683454,0.04792512425674259,139,1038,Don't get so excited; I just have to pee.,8,108,23,677
