target_id,score,precision,count,rank,caption,funny,unfunny,somewhat_funny,contest
1259,2.10791646430306,0.007165364509640195,10295,1,The leftover salmon. Into my dish. You will remember nothing.,3348,2245,4702,677
239,2.0454545454545454,0.007671555715240619,9614,2,Must....return....new....puppy...,2954,2521,4139,677
1045,2.024855836150328,0.00797337131675859,10058,3,"Remember all the times I ran into the wall chasing that red dot? Who's laughing now, Gary?",3345,3096,3617,677
2281,1.9263593380614656,0.008579105123633642,8460,4,Now it is I who will post videos of you on the internet.,2351,2978,3131,677
2683,1.925384963768116,0.007941387285603363,8832,5,The ahi. Not the canned.,2174,2846,3812,677
1347,1.9253679453007302,0.008265139414627802,8629,6,For 13 years Fred inexplicably woke up with fingertips that smelled like tuna.,2254,2904,3471,677
2408,1.924718574108818,0.008611527005766844,8528,7,Having nine lives: awesome. Controlling one human: priceless.,2407,3054,3067,677
2154,1.924065841643638,0.008350648326013697,8323,8,"When you wake, you won't miss the dog, the new kitten, or the liver pate.",2135,2775,3413,677
2427,1.9202161883927422,0.009108559549487841,7771,9,Why we never heard much about Pavlov's cat.,2233,2862,2676,677
112,1.8494764397905759,0.01176145196100298,4584,10,Your fish is my command.,1160,1850,1574,677
1003,1.8416203568294822,0.009054038114363294,6838,11,"Whenever I am in the kitchen, it's time to feed the cat.  Whenever I am in the kitchen, it's time...",1468,2556,2814,677
2044,1.8403477300952118,0.009939934091175832,7247,12,"You will not vote for someone who ""grabs em' by the pussy.",2117,3280,1850,677
2484,1.830914083954492,0.010938819226456136,5098,13,"Repeat after me, I will never again dress my cat for Halloween.",1201,2066,1831,677
2672,1.8191053580206455,0.009212040548348831,6103,14,"That's right: just open the fridge, put the tuna salad on the floor and walk away.",1140,2252,2711,677
1114,1.8132407720961734,0.010131765239889682,5906,15,"You will obey my every whim. Oh wait, you already do.",1349,2457,2100,677
2533,1.803185617410503,0.00945295012453884,6341,16,"Excellent. Now get the dog, get in the car, and drive it back to the shelter.",1304,2558,2479,677
1029,1.7963495257257833,0.008909423732690876,6958,17,When you awake you will forget you have fed me.,1366,2789,2803,677
1168,1.7659954116747387,0.012957305679712053,3923,18,Schroedinger's cat liked to keep Keith awake and asleep at the same time.,940,1858,1125,677
121,1.7640825432236475,0.013047130397390808,3586,19,Catatonic State,771,1617,1198,677
398,1.736,0.013461589263210855,3250,20,"You will open the door, you will open a can of cat food, you will taste the cat food, and see if  YOU think it tastes like tuna.",641,1499,1110,677
2037,1.7350157728706626,0.0112368675502776,4438,21,Who's got the laser pointer now?,817,1997,1624,677
665,1.7343680709534368,0.01136535168752888,4510,22,"As it was in ancient Egypt, so shall it be on East 48th.",881,2084,1545,677
8,1.732595573440644,0.010939855109455018,4970,23,"Of course, being a cat, Mr. Fluffy never used his powers for good.",1003,2340,1627,677
323,1.7031478770131772,0.014151773212275924,2732,24,"Artie couldn't figure out why he was so tired every morning, and the cat was never hungry.",465,1278,989,677
1648,1.701872129989403,0.014585458037397175,2831,25,Purrfect.. now take the tuna fish out of the refrigerator... and put the dog in the freezer.,556,1400,875,677
1401,1.6843910806174958,0.014220078483545392,2915,26,"Open the frig door, Hal.",544,1464,907,677
1873,1.6834782608695653,0.03026885754776123,575,27,"Small can, lower shelf",89,271,215,677
567,1.681201550387597,0.013835976559375334,3096,28,"You never thought I’d actually catch the laser, did you Tom?",584,1573,939,677
968,1.6783898305084746,0.016065453161329415,2360,29,Frank would come to regret adopting a cat at the area 51 meetup.,461,1220,679,677
198,1.6742351816443595,0.011029257617647989,4184,30,I will uncage the canary...I will uncage the canary...,608,1973,1603,677
1597,1.6721355567509413,0.011976705173406677,3718,31,"...and you will continue to believe that your are the boss""",592,1818,1308,677
2576,1.6567164179104477,0.014064289760655345,2680,32,The dog peed on the carpet. The dog hates you. The dog must go!,408,1328,944,677
1774,1.643266475644699,0.013821812832218047,2792,33,"When I say 'meow', you will feed me liver pate from Katz's Deli.",424,1420,948,677
777,1.637000700770848,0.019376055479391634,1427,34,"Dave couldn't explain why, he just knew he was a cat person.",217,735,475,677
2229,1.6266986410871302,0.015060597147438353,2502,35,"Now, YOU use the litter box.",420,1356,726,677
585,1.624252311038608,0.01729772201380774,1839,36,We built the pyramids this way as well.,290,981,568,677
1090,1.6212854181064271,0.019802109661233424,1447,37,"The aliens discovered that taking the form of this fuzzy master breed got them food, shelter, free rein to study the humans with nothing asked in return. And they could bite them every now and then.",240,788,419,677
828,1.6167734420500874,0.01801142659674782,1717,38,Look what I dragged in.,275,933,509,677
540,1.6166842661034846,0.01116873996988041,3788,39,"Yes, that’s it. Now open the door and hand me the tuna...",453,1909,1426,677
636,1.6088595664467484,0.015628800440821124,2122,40,There's always something the animal shelter fails to mention,297,1127,698,677
2543,1.6078703703703703,0.015750283313778212,2160,41,"Andrew Lloyd Webber, this is your conscience speaking, you should write a musical about cats, you should write a musical about cats, you should write a musical about cats, you should wr...",321,1168,671,677
2144,1.6064837905236908,0.01621555929729293,2005,42,I wish I'd discovered this power eight lives ago.,289,1078,638,677
785,1.5825352112676057,0.017293016272957967,1775,43,"After years of failed attempts to operate the can opener when he wanted a midnight snack, Felix finally turned to the occult.",255,996,524,677
2030,1.5802011646373744,0.01735422756488343,1889,44,"And when I snap my fingers you'll  . . . . oh, damn.",307,1100,482,677
2091,1.5800947867298578,0.022460939823348337,1055,45,Pinning this on Ambien was genius.,152,595,308,677
2553,1.5601394538059268,0.016955735963340754,1721,46,"The dog is a liar, a gossip, and a climate change denier...the dog is a liar, a gossip, and a climate change denier...",218,978,525,677
2163,1.5601374570446735,0.02017097192293985,1164,47,Must free sardines from can.,132,644,388,677
1970,1.55899945622621,0.01616599478313389,1839,48,Frank never could figure out why he was always out of tuna.,215,1026,598,677
2589,1.5569815195071868,0.01512519919984833,1948,49,Open tuna. Leave on counter. Put the dog out.,198,1064,686,677
501,1.5556458164094233,0.01926472081623664,1231,50,Get milk. Pour in bowl. Set on floor. Scratch the back of cat's neck. Sleep on the edge of the bed to make room for cat. Repeat,129,676,426,677
2250,1.553415061295972,0.017296529732717114,1713,51,You have served me well tonight; you may pour yourself a saucer of wine.,227,992,494,677
497,1.5497131931166348,0.021449801125554713,1046,52,One meow and you will find me irresistible.  Two meows and you will accept my superiority.  Three meows and you will feed me.,122,593,331,677
2155,1.5481967213114753,0.01845673962164536,1525,53,"Well, look what the cat dragged in.",207,896,422,677
1329,1.5451092117758785,0.02131121739482924,1053,54,Day 2: Mastery over the human is complete.,121,600,332,677
371,1.5428015564202335,0.017750197417280893,1542,55,Must...open...birdcage.,183,888,471,677
480,1.5394922425952045,0.019168582218641858,1418,56,"When you awake, all you'll remember is that all of the meat and fish is for me, and all of the chocolate is for the dog.",193,846,379,677
2546,1.5355311355311356,0.0187638388794488,1365,57,And tomorrow you will blame everything on the Ambien,158,792,415,677
880,1.5346901017576318,0.021919821400738004,1081,58,"Now bring me what I demand, so I may reject it in disintrest.",146,649,286,677
1680,1.5332618025751072,0.022772381181397953,932,59,You will not have me fixed!,109,544,279,677
7,1.5309187279151943,0.020573690870225522,1132,60,...and then you’ll post the dog on Craigslist.,130,661,341,677
2164,1.529868114817688,0.01899613720452266,1289,61,"You better hope there's milk in there; otherwise, we're going for a drive.",142,750,397,677
856,1.5295489891135303,0.01890134536919471,1286,62,"Neuter, bad.  Drop sushi on floor, good.",135,740,411,677
1974,1.5277554304102976,0.019545790414628256,1243,63,Must...sell...dog...,140,727,376,677
2526,1.5269565217391305,0.020469835137284603,1150,64,"When I awake, I will let you out. Then in. Then out. . .",135,680,335,677
1656,1.5258928571428572,0.020934405162313974,1120,65,"What do you think of your laser pointer now, Carl?",135,666,319,677
2447,1.5233050847457628,0.032975856104768594,472,66,"Pâte, pâte, pâté...",62,287,123,677
1349,1.5202464788732395,0.02034202054056185,1136,67,You will serve me the leftover salmon and think YOU ate it when you awaken.,125,670,341,677
2507,1.52,0.02120900903052615,1125,68,"Cat’s diary:  day 253
“Success!  The servant now sees me for the deity I am”.",144,684,297,677
2931,1.52,0.02333989518218801,950,69,"Yes, Chairman Meow.",127,583,240,677
3095,1.52,0.021301828282163777,1100,70,Security cameras finally exonerate Phil as the culprit in Muffy's troublesome weight gain.,137,665,298,677
481,1.5147392290249433,0.03518029328352788,441,71,"OK, excellent, excellent. Now, when I snap my fingers ... oh, rats.",65,279,97,677
138,1.5137254901960784,0.02112427761400688,1020,72,"Dave, cats don't need neutering.
Dave, cats don't need neutering.
Dave, cats don't need neutering.",109,608,303,677
385,1.5118343195266273,0.022092774985941407,1014,73,"So, ,this is a Cat scan!!!!!",124,619,271,677
1270,1.5118343195266273,0.021692557134182524,1014,74,"When I say 'meow,' you will put that seared salmon with the creamy avocado remoulade in my bowl and return to bed.",115,610,289,677
2696,1.5038167938931297,0.024622231929070745,917,75,You could rule the world and you settle for tuna.,140,595,182,677
1462,1.503370786516854,0.02332574874507423,890,76,"Schrödinger's cat lived, and used her newfound powers for experiments of her own",104,546,240,677
2515,1.5033259423503327,0.022171103230414303,902,77,"When I awake, I will cancel the vet appointment.",87,535,280,677
1427,1.5005675368898979,0.02272145957682412,881,78,When you wake tomorrow you will feel refreshed...and feed me any time I rub against your leg.,90,530,261,677
2668,1.4988372093023257,0.023181888350406882,860,79,This is so much more effective than meowing.,91,522,247,677
1888,1.4982456140350877,0.02357305465780937,855,80,Schrodinger's Cat gets his revenge,96,525,234,677
865,1.4976415094339623,0.023891851064668956,848,81,Come hither so I may reject you.,99,525,224,677
970,1.497027348394768,0.02433192535630732,841,82,"Barring a few such instances, we consider the Chernobyl Exclusion Zone pet foster program to have been a rousing success.",104,527,210,677
2598,1.4957678355501813,0.02354642885963539,827,83,"Tonight, the lemon pasta with a white Bordeaux.",86,503,238,677
3137,1.4957678355501813,0.0236085182187383,827,84,You will worship my indifference.  You will worship my indifference.,87,504,236,677
1456,1.4957575757575758,0.024081697258673776,825,85,Come here and repeat after me... “I will not buy vegan salmon pate ever again.”,94,510,221,677
165,1.4951456310679612,0.02391891480463517,824,86,Now do the Hokey Pokey and turn yourself around.,91,507,226,677
1437,1.4943820224719102,0.02677148395296676,623,87,Who's a good human?,61,376,186,677
408,1.493167701863354,0.02433289739839636,805,88,You will put the leftover salmon in my dish and then carry me upstairs on a silk cushion and place me on your bed.,91,499,215,677
1633,1.4923857868020305,0.022961119644022934,788,89,"The tuunnaaaa.....
You will open the tuunnnaaaa....",65,465,258,677
3061,1.4910485933503836,0.024394160630524752,782,90,If only catching mice were this easy.,84,482,216,677
128,1.4871794871794872,0.02351192621348077,741,91,You have an irresistible desire to open a can of tuna and leave it on the counter.,59,439,243,677
1885,1.486522911051213,0.024400864764941847,742,92,Dave suddenly realized the lines between cat ownership and cat servitude are very blurry.,71,452,219,677
3119,1.4864479315263908,0.025501741364338533,701,93,Sir Andrew Lloyd Webber gets an idea for a new musical.,72,432,197,677
1564,1.484094052558783,0.02546740047061839,723,94,My dish is your command!,79,452,192,677
2891,1.4813218390804597,0.024893604074783228,696,95,And buy me the wild salmon this time.,63,424,209,677
2612,1.4785185185185186,0.02578319399702543,675,96,"Got your tongue, now your mind.",67,419,189,677
1308,1.4776119402985075,0.02617790116133939,670,97,"Yes, now that's a good human. Come tell Mr. Whiskers where you've hid the treats.",70,420,180,677
3133,1.4770642201834863,0.038202465318651,327,98,"When I count to three you will forget that you were hypnotized. But first, remove the heavy glass cover from the aquarium...",37,208,82,677
2478,1.4766214177978885,0.024774395557003837,663,99,"From now on, any damage that may occur around the house you will blame on the dog.",52,399,212,677
86,1.475609756097561,0.025691414351989395,656,100,"Unbeknownst to Carl, Mr. Sneakers had an ulterior motive for being in his lap during every weight-loss hypnosis video sessions.",60,404,192,677
1514,1.4736842105263157,0.027621925867495643,608,101,How PetSmart got its name.,65,385,158,677
2984,1.4735202492211839,0.026548487846231948,642,102,"That’s right, Dr. Schrödinger, I am indeed counterintuitive.",65,403,174,677
677,1.4723538704581358,0.026349919872244866,633,103,"You will feed the kitty. You will not remember this, and when you wake up you will feed the kitty again.",60,394,179,677
2410,1.4713375796178343,0.026306130584071916,628,104,"Horace's instinct that this rescue cat was different 
from all the others appears to be correct.",58,390,180,677
2898,1.4701130856219708,0.028013261699990608,619,105,He never suspected a counter attack!,73,401,145,677
457,1.469820554649266,0.02646166767047461,613,106,You will open the Sicilian tuna packed in olive oil....,55,380,178,677
858,1.4693396226415094,0.032684831031014334,424,107,Your....dish....is....my....command.....,43,268,113,677
189,1.4688524590163934,0.02841322980753521,610,108,Feed cat...Kill dog.,74,398,138,677
895,1.468543046357616,0.026325070567547466,604,109,"OK, I put the dog out in the rain.  What next?",51,372,181,677
326,1.4673366834170853,0.0281829092606871,597,110,The day Mr. Boots assumed complete control of the relationship.,67,385,145,677
1083,1.4664429530201342,0.02750756065591727,596,111,"I got you out here, now I will just ignore you.",60,378,158,677
737,1.4640410958904109,0.026285689493292602,584,112,"You will place whipped cream beside me,
you will return to your bed, you will remember nothing.",45,358,181,677
1305,1.4639718804920914,0.02822720964485836,569,113,Must...make...salmon...milkshake...,58,363,148,677
2800,1.4620535714285714,0.030911995207659266,448,114,So Andy’s bafflement regarding his inability to keep enough cat food in his apartment continued.,40,281,127,677
378,1.46028880866426,0.029666323028921273,554,115,You never considered what would happen if I caught the laser pointer.,66,365,123,677
1293,1.4593128390596746,0.028117560349107906,553,116,Place the tuna on the counter and go to bed.,52,351,150,677
2534,1.4577205882352942,0.02820720428176747,544,117,The vet said there would be some side effects.,50,345,149,677
1761,1.4575645756457565,0.029346278955019428,542,118,I wish I had a cell phone-- this would be so cute on YouTube!,59,353,130,677
851,1.45607476635514,0.0287851103706748,535,119,"The best part is, even without these powers I could STILL get him to do whatever I want.",52,343,140,677
2034,1.45607476635514,0.027920931461859845,535,120,"Not the kibble in the drawer, the caviar in the refrigerator",45,336,154,677
2386,1.45607476635514,0.02754226985101513,535,121,"If I just had a thumb, I wouldn't have to do all this.",42,333,160,677
549,1.4559099437148217,0.027867815552457563,533,122,Toasted bagel with cream cheese and smoked salmon Smoked Salmon SMOKED SALMON!,44,334,155,677
1666,1.4543726235741445,0.028633235707708125,526,123,"Caviar, dish, floor. Caviar, dish, floor...",48,335,143,677
1218,1.4541984732824427,0.028326758537085016,524,124,When you wake up you will have no recollection of salmon leftovers.,45,331,148,677
2185,1.453307392996109,0.03025588350689777,514,125,"(No caption necessary - it’s a funny picture, but everyone knows this is an accurate depiction of reality)",57,338,119,677
2242,1.452054794520548,0.028560177720935418,511,126,Must put the dog out. Must put the dog out. Must...,43,323,145,677
634,1.4518664047151277,0.028907279339843453,509,127,"""I'm into great power -- but great responsibility is not really my thing.""",45,324,140,677
2012,1.4503968253968254,0.028419943848445567,504,128,"Cream, cream, I tell you, NOT half-and half like last time.",43,322,139,677
2289,1.45,0.03367618168724865,400,129,"No, not hungry.  I'm just bored.",41,261,98,677
2928,1.4493927125506072,0.028530082920429602,494,130,"The flounder in the fridge, Fred. Right here, right now.",38,310,146,677
2142,1.448692152917505,0.031002853743941183,497,131,Now go pee in the dog's basket.,57,331,109,677
1216,1.4480651731160896,0.026770850257679533,491,132,Good. Now open the door and go back to bed.,33,309,149,677
1998,1.4480651731160896,0.0303371786970895,491,133,"Who wants to follow the laser, now?",50,321,120,677
1266,1.4478527607361964,0.028285356146195064,489,134,"OK, now SLOWLY open the door and get the dish of cream...",35,305,149,677
1442,1.4478527607361964,0.029304080121465726,489,135,"Say it. Say ""cats are better than dogs"".",42,312,135,677
1692,1.4478527607361964,0.028136813371127146,489,136,Cats are man's best friend.  Cats are man's best friend...,34,304,151,677
2742,1.4478527607361964,0.03110761136805916,489,137,"Guess who swallowed your ""hilarious"" laser pointer, Todd.",55,325,109,677
1460,1.4458333333333333,0.028942122032480325,480,138,"You will open the drawer and fetch the can opener.
You will open the can of  tuna.
You will not drain the oil.
You will go back to bed and dream of me.",37,303,140,677
2157,1.4442105263157894,0.030777299904598217,475,139,It's taken me 8 lifetimes to master this!,48,312,115,677
463,1.443496801705757,0.031060260569123487,469,140,Must . . . kill . . . Andrew Lloyd Webber.,48,309,112,677
550,1.4427645788336934,0.02982165512370168,463,141,Of course it's time to feed me again. Good boy.,41,301,121,677
1881,1.4427312775330396,0.029502773691507517,454,142,"Got you up, just for the halibut.",38,294,122,677
1210,1.44206008583691,0.03193106747204759,466,143,Obey the kitty.,53,313,100,677
2477,1.44206008583691,0.02968411091947791,466,144,"Real ""Wild Caught Tuna"", not that canned crap..!!",38,298,130,677
2877,1.441304347826087,0.028823610099251325,460,145,..and then you will carefully place the platter of leftover salmon on the floor and return immediately to your bed....,31,288,141,677
3091,1.4410480349344978,0.031288801845384885,458,146,Let's see how you like chasing a light for once.,46,302,110,677
3087,1.4405405405405405,0.03393134112777523,370,147,My first command: get rid of that dry cat food.,33,240,97,677
354,1.4402654867256637,0.030800398719142145,452,148,"My name is no longer Pickles. It is Master Darklord Of The Feline Kingdom. Also, feed me please.",41,294,117,677
2259,1.4402654867256637,0.030640716732423558,452,149,Sushi grade salmon...sushi grade salmon...sushi grade salmon...,40,293,119,677
557,1.4395604395604396,0.02826988310529778,455,150,Must. Open. Cat food.,34,294,127,677
1523,1.4395604395604396,0.031277824875366185,455,151,Shouldn’t have neutered me.,45,300,110,677
1423,1.4392935982339956,0.03137661004836113,453,152,"Get rid of the dog, clean the plastic box, spank your spoiled toddler, and report back for duty in 15 minutes.",45,299,109,677
2974,1.4392935982339956,0.030428363691148392,453,153,Who needs opposable thumbs?,39,293,121,677
1628,1.4382022471910112,0.03129865879072379,445,154,Greg's friends knew he was pussy-whipped. They just didn't realize it was this bad.,42,292,111,677
2542,1.4360730593607305,0.03148236795881772,438,155,Repeat after me: I'm really more of a cat person.,41,288,109,677
256,1.435483870967742,0.0297831468464318,434,156,Tuna can.  Must.  Open.  Tuna can.,30,275,129,677
1159,1.4351851851851851,0.03058617005412546,432,157,You are a cat. You will do anything to find food. You will leave it uneaten and return to bed.,34,278,120,677
1553,1.4351851851851851,0.03162219788364431,432,158,This will definitely go viral on YouTube.,40,284,108,677
617,1.4338747099767981,0.03149757923432035,431,159,Catnip's in the top drawer. Cannabis in second. Party time.,39,283,109,677
2384,1.4335664335664335,0.031427960882790665,429,160,"Yet again, Joe finds himself in a catatonic state as the mysterious disappearance of chopped liver from his refrigerator continues...",38,281,110,677
38,1.4329411764705882,0.032156907862054745,425,161,Secret Life of Pets: Kitchen Edition.,41,282,102,677
1283,1.4329411764705882,0.03110424486212303,425,162,You will drop the drumstick on the floor and  think you ate it yesterday,35,276,114,677
329,1.4323040380047507,0.029828210120769832,421,163,"...and when I clap my paws, you will awaken refreshed and with a sudden urge to order a ridiculous amount of catnip.",27,266,128,677
334,1.4306930693069306,0.03334781165091252,404,164,The Manchurian Can opener.,41,271,92,677
2678,1.429951690821256,0.034155612070343316,414,165,Ignore Trump. Do NOT grab the pussy.,49,285,80,677
1478,1.428921568627451,0.030644299907834124,408,166,Looks like the dog days are over.,31,266,111,677
2041,1.428921568627451,0.03217803838599847,408,167,"And as you relax, breathe, and find the tuna.",36,269,103,677
96,1.4282178217821782,0.0333348161096181,404,168,It wasn't the CAT-scan Bob was expecting.,41,272,91,677
331,1.4282051282051282,0.0340109502067265,390,169,Keep your hands to yourself Mr. President.,40,263,87,677
3001,1.4271604938271605,0.03289975017709964,405,170,"I may wear a collar, but we all know who the real submissive is.",39,271,95,677
1151,1.4260651629072683,0.030586937991881842,399,171,"Yes, of course this is a dream, Bill. Now, give me some tuna.",30,262,107,677
2048,1.4260651629072683,0.033439170490725346,399,172,"I promised that I would never  use my powers for personal gain, but that liter box has got to be emptied.",40,269,90,677
2308,1.4256926952141058,0.032205357318342835,397,173,That's right-- bring those opposable thumbs right over here.,33,261,103,677
2831,1.4253164556962026,0.03151253925140859,395,174,I liked it better when you manipulated me emotionally.,29,256,110,677
100,1.4238578680203047,0.03135345391418059,394,175,You meowed?,28,255,111,677
2458,1.422279792746114,0.032623896834320265,386,176,Why can't you just meow beside your food dish like other cats do?,32,255,99,677
452,1.421875,0.03436214056486155,384,177,Muffy's hypnotic powers came in handy while training her new forever servant.,40,262,82,677
960,1.421875,0.03396408604836817,384,178,Now kill the dog.,38,260,86,677
1734,1.421875,0.033561310731296104,384,179,"Alexa, is that you?",36,258,90,677
2276,1.421875,0.033561310731296104,384,180,...and in the morning you'll blame it all on the Russians.,36,258,90,677
2335,1.421875,0.03315364255861284,384,181,Honey? I think the cat ate the laser pointer.,34,256,94,677
830,1.421487603305785,0.033391012532256036,363,182,"In an unprecedented power play, Mitsy impersonates the sound of the coffee maker and regains control of the morning schedule.",29,239,95,677
1711,1.4214659685863875,0.035279123151406126,382,183,"CAT: ""MAN DO!""",44,265,73,677
327,1.4195250659630607,0.03281792707169745,379,184,I hope he doesn't use my litter box again.,31,251,97,677
2166,1.4186666666666667,0.03348656402635461,375,185,Dear Diary: 4:36am. Woke suddenly with irresistible craving for canned shrimp. Again.,33,251,91,677
72,1.4178272980501392,0.03564829798407031,359,186,You'd think you'd use your powers to open the can yourself.,38,247,74,677
2993,1.417789757412399,0.03219044684043209,371,187,"Yes, yes.  Get the salmon.  Bring the salmon.",26,242,103,677
3063,1.417789757412399,0.03437910886995896,371,188,I was having a nightmare.  I was in a New Yorker cartoon!,36,252,83,677
95,1.4173441734417345,0.033864732639169545,369,189,"That’s right, a few more steps. Not long now until I completely lose interest in your attention.",33,248,88,677
1814,1.4168937329700273,0.034211630493015795,367,190,Who's a good boy?,34,248,85,677
1859,1.4168937329700273,0.031727750167602015,367,191,Fred blamed his wife that morning when he was forced to drink his coffee black,23,237,107,677
1202,1.4164383561643836,0.032542584320274286,365,192,I must put the dog out forever! I must put the dog out forever!,26,239,100,677
172,1.415041782729805,0.03429477385058468,359,193,The fiancé has overstayed her welcome.,32,242,85,677
1468,1.415041782729805,0.03406713923064748,359,194,You are very hungry - you need milk - in a saucer.,31,241,87,677
1122,1.413888888888889,0.032597561533291235,360,195,Pay no attention to the cat on the counter.,25,236,99,677
2630,1.413888888888889,0.03235932528350584,360,196,"You are fully under my control ... get the tuna - the albacore, not the cheap stuff.",24,235,101,677
2925,1.413888888888889,0.03235932528350584,360,197,I have forgotten that you barfed on my bed. I have forgotten that you scratched the baby. I have forgotten that you peed on the rug. I have forgotten . . .,24,235,101,677
823,1.4129213483146068,0.03494174404798186,356,198,What's the matter? Cat got your free will?,34,243,79,677
